"Season","Sector","Category","Crop","QueryType","QueryText","KCCAns","StateName","DistrictName","BlockName","CreatedOn"
"KHARIF","HORTICULTURE","Condiments and Spices","Ginger","	Plant Protection	","Fungal attack in  ginger crop                                                                                                                                                                                                   Fungal attack in crop                                                                                                                                             Fungal attack in crop","Mancozeb 63% + Carbendazim 12% WP 40 gram and steptrocyclin 2 gram at 15 liter of water.","MADHYA PRADESH","BALAGHAT","WARASEONI                                         ","2014-08-26 21:37:51.467"
"KHARIF","AGRICULTURE","Others","Others","Weather","Farmer  want to know information  about  weather forecast ?","DAY-1               DAY-2               DAY-3               DAY-4               DAY-5
                              27/08               28/08               29/08               30/08               31/08
------------------- ------------------- ------------------- ------------------- ------------------- -------------------
Rainfall (mm)                   0                   4                  15                  13                  19","MADHYA PRADESH","BALAGHAT","KIRNAPUR                                          ","2014-08-27 06:37:26.547"
"KHARIF","AGRICULTURE","Cereals","Paddy (Dhan)","	Plant Protection	","How to control weeds in paddy crop?","Spray Nomini gold (Bispayriback sodium) 80 mili  per acar.","MADHYA PRADESH","BALAGHAT","WARASEONI                                         ","2014-08-27 10:14:09.623"
"KHARIF","AGRICULTURE","Cereals","Paddy (Dhan)","	Plant Protection	","fungal problem in paddy ?","tricyclazole 75% WP 10-12 g/pump","MADHYA PRADESH","BALAGHAT","BAIHAR                                            ","2014-08-27 15:57:48.890"
"KHARIF","AGRICULTURE","Others","Others","Weather","How to control Blast disease in paddy crop?","Spray Tricyclazol, hexacorazol, propiconazol 20-25 ml per pump and steptrocyclin 2 to 3 gram per pump.","MADHYA PRADESH","BALAGHAT","KATANGI                                           ","2014-08-28 07:39:59.443"
"KHARIF","AGRICULTURE","Cereals","Paddy (Dhan)","Fertilizer Use and Availability","Fertilizers spray on  crop ?","Recommended for Spray of Sujla NPK 19-19-19  @ 100 gm./pump..","MADHYA PRADESH","BALAGHAT","KHAIRLANJI                                        ","2014-08-28 09:43:18.337"
"KHARIF","AGRICULTURE","Cereals","Paddy (Dhan)","	Plant Protection	","How to control stem borer in paddy crop ?","recomended for Apply cartap hydro chloride 7 to 10 kg at per Acer.","MADHYA PRADESH","BALAGHAT","KATANGI                                           ","2014-08-28 18:05:02.210"
"KHARIF","AGRICULTURE","Cereals","Paddy (Dhan)","	Plant Protection	","How to control Blast disease in paddy crop?","Spray Tricyclazol, hexacorazol, propiconazol 20-25 ml per pump and steptrocyclin 2 to 3 gram per pump.","MADHYA PRADESH","BALAGHAT","BAIHAR                                            ","2014-08-28 19:22:37.383"
"KHARIF","AGRICULTURE","Cereals","Paddy (Dhan)","	Plant Protection	","How to control Blast disease in paddy crop?","Spray Tricyclazol, hexacorazol, propiconazol 20-25 ml per pump and steptrocyclin 2 to 3 gram per pump.","MADHYA PRADESH","BALAGHAT","WARASEONI                                         ","2014-08-28 19:42:18.083"
"KHARIF","AGRICULTURE","Cereals","Paddy (Dhan)","	Plant Protection	","How to control Blast disease in paddy crop?","Spray Tricyclazol,15 gm per pump and steptrocyclin 2 to 3 gram per pump","MADHYA PRADESH","BALAGHAT","BALAGHAT                                          ","2014-08-28 20:22:20.160"
