"Season","Sector","Category","Crop","QueryType","QueryText","KCCAns","StateName","DistrictName","BlockName","CreatedOn"
"RABI","AGRICULTURE","Cereals","Wheat","Weather","NWP MODELS BASED DISTRICT LEVEL WEATHER PREDICTION?","25/10               26/10               27/10               28/10               29/10

Rainfall (mm)                   0                   0                   0                   0                   0","MADHYA PRADESH","BARWANI","THIKRI                                            ","2014-10-24 11:00:36.430"
"RABI","AGRICULTURE","Others","Others","Government Schemes","farmer want to information about mandi rate ragistion?","YOUR MOBILE NO.  mandi RATE  ragistation is  activate.","MADHYA PRADESH","BARWANI","PANSEMAL                                          ","2014-10-24 12:31:55.640"
"RABI","AGRICULTURE","Others","Others","Government Schemes","farmer want to information about mandi rate ragistion?","YOUR MOBILE NO.  mandi RATE  ragistation is  activate.","MADHYA PRADESH","BARWANI","THIKRI                                            ","2014-10-24 19:36:34.977"
"RABI","HORTICULTURE","Vegetables","Tomato","	Plant Protection	","How to control of fungal attack in tomato crop?","Use copper oxy chloride 45 gram and steptrocyclin 2 gram at 15 liter of water.","MADHYA PRADESH","BARWANI","PANSEMAL                                          ","2014-10-25 08:15:56.930"
"RABI","AGRICULTURE","Others","Others","Weather","farmer want to weather information of district?","25/10               26/10               27/10               28/10               29/10
------------------- ------------------- ------------------- ------------------- ------------------- -------------------
Rainfall (mm)                   0                   0                   0                   0                   0","MADHYA PRADESH","BARWANI","THIKRI                                            ","2014-10-25 11:27:00.730"
"KHARIF","HORTICULTURE","Vegetables","Onion","Market Information","market price of onion","Onion
Burhanpur(F&V)	1.6	Tonnes	Local	1000	2000	1500	Rs/Quintal
Dewas(F&V)	2	Tonnes	Other	250	750	300	Rs/Quintal
Sagar(F&V)	3.4	Tonnes	Other	800	1200	1000	Rs/Quintal","MADHYA PRADESH","BARWANI","RAJPUR                                            ","2014-10-27 14:40:44.420"
"RABI","AGRICULTURE","Fiber Crops","Cotton (Kapas)","	Plant Protection	","how to control cotton crop pest ?","achitamiprid 20%wp, 4-5g/pump spray","MADHYA PRADESH","BARWANI","NEWALI                                            ","2014-10-27 16:10:38.453"
"RABI","AGRICULTURE","Others","Others","Government Schemes","farmer want to other information for kvk co. no. ?","horticulture department -07290-223476, kvk co. no. -222426","MADHYA PRADESH","BARWANI","THIKRI                                            ","2014-10-28 14:18:22.477"
"RABI","AGRICULTURE","Others","Others","Varieties","Varieties of Wheat crop?","Unirrigated – sujata, MP 3020, HW 2004 (amar), JWS 17, HI 1500, HI 1531, HI 4672 (Malavratna), HI 8627, HI 7483 (Meghdut)","MADHYA PRADESH","BARWANI","THIKRI                                            ","2014-10-28 17:14:53.970"
"RABI","AGRICULTURE","Pulses","Bengal Gram (Gram/Chick Pea/Kabuli/Chana)","Seeds","Seed treatment in gram crop?","Use vitavax plus or  bavastin 3 gm per kg of seed","MADHYA PRADESH","BARWANI","PANSEMAL                                          ","2014-10-29 17:50:12.810"
"RABI","AGRICULTURE","Others","Others","Government Schemes","Farmer wants to start mandi rate facility on mobile phone?","Your mandi rate facility registration has been successfully registered at kishan call center.","MADHYA PRADESH","BARWANI","BARWANI                                           ","2014-10-30 09:57:43.800"
"RABI","AGRICULTURE","Others","Others","Government Schemes","Farmer wants to start mandi rate facility on mobile phone?","Your mandi rate facility registration has been successfully registered at kishan call center.","MADHYA PRADESH","BARWANI","BARWANI                                           ","2014-10-30 09:58:06.250"
"RABI","AGRICULTURE","Others","Others","Weather","Farmer want to know information about weather forecast ?","DAY-1               DAY-2               DAY-3               DAY-4               DAY-5
                              31/10               01/11               02/11               03/11               04/11
------------------- ------------------- ------------------- ------------------- ------------------- -------------------
Rainfall (mm)                   0                   0                   0                   0                   0
Max Temperature ( deg C)       34                  34                  34                  34","MADHYA PRADESH","BARWANI","BARWANI                                           ","2014-10-31 07:39:42.090"
"RABI","AGRICULTURE","Pulses","Bengal Gram (Gram/Chick Pea/Kabuli/Chana)","	Plant Protection	","farmer want to start of mandi slert sms in mobile ?
.","Your number has been on the market price of the messaging service","MADHYA PRADESH","BARWANI","BARWANI                                           ","2014-10-31 08:54:48.053"
"RABI","AGRICULTURE","Others","Others","Market Information","Farmer  want number resister in mandi rate ?","your number register in mandi rate .","MADHYA PRADESH","BARWANI","PANSEMAL                                          ","2014-10-31 12:06:59.867"
"RABI","AGRICULTURE","Others","Others","Market Information","Farmer want to know information about how to activate sms advisory scheme ?
?","To activate sms advisory scheme on your mobile number","MADHYA PRADESH","BARWANI","BARWANI                                           ","2014-10-31 12:31:05.520"
"RABI","AGRICULTURE","Others","Others","Weather","Farmer want to know information about  weather forecast  ?","Barwani 1 – 3 Day Weather Forecast Summary: Mostly dry. Warm (max 33°C on Fri afternoon, min 24°C on Fri night). Wind will be generally light.","MADHYA PRADESH","BARWANI","SENDHAWA                                          ","2014-10-31 20:16:34.087"
