"Season","Sector","Category","Crop","QueryType","QueryText","KCCAns","StateName","DistrictName","BlockName","CreatedOn"
"KHARIF","HORTICULTURE","Condiments and Spices","Ginger","	Plant Protection	","Farmer want to information about how to control of fungal attack in crop?","Mancozeb 63% + Carbendazim 12% WP 40 gram and steptrocyclin 2 gram at 15 liter of water.","MADHYA PRADESH","CHHINDWARA","BICHHUA","2014-09-18 08:03:31.440"
"KHARIF","AGRICULTURE","Fiber Crops","Cotton (Kapas)","Fertilizer Use and Availability","Which fertilizer and nutrient give for better growth in cotton crop?","Recommended for Spray N: P: K 19:19:19 100 grams and humic acid 30 ml at 15 liter of water.","MADHYA PRADESH","CHHINDWARA","SAUSAR","2014-09-18 08:06:50.527"
"KHARIF","AGRICULTURE","Cereals","Paddy (Dhan)","Weather","weather information ?","DAY-1               DAY-2               DAY-3               DAY-4               DAY-5
                              18/09               19/09               20/09               21/09               22/09
------------------- ------------------- ------------------- ------------------- ------------------- -------------------
Rainfall (mm)                   0                   0                   0                   0                   0","MADHYA PRADESH","CHHINDWARA","SAUSAR","2014-09-18 08:24:30.853"
"KHARIF","AGRICULTURE","Others","Others","Weather","Farmer Want To Know Information About Weather Forecast of CHHINDWARA  district  ?","there is no chance of rainfall for next 3-4 days in CHHINDWARA  district of MP.","MADHYA PRADESH","CHHINDWARA","SAUSAR","2014-09-18 08:42:14.863"
"KHARIF","AGRICULTURE","Others","Others","Weather","Farmer Want To Know Information About Weather Forecast of CHHINDWARA district  ?","there is no chance of rainfall for next 3-4 days in CHHINDWARA district of MP.","MADHYA PRADESH","CHHINDWARA","MOHKHED","2014-09-18 09:26:53.020"
"KHARIF","AGRICULTURE","Oilseeds","Linseed (alsi)","Weather","weather forcast in chhindwara?","19/09               20/09               21/09               22/09               23/09
------------------- ------------------- ------------------- ------------------- ------------------- -------------------
Rainfall (mm)                   0                   0                   0                   0                   0","MADHYA PRADESH","CHHINDWARA","BICHHUA","2014-09-18 09:53:47.910"
"KHARIF","AGRICULTURE","Oilseeds","Soybean (bhat)","	Plant Protection	","Farmer  want number activate in sms facility ?","your number is resistard in sms facility","MADHYA PRADESH","CHHINDWARA","BICHHUA","2014-09-18 09:55:42.747"
"KHARIF","AGRICULTURE","Others","Others","Weather","Farmer want to information about weather  forecast  ?","Chhindwara 1 – 3 Day Weather Forecast Summary: Mostly dry. Warm (max 30°C on Fri afternoon, min 24°C on Thu night). Wind will be generally light.","MADHYA PRADESH","CHHINDWARA","BICHHUA","2014-09-18 10:00:41.530"
"KHARIF","AGRICULTURE","Millets","Maize (Makka)","	Plant Protection	","How to control stem borer in maize crop?","Apply cartap hydro chloride 7 to 10 kg at per Acer.","MADHYA PRADESH","CHHINDWARA","CHHINDWARA","2014-09-18 10:57:42.173"
"KHARIF","AGRICULTURE","Others","Others","Weather","Farmer want to information about weather  forecast  ?","Chhindwara 1 – 3 Day Weather Forecast Summary: Mostly dry. Warm (max 30°C on Fri afternoon, min 24°C on Thu night). Wind will be generally light.","MADHYA PRADESH","CHHINDWARA","PARASIA","2014-09-18 11:13:13.597"
"KHARIF","AGRICULTURE","Others","Others","Weather","Farmer  want to know information  about  weather forecast ?","DAY-1               DAY-2               DAY-3               DAY-4               DAY-5
                              19/09               20/09               21/09               22/09               23/09
------------------- ------------------- ------------------- ------------------- ------------------- -------------------
Rainfall (mm)                   0                   0                   0                   0                   0","MADHYA PRADESH","CHHINDWARA","CHHINDWARA","2014-09-18 13:13:16.027"
"KHARIF","AGRICULTURE","Others","Others","Government Schemes","farmer want to know information about agriculture insurance ?","To know information about agriculture insurance contact to your nearest bank  & dial 0755-4218901,4218902,4218903","MADHYA PRADESH","CHHINDWARA","CHAURAI","2014-09-18 13:13:24.763"
"KHARIF","AGRICULTURE","Fiber Crops","Cotton (Kapas)","	Plant Protection	","how to control redness in cotton crop","spray meganicium sulphate 75 gram / pump or Spray Daiphenthuran (Pegasas) 10 to 15 gram at per pump.","MADHYA PRADESH","CHHINDWARA","PANDHURNA","2014-09-18 14:45:53.777"
"KHARIF","AGRICULTURE","Others","Others","	Plant Protection	","farmer want to know information about weather chhindwara ?","","MADHYA PRADESH","CHHINDWARA","BICHHUA","2014-09-18 15:29:18.627"
"KHARIF","AGRICULTURE","Others","Others","	Plant Protection	","farmer want to know information about weather chhindwara ?","no chance of rainfall for next five days.","MADHYA PRADESH","CHHINDWARA","BICHHUA","2014-09-18 15:29:20.840"
"KHARIF","AGRICULTURE","Others","Others","	Plant Protection	","farmer want to know information about weather chhindwara ?","no chance of rainfall for next five days.","MADHYA PRADESH","CHHINDWARA","BICHHUA","2014-09-18 15:29:22.163"
"KHARIF","HORTICULTURE","Vegetables","Cauliflower","	Plant Protection	","Farmer want to how to control caterpillar of  cauliflower crop ?","Cut Worms

Set up light trap in summer months. Spray Chlorpyriphos 2 ml/lit in the collar region during evening hours.","MADHYA PRADESH","CHHINDWARA","MOHKHED","2014-09-18 15:29:33.953"
"KHARIF","AGRICULTURE","Fiber Crops","Cotton (Kapas)","	Plant Protection	","farmer want to know information about How to control thrip in cotton  crop   ?","Ans. – sprey of  fipronil 5 % sc 250ml. per acre.","MADHYA PRADESH","CHHINDWARA","SAUSAR","2014-09-18 16:03:06.257"
"KHARIF","AGRICULTURE","Others","Others","Weather","farmer want to weather information of  Chhindwara district?","No rainfall chance in your district and weather will some cloudy at next 5 days weather will some cloudy.","MADHYA PRADESH","CHHINDWARA","PARASIA","2014-09-18 16:33:50.487"
"KHARIF","AGRICULTURE","Fiber Crops","Cotton (Kapas)","	Plant Protection	","farmer want to know information about How to control thrip in cotton crop   ?","Ans. – sprey of  fipronil 5 % sc 250ml. per acre.","MADHYA PRADESH","CHHINDWARA","SAUSAR","2014-09-18 18:11:39.737"
"KHARIF","AGRICULTURE","Fiber Crops","Cotton (Kapas)","	Plant Protection	","How to control of fungal attack in cotton crop?","Use copper oxy chloride 45 gram and steptrocyclean 2 gram at 15 liter of water.","MADHYA PRADESH","CHHINDWARA","SAUSAR","2014-09-18 18:18:18.903"
"KHARIF","AGRICULTURE","Others","Others","Weather","Farmer  want to  weather forecasting  information of District chhindwara","DAY-1               DAY-2               DAY-3               DAY-4               DAY-5
                              19/09               20/09               21/09               22/09               23/09
------------------- ------------------- ------------------- ------------------- ------------------- -------------------
Rainfall (mm)                   0                   0                   0                   0                   0","MADHYA PRADESH","CHHINDWARA","MOHKHED","2014-09-18 19:41:00.670"
"KHARIF","HORTICULTURE","Vegetables","Pea (Vegetable)","	Plant Protection	","Seed treatment in pea crop.","Use bavastim 3 gm per kg of seed","MADHYA PRADESH","CHHINDWARA","MOHKHED","2014-09-18 19:46:58.350"
"KHARIF","AGRICULTURE","Others","Others","Market Information","farmer want to ragistration in our mobile number ?","your ragistration is completed..","MADHYA PRADESH","CHHINDWARA","CHAURAI","2014-09-18 19:59:16.107"
"KHARIF","HORTICULTURE","Condiments and Spices","Coriander","	Plant Protection	","How to control of fungal attack in coriander  crop ?","thiophanate methyl 25 gram / 16 litre of water spray","MADHYA PRADESH","CHHINDWARA","CHAURAI","2014-09-18 20:10:06.603"
"KHARIF","HORTICULTURE","Condiments and Spices","Coriander","Seeds and Planting Material","farmer want to sowing time of coriender crop ?","15 oct-15 nov its a suitable time .","MADHYA PRADESH","CHHINDWARA","PANDHURNA","2014-09-18 21:34:39.087"
"KHARIF","HORTICULTURE","Vegetables","Cauliflower","Cultural Practices","what is the fertilizer dose of couliflower?","200gm Urea, 500gm SSP, MOP 50gm/pit at the time of planting","MADHYA PRADESH","CHHINDWARA","AMARWARA","2014-09-19 08:14:38.080"
"KHARIF","AGRICULTURE","Pulses","Pigeon pea (red gram/arhar/tur)","	Plant Protection	","farmer want to know information about  How to control caterpillars in arher crop?","trijophose 40% + Cypermethrin 4% EC 1000 Ml. / hac. Rate of spray.","MADHYA PRADESH","CHHINDWARA","SAUSAR","2014-09-19 08:24:23.663"
"KHARIF","AGRICULTURE","Fiber Crops","Cotton (Kapas)","	Plant Protection	","farmer want to know information about How to control white fly in cotton crop?","Spray Dimethoate (Rogar) or Triazophos 30 ml per pump.","MADHYA PRADESH","CHHINDWARA","SAUSAR","2014-09-19 08:27:45.970"
"KHARIF","AGRICULTURE","Pulses","Pigeon pea (red gram/arhar/tur)","	Plant Protection	","farmer want to know information about  How to control caterpillars in  tur crop?","Monocrotophos 36 s. L. 800 ml. / hac. Rate of spray.","MADHYA PRADESH","CHHINDWARA","PANDHURNA","2014-09-19 08:44:00.690"
"KHARIF","HORTICULTURE","Vegetables","Potato","Cultural Practices","farmer wan tto information about seed treatment in potato crop?","Seed treatment
 Use Carbon disulphide 30 g/100 kg of seeds for breaking the dormancy and inducing sprouting of tubers.","MADHYA PRADESH","CHHINDWARA","PARASIA","2014-09-19 11:03:20.667"
"KHARIF","AGRICULTURE","Pulses","Pigeon pea (red gram/arhar/tur)","	Plant Protection	","farmer want to know information about Which fertilizer and nutrient give for better growth in arher crop?","spray of N:P:K-0:52:34, 100 gram/pump.","MADHYA PRADESH","CHHINDWARA","SAUSAR","2014-09-19 11:43:43.300"
"KHARIF","AGRICULTURE","Millets","Maize (Makka)","	Plant Protection	","How to control soil insect on maize crop?","Apply cartap hydro chloride 7 to 10 kg at per Acer.","MADHYA PRADESH","CHHINDWARA","CHHINDWARA","2014-09-19 12:14:44.223"
"KHARIF","HORTICULTURE","Vegetables","Tomato","	Plant Protection	","Farmer want to know information about control of fruit borer at tomato ?","Endoxacarb 14.5% SC 80-100ml/acre or 10-15/pump","MADHYA PRADESH","CHHINDWARA","PARASIA","2014-09-19 13:12:26.560"
"KHARIF","AGRICULTURE","Others","Others","Weather","Farmer want to know information about   weather forecast ?","20/09               21/09               22/09               23/09               24/09
Rainfall (mm)                   0                   0                   0                   0                   0","MADHYA PRADESH","CHHINDWARA","MOHKHED","2014-09-19 13:23:18.720"
"KHARIF","AGRICULTURE","Others","Others","Weather","farmer want to know information about weather?","no chance of rainfall","MADHYA PRADESH","CHHINDWARA","PANDHURNA","2014-09-19 13:25:39.453"
"KHARIF","AGRICULTURE","Others","Others","	Plant Protection	","Farmer want to know information about weather forecasting ?","Chhindwara 1 – 3 Day Weather Forecast Summary: Mostly dry. Warm (max 30°C on Fri afternoon, min 24°C on Sat night). Wind will be generally light.","MADHYA PRADESH","CHHINDWARA","BICHHUA","2014-09-19 14:28:29.053"
"KHARIF","AGRICULTURE","Others","Others","Market Information","Farmer want to know information about how to activate sms advisory scheme ?","To activate sms advisory scheme on your mobile number","MADHYA PRADESH","CHHINDWARA","BICHHUA","2014-09-19 14:35:01.790"
"KHARIF","AGRICULTURE","Others","Others","Weather","Farmer  want to know information  about  weather forecast ?","DAY-1               DAY-2               DAY-3               DAY-4               DAY-5
                              20/09               21/09               22/09               23/09               24/09
Rainfall (mm)                   0                   0                   0                   0                   0","MADHYA PRADESH","CHHINDWARA","SAUSAR","2014-09-19 14:42:34.273"
"KHARIF","AGRICULTURE","Others","Others","Weather","farmer want to know information about weather in chhindwara ?","DAY-1               DAY-2               DAY-3               DAY-4               DAY-5
                              20/09               21/09               22/09               23/09               24/09
------------------- ------------------- ------------------- ------------------- ------------------- -------------------
Rainfall (mm)                   0                   0                   0                   0                   0","MADHYA PRADESH","CHHINDWARA","MOHKHED","2014-09-19 17:02:51.370"
"KHARIF","AGRICULTURE","Others","Others","Weather","weather forecast ?","chance of no rainfall next five days .","MADHYA PRADESH","CHHINDWARA","PANDHURNA","2014-09-19 17:32:52.767"
"KHARIF","AGRICULTURE","Others","Others","Weather","farmer want to weather information of district?","No rainfall chance in your district and weather will some cloudy at next 5 days weather will some cloudy.","MADHYA PRADESH","CHHINDWARA","CHHINDWARA","2014-09-19 17:43:10.447"
"KHARIF","HORTICULTURE","Vegetables","Tomato","	Plant Protection	","Which fertilizer and nutrient give for better growth in tomato crop?","NPK 19:19:19  100 Gram per pump are use and humic acid 30ml/pump","MADHYA PRADESH","CHHINDWARA","AMARWARA","2014-09-19 18:51:12.220"
"KHARIF","HORTICULTURE","Vegetables","Chillies","	Plant Protection	","FARMER WANT TO HOW KNOW TO CONTROL FUNGAL INFECTION IN CHILLI CROP ?","Recommended for spray Metalaxyl + Mencozeb @ 30 g/pump.  .","MADHYA PRADESH","CHHINDWARA","AMARWARA","2014-09-19 18:57:28.257"
"KHARIF","AGRICULTURE","Others","Others","Market Information","Farmer want to information about mandi  registration?","Now your number is registered hear for manndi  rate","MADHYA PRADESH","CHHINDWARA","CHHINDWARA","2014-09-19 19:36:13.863"
"KHARIF","AGRICULTURE","Others","Others","Weather","Farmer  want to  weather forecasting  information of District CHHINDWARA","DAY-1               DAY-2               DAY-3               DAY-4               DAY-5
                              20/09               21/09               22/09               23/09               24/09
------------------- ------------------- ------------------- ------------------- ------------------- -------------------
Rainfall (mm)                   0                   0                   0                   0                   0","MADHYA PRADESH","CHHINDWARA","SAUSAR","2014-09-20 06:25:27.753"
"KHARIF","HORTICULTURE","Vegetables","Chillies","	Plant Protection	","How to control sucking pest on chilli crop?","Spray imidaclorprid 17.8%SL 7 ml per pump.or acetamiprid 5gm/pump.","MADHYA PRADESH","CHHINDWARA","CHAURAI","2014-09-20 06:36:21.420"
"KHARIF","AGRICULTURE","Oilseeds","Soybean (bhat)","Weather","Farmer want to know information about weather forecast  ?","next 2 days light rain possibilities","MADHYA PRADESH","CHHINDWARA","PANDHURNA","2014-09-20 08:00:33.610"
"KHARIF","AGRICULTURE","Others","Others","Government Schemes","FARMER WANT TO KNOW ABOUT govt. schemes of agriculture ?","Please contact your R.A.E.O officer or agriculture officer of block office or farmer welfare and agriculture development office of your district.","MADHYA PRADESH","CHHINDWARA","CHHINDWARA","2014-09-20 08:06:14.770"
"KHARIF","AGRICULTURE","Oilseeds","Soybean (bhat)","Weather","farmer want to know information about weather?","no chance of rainfall for next five days.","MADHYA PRADESH","CHHINDWARA","PARASIA","2014-09-20 08:07:47.680"
"KHARIF","AGRICULTURE","Others","Others","Government Schemes","About govt. scheme ?","please contact RAEO/ADO for more information ..","MADHYA PRADESH","CHHINDWARA","MOHKHED","2014-09-20 10:31:55.917"
"KHARIF","HORTICULTURE","Vegetables","Tomato","	Plant Protection	","how to control of flower drop in tomato crop?","spray of planofix 5-6 ml/pump.","MADHYA PRADESH","CHHINDWARA","CHHINDWARA","2014-09-20 10:35:18.173"
"KHARIF","HORTICULTURE","Vegetables","Cauliflower","	Plant Protection	","How to control caterpillars in cauliflower crop?","indoxa carb 15 ml at 15 liter of water.","MADHYA PRADESH","CHHINDWARA","MOHKHED","2014-09-20 11:14:57.620"
"KHARIF","AGRICULTURE","Others","Others","Weather","Weather forecasting for chhindwara district of Madhya Pradesh?","No rainfall within 5 days in your district.","MADHYA PRADESH","CHHINDWARA","BICHHUA","2014-09-20 11:37:41.493"
"KHARIF","AGRICULTURE","Others","Others","Weather","Farmer want to know information about    weather forecast of chhindwara ?","no chance of rainfall next week in chhindwara  dist.","MADHYA PRADESH","CHHINDWARA","AMARWARA","2014-09-20 11:51:27.117"
"KHARIF","AGRICULTURE","Others","Others","Weather","farmer want to weather information at chhindwara district?","DISTRICT :  CHHINDWARA                                                     STATE :  MADHYA-PRADESH   
------------------- ------------------- ------------------- ------------------- ------------------- -------------------
    PARAMETERS                                            ENSEMBLE FCST   
                   ----------------------------------------------------------------------------------------------------
                              DAY-1               DAY-2               DAY-3               DAY-4               DAY-5
                              21/09               22/09               23/09               24/09               25/09
------------------- ------------------- ------------------- ------------------- ------------------- -------------------
Rainfall (mm)                   0                   0                   0                   0                   0
Max Temperature ( deg C)       32                  32                  32                  34                  33
Min Temperature ( deg C)       21                  21                  21                  21                  21
Total cloud cover (octa)        8                   7                   8                   6                   4","MADHYA PRADESH","CHHINDWARA","PANDHURNA","2014-09-20 14:03:35.547"
"KHARIF","HORTICULTURE","Vegetables","Chillies","	Plant Protection	","farmer want to know information about How to control aphid  in  chilly crop?","Ans. – sprey of  fipronil 5 % sc 250ml. per acre.","MADHYA PRADESH","CHHINDWARA","AMARWARA","2014-09-20 14:26:06.050"
"KHARIF","AGRICULTURE","Others","Others","Market Information","FARMER WAT TO AAD MY NO. IN MANDI RATE?","your mobile no. mandi rate start now after some time.","MADHYA PRADESH","CHHINDWARA","PARASIA","2014-09-20 15:31:36.090"
"KHARIF","AGRICULTURE","Others","Others","Weather","farmer want to weather information at chhindwara district?","DISTRICT :  CHHINDWARA                                                     STATE :  MADHYA-PRADESH   
------------------- ------------------- ------------------- ------------------- ------------------- -------------------
    PARAMETERS                                            ENSEMBLE FCST   
                   ----------------------------------------------------------------------------------------------------
                              DAY-1               DAY-2               DAY-3               DAY-4               DAY-5
                              21/09               22/09               23/09               24/09               25/09
------------------- ------------------- ------------------- ------------------- ------------------- -------------------
Rainfall (mm)                   0                   0                   0                   0                   0
Max Temperature ( deg C)       32                  32                  32                  34                  33
Min Temperature ( deg C)       21                  21                  21                  21                  21
Total cloud cover (octa)        8                   7                   8                   6                   4","MADHYA PRADESH","CHHINDWARA","CHHINDWARA","2014-09-20 15:47:56.653"
"KHARIF","HORTICULTURE","Vegetables","Chillies","	Plant Protection	","farmer want to know information about How to control thrip in chilly crop  ?","Kelothyynidin 1.5 g / 16 liters of water to spray with","MADHYA PRADESH","CHHINDWARA","PANDHURNA","2014-09-20 18:07:42.377"
"KHARIF","AGRICULTURE","Others","Others","Weather","WEATHER REPORT IN CHHINDWARA ?","Chhindwara 1 – 3 Day Weather Forecast Summary: Light rain (total 3mm), mostly falling on Sun afternoon. Warm (max 30°C on Mon afternoon, min 24°C on Sat night). Winds decreasing (fresh winds from the NNW on Sun morning, light winds from the N by Tue morning).","MADHYA PRADESH","CHHINDWARA","CHAURAI","2014-09-20 20:31:12.650"
"KHARIF","AGRICULTURE","Others","Others","Weather","weather forcasting.","DAY-1               DAY-2               DAY-3               DAY-4               DAY-5
                              21/09               22/09               23/09               24/09               25/09
------------------- ------------------- ------------------- ------------------- ------------------- -------------------
Rainfall (mm)                   0                   0                   0                   0                   0","MADHYA PRADESH","CHHINDWARA","PANDHURNA","2014-09-21 06:27:49.003"
"KHARIF","HORTICULTURE","Vegetables","Cauliflower","	Plant Protection	","farmer want to know information about How to control red spider in orange plant?","Spray abhamectin benjoate (abhasin) 10 to 15 ml at per pump or Propargite 57% EC (omite) 60 ml at per pump.","MADHYA PRADESH","CHHINDWARA","MOHKHED","2014-09-21 06:52:52.957"
"KHARIF","AGRICULTURE","Others","Others","Weather","Farmer Want To Know Information About Weather Forecast of CHHINDWARA district  ?","there is no chance of rainfall for next 3-4 days in CHHINDWARA district of MP.","MADHYA PRADESH","CHHINDWARA","SAUSAR","2014-09-21 06:54:09.413"
"KHARIF","AGRICULTURE","Oilseeds","Soybean (bhat)","	Plant Protection	","How to control caterpillars in soyabean crop?","Spray of Queenolfos 25 EC 1000 Ml. / hac.","MADHYA PRADESH","CHHINDWARA","MOHKHED","2014-09-21 06:58:04.923"
"KHARIF","AGRICULTURE","Others","Others","Sowing Time and Weather","farmer want to know information about weather?","Parasia 1 – 3 Day Weather Forecast Summary: Light rain (total 2mm), mostly falling on Sun afternoon. Warm (max 31°C on Tue afternoon, min 24°C on Sat night). Winds decreasing (fresh winds from the NNW on Sun morning, light winds from the N by Tue morning).","MADHYA PRADESH","CHHINDWARA","PARASIA","2014-09-21 07:04:41.470"
"KHARIF","HORTICULTURE","Vegetables","Cabbage","	Plant Protection	","farmer want to know information about How to control aphid in cabbage crop?","spray indoxacarb (awant) @ 15 ml/pump.","MADHYA PRADESH","CHHINDWARA","MOHKHED","2014-09-21 07:06:41.533"
"KHARIF","AGRICULTURE","Others","Others","Weather","Farmer want to know information about weather forecast  ?","21/09               22/09               23/09               24/09               25/09
------------------- ------------------- ------------------- ------------------- ------------------- -------------------
Rainfall (mm)                   0                   0                   0                   0                   0","MADHYA PRADESH","CHHINDWARA","PARASIA","2014-09-21 07:08:28.527"
"KHARIF","AGRICULTURE","Others","Others","Weather","Farmer want to know information about weather forecast  ?","21/09               22/09               23/09               24/09               25/09
------------------- ------------------- ------------------- ------------------- ------------------- -------------------
Rainfall (mm)                   0                   0                   0                   0                   0","MADHYA PRADESH","CHHINDWARA","PARASIA","2014-09-21 07:08:30.160"
"KHARIF","HORTICULTURE","Vegetables","Onion","Fertilizer Use and Availability","Farmer want to know information about control of pest at onion ?","Trizophos 40% 250-300ml/acre or 25-30ml/acre","MADHYA PRADESH","CHHINDWARA","PANDHURNA","2014-09-21 07:42:06.833"
"KHARIF","AGRICULTURE","Others","Others","Weather","Farmer want to know information about  weather  farecast ?","DAY-1               DAY-2               DAY-3               DAY-4               DAY-5
                              21/09               22/09               23/09               24/09               25/09
------------------- ------------------- ------------------- ------------------- ------------------- -------------------
Rainfall (mm)                   0                   0                   0                   0                   0","MADHYA PRADESH","CHHINDWARA","CHHINDWARA","2014-09-21 07:58:56.910"
"KHARIF","AGRICULTURE","Others","Others","Weather","farmer want to weather information of chhindwara district?","light rainfall chance in your district and weather will some cloudy at next 2 days","MADHYA PRADESH","CHHINDWARA","PARASIA","2014-09-21 08:03:25.067"
"KHARIF","HORTICULTURE","Vegetables","Tomato","	Plant Protection	","How to control of fungal attack in tomato crop?","Use copper oxy chloride 45 gram and steptrocyclin 2 gram at 15 liter of water.","MADHYA PRADESH","CHHINDWARA","MOHKHED","2014-09-21 08:30:04.033"
"KHARIF","AGRICULTURE","Pulses","Bengal Gram (Gram/Chick Pea/Kabuli/Chana)","Weather","farmer want to know information about weather forcast in chhindwara?","21/09               22/09               23/09               24/09               25/09
------------------- ------------------- ------------------- ------------------- ------------------- -------------------
Rainfall (mm)                   0                   0                   0                   0                   0","MADHYA PRADESH","CHHINDWARA","MOHKHED","2014-09-21 09:07:20.867"
