"Season","Sector","Category","Crop","QueryType","QueryText","KCCAns","StateName","DistrictName","BlockName","CreatedOn"
"KHARIF","AGRICULTURE","Others","Others","Market Information","Farmer want to know  SMS advisory in mobile ?","Advisory on your mobile been registered successfully! Your client id is MP086938","MADHYA PRADESH","NARSIMPUR","SAINKHEDA                                         ","2014-09-10 14:48:40.737"
"KHARIF","AGRICULTURE","Cereals","Paddy (Dhan)","	Plant Protection	","paddy weeds control >?","spray almix @ 8 gram / acre","MADHYA PRADESH","NARSIMPUR","BABAI CHICHALI                                    ","2014-09-10 17:18:52.757"
"KHARIF","HORTICULTURE","Condiments and Spices","Turmeric","Nutrient Management","foliar spray in turmaric?","spray of water soluble fertilizer NPK 19:19::19 @     100 g   /pump","MADHYA PRADESH","NARSIMPUR","GOTEGAON                                          ","2014-09-10 18:23:25.000"
"KHARIF","AGRICULTURE","Others","Others","Weather","weather information of narsimpur?","aage ke 5 dino me barish hone ki sammbhabana hai","MADHYA PRADESH","NARSIMPUR","BABAI CHICHALI                                    ","2014-09-10 18:28:18.967"
"KHARIF","AGRICULTURE","Others","Others","Weather","Farmer  want to  weather forecasting  information of District Narshingpur","DAY-1               DAY-2               DAY-3               DAY-4               DAY-5
                              11/09               12/09               13/09               14/09               15/09
------------------- ------------------- ------------------- ------------------- ------------------- -------------------
Rainfall (mm)                   0                  14                  17                  10                   8","MADHYA PRADESH","NARSIMPUR","GOTEGAON                                          ","2014-09-10 18:28:35.717"
"KHARIF","AGRICULTURE","Oilseeds","Soybean (bhat)","	Plant Protection	","yellow mosaic  control in soybean?","Acetamiprid (ACETA /Pride) 20% SP @ 6 gram /pump","MADHYA PRADESH","NARSIMPUR","GOTEGAON                                          ","2014-09-10 18:32:41.730"
"KHARIF","HORTICULTURE","Fruits","Orange","	Plant Protection	","farmer want to know information about how to control Fruit sucking moth in orange crop?","to control Fruit sucking moth in orange crop spray malathion 0.05% (50 EC at 1ml/lit)","MADHYA PRADESH","NARSIMPUR","GOTEGAON                                          ","2014-09-10 18:38:11.180"
"KHARIF","AGRICULTURE","Others","Others","Government Schemes","Farmer  want number activate in sms facility ?","your number is resistard in sms facility","MADHYA PRADESH","NARSIMPUR","KARELI                                            ","2014-09-10 21:23:41.380"
"KHARIF","AGRICULTURE","Others","Others","Weather","weather forecast ?","chance of moderate of rainfall next five days .","MADHYA PRADESH","NARSIMPUR","GOTEGAON                                          ","2014-09-10 21:30:14.237"
"KHARIF","AGRICULTURE","Oilseeds","Soybean (bhat)","	Plant Protection	","How to control white fly in soyabean crop?","Spray diphenthuran 50%WP (pegasas)  @10 to 15 gram at per pump.","MADHYA PRADESH","NARSIMPUR","GOTEGAON                                          ","2014-09-10 21:37:57.877"
"KHARIF","AGRICULTURE","Others","Others","Weather","Farmer want to know about  weather information ?","Narsimhapur 4 – 7 Day Weather Forecast Summary: Heavy rain (total 29mm), heaviest during Sat night","MADHYA PRADESH","NARSIMPUR","GOTEGAON                                          ","2014-09-10 21:48:02.083"
"KHARIF","HORTICULTURE","Vegetables","Potato","Cultural Practices","varieties of Potato ?","Kufri Jyoti, Kufri Muthu, Kufri Swarna, Kufri Thangam, Kufri Malar, Kufri Soga and Kufri Giriraj are commonly cultivated.","MADHYA PRADESH","NARSIMPUR","SAINKHEDA                                         ","2014-09-11 06:31:38.270"
"KHARIF","AGRICULTURE","Others","Others","Weather","Farmer  want to  weather forecasting  information of District narshingpur","DAY-1               DAY-2               DAY-3               DAY-4               DAY-5
                              11/09               12/09               13/09               14/09               15/09
------------------- ------------------- ------------------- ------------------- ------------------- -------------------
Rainfall (mm)                   0                  14                  17                  10                   8","MADHYA PRADESH","NARSIMPUR","CHAWARPATHA                                       ","2014-09-11 07:10:58.673"
"KHARIF","HORTICULTURE","Vegetables","Chillies","	Plant Protection	","How to control of fungal attack in chilli mcrop?","Use copper oxy chloride 45 gram and steptrocyclin 2 gram at 15 liter of water.","MADHYA PRADESH","NARSIMPUR","NARSIMHAPUR                                       ","2014-09-11 07:15:59.363"
"KHARIF","AGRICULTURE","Cereals","Paddy (Dhan)","	Plant Protection	","how to control of paddy blast ?","traycaiclajol 150-200g/acre or  tebukonajol 300ml/acre.","MADHYA PRADESH","NARSIMPUR","NARSIMHAPUR                                       ","2014-09-11 08:58:47.790"
"KHARIF","AGRICULTURE","Oilseeds","Soybean (bhat)","	Plant Protection	","farmer want to know information about how to control defoliators in soybean?","recommended for to control defoliators Spray any one of the following insecticides in the initial stage of infestation 
 Indoxacarb 14.5 % SC @ 10-12ml /pump
  Deltamethrin 2.8 EC@ 750 ml Spray per ha.
  Cveenalfos 25 EC@ 1000 ml Spray per ha.
  Politryn  44 EC @1000 ml Spray per ha.
 Prfinofos 50 EC@ 1500 ml Spray per ha.
  Spark 36 EC@1000 ml Spray per ha.","MADHYA PRADESH","NARSIMPUR","NARSIMHAPUR                                       ","2014-09-11 11:00:23.407"
"KHARIF","AGRICULTURE","Cereals","Paddy (Dhan)","	Plant Protection	","How to control of fungal attack in paddy crop?","Recommended for Mancozeb 63% + Carbendazim 12% WP 40 gram and steptrocyclin 2 gram at 15 liter of water.","MADHYA PRADESH","NARSIMPUR","BABAI CHICHALI                                    ","2014-09-11 12:30:37.180"
"KHARIF","AGRICULTURE","Pulses","Green Gram (Moong Bean/ Moong)","Nutrient Management","foliar spray in green gram?","spray of water soluble fertilizer NPK 19:19:19 @     100 g   /pump","MADHYA PRADESH","NARSIMPUR","SAINKHEDA                                         ","2014-09-11 13:19:55.000"
"KHARIF","AGRICULTURE","Cereals","Paddy (Dhan)","	Plant Protection	","How to control caterpillars in soyabean crop?","","MADHYA PRADESH","NARSIMPUR","NARSIMHAPUR                                       ","2014-09-11 14:19:22.517"
"KHARIF","AGRICULTURE","Cereals","Paddy (Dhan)","	Plant Protection	","How to control stem borer in paddy crop?","recomended for Apply cartap hydro chloride 7 to 10 kg at per Acer.","MADHYA PRADESH","NARSIMPUR","GOTEGAON                                          ","2014-09-11 16:04:30.420"
"KHARIF","AGRICULTURE","Cereals","Paddy (Dhan)","	Plant Protection	","How to control blast in paddy ?","Tricyclozole @ 9 gram per pump spray","MADHYA PRADESH","NARSIMPUR","GOTEGAON                                          ","2014-09-11 16:38:24.390"
"KHARIF","AGRICULTURE","Others","Others","Market Information","farmer want to mandi registration activation ?","your mobile no. mandi rate start","MADHYA PRADESH","NARSIMPUR","GOTEGAON                                          ","2014-09-11 16:44:29.760"
"KHARIF","HORTICULTURE","Flowers","Rose","Fertilizer Use and Availability","Which fertilizer and nutrient give for better growth in rose crop?","Spray N: P: K 19:19:19 100 grams and humic acid 30 ml at 15 liter of water.","MADHYA PRADESH","NARSIMPUR","CHAWARPATHA                                       ","2014-09-11 17:45:23.610"
"KHARIF","AGRICULTURE","Cereals","Paddy (Dhan)","	Plant Protection	","How to control white fly in paddy crop?","Recommended for Spray Dimethoate 30%EC (Rogar) 40 ml per pump.","MADHYA PRADESH","NARSIMPUR","CHAWARPATHA                                       ","2014-09-11 18:31:27.623"
"KHARIF","AGRICULTURE","Cereals","Paddy (Dhan)","	Plant Protection	","How to control of fungal attack in paddy crop?","Recommended for Mancozeb 63% + Carbendazim 12% WP 40 gram and steptrocyclin 2 gram at 15 liter of water.","MADHYA PRADESH","NARSIMPUR","GOTEGAON                                          ","2014-09-11 18:39:41.220"
"KHARIF","AGRICULTURE","Cereals","Paddy (Dhan)","	Plant Protection	","farmer want to know information about How to control stem borer in paddy crop?","Apply cartap hydro chloride 7 to 10 kg at per Acer.","MADHYA PRADESH","NARSIMPUR","SAINKHEDA                                         ","2014-09-11 18:45:34.657"
"KHARIF","AGRICULTURE","Others","Others","Weather","farmer want to know information about weather?","chance of good rainfall for next 3 days for dist Narsimhapur","MADHYA PRADESH","NARSIMPUR","GOTEGAON                                          ","2014-09-11 18:49:58.777"
"KHARIF","AGRICULTURE","Cereals","Paddy (Dhan)","	Plant Protection	","How to control Termite in paddy crop?","Recommended for Upon the outbreak of the standing crop termites cloropayriphos 20 EC 500 ml with irrigation water per acre to the drug. Ardhsincit land above the amount of drug dissolved in 3 liters of water mixed with 50 kg of sand spread on the farm Lgaven water.","MADHYA PRADESH","NARSIMPUR","SAINKHEDA                                         ","2014-09-11 19:00:03.410"
"KHARIF","AGRICULTURE","Pulses","Black Gram (urd bean)","Nutrient Management","farmer want to know information about How to control flower drop problem in urd bean crop?","Spray Planofix 4 to 5 Ml at 15 liter of water.","MADHYA PRADESH","NARSIMPUR","SAINKHEDA                                         ","2014-09-11 19:26:55.090"
"KHARIF","AGRICULTURE","Sugar and Starch Crops","Sugarcane (Noble Cane)","	Plant Protection	","Which fertilizer and nutrient give for better growth in sugercane crop?","Spray N: P: K 19:19:19 100 grams and humic acid 30 ml at 15 liter of water.","MADHYA PRADESH","NARSIMPUR","KARELI                                            ","2014-09-11 20:52:26.333"
"KHARIF","AGRICULTURE","Others","Others","Weather","farmer want to know information about weather NARSINGPUR?","chance of low rainfall for next week for dist  NARSINGPUR","MADHYA PRADESH","NARSIMPUR","NARSIMHAPUR                                       ","2014-09-12 09:27:37.400"
"KHARIF","HORTICULTURE","Vegetables","Chillies","	Plant Protection	","root insect control in chilli?","drenching of Chlorpyrifos 20 % EC@40 ml /pump","MADHYA PRADESH","NARSIMPUR","GOTEGAON                                          ","2014-09-12 09:29:40.660"
"KHARIF","AGRICULTURE","Pulses","Pigeon pea (red gram/arhar/tur)","Nutrient Management","better growth on crop.","Spray N: P: K 19:19:19 100 grams and humic acid 30 ml at 15 liter of water.","MADHYA PRADESH","NARSIMPUR","KARELI                                            ","2014-09-12 10:00:08.707"
"KHARIF","AGRICULTURE","Pulses","Pigeon pea (red gram/arhar/tur)","	Plant Protection	","sucking pest control in pigeonpea?","Mencozeb + Carbindazim (Saaf or  sixer)@ 30 g /pump + Imidacloprid 17.8 % SL (confidor) @ 7 ml /pump","MADHYA PRADESH","NARSIMPUR","CHAWARPATHA                                       ","2014-09-12 10:44:14.653"
"KHARIF","AGRICULTURE","Oilseeds","Soybean (bhat)","	Plant Protection	","How to control defoliators of soybean?","Spray the solution of Quinalphose 25EC @ 1ml/lit or Indoxacarb 14.5 % SC @ 13- 15ml /pump or Trizophos 30ml/pump or cholrofinexypyr @ 1ml/lit or Emamectin benzoate 5 % SG @ 6gm/ pump.","MADHYA PRADESH","NARSIMPUR","CHAWARPATHA                                       ","2014-09-12 11:49:51.130"
"KHARIF","AGRICULTURE","Cereals","Paddy (Dhan)","Bio-Pesticides and Bio-Fertilizers","which fertilizer and nutrient give for better growth in paddy crop?","Spray N: P: K 19:19:19 100 grams and humic acid 30 ml at 15 liter of water.","MADHYA PRADESH","NARSIMPUR","KARELI                                            ","2014-09-12 14:06:48.173"
"KHARIF","AGRICULTURE","Pulses","Pigeon pea (red gram/arhar/tur)","	Plant Protection	","how to control root-knot nematode in paddy  crop ?","broadcasting of carbofuran 3G in 7-10kg /acre","MADHYA PRADESH","NARSIMPUR","KARELI                                            ","2014-09-12 14:17:49.230"
"KHARIF","AGRICULTURE","Oilseeds","Soybean (bhat)","	Plant Protection	","how to control of flower drop in soybean crop?","spray of planofix 5-6 ml/pump.","MADHYA PRADESH","NARSIMPUR","KARELI                                            ","2014-09-12 14:28:14.933"
"KHARIF","AGRICULTURE","Pulses","Pigeon pea (red gram/arhar/tur)","	Plant Protection	","farmer want to know information about how to control defoliators in arhar?","recommended for to control defoliators Spray any one of the following insecticides in the initial stage of infestation 
 Indoxacarb 14.5 % SC @ 10-12ml /pump
 spray Emamectin benzoate 5 % 7-8 gram/pump","MADHYA PRADESH","NARSIMPUR","KARELI                                            ","2014-09-12 14:29:17.223"
"KHARIF","AGRICULTURE","Cereals","Paddy (Dhan)","	Plant Protection	","farmer want to know information about How to control of fungal attack in crop ?","spray mencojeb + carbandazim 45 gram and steptrocyclin 2 gram at 15 liter of water","MADHYA PRADESH","NARSIMPUR","GOTEGAON                                          ","2014-09-12 14:33:35.387"
"KHARIF","AGRICULTURE","Others","Others","	Plant Protection	","Weather forecasting for narsimpur district of Madhya Pradesh?","rainfall within 5 days in your district.","MADHYA PRADESH","NARSIMPUR","GOTEGAON                                          ","2014-09-12 14:35:58.633"
"KHARIF","HORTICULTURE","Vegetables","Potato","Seeds and Planting Material","spacing of potato planting ?","row to row 55-60cm. and plant to plant 20-25cm. spacing of potato planting","MADHYA PRADESH","NARSIMPUR","CHAWARPATHA                                       ","2014-09-12 15:13:15.597"
"KHARIF","AGRICULTURE","Pulses","Black Gram (urd bean)","	Plant Protection	","Farmer want to information about how to control of sucking pest urd in crop?","recomended for Spray diphenthuran 50% wp (pegasas) @ 10 to 15 gram at per pump.","MADHYA PRADESH","NARSIMPUR","KARELI                                            ","2014-09-12 15:27:13.923"
"KHARIF","AGRICULTURE","Others","Others","Government Schemes","farmer want to know information about  	WHERE CONTACT FOR government schemes ?","contact to your R A E O","MADHYA PRADESH","NARSIMPUR","CHAWARPATHA                                       ","2014-09-12 15:43:15.420"
"KHARIF","AGRICULTURE","Others","Others","Market Information","Farmer  want number activate in sms facility ?","your number is resistard in sms facility","MADHYA PRADESH","NARSIMPUR","KARELI                                            ","2014-09-12 16:10:02.433"
"KHARIF","AGRICULTURE","Cereals","Paddy (Dhan)","	Plant Protection	","?? ??? ?? ???? ??? ???? ???????? ???????? ??? ??????? ?? ?? ??? ???? ??, ???? ?????? ??? ???? ?????? ?????? ?????????? ???? ?? ???? ????? ????? ?? ???? ????","????????? ?? ????????? ????? (5%) 30 ????/??. ?? ?????? ?? ????????? ??????? ????? (50%) ?? 1.5 ??.????./??. ?? ???????","MADHYA PRADESH","NARSIMPUR","GOTEGAON                                          ","2014-09-12 17:12:24.597"
"KHARIF","AGRICULTURE","Oilseeds","Soybean (bhat)","	Plant Protection	","How to control of fungal attack in soyabean crop?","Mancozeb 63% + Carbendazim 12% WP 40 gram and steptrocyclin 2 gram at 15 liter of water.","MADHYA PRADESH","NARSIMPUR","CHAWARPATHA                                       ","2014-09-12 18:59:23.893"
"KHARIF","HORTICULTURE","Vegetables","Tomato","	Plant Protection	","farmer want to know information about flower droop in tomato ?","spray planofix 5 ml. per 15 liter of water.spray","MADHYA PRADESH","NARSIMPUR","GOTEGAON                                          ","2014-09-12 19:02:25.037"
"KHARIF","AGRICULTURE","Pulses","Pigeon pea (red gram/arhar/tur)","	Plant Protection	","farmer want to know information about Which fertilizer and nutrient give for better growth in arhar crop?","Spray N: P: K 19:19:19 100 grams 15 liter of water.","MADHYA PRADESH","NARSIMPUR","KARELI                                            ","2014-09-12 19:14:22.880"
"KHARIF","AGRICULTURE","Cereals","Paddy (Dhan)","	Plant Protection	","how to control leaf roller., hispa and gall midge control.","Chlorpyrifos 20% EC 40 ml/pump.","MADHYA PRADESH","NARSIMPUR","CHAWARPATHA                                       ","2014-09-13 07:05:49.020"
"KHARIF","AGRICULTURE","Cereals","Paddy (Dhan)","	Plant Protection	","how to control blast of paddy crop ?","spray tricyclazol 20-25 gram per pump .","MADHYA PRADESH","NARSIMPUR","BABAI CHICHALI                                    ","2014-09-13 07:37:13.917"
"KHARIF","AGRICULTURE","Cereals","Paddy (Dhan)","	Plant Protection	","How to control of fungal attack in paddy crop?","Mancozeb 63% + Carbendazim 12% WP 40 gram and steptrocyclin 2 gram at 15 liter of water.","MADHYA PRADESH","NARSIMPUR","NARSIMHAPUR                                       ","2014-09-13 07:59:09.533"
"KHARIF","AGRICULTURE","Sugar and Starch Crops","Sugarcane (Noble Cane)","	Plant Protection	","pest on sugarcane ?","Spray of Malathion @ 45 ML./pump.","MADHYA PRADESH","NARSIMPUR","SAINKHEDA                                         ","2014-09-13 08:38:01.690"
"KHARIF","AGRICULTURE","Others","Others","Weather","farmer want to know information about weather?","DAY-1               DAY-2               DAY-3               DAY-4               DAY-5
                              13/09               14/09               15/09               16/09               17/09
------------------- ------------------- ------------------- ------------------- ------------------- -------------------
Rainfall (mm)                  26                  15                   9                   7                   4","MADHYA PRADESH","NARSIMPUR","GOTEGAON                                          ","2014-09-13 08:55:20.823"
"KHARIF","AGRICULTURE","Cereals","Paddy (Dhan)","	Plant Protection	","How to control of fungal attack in paddy  crop?","Mancozeb 63% + Carbendazim 12% WP 40 gram and steptrocyclin 2 gram at 15 liter of water.","MADHYA PRADESH","NARSIMPUR","GOTEGAON                                          ","2014-09-13 09:36:20.070"
"KHARIF","AGRICULTURE","Others","Others","Weather","farmer want to know weather information ?","Gadarwara 1 – 3 Day Weather Forecast Summary: Light rain (total 4mm), mostly falling on Sat afternoon. Warm (max 31°C on Sun afternoon, min 25°C on Sat morning). Wind will be generally light.","MADHYA PRADESH","NARSIMPUR","SAINKHEDA                                         ","2014-09-13 10:27:38.710"
"KHARIF","AGRICULTURE","Cereals","Paddy (Dhan)","	Plant Protection	","How to control of fungal attack in PADDY crop?","Mancozeb 63% + Carbendazime 12% WP 40 gram and steptrocyclean 2 gram at 15 liter of water.","MADHYA PRADESH","NARSIMPUR","GOTEGAON                                          ","2014-09-13 10:43:45.450"
"KHARIF","AGRICULTURE","Cereals","Paddy (Dhan)","	Plant Protection	","how to control of leaf roller on paddy crop.","Chlorpyriphos 50% + Cypermethrin 5% EC 30ml/pump.","MADHYA PRADESH","NARSIMPUR","KARELI                                            ","2014-09-13 11:01:07.130"
"KHARIF","AGRICULTURE","Cereals","Paddy (Dhan)","Fertilizer Use and Availability","Fertilizers spray on  crop ?","Recommended for Spray of Sujla NPK 19-19-19  @ 100 gm./pump..","MADHYA PRADESH","NARSIMPUR","GOTEGAON                                          ","2014-09-13 11:57:37.180"
"KHARIF","AGRICULTURE","Cereals","Paddy (Dhan)","	Plant Protection	","How to control aphids in moong crop?","Spray imidaclorprid 17.8%SL 5 to 6 ml per pump.","MADHYA PRADESH","NARSIMPUR","CHAWARPATHA                                       ","2014-09-13 12:47:13.667"
"KHARIF","AGRICULTURE","Others","Others","Market Information","farmer want to mandi registration activation ?","your mobile no. mandi rate start","MADHYA PRADESH","NARSIMPUR","KARELI                                            ","2014-09-13 12:52:01.413"
"KHARIF","AGRICULTURE","Oilseeds","Soybean (bhat)","	Plant Protection	","What Can I Do To Control In Flower Drop In SOYBEAN ?","You Can Spray Planofix 5ml/Pump To Control Flower Drop In SOYBEAN","MADHYA PRADESH","NARSIMPUR","GOTEGAON                                          ","2014-09-13 13:46:43.693"
"KHARIF","AGRICULTURE","Oilseeds","Soybean (bhat)","	Plant Protection	","What Can I Do To Control In Flower Drop In SOYBEAN ?","You Can Spray Planofix 5ml/Pump To Control Flower Drop In SOYBEAN","MADHYA PRADESH","NARSIMPUR","GOTEGAON                                          ","2014-09-13 13:46:45.227"
"KHARIF","AGRICULTURE","Pulses","Pigeon pea (red gram/arhar/tur)","	Plant Protection	","How to control white fly in arhar crop?","Spray Dimethoate 30%EC (Rogar) 40 ml per pump.","MADHYA PRADESH","NARSIMPUR","GOTEGAON                                          ","2014-09-13 15:18:04.410"
"KHARIF","AGRICULTURE","Cereals","Paddy (Dhan)","	Plant Protection	","farmer want to know information about How to control Blast disease in paddy crop?","Spray Tricyclazol, hexacorazol, propiconazol 20-25 ml per pump and steptrocyclin 2 to 3 gram per pump.","MADHYA PRADESH","NARSIMPUR","CHAWARPATHA                                       ","2014-09-13 16:40:58.537"
"KHARIF","HORTICULTURE","Condiments and Spices","Ginger","	Plant Protection	","How to control of Leaf spot of ginger?","Mancozeb 63% + Carbendazime 12% WP 40 gram and steptrocyclean 2 gram at 15 liter of water.","MADHYA PRADESH","NARSIMPUR","SAINKHEDA                                         ","2014-09-13 16:48:03.840"
"KHARIF","AGRICULTURE","Others","Others","Market Information","farmer want to ragistration in our mobile number ?","your ragistration is completed..","MADHYA PRADESH","NARSIMPUR","BABAI CHICHALI                                    ","2014-09-13 16:53:00.763"
"KHARIF","AGRICULTURE","Millets","Common Millet (Panivaragu/Chena/Proso Millet/Hogm","	Plant Protection	","farmer want to know information about registration of market information?","You have been registered for market information from kisaan call center","MADHYA PRADESH","NARSIMPUR","NARSIMHAPUR                                       ","2014-09-13 17:11:09.490"
"KHARIF","AGRICULTURE","Others","Others","Market Information","Farmer  want number activate in sms facility ?","your number is resistard in sms facility","MADHYA PRADESH","NARSIMPUR","BABAI CHICHALI                                    ","2014-09-13 18:27:49.863"
"KHARIF","AGRICULTURE","Cereals","Paddy (Dhan)","	Plant Protection	","How to control of fungal attack in psddy crop?","Use copper oxy chloride 45 gram and steptrocyclean 2 gram at 15 liter of water.","MADHYA PRADESH","NARSIMPUR","SAINKHEDA                                         ","2014-09-14 06:22:49.193"
"KHARIF","AGRICULTURE","Others","Others","Government Schemes","About govt. scheme ?","please contact RAEO/ADO for more information ..","MADHYA PRADESH","NARSIMPUR","SAINKHEDA                                         ","2014-09-14 06:43:57.207"
"KHARIF","AGRICULTURE","Pulses","Black Gram (urd bean)","	Plant Protection	","Farmer  want number activate in sms facility ?","your number is resistard in sms facility","MADHYA PRADESH","NARSIMPUR","SAINKHEDA                                         ","2014-09-14 08:06:08.040"
"KHARIF","AGRICULTURE","Others","Others","Weather","Farmer  want to know information  about  weather forecast ?","DAY-1               DAY-2               DAY-3               DAY-4               DAY-5
                              14/09               15/09               16/09               17/09               18/09
------------------- ------------------- ------------------- ------------------- ------------------- -------------------
Rainfall (mm)                   6                   6                   6                   3","MADHYA PRADESH","NARSIMPUR","SAINKHEDA                                         ","2014-09-14 08:31:01.827"
"KHARIF","AGRICULTURE","Oilseeds","Soybean (bhat)","	Plant Protection	","How to control of fungal attack in soyabean crop?","Use copper oxy chloride 45 gram and steptrocyclin 2 gram at 15 liter of water.","MADHYA PRADESH","NARSIMPUR","KARELI                                            ","2014-09-14 08:32:09.353"
"KHARIF","AGRICULTURE","Cereals","Paddy (Dhan)","	Plant Protection	","how to control blast of paddy crop ?","spray tricyclazol 30 gram per pump .","MADHYA PRADESH","NARSIMPUR","BABAI CHICHALI                                    ","2014-09-14 09:27:34.050"
"KHARIF","AGRICULTURE","Cereals","Paddy (Dhan)","	Plant Protection	","fungal problem in paddy ?","Recommended for spray  Mencozeb + Carbindazim (Saaf or  sixer)@ 30 g /pump .","MADHYA PRADESH","NARSIMPUR","NARSIMHAPUR                                       ","2014-09-14 11:03:26.320"
"KHARIF","AGRICULTURE","Cereals","Paddy (Dhan)","	Plant Protection	","how to control Leaf Blast in paddy ?","Tricyclazole @ 1 g /lit of water.","MADHYA PRADESH","NARSIMPUR","NARSIMHAPUR                                       ","2014-09-14 11:09:57.650"
"KHARIF","AGRICULTURE","Oilseeds","Soybean (bhat)","Fertilizer Use and Availability","how to increase growth of soybean ?","foliar application of IFFCO 19:19:19 water soluble fertilizer @ 2kg / acar.","MADHYA PRADESH","NARSIMPUR","SAINKHEDA                                         ","2014-09-14 11:20:39.930"
"KHARIF","HORTICULTURE","Condiments and Spices","Ginger","	Plant Protection	","how to control Leaf spot on ginger crop.","Use copper oxy chloride 45 gram and steptrocyclin 2 gram at 15 liter of water.","MADHYA PRADESH","NARSIMPUR","KARELI                                            ","2014-09-14 12:24:15.963"
