"Season","Sector","Category","Crop","QueryType","QueryText","KCCAns","StateName","DistrictName","BlockName","CreatedOn"
"KHARIF","AGRICULTURE","Pulses","Black Gram (urd bean)","	Plant Protection	","Bacterial Leaf Blight control in moong","Application of any copper fungicides @ 30 g along with streptocyclin at the rate of 2 g /pump","MADHYA PRADESH","NARSIMPUR","SAINKHEDA                                         ","2014-09-14 12:27:53.770"
"KHARIF","AGRICULTURE","Cereals","Paddy (Dhan)","	Plant Protection	","yellowing of rice?","Mencozeb + Carbindazim (Saaf or  sixer)@ 30 g /pump","MADHYA PRADESH","NARSIMPUR","SAINKHEDA                                         ","2014-09-14 12:31:08.383"
"KHARIF","AGRICULTURE","Others","Others","	Plant Protection	","Farmer  want to  weather forecasting  information of District narshingpur","DAY-1               DAY-2               DAY-3               DAY-4               DAY-5
                              15/09               16/09               17/09               18/09               19/09
------------------- ------------------- ------------------- ------------------- ------------------- -------------------
Rainfall (mm)                   5                   4                   5                   0                   0","MADHYA PRADESH","NARSIMPUR","SAINKHEDA                                         ","2014-09-14 12:33:44.550"
"KHARIF","AGRICULTURE","Others","Others","	Plant Protection	","Farmer  want to  weather forecasting  information of District narshingpur","DAY-1               DAY-2               DAY-3               DAY-4               DAY-5
                              15/09               16/09               17/09               18/09               19/09
------------------- ------------------- ------------------- ------------------- ------------------- -------------------
Rainfall (mm)                   5                   4                   5                   0                   0","MADHYA PRADESH","NARSIMPUR","SAINKHEDA                                         ","2014-09-14 12:33:46.187"
"KHARIF","AGRICULTURE","Cereals","Paddy (Dhan)","	Plant Protection	","Farmer want to know how to control stem borer in paddy crop?","Apply cartap hydro cloride 10 bat per acer.","MADHYA PRADESH","NARSIMPUR","GOTEGAON                                          ","2014-09-14 13:40:18.387"
"KHARIF","AGRICULTURE","Pulses","Pigeon pea (red gram/arhar/tur)","	Plant Protection	","Which fertilizer and nutrient give for better growth in arhar crop?","Spray N: P: K 19:19:19 100 grams and humic acid 30 ml at 15 liter of water.","MADHYA PRADESH","NARSIMPUR","KARELI                                            ","2014-09-14 13:46:36.597"
"KHARIF","AGRICULTURE","Cereals","Paddy (Dhan)","	Plant Protection	","How to control of fungal attack in RICE  crop?","Mancozeb 63% + Carbendazim 12% WP 40 gram and steptrocyclin 2 gram at 15 liter of water.","MADHYA PRADESH","NARSIMPUR","GOTEGAON                                          ","2014-09-14 14:42:34.313"
"KHARIF","AGRICULTURE","Others","Others","Government Schemes","Agriculture government schemes information?","Please contact your RAEO.","MADHYA PRADESH","NARSIMPUR","BABAI CHICHALI                                    ","2014-09-14 16:00:56.893"
"KHARIF","AGRICULTURE","Cereals","Paddy (Dhan)","	Plant Protection	","How to control defoliators of soybean ?","Spray the solution of Quinalphose 25EC @ 1ml/lit or Indoxacarb 14.5 % SC @ 13- 15ml /pump or Trizophos 30ml/pump or cholrofinexypyr @ 1ml/lit or Emamectin benzoate 5 % SG @ 6gm/ pump.","MADHYA PRADESH","NARSIMPUR","BABAI CHICHALI                                    ","2014-09-15 07:39:59.577"
"KHARIF","AGRICULTURE","Cereals","Paddy (Dhan)","	Plant Protection	","How to control white fly in paddy crop?","Recommended for Spray imidaclorprid 17.8%SL 5 to 6 ml per pump.","MADHYA PRADESH","NARSIMPUR","CHAWARPATHA                                       ","2014-09-15 08:37:01.213"
"KHARIF","AGRICULTURE","Cereals","Paddy (Dhan)","	Plant Protection	","How to increase size and production in paddy crop?","Spray N: P: K 0:52:34 100  at 15 liter of water.","MADHYA PRADESH","NARSIMPUR","GOTEGAON                                          ","2014-09-15 09:24:13.743"
"KHARIF","AGRICULTURE","Others","Others","Weather","Farmer want to know information about  weather forecast ?","15/09               16/09               17/09               18/09               19/09
------------------- ------------------- ------------------- ------------------- ------------------- -------------------
Rainfall (mm)                   3                   0                   0                   0                   0","MADHYA PRADESH","NARSIMPUR","NARSIMHAPUR                                       ","2014-09-15 09:53:33.097"
"KHARIF","AGRICULTURE","Cereals","Paddy (Dhan)","	Plant Protection	","how to control blast of paddy crop ?","spray tricyclazol 20-25 gram per pump .","MADHYA PRADESH","NARSIMPUR","GOTEGAON                                          ","2014-09-15 10:53:08.877"
"KHARIF","AGRICULTURE","Cereals","Wheat","Weather","Farmer want to information about weather  forecast  ? 

Farmer want to information about weather  forecast  ?","16/09               17/09               18/09               19/09               20/09
------------------- ------------------- ------------------- ------------------- ------------------- -------------------
Rainfall (mm)                   4                   5                   0                   0                   0","MADHYA PRADESH","NARSIMPUR","GOTEGAON                                          ","2014-09-15 11:59:15.830"
"KHARIF","AGRICULTURE","Cereals","Paddy (Dhan)","	Field Preparation	","farmer want to information about mandi rate ragistion?","mandi ragistation is  activate.","MADHYA PRADESH","NARSIMPUR","GOTEGAON                                          ","2014-09-15 12:02:33.017"
"KHARIF","AGRICULTURE","Oilseeds","Soybean (bhat)","	Plant Protection	","farmer want to know information about  How to control caterpillars in soyabean crop?","spray of  deltamethrin20 ml+dachlorvas (nuvan) 20 ml / 16litre water","MADHYA PRADESH","NARSIMPUR","NARSIMHAPUR                                       ","2014-09-15 14:07:40.290"
"KHARIF","AGRICULTURE","Pulses","Green Gram (Moong Bean/ Moong)","	Plant Protection	","how to increase growth on flowering stage of moong crop ?","0-52-34,, 100g/pump spray.","MADHYA PRADESH","NARSIMPUR","KARELI                                            ","2014-09-15 15:19:04.620"
"KHARIF","AGRICULTURE","Oilseeds","Soybean (bhat)","Weather","anjafarmer want to weather information of district?","16/09               17/09               18/09               19/09               20/09
Rainfall (mm)                   4                   5                   0                   0                   0","MADHYA PRADESH","NARSIMPUR","NARSIMHAPUR                                       ","2014-09-15 15:19:49.570"
"KHARIF","AGRICULTURE","Oilseeds","Soybean (bhat)","	Plant Protection	","how to increase growth on flowering stage of soyabean crop ?","0-52-34,, 100g/pump spray.","MADHYA PRADESH","NARSIMPUR","NARSIMHAPUR                                       ","2014-09-15 17:55:00.680"
"KHARIF","AGRICULTURE","Pulses","Black Gram (urd bean)","	Plant Protection	","How to control white fly in urd crop?","Spray of imidaclorprid 17.8%SL 5 to 6 ml per pump.","MADHYA PRADESH","NARSIMPUR","KARELI                                            ","2014-09-15 18:14:31.480"
"KHARIF","AGRICULTURE","Pulses","Green Gram (Moong Bean/ Moong)","	Plant Protection	","How to control white fly  crop?","Spray of Queenolfos 25 EC 1000 Ml. / hac. 
or Spray of Profenofos 40% + Cypermethrin 4% EC 1000 Ml. / hac.","MADHYA PRADESH","NARSIMPUR","SAINKHEDA                                         ","2014-09-15 18:16:38.980"
"KHARIF","AGRICULTURE","Pulses","Bengal Gram (Gram/Chick Pea/Kabuli/Chana)","	Plant Protection	","FARMER WAT TO AAD MY NO. IN MANDI RATE?","your mobile mandi rate start","MADHYA PRADESH","NARSIMPUR","KARELI                                            ","2014-09-15 18:24:11.750"
"KHARIF","HORTICULTURE","Vegetables","Chillies","	Plant Protection	","wilt control in chilli?","Recommended for  wilt control in chilli Copper oxychloride @ 40 g /pump","MADHYA PRADESH","NARSIMPUR","SAINKHEDA                                         ","2014-09-16 07:02:51.153"
"KHARIF","AGRICULTURE","Others","Others","Weather","Farmer  want to  weather forecasting  information of District narshingpur","DAY-1               DAY-2               DAY-3               DAY-4               DAY-5
                              16/09               17/09               18/09               19/09               20/09
------------------- ------------------- ------------------- ------------------- ------------------- -------------------
Rainfall (mm)                   4                   5                   0                   0                   0","MADHYA PRADESH","NARSIMPUR","SAINKHEDA                                         ","2014-09-16 07:04:23.880"
"KHARIF","AGRICULTURE","Cereals","Paddy (Dhan)","	Plant Protection	","Which fertilizer and nutrient give for better growth in paddy crop?","Spray N: P: K 19:19:19 100 grams at 15 liter of water.","MADHYA PRADESH","NARSIMPUR","NARSIMHAPUR                                       ","2014-09-16 09:35:07.530"
"KHARIF","AGRICULTURE","Cereals","Paddy (Dhan)","	Plant Protection	","How to control of fungal attack in paddy crop?","Use copper oxy chloride 45 gram and steptrocyclin 2 gram at 15 liter of water.","MADHYA PRADESH","NARSIMPUR","KARELI                                            ","2014-09-16 10:33:56.133"
"KHARIF","HORTICULTURE","Vegetables","Potato","Market Information","want to know about mandi rate of Potato ?","12/09/2014 300 Desi 1650 1960 1780","MADHYA PRADESH","NARSIMPUR","GOTEGAON                                          ","2014-09-16 10:42:22.550"
"KHARIF","AGRICULTURE","Cereals","Paddy (Dhan)","Fertilizer Use and Availability","Which fertilizer and nutrient give for better growth in paddy crop?","Spray N: P: K 19:19:19 100 grams and humic acid 30 ml at 15 liter of water.","MADHYA PRADESH","NARSIMPUR","SAINKHEDA                                         ","2014-09-16 10:51:58.430"
"KHARIF","AGRICULTURE","Pulses","Pigeon pea (red gram/arhar/tur)","	Plant Protection	","how to control wilt ?","The affected plants should be removed and destroyed. Spot drenching of the solution Kasubi ( kasukamycine 3% SL) @ 250ml/acer + 50ml Cursur ( Flufilazol 40% EC) or Carbendazim (0.1%). Crop rotation with a non- host crop such as cereals.","MADHYA PRADESH","NARSIMPUR","NARSIMHAPUR                                       ","2014-09-16 11:37:14.770"
"KHARIF","AGRICULTURE","Pulses","Pigeon pea (red gram/arhar/tur)","	Plant Protection	","how to control stem fly of arhar crop ?","Recommended for spray  Monocrotophos 36 s. L. 40 ml/ pump . .","MADHYA PRADESH","NARSIMPUR","KARELI                                            ","2014-09-16 13:04:13.427"
"KHARIF","AGRICULTURE","Others","Others","Market Information","how to start market information ?","your mobile no. mandi rate start","MADHYA PRADESH","NARSIMPUR","CHAWARPATHA                                       ","2014-09-16 13:16:19.583"
"KHARIF","AGRICULTURE","Others","Others","Weather","Farmer want to know information about    weather forecast  ?","Narsimhapur 1 – 3 Day Weather Forecast Summary: Mostly dry. Warm (max 33°C on Thu afternoon, min 25°C on Tue night). Wind will be generally light.","MADHYA PRADESH","NARSIMPUR","NARSIMHAPUR                                       ","2014-09-16 14:12:30.417"
"JAYAD","AGRICULTURE","Cereals","Paddy (Dhan)","	Plant Protection	","farmer want to know information about how to control nematodes paddy crop?","recommended for to control nematodes paddy crop spray nemagone 30ml/pump","MADHYA PRADESH","NARSIMPUR","GOTEGAON                                          ","2014-09-16 14:36:21.197"
"KHARIF","AGRICULTURE","Cereals","Paddy (Dhan)","	Plant Protection	","Which fertilizer and nutrient give for better growth in paddy crop?","foliar application of IFFCO 19:19:19 water soluable fertilizer @ 100 -150gm/pump.and humic acid 30ml/pump","MADHYA PRADESH","NARSIMPUR","SAINKHEDA                                         ","2014-09-16 16:13:46.347"
"KHARIF","AGRICULTURE","Sugar and Starch Crops","Sugarcane (Noble Cane)","	Plant Protection	","farmer want to know information about  How to control caterpillars in soyabean crop?","Monocrotophos 36 s. L. 800 ml. / hac. Rate of spray.","MADHYA PRADESH","NARSIMPUR","GOTEGAON                                          ","2014-09-16 18:05:06.010"
"KHARIF","AGRICULTURE","Sugar and Starch Crops","Sugarcane (Noble Cane)","	Plant Protection	","farmer want to know information about  How to control caterpillars in sugarcane crop?","Monocrotophos 36 s. L. 800 ml. / hac. Rate of spray.","MADHYA PRADESH","NARSIMPUR","GOTEGAON                                          ","2014-09-16 18:06:29.577"
"KHARIF","AGRICULTURE","Cereals","Paddy (Dhan)","Weather","farmer want to know information about Which fertilizer and nutrient give for better growth in paddy crop?","Spray N: P: K 19:19:19 100 grams /15 liter of water.","MADHYA PRADESH","NARSIMPUR","CHAWARPATHA                                       ","2014-09-16 19:16:46.653"
"KHARIF","AGRICULTURE","Others","Others","Weather","Farmer want to know information about weather forecast  ?","17/09               18/09               19/09               20/09               21/09
------------------- ------------------- ------------------- ------------------- ------------------- -------------------
Rainfall (mm)                   0                   0                   0                   0                   0","MADHYA PRADESH","NARSIMPUR","CHAWARPATHA                                       ","2014-09-17 06:41:16.410"
"KHARIF","AGRICULTURE","Others","Others","Market Information","farmer want to mandi registration activation ?","your mobile no. mandi rate start","MADHYA PRADESH","NARSIMPUR","BABAI CHICHALI                                    ","2014-09-17 06:51:46.810"
"KHARIF","AGRICULTURE","Others","Others","	Plant Protection	","How to control caterpillars in BRINJAL crop ?","Spray emamectin benjoate or corajan or fem 10 ml at 15 liter of water","MADHYA PRADESH","NARSIMPUR","CHAWARPATHA                                       ","2014-09-17 07:27:11.063"
"KHARIF","AGRICULTURE","Pulses","Black Gram (urd bean)","	Plant Protection	","how to control white fly in urd","metasistox","MADHYA PRADESH","NARSIMPUR","CHAWARPATHA                                       ","2014-09-17 07:51:38.553"
"KHARIF","AGRICULTURE","Others","Others","Weather","Farmer want to know information about weather information ?","DAY-1               DAY-2               DAY-3               DAY-4               DAY-5
                              17/09               18/09               19/09               20/09               21/09
------------------- ------------------- ------------------- ------------------- ------------------- -------------------
Rainfall (mm)                   0                   0                   0                   0                   0","MADHYA PRADESH","NARSIMPUR","KARELI                                            ","2014-09-17 08:11:28.220"
"KHARIF","AGRICULTURE","Others","Others","	Plant Protection	","How to control of fungal attack","Use copper oxy chloride 45 gram and steptrocyclin 2 gram at 15 liter of water.","MADHYA PRADESH","NARSIMPUR","KARELI                                            ","2014-09-17 09:35:56.027"
"KHARIF","AGRICULTURE","Cereals","Paddy (Dhan)","	Plant Protection	","Farmer want to know information about control of fungal attack in paddy ?","Hexaconazole 5% SC 300-350ml/acre","MADHYA PRADESH","NARSIMPUR","GOTEGAON                                          ","2014-09-17 10:09:20.813"
"KHARIF","AGRICULTURE","Pulses","Pigeon pea (red gram/arhar/tur)","	Plant Protection	","How to control of fungal attack in pigeon pea  crop?","Use copper oxy chloride 45 gram and steptrocyclin 2 gram at 15 liter of water.","MADHYA PRADESH","NARSIMPUR","CHAWARPATHA                                       ","2014-09-17 10:15:41.560"
"KHARIF","AGRICULTURE","Others","Others","Weather","Farmer  want to know information  about  weather forecast ?","DAY-1               DAY-2               DAY-3               DAY-4               DAY-5
                              18/09               19/09               20/09               21/09               22/09
------------------- ------------------- ------------------- ------------------- ------------------- -------------------
Rainfall (mm)                   0                   0                   0                   3                   0","MADHYA PRADESH","NARSIMPUR","NARSIMHAPUR                                       ","2014-09-17 10:19:37.490"
"KHARIF","AGRICULTURE","Cereals","Paddy (Dhan)","	Field Preparation	","how to control fungal disease ?","imidacholoropid","MADHYA PRADESH","NARSIMPUR","BABAI CHICHALI                                    ","2014-09-17 10:26:09.373"
"KHARIF","AGRICULTURE","Cereals","Paddy (Dhan)","	Plant Protection	","farmer want to know information about How to control of fungal attack in paddy crop ?","spray mencozeb + carbendazim 45 gram and steptrocyclin 2 gram at 15 liter of water","MADHYA PRADESH","NARSIMPUR","CHAWARPATHA                                       ","2014-09-17 11:07:59.693"
"KHARIF","AGRICULTURE","Cereals","Paddy (Dhan)","	Plant Protection	","Farmer want to know information about control of pest in paddy ?","Profenofos40%+Cypermethrin4% 300-350ml/acre","MADHYA PRADESH","NARSIMPUR","GOTEGAON                                          ","2014-09-17 11:20:49.440"
"KHARIF","AGRICULTURE","Pulses","Pigeon pea (red gram/arhar/tur)","	Plant Protection	","How to control caterpillars in arher crop?","Spray of trijophose  40% + Cypermethrin 4% EC 1000 Ml. / hac.","MADHYA PRADESH","NARSIMPUR","GOTEGAON                                          ","2014-09-17 11:54:27.943"
"KHARIF","AGRICULTURE","Cereals","Paddy (Dhan)","	Plant Protection	","farmer want to know information about How to control Blast disease in paddy crop?","Spray Tricyclazol, hexacorazol, propiconazol 20-25 ml per pump and steptrocyclin 2 to 3 gram per pump.","MADHYA PRADESH","NARSIMPUR","BABAI CHICHALI                                    ","2014-09-17 13:00:59.950"
"KHARIF","AGRICULTURE","Cereals","Paddy (Dhan)","	Plant Protection	","Farmer want to know information about control of pest in paddy ?","Endoxacarb 14.5% SC 100-150ml/acre(15-20ml/pump)","MADHYA PRADESH","NARSIMPUR","NARSIMHAPUR                                       ","2014-09-17 13:13:55.970"
"KHARIF","AGRICULTURE","Others","Others","Market Information","farmer want to information about add my no. in mandi rate.","your mobile number mandi rate start","MADHYA PRADESH","NARSIMPUR","NARSIMHAPUR                                       ","2014-09-17 13:42:45.673"
"KHARIF","AGRICULTURE","Pulses","Pigeon pea (red gram/arhar/tur)","	Plant Protection	","How to control caterpillars in red gram crop?","Profenofos 40% + Cypermethrin 4% EC 1000 Ml. / hac. Rate of spray.","MADHYA PRADESH","NARSIMPUR","GOTEGAON                                          ","2014-09-17 13:58:45.447"
"KHARIF","AGRICULTURE","Pulses","Pigeon pea (red gram/arhar/tur)","	Plant Protection	","farmer want to know information about How to control aphid  in pigeon pea crop?","Spray Dimethoate 30 EC (Rogar) or Triazophos 30 ml per pump.","MADHYA PRADESH","NARSIMPUR","NARSIMHAPUR                                       ","2014-09-17 14:46:57.873"
"KHARIF","AGRICULTURE","Cereals","Paddy (Dhan)","	Plant Protection	","How to control stem borer in paddy crop?","Apply cartap hydro chloride 7 to 10 kg at per Acer.","MADHYA PRADESH","NARSIMPUR","NARSIMHAPUR                                       ","2014-09-17 16:16:49.580"
"KHARIF","AGRICULTURE","Cereals","Paddy (Dhan)","	Plant Protection	","Farmer want to information about Fungal attack in paddy crop","Use copper oxy chloride 45 gram and steptrocyclin 2 gram at 15 liter of watr.","MADHYA PRADESH","NARSIMPUR","CHAWARPATHA                                       ","2014-09-17 16:46:47.990"
"KHARIF","AGRICULTURE","Cereals","Paddy (Dhan)","	Plant Protection	","Farmer want to information about Fungal attack in paddy crop","Use copper oxy chloride 45 gram and steptrocyclin 2 gram at 15 liter of watr.","MADHYA PRADESH","NARSIMPUR","CHAWARPATHA                                       ","2014-09-17 16:57:37.810"
"KHARIF","AGRICULTURE","Pulses","Pigeon pea (red gram/arhar/tur)","	Plant Protection	","how to control SUCKING IN arhar ?","recommend for spray to Imidacloprid 17.8 % SL 5-7 ML/PUMP","MADHYA PRADESH","NARSIMPUR","CHAWARPATHA                                       ","2014-09-17 17:03:21.053"
"KHARIF","AGRICULTURE","Oilseeds","Soybean (bhat)","	Plant Protection	","How to control caterpillars in soyabean crop?","Spray of Queenolfos 25 EC 1000 Ml. / hac. 
or Spray of Profenofos 40% + Cypermethrin 4% EC 1000 Ml. / hac.","MADHYA PRADESH","NARSIMPUR","NARSIMHAPUR                                       ","2014-09-17 18:35:02.580"
"KHARIF","AGRICULTURE","Others","Others","	Plant Protection	","I want number resister in mandi rate?","Your number  is resister in mandi rate  .","MADHYA PRADESH","NARSIMPUR","GOTEGAON                                          ","2014-09-17 18:55:01.437"
"KHARIF","AGRICULTURE","Pulses","Pigeon pea (red gram/arhar/tur)","	Plant Protection	","How to control of fungal attack in red gram crop?","Mancozeb 63% + Carbendazime 12% WP (saaf ) 40 gram and steptrocyclean 2 gram at 15 liter of water.","MADHYA PRADESH","NARSIMPUR","GOTEGAON                                          ","2014-09-18 06:43:10.417"
"KHARIF","AGRICULTURE","Others","Others","Weather","NARSINGPUR Weather Forecast – 10 Day (Madhya Pradesh, India)?","DAY-1               DAY-2               DAY-3               DAY-4               DAY-5
                              18/09               19/09               20/09               21/09               22/09
------------------- ------------------- ------------------- ------------------- ------------------- -------------------
Rainfall (mm)                   0                   0                   0                   3                   0","MADHYA PRADESH","NARSIMPUR","SAINKHEDA                                         ","2014-09-18 07:08:54.810"
"KHARIF","AGRICULTURE","Cereals","Paddy (Dhan)","	Plant Protection	","How to control stem borer in paddy?","Spray the solution of Metasystox or Daimethoate 2ml/lit of water or soil application of Cartap hydrochloride @ 7kg/acer.","MADHYA PRADESH","NARSIMPUR","BABAI CHICHALI                                    ","2014-09-18 07:17:26.330"
"KHARIF","AGRICULTURE","Pulses","Black Gram (urd bean)","	Plant Protection	","How to control white fly in soyabean crop?","Spray Dimethoate 30%EC (Rogar) 40 ml per pump.","MADHYA PRADESH","NARSIMPUR","BABAI CHICHALI                                    ","2014-09-18 08:46:29.607"
"KHARIF","AGRICULTURE","Others","Others","Weather","Farmer want to know about weather information ?","18/09               19/09               20/09               21/09               22/09
Rainfall (mm)                   0                   0                   0                   3                   0","MADHYA PRADESH","NARSIMPUR","NARSIMHAPUR                                       ","2014-09-18 09:41:12.110"
"KHARIF","AGRICULTURE","Pulses","Pigeon pea (red gram/arhar/tur)","	Plant Protection	","How to control of fungal attack in pigeon pea crop?","Mancozeb 63% + Carbendazim 12% WP 40 gram and steptrocyclin 2 gram at 15 liter of water.","MADHYA PRADESH","NARSIMPUR","CHAWARPATHA                                       ","2014-09-18 10:14:20.290"
"KHARIF","AGRICULTURE","Others","Others","Weather","Farmer want to know information about weather forecast  ?","19/09               20/09               21/09               22/09               23/09
------------------- ------------------- ------------------- ------------------- ------------------- -------------------
Rainfall (mm)                   0                   0                   0                   0                   0","MADHYA PRADESH","NARSIMPUR","SAINKHEDA                                         ","2014-09-18 13:20:29.890"
"KHARIF","AGRICULTURE","Others","Others","	Plant Protection	","How to control Termite in fallow crop?","use of cloropayriphos 20 EC 600 ml with sand .","MADHYA PRADESH","NARSIMPUR","GOTEGAON                                          ","2014-09-18 14:29:22.483"
"KHARIF","AGRICULTURE","Cereals","Paddy (Dhan)","	Plant Protection	","How to control GUNDHI BUG IN PADDY ?","MAILATHION @ 30 KG /HA.BROUD CASTING OR CARBARYLE 1.5 KG /HA. SPRAY","MADHYA PRADESH","NARSIMPUR","KARELI                                            ","2014-09-18 16:44:30.463"
"KHARIF","AGRICULTURE","Cereals","Paddy (Dhan)","	Plant Protection	","How to control GUNDHI BUG IN PADDY ?","MAILATHION @ 30 KG /HA.BROUD CASTING OR CARBARYLE 1.5 KG /HA. SPRAY","MADHYA PRADESH","NARSIMPUR","KARELI                                            ","2014-09-18 16:49:31.823"
"KHARIF","AGRICULTURE","Cereals","Paddy (Dhan)","	Plant Protection	","farmer want to know information about How to control of fungal attack in paddy  crop?","recommended for to control of fungal attack in gram crop use captan + hexaconazol 40gm.and streptocyclin 2 gram at 15 liter of water","MADHYA PRADESH","NARSIMPUR","NARSIMHAPUR                                       ","2014-09-18 17:20:32.920"
"KHARIF","AGRICULTURE","Oilseeds","Soybean (bhat)","	Plant Protection	","How to control caterpillars in soyabean crop?","Spray emamectin benjoate 5% SG @ 6 GRAM 10 ml at 15 liter of water or indoxa carb 10 ml at 15 liter of water.","MADHYA PRADESH","NARSIMPUR","KARELI                                            ","2014-09-18 18:48:11.200"
