"Season","Sector","Category","Crop","QueryType","QueryText","KCCAns","StateName","DistrictName","BlockName","CreatedOn"
"RABI","AGRICULTURE","Others","Others","Market Information","Farmer want to know  information about   contact no .?","solar instrument  office contact no 0755-2556526","MADHYA PRADESH","RATLAM","RATLAM                                            ","2014-11-18 15:50:59.230"
"RABI","AGRICULTURE","Cereals","Wheat","Varieties","Farmer wants to information of Varieties of Wheat crop?","Irrigated Late sown- Lok-1, GW 173, DL 788-2 (vidisha), HI 1454 (Abha), MP 4010, HI 1418 (Naveen Chandusi), HD 2402, HD 2932 (Pust wheat-111)","MADHYA PRADESH","RATLAM","RATLAM                                            ","2014-11-18 16:05:00.310"
"RABI","AGRICULTURE","Cereals","Wheat","Varieties","Farmer wants to information of Varieties of Wheat crop?","Irrigated Late sown- Lok-1, GW 173, DL 788-2 (vidisha), HI 1454 (Abha), MP 4010, HI 1418 (Naveen Chandusi), HD 2402, HD 2932 (Pust wheat-111)","MADHYA PRADESH","RATLAM","RATLAM                                            ","2014-11-18 16:05:00.930"
"RABI","HORTICULTURE","Condiments and Spices","Garlic","	Plant Protection	","How to control thrips in garlic crop?","Recommended for Lambda Cyhalothrin 5% EC 120 to 150 ml at per acre.","MADHYA PRADESH","RATLAM","SAILANA                                           ","2014-11-18 16:31:39.527"
"RABI","AGRICULTURE","Others","Others","Sowing Time and Weather","farmer want to sowing season in fenugreek crop ?","Season: June - July and October - November .","MADHYA PRADESH","RATLAM","SAILANA                                           ","2014-11-18 16:56:26.413"
"RABI","HORTICULTURE","Condiments and Spices","Garlic","	Plant Protection	","FARMER WANT TO HOW KNOW TO CONTROL FUNGAL INFECTION IN garlic CROP ?","Recommended for spray HEXACONAZOL 20 ml/pump
Chlorpyriphos 20%ec 1 liter per acre apply mix with sand .","MADHYA PRADESH","RATLAM","JAORA                                             ","2014-11-18 17:34:31.520"
"RABI","AGRICULTURE","Others","Others","	Plant Protection	","How to control white fly in garlic crop?","Spray imidaclorprid 17.8%SL 5 to 6 ml per pump.","MADHYA PRADESH","RATLAM","PIPLODA                                           ","2014-11-18 18:53:19.593"
"RABI","AGRICULTURE","Others","Others","	Plant Protection	","How to control of fungal attack in garlic crop?","Mancozeb 63% + Carbendazim 12% WP 15 gram and steptrocyclin 2 gram at 15 liter of water.","MADHYA PRADESH","RATLAM","PIPLODA                                           ","2014-11-18 18:58:38.443"
"RABI","HORTICULTURE","Vegetables","Pea (Vegetable)","	Plant Protection	","farmer want to know information about  How to control white fly in pea crop?","Spray of imidaclorprid 17.8%SL 5 to 6 ml per pump.","MADHYA PRADESH","RATLAM","PIPLODA                                           ","2014-11-18 19:55:51.677"
"RABI","AGRICULTURE","Cereals","Wheat","	Plant Protection	","farmer want to know information about weed MANAGEMENT in wheat?","for weed MANAGEMENT in wheat spray metsulfuran @ 1gm/pump.","MADHYA PRADESH","RATLAM","JAORA                                             ","2014-11-18 20:45:01.450"
"RABI","ANIMAL HUSBANDRY","Animal","Bovine(Cow,Buffalo)","Dairy Production","farmer want to know information about What nutrition gives to our cattle?","Please contact 18001801199 numbers.","MADHYA PRADESH","RATLAM","JAORA                                             ","2014-11-18 21:11:14.407"
"RABI","AGRICULTURE","Others","Others","Market Information","Farmer want to mandi rate registration in mobile ?","Your mandi rate start after some time …","MADHYA PRADESH","RATLAM","JAORA                                             ","2014-11-18 21:17:54.753"
"RABI","AGRICULTURE","Cereals","Wheat","Fertilizer Use and Availability","Fertilizer dose in wheat crop?","Recommended for Urea 175 kg, DAP 109 kg and MOP 50 kg per hac.","MADHYA PRADESH","RATLAM","RATLAM                                            ","2014-11-18 21:55:34.820"
"RABI","AGRICULTURE","Others","Others","Weather","Farmer want to know information about weather forecast ?","19/11               20/11               21/11               22/11               23/11
------------------- ------------------- ------------------- ------------------- ------------------- -------------------
Rainfall (mm)                   0                   0                   0                   0                   0","MADHYA PRADESH","RATLAM","PIPLODA                                           ","2014-11-19 07:49:21.200"
"RABI","HORTICULTURE","Condiments and Spices","Garlic","	Plant Protection	","seed treatment in gram.","use bavastim 3 gm ker kg of seed","MADHYA PRADESH","RATLAM","RATLAM                                            ","2014-11-19 07:52:28.397"
"RABI","HORTICULTURE","Condiments and Spices","Coriander","	Plant Protection	","farmer want to know about control of wilt in coriander crops?","Mancozeb 63% + Carbendazim 12% WP 40 gram 15 liter of water","MADHYA PRADESH","RATLAM","RATLAM                                            ","2014-11-19 09:12:50.683"
"RABI","AGRICULTURE","Cereals","Wheat","Market Information","farmer want to know information about registration of market information?","recommended for registration of market information you have been registered for market information from kisaan call center.","MADHYA PRADESH","RATLAM","PIPLODA                                           ","2014-11-19 09:42:01.467"
"RABI","HORTICULTURE","Condiments and Spices","Garlic","	Plant Protection	","Farmer want to know information about sucking pest in garlic ?","Thiomethoxam 25% WG 5gm + Acetameprid 20% SP 7gm/pump","MADHYA PRADESH","RATLAM","RATLAM                                            ","2014-11-19 10:04:31.383"
"RABI","HORTICULTURE","Condiments and Spices","Garlic","	Plant Protection	","Farmer want to know information about fungal attack in garlic ?","Carbendazim 12% + Mencozeb 63% 300-350gm/acre(35-40gm/pump)","MADHYA PRADESH","RATLAM","RATLAM                                            ","2014-11-19 10:06:18.450"
"RABI","AGRICULTURE","Others","Others","Weather","weather information ?","some clouds in your area","MADHYA PRADESH","RATLAM","ALOT                                              ","2014-11-19 10:31:15.183"
"RABI","AGRICULTURE","Others","Others","Market Information","farmer want to know information about registration of market information?","recommended for registration of market information you have been registered for market information from kisaan call center.","MADHYA PRADESH","RATLAM","RATLAM                                            ","2014-11-19 10:42:15.933"
"RABI","HORTICULTURE","Condiments and Spices","Garlic","	Plant Protection	","farmer want to know information about How to control of fungal attack in crop ?","Use copper oxy chloride  50% w  45 gram and steptrocyclin  90% w/w 2 gram at 15 liter of water","MADHYA PRADESH","RATLAM","JAORA                                             ","2014-11-19 10:48:15.230"
"RABI","HORTICULTURE","Condiments and Spices","Garlic","	Plant Protection	","farmer want to know information about How to control of fungal attack in garlic  crop?","recommended for to control of fungal attack use copper oxy chloride 40 gram and streptocyclin 2 gram at 15 liter of water","MADHYA PRADESH","RATLAM","RATLAM                                            ","2014-11-19 10:56:00.597"
"RABI","HORTICULTURE","Condiments and Spices","Garlic","	Plant Protection	","farmer want to know information about How to control of fungal attack in garlic crop ?","Use copper oxy chloride  50% w  45 gram and steptrocyclin  90% w/w 2 gram at 15 liter of water","MADHYA PRADESH","RATLAM","RATLAM                                            ","2014-11-19 10:56:51.947"
"RABI","HORTICULTURE","Vegetables","Onion","Cultural Practices","farmer want to know information about	Varieties of  onion?","recommended for Varieties of  onion Pusa Red, Pusa White Flat, Pusa White Round, Pusa Ratnar, S-131, Early Grano, Punjab Selection, Punjab Red Round, Punjab-48, Punjab Red Round, CO-1(Multiplier), CO-2, CO-3, CO-4, MDU-1, Hissar 2, Kalyanpur Red Round, Udaipur 101, Brown Spanish (Long day) and VL-1 (Long day).","MADHYA PRADESH","RATLAM","RATLAM                                            ","2014-11-19 11:04:09.200"
"RABI","HORTICULTURE","Condiments and Spices","Fenugreek","	Plant Protection	","Farmer want to know information about fungal attack in","Coper oxichloride 300-350gm(35-40gm/pump) + Streptocyclin 12gm(2gm/pump)/acre","MADHYA PRADESH","RATLAM","PIPLODA                                           ","2014-11-19 11:13:44.400"
"RABI","HORTICULTURE","Condiments and Spices","Nutmeg","	Plant Protection	","How to control of fungal attack in kalonji ?","Mancozeb 63% + Carbendazim 12% WP 40 gram and steptrocyclin 2 gram at 15 liter of water.","MADHYA PRADESH","RATLAM","ALOT                                              ","2014-11-19 11:18:50.487"
"RABI","HORTICULTURE","Condiments and Spices","Garlic","	Plant Protection	","How to control of fungal attack in garlic crop?","Recommended for Use copper oxy chloride 45 gram and steptrocyclin 2 gram at 15 liter of water.","MADHYA PRADESH","RATLAM","RATLAM                                            ","2014-11-19 11:22:03.430"
"RABI","AGRICULTURE","Others","Others","Market Information","Farmer want to registration about mandi rate  ?","in your mobile mandi rate has started ,,,,,,,","MADHYA PRADESH","RATLAM","RATLAM                                            ","2014-11-19 11:32:53.400"
"RABI","AGRICULTURE","Cereals","Wheat","Varieties","farmer want to know information about varieties of Wheat crop?","Irrigated within time - Lok-1, MP 1142, HI 1077 (Mangala), DL803-3 (kanchan), GW 190, GW 273, GW 322, MP 1142, GW 366, HI 8381 (Malavshree), HI 8498 (Malav shakti).","MADHYA PRADESH","RATLAM","RATLAM                                            ","2014-11-19 12:31:02.863"
"RABI","AGRICULTURE","Cereals","Wheat","Varieties","farmer want to know information about varieties of Wheat crop?","Irrigated within time - Lok-1, MP 1142, HI 1077 (Mangala), DL803-3 (kanchan), GW 190, GW 273, GW 322, MP 1142, GW 366, HI 8381 (Malavshree), HI 8498 (Malav shakti).","MADHYA PRADESH","RATLAM","RATLAM                                            ","2014-11-19 12:31:03.240"
"RABI","AGRICULTURE","Others","Others","Market Information","Farmer wants to start mandi rate facility on mobile phone?","Mandi rate facility has been successfully activated on your mobile phone.","MADHYA PRADESH","RATLAM","RATLAM                                            ","2014-11-19 12:53:13.367"
"RABI","AGRICULTURE","Cereals","Wheat","Fertilizer Use and Availability","Fertilizer dose in wheat crop?","Urea 210 kg, DAP 130 kg and MOP 65 kg per hac.","MADHYA PRADESH","RATLAM","RATLAM                                            ","2014-11-19 13:00:19.927"
"RABI","HORTICULTURE","Vegetables","Onion","	Plant Protection	","How to control white fly in onion  crop?","Recommended for Spray Dimethoate 30%EC (Rogar) 40 ml per pump.","MADHYA PRADESH","RATLAM","PIPLODA                                           ","2014-11-19 13:30:02.130"
"RABI","AGRICULTURE","Others","Others","Market Information","farmer want to know information about registration of market information?","recommended for registration of market information you have been registered for market information from kisaan call center.","MADHYA PRADESH","RATLAM","JAORA                                             ","2014-11-19 13:32:24.317"
"RABI","AGRICULTURE","Cereals","Wheat","	Plant Protection	","farmer want to start of mandi slert sms in mobile ?","Your number has been on the market price of the messaging service.","MADHYA PRADESH","RATLAM","JAORA                                             ","2014-11-19 13:45:33.823"
"RABI","HORTICULTURE","Condiments and Spices","Garlic","	Plant Protection	","farmer want to know information about how to control sucking pest in garlic crop?","recommended for to control sucking pest in  crop spray imedachlorprid 5-7 ml at 15 liter of water.","MADHYA PRADESH","RATLAM","JAORA                                             ","2014-11-19 13:55:20.360"
"RABI","AGRICULTURE","Others","Others","	Plant Protection	","farmer want to know information about how to control sucking pest in garlic?","recommended for spray imedaclorpid @5-7 ml/pump","MADHYA PRADESH","RATLAM","PIPLODA                                           ","2014-11-19 14:22:55.173"
"RABI","AGRICULTURE","Others","Others","Market Information","Farmer wants to start mandi rate facility on mobile phone?","Mandi rate facility has been successfully activated on your mobile phone.","MADHYA PRADESH","RATLAM","PIPLODA                                           ","2014-11-19 14:26:31.770"
"RABI","AGRICULTURE","Others","Others","Market Information","Farmer wants to start mandi rate facility on mobile phone?","Mandi rate facility has been successfully activated on your mobile phone.","MADHYA PRADESH","RATLAM","PIPLODA                                           ","2014-11-19 14:26:32.403"
"RABI","AGRICULTURE","Pulses","Bengal Gram (Gram/Chick Pea/Kabuli/Chana)","	Plant Protection	","FARMER WANT TO HOW KNOW TO CONTROL FUNGAL INFECTION IN PEA CROP ?","Recommended for spray  Tricoderma  viride 2.5 kg/ha mix in 50 kg FYM/acre , sprinkered with water and cover with polythein and apply after 2 days when proper moisture in field","MADHYA PRADESH","RATLAM","PIPLODA                                           ","2014-11-19 14:31:02.940"
"RABI","HORTICULTURE","Condiments and Spices","Garlic","	Plant Protection	","farmer want to know information about How to control of fungal attack in garlic crop ?","spray mencojeb + carbandazim 45 gram and steptrocyclin 2 gram at 15 liter of water","MADHYA PRADESH","RATLAM","RATLAM                                            ","2014-11-19 14:33:41.243"
"RABI","AGRICULTURE","Others","Others","Market Information","Farmer wants to start mandi rate facility on mobile phone?","Mandi rate facility has been successfully activated on your mobile phone.","MADHYA PRADESH","RATLAM","SAILANA                                           ","2014-11-19 14:46:37.940"
"RABI","AGRICULTURE","Others","Others","	Plant Protection	","farmer want to know information about how to control sucking pest in garlic?","recommended for spray imedaclorpid @5-7 ml/pump","MADHYA PRADESH","RATLAM","SAILANA                                           ","2014-11-19 14:58:10.700"
"RABI","AGRICULTURE","Others","Others","Market Information","Farmer wants to start mandi rate facility on mobile phone?","Mandi rate facility has been successfully activated on your mobile phone.","MADHYA PRADESH","RATLAM","SAILANA                                           ","2014-11-19 15:01:18.470"
"RABI","AGRICULTURE","Pulses","Bengal Gram (Gram/Chick Pea/Kabuli/Chana)","	Plant Protection	","farmer want to know information about How to control of fungal attack in gram  crop?","sprey Velidamichin 20ml/pump","MADHYA PRADESH","RATLAM","RATLAM                                            ","2014-11-19 15:06:41.733"
"RABI","AGRICULTURE","Others","Others","Government Schemes","Farmer wants to start mandi rate facility on mobile phone?","Your mandi rate facility registration has been successfully registered at kishan call center.","MADHYA PRADESH","RATLAM","PIPLODA                                           ","2014-11-19 15:21:22.407"
"RABI","AGRICULTURE","Pulses","Bengal Gram (Gram/Chick Pea/Kabuli/Chana)","	Plant Protection	","How to control of fungal attack in  gram ?","Recommended for Mancozeb 63% + Carbendazim 12% WP 40 gram and steptrocyclin 2 gram at 15 liter of water.","MADHYA PRADESH","RATLAM","RATLAM                                            ","2014-11-19 15:23:59.073"
"RABI","AGRICULTURE","Others","Others","Market Information","Farmer want to know information about  number resister in mandi rate ?","your number has been UPDATE registered for mandi rate and agriculture crop S.M.S. FACILITIES","MADHYA PRADESH","RATLAM","ALOT                                              ","2014-11-19 16:07:10.980"
"RABI","AGRICULTURE","Oilseeds","Linseed (alsi)","	Plant Protection	","How to control Alterneriya in linseed crop?","captan + hexaconajol 500-600 gram at 500 liter water","MADHYA PRADESH","RATLAM","PIPLODA                                           ","2014-11-19 16:33:28.420"
"RABI","AGRICULTURE","Others","Others","Market Information","Farmer want to know information about  number resister in mandi rate ?","your number has been registered for mandi rate and agriculture crop S.M.S. FACILITIES","MADHYA PRADESH","RATLAM","JAORA                                             ","2014-11-19 16:40:38.280"
"RABI","AGRICULTURE","Others","Others","Market Information","Farmer want to know  SMS advisory IN mobile ?","Advisory on your mobile been registered successfully!","MADHYA PRADESH","RATLAM","ALOT                                              ","2014-11-19 16:43:09.120"
"RABI","HORTICULTURE","Vegetables","Onion","	Plant Protection	","Farmer want to information about how to control of fungal attack in crop?","Mancozeb 63% + Carbendazim 12% WP 40 gram and steptrocyclin 2 gram at 15 liter of water.","MADHYA PRADESH","RATLAM","PIPLODA                                           ","2014-11-19 16:45:02.370"
"RABI","AGRICULTURE","Cereals","Wheat","Weather","How to control weeds in wheat crop?","Sulfosulfuron 75% WG @ 13.5 gm/acre","MADHYA PRADESH","RATLAM","JAORA                                             ","2014-11-19 16:53:11.710"
"RABI","AGRICULTURE","Pulses","Bengal Gram (Gram/Chick Pea/Kabuli/Chana)","	Plant Protection	","FARMER WANT TO HOW KNOW TO CONTROL FUNGAL INFECTION IN PEA CROP ?","Recommended for spray  Mencozeb + Carbindazim (Saaf or  sixer)@ 30 g /pump .","MADHYA PRADESH","RATLAM","PIPLODA                                           ","2014-11-19 17:43:49.363"
"RABI","AGRICULTURE","Pulses","Bengal Gram (Gram/Chick Pea/Kabuli/Chana)","Nutrient Management","Which fertilizer and nutrient give for better growth in PEA crop?","Recommended for spray foliar application of IFFCO 19:19:19 water soluble fertilizer @ 100 gm/pump.","MADHYA PRADESH","RATLAM","PIPLODA                                           ","2014-11-19 17:46:42.203"
"RABI","HORTICULTURE","Vegetables","Pea (Vegetable)","	Plant Protection	","how  to control powdery mildew in pea crop?","For controlling powdery mildew, spray Wettable sulphur 2 g/lit or dust Sulphur at 25 kg/ha or Dinocap 1 ml/lit or Tridemorph 0.5 ml/lit, three rounds at 15 days interval.","MADHYA PRADESH","RATLAM","JAORA                                             ","2014-11-19 17:56:52.310"
"RABI","HORTICULTURE","Condiments and Spices","Garlic","	Plant Protection	","How to control thrips in garlic crop?","recommended for to control sucking pest in  crop spray imedachlorprid 5-7 ml at 15 liter of water.","MADHYA PRADESH","RATLAM","JAORA                                             ","2014-11-19 18:00:28.057"
"RABI","HORTICULTURE","Condiments and Spices","Garlic","	Plant Protection	","Root rot in Garlic ?","Recommended for spray coper oxcy chloride @ 45 gram + streptrocycline @ 2 gram/pump.","MADHYA PRADESH","RATLAM","RATLAM                                            ","2014-11-20 07:26:44.137"
"RABI","AGRICULTURE","Others","Others","Market Information","Farmer want registration for mandi rate sms service?","your registration is done  for mandi rate sms service","MADHYA PRADESH","RATLAM","PIPLODA                                           ","2014-11-20 07:39:42.280"
"RABI","HORTICULTURE","Vegetables","Onion","	Plant Protection	","farmer want to know information about Bulb development for onion crop  ?","jibralik acid 1 gram / 60 litre water with spray","MADHYA PRADESH","RATLAM","ALOT                                              ","2014-11-20 08:10:57.433"
"RABI","AGRICULTURE","Others","Others","Market Information","I want number resister in mandi rate ?","your number has been UPDATE registered for mandi rate","MADHYA PRADESH","RATLAM","JAORA                                             ","2014-11-20 08:38:44.653"
"RABI","HORTICULTURE","Vegetables","Pea (Vegetable)","	Plant Protection	","Wilt disease in Pea ?","spray validamicin @ 20 gm/pump","MADHYA PRADESH","RATLAM","RATLAM                                            ","2014-11-20 09:07:35.333"
"RABI","HORTICULTURE","Condiments and Spices","Garlic","	Plant Protection	","weed management in garlic?","oxyflorofen (Gol)@100 ml /acre+ Quizalofop ethyl ( Terga super) @ 300 ml /acre","MADHYA PRADESH","RATLAM","JAORA                                             ","2014-11-20 10:05:42.330"
"RABI","AGRICULTURE","Pulses","Bengal Gram (Gram/Chick Pea/Kabuli/Chana)","	Plant Protection	","How to control of fungal attack in kabuli gram  crop?","Recommended for spray copper oxy chloride 40 gram and steptrocyclin 2 gram at 15 liter of water.","MADHYA PRADESH","RATLAM","RATLAM                                            ","2014-11-20 11:17:57.180"
"RABI","AGRICULTURE","Cereals","Wheat","	Plant Protection	","how to control the weeds of wheat?","2,4-D sodium salt and Isoproteuran @ 500gm/hac in 600-700lit of water.","MADHYA PRADESH","RATLAM","PIPLODA                                           ","2014-11-20 12:41:48.247"
"RABI","AGRICULTURE","Others","Others","Government Schemes","Q:-Farmer Want To Start The Sms Advisory Facility For Mandi Rate And Different Crops ?","The Sms Advaisory Fasility For Mandi Rate And Different Crops Will Be Start As Soon As Possible.","MADHYA PRADESH","RATLAM","JAORA                                             ","2014-11-20 12:41:57.023"
"RABI","HORTICULTURE","Fruits","Citrus","	Plant Protection	","sucking pest control in citrus","Spraying of  Methyl parathion  or  Dimethoate 30 % EC  @ 2 ml /liter of water","MADHYA PRADESH","RATLAM","ALOT                                              ","2014-11-20 13:17:18.873"
"RABI","AGRICULTURE","Others","Others","Market Information","farmer want to information about add my no. in mandi rate.","registration is completed in your mobile number|","MADHYA PRADESH","RATLAM","PIPLODA                                           ","2014-11-20 13:38:25.000"
"RABI","AGRICULTURE","Others","Others","Market Information","farmer want to information about add my no. in mandi rate.","registration is completed in your mobile number|","MADHYA PRADESH","RATLAM","PIPLODA                                           ","2014-11-20 13:38:25.490"
"RABI","AGRICULTURE","Others","Others","	Plant Protection	","How to control cutwarm in gram crop?","Spray of Monocrotophos 36 s. L. 800 ml. / hac.
or Spray of Troijofos 40 EC 1000 Ml. / hac.
or Spray of Queenolfos 25 EC 1000 Ml. / hac. 
or Spray of Profenofos 40% + Cypermethrin 4% EC 1000 Ml. / hac.","MADHYA PRADESH","RATLAM","PIPLODA                                           ","2014-11-20 14:14:09.853"
"RABI","AGRICULTURE","Others","Others","Market Information","Farmer wants to start mandi rate facility on mobile phone?","Mandi rate facility has been successfully activated on your mobile phone.","MADHYA PRADESH","RATLAM","PIPLODA                                           ","2014-11-20 14:19:37.830"
"RABI","AGRICULTURE","Others","Others","Weather","Farmer want to know information about               weather forecast ?","1 – 3 Day Weather Forecast Summary: Mostly dry. Warm (max 29°C on Fri afternoon, min 21°C on Sat night). Wind will be generally light.","MADHYA PRADESH","RATLAM","RATLAM                                            ","2014-11-20 15:31:46.140"
"RABI","HORTICULTURE","Condiments and Spices","Methi (Fenugreek)","	Plant Protection	","Farmer want to know information about fungal attack in methi ?","Drenching of carbendazim + mancozev 40 gm/ and streptrocycline 2 gram at 15 liter of water .","MADHYA PRADESH","RATLAM","RATLAM                                            ","2014-11-20 15:58:22.260"
"RABI","HORTICULTURE","Vegetables","Chillies","	Plant Protection	","Leaf mosaic & Thrips in","Recommended for Spray of Methyl Dematon @ 25-30 ML./pump.","MADHYA PRADESH","RATLAM","RATLAM                                            ","2014-11-20 16:07:25.910"
"RABI","HORTICULTURE","Condiments and Spices","Garlic","	Plant Protection	","How to control of fungal attack in garlic crop?","Use copper oxy chloride 40 gram and steptrocyclin 2 gram at 15 liter of water.","MADHYA PRADESH","RATLAM","JAORA                                             ","2014-11-20 16:25:15.720"
"RABI","AGRICULTURE","Others","Others","Weather","Farmer want to know information about  weather forecast ?","----------------------------------------------------------------------------------------------------
                              DAY-1               DAY-2               DAY-3               DAY-4               DAY-5
                              21/11               22/11               23/11               24/11               25/11
------------------- ------------------- ------------------- ------------------- ------------------- -------------------
Rainfall (mm)                   0                   0                   0                   0                   0","MADHYA PRADESH","RATLAM","JAORA                                             ","2014-11-20 16:37:52.160"
"RABI","HORTICULTURE","Condiments and Spices","Garlic","	Plant Protection	","farmer want to know information about Which fertilizer and nutrient give for better growth in garlic  crop?","Spray N: P: K 19:19:19 100 grams /15 liter of water.","MADHYA PRADESH","RATLAM","PIPLODA                                           ","2014-11-20 16:42:29.680"
"RABI","HORTICULTURE","Condiments and Spices","Garlic","	Plant Protection	","How to control of fungal attack in garlic crop?","Use copper oxy chloride 45 gram and steptrocyclin 2 gram at 15 liter of water.","MADHYA PRADESH","RATLAM","JAORA                                             ","2014-11-20 17:09:56.070"
