"Season","Sector","Category","Crop","QueryType","QueryText","KCCAns","StateName","DistrictName","BlockName","CreatedOn"
"RABI","HORTICULTURE","Vegetables","Chillies","	Plant Protection	","farmer want to know information about how to control sucking pest in onion?","recommended for spray imedaclorpid @5-7 ml/pump","MADHYA PRADESH","RATLAM","PIPLODA                                           ","2014-11-24 07:58:58.773"
"RABI","HORTICULTURE","Condiments and Spices","Garlic","	Plant Protection	","How to increase size and production in garlic  crop?","Recommended for N:P:K 0:52:34 1 kg at per acer","MADHYA PRADESH","RATLAM","PIPLODA                                           ","2014-11-24 08:27:49.097"
"RABI","AGRICULTURE","Others","Others","Market Information","Farmer want to know information about to activate sms advisory scheme ?","To activate sms advisory scheme on your mobile number","MADHYA PRADESH","RATLAM","ALOT                                              ","2014-11-24 08:42:16.960"
"RABI","AGRICULTURE","Others","Others","Market Information","Farmer want to know information about to activate sms advisory scheme ?","To activate sms advisory scheme on your mobile number","MADHYA PRADESH","RATLAM","ALOT                                              ","2014-11-24 08:42:17.760"
"RABI","AGRICULTURE","Pulses","Bengal Gram (Gram/Chick Pea/Kabuli/Chana)","	Plant Protection	","how to control fungal attack in gram ?","RECOMMENDED FOR SPRAY TO MENCOZEB + CARBENDAZIM 35-40 GRAM/PUMP","MADHYA PRADESH","RATLAM","ALOT                                              ","2014-11-24 09:56:31.390"
"RABI","AGRICULTURE","Pulses","Bengal Gram (Gram/Chick Pea/Kabuli/Chana)","	Plant Protection	","How to control caterpillars in gram crop?","Recommended for Spray of Profenofos 40% + Cypermethrin 4% EC 1000 Ml. / hac.","MADHYA PRADESH","RATLAM","PIPLODA                                           ","2014-11-24 10:30:07.620"
"RABI","AGRICULTURE","Others","Others","Weather","Farmer want to know information about  weather forecast  ?","24/11               25/11               26/11               27/11               28/11
------------------- ------------------- ------------------- ------------------- ------------------- -------------------
Rainfall (mm)                   0                   0                   0                   0                   0","MADHYA PRADESH","RATLAM","PIPLODA                                           ","2014-11-24 11:05:52.580"
"RABI","AGRICULTURE","Others","Others","Weather","Farmer want to know information about  weather forecast  ?","24/11               25/11               26/11               27/11               28/11
------------------- ------------------- ------------------- ------------------- ------------------- -------------------
Rainfall (mm)                   0                   0                   0                   0                   0","MADHYA PRADESH","RATLAM","PIPLODA                                           ","2014-11-24 11:05:54.283"
"RABI","AGRICULTURE","Others","Others","Weather","Farmer want to know information about  weather forecast  ?","24/11               25/11               26/11               27/11               28/11
------------------- ------------------- ------------------- ------------------- ------------------- -------------------
Rainfall (mm)                   0                   0                   0                   0                   0","MADHYA PRADESH","RATLAM","PIPLODA                                           ","2014-11-24 11:06:01.407"
"RABI","HORTICULTURE","Condiments and Spices","Garlic","Fertilizer Use and Availability","what is fertilizer dose of garlic crop ?","Urea86 ,Super Phosphate 470, Potash 125 kilogram per hectare FOR garlic CROP .","MADHYA PRADESH","RATLAM","JAORA                                             ","2014-11-24 11:44:22.720"
"RABI","HORTICULTURE","Condiments and Spices","Garlic","	Plant Protection	","HOW TO CONTORL THRIPS OF GARLIC CROP ?","Recommended for spray Thiamethaxam 70 % WS @ 5 gram per pump .","MADHYA PRADESH","RATLAM","JAORA                                             ","2014-11-24 11:47:09.700"
"RABI","AGRICULTURE","Oilseeds","Soybean (bhat)","	Plant Protection	","farmer wants to information of variety of soybean?","variety of soybean- J.S.-9560, J.S.93-05, J.S.-335.","MADHYA PRADESH","RATLAM","JAORA                                             ","2014-11-24 12:07:08.153"
"RABI","AGRICULTURE","Others","Others","Market Information","Farmer want to know information about to activate sms advisory scheme ?","To activate sms advisory scheme on your mobile number","MADHYA PRADESH","RATLAM","RATLAM                                            ","2014-11-24 13:04:00.517"
"RABI","HORTICULTURE","Condiments and Spices","Garlic","Fertilizer Use and Availability","what is the fertilizer dose of garlic?","During last ploughing incorporate 50 t/ha of FYM; Apply Azospirillum 2 kg and Phosphobacteria 2 kg/ha, 40:75:75 kg/ha NPK(16okg DAP, 125kgMOP), 50 MgSO4 and 1 ton neem cake as basal and N 35 kg/ha at 45 days after planting.","MADHYA PRADESH","RATLAM","JAORA                                             ","2014-11-24 13:24:09.333"
"RABI","HORTICULTURE","Condiments and Spices","Garlic","	Plant Protection	","Farmer want to information about how to control of fungal attack in garlic crop?","spray Metalaxyl 8% + Mancozeb 64% WP 40 gram and steptrocyclin 2 gram at 15 liter of water.","MADHYA PRADESH","RATLAM","ALOT                                              ","2014-11-24 13:39:17.293"
"RABI","HORTICULTURE","Condiments and Spices","Garlic","	Plant Protection	","How we control the root rot in Garlic ?","Recommended for spray coper oxcy chloride @ 45 gram + streptrocycline @ 2 gram/pump.","MADHYA PRADESH","RATLAM","JAORA                                             ","2014-11-24 13:53:35.070"
"RABI","HORTICULTURE","Condiments and Spices","Garlic","	Plant Protection	","Spray N: P: K 19:19:19 100 grams and humic acid 30 ml at 15 liter of water.","Spray N: P: K 19:19:19 100 grams and humic acid 30 ml at 15 liter of water.","MADHYA PRADESH","RATLAM","ALOT                                              ","2014-11-24 13:59:39.947"
"RABI","HORTICULTURE","Condiments and Spices","Garlic","	Plant Protection	","How to control of fungal attack in garlic crop?","Recommended for spray   Mancozeb 63% + Carbendazim 12% WP 40 gram and steptrocyclin 2 gram at 15 liter of water.","MADHYA PRADESH","RATLAM","JAORA                                             ","2014-11-24 14:26:27.150"
"RABI","HORTICULTURE","Condiments and Spices","Coriander","	Plant Protection	","Farmer want to know information about How to control of fungal attack in paddy crop?","Recommended for to control of fungal attack use copper oxy chloride 40 gram and streptocyclin 2 gram at 15 liter of water","MADHYA PRADESH","RATLAM","ALOT                                              ","2014-11-24 14:35:31.833"
"RABI","HORTICULTURE","Condiments and Spices","Garlic","	Plant Protection	","Q.- How to control Termite Attack  in garlic crop ?","Ans.- Apply Methyle Parathion 8 to10kg. Chlorpyriphos 4% Dust 15  per Hactare.","MADHYA PRADESH","RATLAM","JAORA                                             ","2014-11-24 14:55:49.910"
"RABI","AGRICULTURE","Others","Others","Market Information","Farmer wants to start mandi rate facility on mobile phone?","Mandi rate facility has been successfully activated on your mobile phone.","MADHYA PRADESH","RATLAM","RATLAM                                            ","2014-11-24 15:40:20.520"
"RABI","AGRICULTURE","Pulses","Bengal Gram (Gram/Chick Pea/Kabuli/Chana)","	Plant Protection	","farmer want to know information about How to control of fungal attack in  pea crop ?","Ans- validamycine 30 mili litre /16 litre of water spray","MADHYA PRADESH","RATLAM","RATLAM                                            ","2014-11-24 16:05:01.567"
"RABI","HORTICULTURE","Condiments and Spices","Garlic","	Plant Protection	","how to control soil pest in garlic ?","Apply cartap hydro chloride 7 to 10 kg at per Acer.","MADHYA PRADESH","RATLAM","RATLAM                                            ","2014-11-24 16:50:08.067"
"RABI","ANIMAL HUSBANDRY","Animal","Goat","Animal Production (Piggery, Goatery, Sheep Farming etc.)","What nutrition gives to our cattle?","Please contact 18001801199 numbers.","MADHYA PRADESH","RATLAM","ALOT                                              ","2014-11-24 17:17:29.840"
"RABI","AGRICULTURE","Others","Others","Weather","Farmer want to know information about   weather forecast ?","THERE IS NO RAINFALL IN YOUR   DISTT, NEXT 5 DAYS","MADHYA PRADESH","RATLAM","JAORA                                             ","2014-11-24 17:25:35.553"
"RABI","AGRICULTURE","Others","Others","Market Information","Farmer want to know about inofrmation mandi regestration ?","farmer want to mandi rate registration completed .","MADHYA PRADESH","RATLAM","PIPLODA                                           ","2014-11-24 17:52:16.360"
"RABI","AGRICULTURE","Others","Others","Market Information","Farmer want to know information about How to control of fungal attack in paddy crop?","Recommended for to control of fungal attack spray carbandazim + mancozeb 40gm.and streptocyclin 2 gram at 15 liter of water","MADHYA PRADESH","RATLAM","PIPLODA                                           ","2014-11-24 17:57:14.047"
"RABI","AGRICULTURE","Others","Others","Weather","farmer want to weather information of district?","No rainfall chance in your district at next 5 days. weather will clear .","MADHYA PRADESH","RATLAM","RATLAM                                            ","2014-11-24 18:01:58.827"
"RABI","AGRICULTURE","Others","Others","Market Information","Farmer wants to start mandi rate facility on mobile phone?","Your mandi rate facility registration has been successfully registered at kishan call center.","MADHYA PRADESH","RATLAM","SAILANA                                           ","2014-11-24 18:02:32.780"
"RABI","AGRICULTURE","Cereals","Wheat","Varieties","farmer want to know information about varieties of irrigated wheat?","recommended for   varieties of irrigated wheat M.P. 1142, H.I. 1077, G.W. 273, G.W. 322, G. W. 190
Raj 1555, H.D. 4530, H.I. 8498, H.I 8381, J.W. 1106, Sudha .","MADHYA PRADESH","RATLAM","RATLAM                                            ","2014-11-24 18:12:49.370"
"RABI","AGRICULTURE","Cereals","Wheat","	Plant Protection	","How to control of fungal attack in wheat crop?","Recommended for Mancozeb 63% + Carbendazim 12% WP 40 gram and steptrocyclin 2 gram at 15 liter of water.","MADHYA PRADESH","RATLAM","RATLAM                                            ","2014-11-24 18:21:43.743"
"RABI","AGRICULTURE","Others","Others","	Plant Protection	","farmer want to know information about how to control sucking pest in garlic?","recommended for spray imedaclorpid @5-7 ml/pump","MADHYA PRADESH","RATLAM","SAILANA                                           ","2014-11-24 18:41:50.127"
"RABI","AGRICULTURE","Others","Others","Government Schemes","Agriculture government schemes information?","Please contact your RAEO","MADHYA PRADESH","RATLAM","RATLAM                                            ","2014-11-24 20:21:44.957"
"RABI","AGRICULTURE","Others","Others","Weather","farmer want to weather information of district?","No rainfall chance in your district and weather will some cloudy at next 5 days weather will some cloudy.","MADHYA PRADESH","RATLAM","ALOT                                              ","2014-11-24 21:56:14.030"
"RABI","HORTICULTURE","Condiments and Spices","Garlic","	Plant Protection	","How we control Thrips in Garlic ?","Thrips can be controlled by spraying Methyl dematon 25 EC @15-20ml/pump...","MADHYA PRADESH","RATLAM","JAORA                                             ","2014-11-25 06:18:30.743"
"RABI","AGRICULTURE","Others","Others","	Water Management	","farmer want to know information about WATER MANAGEMENT in wheat?","recommended for The crop requires 4 - 6 irrigations depending on the soil type and rainfall. Wheat crop requires minimum of 5 irrigations at the following critical stages.
I – Immediately after sowing
II – Crown root intiation : 15-20 DAS 
III- Active tillering stage : 35-40 DAS
IV- Flowering stage : 50-55 DAS
V- Grain filling stage : 70-75 DAS
Crown root initiation and flowering are the most critical stages. Water stagnation should be voided at the time of germination.","MADHYA PRADESH","RATLAM","RATLAM                                            ","2014-11-25 06:29:03.553"
"RABI","AGRICULTURE","Others","Others","Government Schemes","Q:-Farmer Want To Start The Sms Advisory Facility For Mandi Rate And Different Crops ?","The Sms Advaisory Fasility For Mandi Rate And Different Crops Will Be Start As Soon As Possible.","MADHYA PRADESH","RATLAM","PIPLODA                                           ","2014-11-25 08:06:27.323"
"RABI","HORTICULTURE","Condiments and Spices","Garlic","	Plant Protection	","Farmer want to information about how to control of fungal attack in garlic crop?","spray Metalaxyl 8% + Mancozeb 64% WP 40 gram and steptrocyclin 2 gram at 15 liter of water.","MADHYA PRADESH","RATLAM","ALOT                                              ","2014-11-25 08:33:57.560"
"RABI","AGRICULTURE","Others","Others","Market Information","How to control of fungal attack in garlic crop?","Use copper oxy chloride 45 gram and steptrocyclin 2 gram at 15 liter of water.","MADHYA PRADESH","RATLAM","RATLAM                                            ","2014-11-25 08:38:02.540"
"RABI","HORTICULTURE","Condiments and Spices","Garlic","	Plant Protection	","How to control of fungal attack in garlic crop?","Mancozeb 63% + Carbendazim 12% WP 40 gram and steptrocyclin 2 gram at 15 liter of water.","MADHYA PRADESH","RATLAM","","2014-11-25 09:08:33.793"
"RABI","AGRICULTURE","Others","Others","Market Information","Farmer wants to start mandi rate facility on mobile phone?","Mandi rate facility has been successfully activated on your mobile phone.","MADHYA PRADESH","RATLAM","","2014-11-25 09:12:40.263"
"RABI","AGRICULTURE","Others","Others","Market Information","farmer want to know information about  mandi registration ?","registration completed","MADHYA PRADESH","RATLAM","ALOT                                              ","2014-11-25 09:24:57.893"
"RABI","HORTICULTURE","Condiments and Spices","Garlic","	Plant Protection	","Which fertilizer and nutrient give for better growth in GARLIC  crop?","Spray N: P: K 19:19:19 100 grams and humic acid 30 ml at 15 liter of water.","MADHYA PRADESH","RATLAM","JAORA                                             ","2014-11-25 09:34:40.423"
"RABI","HORTICULTURE","Condiments and Spices","Garlic","	Plant Protection	","How to control of fungal attack in GARLIC  crop?","Mancozeb 63% + Carbendazim 12% WP 40 gram and steptrocyclin 2 gram at 15 liter of water.","MADHYA PRADESH","RATLAM","JAORA                                             ","2014-11-25 09:38:41.363"
"RABI","AGRICULTURE","Others","Others","Varieties","Farmer wants to information of Varieties of Wheat crop?","Irrigated within time - Lok-1, MP 1142, HI 1077 (Mangala), DL803-3 (kanchan), GW, GW 273, GW 322,  GW 366, HI 8381 (Malavshree), HI 8498 (Malav shakti).","MADHYA PRADESH","RATLAM","JAORA                                             ","2014-11-25 10:25:39.553"
"RABI","AGRICULTURE","Others","Others","Fertilizer Use and Availability","Fertilizer dose in wheat crop?","Urea 175 kg, DAP 109 kg and MOP 50 kg per hac.","MADHYA PRADESH","RATLAM","JAORA                                             ","2014-11-25 10:31:15.650"
"RABI","HORTICULTURE","Vegetables","Peas (field peas/ garden peas/matar)","	Plant Protection	","how to control caterpillar in pea crop ?","Recommended for spray Profenophos 40% + Cypermethrin 4% EC(Rocket or  Poltrin –or , Veercombi-4 )@ 40 ml /pump","MADHYA PRADESH","RATLAM","RATLAM                                            ","2014-11-25 11:42:10.943"
"RABI","AGRICULTURE","Others","Others","Weather","Weather forecasting for ratlam district of Madhya Pradesh?","No rainfall within 5 days in your district.","MADHYA PRADESH","RATLAM","PIPLODA                                           ","2014-11-25 12:07:15.887"
"RABI","AGRICULTURE","Cereals","Wheat","Nutrient Management","Which fertilizer and nutrient give for better growth in WHEAT crop?","Recommended for spray foliar application of IFFCO 19:19:19 water soluble fertilizer @ 100 gm/pump.","MADHYA PRADESH","RATLAM","PIPLODA                                           ","2014-11-25 12:09:09.687"
"RABI","HORTICULTURE","Condiments and Spices","Garlic","	Plant Protection	","Q. HOW CAN WE CONTROL ROOT PEST IN GARLIC ?","you can apply carbofuran 8 kg/acre to control root pest in GARLIC","MADHYA PRADESH","RATLAM","ALOT                                              ","2014-11-25 12:20:45.627"
"RABI","AGRICULTURE","Pulses","Bengal Gram (Gram/Chick Pea/Kabuli/Chana)","Nutrient Management","Which fertilizer and nutrient give for better growth in PEA crop?","Recommended for spray foliar application of IFFCO 19:19:19 water soluble fertilizer @ 100 gm/pump.","MADHYA PRADESH","RATLAM","RATLAM                                            ","2014-11-25 12:43:26.797"
"RABI","HORTICULTURE","Condiments and Spices","Garlic","	Plant Protection	","Farmer want to information about how to control of fungal attack in garlic crop?","Use copper oxy chloride 45 gram and steptrocyclin 2 gram at 15 liter of water.","MADHYA PRADESH","RATLAM","JAORA                                             ","2014-11-25 13:17:23.730"
"RABI","AGRICULTURE","Cereals","Wheat","	Plant Protection	","How Can We Control Fungus In WHEAT ?","You Can Spray Tebuconazole @ 200ml/Acre, Mencozeb + Carbindazim (Saaf Or  Sixer)@ 40 G /Pump To Control Fungus In WHEAT .
And Steptrocyclin 2  Gram Per Pump.","MADHYA PRADESH","RATLAM","PIPLODA                                           ","2014-11-25 13:33:36.550"
"RABI","HORTICULTURE","Fruits","Citrus","Fertilizer Use and Availability","fertilizer dose of citrus ?","FYM 20 Kg/plant/year, Urea 2kg /plant/year, SSP 3kg/plant/year, MOP 300gram /plant/year.","MADHYA PRADESH","RATLAM","JAORA                                             ","2014-11-25 13:36:51.843"
"RABI","AGRICULTURE","Cereals","Wheat","	Plant Protection	","How to control of fungal attack in soyabean crop?","Recommended for Use copper oxy chloride 45 gram and steptrocyclin 2 gram at 15 liter of water.
Recommended for Mancozeb 63% + Carbendazim 12% WP 40 gram and steptrocyclin 2 gram at 15 liter of water.
Recommended for Spray tebuconazol 25% EC 200 ml at 200 liter of water.
Recommended for thofinet mithail 30 gram per pump.","MADHYA PRADESH","RATLAM","ALOT                                              ","2014-11-25 13:51:56.177"
"RABI","AGRICULTURE","Cereals","Wheat","	Plant Protection	","How to control of fungal attack in wheat crop?","Recommended for Use copper oxy chloride 45 gram and steptrocyclin 2 gram at 15 liter of water.
Recommended for Mancozeb 63% + Carbendazim 12% WP 40 gram and steptrocyclin 2 gram at 15 liter of water.
Recommended for Spray tebuconazol 25% EC 200 ml at 200 liter of water.
Recommended for thofinet mithail 30 gram per pump.","MADHYA PRADESH","RATLAM","ALOT                                              ","2014-11-25 13:53:29.727"
"RABI","HORTICULTURE","Condiments and Spices","Garlic","	Plant Protection	","farmer want to know information about How to control soil pest in garlic ?","Apply cartap hydro chloride 7 to 10 kg at per Acer.","MADHYA PRADESH","RATLAM","JAORA                                             ","2014-11-25 14:42:50.370"
"RABI","HORTICULTURE","Fruits","Orange","	Plant Protection	","farmer want to know information about How to control  Black aphid  in crop?","Spray Dimethoate (Rogar) 30 ml per pump.","MADHYA PRADESH","RATLAM","RATLAM                                            ","2014-11-25 15:03:29.397"
"RABI","AGRICULTURE","Pulses","Bengal Gram (Gram/Chick Pea/Kabuli/Chana)","	Plant Protection	","HOW TO CONTROL CATTERPILLAR IN GRAM CROP?","SPRAY INDOXACARB ( AAWANT) @ 15 ML/PUMP.","MADHYA PRADESH","RATLAM","RATLAM                                            ","2014-11-25 15:17:46.657"
"RABI","AGRICULTURE","Pulses","Bengal Gram (Gram/Chick Pea/Kabuli/Chana)","	Plant Protection	","farmer want to know information about How to control of fungal attack in gram crop?","recommended for to control of fungal attack in gram crop use belademycin 25ml at 15 liter of water","MADHYA PRADESH","RATLAM","ALOT                                              ","2014-11-25 15:51:34.297"
"RABI","AGRICULTURE","Others","Others","Market Information","farmer want to know information about registration of market information?","recommended for registration of market information you have been registered for market information from kisaan call center.","MADHYA PRADESH","RATLAM","RATLAM                                            ","2014-11-25 16:38:56.503"
"RABI","AGRICULTURE","Cereals","Wheat","Nutrient Management","farmer want to know information about What are fertilizer doses in WHEAT crop?","Urea = 210. KG., DAP = 130. Kg., Muriate of potash = 65. Kg. and zinc sulphate 25 kg   Use per hectare.","MADHYA PRADESH","RATLAM","JAORA                                             ","2014-11-25 17:17:50.210"
"RABI","AGRICULTURE","Others","Others","Market Information","farmer want to know information about number activate in sms facility ?","your number is resistard in sms facility","MADHYA PRADESH","RATLAM","SAILANA                                           ","2014-11-25 18:01:45.410"
"RABI","AGRICULTURE","Cereals","Paddy (Dhan)","Fertilizer Use and Availability","Fertilizer dose in wheat crop?","Recommended for Urea 175 kg, DAP 109 kg and MOP 50 kg per hac.","MADHYA PRADESH","RATLAM","RATLAM                                            ","2014-11-25 18:53:29.770"
"RABI","AGRICULTURE","Cereals","Wheat","Fertilizer Use and Availability","Fertilizer dose in wheat crop?","Recommended for Urea 175 kg, DAP 109 kg and MOP 50 kg per hac.","MADHYA PRADESH","RATLAM","RATLAM                                            ","2014-11-25 18:56:10.227"
"RABI","AGRICULTURE","Cereals","Wheat","Fertilizer Use and Availability","Fertilizer dose in wheat crop?","Recommended for Urea 175 kg, DAP 109 kg and MOP 50 kg per hac.","MADHYA PRADESH","RATLAM","RATLAM                                            ","2014-11-25 18:58:03.237"
"RABI","AGRICULTURE","Others","Others","Weather","Farmer want  to know information about mandi Ragistion?....","in your monbile mandi rate has been started ,,","MADHYA PRADESH","RATLAM","PIPLODA                                           ","2014-11-25 20:11:54.483"
"RABI","AGRICULTURE","Pulses","Bengal Gram (Gram/Chick Pea/Kabuli/Chana)","	Plant Protection	","Farmer want  to know information about   fungal attack in gram ?","carbandazim + mancozeb 30gm. 15 liter of water","MADHYA PRADESH","RATLAM","PIPLODA                                           ","2014-11-25 20:16:43.037"
"RABI","AGRICULTURE","Pulses","Bengal Gram (Gram/Chick Pea/Kabuli/Chana)","	Plant Protection	","farmer want to know information about fungus attack in gram  ?","carbandazim + mancozeb 30gm. 15 liter of water.","MADHYA PRADESH","RATLAM","PIPLODA                                           ","2014-11-25 20:18:03.617"
"RABI","HORTICULTURE","Condiments and Spices","Garlic","	Plant Protection	","Farmer want to know information about How to control of fungal attack in gram crop?","Recommended for to control of fungal attack use copper oxy chloride 40 gram and streptocyclin 2 gram at 15 liter of water","MADHYA PRADESH","RATLAM","RATLAM                                            ","2014-11-25 21:51:23.587"
"RABI","HORTICULTURE","Condiments and Spices","Garlic","	Plant Protection	","How to control Termite in garlic crop?","Recommended for Upon the outbreak of the standing crop termites cloropayriphos 20 EC 500 ml with irrigation water per acre to the drug. Ardhsincit land above the amount of drug dissolved in 3 liters of water mixed with 50 kg of sand spread on the farm Lgaven water.","MADHYA PRADESH","RATLAM","JAORA                                             ","2014-11-26 07:40:00.423"
"RABI","AGRICULTURE","Pulses","Bengal Gram (Gram/Chick Pea/Kabuli/Chana)","	Plant Protection	","how to control fungal disease ?","Mancozeb 63% + Carbendazim 12% WP 40 gram and steptrocyclin 2 gram at 15 liter of water.","MADHYA PRADESH","RATLAM","RATLAM                                            ","2014-11-26 07:56:11.290"
"RABI","AGRICULTURE","Cereals","Wheat","	Plant Protection	","How to control white fly in wheat crop?","Recommended for Spray Dimethoate 30%EC (Rogar) 40 ml per pump.","MADHYA PRADESH","RATLAM","JAORA                                             ","2014-11-26 08:02:10.170"
"RABI","AGRICULTURE","Pulses","Bengal Gram (Gram/Chick Pea/Kabuli/Chana)","	Plant Protection	","How To Control Wilt In Chick Pea Crop ?","You Can Spray Tebuconazole @ 200ml/Acre, Mencozeb + Carbindazim (Saaf Or  Sixer)@ 40 G /Pump To Control Fungus In Chick Pea Crop. And Steptrocyclin 2  Gram Per Pump.
Or  Copper Oxychloride (0.30%) And Bordeaux Mixture (1.0%), Is Recommended For Control Of Wilt Disease.","MADHYA PRADESH","RATLAM","RATLAM                                            ","2014-11-26 08:02:35.437"
"RABI","AGRICULTURE","Pulses","Bengal Gram (Gram/Chick Pea/Kabuli/Chana)","	Plant Protection	","Seed treatment in Bengal gram ?","Use bavistin 3 gm per kg of seed","MADHYA PRADESH","RATLAM","RATLAM                                            ","2014-11-26 08:03:12.140"
"RABI","HORTICULTURE","Vegetables","Pea (Vegetable)","	Plant Protection	","How to control of fungal attack in pea crop?","Use copper oxy chloride 45 gram and steptrocyclin 2 gram at 15 liter of water.","MADHYA PRADESH","RATLAM","RATLAM                                            ","2014-11-26 08:24:06.430"
