"Season","Sector","Category","Crop","QueryType","QueryText","KCCAns","StateName","DistrictName","BlockName","CreatedOn"
"KHARIF","AGRICULTURE","Others","Others","Weather","INFORMATION REGARDING FOR THE CURRENT WEATHER CONDITION?","SOME CHANCE OF RAINFALL TODAY.","PUNJAB","FATEHGARH SAHIB","SIRHIND                                           ","2014-10-01 06:54:05.330"
"RABI","AGRICULTURE","Others","Others","Weather","INFORMATION REGARDING FOR THE WEATHER ?","SOME CHANCE OF RAINFALL TODAY.","PUNJAB","FATEHGARH SAHIB","BASSI PATHANA                                     ","2014-10-01 07:10:28.833"
"KHARIF","HORTICULTURE","Vegetables","Onion","Seeds and Planting Material","INFORMATION REGARDING FOR THE SOWING TIME OF ONION(PYAJ)?","THE SOWING TIME OF ONION(PYAJ) IS -IN KHARIB SEASON-JUNE MONTH & IN RABI SEASON-OCT.-NOV.","PUNJAB","FATEHGARH SAHIB","AMLOH                                             ","2014-10-01 08:57:23.647"
"KHARIF","AGRICULTURE","Cereals","Paddy (Dhan)","	Plant Protection	","INFORMATION REGARDING FOR THE CONTROL OF RICE STEMBORER IN PADDY(JHONA) CROP?","FOR THE CONTROL OF RICE STEMBORER IN PADDY(JHONA) CROP,PLS APPLY 5KG CARTAP HYDROCHLORIDE(PADAN) OR 4KG CHLORANTRANILIPROLE(FERTERRA) PER ACRE.","PUNJAB","FATEHGARH SAHIB","SIRHIND                                           ","2014-10-01 09:03:14.123"
"KHARIF","AGRICULTURE","Cereals","Paddy (Dhan)","	Plant Protection	","INFORMATION RGEARDING FOR THE CONTROL OF SHEATH BLIGHT ATTACK ON PADDY(JHONA) CROP?","FOR THE CONTROL OF SHEATH BLIGHT ATTACK ON PADDY(JHONA) CROP,PLS SPRAY 500ML HEXACONAZOLE(HEXAVEER) OR 200 ML THIFLUZAMIDE(PULSOR) IN 150 LITRE WATER.","PUNJAB","FATEHGARH SAHIB","KHAMANO                                           ","2014-10-01 09:35:55.783"
"KHARIF","AGRICULTURE","Others","Others","Training and Exposure Visits","Information regarding Contact no. of PAU, Ludhiana?","Contact no. of PAU, Ludhiana:- 0161-2401960.","PUNJAB","FATEHGARH SAHIB","KHERA                                             ","2014-10-01 10:22:53.700"
"KHARIF","AGRICULTURE","Cereals","Paddy (Dhan)","	Plant Protection	","INFORMATION RGEARDING FOR THE CONTROL OF GRASSHOPPER IN PADDY CROP?","FOR THE CONTROL OF GRASSHOPPER IN PADDY(JHONA) CROP,PLS  SPRAY 350 ML LAMBDA CYHALOTHRIN (KARATE) IN 150 LITRE WATER PER ACRE.","PUNJAB","FATEHGARH SAHIB","AMLOH                                             ","2014-10-01 10:51:49.140"
"RABI","AGRICULTURE","Others","Others","Weather","INFORMATION REGARDING WEATHER FORECAST","TODAY THERE ARE NO CHANCES OF RAINFALL","PUNJAB","FATEHGARH SAHIB","KHERA                                             ","2014-10-01 12:27:07.320"
"KHARIF","AGRICULTURE","Others","Others","Government Schemes","INFORMATION REGARDING SMS ACTIVATION FROM KISAAN CALL CENTER?","SMS SERVICE IS ACTIVATED ON YOUR PHONE.","PUNJAB","FATEHGARH SAHIB","AMLOH                                             ","2014-10-01 13:05:35.737"
"KHARIF","AGRICULTURE","Cereals","Paddy (Dhan)","	Plant Protection	","Information regarding how to control Leaf Folder in Basmati-1121?","Spray 35 ml. Fame (Flubendiamide 480SC) or 60 ml. Coragen (Chlorantraniliprole 20SC) in 100 lt. of water per acre.","PUNJAB","FATEHGARH SAHIB","AMLOH                                             ","2014-10-01 13:12:45.967"
"KHARIF","AGRICULTURE","Oilseeds","Indian rapeseed and mustard (yellow sarson)","Varieties","Information regarding new veriety of gobhi sarson","GSC-7
YIELD-8.9QUINTAL/ACRE","PUNJAB","FATEHGARH SAHIB","BASSI PATHANA                                     ","2014-10-01 14:08:25.007"
"KHARIF","AGRICULTURE","Others","Others","Weather","INFORMATION REGARDING WEATHER","CHANCE OF RAINFALL","PUNJAB","FATEHGARH SAHIB","KHERA                                             ","2014-10-01 15:16:56.520"
"KHARIF","AGRICULTURE","Cereals","Paddy (Dhan)","	Plant Protection	","INFORMATION REGARDING FOR THE CURRENT WEATHER CONDITION?","SOME CHANCE OF RAINFALL TODAY.","PUNJAB","FATEHGARH SAHIB","BASSI PATHANA                                     ","2014-10-01 16:31:59.617"
"KHARIF","AGRICULTURE","Cereals","Paddy (Dhan)","	Plant Protection	","INFORMATION REGARDING CONTROL OF SHEAT BLIGHT IN RICE?","SPRAY TILT @ 200 ML IN 200 LITERS OF WATER /ACRE.","PUNJAB","FATEHGARH SAHIB","BASSI PATHANA                                     ","2014-10-01 17:38:47.503"
"KHARIF","AGRICULTURE","Cereals","Paddy (Dhan)","	Plant Protection	","INFORMATION REGARDING CONTROL OF SHEAT BLIGHT IN RICE?","SPRAY TILT @ 200 ML IN 200 LITERS OF WATER /ACRE.","PUNJAB","FATEHGARH SAHIB","AMLOH                                             ","2014-10-01 17:47:42.093"
"RABI","AGRICULTURE","Cereals","Paddy (Dhan)","	Plant Protection	","INFORMATION REGARDING CONTROL OF SHEAT BLIGHT IN RICE?","SPRAY TILT @ 200 ML IN 200 LITERS OF WATER /ACRE.","PUNJAB","FATEHGARH SAHIB","KHAMANO                                           ","2014-10-01 18:44:00.363"
"KHARIF","AGRICULTURE","Others","Others","Weather","INFORMATION REGARDING FOR WEATHER CONDITION ?","WEATHER IS CLOUDY AND CHANCE OF RAINFALL","PUNJAB","FATEHGARH SAHIB","AMLOH                                             ","2014-10-01 19:48:50.350"
"KHARIF","AGRICULTURE","Others","Others","Weather","INFORMATION REGARDING FOR THE WEATHER?","WEATHER IS CLOUDY AND CHANCE OF RAINFALL IN NEXT TWO DAYS.","PUNJAB","FATEHGARH SAHIB","KHAMANO                                           ","2014-10-01 19:48:56.430"
"KHARIF","AGRICULTURE","Others","Others","Weather","INFORMATION REGARDING WEATHER ?","NO CHANCE OF RAINFALL TODAY.","PUNJAB","FATEHGARH SAHIB","SIRHIND                                           ","2014-10-01 20:05:27.403"
"KHARIF","AGRICULTURE","Others","Others","Weather","Information regarding weather ?","some clouds and no chances of rainfall .","PUNJAB","FATEHGARH SAHIB","KHAMANO                                           ","2014-10-01 20:12:26.430"
"KHARIF","AGRICULTURE","Others","Others","Weather","INFORMATION REGARDING FOR WEATHER CONDITION ?","WEATHER IS CLOUDY AND CHANCE OF RAINFALL","PUNJAB","FATEHGARH SAHIB","SIRHIND                                           ","2014-10-01 20:20:41.787"
"KHARIF","AGRICULTURE","Others","Others","Weather","INFORMATION REGARDING WEATHER ?","TODAY WEATHER IS CLOUDY BUT NO CHANCES  OF RAINFALL","PUNJAB","FATEHGARH SAHIB","BASSI PATHANA                                     ","2014-10-01 20:25:36.090"
"KHARIF","AGRICULTURE","Others","Others","Weather","INFORMATION REGARDING WEATHER ?","TODAY WEATHER IS CLOUDY BUT NO CHANCES  OF RAINFALL","PUNJAB","FATEHGARH SAHIB","BASSI PATHANA                                     ","2014-10-01 20:27:59.110"
"KHARIF","AGRICULTURE","Cereals","Paddy (Dhan)","	Plant Protection	","information regarding control of catter piller in paddy?","spray fame 40ml in 120 litre of water/acre","PUNJAB","FATEHGARH SAHIB","SIRHIND                                           ","2014-10-02 06:11:01.570"
"RABI","AGRICULTURE","Cereals","Wheat","	Plant Protection	","INFORMATION REGARDING FOR THE SUITABLE VARIETIES OF WHEAT FOR RUNNING SEASON?","SUITABLE VARIETIES OF WHEAT FOR RUNNING SEASON ARE-WH 1105 (23QTLS/ACRE,2014) HD-2967, PBW-621, PBW-550, & DBW-17, PBW-502, WH-542.","PUNJAB","FATEHGARH SAHIB","SIRHIND                                           ","2014-10-02 08:40:11.843"
"KHARIF","AGRICULTURE","Others","Others","Weather","information regarding weather forecast ?","weather is cloudy but no chances of rainfall today","PUNJAB","FATEHGARH SAHIB","SIRHIND                                           ","2014-10-02 09:51:23.453"
"KHARIF","AGRICULTURE","Cereals","Paddy (Dhan)","	Plant Protection	","INFORMATION REGARDING FOR THE CONTROL OF LEAF FOLDER IN PADDY(JHONA) CROP?","FOR THE CONTROL OF LEAF FOLDER IN PADDY(JHONA) CROP,PLS SPRAY 400 ML TRIZOPHOS 40 EC(HOSTATHION) OR 350 ML SPARK (TRIZOPHOS+DELTAMETHRIN) OR 350 ML PROFENOPHOS+CYPERMETHRIN IN 150 LITRE WATER PER ACRE.","PUNJAB","FATEHGARH SAHIB","BASSI PATHANA                                     ","2014-10-02 10:10:18.967"
"KHARIF","AGRICULTURE","Cereals","Paddy (Dhan)","	Plant Protection	","INFORMATION REGARDING CONTROL OFLEAF FOLDER IN RICE?","SPRAY 800ML EKALUX IN 100LT WATER/ACRE.","PUNJAB","FATEHGARH SAHIB","SIRHIND                                           ","2014-10-02 10:21:38.590"
"KHARIF","AGRICULTURE","Cereals","Paddy (Dhan)","	Plant Protection	","INFORMATION REGARDING FOR THE CONTROL OF BROWN LEAF SPOT  DISEASE ATTACK ON PADDY(JHONA) CROP?","FOR THE CONTROL OF BROWN LEAF SPOT  DISEASE ATTACK ON PADDY, SPRAY 200 ML TILT 25 EC OR FOLICUR 25 EC IN 200 LITRE WATER PER ACRE","PUNJAB","FATEHGARH SAHIB","BASSI PATHANA                                     ","2014-10-02 10:41:49.850"
"KHARIF","AGRICULTURE","Cereals","Paddy (Dhan)","	Plant Protection	","INFORMATION REGARDING FOR THE SUITABLE VARIETIES OF WHEAT FOR RUNNING SEASON?","SUITABLE VARIETIES OF WHEAT FOR RUNNING SEASON ARE-WH 1105 (23QTLS/ACRE,2014) HD-2967, PBW-621, PBW-550, & DBW-17, PBW-502, WH-542.","PUNJAB","FATEHGARH SAHIB","SIRHIND                                           ","2014-10-02 11:09:29.760"
"KHARIF","AGRICULTURE","Cereals","Wheat","Seeds","INFORMATION REGARDING FOR THE FERT.DOSE IN WHEAT AT THE TIME OF SOWING?","FERT.DOSE IN WHEAT AT THE TIME OF SOWING.-DAP-55KG,MOP-25KG & UREA-20KG.","PUNJAB","FATEHGARH SAHIB","KHAMANO                                           ","2014-10-02 12:22:56.430"
"KHARIF","HORTICULTURE","Vegetables","Onion","	Plant Protection	","information regarding the seed treatment ?","treat the seed with emisan.","PUNJAB","FATEHGARH SAHIB","SIRHIND                                           ","2014-10-02 13:24:34.627"
"KHARIF","AGRICULTURE","Cereals","Paddy (Dhan)","	Plant Protection	","INFORMATION RGEARDING FOR THE CONTROL OF SHEATH BLIGHT ATTACK ON PADDY(JHONA) CROP?","FOR THE CONTROL OF SHEATH BLIGHT ATTACK ON PADDY(JHONA) CROP,PLS SPRAY 500ML HEXACONAZOLE(HEXAVEER) OR 200 ML THIFLUZAMIDE(PULSOR) IN 150 LITRE WATER.","PUNJAB","FATEHGARH SAHIB","AMLOH                                             ","2014-10-02 14:54:23.643"
"KHARIF","AGRICULTURE","Others","Others","Weather","INFORMATION REGARDING WEATHER?","NO CHANCE OF RAINFALL TODAY.","PUNJAB","FATEHGARH SAHIB","AMLOH                                             ","2014-10-02 15:20:49.913"
"JAYAD","AGRICULTURE","Others","Others","Weather","INFORMATION REGARDING WEATHER?","WEATHER REMAIN CLEAR TODAY.","PUNJAB","FATEHGARH SAHIB","AMLOH                                             ","2014-10-02 15:32:39.837"
"RABI","AGRICULTURE","Others","Others","Weather","INFORMATION REGARDING WEATHER ?","NO CHANCE OF RAINFALL TODAY.","PUNJAB","FATEHGARH SAHIB","KHERA                                             ","2014-10-02 17:01:51.820"
"KHARIF","AGRICULTURE","Cereals","Paddy (Dhan)","	Plant Protection	","Information regarding Market Rate of Paddy?","Market Rate of Paddy is Rs. 1360 per qtl.","PUNJAB","FATEHGARH SAHIB","KHERA                                             ","2014-10-02 17:05:59.740"
"KHARIF","HORTICULTURE","Vegetables","Pea (Vegetable)","	Plant Protection	","INFORMATION REGARDING FOR THE SUITABLE VARIETIES OF PEA(MATAR)?","THE SUITABLE VARIETIES OF PEA(MATAR)- EARLY VARIETIES- MATAR AGETA-6, ARKEL & MEDIUM VARIETIES- PUNJAB -89,MITHI PHALI.","PUNJAB","FATEHGARH SAHIB","KHERA                                             ","2014-10-02 17:20:14.740"
"KHARIF","AGRICULTURE","Cereals","Paddy (Dhan)","	Plant Protection	","INFORMATION REGARDING FOR THE CONTROL OF RICE STEMBORER IN PADDY(JHONA) CROP?","FOR THE CONTROL OF RICE STEMBORER IN PADDY(JHONA) CROP,PLS SPRAY 35ML FAME IN 120 LITRE WATER.","PUNJAB","FATEHGARH SAHIB","BASSI PATHANA                                     ","2014-10-02 17:38:35.663"
"KHARIF","AGRICULTURE","Cereals","Paddy (Dhan)","	Plant Protection	","how to control steam borer in paddy crop ?","spray to fame @ 40 ml in 150 liter of water / acre .","PUNJAB","FATEHGARH SAHIB","BASSI PATHANA                                     ","2014-10-02 18:23:32.823"
"KHARIF","AGRICULTURE","Cereals","Paddy (Dhan)","	Plant Protection	","INFORMATION RGEARDING FOR THE CONTROL OF SHEATH BLIGHT ATTACK ON PADDY(JHONA) CROP?","FOR THE CONTROL OF SHEATH BLIGHT ATTACK ON PADDY(JHONA) CROP,PLS SPRAY 500ML HEXACONAZOLE(HEXAVEER) OR 200 ML THIFLUZAMIDE(PULSOR) IN 150 LITRE WATER.","PUNJAB","FATEHGARH SAHIB","BASSI PATHANA                                     ","2014-10-02 18:27:49.493"
"KHARIF","AGRICULTURE","Others","Others","Weather","INFORMATION REGARDING WEATHER?","WEATHER REMAIN CLEAR TONIGHT.","PUNJAB","FATEHGARH SAHIB","SIRHIND                                           ","2014-10-02 20:18:25.580"
"KHARIF","AGRICULTURE","Others","Others","Weather","INFORMATION REGARDING WEATHER?","WEATHER REMAIN CLEAR TONIGHT..","PUNJAB","FATEHGARH SAHIB","SIRHIND                                           ","2014-10-02 20:40:55.280"
"KHARIF","AGRICULTURE","Others","Others","Sowing Time and Weather","INFORMATION REGARDING FOR THE CURRENT WEATHER CONDITION?","WEATHER REMAINS CLEAR TODAY.","PUNJAB","FATEHGARH SAHIB","BASSI PATHANA                                     ","2014-10-02 20:45:52.153"
"KHARIF","AGRICULTURE","Cereals","Paddy (Dhan)","	Plant Protection	","CONTROL OF IN PADDY?","SPRAY 200ML FOLICUR IN 200LT WATER/ACRE.","PUNJAB","FATEHGARH SAHIB","BASSI PATHANA                                     ","2014-10-03 06:57:06.970"
"KHARIF","AGRICULTURE","Cereals","Paddy (Dhan)","	Plant Protection	","CONTROL OF LEAF SPOTS IN PADDY?","SPRAY 200ML TILT OR 200ML FOLICUR IN 200LT WATER/ACRE.","PUNJAB","FATEHGARH SAHIB","AMLOH                                             ","2014-10-03 07:02:17.987"
"KHARIF","AGRICULTURE","Cereals","Paddy (Dhan)","	Plant Protection	","Information regarding how to control Stem Borer in Basmati-1121?","Spray 35 ml. Fame (Flubendiamide 480SC) or 60 ml. Coragen (Chlorantraniliprole 20SC) in 100 lt. of water per acre.","PUNJAB","FATEHGARH SAHIB","AMLOH                                             ","2014-10-03 07:56:44.700"
"KHARIF","AGRICULTURE","Cereals","Paddy (Dhan)","	Plant Protection	","INFORMATION RGEARDING FOR THE CONTROL OF SHEATH BLIGHT ATTACK ON PADDY(JHONA) CROP?","FOR THE CONTROL OF SHEATH BLIGHT ATTACK ON PADDY(JHONA) CROP,SPRAY 400 ML HEXACONAZOLE 5% EC OR 400 ML VALIDAMYCIN 3%L OR 200 ML THIFLUZAMIDE 24% SC(PULSUR) MIXED WITH 200LITRE WATER PER ACRE.","PUNJAB","FATEHGARH SAHIB","KHAMANO                                           ","2014-10-03 08:21:02.283"
"KHARIF","AGRICULTURE","Sugar and Starch Crops","Sugarcane (Noble Cane)","	Plant Protection	","Information regarding how to control Grasshoppers in Sugarcane?","Broadcast 8 kg. Phorate or 10 kg. Regent mix in 30 kg. dry sand per acre then apply light irrigation.","PUNJAB","FATEHGARH SAHIB","BASSI PATHANA                                     ","2014-10-03 08:26:20.790"
"KHARIF","HORTICULTURE","Fruits","Pomegranate","	Plant Protection	","Information regarding how to control Fruit Rot in Pomegranate?","Spray 3 gm. Copper Oxychloride in  per lt. of water.","PUNJAB","FATEHGARH SAHIB","SIRHIND                                           ","2014-10-03 08:31:27.143"
"KHARIF","AGRICULTURE","Cereals","Paddy (Dhan)","	Plant Protection	","#: HOW TO CONTROL OF BACETERIAL LEAF BLIGHT IN PADDY CROP?","A: SPRAY OF VALIDAMYCIN 3 SL @ 400 ML IN 120 LITRES OF WATER PER ACRE.","PUNJAB","FATEHGARH SAHIB","KHAMANO                                           ","2014-10-03 10:12:51.440"
"KHARIF","AGRICULTURE","Others","Others","Training and Exposure Visits","Information regarding Contact no. of PAU, Ludhiana?","Contact no. of PAU, Ludhiana:- 0161-2401960.","PUNJAB","FATEHGARH SAHIB","BASSI PATHANA                                     ","2014-10-03 10:42:17.580"
"KHARIF","AGRICULTURE","Fodder Crops","Barseem","Varieties","Information regarding varieties of Barseem?","Varieties of Barseem:- BL-42, BL-10, BL-1.","PUNJAB","FATEHGARH SAHIB","KHAMANO                                           ","2014-10-03 10:46:34.297"
"KHARIF","AGRICULTURE","Others","Others","Weather","INFORMATION REGARDING WEATHER?","WEATHER REMAIN CLEAR TODAY.","PUNJAB","FATEHGARH SAHIB","BASSI PATHANA                                     ","2014-10-03 10:48:00.387"
"KHARIF","AGRICULTURE","Cereals","Wheat","	Plant Protection	","INFORMATION REGARDING VARIETIES OF wheaT?","wh 1105","PUNJAB","FATEHGARH SAHIB","KHERA                                             ","2014-10-03 11:02:56.757"
"KHARIF","AGRICULTURE","Cereals","Paddy (Dhan)","	Plant Protection	","CONTACT NO OF PUSA DELHI?","1125842387","PUNJAB","FATEHGARH SAHIB","SIRHIND                                           ","2014-10-03 11:17:03.060"
"RABI","HORTICULTURE","Vegetables","Pea (Vegetable)","	Plant Protection	","INFORMATION REGARDING FOR THE SOWING TIME OF PEA(MATAR)?","THE SOWING TIME OF PEA(MATAR)-15 OCTOBER TO 15 NOVEMBER.","PUNJAB","FATEHGARH SAHIB","AMLOH                                             ","2014-10-03 11:46:11.657"
"KHARIF","AGRICULTURE","Cereals","Paddy (Dhan)","	Plant Protection	","Information regarding how to control Black Aphids on Stem in Paddy?","Spray 330 ml. Buprofezin 25EC + 100 ml. Nuwan 76EC in 100 lt. of water per acre.","PUNJAB","FATEHGARH SAHIB","BASSI PATHANA                                     ","2014-10-03 12:20:48.843"
"RABI","HORTICULTURE","Vegetables","Onion","Cultural Practices","INFORMATION REGARDING IMPROVED VARIETIES OF ONION ?","VARIETIES OF ONION: PRO-6,PUNJAB WHITE,PUNJAB NAROYA,PUNJAB RED ROUND.","PUNJAB","FATEHGARH SAHIB","KHAMANO                                           ","2014-10-03 15:03:44.043"
"KHARIF","AGRICULTURE","Others","Others","Weather","information regarding weather?","weather is clear and no chances of rainfall.","PUNJAB","FATEHGARH SAHIB","KHERA                                             ","2014-10-03 15:13:42.400"
"KHARIF","AGRICULTURE","Others","Others","Weather","INFORMATION REGARDING WEATHER ?","WEATHER IS CLEAR NO CHANCES OF RAINFALL.","PUNJAB","FATEHGARH SAHIB","SIRHIND                                           ","2014-10-03 15:33:57.383"
"KHARIF","AGRICULTURE","Others","Others","Weather","INFORMATION REGARDING WEATHER ?","WEATHER IS CLEAR NO CHANCES OF RAINFALL.","PUNJAB","FATEHGARH SAHIB","AMLOH                                             ","2014-10-03 16:44:29.170"
"KHARIF","AGRICULTURE","Cereals","Paddy (Dhan)","	Plant Protection	","HOW TO CONTROL FUNGAL DISEASES IN PADDY CROP ?","SPRAY TO TILT @ 200 ML IN 200 LITER OF WATER / ACRE .","PUNJAB","FATEHGARH SAHIB","SIRHIND                                           ","2014-10-03 16:50:00.753"
"RABI","AGRICULTURE","Others","Others","Weather","information regarding of weather?","cloudy weather some chances of rainfall on 7oct-8oct .","PUNJAB","FATEHGARH SAHIB","AMLOH                                             ","2014-10-03 17:22:23.553"
"KHARIF","AGRICULTURE","Cereals","Paddy (Dhan)","	Plant Protection	","INFORMATION RGEARDING FOR THE CONTROL OF SHEATH BLIGHT ATTACK ON PADDY(JHONA) CROP?","FOR THE CONTROL OF SHEATH BLIGHT ATTACK ON PADDY(JHONA) CROP,SPRAY 400 ML HEXACONAZOLE 5% EC OR 400 ML VALIDAMYCIN 3%L OR 200 ML THIFLUZAMIDE 24% SC(PULSUR) MIXED WITH 200LITRE WATER PER ACRE.","PUNJAB","FATEHGARH SAHIB","KHAMANO                                           ","2014-10-03 17:47:10.777"
"KHARIF","HORTICULTURE","Vegetables","Pea (Vegetable)","Cultural Practices","NFORMATION REGARDING MAIN SEASON VARIETIES OF PEA ?","MAIN SEASON VARIETIES OF PEA:PUNJAB-89,MITHI PHALI,PUNJAB-87,PUNJAB-88.","PUNJAB","FATEHGARH SAHIB","SIRHIND                                           ","2014-10-03 17:53:40.097"
"KHARIF","AGRICULTURE","Others","Others","Weather","INFORMATION REGARDING WEATHER ?","TODAY WEATHER IS CLOUDY BUT NO CHANCES  OF RAINFALL","PUNJAB","FATEHGARH SAHIB","KHAMANO                                           ","2014-10-03 17:55:35.877"
"KHARIF","AGRICULTURE","Others","Others","Weather","INFORMATION REGARDING FOR WEATHER CONDITION ?","WEATHER IS CLEAR AND NO CHANCE OF RAINFALL.","PUNJAB","FATEHGARH SAHIB","AMLOH                                             ","2014-10-03 18:02:43.917"
"KHARIF","AGRICULTURE","Others","Others","Weather","INFORMATION REGARDING WEATHER ?","NO CHANCE OF RAINFALL TODAY.","PUNJAB","FATEHGARH SAHIB","SIRHIND                                           ","2014-10-03 18:15:04.390"
"KHARIF","AGRICULTURE","Others","Others","Weather","INFORMATION REGARDING WEATHER ?","NO CHANCE OF RAINFALL TODAY.","PUNJAB","FATEHGARH SAHIB","SIRHIND                                           ","2014-10-03 18:15:18.043"
"KHARIF","AGRICULTURE","Cereals","Paddy (Dhan)","	Plant Protection	","INFORMATION REGARDING FOR THE CONTROL  OF WHITEBACKED PLANT HOPPER(W.P.H.) & BROWN PLANT HOPPER(B.P.H.) IN PADDY(JHONA) CROP?","FOR THE CONTROL  OF WHITEBACKED PLANT HOPPER(W.P.H.) & BROWN PLANT HOPPER(B.P.H.) IN PADDY(JHONA) CROP,PLS SPRAY 350ML BUPROFEZIN+100 ML NUVAN IN 150LITRE WATER.","PUNJAB","FATEHGARH SAHIB","AMLOH                                             ","2014-10-03 19:04:43.410"
"KHARIF","AGRICULTURE","Others","Others","Weather","information regarding weather?","weather is clear and no chances of rainfall.","PUNJAB","FATEHGARH SAHIB","SIRHIND                                           ","2014-10-03 19:07:24.300"
"KHARIF","AGRICULTURE","Others","Others","Weather","information regarding of weather?","cloudy weather some chances of rainfall on 7oct-8oct .","PUNJAB","FATEHGARH SAHIB","AMLOH                                             ","2014-10-03 19:10:46.437"
"KHARIF","AGRICULTURE","Others","Others","Weather","INFORMATION REGARDING WEATHER ?","TODAY WEATHER IS CLOUDY BUT NO CHANCES  OF RAINFALL","PUNJAB","FATEHGARH SAHIB","BASSI PATHANA                                     ","2014-10-03 20:41:38.453"
"KHARIF","AGRICULTURE","Others","Others","Weather","information regarding of weather?","cloudy weather some chances of rainfall on 7oct-8oct .","PUNJAB","FATEHGARH SAHIB","BASSI PATHANA                                     ","2014-10-03 20:43:36.887"
"RABI","AGRICULTURE","Others","Others","Weather","INFORMATION REGARDING WEATHER OF FATEHGARH SAHIB?","I TOLD THE KISAN SOME CHANCE OF RAIN.","PUNJAB","FATEHGARH SAHIB","AMLOH                                             ","2014-10-04 06:45:45.400"
"RABI","AGRICULTURE","Others","Others","Weather","INFORMATION REGARDING WEATHER OF FATEHGARH SAHIB?","I TOLD THE KISAN SOME CHANCE OF RAIN.","PUNJAB","FATEHGARH SAHIB","AMLOH                                             ","2014-10-04 06:46:12.183"
"KHARIF","AGRICULTURE","Cereals","Paddy (Dhan)","	Plant Protection	","INFORMATION REGARDING FOR THE CONTROL  OF WHITE BACKED PLANT HOPPER(W.P.H.) & BROWN PLANT HOPPER(B.P.H.) IN PADDY(JHONA) CROP?","FOR THE CONTROL  OF WHITE BACKED PLANT HOPPER(W.P.H.) & BROWN PLANT HOPPER(B.P.H.) IN PADDY(JHONA) CROP,PLS SPRAY APPLOUD (BUPROFEZIN 25 EC)@350ML + 100 ML NUVAN IN 150 LITER OF WATER / ACRE .","PUNJAB","FATEHGARH SAHIB","SIRHIND                                           ","2014-10-04 08:12:17.607"
"KHARIF","AGRICULTURE","Cereals","Paddy (Dhan)","	Plant Protection	","INFORMATION REGARDING CONTROL OF APHID IN RICE?","SPRAY CONFIDOR @ 80 ML IN 100 LITERS OF WATER/ACRE.","PUNJAB","FATEHGARH SAHIB","AMLOH                                             ","2014-10-04 08:34:09.593"
"KHARIF","HORTICULTURE","Fruits","Citrus","	Plant Protection	","INFORMATION REGARDING FOR THE CONTROL OF DIE-BACK IN CITRUS CROP?","FOR THE CONTROL OF DIE-BACK IN CITRUS CROP PLS SPRAY COPPER OXYCHLORIDE.","PUNJAB","FATEHGARH SAHIB","SIRHIND                                           ","2014-10-04 09:27:23.057"
"KHARIF","AGRICULTURE","Cereals","Paddy (Dhan)","	Plant Protection	","INFORMATION RGEARDING FOR THE CONTROL OF FALSE SMUT  DISEASE ATTACK ON PADDY(JHONA) CROP","FOR THE CONTROL OF FALSE SMUT  DISEASE ATTACK ON PADDY(JHONA) CROP,PLS SPRAY 500GM COPPER OXYCHLORIDE(BLUE COPPER) IN 200 LITRE WATER PER ACRE AT BOOT STAGE OF CROP.","PUNJAB","FATEHGARH SAHIB","SIRHIND                                           ","2014-10-04 09:59:45.120"
"KHARIF","AGRICULTURE","Cereals","Paddy (Dhan)","	Plant Protection	","INFORMATION RGEARDING FOR THE CONTROL OF SHEATH BLIGHT ATTACK ON PADDY(JHONA) CROP?","FOR THE CONTROL OF SHEATH BLIGHT ATTACK ON PADDY(JHONA) CROP PLS SPARY 200ML TILT PER ACER.","PUNJAB","FATEHGARH SAHIB","BASSI PATHANA                                     ","2014-10-04 10:07:15.063"
"KHARIF","AGRICULTURE","Others","Others","Weather","INFORMATION REGARDING FOR WEATHER CONDITION ?","WEATHER IS CLEAR AND NO CHANCE OF RAINFALL.","PUNJAB","FATEHGARH SAHIB","BASSI PATHANA                                     ","2014-10-04 11:26:34.670"
"KHARIF","AGRICULTURE","Others","Others","Weather","INFORMATION REGARDING WEATHER ?","TODAY WEATHER IS CLOUDY BUT NO CHANCES  OF RAINFALL","PUNJAB","FATEHGARH SAHIB","KHERA                                             ","2014-10-04 12:41:58.973"
"KHARIF","AGRICULTURE","Others","Others","Weather","INFORMATION REGARDING WEATHER ?","TODAY WEATHER IS CLOUDY BUT NO CHANCES  OF RAINFALL","PUNJAB","FATEHGARH SAHIB","BASSI PATHANA                                     ","2014-10-04 13:03:40.447"
"JAYAD","AGRICULTURE","Others","Others","	Plant Protection	","FUNGISIDE - FOLICUR 200 ML IN 200 LITRE WATER PER ACRE","INSECTICIDE - EKALUX (QUINALPHOS )500-800 ML IN 125 LITRE WATER PER ACRE","PUNJAB","FATEHGARH SAHIB","KHAMANO                                           ","2014-10-04 14:10:25.727"
"KHARIF","AGRICULTURE","Others","Others","Varieties","information regarding to weather ?","no chances of rain in today and next day","PUNJAB","FATEHGARH SAHIB","AMLOH                                             ","2014-10-04 14:18:07.673"
"KHARIF","AGRICULTURE","Others","Others","Weather","INFORMAION REGARDING FOR THE WEATHER?","WEATHER IS CLOUDY BUT NO CHANCES OF RAINFALL  TODAY.","PUNJAB","FATEHGARH SAHIB","BASSI PATHANA                                     ","2014-10-04 16:34:31.433"
"KHARIF","AGRICULTURE","Cereals","Paddy (Dhan)","	Plant Protection	","information regarding weather ?","weather  is cloudy and some chances of rainfall today.","PUNJAB","FATEHGARH SAHIB","BASSI PATHANA                                     ","2014-10-04 18:10:43.437"
