"Season","Sector","Category","Crop","QueryType","QueryText","KCCAns","StateName","DistrictName","BlockName","CreatedOn"
"KHARIF","HORTICULTURE","Vegetables","Bitter Gourd","	Plant Protection	","hedda beetle in bitter gourd home garden","recommended for spray garlic+ginger+chilli combination solution","PUDUCHERRY","KARAIKAL","Kottucherry","2014-10-03 12:46:08.177"
"RABI","HORTICULTURE","Vegetables","Brinjal","Fertilizer Use and Availability","Brinjal top dressing fertilizer","RECOMMENDED FOR Brinjal top dressing fertilizer Apply urea 40 kg + potash 15 kg/ac","PUDUCHERRY","KARAIKAL","KARAIKAL                                          ","2014-10-03 15:27:46.833"
"RABI","AGRICULTURE","Cereals","Paddy (Dhan)","Fertilizer Use and Availability","Top dressing fertilizer management for paddy","RECOMMENDED FOR Top dressing fertilizer management for paddy apply urea 25 kg + potash 15 kg + neem cake 5 kg + Microfood 10 kg/ ac","PUDUCHERRY","KARAIKAL","Nedungadu","2014-10-03 20:04:51.967"
"KHARIF","AGRICULTURE","Cereals","Paddy (Dhan)","Weed Management","weeds control in paddy","Recommended for spray pendimethalin 400gm / ac on 5 days after sowing","PUDUCHERRY","KARAIKAL","KARAIKAL                                          ","2014-10-04 14:50:39.807"
"KHARIF","AGRICULTURE","Oilseeds","Groundnut (pea nut/mung phalli)","Market Information","market rate for groundnut","Chethupattu Bold	6687 - 6987 Rs/Quintal","PUDUCHERRY","KARAIKAL","KARAIKAL                                          ","2014-10-06 11:11:41.420"
"KHARIF","AGRICULTURE","Cereals","Paddy (Dhan)","Weed Management","weeds control in paddy","Recommended for apply Pyrasolsalburan ethayl 200gm / 200lit ac 15th days after sowing","PUDUCHERRY","KARAIKAL","Thirunallar","2014-10-06 11:28:01.860"
"KHARIF","HORTICULTURE","Plantation Crops","Teak","	Plant Protection	","planting season for teak","recommended for planting before rainy season","PUDUCHERRY","KARAIKAL","Thirunallar","2014-10-07 11:12:31.657"
"KHARIF","AGRICULTURE","Others","Others","Soil Testing","Soil testing techniques","recommended number for agriculture office 9442412481","PUDUCHERRY","KARAIKAL","TR Pattinam","2014-10-08 19:49:37.750"
"RABI","HORTICULTURE","Fruits","Pomegranate","	Plant Protection	","Fruit Borer in pomegranate","RECOMMENDED FOR Fruit Borer in pomegranate spray chlorpyrifos 2ml+ neem oil 3ml+ teepol 1ml /lit of water","PUDUCHERRY","KARAIKAL","Neravy","2014-10-08 20:13:55.447"
"KHARIF","HORTICULTURE","Fruits","Pomegranate","	Plant Protection	","Fruit Borer in pomegranate","spray chlorpyrifos 2ml+  teepol 1ml /lit of water","PUDUCHERRY","KARAIKAL","Thirunallar","2014-10-08 21:36:04.237"
"KHARIF","AGRICULTURE","Cereals","Paddy (Dhan)","Agriculture Mechanization","paddy transplanter availability","recommended for contact to ADA office","PUDUCHERRY","KARAIKAL","KARAIKAL                                          ","2014-10-09 09:52:17.447"
"KHARIF","AGRICULTURE","Cereals","Paddy (Dhan)","	Plant Protection	","Paddy basal fertilizer","Recommended for apply DAP 50 kg + zinc sulphate 10 kg/ac+neem cake 10kg/ac","PUDUCHERRY","KARAIKAL","KARAIKAL                                          ","2014-10-11 14:46:30.860"
"KHARIF","AGRICULTURE","Others","Others","Weather","Weather report details","recommended for today is a no rain day","PUDUCHERRY","KARAIKAL","Kottucherry","2014-10-12 22:01:57.960"
"KHARIF","AGRICULTURE","Cereals","Paddy (Dhan)","Nutrient Management","query : paddy basal fertilizer management","ans : recommended for apply DAP 50 kilo + FYM 10 tonne + neem cake 10 kilo + znso4 10 kilo / acre","PUDUCHERRY","KARAIKAL","KARAIKAL                                          ","2014-10-15 09:38:04.283"
"RABI","AGRICULTURE","Others","Others","Weather","weather report karaikal","recommended for weather report karaikal today have rain","PUDUCHERRY","KARAIKAL","KARAIKAL                                          ","2014-10-18 21:47:27.577"
"KHARIF","AGRICULTURE","Cereals","Paddy (Dhan)","Fertilizer Use and Availability","Foliar nutrition for paddy","recommended for spray urea 10gm +DAP 20gm + potassium chloride 10 gm /lit of water","PUDUCHERRY","KARAIKAL","KARAIKAL                                          ","2014-10-20 11:10:35.860"
"KHARIF","AGRICULTURE","Cereals","Paddy (Dhan)","Fertilizer Use and Availability","Top dressing fertilizer management for paddy","Recommended for apply urea 25 kg + potash 15 kg + neem cake 5 kg + Microfood 5 kg/ ac","PUDUCHERRY","KARAIKAL","KARAIKAL                                          ","2014-10-24 13:40:24.580"
"KHARIF","AGRICULTURE","Cereals","Paddy (Dhan)","Fertilizer Use and Availability","Paddy basal fertilizer","Recommended for apply DAP 50 kg + zinc sulphate 10kg + neem cake 10 kg/ac","PUDUCHERRY","KARAIKAL","Kottucherry","2014-10-24 14:31:59.977"
"RABI","AGRICULTURE","Others","Others","Weather","WEATHER RERORT KARAIKAL","RECOMMENDED FOR WEATHER RERORT KARAIKAL TODA HAVE RAIN","PUDUCHERRY","KARAIKAL","KARAIKAL                                          ","2014-10-25 18:43:22.300"
"RABI","AGRICULTURE","Cereals","Paddy (Dhan)","	Plant Protection	","paddy  wilt","Recommended for Trichoderma viride 1kg + Cowdung 20kg /tree","PUDUCHERRY","KARAIKAL","KARAIKAL                                          ","2014-10-25 21:44:31.957"
"KHARIF","AGRICULTURE","Pulses","Black Gram (urd bean)","Cultural Practices","black gram sowing season and variety","Recommended for black gram sowing season : June - August and variety : VBN (Bg) 4, VBN(Bg) 5, VBN 7","PUDUCHERRY","KARAIKAL","KARAIKAL                                          ","2014-10-27 17:08:01.223"
"KHARIF","AGRICULTURE","Cereals","Paddy (Dhan)","Fertilizer Use and Availability","paddy basal fertilizer management","Recommended for apply DAP 50 kg + zinc sulphate 10 kg + neem cake 10kg + FYM 10ton /ac","PUDUCHERRY","KARAIKAL","KARAIKAL                                          ","2014-10-30 16:36:51.543"
"RABI","AGRICULTURE","Cereals","Paddy (Dhan)","	Plant Protection	","Brown Plant hopper in paddy","Recommended for Brown Plant hopper in paddy Spray imidaclopride 2 ml/lit","PUDUCHERRY","KARAIKAL","KARAIKAL                                          ","2014-10-31 19:49:19.457"
