"Season","Sector","Category","Crop","QueryType","QueryText","KCCAns","StateName","DistrictName","BlockName","CreatedOn"
"","AGRICULTURE","Oilseeds","Soybean (bhat)","	Plant Protection	","farmer want to know information about How to control weeds in soybean crop?","When your crop become 25 to 30 days you will be spay qugelefop ethyel 400ml per acar for narrow leaf weeds and emejhathayper 300 ml per acar for broad leaf weeds","MADHYA PRADESH","BHOPAL","PHANDA                                            ","2014-08-07 13:14:53.000"
"JAYAD","ANIMAL HUSBANDRY","Animal","Bovine(Cow,Buffalo)","Credit","want to start dairy so what can I do ?","pls contact 18001801199 more information..","MADHYA PRADESH","BHOPAL","BERASIA                                           ","2014-08-07 13:55:01.000"
"JAYAD","AGRICULTURE","Oilseeds","Groundnut (pea nut/mung phalli)","	Plant Protection	","farmer want to know information about How to control of fungal attack in groundnut crop ?","spray mencojeb + carbandazim 45 gram and steptrocyclin 2 gram at 15 liter of water","MADHYA PRADESH","BHOPAL","BERASIA                                           ","2014-08-07 14:43:56.000"
"JAYAD","AGRICULTURE","Oilseeds","Soybean (bhat)","	Plant Protection	","How to control ring caterpillars in soyabean crop?","Troijofos 40 EC 1000 Ml. / hac. Rate of spray.
Queenolfos 25 EC 1000 Ml. / hac. Rate of spray.
Profenofos 40% + Cypermethrin 4% EC 1000 Ml. / hac. Rate of spray.","MADHYA PRADESH","BHOPAL","PHANDA                                            ","2014-08-07 15:20:37.000"
"JAYAD","HORTICULTURE","Vegetables","Chillies","	Plant Protection	","how to control of thrips in chilli crop?","spray ethofenoprox @ 30 ml/pump.","MADHYA PRADESH","BHOPAL","BERASIA                                           ","2014-08-07 15:31:55.000"
"JAYAD","AGRICULTURE","Cereals","Paddy (Dhan)","	Plant Protection	","HOW TO CONTROL OF LEAF FOLDER INSECT IN PADDY CROP ?","SPRAY OF ACEPHATE 350-400 GRAM PER ACRE .","MADHYA PRADESH","BHOPAL","BERASIA                                           ","2014-08-07 15:48:58.000"
"JAYAD","AGRICULTURE","Oilseeds","Soybean (bhat)","Nutrient Management","Which fertilizer and nutrient give for better growth in soyabean crop?","Spray N: P: K 19:19:19 100 grams and humic acid 30 ml at 15 liter of water.","MADHYA PRADESH","BHOPAL","PHANDA                                            ","2014-08-07 16:29:39.000"
"JAYAD","AGRICULTURE","Others","Others","Weather","Weather forecasting for Ujjain district of Madhya Pradesh?","rainfall within 5 days in your district.","MADHYA PRADESH","BHOPAL","BERASIA                                           ","2014-08-07 16:38:46.000"
"","AGRICULTURE","Cereals","Paddy (Dhan)","Cultural Practices","How to control weeds in paddy crop?","Spray Nomini gold(Bispayriback sodium) 80 gram per acar.","MADHYA PRADESH","BHOPAL","BERASIA                                           ","2014-08-07 17:23:58.000"
"JAYAD","AGRICULTURE","Cereals","Paddy (Dhan)","	Plant Protection	","farmer want to know information about how to control weeds in paddy  crop?","to control weeds in paddy  crop spray Bispyribac Sodium 10% SC(Nominigold, philip) 8 gram per pump.","MADHYA PRADESH","BHOPAL","BERASIA                                           ","2014-08-07 17:30:43.000"
"JAYAD","AGRICULTURE","Others","Others","Market Information","farmer want to add mandi rates?","mandi rates has been added successfully.","MADHYA PRADESH","BHOPAL","BERASIA                                           ","2014-08-07 18:19:50.000"
"JAYAD","AGRICULTURE","Others","Others","Government Schemes","farmer want to information about govt.schemes?","for detail information please contact -r.a.e.o.","MADHYA PRADESH","BHOPAL","BERASIA                                           ","2014-08-07 19:10:04.000"
"JAYAD","AGRICULTURE","Oilseeds","Soybean (bhat)","	Plant Protection	","How to control weeds in soybean crop?","When your crop become 15 to 20 days you will be spay qugelefop ethyel 400ml per acar for narrow leaf weeds and emejhathayper 300 ml acar for broad leaf weeds per|","MADHYA PRADESH","BHOPAL","PHANDA                                            ","2014-08-08 09:03:33.000"
"","AGRICULTURE","Oilseeds","Soybean (bhat)","","Which fertilizer and nutrient give for better growth in soyabean crop?","Spray N: P: K 19:19:19 100 grams and humic acid 30 ml at 15 liter of water.","MADHYA PRADESH","BHOPAL","BERASIA                                           ","2014-08-08 10:28:10.000"
"JAYAD","AGRICULTURE","Cereals","Paddy (Dhan)","Weather","weather information ?","AY-1               DAY-2               DAY-3               DAY-4               DAY-5
                              09/08               10/08               11/08               12/08               13/08
------------------- ------------------- ------------------- ------------------- ------------------- -------------------
Rainfall (mm)                   0                   0                   0                   0                   0","MADHYA PRADESH","BHOPAL","BERASIA                                           ","2014-08-08 10:47:00.000"
"JAYAD","AGRICULTURE","Others","Others","	Plant Protection	","how to control weed in field ?","apply glyphoset @ 1 liter / hacter .","MADHYA PRADESH","BHOPAL","BERASIA                                           ","2014-08-08 14:08:17.000"
"JAYAD","AGRICULTURE","Others","Others","	Plant Protection	","Which non selective herbicide use in fallow field?","Spray Glyphosate 41% SL 100 ml per pump.","MADHYA PRADESH","BHOPAL","BERASIA                                           ","2014-08-08 14:24:42.000"
"JAYAD","AGRICULTURE","Cereals","Paddy (Dhan)","	Plant Protection	","farmer want to know information about How to control weeds in paddy crop?","Spray Nomini gold(Bispayriback sodium) 80 ml per acar.","MADHYA PRADESH","BHOPAL","PHANDA                                            ","2014-08-08 14:55:04.000"
"JAYAD","AGRICULTURE","Oilseeds","Soybean (bhat)","Fertilizer Use and Availability","Which fertilizer and nutrient give for better growth in soyabean crop?","Recommended for Spray N: P: K 19:19:19 100 grams and humic acid 30 ml at 15 liter of water.","MADHYA PRADESH","BHOPAL","BERASIA                                           ","2014-08-08 15:41:47.000"
"","AGRICULTURE","Oilseeds","Soybean (bhat)","	Plant Protection	","farmer want to know information about Which fertilizer and nutrient give for better growth in soyabean crop?","Spray N: P: K 19:19:19 100 grams /15 liter of water.","MADHYA PRADESH","BHOPAL","BERASIA                                           ","2014-08-08 17:40:11.000"
"JAYAD","AGRICULTURE","Oilseeds","Soybean (bhat)","	Plant Protection	","farmer want to know information about how to control defoliators in soybean?","to control defoliators Spray any one of the following insecticides in the initial stage of infestation 
 Indoxacarb 14.5 % SC @ 10-12ml /pump
  Deltamethrin 2.8 EC@ 750 ml Spray per ha.
  Cveenalfos 25 EC@ 1000 ml Spray per ha.","MADHYA PRADESH","BHOPAL","PHANDA                                            ","2014-08-08 17:40:14.000"
"JAYAD","HORTICULTURE","Vegetables","Cowpea (Vegetable)","Field Preparation","Farmer wants to know aboutseason of cowpea crop?","Season of cowpea 
June – July (Rainfed), February – March (irrigated)","MADHYA PRADESH","BHOPAL","PHANDA                                            ","2014-08-08 17:41:26.000"
"JAYAD","HORTICULTURE","Vegetables","Sponge Gourd","	Plant Protection	","How to control caterpillars in sponge gourd crop?","spray of  deltamethrin20+dachlorvas (nuvan) 20 ml / 16litre water","MADHYA PRADESH","BHOPAL","BERASIA                                           ","2014-08-08 17:57:33.000"
"JAYAD","AGRICULTURE","Cereals","Paddy (Dhan)","Nutrient Management","What are fertilizer doses in paddy crop?","Urea = 131. KG., DAP = 108. Kg., Muriate of potash = 50. Kg. and zinc sulphate 25 kg   Use per hectare.","MADHYA PRADESH","BHOPAL","BERASIA                                           ","2014-08-08 18:11:41.000"
"","HORTICULTURE","Vegetables","Pea (Vegetable)","","seed rate of pea crop?","Seed rate
The optimum seed rate is 25 kg/ha.","MADHYA PRADESH","BHOPAL","BERASIA                                           ","2014-08-08 19:09:14.000"
"","AGRICULTURE","Others","Others","Market Information","I want number resister in mandi rate ?","please contact your block technical manager officers","MADHYA PRADESH","BHOPAL","BERASIA                                           ","2014-08-08 19:12:35.000"
"JAYAD","HORTICULTURE","Fruits","Pomegranate","	Plant Protection	","farmer want to know information about control of flower and fruit drop ?","to control of flower and fruit drop spray planofix 5 ml per pump","MADHYA PRADESH","BHOPAL","PHANDA                                            ","2014-08-09 06:58:40.000"
"","AGRICULTURE","Pulses","Green Gram (Moong Bean/ Moong)","	Plant Protection	","How to control weeds in moong crop?","emejhathayper 250 ml per acar for broad leaf weeds","MADHYA PRADESH","BHOPAL","BERASIA                                           ","2014-08-09 09:32:06.000"
"JAYAD","AGRICULTURE","Oilseeds","Soybean (bhat)","	Plant Protection	","How to control weeds in soybean crop?","When your crop become 15 to 20 days you will be spay qugelefop ethyel 400ml per acar for narrow leaf weeds and emejhathayper 300 ml per Acer for broad leaf weeds.","MADHYA PRADESH","BHOPAL","BERASIA                                           ","2014-08-09 09:44:28.000"
"JAYAD","AGRICULTURE","Oilseeds","Soybean (bhat)","Nutrient Management","fertilizer  soyabean ?","apply 44 kg + urea + ssp-375 kg + mop-34 kg / hectare .","MADHYA PRADESH","BHOPAL","BERASIA                                           ","2014-08-09 10:32:31.000"
"JAYAD","AGRICULTURE","Pulses","Black Gram (urd bean)","Seeds","Farmer wants to know about varieties of urd crop?","T-9, panth-u-30, khargone-3, basant bahar, Jawahar urd-2, jawahar urd-3, TPU-4 are urd verities.","MADHYA PRADESH","BHOPAL","BERASIA                                           ","2014-08-09 12:05:01.000"
"JAYAD","AGRICULTURE","Others","Others","Weather","Farmer want to know information about weather forcast?","DAY-1               DAY-2               DAY-3               DAY-4               DAY-5
                              10/08               11/08               12/08               13/08               14/08
------------------- ------------------- ------------------- ------------------- ------------------- -------------------
Rainfall (mm)                   3                   3                   3                   0                   0","MADHYA PRADESH","BHOPAL","BERASIA                                           ","2014-08-09 12:27:34.000"
"JAYAD","AGRICULTURE","Oilseeds","Soybean (bhat)","	Plant Protection	","How to control weeds in soybean crop?","When your crop become 20 to 25 days you will be spay qugelefop ethyel 400ml per acar for narrow leaf weeds and emejhathayper 300 ml per acar for broad leaf weeds","MADHYA PRADESH","BHOPAL","PHANDA                                            ","2014-08-09 12:58:05.000"
"JAYAD","AGRICULTURE","Others","Others","Weather","weather information ?","some clouds in your area","MADHYA PRADESH","BHOPAL","BERASIA                                           ","2014-08-09 13:36:33.000"
"","AGRICULTURE","Others","Others","	Plant Protection	","Which non selective herbicide use in field?","Spray Glyphosate 41% SL 100 ml per pump.","MADHYA PRADESH","BHOPAL","BERASIA                                           ","2014-08-09 14:02:38.000"
"JAYAD","AGRICULTURE","Cereals","Paddy (Dhan)","Fertilizer Use and Availability","Farmer want to know information about fertilizer doses at paddy ?","Paddy-Urea-40kg,DAP-60kg,MOP-30kg,ZInc Sulphate-10kg/acre","MADHYA PRADESH","BHOPAL","PHANDA                                            ","2014-08-09 14:43:31.000"
"JAYAD","AGRICULTURE","Oilseeds","Soybean (bhat)","Nutrient Management","Which fertilizer and nutrient give for better growth in soyabean crop?","Spray N: P: K 19:19:19 100 grams and humic acid 30 ml at 15 liter of water.","MADHYA PRADESH","BHOPAL","PHANDA                                            ","2014-08-09 15:00:06.000"
"JAYAD","HORTICULTURE","Fruits","Lemon","	Plant Protection	","how to control Black fly of lemon crop ?","Dimethoate (Rogar) @ 30 ml/pump","MADHYA PRADESH","BHOPAL","PHANDA                                            ","2014-08-09 15:57:36.000"
"","AGRICULTURE","Cereals","Paddy (Dhan)","	Plant Protection	","what is fertilizer dose of paddy crop ?","10kg/acre zinc shalphet + 40kg dap + urea 15-20kg/acre + potash 20kg/acre.","MADHYA PRADESH","BHOPAL","BERASIA                                           ","2014-08-09 16:01:57.000"
"","HORTICULTURE","Fruits","Mango","	Plant Protection	","how to control of yellowing mangoes plant ?","mencozeb 30g/pump +npk, 19-19, 100g/pump spray","MADHYA PRADESH","BHOPAL","PHANDA                                            ","2014-08-09 19:03:49.000"
"JAYAD","AGRICULTURE","Cereals","Paddy (Dhan)","	Plant Protection	","farmer want to know information about  How to control caterpillars in paddy crop?","Troijofos 40 EC 1000 Ml. / hac. Rate of spray.","MADHYA PRADESH","BHOPAL","PHANDA                                            ","2014-08-09 19:53:55.000"
"JAYAD","ANIMAL HUSBANDRY","Animal","Bovine(Cow,Buffalo)","Disease Management","for animal problems toll free no, ?","for animal toll free no,=18001801199","MADHYA PRADESH","BHOPAL","BERASIA                                           ","2014-08-09 19:58:53.000"
"","AGRICULTURE","Cereals","Paddy (Dhan)","","Which fertilizer and nutrient give for better growth in paddy crop?","Recommended for spray foliar application of IFFCO 19:19:19 water soluble fertilizer @ 100 gm/pump.","MADHYA PRADESH","BHOPAL","PHANDA                                            ","2014-08-09 21:01:01.000"
"","AGRICULTURE","Others","Others","Weather","FARMER ASKING ABOUT WEATHER INFORMATION in bhopal ?","next 5 days rainfall chances and cloud cover","MADHYA PRADESH","BHOPAL","BERASIA                                           ","2014-08-10 10:46:57.000"
"JAYAD","HORTICULTURE","Vegetables","Bhindi(Okra/Ladysfinger)","	Plant Protection	","How to control aphids in bhindi crop?","Spray imidaclorprid 17.8%SL 5 to 6 ml per pump.","MADHYA PRADESH","BHOPAL","BERASIA                                           ","2014-08-10 12:12:16.000"
"JAYAD","AGRICULTURE","Others","Others","Weather","cauliflower ready to transplanting.","Transplant 30 to 40 days old seedlings at a spacing of 45 cm.  Avoid land infected with ‘club root disease’.","MADHYA PRADESH","BHOPAL","PHANDA                                            ","2014-08-10 15:05:14.000"
"JAYAD","AGRICULTURE","Others","Others","	Plant Protection	","farmer want to know information about weatherBhopal?","chance of good rainfall for next week for dist Bhopal","MADHYA PRADESH","BHOPAL","BERASIA                                           ","2014-08-10 15:26:36.000"
"JAYAD","HORTICULTURE","Vegetables","Bitter Gourd","Nutrient Management","chilli crop fertilizer application.","Recommended Dose: 120:80:80 kg / ha","MADHYA PRADESH","BHOPAL","BERASIA                                           ","2014-08-10 15:31:33.000"
"JAYAD","AGRICULTURE","Others","Others","","RAIN FALL IN BHOPAL ?","Bhopal 1 – 3 Day Weather Forecast Summary: Moderate rain (total 10mm), heaviest on Sun night. Warm (max 29°C on Tue afternoon, min 23°C on Tue night). Mainly fresh winds","MADHYA PRADESH","BHOPAL","BERASIA                                           ","2014-08-10 17:46:09.000"
"JAYAD","AGRICULTURE","Cereals","Paddy (Dhan)","	Plant Protection	","•	How to control of fungal attack in cropand Which fertilizer and nutrient give for better growth in soyabean crop?","Mancozeb 63% + Carbendazim 12% WP 40 gram and steptrocyclin 2 gram at 15 liter of water.NPK 19:19:19  100 Gram per pump","MADHYA PRADESH","BHOPAL","PHANDA                                            ","2014-08-10 21:18:46.000"
"JAYAD","AGRICULTURE","Oilseeds","Soybean (bhat)","","Farmer want to know information about better growth of soybean ?","NPK-19:19:19 100gm/pump for better growth","MADHYA PRADESH","BHOPAL","PHANDA                                            ","2014-08-11 10:07:23.000"
"JAYAD","HORTICULTURE","Vegetables","Brinjal","	Plant Protection	","How to control soil insect  in brinjal  crop?","Apply cartap hydro chloride 7 to 10 kg at per Acer.","MADHYA PRADESH","BHOPAL","BERASIA                                           ","2014-08-11 10:20:15.000"
"JAYAD","AGRICULTURE","Cereals","Paddy (Dhan)","	Plant Protection	","fertilizer application in paddy  ?","recommended for apply fertilizer application in paddy-urea-130 kg,s.p-250  kg,m.o.p-34 kg per haqteor","MADHYA PRADESH","BHOPAL","BERASIA                                           ","2014-08-11 10:49:13.000"
"JAYAD","AGRICULTURE","Oilseeds","Soybean (bhat)","Fertilizer Use and Availability","Which fertilizer and nutrient give for better growth in soybean crop?","Spray N: P: K 19:19:19 100 grams and humic acid 30 ml at 15 liter of water.","MADHYA PRADESH","BHOPAL","PHANDA                                            ","2014-08-11 14:14:25.000"
"JAYAD","AGRICULTURE","Oilseeds","Soybean (bhat)","	Plant Protection	","farmer want to know information about  how to increase growth of  soybean?","Ans:- foliar application of IFFCO 19:19:19 water soluble fertilizer @ 100 gm/pump.","MADHYA PRADESH","BHOPAL","BERASIA                                           ","2014-08-11 14:36:30.000"
"","AGRICULTURE","Pulses","Green Gram (Moong Bean/ Moong)","Fertilizer Use and Availability","Which fertilizer and nutrient give for better growth in green graM crop?","Recommended for spray foliar application of IFFCO 19:19:19 water soluble fertilizer @ 100 gm/pump.","MADHYA PRADESH","BHOPAL","BERASIA                                           ","2014-08-11 15:10:40.000"
"","AGRICULTURE","Others","Others","","farmer want to know information about registration of market information?","you have been registered for market information from kisaan call center","MADHYA PRADESH","BHOPAL","BERASIA                                           ","2014-08-11 15:57:34.000"
"KHARIF","AGRICULTURE","Oilseeds","Soybean (bhat)","	Plant Protection	","HOW TO INCREASE GROWTH OF SOYABEAN CROP ?","0-52-34, 100G/PUMP +ZAIM GOLD 30ML/PUMP SPRAY","MADHYA PRADESH","BHOPAL","BERASIA                                           ","2014-08-19 14:57:08.453"
"KHARIF","AGRICULTURE","Others","Others","Weather","Farmer want to know about weather information  ?","Recommended for rainfall 2-5 mm during 10 days","MADHYA PRADESH","BHOPAL","BERASIA                                           ","2014-08-19 16:23:41.223"
"KHARIF","AGRICULTURE","Oilseeds","Soybean (bhat)","	Plant Protection	","Farmer want to information weed control in soyabean crop?","Spray of targa super(quezalofop ethyl)400ml/acre or persuit (imezathaper) 300 ml/acre.","MADHYA PRADESH","BHOPAL","BERASIA                                           ","2014-08-19 21:38:06.997"
"KHARIF","AGRICULTURE","Others","Others","Weather","Weather forecasting for bhopal district of Madhya Pradesh?","20/08               21/08               22/08               23/08               24/08
------------------- ------------------- ------------------- ------------------- ------------------- -------------------
Rainfall (mm)                   0                   0                   6                  12                   8","MADHYA PRADESH","BHOPAL","PHANDA                                            ","2014-08-20 10:22:04.887"
"KHARIF","AGRICULTURE","Oilseeds","Soybean (bhat)","	Plant Protection	","what is control soyabean green larvae ?","spray trizophose @ 2 ml / liter .","MADHYA PRADESH","BHOPAL","BERASIA                                           ","2014-08-20 12:06:11.620"
"KHARIF","AGRICULTURE","Pulses","Green Gram (Moong Bean/ Moong)","	Plant Protection	","white fly  control in moong ?","spray imidaclopride @ 5 ml / pump.","MADHYA PRADESH","BHOPAL","BERASIA                                           ","2014-08-20 12:07:48.877"
"KHARIF","AGRICULTURE","Others","Others","Weather","farmer wants to information of weather of Bhopal district?","DAY-1               DAY-2               DAY-3               DAY-4               DAY-5
                              21/08               22/08               23/08               24/08               25/08
Rainfall (mm)                   0                   6                  17                  11                  17
Max Temperature ( deg C)       35                  35                  33                  29                  32","MADHYA PRADESH","BHOPAL","BERASIA                                           ","2014-08-20 13:34:27.517"
"KHARIF","AGRICULTURE","Oilseeds","Soybean (bhat)","	Plant Protection	","farmer want to know information about how to control sucking pest in soybean crop?","recommended for to control sucking pest  Spray any one of the following insecticides in the initial stage of infestation 
dimethoate 30 EC 500 ml/ha 
methyl demeton 25 EC@ 500 ml/ha.","MADHYA PRADESH","BHOPAL","BERASIA                                           ","2014-08-20 14:52:02.983"
"KHARIF","AGRICULTURE","Others","Others","Weather","farmer want to know information about How to control caterpillars in soyabean crop?","Spray emamectin benjoate or corajan or fem 10 ml at 15 liter of water or indoxa carb 10 ml at 15 liter of water.","MADHYA PRADESH","BHOPAL","BERASIA                                           ","2014-08-20 19:09:28.453"
"KHARIF","AGRICULTURE","Others","Others","Weather","Weather forecasting for bhopal   district of Madhya Pradesh","rainfall  chances next 22,23,24,25 date  cloud cover","MADHYA PRADESH","BHOPAL","PHANDA                                            ","2014-08-20 19:12:09.757"
"KHARIF","AGRICULTURE","Others","Others","Weather","farmer want to know information about   weather information ?","Bhopal 1 – 3 Day Weather Forecast Summary: Light rain (total 9mm), mostly falling on Fri afternoon. Warm (max 33°C on Fri afternoon, min 26°C on Wed night). Wind will be generally light.","MADHYA PRADESH","BHOPAL","BERASIA                                           ","2014-08-20 19:41:03.620"
"KHARIF","HORTICULTURE","Vegetables","Sponge Gourd","	Plant Protection	","Leaf minoe on sponge guard what can I do for its control ?","Recommended for control of pest in sponge guard spray of Chlorepyrifos @ 35-40 ML./pump.","MADHYA PRADESH","BHOPAL","BERASIA                                           ","2014-08-21 07:15:34.300"
"KHARIF","AGRICULTURE","Others","Others","Weather","farmer want to know information about weather Bhopal?","chance of low rainfall for next week for dist Bhopal","MADHYA PRADESH","BHOPAL","BERASIA                                           ","2014-08-21 10:01:05.130"
"KHARIF","AGRICULTURE","Others","Others","Weather","farmer want to know information about weather Bhopal?","chance of low rainfall for next week for dist Bhopal","MADHYA PRADESH","BHOPAL","BERASIA                                           ","2014-08-21 10:01:09.100"
"KHARIF","HORTICULTURE","Vegetables","Bhindi(Okra/Ladysfinger)","	Plant Protection	","farmer want to know information about  How to control white fly in bhindi crop?","Spray of imidaclorprid 17.8%SL 5 to 6 ml per pump.","MADHYA PRADESH","BHOPAL","BERASIA                                           ","2014-08-21 10:17:42.803"
"KHARIF","HORTICULTURE","Vegetables","Bhindi(Okra/Ladysfinger)","	Plant Protection	","farmer want to know information about  How to control white fly in bhindi crop?","Spray of imidaclorprid 17.8%SL 5 to 6 ml per pump.","MADHYA PRADESH","BHOPAL","BERASIA                                           ","2014-08-21 10:17:45.937"
"KHARIF","AGRICULTURE","Others","Others","Weather","Farmer want to know information about weather forecast ?","22/08               23/08               24/08               25/08               26/08
------------------- ------------------- ------------------- ------------------- ------------------- -------------------
Rainfall (mm)                   3                   9                  12                   7                  12","MADHYA PRADESH","BHOPAL","BERASIA                                           ","2014-08-21 10:29:53.930"
"KHARIF","AGRICULTURE","Oilseeds","Soybean (bhat)","Fertilizer Use and Availability","which fertilizer use to increase flowering in soybean crop?","spray fentic plus @ 8-10 ml/pump.","MADHYA PRADESH","BHOPAL","BERASIA                                           ","2014-08-21 11:15:18.780"
"KHARIF","HORTICULTURE","Fruits","Orange","	Plant Protection	","how to control of Scab/Verucosis : Elsinoe fawcetti in ornage crop ?","Recommended for Mancozeb 63% + Carbendazim 12% WP 40 gram at 15 liter of water.","MADHYA PRADESH","BHOPAL","PHANDA                                            ","2014-08-21 14:42:46.030"
"KHARIF","AGRICULTURE","Others","Others","Weather","farmer  want to know information about    weather forecast ?","Bhopal 1 – 3 Day Weather Forecast Summary: Moderate rain (total 14mm), heaviest on Sat night. Warm (max 33°C on Fri afternoon, min 26°C on Sat night). Wind will be generally light","MADHYA PRADESH","BHOPAL","PHANDA                                            ","2014-08-21 16:43:26.643"
"KHARIF","AGRICULTURE","Others","Others","Weather","weather information bhopal?","possibility of rain","MADHYA PRADESH","BHOPAL","BERASIA                                           ","2014-08-21 17:34:25.457"
"KHARIF","AGRICULTURE","Oilseeds","Soybean (bhat)","	Water Management	","water management in soyabean ?","irrigate the crop of soyabean .","MADHYA PRADESH","BHOPAL","PHANDA                                            ","2014-08-21 17:59:59.480"
