"Season","Sector","Category","Crop","QueryType","QueryText","KCCAns","StateName","DistrictName","BlockName","CreatedOn"
"JAYAD","AGRICULTURE","Others","Others","Weather","Farmer  want to know information about  weather forecast ?","Bhopal 1 – 3 Day Weather Forecast Summary: Heavy rain (total 188mm), heaviest during Tue night. Warm (max 27°C on Sun afternoon, min 23°C on Tue night). Winds increasing (moderate winds from the WSW on Sun afternoon, near gales from the WSW by Wed morning).","MADHYA PRADESH","BHOPAL","BERASIA                                           ","2014-08-03 21:57:27.000"
"","AGRICULTURE","Oilseeds","Soybean (bhat)","","How to control weeds in soybean crop?","When your crop become 15 to 20 days you will be spay qugelefop ethyel 400ml per acar for narrow leaf weeds and emejhathayper 300 ml per acar for broad leaf weeds","MADHYA PRADESH","BHOPAL","BERASIA                                           ","2014-08-03 22:00:53.000"
"JAYAD","HORTICULTURE","Vegetables","Bell Pepper","	Plant Protection	","How to control flower drop problem in  crop?","Spray Planofix  4.5 % SL.@  7 Ml at 15 liter of water.","MADHYA PRADESH","BHOPAL","PHANDA                                            ","2014-08-04 07:19:02.000"
"JAYAD","AGRICULTURE","Others","Others","Weather","weather report ?","Bhopal 1 – 3 Day Weather Forecast Summary: Heavy rain (total 189mm), heaviest during Tue night. Warm (max 28°C on Mon afternoon, min 22°C on Wed night). Winds increasing (moderate winds from the W on Mon afternoon, near gales from the WSW by Wed morning).","MADHYA PRADESH","BHOPAL","BERASIA                                           ","2014-08-04 08:09:33.000"
"","HORTICULTURE","Condiments and Spices","Garlic","	Plant Protection	","Bacterial wilt control in ginger?","Recommended for  Bacterial wiltcontrol in ginger : Drenching of Copper oxychloride @ 30 g /pump","MADHYA PRADESH","BHOPAL","BERASIA                                           ","2014-08-04 09:17:15.000"
"JAYAD","AGRICULTURE","Oilseeds","Soybean (bhat)","	Plant Protection	","Farmer want to know information about control of weeds at soybean ?","Imazethapar 10% SL 300-350ml/acre or 30-35ml/pump","MADHYA PRADESH","BHOPAL","BERASIA                                           ","2014-08-04 09:49:17.000"
"JAYAD","AGRICULTURE","Oilseeds","Soybean (bhat)","	Plant Protection	","farmer want to know information about What are fertilizer doses in soyabean crop?","Urea = 44. KG., DAP = 100. Kg., Muriate of potash = 25. Kg. kg   Use per hectare.","MADHYA PRADESH","BHOPAL","BERASIA                                           ","2014-08-04 10:23:15.000"
"JAYAD","HORTICULTURE","Vegetables","Sponge Gourd","	Plant Protection	","How we control Flower drop in Crop ?","Recommended of Planofix @ 5 ML./pump for manage the Flower drop condition..","MADHYA PRADESH","BHOPAL","PHANDA                                            ","2014-08-04 10:31:29.000"
"JAYAD","AGRICULTURE","Others","Others","Nutrient Management","Which fertilizer and nutrient give for better growth in soybean crop?","Spray N: P: K 19:19:19 100 grams and humic acid 30 ml at 15 liter of water.","MADHYA PRADESH","BHOPAL","PHANDA                                            ","2014-08-04 10:38:01.000"
"JAYAD","AGRICULTURE","Pulses","Black Gram (urd bean)","Seeds","Farmer wants to know the Varieties of black gram crop?","JU-3, PDU-1, LBG-20, TAU-1, PU-19, PU-30, PU-35, JU-86, T-9, TU-98-14","MADHYA PRADESH","BHOPAL","PHANDA                                            ","2014-08-04 11:47:52.000"
"JAYAD","AGRICULTURE","Others","Others","Weather","Bhopal Weather Forecast – 10 Day (Madhya Pradesh, India)","Bhopal 1 – 3 Day Weather Forecast Summary: Heavy rain (total 189mm), heaviest during Tue night. Warm (max 28°C on Mon afternoon, min 22°C on Wed night). Winds increasing (moderate winds from the W on Mon afternoon, near gales from the WSW by Wed morning).","MADHYA PRADESH","BHOPAL","BERASIA                                           ","2014-08-04 12:11:53.000"
"JAYAD","AGRICULTURE","Oilseeds","Soybean (bhat)","	Plant Protection	","Farmer want to know information about control of weeds at soybean ?","Imazethapar 10% SL 300-350ml/acre or 30-35ml/pump","MADHYA PRADESH","BHOPAL","BERASIA                                           ","2014-08-04 12:29:18.000"
"","HORTICULTURE","Vegetables","Bhindi(Okra/Ladysfinger)","	Plant Protection	","Yellow Vein Mosaic control in bhindi?","Recommended for Yellow Vein Mosaic control in bhindi It can be controlled by application of Chlorpyriphos 2.5 ml + neem oil 2 ml lit of water.","MADHYA PRADESH","BHOPAL","PHANDA                                            ","2014-08-04 13:01:36.000"
"JAYAD","HORTICULTURE","Flowers","Marigold","	Plant Protection	","fertilizer use in marigold crop ?",": Recommended Dose of Fertilizer (RDF) is 90: 90:75kg NPK/ha. 75% RDF is applied through fertigation [Water Soluble Fertilizer (WSF) application through drip irrigation]. Water Soluble Fertilizers such as Polyfeed (19:19:19), Potassium Nitrate (13:0:45) and Urea (46% N) can be used.","MADHYA PRADESH","BHOPAL","PHANDA                                            ","2014-08-04 13:13:26.000"
"","AGRICULTURE","Others","Others","Weather","Farmar  want to  weather forecasting  information of District Bhopal","DAY-1               DAY-2               DAY-3               DAY-4               DAY-5
                              05/08               06/08               07/08               08/08               09/08
------------------- ------------------- ------------------- ------------------- ------------------- -------------------
Rainfall (mm)                  80                 104                   5                   0                   0","MADHYA PRADESH","BHOPAL","BERASIA                                           ","2014-08-04 13:13:44.000"
"JAYAD","AGRICULTURE","Oilseeds","Soybean (bhat)","Fertilizer Use and Availability","Which fertilizer and nutrient give for better growth in soybean crop?","Spray N: P: K 19:19:19 100 grams and humic acid 30 ml at 15 liter of water","MADHYA PRADESH","BHOPAL","PHANDA                                            ","2014-08-04 13:17:13.000"
"JAYAD","HORTICULTURE","Vegetables","Cabbage","Weather","Want to know about Weather forecast information of my District?","05/08               06/08               07/08               08/08               09/08
Rainfall (mm)                  80                 104                   5                   0                   0","MADHYA PRADESH","BHOPAL","PHANDA                                            ","2014-08-04 13:33:12.000"
"JAYAD","AGRICULTURE","Others","Others","	Field Preparation	","how to control all weed in field","glyphosade 100ml/pump spray","MADHYA PRADESH","BHOPAL","PHANDA                                            ","2014-08-04 14:07:20.000"
"","AGRICULTURE","Cereals","Paddy (Dhan)","","farmer want to mandi rate at youre mobile phone ?","your number at  has been activeted mandi rate facility .","MADHYA PRADESH","BHOPAL","BERASIA                                           ","2014-08-04 18:17:07.000"
"JAYAD","AGRICULTURE","Others","Others","Weather","Farmer want to know information about    weather forecast ?","Bhopal 1 – 3 Day Weather Forecast Summary: Heavy rain (total 66mm), heaviest during Mon night. Warm (max 27°C on Mon afternoon, min 22°C on Wed night). Mainly strong winds.","MADHYA PRADESH","BHOPAL","BERASIA                                           ","2014-08-04 18:50:40.000"
"JAYAD","HORTICULTURE","Fruits","Papaya","	Plant Protection	","How to control of fungal attack in papaya crop?","Use copper oxy chloride 45 gram and steptrocyclin 2 gram at 15 liter of water.","MADHYA PRADESH","BHOPAL","PHANDA                                            ","2014-08-04 19:37:15.000"
"JAYAD","AGRICULTURE","Oilseeds","Soybean (bhat)","	Plant Protection	","farmer want to know information about weed management in SOYBEAN?","for weed management in SOYBEAN spray Imazethapyr 10% SL @250-300 ml/acer as post emergense .","MADHYA PRADESH","BHOPAL","PHANDA                                            ","2014-08-05 07:45:24.000"
"","AGRICULTURE","Others","Others","Weather","Weather forecasting for bhopal district of Madhya Pradesh?","DAY-1               DAY-2               DAY-3               DAY-4               DAY-5
                              05/08               06/08               07/08               08/08               09/08
------------------- ------------------- ------------------- ------------------- ------------------- -------------------
Rainfall (mm)                  80                 104                   5                   0                   0","MADHYA PRADESH","BHOPAL","BERASIA                                           ","2014-08-05 07:54:56.000"
"JAYAD","AGRICULTURE","Oilseeds","Soybean (bhat)","	Plant Protection	","How to control weeds in soybean crop?","When your crop become 15 to 20 days you will be spay qugelefop ethyel 400ml per acar for narrow leaf weeds and emejhathayper 300 ml acar for broad leaf weeds per|","MADHYA PRADESH","BHOPAL","BERASIA                                           ","2014-08-05 09:51:50.000"
"JAYAD","HORTICULTURE","Vegetables","Ribbed Gourd (Kali Tori)","	Plant Protection	","farmer want to know information about How to control aphid in kali tori crop?","Spray of imidaclorprid 17.8%SL 5 to 6 ml per pump.","MADHYA PRADESH","BHOPAL","BERASIA                                           ","2014-08-05 10:08:47.000"
"JAYAD","AGRICULTURE","Oilseeds","Soybean (bhat)","	Plant Protection	","How to control weeds in soybean crop?","When your crop become 15 to 20 days you will be spay qugelefop ethyel 400ml per acar for narrow leaf weeds and emejhathayper 300 ml per acar for broad leaf weeds","MADHYA PRADESH","BHOPAL","BERASIA                                           ","2014-08-05 10:18:13.000"
"JAYAD","AGRICULTURE","Cereals","Paddy (Dhan)","	Plant Protection	","farmer want to know information about How to control of fungal attack in paddy crop ?","spray mencojeb + carbandazim 45 gram and steptrocyclin 2 gram at 15 liter of water","MADHYA PRADESH","BHOPAL","BERASIA                                           ","2014-08-05 10:29:23.000"
"JAYAD","AGRICULTURE","Pulses","Black Gram (urd bean)","Seeds","Farmer wants to know about varieties of urd crop?","Recommended for T-9, panth-u-30, khargone-3, basant bahar, Jawahar urd-2, jawahar urd-3, TPU-4 are urd verities.","MADHYA PRADESH","BHOPAL","BERASIA                                           ","2014-08-05 10:30:39.000"
"JAYAD","AGRICULTURE","Pulses","Black Gram (urd bean)","Seeds","Farmer wants to know about varieties of urd crop?","Recommended for T-9, panth-u-30, khargone-3, basant bahar, Jawahar urd-2, jawahar urd-3, TPU-4 are urd verities.","MADHYA PRADESH","BHOPAL","BERASIA                                           ","2014-08-05 10:31:09.000"
"JAYAD","AGRICULTURE","Pulses","Black Gram (urd bean)","Seeds","Farmer wants to know about varieties of urd crop?","Recommended for T-9, panth-u-30, khargone-3, basant bahar, Jawahar urd-2, jawahar urd-3, TPU-4 are urd verities.","MADHYA PRADESH","BHOPAL","BERASIA                                           ","2014-08-05 10:32:02.000"
"JAYAD","AGRICULTURE","Pulses","Black Gram (urd bean)","Seeds","Farmer wants to know about varieties of urd crop?","Recommended for T-9, panth-u-30, khargone-3, basant bahar, Jawahar urd-2, jawahar urd-3, TPU-4 are urd verities.","MADHYA PRADESH","BHOPAL","BERASIA                                           ","2014-08-05 10:33:04.000"
"","AGRICULTURE","Cereals","Paddy (Dhan)","Fertilizer Use and Availability","What are fertilizer doses in paddy crop?","Urea = 131. KG., DAP = 125. Kg., Muriate of potash = 50. Kg. and zinc sulphate 25 kg   Use per hectare.","MADHYA PRADESH","BHOPAL","BERASIA                                           ","2014-08-05 11:18:37.000"
"JAYAD","AGRICULTURE","Oilseeds","Soybean (bhat)","Nutrient Management","Which fertilizer and nutrient give for better growth in soyabean crop?","NPK  00:52:34  100 Gram per pump .","MADHYA PRADESH","BHOPAL","PHANDA                                            ","2014-08-05 14:26:30.000"
"JAYAD","AGRICULTURE","Pulses","Black Gram (urd bean)","	Plant Protection	","How to control weeds in urd crop?","spray of agil 35-40 ml per pump .","MADHYA PRADESH","BHOPAL","PHANDA                                            ","2014-08-05 14:29:37.000"
"JAYAD","AGRICULTURE","Others","Others","Market Information","farmer want to know information about Which fertilizer and nutrient give for better growth in paddy crop?","Spray N: P: K 19:19:19 100 grams at 15 liter of water.","MADHYA PRADESH","BHOPAL","BERASIA                                           ","2014-08-05 16:20:49.000"
"JAYAD","AGRICULTURE","Oilseeds","Soybean (bhat)","Fertilizer Use and Availability","which fertilizer and nutrient give for better growth  in soyabean crop?","Recommended for Spray N:P:K 0:52:34 @ 100 gram at 15 liter of water.","MADHYA PRADESH","BHOPAL","BERASIA                                           ","2014-08-05 16:29:24.000"
"JAYAD","AGRICULTURE","Others","Others","Weather","weather information ?","some clouds in your area","MADHYA PRADESH","BHOPAL","BERASIA                                           ","2014-08-05 17:28:43.000"
"JAYAD","AGRICULTURE","Pulses","Black Gram (urd bean)","	Field Preparation	","sowing time of urd","june july","MADHYA PRADESH","BHOPAL","BERASIA                                           ","2014-08-05 18:46:07.000"
"JAYAD","AGRICULTURE","Cereals","Paddy (Dhan)","	Plant Protection	","farmer want to know information about dose of zinc sulphatein peddy ?","dose of zinc sulphate is 10kg par acer","MADHYA PRADESH","BHOPAL","BERASIA                                           ","2014-08-06 08:15:43.000"
"JAYAD","AGRICULTURE","Others","Others","Cultural Practices","Which non selective herbicide use in field?","Spray Glyphosate 41% SL 100 ml per pump.","MADHYA PRADESH","BHOPAL","BERASIA                                           ","2014-08-06 08:16:04.000"
"JAYAD","AGRICULTURE","Others","Others","Weather","WEATHER","Rainfall (mm)                  67                   9                   0                   0                   0
Max Temperature ( deg C)       23                  24                  29                  30                  30
Min Temperature ( deg C)       22                  21                  21                  21                  22
Total cloud cover (octa)        8                   5                   3                   3                   5","MADHYA PRADESH","BHOPAL","PHANDA                                            ","2014-08-06 09:02:06.000"
"JAYAD","AGRICULTURE","Others","Others","Weather","Farmer want to know information about weather forecast ?","DAY-1               DAY-2               DAY-3               DAY-4               DAY-5
                              06/08               07/08               08/08               09/08               10/08
------------------- ------------------- ------------------- ------------------- ------------------- -------------------
Rainfall (mm)                  43                   4                   0                   0                   3","MADHYA PRADESH","BHOPAL","BERASIA                                           ","2014-08-06 09:44:21.000"
"JAYAD","AGRICULTURE","Oilseeds","Soybean (bhat)","	Plant Protection	","Want to know Weed control in Soyabean ?","Spray of Emizathyper @ 35-  ML./pump.","MADHYA PRADESH","BHOPAL","BERASIA                                           ","2014-08-06 09:46:29.000"
"JAYAD","AGRICULTURE","Oilseeds","Soybean (bhat)","	Plant Protection	","fertilizer application","????? ??? ??? ???? ?? ??? (????????) 2 ?? ????? ??? ????? ????? ?? ??? ??? ??? ????? ??? ???? ????? ??? ???? ??? 8 ???? ?????? 32 ???? ????? 8 ???? ????? ??? 8 ???? ???? ????? ??? ?????? ?? ?????? ?????? ??????? ?? ???? ?? ???? ???? ?? ???? ??? ??? ????? ?????, ?????? ???????? ?? ????? ?? ?????????? ???? ???????? ???????? ?? ????? ??? ???? 5 ?? 6 ??.??. ?? ????? ?? ????? ??????","MADHYA PRADESH","BHOPAL","BERASIA                                           ","2014-08-06 10:50:05.000"
"JAYAD","AGRICULTURE","Others","Others","Weather","weather","Rainfall (mm)                  67                   9                   0                   0                   0
Max Temperature ( deg C)       23                  24                  29                  30                  30
Min Temperature ( deg C)       22                  21                  21                  21                  22
Total cloud cover (octa)        8                   5                   3                   3                   5","MADHYA PRADESH","BHOPAL","BERASIA                                           ","2014-08-06 10:52:23.000"
"JAYAD","HORTICULTURE","Vegetables","Onion","","farmer want to know information about How to control of fungal attack in onion crop?","spray of carbandazim + mancozeb 30gm/pump.","MADHYA PRADESH","BHOPAL","BERASIA                                           ","2014-08-06 11:28:15.000"
"JAYAD","HORTICULTURE","Vegetables","Onion","	Plant Protection	","how to control dapping off ?","Treat the seeds with Trichoderma viride 4 g/kg or Pseudomonas fluorescens 10 g/kg of seed 24 hours before sowing. Apply Pseudomonas fluorescens as soil application @ 2.5 kg/ha mixed with 50 kg of FYM.  Water stagnation should be avoided and drench with Copper oxychloride at 2.5 g/lit at 4 lit/sq.m .","MADHYA PRADESH","BHOPAL","BERASIA                                           ","2014-08-06 11:45:57.000"
"JAYAD","AGRICULTURE","Oilseeds","Soybean (bhat)","	Plant Protection	","Want to know Weed control in Soyabean ?","Spray of Emizathyper @ 35-  ML./pump.","MADHYA PRADESH","BHOPAL","BERASIA                                           ","2014-08-06 12:00:33.000"
"JAYAD","HORTICULTURE","Fruits","Citrus","	Plant Protection	","How to control flower drop problem in citus crop?","Spray Planofix 4 to 5 Ml at 15 liter of water.","MADHYA PRADESH","BHOPAL","BERASIA                                           ","2014-08-06 12:13:16.000"
"","AGRICULTURE","Others","Others","Weather","Farmar  want to  weather forecasting  information of District Bhopal","DAY-1               DAY-2               DAY-3               DAY-4               DAY-5
                              07/08               08/08               09/08               10/08               11/08
------------------- ------------------- ------------------- ------------------- ------------------- -------------------
Rainfall (mm)                  21                   3                   0                   0                   0","MADHYA PRADESH","BHOPAL","BERASIA                                           ","2014-08-06 13:24:57.000"
"JAYAD","AGRICULTURE","Oilseeds","Soybean (bhat)","	Plant Protection	","Which fertilizer and nutrient give for better growth in soyabean crop?","Spray N: P: K 19:19:19 100 grams and humic acid 30 ml at 15 liter of water.","MADHYA PRADESH","BHOPAL","BERASIA                                           ","2014-08-06 13:38:25.000"
"JAYAD","HORTICULTURE","Vegetables","Cucumber","Nutrient Management","Which fertilizer and nutrient give for better growth in cucumer crop?","Spray N: P: K 19:19:19 100 grams  at 15 liter of water.","MADHYA PRADESH","BHOPAL","PHANDA                                            ","2014-08-06 14:16:49.000"
"JAYAD","HORTICULTURE","Vegetables","Cucumber","Nutrient Management","farmer want to know information about  how to increase growth of  cucumber?","Ans:- foliar application of IFFCO 19:19:19 water soluble fertilizer @ 100 gm/pump.","MADHYA PRADESH","BHOPAL","PHANDA                                            ","2014-08-06 14:20:36.000"
"","AGRICULTURE","Others","Others","Weather","Farmer want to know about weather information  ?","Recommended for rainfall 00 mm during 10 days","MADHYA PRADESH","BHOPAL","BERASIA                                           ","2014-08-06 14:28:45.000"
"JAYAD","AGRICULTURE","Cereals","Paddy (Dhan)","Fertilizer Use and Availability","Which fertilizer and nutrient give for better growth in PADDY crop?","Recommended for spray foliar application of IFFCO 19:19:19 water soluble fertilizer @ 100 gm/pump.","MADHYA PRADESH","BHOPAL","BERASIA                                           ","2014-08-06 16:06:49.000"
"JAYAD","AGRICULTURE","Cereals","Paddy (Dhan)","Fertilizer Use and Availability","Which fertilizer and nutrient give for better growth in soyabean crop?","Recommended for spray foliar application of IFFCO 19:19:19 water soluble fertilizer @ 100 gm/pump.","MADHYA PRADESH","BHOPAL","BERASIA                                           ","2014-08-06 16:54:15.000"
"","AGRICULTURE","Others","Others","Weather","farmer want to weather information of Bhopal district?","light rainfall chance in your district and weather will some cloudy at next 5 days","MADHYA PRADESH","BHOPAL","BERASIA                                           ","2014-08-06 17:52:26.000"
"JAYAD","AGRICULTURE","Oilseeds","Soybean (bhat)","	Plant Protection	","Control  narrow leaf weed in soyabean ?","????????????? ?? -?????    (????? ????) @ 300 ??.?? / ???? +??????????? ?????(???????,???????) @15 ?????  / ???? ?? ????? ?? ??? ????? ??????? ??? ????? ?? 15 ?? 25 ??? ??? ????? ???","MADHYA PRADESH","BHOPAL","BERASIA                                           ","2014-08-06 17:58:42.000"
"JAYAD","AGRICULTURE","Others","Others","Weather","weather report ?","??? ???? ?? ???? ?????
???? ??: +23°
????????: 997.8 ???????????? 
?????: +22°
???: 91.3%
????????????: 2 ????????
???? ?? 6.8. 05:30 pm
?? ???? ??? Bhopal / Bairagarh
????? ????????, Bhopal / Bairagarh >","MADHYA PRADESH","BHOPAL","BERASIA                                           ","2014-08-06 21:00:20.000"
"JAYAD","HORTICULTURE","Condiments and Spices","Ginger","	Plant Protection	","Which fertilizer and nutrient give for better growth in ginger crop?","Spray N: P: K 19:19:19 100 grams and humic acid 30 ml at 15 liter of water.","MADHYA PRADESH","BHOPAL","BERASIA                                           ","2014-08-06 21:21:44.000"
"","HORTICULTURE","Vegetables","Bitter Gourd","Nutrient Management","Which fertilizer and nutrient give for better growth in bitter gourd  crop?","Spray N: P: K 19:19:19 100 grams and humic acid 30 ml at 15 liter of water.","MADHYA PRADESH","BHOPAL","BERASIA                                           ","2014-08-06 21:22:44.000"
"","AGRICULTURE","Oilseeds","Soybean (bhat)","	Plant Protection	","weed management in soybean?","recommended for soybean weed control  apply Chlorimuon ( Kloben) @ 15 g /acre for controlling BLWs in soybean + Quizalofop ethyl ( Terga super) @ 300 ml /acre at 15 -20 day after sowing","MADHYA PRADESH","BHOPAL","BERASIA                                           ","2014-08-07 09:30:23.000"
"JAYAD","HORTICULTURE","Vegetables","Snake Gourd","	Plant Protection	","Farmer want to know information about sucking pest in snake ?","Thiomethoxam 25% WG 5gm + Acetameprid 20% SP 7gm/pump","MADHYA PRADESH","BHOPAL","BERASIA                                           ","2014-08-07 10:24:11.000"
"","AGRICULTURE","Others","Others","Market Information","mandi rate seva ?","your mobile mandi rate start","MADHYA PRADESH","BHOPAL","BERASIA                                           ","2014-08-07 11:16:28.000"
"JAYAD","AGRICULTURE","Cereals","Paddy (Dhan)","Fertilizer Use and Availability","farmer want to know information about What are fertilizer doses in paddy crop?","Urea = 131. KG., DAP = 108. Kg., Muriate of potash = 50. Kg. and zinc sulphate 25 kg   Use per hectare.","MADHYA PRADESH","BHOPAL","BERASIA                                           ","2014-08-07 11:20:47.000"
"JAYAD","AGRICULTURE","Cereals","Paddy (Dhan)","	Plant Protection	","How to control weeds in paddy crop?","Spray Nomini gold (Bispayriback sodium) 80 gram per acar.","MADHYA PRADESH","BHOPAL","BERASIA                                           ","2014-08-07 11:21:40.000"
"JAYAD","AGRICULTURE","Others","Others","Weather","Farmer Want To Know Information About Weather Forecast of Bhopal district  ?","Bhopal 1 – 3 Day Weather Forecast Summary: Light rain (total 2mm), mostly falling on Thu night. Warm (max 29°C on Sat afternoon, min 23°C on Thu morning). Winds decreasing (strong winds from the WSW on Thu morning, light winds from the WSW by Sat night).","MADHYA PRADESH","BHOPAL","BERASIA                                           ","2014-08-07 11:28:26.000"
"JAYAD","AGRICULTURE","Cereals","Paddy (Dhan)","	Field Preparation	","farmer want to know information about How to control weeds in soybean crop?","When your crop become 25 to 30 days you will be spay qugelefop ethyel 400ml per acar for narrow leaf weeds and emejhathayper 300 ml per acar for broad leaf weeds","MADHYA PRADESH","BHOPAL","BERASIA                                           ","2014-08-07 11:40:00.000"
"JAYAD","AGRICULTURE","Pulses","Bengal Gram (Gram/Chick Pea/Kabuli/Chana)","","sowing time in gram ?","??? ?? ???? ?? ??????? ??? 15 ??????? ?? 15 ?????? ??? ???? ?? ???? ?? ?????? ??? ??????? ?? ????? ?????? ?? ?? ???? ?? ?? ???? ??? ???? ?? ???? ???? ?? ??? ?? ???? ?? ??????? ?? ??? ?????? ?????","MADHYA PRADESH","BHOPAL","PHANDA                                            ","2014-08-07 11:57:21.000"
"JAYAD","AGRICULTURE","Cereals","Paddy (Dhan)","	Plant Protection	","How to control weeds in paddy crop?","Spray Nomini gold (Bispayriback sodium) 80 gram per acar.","MADHYA PRADESH","BHOPAL","PHANDA                                            ","2014-08-07 12:58:53.000"
"JAYAD","AGRICULTURE","Cereals","Paddy (Dhan)","	Plant Protection	","How to control weeds in paddy crop?","Spray whip super  300 ml per acar.","MADHYA PRADESH","BHOPAL","PHANDA                                            ","2014-08-07 13:02:40.000"
