"Season","Sector","Category","Crop","QueryType","QueryText","KCCAns","StateName","DistrictName","BlockName","CreatedOn"
"JAYAD","AGRICULTURE","Oilseeds","Soybean (bhat)","	Plant Protection	","How to control weeds in soybean crop?","When your crop become 15 to 20 days you will be spay qugelefop ethyel 400ml per acar for narrow leaf weeds and emejhathayper 300 ml acar for broad leaf weeds per|","MADHYA PRADESH","SHAJAPUR","SHAJAPUR                                          ","2014-08-08 20:27:38.000"
"JAYAD","AGRICULTURE","Oilseeds","Soybean (bhat)","	Plant Protection	","farmer want to know information about Which fertilizer and nutrient give for better growth in soyabean crop?","Spray N: P: K 19:19:19 100 grams /15 liter of water.","MADHYA PRADESH","SHAJAPUR","BAROD                                             ","2014-08-08 20:45:20.000"
"JAYAD","HORTICULTURE","Vegetables","Brinjal","	Plant Protection	","How to control caterpillars in brinjal crop?","Spray emamectin benjoate or corajan or fem 10 ml at 15 liter of water or indoxa carb 10 ml at 15 liter of water.","MADHYA PRADESH","SHAJAPUR","AGAR                                              ","2014-08-08 21:36:03.000"
"JAYAD","AGRICULTURE","Others","Others","Government Schemes","farmer want to information about govt.schemes?","for detail information please contact -r.a.e.o.","MADHYA PRADESH","SHAJAPUR","KALAPIPAL                                         ","2014-08-08 21:52:26.000"
"","AGRICULTURE","Oilseeds","Soybean (bhat)","Nutrient Management","nutrient give for better Which fertilizer and growth in soyabean crop?","Spray N: P: K 19:19:19 100 grams and humic acid 30 ml at 15 liter of water.","MADHYA PRADESH","SHAJAPUR","KALAPIPAL                                         ","2014-08-09 06:59:51.000"
"JAYAD","AGRICULTURE","Oilseeds","Soybean (bhat)","Fertilizer Use and Availability","Which fertilizer and nutrient give for better growth in soyabean crop?","Spray N: P: K 19:19:19 100 grams and humic acid 30 ml at 15 liter of water.","MADHYA PRADESH","SHAJAPUR","SHUJALPUR                                         ","2014-08-09 08:05:02.000"
"","AGRICULTURE","Oilseeds","Soybean (bhat)","Market Information","farmer want to know information about registration of market information?","you have been registered for market information from kisaan call centre.","MADHYA PRADESH","SHAJAPUR","SUSNER                                            ","2014-08-09 08:51:31.000"
"","AGRICULTURE","Pulses","Pigeon pea (red gram/arhar/tur)","	Plant Protection	","Farmer want to information about how to control of fungal attack in crop?","Use copper oxy chloride 45 gram and steptrocyclin 2 gram at 15 liter of water.
Mancozeb 63% + Carbendazim 12% WP 40 gram and steptrocyclin 2 gram at 15 liter of water.","MADHYA PRADESH","SHAJAPUR","SHUJALPUR                                         ","2014-08-09 08:52:01.000"
"JAYAD","AGRICULTURE","Oilseeds","Soybean (bhat)","Fertilizer Use and Availability","Which fertilizer and nutrient give for better growth in soybean crop?","Spray N: P: K 19:19:19 100 grams and humic acid 30 ml at 15 liter of water.","MADHYA PRADESH","SHAJAPUR","SHUJALPUR                                         ","2014-08-09 08:58:25.000"
"JAYAD","AGRICULTURE","Oilseeds","Soybean (bhat)","Fertilizer Use and Availability","Which fertilizer and nutrient give for better growth in soybean crop?","Spray N: P: K 19:19:19 100 grams and humic acid 30 ml at 15 liter of water.","MADHYA PRADESH","SHAJAPUR","SHUJALPUR                                         ","2014-08-09 09:02:56.000"
"JAYAD","ANIMAL HUSBANDRY","Animal","Bovine(Cow,Buffalo)","Animal Nutrition","What nutrition gives to our cattle?","Please contact 18001801199 numbers.","MADHYA PRADESH","SHAJAPUR","KALAPIPAL                                         ","2014-08-09 09:48:15.000"
"JAYAD","HORTICULTURE","Vegetables","Chillies","Fertilizer Use and Availability","fertilizer dose of green gram ?","Basal dose : FYM 25 t/ha, NPK 30:60:30 kg/ ha. 
                     Potassium as K2SO4 for quality improvement. Application of potassium in the form of  potassium sulphate will increase quality of chilli. 
 Top dressing : 30 kg N/ha in equal splits on 30, 60 and 90 days after planting.","MADHYA PRADESH","SHAJAPUR","SHUJALPUR                                         ","2014-08-09 09:58:47.000"
"JAYAD","AGRICULTURE","Oilseeds","Soybean (bhat)","Nutrient Management","farmer want to know information about  how to increase growth of  soybean?","Ans:- foliar application of IFFCO 19:19:19 water soluble fertilizer @ 100 gm/pump.","MADHYA PRADESH","SHAJAPUR","MOMAN BADODIA                                     ","2014-08-09 10:11:56.000"
"JAYAD","HORTICULTURE","Vegetables","Tomato","","farmer want to know information about varieties of tomato?","US Agriseeds 	US 440, Bhoomika,
Nunhems India Ltd.	Laxmi 5005
Seminis	Abhishek, Abhilash
Syngenta	No. 1195
Rasi Seeds 	Shivam, Sagar
Sinnova	Lyco
Mahyco	No. 701
Bioseed	Swadeshi
Namdhari	No. 585
Indo American	No. 2102, No. 9802","MADHYA PRADESH","SHAJAPUR","MOMAN BADODIA                                     ","2014-08-09 10:21:48.000"
"JAYAD","AGRICULTURE","Others","Others","Weather","Weather forecast ?","chance of  meadium rainfall next five days","MADHYA PRADESH","SHAJAPUR","SHUJALPUR                                         ","2014-08-09 10:21:56.000"
"JAYAD","AGRICULTURE","Oilseeds","Soybean (bhat)","	Plant Protection	","HOW TO CONTROL GURDLE BEETLE ?","Recommended for SPRAY TRYZOPHOS 40M ec @ 1 litre/hectare.","MADHYA PRADESH","SHAJAPUR","KALAPIPAL                                         ","2014-08-09 10:29:06.000"
"JAYAD","AGRICULTURE","Others","Others","Weather","rain fall in agar ?","Barod 1 – 3 Day Weather Forecast Summary: Moderate rain (total 13mm), heaviest on Sat afternoon. Warm (max 29°C on Sat afternoon, min 24°C on Sat night). Mainly fresh winds.","MADHYA PRADESH","SHAJAPUR","BAROD                                             ","2014-08-09 10:40:36.000"
"","AGRICULTURE","Others","Others","Market Information","I want number resister in mandi rate ?","please contact your block technical manager officers","MADHYA PRADESH","SHAJAPUR","SUSNER                                            ","2014-08-09 10:46:39.000"
"JAYAD","HORTICULTURE","Medicinal and Aromatic Plants","Safed Musli","	Plant Protection	","farmer want to know information about How to control of fungal attack in safed musli crop ?","spray mencojeb + carbandazim 45 gram and steptrocyclin 2 gram at 15 liter of water","MADHYA PRADESH","SHAJAPUR","AGAR                                              ","2014-08-09 11:10:31.000"
"JAYAD","AGRICULTURE","Oilseeds","Soybean (bhat)","	Plant Protection	","How to control caterpillars in soyabean crop?","Spray of Monocrotophos 36 s. L. 800 ml. / hac.
Spray of Troijofos 40 EC 1000 Ml. / hac.
Spray of Queenolfos 25 EC 1000 Ml. / hac.","MADHYA PRADESH","SHAJAPUR","SHAJAPUR                                          ","2014-08-09 11:37:21.000"
"JAYAD","AGRICULTURE","Others","Others","Weather","Farmer want to know information about  weather forecast  ?","Shajapur 1 – 3 Day Weather Forecast Summary: Heavy rain (total 31mm), heaviest during Sun night. Warm (max 28°C on Sat afternoon, min 24°C on Sat night). Mainly fresh winds.","MADHYA PRADESH","SHAJAPUR","SHUJALPUR                                         ","2014-08-09 12:09:22.000"
"JAYAD","AGRICULTURE","Oilseeds","Soybean (bhat)","	Plant Protection	","Farmer want to know information about control of pest in soybean ?","Trizophas 40% EC 300-350ml/acre or 30-35ml/pump","MADHYA PRADESH","SHAJAPUR","SHUJALPUR                                         ","2014-08-09 13:17:45.000"
"JAYAD","HORTICULTURE","Fruits","Orange","	Plant Protection	","How to control of fungal attack in orange crop?","Mancozeb 63% + Carbendazim 12% WP 40 gram and steptrocyclin 2 gram at 15 liter of water.","MADHYA PRADESH","SHAJAPUR","AGAR                                              ","2014-08-09 13:31:04.000"
"JAYAD","AGRICULTURE","Oilseeds","Soybean (bhat)","	Plant Protection	","how to improve growth ?","SPRAY NPK 19:19:19 @ 1.5 Kg dissolve in 150 litre of water.","MADHYA PRADESH","SHAJAPUR","SHAJAPUR                                          ","2014-08-09 13:34:01.000"
"JAYAD","HORTICULTURE","Vegetables","Potato","","Varieties of potato ?","Varieties 
Kufri Jyoti, Kufri Muthu, Kufri Swarna, Kufri Thangam, Kufri Malar, Kufri Soga and Kufri Giriraj are commonly cultivated.","MADHYA PRADESH","SHAJAPUR","AGAR                                              ","2014-08-09 13:43:42.000"
"JAYAD","AGRICULTURE","Oilseeds","Soybean (bhat)","	Plant Protection	","How to control weeds in soybean crop?","When your crop become 15 to 20 days you will be spay qugelefop ethyel 400ml per acar for narrow leaf weeds and emejhathayper 300 ml per acar for broad leaf weeds.or agil 200 ml/acre or patella (sodium asiflorfen +clodinafop ) 400 ml/acre","MADHYA PRADESH","SHAJAPUR","SUSNER                                            ","2014-08-09 14:14:43.000"
"JAYAD","AGRICULTURE","Oilseeds","Soybean (bhat)","	Plant Protection	","How to reduce effect of herbicide in soyabean crop?","Spray glucose 100 to 150 gram per pump.","MADHYA PRADESH","SHAJAPUR","SHUJALPUR                                         ","2014-08-09 14:18:09.000"
"JAYAD","HORTICULTURE","Fruits","Papaya","	Plant Protection	","How to control flower drop problem in soyabean crop?","Spray Plano fix 4 to 5 Ml at 15 liter of water.","MADHYA PRADESH","SHAJAPUR","SHAJAPUR                                          ","2014-08-09 14:47:42.000"
"JAYAD","AGRICULTURE","Millets","Maize (Makka)","	Plant Protection	","how to increase maize crop growth ?","npk, 19-19, 100g/pump + trajophos 40ml/pump spray","MADHYA PRADESH","SHAJAPUR","SHAJAPUR                                          ","2014-08-09 14:50:35.000"
"JAYAD","HORTICULTURE","Vegetables","Tomato","","Farmer want to know information about control of sucking pest in tomato ?","Imidachlopride 17.8% SL 50-80ml/acre or 5-7ml/pump for control of sucking pest","MADHYA PRADESH","SHAJAPUR","SHUJALPUR                                         ","2014-08-09 15:15:17.000"
"JAYAD","AGRICULTURE","Others","Others","Weather","farmer want to know information about  weather of Shajapur ?","chance of low rainfall for next week for dist Shajapur","MADHYA PRADESH","SHAJAPUR","SHAJAPUR                                          ","2014-08-09 15:16:32.000"
"JAYAD","HORTICULTURE","Vegetables","Chillies","","sucking pest problem in soybean ?","Spray of  Acetamiprid 20% SP @ 50 gm/acre.","MADHYA PRADESH","SHAJAPUR","AGAR                                              ","2014-08-09 15:36:46.000"
"JAYAD","HORTICULTURE","Vegetables","Chillies","	Plant Protection	","Farmer want to information about how to control of fungal attack in crop?","Use copper oxy chloride 45 gram and steptrocyclin 2 gram at 15 liter of water.","MADHYA PRADESH","SHAJAPUR","KALAPIPAL                                         ","2014-08-09 15:52:51.000"
"JAYAD","AGRICULTURE","Others","Others","","what is the expected date of monsoon ?","The expected date of monsoon 15-20 June.","MADHYA PRADESH","SHAJAPUR","AGAR                                              ","2014-08-09 16:19:21.000"
"","AGRICULTURE","Others","Others","Government Schemes","farmer want to know information about govt. schemes?","to know about govt. schemes please contect rural agriculture extension officer ..","MADHYA PRADESH","SHAJAPUR","SHAJAPUR                                          ","2014-08-09 16:23:32.000"
"JAYAD","HORTICULTURE","Fruits","Pomegranate","	Plant Protection	","farmer want to variety of pomegranate ?","gholka ,ganesh .","MADHYA PRADESH","SHAJAPUR","AGAR                                              ","2014-08-09 16:24:28.000"
"JAYAD","AGRICULTURE","Oilseeds","Soybean (bhat)","	Plant Protection	","How to control weeds in soybean crop?","When your crop become 15 to 20 days you will be spay qugelefop ethyel 400ml per acar for narrow leaf weeds and emejhathayper 300 ml acar for broad leaf weeds per|","MADHYA PRADESH","SHAJAPUR","SHAJAPUR                                          ","2014-08-09 16:28:20.000"
"JAYAD","AGRICULTURE","Oilseeds","Soybean (bhat)","Nutrient Management","Which fertilizer and nutrient give for better growth in soyabean crop?","NPK 19:19:19  100 Gram per pump are use and humic acid 30ml/pump","MADHYA PRADESH","SHAJAPUR","KALAPIPAL                                         ","2014-08-09 16:44:14.000"
"JAYAD","AGRICULTURE","Oilseeds","Soybean (bhat)","	Plant Protection	","farmer want to know information about  How to control caterpillars in soyabean crop?","Troijofos 40 EC 1000 Ml. / hac. Rate of spray.","MADHYA PRADESH","SHAJAPUR","SHAJAPUR                                          ","2014-08-09 16:46:01.000"
"JAYAD","AGRICULTURE","Pulses","Green Gram (Moong Bean/ Moong)","	Plant Protection	","farmer want to know information about variety of moong crop ?","Varieties  of moong :  kopargav, naval,(nirmal seeds)","MADHYA PRADESH","SHAJAPUR","KALAPIPAL                                         ","2014-08-09 16:49:34.000"
"JAYAD","HORTICULTURE","Vegetables","Onion","	Plant Protection	","farmer want to know information about How to control of fungal attack in onion crop ?","spray mencojeb + carbandazim 45 gram and steptrocyclin 2 gram at 15 liter of water","MADHYA PRADESH","SHAJAPUR","SHUJALPUR                                         ","2014-08-09 17:00:04.000"
"JAYAD","AGRICULTURE","Oilseeds","Soybean (bhat)","	Plant Protection	","farmer want to know information about How to control of fungal attack in soyabean crop ?","Use copper oxy chloride  50% w  45 gram and steptrocyclin  90% w/w 2 gram at 15 liter of water","MADHYA PRADESH","SHAJAPUR","KALAPIPAL                                         ","2014-08-09 17:05:17.000"
"JAYAD","AGRICULTURE","Oilseeds","Soybean (bhat)","	Plant Protection	","Which fertilizer and nutrient give for better growth in soyabean crop?","Spray N: P: K 19:19:19 100 grams and humic acid 30 ml at 15 liter of water.","MADHYA PRADESH","SHAJAPUR","SHUJALPUR                                         ","2014-08-09 17:06:37.000"
"JAYAD","AGRICULTURE","Pulses","Pigeon pea (red gram/arhar/tur)","	Plant Protection	","farmer want to know information about How to control of fungal attack in pigeon pea crop ?","spray mencojeb + carbandazim 45 gram and steptrocyclin 2 gram at 15 liter of water","MADHYA PRADESH","SHAJAPUR","KALAPIPAL                                         ","2014-08-09 17:07:06.000"
"JAYAD","HORTICULTURE","Condiments and Spices","Coriander","Nutrient Management","Which fertilizer and nutrient give for better growth in coriander crop?","Spray N: P: K 19:19:19 100 grams and humic acid 30 ml at 15 liter of water.","MADHYA PRADESH","SHAJAPUR","SHUJALPUR                                         ","2014-08-09 17:07:26.000"
"JAYAD","AGRICULTURE","Others","Others","Weather","Farmer want to know information about    weather forecast  ?","10/08               11/08               12/08               13/08               14/08
------------------- ------------------- ------------------- ------------------- ------------------- -------------------
Rainfall (mm)                   0                   0                   0                   0                   0","MADHYA PRADESH","SHAJAPUR","SHUJALPUR                                         ","2014-08-09 17:11:35.000"
"JAYAD","HORTICULTURE","Vegetables","Tomato","	Plant Protection	","Farmer want to information about how to control of fungal attack in crop?","Use copper oxy chloride 45 gram and steptrocyclin 2 gram at 15 liter of water.","MADHYA PRADESH","SHAJAPUR","SHUJALPUR                                         ","2014-08-09 17:22:35.000"
"JAYAD","AGRICULTURE","Oilseeds","Soybean (bhat)","	Plant Protection	","soyabean green larvae ?","spray trizophose @ 2 ml / liter .","MADHYA PRADESH","SHAJAPUR","SHUJALPUR                                         ","2014-08-09 17:35:55.000"
"JAYAD","HORTICULTURE","Vegetables","Onion","Cultural Practices","onion varieties -","Nashik red, Pusa Ratnar, Agri found Dark Red.","MADHYA PRADESH","SHAJAPUR","SHUJALPUR                                         ","2014-08-09 17:39:20.000"
"JAYAD","HORTICULTURE","Fruits","Orange","	Plant Protection	","farmer want to know information about how to drop flower of orange?","to drop flower of orange spray urea @1.5-2kg /pump.","MADHYA PRADESH","SHAJAPUR","SHUJALPUR                                         ","2014-08-09 17:43:29.000"
"JAYAD","AGRICULTURE","Oilseeds","Soybean (bhat)","Nutrient Management","Farmer want to know information about better growth of soybean ?","Boom Flower/Miracle-300ml/acre or 25-30ml/pump","MADHYA PRADESH","SHAJAPUR","SUSNER                                            ","2014-08-09 17:48:20.000"
"JAYAD","HORTICULTURE","Vegetables","Chillies","	Plant Protection	","farmer want to know information about How to control thrip in chilly crop   ?","Ans. – sprey of  fipronil 5 % sc 250ml. per acre.","MADHYA PRADESH","SHAJAPUR","KALAPIPAL                                         ","2014-08-09 18:23:55.000"
"JAYAD","AGRICULTURE","Oilseeds","Soybean (bhat)","	Plant Protection	","farmer want to know information about  How to control caterpillars in crop?","Queenolfos 25 EC 1000 Ml. / hac. Rate of spray.","MADHYA PRADESH","SHAJAPUR","SHAJAPUR                                          ","2014-08-09 18:41:08.000"
"JAYAD","AGRICULTURE","Oilseeds","Soybean (bhat)","	Plant Protection	","How to control caterpillars in soyabean crop","Queenolfos 25 EC 1000 Ml. / hac. Rate of spray.","MADHYA PRADESH","SHAJAPUR","BAROD                                             ","2014-08-09 18:45:00.000"
"JAYAD","AGRICULTURE","Oilseeds","Soybean (bhat)","	Plant Protection	","farmer want to know information about  How to control caterpillars in crop?","Troijofos 40 EC 1000 Ml. / hac. Rate of spray.","MADHYA PRADESH","SHAJAPUR","KALAPIPAL                                         ","2014-08-09 18:45:25.000"
"JAYAD","AGRICULTURE","Oilseeds","Soybean (bhat)","	Plant Protection	","How to control caterpillars in soyabean crop?","spray Trizophos 40 EC 50 Ml. / pump","MADHYA PRADESH","SHAJAPUR","MOMAN BADODIA                                     ","2014-08-09 19:33:27.000"
"","AGRICULTURE","Oilseeds","Soybean (bhat)","	Plant Protection	","how to control soyabean crop pest ?","trijophos or quinolphos 30-40ml/pump spray.","MADHYA PRADESH","SHAJAPUR","KALAPIPAL                                         ","2014-08-09 19:48:39.000"
"JAYAD","AGRICULTURE","Cereals","Paddy (Dhan)","	Plant Protection	","what is fertilizer dose of paddy crop ?","10kg/acre zinc shalphet + 40kg dap + urea 15-20kg/acre + potash 20kg/acre.","MADHYA PRADESH","SHAJAPUR","SHAJAPUR                                          ","2014-08-09 19:51:20.000"
"JAYAD","AGRICULTURE","Oilseeds","Soybean (bhat)","	Plant Protection	","How to control caterpillars in soyabean crop?","Recommended for Spray of Trizophos 40 EC 1000 Ml. / hac.","MADHYA PRADESH","SHAJAPUR","SHUJALPUR                                         ","2014-08-09 19:53:11.000"
"JAYAD","AGRICULTURE","Oilseeds","Soybean (bhat)","Fertilizer Use and Availability","Which fertilizer and nutrient give for better growth in soybean crop?","Recommended for Spray N: P: K 19:19:19 100 grams and humic acid 30 ml at 15 liter of water.","MADHYA PRADESH","SHAJAPUR","SHUJALPUR                                         ","2014-08-09 19:58:00.000"
"","AGRICULTURE","Others","Others","Weather","Farmer want to know  SMS advisory IN mobile ?","Advisory on your mobile been registered successfully! Your client id is 
MDP_8216278","MADHYA PRADESH","SHAJAPUR","MOMAN BADODIA                                     ","2014-08-09 20:14:02.000"
"JAYAD","HORTICULTURE","Vegetables","Brinjal","	Plant Protection	","How to control caterpillars in brinjal crop?","Triazofos 40% EC @ 1000 Ml. / hac. Rate of spray.( 2.5ml/lit.)","MADHYA PRADESH","SHAJAPUR","AGAR                                              ","2014-08-09 20:24:36.000"
"JAYAD","AGRICULTURE","Oilseeds","Soybean (bhat)","	Plant Protection	","How to control caterpillars in soyabean crop?","Spray of Troijofos 40 EC 1000 Ml. / hac.","MADHYA PRADESH","SHAJAPUR","SHUJALPUR                                         ","2014-08-09 21:05:29.000"
"JAYAD","AGRICULTURE","Pulses","Pigeon pea (red gram/arhar/tur)","	Plant Protection	","How to control flower drop problem in pigeon pea crop?","Spray Planofix  4.5 % SL.@ 4 to 5 Ml at 15 liter of water.","MADHYA PRADESH","SHAJAPUR","KALAPIPAL                                         ","2014-08-10 06:53:18.000"
"JAYAD","AGRICULTURE","Oilseeds","Soybean (bhat)","	Plant Protection	","How to control caterpillars in soyabean crop?","Spray of Troijofos 40 EC 1000 Ml. / hac.","MADHYA PRADESH","SHAJAPUR","SHUJALPUR                                         ","2014-08-10 06:57:47.000"
"JAYAD","AGRICULTURE","Others","Others","Weather","Farmer want to know information about weather forcast?","DAY-1               DAY-2               DAY-3               DAY-4               DAY-5
                              10/08               11/08               12/08               13/08               14/08
------------------- ------------------- ------------------- ------------------- ------------------- -------------------
Rainfall (mm)                   0                   0                   0                   0                   0","MADHYA PRADESH","SHAJAPUR","SHUJALPUR                                         ","2014-08-10 07:00:33.000"
"JAYAD","AGRICULTURE","Oilseeds","Soybean (bhat)","	Plant Protection	","How to control caterpillars in soyabean crop?","????????????? 36 ??. ??. 800 ??.??/?? ?? ?? ?? ?????? ?????
?????????? 40 ?.??. 1000 ??.??./?? ?? ?? ?? ?????? ?????
?????????? 25 ?.??. 1000 ??.??./?? ?? ?? ?? ?????? ?????
??????????? 40%??? + ???????????? 4% ??? 1000 ??.??./?? ?? ?? ?? ?????? ?????","MADHYA PRADESH","SHAJAPUR","KALAPIPAL                                         ","2014-08-10 07:00:39.000"
"JAYAD","HORTICULTURE","Fruits","Orange","	Plant Protection	","How to control caterpillars in soyabean crop?","Queenolfos 25 EC 1000 Ml. / hac. Rate of spray","MADHYA PRADESH","SHAJAPUR","NALKHEDA                                          ","2014-08-10 07:03:23.000"
"JAYAD","HORTICULTURE","Fruits","Pomegranate","	Plant Protection	","farmer want to know information about flower droop in pomegrante?","spray planofix 7ml. per 15 liter of water.spray","MADHYA PRADESH","SHAJAPUR","MOMAN BADODIA                                     ","2014-08-10 07:45:21.000"
"JAYAD","AGRICULTURE","Oilseeds","Soybean (bhat)","	Plant Protection	","farmer want to know information about  How to control caterpillars in SOYABEAN crop?","Troijofos 40 EC 1000 Ml. / hac. Rate of spray.","MADHYA PRADESH","SHAJAPUR","NALKHEDA                                          ","2014-08-10 08:18:00.000"
"JAYAD","AGRICULTURE","Oilseeds","Soybean (bhat)","Fertilizer Use and Availability","Which fertilizer and nutrient give for better growth in soyabean crop?","Spray N: P: K 19:19:19 100 grams and humic acid 30 ml at 15 liter of water.","MADHYA PRADESH","SHAJAPUR","SHUJALPUR                                         ","2014-08-10 09:06:45.000"
"JAYAD","HORTICULTURE","Fruits","Mosambi","	Plant Protection	","How to control flower drop problem in  crop?","Spray Plano fix 6 Ml at 15 liter of water.","MADHYA PRADESH","SHAJAPUR","AGAR                                              ","2014-08-10 09:16:15.000"
"JAYAD","AGRICULTURE","Cereals","Paddy (Dhan)","	Plant Protection	","soyabean green larvae ?","?????? ???? ????????? @ ? ???? ????  ?????  ???? ???? ?? ????? ?? .","MADHYA PRADESH","SHAJAPUR","KALAPIPAL                                         ","2014-08-10 09:25:29.000"
"JAYAD","AGRICULTURE","Others","Others","Weather","Farmer want to know    about  weather information?","DAY-1               DAY-2               DAY-3               DAY-4               DAY-5
                              10/08               11/08               12/08               13/08               14/08
------------------- ------------------- ------------------- ------------------- ------------------- -------------------
Rainfall (mm)                   0                   0                   0                   0                   0","MADHYA PRADESH","SHAJAPUR","KALAPIPAL                                         ","2014-08-10 09:34:44.000"
"","AGRICULTURE","Others","Others","Weather","Weather forecasting for Shajapur district?","DAY-1               DAY-2               DAY-3               DAY-4               DAY-5
                              10/08               11/08               12/08               13/08               14/08
------------------- ------------------- ------------------- ------------------- ------------------- -------------------
Rainfall (mm)                   0                   0                   0                   0                   0","MADHYA PRADESH","SHAJAPUR","SHUJALPUR                                         ","2014-08-10 09:42:36.000"
"JAYAD","AGRICULTURE","Pulses","Black Gram (urd bean)","	Plant Protection	","urd weeds control >?","spray ajil @ 300 mili / acre.","MADHYA PRADESH","SHAJAPUR","AGAR                                              ","2014-08-10 10:11:09.000"
"JAYAD","AGRICULTURE","Oilseeds","Soybean (bhat)","Nutrient Management","which fertilizer and nutrient give for better growth in soybean crop?","Spray N: P: K 19:19:19 100 grams and humic acid 30 ml at 15 liter of water.","MADHYA PRADESH","SHAJAPUR","SHUJALPUR                                         ","2014-08-10 10:19:37.000"
"JAYAD","AGRICULTURE","Oilseeds","Soybean (bhat)","	Plant Protection	","Farmer want to know information about control of weeds at soybean ?","Imezathapyr 10% SL 300ml/acre or 25-30ml/pump","MADHYA PRADESH","SHAJAPUR","BAROD                                             ","2014-08-10 10:24:24.000"
