"Season","Sector","Category","Crop","QueryType","QueryText","KCCAns","StateName","DistrictName","BlockName","CreatedOn"
"KHARIF","AGRICULTURE","Oilseeds","Soybean (bhat)","	Plant Protection	","farmer want to know information about  How to control caterpillars in soybean  crop?","Monocrotophos 36 s. L. 800 ml. / hac. Rate of spray.","MADHYA PRADESH","SHAJAPUR","KALAPIPAL                                         ","2014-08-22 12:16:14.237"
"KHARIF","AGRICULTURE","Oilseeds","Soybean (bhat)","	Plant Protection	","farmer want to know information about  How to control caterpillars in soybean  crop?","Monocrotophos 36 s. L. 800 ml. / hac. Rate of spray.","MADHYA PRADESH","SHAJAPUR","KALAPIPAL                                         ","2014-08-22 12:16:15.503"
"KHARIF","AGRICULTURE","Others","Others","Weather","Farmer want to know information about  weather  forecast","22/08               23/08               24/08               25/08               26/08
------------------- ------------------- ------------------- ------------------- ------------------- -------------------
Rainfall (mm)                   0                   4                  10                  18                   8","MADHYA PRADESH","SHAJAPUR","SHAJAPUR                                          ","2014-08-22 12:18:53.427"
"KHARIF","AGRICULTURE","Others","Others","Weather","Farmer want to know information about  weather  forecast","22/08               23/08               24/08               25/08               26/08
------------------- ------------------- ------------------- ------------------- ------------------- -------------------
Rainfall (mm)                   0                   4                  10                  18                   8","MADHYA PRADESH","SHAJAPUR","SHAJAPUR                                          ","2014-08-22 12:18:55.910"
"KHARIF","AGRICULTURE","Others","Others","Weather","Farmer want to know information about  weather  forecast","22/08               23/08               24/08               25/08               26/08
------------------- ------------------- ------------------- ------------------- ------------------- -------------------
Rainfall (mm)                   0                   4                  10                  18                   8","MADHYA PRADESH","SHAJAPUR","SHAJAPUR                                          ","2014-08-22 12:18:57.917"
"KHARIF","AGRICULTURE","Others","Others","Weather","Farmer want to know information about  weather  forecast","22/08               23/08               24/08               25/08               26/08
------------------- ------------------- ------------------- ------------------- ------------------- -------------------
Rainfall (mm)                   0                   4                  10                  18                   8","MADHYA PRADESH","SHAJAPUR","SHAJAPUR                                          ","2014-08-22 12:18:59.620"
"KHARIF","AGRICULTURE","Oilseeds","Soybean (bhat)","	Plant Protection	","What Can I Do To Control In Flower Drop In SOYBEAN ?","You Can Spray Planofix 5ml/Pump To Control Flower Drop In SOYBEAN .","MADHYA PRADESH","SHAJAPUR","SHAJAPUR                                          ","2014-08-22 12:22:05.637"
"KHARIF","HORTICULTURE","Vegetables","Tomato","Fertilizer Use and Availability","How to control flower drop problem in tomato crop?","Spray Plano fix 4 to 5 Ml at 15 liter of water.","MADHYA PRADESH","SHAJAPUR","KALAPIPAL                                         ","2014-08-22 12:46:08.310"
"KHARIF","AGRICULTURE","Oilseeds","Soybean (bhat)","Fertilizer Use and Availability","weather report ?","foliar application of IFFCO 19:19:19 water soluble fertilizer @ 2kg / acar.","MADHYA PRADESH","SHAJAPUR","SHUJALPUR                                         ","2014-08-22 12:50:44.553"
"KHARIF","AGRICULTURE","Oilseeds","Soybean (bhat)","Fertilizer Use and Availability","weather report ?","foliar application of IFFCO 19:19:19 water soluble fertilizer @ 2kg / acar.","MADHYA PRADESH","SHAJAPUR","SHUJALPUR                                         ","2014-08-22 12:50:45.530"
"KHARIF","AGRICULTURE","Others","Others","Weather","Tell Me About 5 Days Weather Forecast Of  Guna  District Of M.P ?","5 Days Weather Forecast Of Indore District Of M.P:-
DAY-1     DA Y-2        DAY-3       DAY-4               DAY-5
23/06               24/05               25/06               26/06               27/06
Rainfall (mm) 0           10                   10                   18                   5","MADHYA PRADESH","SHAJAPUR","MOMAN BADODIA                                     ","2014-08-22 13:08:05.563"
"KHARIF","HORTICULTURE","Medicinal and Aromatic Plants","Aloe Vera","Cultural Practices","What is the sowing seson of Ahwagandha?",":-  The sowing season of Ashwagandha is Late kharif (September) for the better growth & the best Variety is Jawahar Ashwagandha- 20.","MADHYA PRADESH","SHAJAPUR","AGAR                                              ","2014-08-22 13:41:59.670"
"KHARIF","AGRICULTURE","Others","Others","Weather","weather information ?","light rain posibletes in next 3 days","MADHYA PRADESH","SHAJAPUR","MOMAN BADODIA                                     ","2014-08-22 14:31:50.323"
"KHARIF","AGRICULTURE","Others","Others","Weather","farmer want to know information about  weather of shajapur ?","chance of heavy rainfall next week in shajapur","MADHYA PRADESH","SHAJAPUR","AGAR                                              ","2014-08-22 15:17:03.310"
"KHARIF","AGRICULTURE","Others","Others","Weather","Farmer want to know information about  weather forecast  ?","Shajapur 1 – 3 Day Weather Forecast Summary: Moderate rain (total 12mm), heaviest on Sat night. Warm (max 33°C on Fri afternoon, min 27°C on Fri night). Wind will be generally light.","MADHYA PRADESH","SHAJAPUR","NALKHEDA                                          ","2014-08-22 15:23:19.400"
"KHARIF","AGRICULTURE","Others","Others","Weather","Farmer want to know information about    weather forecast  ?","DAY-1               DAY-2               DAY-3               DAY-4               DAY-5
                              23/08               24/08               25/08               26/08               27/08
------------------- ------------------- ------------------- ------------------- ------------------- -------------------
Rainfall (mm)                   0                  10                  10                  18                   5","MADHYA PRADESH","SHAJAPUR","SHUJALPUR                                         ","2014-08-22 15:27:37.413"
"KHARIF","AGRICULTURE","Oilseeds","Soybean (bhat)","	Plant Protection	","How to control caterpillars in soyabean crop?","Spray emamectin benjoate or corajan or fem 10 ml at 15 liter of water or indoxa carb 10 ml at 15 liter of water.","MADHYA PRADESH","SHAJAPUR","SHUJALPUR                                         ","2014-08-22 15:34:11.220"
"KHARIF","AGRICULTURE","Others","Others","Weather","Farmer want to know information about   weather forecast ?","23/08               24/08               25/08               26/08               27/08
Rainfall (mm)                   0                  10                  10                  18                   5","MADHYA PRADESH","SHAJAPUR","NALKHEDA                                          ","2014-08-22 16:19:21.893"
"KHARIF","AGRICULTURE","Oilseeds","Soybean (bhat)","	Plant Protection	","How to control girdle bettle  in soyabean crop","spray Trizophos 40 EC 40 Ml. / pump","MADHYA PRADESH","SHAJAPUR","MOMAN BADODIA                                     ","2014-08-22 16:25:50.720"
"KHARIF","AGRICULTURE","Others","Others","Weather","Farmer want to know information about        weather  farecast ?","DAY-1               DAY-2               DAY-3               DAY-4               DAY-5
                              23/08               24/08               25/08               26/08               27/08
------------------- ------------------- ------------------- ------------------- ------------------- -------------------
Rainfall (mm)                   0                  10                  10                  18                   5","MADHYA PRADESH","SHAJAPUR","SUSNER                                            ","2014-08-22 16:33:09.180"
"KHARIF","AGRICULTURE","Oilseeds","Soybean (bhat)","	Plant Protection	","How to control of fungal attack in soyabean crop?","Mancozeb 63% + Carbendazim 12% WP 40 gram and steptrocyclin 2 gram at 15 liter of water.","MADHYA PRADESH","SHAJAPUR","SHAJAPUR                                          ","2014-08-22 17:21:21.243"
"KHARIF","AGRICULTURE","Oilseeds","Soybean (bhat)","Weather","FARMER ASKING ABOUT WEATHER INFORMATION  in shajapur ?","24,25,26,27  augest chances of rainfall in district","MADHYA PRADESH","SHAJAPUR","SHUJALPUR                                         ","2014-08-22 17:25:03.197"
"KHARIF","HORTICULTURE","Fruits","Orange","	Plant Protection	","How to control of fungal attack in ORANGE  crop?","Use copper oxy chloride 45 gram and steptrocyclin 2 gram at 15 liter of water","MADHYA PRADESH","SHAJAPUR","BAROD                                             ","2014-08-22 17:50:00.593"
"KHARIF","HORTICULTURE","Fruits","Orange","	Plant Protection	","how to control of hairy catterpiller in orange crop ?","spray of indoxacarb 10-15 ml per pump .","MADHYA PRADESH","SHAJAPUR","NALKHEDA                                          ","2014-08-22 18:22:22.747"
"KHARIF","AGRICULTURE","Others","Others","Weather","Farmer want to know information about  weather forecast  ?","Shajapur 1 – 3 Day Weather Forecast Summary: Moderate rain (total 12mm), heaviest on Sat night. Warm (max 33°C on Fri afternoon, min 27°C on Fri night). Wind will be generally light.","MADHYA PRADESH","SHAJAPUR","NALKHEDA                                          ","2014-08-22 18:25:48.217"
"KHARIF","AGRICULTURE","Others","Others","Weather","Farmar  want to  weather forecasting  information of District shajapur","DAY-1               DAY-2               DAY-3               DAY-4               DAY-5
                              23/08               24/08               25/08               26/08               27/08
------------------- ------------------- ------------------- ------------------- ------------------- -------------------
Rainfall (mm)                   0                  10                  10                  18                   5","MADHYA PRADESH","SHAJAPUR","MOMAN BADODIA                                     ","2014-08-22 18:42:43.613"
"KHARIF","AGRICULTURE","Others","Others","Market Information","I want number resister in mandi rate ?","your number register in mandi rate .","MADHYA PRADESH","SHAJAPUR","AGAR                                              ","2014-08-22 19:18:38.820"
"KHARIF","AGRICULTURE","Others","Others","Weather","Farmer wants to weather forcasting","next 3 days light rain possibilits","MADHYA PRADESH","SHAJAPUR","KALAPIPAL                                         ","2014-08-22 21:43:53.970"
"KHARIF","AGRICULTURE","Others","Others","Weather","Farmer wants to weather forcasting","next 3 days light rain possibilits","MADHYA PRADESH","SHAJAPUR","KALAPIPAL                                         ","2014-08-22 21:45:03.380"
"KHARIF","AGRICULTURE","Oilseeds","Soybean (bhat)","	Plant Protection	","caterpillar control in soybean?","Recommended forcaterpillar control in soybean   Quinalphos 25 EC 30 g/pump + Neem oil 45ml/pump","MADHYA PRADESH","SHAJAPUR","KALAPIPAL                                         ","2014-08-22 21:55:46.567"
"KHARIF","AGRICULTURE","Cereals","Paddy (Dhan)","	Plant Protection	","Farmer wants to start mandi rate facility on mobile phone?","Mandi rate facility has been successfully activated on your mobile phone.","MADHYA PRADESH","SHAJAPUR","SHUJALPUR                                         ","2014-08-22 21:56:20.063"
"KHARIF","AGRICULTURE","Others","Others","Market Information","Farmer wants to start mandi rate facility on mobile phone?","Mandi rate facility has been successfully activated on your mobile phone.","MADHYA PRADESH","SHAJAPUR","MOMAN BADODIA                                     ","2014-08-22 22:09:22.093"
"KHARIF","AGRICULTURE","Others","Others","Weather","Farmar  want to  weather forecasting  information of District shajapur","DAY-1               DAY-2               DAY-3               DAY-4               DAY-5
                              23/08               24/08               25/08               26/08               27/08
------------------- ------------------- ------------------- ------------------- ------------------- -------------------
Rainfall (mm)                   0                  10                  10                  18                   5","MADHYA PRADESH","SHAJAPUR","AGAR                                              ","2014-08-23 07:51:12.830"
"KHARIF","HORTICULTURE","Vegetables","Brinjal","	Plant Protection	","farmer want to know information about How to control caterpillars in brinjal crop?","Spray emamectin benjoate or corajan or fem 10 ml at 15 liter of water or indoxa carb 10 ml at 15 liter of water.","MADHYA PRADESH","SHAJAPUR","SHUJALPUR                                         ","2014-08-23 08:29:16.063"
"KHARIF","AGRICULTURE","Oilseeds","Soybean (bhat)","	Plant Protection	","Farmer  want number activate in sms facility ?","your number is resistard in sms facility","MADHYA PRADESH","SHAJAPUR","KALAPIPAL                                         ","2014-08-23 08:41:27.683"
"KHARIF","AGRICULTURE","Oilseeds","Soybean (bhat)","	Plant Protection	","Farmer  want number activate in sms facility ?","your number is resistard in sms facility","MADHYA PRADESH","SHAJAPUR","KALAPIPAL                                         ","2014-08-23 08:41:28.987"
"KHARIF","AGRICULTURE","Oilseeds","Indian rapeseed and mustard (yellow sarson)","	Field Preparation	","farmer want to start of mandi slert sms in mobile ?","Your number has been on the market price of the messaging service.","MADHYA PRADESH","SHAJAPUR","AGAR                                              ","2014-08-23 08:48:14.913"
"KHARIF","AGRICULTURE","Oilseeds","Soybean (bhat)","	Plant Protection	","How to control caterpillars in soyabean crop?","Spray of Troijofos 40 EC 1000 Ml. / hac.","MADHYA PRADESH","SHAJAPUR","SHUJALPUR                                         ","2014-08-23 10:20:09.710"
"KHARIF","HORTICULTURE","Vegetables","Onion","	Plant Protection	","how to control of fungal attack in onion crop?","Use copper oxy chloride 45 gram and steptrocyclin 2 gram at 15 liter of water.","MADHYA PRADESH","SHAJAPUR","KALAPIPAL                                         ","2014-08-23 10:41:09.103"
"KHARIF","AGRICULTURE","Others","Others","Weather","Farmer want to know information about  weather  forecast","24/08               25/08               26/08               27/08               28/08
------------------- ------------------- ------------------- ------------------- ------------------- -------------------
Rainfall (mm)                   8                  15                   9                   7                   0","MADHYA PRADESH","SHAJAPUR","KALAPIPAL                                         ","2014-08-23 10:52:54.027"
"KHARIF","AGRICULTURE","Oilseeds","Soybean (bhat)","Fertilizer Use and Availability","how to increase growth of soybean ?","foliar application of IFFCO 19:19:19 water soluble fertilizer @ 2kg / acar.","MADHYA PRADESH","SHAJAPUR","BAROD                                             ","2014-08-23 11:13:26.197"
"KHARIF","AGRICULTURE","Oilseeds","Soybean (bhat)","Fertilizer Use and Availability","how to increase growth of soybean ?","foliar application of IFFCO 19:19:19 water soluble fertilizer @ 2kg / acar.","MADHYA PRADESH","SHAJAPUR","BAROD                                             ","2014-08-23 11:13:26.877"
"KHARIF","AGRICULTURE","Oilseeds","Brown Sarson","Weather","farmer want to know information about   weather information ?","24/08               25/08               26/08               27/08               28/08
------------------- ------------------- ------------------- ------------------- ------------------- -------------------
Rainfall (mm)                   8                  15                   9                   7                   0","MADHYA PRADESH","SHAJAPUR","SHAJAPUR                                          ","2014-08-23 11:45:30.380"
"KHARIF","AGRICULTURE","Pulses","Black Gram (urd bean)","Weather","weather forcast in shajapur?","24/08               25/08               26/08               27/08               28/08
------------------- ------------------- ------------------- ------------------- ------------------- -------------------
Rainfall (mm)                   8                  15                   9                   7                   0","MADHYA PRADESH","SHAJAPUR","SHAJAPUR                                          ","2014-08-23 12:12:21.967"
"KHARIF","HORTICULTURE","Vegetables","Onion","Market Information","Onion mandi rate ?","22/08/2014 939.7 Onion 200 1625 1125","MADHYA PRADESH","SHAJAPUR","KALAPIPAL                                         ","2014-08-23 13:09:51.603"
"KHARIF","HORTICULTURE","Vegetables","Tomato","	Plant Protection	","How we control Flower drop in Crop ?","Recommended of Planofix @ 5 ML./pump for manage the Flower drop condition..","MADHYA PRADESH","SHAJAPUR","AGAR                                              ","2014-08-23 13:39:36.200"
"KHARIF","AGRICULTURE","Others","Others","Weather","weather report ?","Shajapur 1 – 3 Day Weather Forecast Summary: Moderate rain (total 16mm), heaviest on Sat night. Warm (max 33°C on Sat afternoon, min 26°C on Sun night). Wind will be generally light.","MADHYA PRADESH","SHAJAPUR","SHUJALPUR                                         ","2014-08-23 13:42:27.430"
"KHARIF","AGRICULTURE","Others","Others","Weather","Farmer want to know information about  weather forecast  ?","Shajapur 1 – 3 Day Weather Forecast Summary: Moderate rain (total 11mm), heaviest on Sat afternoon. Warm (max 34°C on Sun afternoon, min 26°C on Sat night). Wind will be generally light.","MADHYA PRADESH","SHAJAPUR","AGAR                                              ","2014-08-23 14:40:41.793"
"KHARIF","AGRICULTURE","Others","Others","Weather","farmer want to know information about weather?","chance of good rainfall for next week for dist Shajapur","MADHYA PRADESH","SHAJAPUR","NALKHEDA                                          ","2014-08-23 14:48:10.390"
"KHARIF","HORTICULTURE","Vegetables","Onion","Seeds and Planting Material","seed production onion seed crop ?","contact to raeo seed corporation company .","MADHYA PRADESH","SHAJAPUR","MOMAN BADODIA                                     ","2014-08-23 14:58:34.460"
"KHARIF","AGRICULTURE","Others","Others","Weather","Farmer wants to know information about weather forecast?","Chance of low rainfall for next five days for dist - shajapur .","MADHYA PRADESH","SHAJAPUR","SUSNER                                            ","2014-08-23 15:02:47.517"
"KHARIF","AGRICULTURE","Others","Others","Market Information","Farmer wants to start mandi rate facility on mobile phone?","Mandi rate facility has been successfully activated on your mobile phone.","MADHYA PRADESH","SHAJAPUR","MOMAN BADODIA                                     ","2014-08-23 16:12:33.497"
"KHARIF","AGRICULTURE","Others","Others","Weather","Farmer want to know information about   weather forecast ?","24/08               25/08               26/08               27/08               28/08
Rainfall (mm)                   8                  15                   9                   7                   0","MADHYA PRADESH","SHAJAPUR","MOMAN BADODIA                                     ","2014-08-23 16:18:31.577"
"KHARIF","AGRICULTURE","Others","Others","Market Information","information to sms registration","sms registration complete","MADHYA PRADESH","SHAJAPUR","AGAR                                              ","2014-08-23 16:43:20.940"
"KHARIF","AGRICULTURE","Others","Others","Weather","what is information of weather of shajapur?","what is information of weather of shajapur?","MADHYA PRADESH","SHAJAPUR","SHUJALPUR                                         ","2014-08-23 16:48:58.090"
"KHARIF","AGRICULTURE","Others","Others","Weather","farmer want to know information about weather?","chance of low rainfall for 4-5 days in  your  district","MADHYA PRADESH","SHAJAPUR","KALAPIPAL                                         ","2014-08-23 17:24:37.213"
"KHARIF","AGRICULTURE","Others","Others","Market Information","Farmer wants to start mandi rate facility on mobile phone?","Mandi rate facility has been successfully activated on your mobile phone.","MADHYA PRADESH","SHAJAPUR","MOMAN BADODIA                                     ","2014-08-23 17:38:02.030"
"KHARIF","AGRICULTURE","Others","Others","Weather","farmer wants to information of weather of shajapur district?","DAY-1               DAY-2               DAY-3               DAY-4               DAY-5
                              24/08               25/08               26/08               27/08               28/08
Rainfall (mm)                   8                  15                   9                   7                   0
Max Temperature ( deg C)       35                  34                  35                  33                  32","MADHYA PRADESH","SHAJAPUR","MOMAN BADODIA                                     ","2014-08-23 17:53:59.197"
"KHARIF","AGRICULTURE","Others","Others","Weather","Farmer want to know information about    weather forecast  ?","Shajapur 1 – 3 Day Weather Forecast Summary: Moderate rain (total 11mm), heaviest on Sat afternoon. Warm (max 34°C on Sun afternoon, min 26°C on Sat night). Wind will be generally light.","MADHYA PRADESH","SHAJAPUR","SHAJAPUR                                          ","2014-08-23 17:56:54.937"
"KHARIF","AGRICULTURE","Oilseeds","Soybean (bhat)","	Plant Protection	","farmer want to know information about How to control of fungal attack in soyabean crop ?","spray mencojeb + carbandazim 45 gram and steptrocyclin 2 gram at 15 liter of water","MADHYA PRADESH","SHAJAPUR","SHUJALPUR                                         ","2014-08-23 18:27:37.523"
"KHARIF","AGRICULTURE","Others","Others","Weather","Farmer want to know information about   weather forecast ?","24/08               25/08               26/08               27/08               28/08
Rainfall (mm)                   8                  15                   9                   7                   0","MADHYA PRADESH","SHAJAPUR","AGAR                                              ","2014-08-23 18:55:11.190"
"KHARIF","HORTICULTURE","Vegetables","Tomato","	Plant Protection	","Farmer want to know information about    
fungal attack in tomato ?","Mancozeb 63% + Carbendazim 12% WP 40 gram and steptrocyclin 2 gram at 15 liter of water.","MADHYA PRADESH","SHAJAPUR","SHAJAPUR                                          ","2014-08-23 19:08:19.077"
"KHARIF","AGRICULTURE","Others","Others","Weather","Farmer want to know information about  weather forecast  ?","Shajapur 1 – 3 Day Weather Forecast Summary: Moderate rain (total 11mm), heaviest on Sat afternoon. Warm (max 34°C on Sun afternoon, min 26°C on Sat night). Wind will be generally light.","MADHYA PRADESH","SHAJAPUR","MOMAN BADODIA                                     ","2014-08-23 19:20:47.947"
"KHARIF","HORTICULTURE","Condiments and Spices","Garlic","Market Information","mandi bhav garlic","Piplya	300	Tonnes	NR	Other	FAQ	700	7400	4125","MADHYA PRADESH","SHAJAPUR","SHUJALPUR                                         ","2014-08-23 20:26:37.127"
"KHARIF","AGRICULTURE","Oilseeds","Soybean (bhat)","	Plant Protection	","farmer want to know information about  How to control caterpillars in soybean  crop?","Troijofos 40 EC 1000 Ml. / hac. Rate of spray.","MADHYA PRADESH","SHAJAPUR","MOMAN BADODIA                                     ","2014-08-24 07:38:40.727"
"KHARIF","AGRICULTURE","Oilseeds","Soybean (bhat)","	Plant Protection	","farmer want to know information about  How to control caterpillars in  soyabean crop?","Troijofos 40 EC 1000 Ml. / hac. Rate of spray.","MADHYA PRADESH","SHAJAPUR","MOMAN BADODIA                                     ","2014-08-24 09:11:59.913"
"KHARIF","HORTICULTURE","Vegetables","Chillies","	Plant Protection	","How to control white fly in soyabean crop?","Spray Dimethoate 30%EC (Rogar) 40 ml per pump.","MADHYA PRADESH","SHAJAPUR","KALAPIPAL                                         ","2014-08-24 09:34:31.657"
"KHARIF","AGRICULTURE","Others","Others","Weather","Farmer wants to know information about  weather  forecast ?","Shajapur 1 – 3 Day Weather Forecast Summary: Light rain (total 6mm), mostly falling on Sun afternoon. Warm (max 33°C on Mon afternoon, min 26°C on Mon night). Wind will be generally light.","MADHYA PRADESH","SHAJAPUR","KALAPIPAL                                         ","2014-08-24 09:38:38.857"
"KHARIF","AGRICULTURE","Others","Others","Weather","Want to know about Weather forecast information of my District?","25/08               26/08               27/08               28/08               29/08
Rainfall (mm)                   8                   0                   4                   7                   8","MADHYA PRADESH","SHAJAPUR","AGAR                                              ","2014-08-24 10:46:29.610"
"KHARIF","AGRICULTURE","Others","Others","Nutrient Management","farmer want to know information about How to control flower drop problem in ORANGE?","Spray Plano fix 4 to 5 Ml at 15 liter of water.","MADHYA PRADESH","SHAJAPUR","SUSNER                                            ","2014-08-24 11:31:30.867"
