"Season","Sector","Category","Crop","QueryType","QueryText","KCCAns","StateName","DistrictName","BlockName","CreatedOn"
"JAYAD","AGRICULTURE","Cereals","Paddy (Dhan)","Fertilizer Use and Availability","What are fertilizer doses in paddy crop?","Recommended for Urea = 131. KG., DAP = 108. Kg., Muriate of potash = 50. Kg. and zinc sulphate 25 kg   Use per hectare.","MADHYA PRADESH","SINGRAULI","DEOSAR                                            ","2014-08-09 14:17:00.000"
"JAYAD","HORTICULTURE","Vegetables","Sponge Gourd","	Plant Protection	","control of pumpkin beetle ?","Recommended for Spray Dimethoate 30%EC (Rogar) 40 ml per pump.","MADHYA PRADESH","SINGRAULI","RAMPUR NAIKIN                                     ","2014-08-09 19:40:01.000"
"JAYAD","AGRICULTURE","Oilseeds","Soybean (bhat)","	Plant Protection	","weeds control in soyabean > ?","spray pursuit @ 300 ml / acre","MADHYA PRADESH","SINGRAULI","DEOSAR                                            ","2014-08-10 10:57:28.000"
"JAYAD","AGRICULTURE","Cereals","Paddy (Dhan)","Nutrient Management","What are fertilizer doses in paddy crop?","Urea = 131. KG., DAP = 108. Kg., Muriate of potash = 50. Kg. and zinc sulphate 25 kg   Use per hectare.","MADHYA PRADESH","SINGRAULI","RAMPUR NAIKIN                                     ","2014-08-10 11:10:36.000"
"JAYAD","HORTICULTURE","Vegetables","Cauliflower","Seeds and Planting Material","farmer want to variety of cauliflower crop ?","namdhari seeds greeshma ,ns 120 ,atisigra ,Savita  ,Kamya F1 ,Snow Peak (029).","MADHYA PRADESH","SINGRAULI","SIDHI                                             ","2014-08-10 19:59:49.000"
"JAYAD","HORTICULTURE","Vegetables","Brinjal","	Plant Protection	","how to control Damping off in brinjal crop?","The disease can be controlled by seed treatment with agrosan or ceresin @2gm/kg of seed.","MADHYA PRADESH","SINGRAULI","SIDHI                                             ","2014-08-10 20:06:53.000"
"JAYAD","AGRICULTURE","Others","Others","Government Schemes","Farmer want to know information about govt scheme ?","To contact agriculture department for better information","MADHYA PRADESH","SINGRAULI","SIDHI                                             ","2014-08-10 21:18:08.000"
"JAYAD","AGRICULTURE","Cereals","Paddy (Dhan)","	Plant Protection	","How to control caterpillars in paddy crop?","Queenolfos 25 EC 1000 Ml. / hac. Rate of spray.","MADHYA PRADESH","SINGRAULI","RAMPUR NAIKIN                                     ","2014-08-10 21:36:48.000"
"JAYAD","AGRICULTURE","Cereals","Paddy (Dhan)","Nutrient Management","Which fertilizer and nutrient give for better growth in soyabean crop?","NPK 19:19:19  100 Gram per pump are use and humic acid 30ml/pump","MADHYA PRADESH","SINGRAULI","SIDHI                                             ","2014-08-11 15:27:33.000"
"KHARIF","AGRICULTURE","Pulses","Pigeon pea (red gram/arhar/tur)","	Plant Protection	","How to control flower drop problem in arhar  crop?","Recommended for Spray Plano fix 4 to 5 Ml at 15 liter of water.","MADHYA PRADESH","SINGRAULI","DEOSAR                                            ","2014-08-20 19:05:27.260"
"KHARIF","AGRICULTURE","Pulses","Pigeon pea (red gram/arhar/tur)","	Plant Protection	","How to control flower drop problem in arhar  crop?","Recommended for Spray Plano fix 4 to 5 Ml at 15 liter of water.","MADHYA PRADESH","SINGRAULI","DEOSAR                                            ","2014-08-20 19:05:28.500"
"KHARIF","AGRICULTURE","Pulses","Pigeon pea (red gram/arhar/tur)","	Plant Protection	","How to control flower drop problem in arhar  crop?","Recommended for Spray Plano fix 4 to 5 Ml at 15 liter of water.","MADHYA PRADESH","SINGRAULI","DEOSAR                                            ","2014-08-20 19:05:29.683"
"KHARIF","AGRICULTURE","Pulses","Pigeon pea (red gram/arhar/tur)","	Plant Protection	","How to control flower drop problem in arhar  crop?","Recommended for Spray Plano fix 4 to 5 Ml at 15 liter of water.","MADHYA PRADESH","SINGRAULI","DEOSAR                                            ","2014-08-20 19:05:31.020"
"KHARIF","AGRICULTURE","Others","Others","Weather","WEATHER INFORMATION ?","chance of light  rainfall next five days .","MADHYA PRADESH","SINGRAULI","DEOSAR                                            ","2014-08-20 20:26:51.260"
"KHARIF","AGRICULTURE","Others","Others","Government Schemes","About govt. scheme ?","please contact RAEO/ADO for more information ..","MADHYA PRADESH","SINGRAULI","DEOSAR                                            ","2014-08-21 13:35:42.847"
"KHARIF","AGRICULTURE","Others","Others","Weather","Farmer want to weather inforecast ?","your district rainfall 27aug-  4 mm ,28aug  - 8 mm ,29 aug  -  4 mm.","MADHYA PRADESH","SINGRAULI","WAIDHAN                                           ","2014-08-21 15:46:04.657"
"KHARIF","AGRICULTURE","Others","Others","Weather","Farmer want to weather inforecast ?","your district rainfall 27aug-  4 mm ,28aug  - 8 mm ,29 aug  -  4 mm.","MADHYA PRADESH","SINGRAULI","WAIDHAN                                           ","2014-08-21 15:46:22.270"
"KHARIF","AGRICULTURE","Others","Others","Weather","Farmer want to weather inforecast ?","your district rainfall 27aug-  4 mm ,28aug  - 8 mm ,29 aug  -  4 mm.","MADHYA PRADESH","SINGRAULI","WAIDHAN                                           ","2014-08-21 15:46:24.703"
"KHARIF","AGRICULTURE","Others","Others","	Water Management	","Solar Pumping Systems","Solar Pumping Systems 900mah 1 hp motar","MADHYA PRADESH","SINGRAULI","DEOSAR                                            ","2014-08-22 17:22:42.360"
"RABI","AGRICULTURE","Sugar and Starch Crops","Sugarcane (Noble Cane)","","about information sowing time sugarcane ?","????? ?? ???? ??????? ???? ?? ??? ????????? ??? ??????? - ?????? ?? ? ???? ????? ????? ????? - ????? ??? ????? ????? ?","MADHYA PRADESH","SINGRAULI","WAIDHAN                                           ","2014-08-23 08:20:04.280"
"JAYAD","AGRICULTURE","Millets","Common Millet (Panivaragu/Chena/Proso Millet/Hogm","Weather","weather forcast in singroli?","24/08               25/08               26/08               27/08               28/08
------------------- ------------------- ------------------- ------------------- ------------------- -------------------
Rainfall (mm)                   0                   0                   0                   0                  39","MADHYA PRADESH","SINGRAULI","CHITRANGI                                         ","2014-08-23 12:28:53.973"
"KHARIF","AGRICULTURE","Cereals","Paddy (Dhan)","Government Schemes","What is the fertilizer dose of transplanted rice?","Basal application of DAP 50kg/acer, Urea 10kg/acer & MOP 10kg/acer.Top dressing of Urea 12kg- 12kg after 30 & 50DAT at tellering & flage leaf stage of the plant.","MADHYA PRADESH","SINGRAULI","WAIDHAN                                           ","2014-08-23 13:50:38.707"
"KHARIF","AGRICULTURE","Cereals","Paddy (Dhan)","	Plant Protection	","Q.- farmer want to know information about blast attack of paddy?","Ans.- spray tricyclazole 75% wp 200gm. per acre","MADHYA PRADESH","SINGRAULI","CHITRANGI                                         ","2014-08-23 16:29:58.913"
"KHARIF","AGRICULTURE","Cereals","Oats ","	Field Preparation	","control of caterpilar in til ?","Spraying of  Quinalphos 25 EC 50 ml/pump","MADHYA PRADESH","SINGRAULI","DEOSAR                                            ","2014-08-24 10:06:08.600"
"KHARIF","AGRICULTURE","Cereals","Paddy (Dhan)","	Plant Protection	","farmer want to know information about  How to control caterpillars in paddy crop?","Monocrotophos 36 s. L. 800 ml. / hac. Rate of spray.","MADHYA PRADESH","SINGRAULI","CHITRANGI                                         ","2014-08-24 10:53:43.073"
"KHARIF","HORTICULTURE","Vegetables","Potato","Seeds and Planting Material","Allu ki variety","Kufri chandramukhi","MADHYA PRADESH","SINGRAULI","CHITRANGI                                         ","2014-08-24 15:49:28.020"
"KHARIF","AGRICULTURE","Others","Others","Weather","Farmer want to know about weather information  ?","Recommended for rainfall 00 mm during 10 days","MADHYA PRADESH","SINGRAULI","DEOSAR                                            ","2014-08-24 20:40:12.243"
"KHARIF","AGRICULTURE","Cereals","Wheat","Storage","Which chemical is use against to store grain pest","Use E.D.B. injection 3 ml/quintal of seed","MADHYA PRADESH","SINGRAULI","DEOSAR                                            ","2014-08-25 06:51:05.173"
"KHARIF","HORTICULTURE","Vegetables","Tomato","Weather","how to control ginger crop  fungal tomato ?","mencozeb 30-40g/pump +streptocyclin 2g/pump spray","MADHYA PRADESH","SINGRAULI","CHITRANGI                                         ","2014-08-25 06:53:42.330"
"KHARIF","AGRICULTURE","Others","Others","Weather","farmer want to know information about  weather of singrauli  ?","chance of low rainfall for next week  dist singrauli","MADHYA PRADESH","SINGRAULI","WAIDHAN                                           ","2014-08-25 12:00:49.923"
"KHARIF","AGRICULTURE","Others","Others","Weather","Farmer want to know information about weather forecast ?","DAY-1               DAY-2               DAY-3               DAY-4               DAY-5
                              26/08               27/08               28/08               29/08               30/08
------------------- ------------------- ------------------- ------------------- ------------------- -------------------
Rainfall (mm)                   0                   3                   4                   5                  10","MADHYA PRADESH","SINGRAULI","WAIDHAN                                           ","2014-08-25 19:48:32.427"
"KHARIF","AGRICULTURE","Others","Others","	Field Preparation	","Agriculture government schemes information?","Please contact your RAEO.","MADHYA PRADESH","SINGRAULI","CHITRANGI                                         ","2014-08-26 11:01:46.333"
"KHARIF","AGRICULTURE","Cereals","Paddy (Dhan)","	Plant Protection	","How to control stem borer in paddy crop?","Apply cartap hydro chloride 7 to 10 kg at per Acer.","MADHYA PRADESH","SINGRAULI","WAIDHAN                                           ","2014-08-26 12:39:47.330"
"KHARIF","HORTICULTURE","Vegetables","Summer Squash (Vegetable Marrow)","Fertilizer Use and Availability","Fertilizer dose at Sugar Beet ?","Fertigation requirement: 120:160:100kg / ha","MADHYA PRADESH","SINGRAULI","DEOSAR                                            ","2014-08-27 09:00:38.127"
"KHARIF","HORTICULTURE","Vegetables","Cabbage","Seeds and Planting Material","CABBAGE VARIETIES ?","HYBRIDS	Hyb. King,Hyb. Super Express,Hyb New GreenBall
VARIETIES	GOLDEN ACRA, PRIDE OF INDIA","MADHYA PRADESH","SINGRAULI","DEOSAR                                            ","2014-08-28 11:39:12.177"
