"Season","Sector","Category","Crop","QueryType","QueryText","KCCAns","StateName","DistrictName","BlockName","CreatedOn"
"KHARIF","HORTICULTURE","Vegetables","Potato","Seeds and Planting Material","INFORMATION REGARDING FOR THE SOWING TIME OF POTATO(ALOO)?","THE SOWING TIME OF POTATO(ALOO)-FIRST SOWING-LAST WEEK OF SEP. TO MID OCT. & SECOND SOWING-FORTNIGHT OF JANUARY.","CHANDIGARH","CHANDIGARH","CHANDIGARH                                        ","2014-09-07 07:54:04.613"
"KHARIF","AGRICULTURE","Cereals","Paddy (Dhan)","	Plant Protection	","INFORMATION  REGARDING CONTROL OF SHEATH BLIGHT IN PADDY?","SPRAY TILT @ 200 ML IN 200 LITERS WATER/ACRE.","CHANDIGARH","CHANDIGARH","CHANDIGARH                                        ","2014-09-10 16:42:32.730"
"KHARIF","AGRICULTURE","Others","Others","Weather","INFORMATION REGARDING  WEATHER ?","TODAY THERE ARE SOME CHANCES OF RAINFALL","CHANDIGARH","CHANDIGARH","CHANDIGARH                                        ","2014-09-10 17:59:04.040"
"KHARIF","AGRICULTURE","Cereals","Paddy (Dhan)","	Plant Protection	","INFORMATION REGARDING FOR THE CONTROL OF BROWN LEAF SPOT  DISEASE ATTACK ON PADDY(JHONA) CROP?","FOR THE CONTROL OF BROWN LEAF SPOT  DISEASE ATTACK ON PADDY, SPRAY 200 ML TILT 25 EC OR FOLICUR 25 EC IN 200 LITRE WATER PER ACRE","CHANDIGARH","CHANDIGARH","CHANDIGARH                                        ","2014-09-16 09:47:34.507"
"KHARIF","AGRICULTURE","Cereals","Paddy (Dhan)","	Plant Protection	","INFORMATION RGEARDING FOR THE CONTROL OF SHEATH BLIGHT ATTACK ON PADDY(JHONA) CROP?","SPRAY 200 ML TILT (PROPICONAZOL  25%) MIX IN 200 LITER WATER /ACER .","CHANDIGARH","CHANDIGARH","CHANDIGARH                                        ","2014-09-28 18:49:42.767"
