"Season","Sector","Category","Crop","QueryType","QueryText","KCCAns","StateName","DistrictName","BlockName","CreatedOn"
"RABI","AGRICULTURE","Cereals","Wheat","Varieties","Information regarding early sowing varieties of wheat?","Information regarding early sowing varieties of wheat?
WH-1105, WH-711, HD-2967, DPW-621, DBW-17,WHD-948,WH-1021,","HARYANA","PANCHKULA","RAIPUR RANI                                       ","2014-11-15 17:00:46.830"
"RABI","AGRICULTURE","Others","Others","Weather","Information regarding weather in panchkula ?","No clouds and no chance of rain fall, today.","HARYANA","PANCHKULA","BARWALA                                           ","2014-11-16 08:06:29.123"
"RABI","AGRICULTURE","Cereals","Wheat","Seeds","information regarding varieties of wheat ?","information regarding varieties of wheat ?
    wh-1105,whd-948,wh-711,pbw-343,hd-2967,dbw-17","HARYANA","PANCHKULA","BARWALA                                           ","2014-11-16 08:08:25.170"
"RABI","AGRICULTURE","Cereals","Wheat","Seeds","""     information regarding varieties of wheat ?
""","""     information regarding varieties of wheat ?
""
    wh-1105,whd-948,wh-711,pbw-343,hd-2967,dbw-17","HARYANA","PANCHKULA","BARWALA                                           ","2014-11-16 08:21:35.477"
"RABI","AGRICULTURE","Others","Others","Weather","Information regarding weather in panchkula ?","Today some clouds, no chances of rainfall.","HARYANA","PANCHKULA","BARWALA                                           ","2014-11-16 09:39:50.617"
"RABI","ANIMAL HUSBANDRY","Animal","Bovine(Cow,Buffalo)","Animal Breeding","Animal Husbandry Toll Free No.?","Animal Husbandry Toll Free No.?
Contact 1800-180-1184 Monday, Wednesday & Friday 10 AM-1PM.","HARYANA","PANCHKULA","BARWALA                                           ","2014-11-16 12:20:23.860"
"RABI","AGRICULTURE","Others","Others","Weather","Information regarding weather in panchkula  ?","no chances of rainfall,today.","HARYANA","PANCHKULA","MORNI                                             ","2014-11-16 16:22:41.653"
"RABI","AGRICULTURE","Cereals","Wheat","Fertilizer Use and Availability","information regarding  fertilizer dose in wheat crop ?","urea 20 kg,potash 40kg,zink 10 kg,d.a.p.50 kg/acre.","HARYANA","PANCHKULA","PINJORE                                           ","2014-11-16 16:44:33.987"
"RABI","AGRICULTURE","Others","Others","Weather","Information regarding  weather in Panchkula?","Some clouds and no chances of rainfall today.","HARYANA","PANCHKULA","BARWALA                                           ","2014-11-17 06:31:52.150"
"RABI","AGRICULTURE","Others","Others","	Plant Protection	","information regarding regarding fungal attack in potato?","spray 2gm indofil m-45 in 1 litre of water.","HARYANA","PANCHKULA","BARWALA                                           ","2014-11-17 10:06:46.490"
"RABI","AGRICULTURE","Others","Others","	Plant Protection	","information regarding regarding fungal attack in potato?","spray 2gm indofil m-45 in 1 litre of water.","HARYANA","PANCHKULA","BARWALA                                           ","2014-11-17 10:06:46.823"
"RABI","AGRICULTURE","Cereals","Wheat","Seeds","Information regarding early varieties of wheat?","WH-1105, WH-711, PBW-550, WH-542, PBW-343, DBW-17, HD-2967, DPW-621-50.","HARYANA","PANCHKULA","BARWALA                                           ","2014-11-17 10:09:23.860"
"RABI","HORTICULTURE","Vegetables","Onion","Seeds and Planting Material","information regarding for control of fungal disease in onion in nursery ?","spray of thiram @ 3gm/litre of water.","HARYANA","PANCHKULA","BARWALA                                           ","2014-11-17 11:12:24.287"
"RABI","AGRICULTURE","Cereals","Wheat","Seeds","Information regarding how to control weeds in wheat?","Spray of accord plus 500 ml in 200 liter water per acre .","HARYANA","PANCHKULA","PINJORE                                           ","2014-11-17 11:19:07.657"
"RABI","HORTICULTURE","Vegetables","Onion","	Plant Protection	","How to control fungal desease in onion crop ?","Spray 400 gm. Mencozeb in 200 lt. of water per acre.","HARYANA","PANCHKULA","RAIPUR RANI                                       ","2014-11-17 11:56:14.720"
"RABI","AGRICULTURE","Cereals","Wheat","Varieties","Information regarding early varieties of wheat?","WH-1105,WH 542, WH 711, DBW 17, PBW 343, DPW-621-50, HD-2967.","HARYANA","PANCHKULA","RAIPUR RANI                                       ","2014-11-17 12:37:52.710"
"RABI","AGRICULTURE","Others","Others","	Plant Protection	","How to control aphids in brinjal?","Spray 400 ml. malathion in 200 lt. of water per acre.","HARYANA","PANCHKULA","BARWALA                                           ","2014-11-17 13:20:29.170"
"RABI","HORTICULTURE","Fruits","Papaya","	Plant Protection	","how to control thrips in papaya ?","spray malathion @ 2 ml in 1 liter of water .","HARYANA","PANCHKULA","RAIPUR RANI                                       ","2014-11-17 14:55:51.057"
"RABI","AGRICULTURE","Cereals","Wheat","Varieties","Information regarding Improved varieties of wheat crop ?","WH-1105,WH 542, whd-902, DBW 17, PBW 343, DPW-621-50,","HARYANA","PANCHKULA","RAIPUR RANI                                       ","2014-11-17 15:03:39.110"
"RABI","AGRICULTURE","Cereals","Wheat","Varieties","Information regarding optimum sowing time of wheat?","Optimum sowing time of wheat is 25th October to End of November.","HARYANA","PANCHKULA","BARWALA                                           ","2014-11-17 15:04:03.953"
"RABI","AGRICULTURE","Others","Others","Weather","Information regarding weather in panchkula?","today some clouds, no chances of rainfall.","HARYANA","PANCHKULA","RAIPUR RANI                                       ","2014-11-17 16:15:51.853"
"RABI","AGRICULTURE","Cereals","Wheat","Seeds","Information regarding varieties of wheat?","Information regarding varieties of wheat?
WH-1105,WH 542, WH 711, DBW 17, PBW 343, DPW-621-50, HD-2967.","HARYANA","PANCHKULA","MORNI                                             ","2014-11-17 18:51:53.657"
"RABI","HORTICULTURE","Vegetables","Mushroom","Mushroom Production","Information regarding mushroom farming ?","Information regarding mushroom farming ?please cont.no.0130-2484107.","HARYANA","PANCHKULA","MORNI                                             ","2014-11-17 18:54:43.210"
"RABI","HORTICULTURE","Vegetables","Tomato","	Plant Protection	","How to control Early Blight in Tomato?","How to control Early Blight in Tomato?spray C. O. C. 400gm in 200 liter water /acre?","HARYANA","PANCHKULA","MORNI                                             ","2014-11-17 19:17:21.737"
"RABI","AGRICULTURE","Cereals","Wheat","Seeds","Information regarding varieties of wheat?","Information regarding varieties of wheat?
WH-1105,WH 542, WH 711, DBW 17, PBW 343, DPW-621-50, HD-2967.","HARYANA","PANCHKULA","PINJORE                                           ","2014-11-17 19:28:00.790"
"RABI","AGRICULTURE","Others","Others","Weather","Information regarding weather of panchkula ?","No rain fall ,some clouds today in panchkula .","HARYANA","PANCHKULA","BARWALA                                           ","2014-11-18 10:06:21.937"
"RABI","AGRICULTURE","Cereals","Wheat","Fertilizer Use and Availability","how to control white /yellow leaf of WHEAT?","how to control white /yellow, red, leaf of WHEAT ?answer:-spray 2 -3 gm megneese  salphate  or ferrous  salphate  in 1 lit  water .","HARYANA","PANCHKULA","MORNI                                             ","2014-11-19 08:55:10.447"
"RABI","HORTICULTURE","Vegetables","Potato","	Plant Protection	","How to control Early Blight in potato?","Spray 400 gm. Mencozeb in 200 lt. of water per acre","HARYANA","PANCHKULA","PINJORE                                           ","2014-11-19 17:32:46.137"
"RABI","AGRICULTURE","Cereals","Wheat","Seeds","Information regarding late varieties of wheat?","Information regarding late varieties of wheat?
HD-2851, PBW-373, PBW-658, RAJ-3765, UP-2338.","HARYANA","PANCHKULA","BARWALA                                           ","2014-11-20 08:20:31.157"
"RABI","HORTICULTURE","Vegetables","Chillies","	Plant Protection	","Information regarding sowing time of chilli nursery?","Information regarding sowing time of chilli nursery?
May-June and October-November.","HARYANA","PANCHKULA","RAIPUR RANI                                       ","2014-11-20 08:59:01.803"
"RABI","AGRICULTURE","Cereals","Wheat","	Plant Protection	","information regarding for control of mandusi in wheat  ?","information regarding for control of mandusi in wheat  : spray of pinoxaden 5EC (axial ) @ 400 ml in 200 litre of water/acre.","HARYANA","PANCHKULA","RAIPUR RANI                                       ","2014-11-20 15:55:32.947"
"RABI","HORTICULTURE","Vegetables","Radish","Bio-Pesticides and Bio-Fertilizers","How to control aphids in radish crop?","How to control aphids in radish crop?
Spray 400 ml. malathion in 200 lt. of water per acre.","HARYANA","PANCHKULA","RAIPUR RANI                                       ","2014-11-20 17:34:50.687"
"RABI","HORTICULTURE","Vegetables","Onion","Soil Testing","control of fungus in ONION?","control of fungus in bottle gourd?
spray 400 gram M-45 in 200 liter water per acre.","HARYANA","PANCHKULA","BARWALA                                           ","2014-11-20 17:54:12.250"
"RABI","HORTICULTURE","Vegetables","Onion","Bio-Pesticides and Bio-Fertilizers","How to control fungal diseases in onion crop?","How to control fungal diseases in onion crop?
Spray 800 gm. Mencozeb in 200 lt. of water per acre.","HARYANA","PANCHKULA","BARWALA                                           ","2014-11-20 19:46:09.670"
"RABI","HORTICULTURE","Vegetables","Potato","	Plant Protection	","control of fungus in potato?","control of fungus in potato?
spray 400 gram M-45 in 200 liter water per acre.","HARYANA","PANCHKULA","RAIPUR RANI                                       ","2014-11-21 08:20:46.993"
"RABI","ANIMAL HUSBANDRY","Animal","Bovine(Cow,Buffalo)","Market Information","Animal Husbandry Toll Free No.?","Animal Husbandry Toll Free No.?
Animal Husbandry Toll Free No.?1800-180-1184","HARYANA","PANCHKULA","BARWALA                                           ","2014-11-21 10:17:57.960"
"RABI","HORTICULTURE","Vegetables","Onion","	Plant Protection	","Information regarding how to control fungal disease in onion nursery?","control fungal disease in onion nursery;-spray-Bavistin@2 gram in / liter water solution,","HARYANA","PANCHKULA","BARWALA                                           ","2014-11-21 15:31:31.003"
"RABI","AGRICULTURE","Others","Others","Weather","Information regarding weather of panchkula?","Information regarding weather of panchkula? weather of panchkula are:-mostly clear and no chance of rainfall in today,","HARYANA","PANCHKULA","BARWALA                                           ","2014-11-21 16:06:21.210"
"RABI","AGRICULTURE","Others","Others","Weather","WEATHER OF PANCHKULA ?","WEATHER OF PANCHKULA ? NO CHANCE OF RAIN TODAY .","HARYANA","PANCHKULA","PINJORE                                           ","2014-11-21 16:10:57.833"
"RABI","AGRICULTURE","Others","Others","Weed Management","Information regarding control of weed in wheat ?","spray of acord plus @ 500 ml in 200 liter water/acre .","HARYANA","PANCHKULA","RAIPUR RANI                                       ","2014-11-21 17:04:21.610"
"RABI","HORTICULTURE","Vegetables","Potato","	Plant Protection	","HOW  TO  CONTROL  FUNGAL DISEASE  IN POTATO CROP ?","HOW  TO  CONTROL  FUNGAL DISEASE  IN POTATO CROP ?
spray 400gm diathen m-45  or vavistin  in 200 litre water /acre .","HARYANA","PANCHKULA","RAIPUR RANI                                       ","2014-11-21 17:46:09.790"
"RABI","AGRICULTURE","Cereals","Wheat","Cultural Practices","information regarding extra grotahin in wheat crop?","information regarding extra grotahin in wheat crop?
spray 2.5 kg urea ,500 gm zink in 100 liter water pre acre .","HARYANA","PANCHKULA","RAIPUR RANI                                       ","2014-11-22 14:17:31.447"
"RABI","AGRICULTURE","Others","Others","Weather","information regarding how to control fungal disease in onion crop ?","information regarding how to control fungal disease in onion crop ?
spray of m-45 @ 2 gm /liter of water/acre .","HARYANA","PANCHKULA","RAIPUR RANI                                       ","2014-11-22 14:48:30.327"
"RABI","HORTICULTURE","Vegetables","Onion","	Plant Protection	","imformation regarding fungal diseases in onion.?","spary:- m 45. @ 2.5 ml.in 1.liter water per/acr.?","HARYANA","PANCHKULA","MORNI                                             ","2014-11-22 15:13:18.067"
"RABI","HORTICULTURE","Vegetables","Tomato","	Plant Protection	","How to control Early Blight in Tomato?","How to control Early Blight in Tomato?
Spray 400 gm. M-45 in 200 lt. of water per acre.","HARYANA","PANCHKULA","BARWALA                                           ","2014-11-22 16:29:49.553"
"RABI","HORTICULTURE","Vegetables","Onion","Cultural Practices","Information regarding how many days after sowing 1st irrigation applied in wheat?","Information regarding how many days after sowing 1st irrigation applied in wheat?
1st irrigation applied in wheat after 22-25 nd days of sowing.","HARYANA","PANCHKULA","BARWALA                                           ","2014-11-23 08:23:10.430"
"RABI","HORTICULTURE","Vegetables","Tomato","Seeds and Planting Material","information regarding sowing time of tomato nursery?","information regarding sowing time of tomato nursery?
For winter season June-July and for spring season November-December.","HARYANA","PANCHKULA","RAIPUR RANI                                       ","2014-11-23 15:41:03.703"
"RABI","HORTICULTURE","Vegetables","Onion","	Plant Protection	","how to control fungal disease in onion ?","spray dithen m-45 @ 2 gram in 1 liter of water /acre.","HARYANA","PANCHKULA","RAIPUR RANI                                       ","2014-11-24 09:29:49.277"
"RABI","AGRICULTURE","Cereals","Wheat","Cultural Practices","How many days frist  irrigation applied in wheat crop?","25 days after sowing.","HARYANA","PANCHKULA","BARWALA                                           ","2014-11-24 10:51:32.687"
"RABI","AGRICULTURE","Others","Others","	Plant Protection	","weather of panchkula.?","weather of panchkula.? no chance of rain fall today.?","HARYANA","PANCHKULA","BARWALA                                           ","2014-11-24 11:34:10.640"
"RABI","AGRICULTURE","Cereals","Wheat","Fertilizer Use and Availability","Information regarding fertilizers doses in wheat at sowing time?","DAP 50 Kg. or SSP-150 Kg., Potash 40 Kg., 10 Kg. Zinc per acre at sowing time.","HARYANA","PANCHKULA","BARWALA                                           ","2014-11-24 12:44:37.400"
"RABI","AGRICULTURE","Cereals","Wheat","Varieties","information regarding late varieties in wheat ?","HD-2851,pbw-373,raj-3765,wh-1021,s-308,up-2338","HARYANA","PANCHKULA","BARWALA                                           ","2014-11-24 12:47:46.693"
"RABI","HORTICULTURE","Vegetables","Onion","	Plant Protection	","information regarding for control of fungal disease in onion nursery ?","spray of thiram @ 3 gm/litre of water.","HARYANA","PANCHKULA","BARWALA                                           ","2014-11-24 14:29:19.763"
"RABI","HORTICULTURE","Vegetables","Potato","	Plant Protection	","Information regarding how to control weeds in POTATO?
spray of topik @ 160 gm in 200liter water/acre .","Information regarding how to control weeds in POTATO?
spray of PERAQUET @ 300 gm in 200liter water/acre .","HARYANA","PANCHKULA","PINJORE                                           ","2014-11-24 15:18:19.910"
"RABI","HORTICULTURE","Vegetables","Potato","	Plant Protection	","information regarding for control of weeds in potato ?","spray of gremaxone @ 1 litre in 250 litre of water.","HARYANA","PANCHKULA","PINJORE                                           ","2014-11-24 15:24:39.427"
"RABI","HORTICULTURE","Vegetables","Onion","	Plant Protection	","How to control Early Blight in ONION?","How to control Early Blight in ONION?
Spray 400 gm.Indofil, M-45 in 200 lt. of water per acre.","HARYANA","PANCHKULA","BARWALA                                           ","2014-11-24 15:25:25.773"
"RABI","AGRICULTURE","Cereals","Wheat","Varieties","how to control early blight of potato?","how to control early blight of potato?
control early blight of potato are:-spray menkozeb(endophilM-45)@600-800 gram in 200 liter water per acer.","HARYANA","PANCHKULA","BARWALA                                           ","2014-11-24 15:30:26.997"
"RABI","AGRICULTURE","Cereals","Wheat","Cultural Practices","how to control fungal diseases in onion crop?","how to control fungal diseases in onion crop?
Spray 3 gm. M-45 / 1 lt. of water .","HARYANA","PANCHKULA","BARWALA                                           ","2014-11-24 16:35:57.863"
"RABI","AGRICULTURE","Others","Others","Weather","weather of panchkula ?","weather of panchkula are :- no chance of rain today .","HARYANA","PANCHKULA","BARWALA                                           ","2014-11-24 17:06:37.840"
"RABI","HORTICULTURE","Vegetables","Beans ","Training and Exposure Visits","Information regarding  GOVN TRAINING IN PANCHKULA?","Information regarding  GOVN TRAINING IN PANCHKULA?
Panchkula   	Krishi Vigyan Kendra, CCSHAU, Directorate of Agriculture, Krishi Bhawan, Sector-21,Panchkula.	 0172-2586412","HARYANA","PANCHKULA","RAIPUR RANI                                       ","2014-11-24 17:38:27.260"
"RABI","HORTICULTURE","Vegetables","Tomato","	Plant Protection	","information regarding sowing time of tomato nursery?","information regarding sowing time of tomato nursery?
For winter season June-July and for spring season November-December.","HARYANA","PANCHKULA","PINJORE                                           ","2014-11-24 18:00:07.573"
"RABI","AGRICULTURE","Others","Others","	Plant Protection	","Information regarding cont. no. of horticulture centre in panchkula ?","cont. no. of horticulture centre in panchkula :- 0172 - 6543319.","HARYANA","PANCHKULA","RAIPUR RANI                                       ","2014-11-25 07:23:29.210"
"RABI","HORTICULTURE","Medicinal and Aromatic Plants","Tulsi","	Plant Protection	","information regarding for control of blight in tulsi ?","spray of dithane m-45 @ 1gm/litre of water.","HARYANA","PANCHKULA","PINJORE                                           ","2014-11-25 08:58:32.670"
"RABI","HORTICULTURE","Vegetables","Onion","Bio-Pesticides and Bio-Fertilizers","how to control fungal diesaes in onion ?","spray 2 gram mencozab in 1 liter water .","HARYANA","PANCHKULA","PINJORE                                           ","2014-11-25 09:37:18.590"
"KHARIF","AGRICULTURE","Cereals","Wheat","	Field Preparation	","how to control deemak in wheat  crop","how to control deemak in wheat  crop
how to control deemak in wheat  crop-1-1.5 liter cloropyrophose per acre .","HARYANA","PANCHKULA","PINJORE                                           ","2014-11-25 11:46:38.520"
"RABI","AGRICULTURE","Cereals","Wheat","Seeds","Information regarding late varieties of wheat crop?","Information regarding late varieties of wheat crop?
hd-2851, hd-2894,raj-3765, sonalikaup-2338,pbw-343,","HARYANA","PANCHKULA","PINJORE                                           ","2014-11-25 15:02:28.570"
"RABI","AGRICULTURE","Cereals","Wheat","Seeds","Information regarding late varieties of wheat crop?","Information regarding late varieties of wheat crop?
hd-2851, hd-2894,raj-3765, sonalikaup-2338,pbw-343,","HARYANA","PANCHKULA","PINJORE                                           ","2014-11-25 15:08:45.157"
"RABI","HORTICULTURE","Vegetables","Onion","Bio-Pesticides and Bio-Fertilizers","How to control fungal diseases in onion crop?","How to control fungal diseases in onion crop?
Spray 50 gm. bavastin in 15 lt. of water .","HARYANA","PANCHKULA","BARWALA                                           ","2014-11-25 17:20:32.280"
"RABI","AGRICULTURE","Others","Others","	Plant Protection	","impoved varities of onion?",":- hisar-2 , pusa red , hisar payag -3.","HARYANA","PANCHKULA","BARWALA                                           ","2014-11-26 12:20:29.013"
"RABI","AGRICULTURE","Others","Others","	Plant Protection	","Information regarding soil testing ?","Contact your nearest Krishi Vigyan Kender.","HARYANA","PANCHKULA","RAIPUR RANI                                       ","2014-11-26 17:53:42.890"
"RABI","AGRICULTURE","Cereals","Wheat","Seeds","information regarding early  varieties of wheat ?","information regarding early  varieties of wheat ?
 Early varieties of wheat :-WH-1105, 711, 157,1021, 283, RAJ-3765,HD-2967 ,948,DBW-550,621, P.B.W.-343,D.B.W-17","HARYANA","PANCHKULA","BARWALA                                           ","2014-11-27 06:45:14.313"
"RABI","AGRICULTURE","Cereals","Wheat","Bio-Pesticides and Bio-Fertilizers","Information regarding how to control mixed weeds in wheat crop?","Spray 500 ml. Accord Plus in 200 lt. of water per acre to control mixed weeds in wheat crop.","HARYANA","PANCHKULA","BARWALA                                           ","2014-11-27 09:45:04.307"
"RABI","AGRICULTURE","Others","Others","Weather","Information regarding to weather in panchkula ?","Today some clouds and no  chance of ranfall.","HARYANA","PANCHKULA","RAIPUR RANI                                       ","2014-11-27 10:13:56.633"
"RABI","AGRICULTURE","Cereals","Wheat","Bio-Pesticides and Bio-Fertilizers","how to control aphids in wheat crop?","how to control aphids in wheat crop?
spray 400 ml. malathion in 200 lt. of water per acre.","HARYANA","PANCHKULA","BARWALA                                           ","2014-11-27 10:14:50.383"
"RABI","AGRICULTURE","Others","Others","Weather","weather of panchkula ?","No rain fall chance today in panchkula .","HARYANA","PANCHKULA","BARWALA                                           ","2014-11-27 10:21:44.797"
"RABI","AGRICULTURE","Others","Others","Weather","Information regarding weather in panchkula?","weather in panchkula?
Today some clouds, no chance of rainfall.","HARYANA","PANCHKULA","BARWALA                                           ","2014-11-27 10:56:11.850"
"RABI","AGRICULTURE","Others","Others","Weather","Information regarding to weather in panchkula ?","Today some clouds and no  chance of ranfall.","HARYANA","PANCHKULA","RAIPUR RANI                                       ","2014-11-27 11:13:50.670"
"RABI","HORTICULTURE","Fruits","Mango","	Plant Protection	","HOW TO CONTROL FUNGES OF MANGO PLANT ?","COC 3G PER LITER OF WATER .","HARYANA","PANCHKULA","PINJORE                                           ","2014-11-27 15:23:47.593"
"RABI","AGRICULTURE","Others","Others","Weather","Information regarding weather of panchkula?","Information regarding weather of panchkula?weather of panchkula:-some clouds and no chance of rainfall in today,","HARYANA","PANCHKULA","BARWALA                                           ","2014-11-27 15:54:00.347"
"RABI","AGRICULTURE","Others","Others","Weather","Information regarding weather in panchkula ?","Some clouds and no chance of rainfall today.","HARYANA","PANCHKULA","PINJORE                                           ","2014-11-27 16:43:15.733"
"RABI","AGRICULTURE","Others","Others","	Plant Protection	","WEATHER OF PANCHKULA ?","WEATHER OF PANCHKULA ARE :- SOME CLOUD AND NO CHANCE OF RAIN TODAY .","HARYANA","PANCHKULA","BARWALA                                           ","2014-11-27 16:53:11.520"
"RABI","AGRICULTURE","Others","Others","	Plant Protection	","WEATHER OF PANCHKULA ?","WEATHER OF PANCHKULA ARE :- SOME CLOUD AND NO CHANCE OF RAIN TODAY .","HARYANA","PANCHKULA","BARWALA                                           ","2014-11-27 17:02:27.693"
"RABI","AGRICULTURE","Others","Others","	Plant Protection	","WEATHER OF PANCHKULA ?","WEATHER OF PANCHKULA ARE :- SOME CLOUD AND NO CHANCE OF RAIN TODAY .","HARYANA","PANCHKULA","BARWALA                                           ","2014-11-27 17:02:28.497"
"RABI","HORTICULTURE","Vegetables","Potato","	Plant Protection	","Information regarding to control fungal disease in potato crop ?","Information regarding to control fungal disease in potato crop ?
spray 600 gm mancogeb-m-45 in 200 litre water per acre.","HARYANA","PANCHKULA","BARWALA                                           ","2014-11-27 17:38:34.257"
"RABI","AGRICULTURE","Cereals","Wheat","Bio-Pesticides and Bio-Fertilizers","Information regarding HAU Hisar Toll Free No.?","Information regarding HAU Hisar Toll Free No.?
Contact 1800-180-3001 Monday, Wednesday & Friday 10 AM-12PM.","HARYANA","PANCHKULA","PINJORE                                           ","2014-11-27 17:42:06.237"
"RABI","AGRICULTURE","Others","Others","Soil Testing","Information regarding soil testing ?","Contact your nearest Krishi Vigyan Kender.","HARYANA","PANCHKULA","PINJORE                                           ","2014-11-27 17:49:40.080"
"RABI","AGRICULTURE","Others","Others","	Plant Protection	","WEATHER OF PANCHKULA.?","SOME CLOUDS NO CHANCE OF RAIN FALL TODAY.?","HARYANA","PANCHKULA","RAIPUR RANI                                       ","2014-11-27 17:58:18.717"
"RABI","HORTICULTURE","Vegetables","Onion","Bio-Pesticides and Bio-Fertilizers","HOW TO CONTROL FUNGAL DIESAES IN ONION ?","SPRAY 2 GRAM M-45 IN 1 LITER WATER .","HARYANA","PANCHKULA","PINJORE                                           ","2014-11-27 18:06:53.350"
"RABI","AGRICULTURE","Cereals","Wheat","Cultural Practices","Information regarding how many days after sowing 1st irrigation applied in wheat?","1st irrigation applied in wheat after 22nd days of sowing.","HARYANA","PANCHKULA","BARWALA                                           ","2014-11-28 06:04:18.350"
"RABI","AGRICULTURE","Others","Others","Weather","Information regarding weather in Panchkula?","Some clouds and no chance of rainfall today.","HARYANA","PANCHKULA","BARWALA                                           ","2014-11-28 06:07:37.557"
