"Season","Sector","Category","Crop","QueryType","QueryText","KCCAns","StateName","DistrictName","BlockName","CreatedOn"
"RABI","AGRICULTURE","Others","Others","Weather","weather of panchkula ?","weather of panchkula ? no chance of rainfall today ,","HARYANA","PANCHKULA","BARWALA                                           ","2014-11-28 06:13:35.780"
"RABI","HORTICULTURE","Vegetables","Potato","	Plant Protection	","How to control Early Blight in potato?","Spray 600 gm. M-45 in 200 lt. of water per acre.","HARYANA","PANCHKULA","BARWALA                                           ","2014-11-28 06:50:41.583"
"RABI","HORTICULTURE","Vegetables","Potato","Bio-Pesticides and Bio-Fertilizers","Information regarding how to control fungal disease in potato crop ?","spray coc @ 600 gm +streptocycline @ 15 gm in 200 litre of water/acre.","HARYANA","PANCHKULA","BARWALA                                           ","2014-11-28 11:00:36.130"
"RABI","AGRICULTURE","Others","Others","Weather","Information regarding weather of Panchkula?","Weather of Panchkula are:- no chance of rainfall in next few days.","HARYANA","PANCHKULA","PINJORE                                           ","2014-11-28 15:18:19.390"
"RABI","AGRICULTURE","Fodder Crops","Guar","Market Information","Information regarding mandi rate of gwar?","mandi rate of gwar-rs 4502/qtl.","HARYANA","PANCHKULA","PINJORE                                           ","2014-11-28 16:45:05.820"
"RABI","AGRICULTURE","Others","Others","Weather","Information regarding weather in PANCHKULA?","Information regarding weather in PANCHKULA?
Some  clouds no chance of rain fall today","HARYANA","PANCHKULA","BARWALA                                           ","2014-11-28 16:47:30.183"
"RABI","AGRICULTURE","Cereals","Wheat","Fertilizer Use and Availability","Information regarding fertiliuzer dose in wheat ?","crop -urea-134kg,potash-40kg,DAP-50kg,zinc-10 kg per acre .","HARYANA","PANCHKULA","PINJORE                                           ","2014-11-28 18:53:59.413"
"RABI","AGRICULTURE","Cereals","Wheat","	Water Management	","Information regarding how many days after sowing 1st irrigation applied in wheat?","Information regarding how many days after sowing 1st irrigation applied in wheat?
1st irrigation applied in wheat after 22nd days of sowing.","HARYANA","PANCHKULA","PINJORE                                           ","2014-11-28 19:01:19.720"
"RABI","AGRICULTURE","Others","Others","Weather","Information regarding weather in panchkula?","some clouds , no chance of rainfall today.","HARYANA","PANCHKULA","RAIPUR RANI                                       ","2014-11-29 07:21:26.380"
"RABI","HORTICULTURE","Vegetables","Onion","	Plant Protection	","information regarding how to control fungal disease in ONION ?","spray of m-45 @ 400 gm in 200 liter of water /acre .","HARYANA","PANCHKULA","MORNI                                             ","2014-11-29 08:07:35.753"
"RABI","HORTICULTURE","Vegetables","Tomato","	Plant Protection	","How to control aphids in tomato?","How to control aphids in tomato?
SPRAY :- 400 ML MELATHION OR 350 ML ROGOR IN 200 LITREB WATER / ACRE","HARYANA","PANCHKULA","BARWALA                                           ","2014-11-29 09:41:27.737"
"RABI","HORTICULTURE","Vegetables","Onion","	Plant Protection	","how to control of fungal dieasese in onion crops?are:-","how to control of fungal dieasese in onion crops?control are:- spray-bavistin@2 gram in 1 liter water .","HARYANA","PANCHKULA","RAIPUR RANI                                       ","2014-11-29 09:43:29.283"
"RABI","AGRICULTURE","Others","Others","Soil Testing","Information regarding soil & water testing?","Information regarding soil & water testing?
Contact your nearest Krishi Vigyan Kender.","HARYANA","PANCHKULA","RAIPUR RANI                                       ","2014-11-29 09:57:53.623"
"RABI","HORTICULTURE","Vegetables","Onion","Seeds and Planting Material","Improved varieties of onion crop-?","Improved varieties of onion crop-pusa red ,hisar pyaj-2 ,3","HARYANA","PANCHKULA","BARWALA                                           ","2014-11-29 11:26:05.533"
"RABI","AGRICULTURE","Cereals","Wheat","Cultural Practices","Information regarding how to improve growth in wheat crop?","Spray 2.5 Kg. Urea and 500 gm. Zinc in 100 lt. of water per acre.","HARYANA","PANCHKULA","BARWALA                                           ","2014-11-29 11:28:24.917"
"RABI","AGRICULTURE","Others","Others","Weather","weather of panchkula.?","weather of panchkula.? some clouds no chance of rain fall today.?","HARYANA","PANCHKULA","PINJORE                                           ","2014-11-29 15:32:27.947"
"RABI","AGRICULTURE","Others","Others","Weather","WEATHER OF PANCHKULA ?","NO CHANCE RAIN FALL IN TODAY .","HARYANA","PANCHKULA","BARWALA                                           ","2014-11-29 17:48:45.380"
"RABI","AGRICULTURE","Others","Others","Weather","weather of panchkula.?","weather of panchkula.? no chance of rain fall todar.?","HARYANA","PANCHKULA","MORNI                                             ","2014-11-29 18:03:06.600"
"RABI","AGRICULTURE","Others","Others","Weather","weather of panchkula ?","weather of panchkula :- today some clouds, no chances of rainfall.","HARYANA","PANCHKULA","RAIPUR RANI                                       ","2014-11-29 18:18:33.953"
"RABI","AGRICULTURE","Cereals","Wheat","Seeds","Information regarding late varieties of wheat?","Late Varieties of wheat - HD-2851 ,HD-2932, PBW-373, PBW-658, RAJ-3765, UP-2338.","HARYANA","PANCHKULA","MORNI                                             ","2014-11-30 07:33:38.897"
"RABI","AGRICULTURE","Cereals","Wheat","Cultural Practices","INformation regarding  medium varieties of wheat crop ?","INformation regarding  medium varieties of wheat crop ?
LATE   VARIETIES  OF WHEAT WH -147, 1080, 1025,  C-306,WH-542,283 S, UP-2338, DBW-17, WH-711,WH-912,DPW233,WHD-943,","HARYANA","PANCHKULA","BARWALA                                           ","2014-11-30 08:31:43.573"
"RABI","AGRICULTURE","Others","Others","	Plant Protection	","WEATHER OF PANCHKULA.?","WEATHER OF PANCHKULA.? NO CHANCE OF RAIN FALL TODAY.?","HARYANA","PANCHKULA","BARWALA                                           ","2014-11-30 11:42:11.167"
"RABI","AGRICULTURE","Cereals","Wheat","Nutrient Management","information  regarding  seed treatment  of wheat ?","information  regarding  seed treatment  of wheat ?
 information regarding firest fertilizer dose  of wheat -45 kg urea ,10 kg micronutrent per acre .","HARYANA","PANCHKULA","BARWALA                                           ","2014-11-30 13:51:09.983"
"RABI","HORTICULTURE","Vegetables","Onion","	Plant Protection	","how to control fengel dieses in onion ?","spray 2 gm bavestin @ per litre water.","HARYANA","PANCHKULA","RAIPUR RANI                                       ","2014-11-30 16:59:37.220"
"RABI","HORTICULTURE","Vegetables","Onion","	Plant Protection	","How to control  Blight in onion?","How to control  Blight in onion?
Spray 3 gm. M-45 in / lt. of water per acre.","HARYANA","PANCHKULA","RAIPUR RANI                                       ","2014-11-30 17:06:05.050"
"RABI","AGRICULTURE","Cereals","Wheat","Cultural Practices","INFORMATION   REGARDING First    IRRIGATION    OF  WHEAT   CROP ?","INFORMATION   REGARDING First    IRRIGATION    OF  WHEAT   CROP ? 
First    IRRIGATION  21 to 25 days AFTER  SOWING TIME   OF  WHEAT   CROP","HARYANA","PANCHKULA","RAIPUR RANI                                       ","2014-11-30 18:09:52.563"
"RABI","AGRICULTURE","Cereals","Wheat","Fertilizer Use and Availability","how to control yallow leaf of wheat ?","urea fertilizer 50kg per acre.after first irrigation.","HARYANA","PANCHKULA","RAIPUR RANI                                       ","2014-11-30 18:17:38.023"
"RABI","HORTICULTURE","Vegetables","Potato","	Plant Protection	","information regarding for growth of potato ?","spray of n:p:k(19:19:19) @ 1 kg in 100 litre of water/acre.","HARYANA","PANCHKULA","PINJORE                                           ","2014-11-30 19:19:10.613"
