"Season","Sector","Category","Crop","QueryType","QueryText","KCCAns","StateName","DistrictName","BlockName","CreatedOn"
"RABI","HORTICULTURE","Vegetables","Potato","	Plant Protection	","information regarding weeds control in potato ?","weeds control in potato ? spray 300 gm gramexon in 200 lit water  / acre .","HARYANA","PANCHKULA","BARWALA                                           ","2014-11-01 07:45:37.570"
"RABI","AGRICULTURE","Oilseeds","Mustard","Varieties","information regarding variety of sarso ?","information regarding variety of sarso -RH 30,T59,RH8113,RB50,RH819,RH9304,RH0749 .","HARYANA","PANCHKULA","BARWALA                                           ","2014-11-01 12:34:47.730"
"RABI","AGRICULTURE","Cereals","Wheat","Seeds","information regarding early  varieties of wheat ?","Early varieties of wheat :-  wh-1105,whd-948,wh-711-157,pbw-343,hd-2967,dbw-17dbw -621, 650 ,hd 2851, 2894 ,RAJ-3765","HARYANA","PANCHKULA","RAIPUR RANI                                       ","2014-11-01 14:45:17.840"
"RABI","AGRICULTURE","Cereals","Wheat","	Plant Protection	","Information regarding early sowing varieties of wheat?","Information regarding early sowing varieties of wheat?
WH-1105, WHD-948,WH-711, HD-2967, DPW-621, DBW-17.","HARYANA","PANCHKULA","BARWALA                                           ","2014-11-01 16:21:54.827"
"RABI","AGRICULTURE","Others","Others","Weather","Information regarding weather in panchkula??","Information regarding weather in panchkula?some cloudy weather,no chance of rainfall today.","HARYANA","PANCHKULA","MORNI                                             ","2014-11-01 17:04:10.000"
"KHARIF","AGRICULTURE","Cereals","Wheat","	Field Preparation	","""Information regarding weather in ?
""","""Information regarding weather in ?
""
today some clouds, some chances of rainfall","HARYANA","PANCHKULA","BARWALA                                           ","2014-11-01 20:25:18.620"
"RABI","AGRICULTURE","Cereals","Wheat","Varieties","Information regarding fertilizers doses in wheat at sowing time?","Information regarding fertilizers doses in wheat at sowing time?
DAP-50 kg ,POTAS-40 kg ,UREA-30 kg,ZINK-10.kg/acre","HARYANA","PANCHKULA","RAIPUR RANI                                       ","2014-11-02 10:21:23.710"
"RABI","AGRICULTURE","Cereals","Wheat","Varieties","Information regarding Improved varieties of wheat crop ?","WH-1105,WH 542, WH 711, DBW 17, PBW 343, DPW-621-50, HD-2967.","HARYANA","PANCHKULA","RAIPUR RANI                                       ","2014-11-02 17:10:40.620"
"RABI","HORTICULTURE","Vegetables","Potato","	Plant Protection	","information regarding how to weeds control in POTATO?","information regarding how to weeds control in POTATO?
spray 1.25liter pendamethalin in 200 liter water /acreafter and before sowing..","HARYANA","PANCHKULA","RAIPUR RANI                                       ","2014-11-03 09:19:06.520"
"KHARIF","AGRICULTURE","Others","Others","Weather","information regarding to weather today?","information regarding to weather today?
some cloud and no chance of rain fall, today","HARYANA","PANCHKULA","RAIPUR RANI                                       ","2014-11-03 12:56:01.997"
"RABI","AGRICULTURE","Others","Others","Weather","Information regarding weather in panchkula ?","Information regarding weather in panchkula ?some cloudy weather,no chance of rainfall today.","HARYANA","PANCHKULA","BARWALA                                           ","2014-11-03 12:57:09.890"
"RABI","AGRICULTURE","Others","Others","Weather","Information regarding weather in panchkula ?","Information regarding weather in panchkula ?Today some clouds, no chance of rainfall .","HARYANA","PANCHKULA","PINJORE                                           ","2014-11-03 13:11:15.350"
"RABI","AGRICULTURE","Others","Others","Weather","Information regarding  weather in  panchkula ?","Today some clouds and no  Chances of rainfall.","HARYANA","PANCHKULA","RAIPUR RANI                                       ","2014-11-03 17:31:35.930"
"RABI","AGRICULTURE","Others","Others","Weather","information regarding to weather in panchkula?","information regarding to weather in panchkula?
some cloud and no chance of rain fall, today","HARYANA","PANCHKULA","RAIPUR RANI                                       ","2014-11-04 07:48:06.067"
"RABI","HORTICULTURE","Vegetables","Onion","Seeds and Planting Material","How to control Early Blight in onion  ?","How to control Early Blight in onion  ?
How to control Early Blight in onion -Spray 400 gm. M-45 in 200 lt. of water per acre.","HARYANA","PANCHKULA","PINJORE                                           ","2014-11-04 09:48:07.757"
"RABI","AGRICULTURE","Cereals","Wheat","Seeds","information variteas in wheat ?","information variteas in wheat ?
variteas in wheat : wh -1105, wh-711, dpw- 261-50, dpw-2967, hd-2851, dbw-17,pvw343 .","HARYANA","PANCHKULA","BARWALA                                           ","2014-11-04 10:55:06.260"
"RABI","AGRICULTURE","Others","Others","Weather","Information regarding weather in Panchkula ?","Information regarding weather in Panchkula ?
 Some clouds, no chance of rain fall today .","HARYANA","PANCHKULA","RAIPUR RANI                                       ","2014-11-04 15:16:56.290"
"RABI","HORTICULTURE","Vegetables","Onion","Vegetative Propagation and Tissue Culture","impoved varities of onion?","impoved varities of onion :- hisar-2 , pusa red , hisar payag -3.","HARYANA","PANCHKULA","BARWALA                                           ","2014-11-05 09:25:11.823"
"RABI","AGRICULTURE","Oilseeds","Mustard","Cultural Practices","Information regarding control of weeds in mustard ?","Information regarding control of weeds in mustard ?no chemical used,only hand hoeing.","HARYANA","PANCHKULA","MORNI                                             ","2014-11-05 09:44:10.857"
"RABI","AGRICULTURE","Cereals","Paddy (Dhan)","Market Information","INFORMATION REGARDING MARKET RATE OF PADDY ?","INFORMATION REGARDING MARKET RATE OF PADDY ?Rs-3250per qt.","HARYANA","PANCHKULA","MORNI                                             ","2014-11-05 10:32:47.033"
"RABI","AGRICULTURE","Cereals","Wheat","Varieties","Information regarding early varieties of wheat?","WH-1105,WH 542, WH 711, DBW 17, PBW 343, DPW-621-50, HD-2967.","HARYANA","PANCHKULA","PINJORE                                           ","2014-11-05 11:42:14.450"
"RABI","AGRICULTURE","Cereals","Wheat","Varieties","Improved varieties in wheat ?","Improved varieties in wheat ?
WH-1025,1105,WH-1080,711,WH157,WH-542,PBW-343,502,DBW-17,550 ,HD-2967, .","HARYANA","PANCHKULA","PINJORE                                           ","2014-11-05 14:06:01.280"
"RABI","AGRICULTURE","Cereals","Wheat","	Plant Protection	","Improved varieties in wheat ?","Improved varieties in wheat ?
WH-1025,1105,WH-1080,711,WH157,WH-542,PBW-343,502,DBW-17,550 ,HD-2967, .","HARYANA","PANCHKULA","BARWALA                                           ","2014-11-05 16:16:38.657"
"RABI","AGRICULTURE","Cereals","Wheat","Weather","Information regarding Improved varieties of wheat crop ?","Information regarding Improved varieties of wheat crop ?
WH-1105,WH 542, whd-902, DBW 17, PBW 343, DPW-621-50,","HARYANA","PANCHKULA","MORNI                                             ","2014-11-05 19:10:21.710"
"RABI","AGRICULTURE","Others","Others","Weather","Information regarding  of weather in panchkula?","Information regarding  of weather in panchkula?
Some ciouds some NO chance of rainfall today.","HARYANA","PANCHKULA","BARWALA                                           ","2014-11-05 19:12:51.120"
"RABI","AGRICULTURE","Cereals","Wheat","	Plant Protection	","information  regarding  seed treatment  of wheat ?","information  regarding  seed treatment  of wheat ?
seed treatment of wheat -2   gm   bavistin  1kgseed  or  1gm  recsil ,1 kg seed  ,treatment karen","HARYANA","PANCHKULA","MORNI                                             ","2014-11-05 19:33:32.220"
"RABI","AGRICULTURE","Cereals","Wheat","Seeds","information regarding early  varieties of wheat ?","information regarding early  varieties of wheat ?
 Early varieties of wheat :-WH-1105, 711, 157,1021, 283, RAJ-3765,HD-2967 ,948,DBW-550,621, P.B.W.-343,D.B.W-17","HARYANA","PANCHKULA","MORNI                                             ","2014-11-05 19:37:56.093"
"RABI","AGRICULTURE","Cereals","Wheat","Varieties","Information regarding early sowing varieties of wheat?","Information regarding early sowing varieties of wheat?
WH-1105, WH-711, HD-2967, DPW-621, DBW-17,WHD-948,WH-1021,","HARYANA","PANCHKULA","MORNI                                             ","2014-11-06 08:30:47.640"
"RABI","HORTICULTURE","Vegetables","Onion","Cultural Practices","improved varieties of onion CROP-?","improved varieties of onion CROP-hisar-2,pusa red,hisar pyaj-3","HARYANA","PANCHKULA","MORNI                                             ","2014-11-06 08:32:30.200"
"RABI","AGRICULTURE","Cereals","Wheat","Fertilizer Use and Availability","information regarding fertilizer dose in wheat at total time ?","information regarding fertilizer dose in wheat at total time ?
apply 136 kg UREA ,,50 kg dap ,(150 Kg SSP),40 kg MOP,and 10 kg Zinc in PE ACRE ,","HARYANA","PANCHKULA","BARWALA                                           ","2014-11-06 08:56:25.720"
"RABI","HORTICULTURE","Vegetables","Onion","Seeds and Planting Material","information regarding varieties  in onion crop?","information regarding varieties  in onion crop-hisar-2,hisar pyaj-3,pusa red ,","HARYANA","PANCHKULA","BARWALA                                           ","2014-11-06 09:03:42.270"
"RABI","AGRICULTURE","Cereals","Wheat","Seeds","Information regarding variteas in wheat ?","Variteas in wheat : wh -1105, wh-542, wh-147 dpw- 261-50, hd-2851, dbw-17,pbw343, hd- 2967,","HARYANA","PANCHKULA","RAIPUR RANI                                       ","2014-11-06 20:09:28.927"
"KHARIF","AGRICULTURE","Cereals","Wheat","	Field Preparation	","Information regarding  varieties of wheat?","Information regarding  varieties of wheat?
WH-1105,WH 542, WH 711, DBW 17, PBW 343, DPW-621-50, HD-2967.","HARYANA","PANCHKULA","MORNI                                             ","2014-11-07 08:47:08.547"
"RABI","HORTICULTURE","Vegetables","Cauliflower","Training and Exposure Visits","Hisar university toll free no- ?","Hisar university toll free no- ?
Contact 1800-180-3001 Monday, Wednesday & Friday 10 AM-12PM.","HARYANA","PANCHKULA","RAIPUR RANI                                       ","2014-11-07 11:07:45.700"
"RABI","AGRICULTURE","Cereals","Wheat","Fertilizer Use and Availability","Information regarding total dose of fertilizers in wheat crop ?","urea-135kg,potas-40 kg,dap-50 kg,zinc-10 kg/acre.","HARYANA","PANCHKULA","BARWALA                                           ","2014-11-07 12:13:41.923"
"RABI","AGRICULTURE","Cereals","Wheat","Varieties","Information regarding early sowing varieties of wheat?","Information regarding early sowing varieties of wheat?
WH-1105, WHD-948,WH-711, HD-2967, DPW-621, DBW-17.","HARYANA","PANCHKULA","RAIPUR RANI                                       ","2014-11-07 15:02:52.417"
"RABI","HORTICULTURE","Vegetables","Cauliflower","Cultural Practices","improved varieties of cauliflower ?","improved varieties of cauliflower ? pusa kataki .hisar-1","HARYANA","PANCHKULA","MORNI                                             ","2014-11-07 18:17:11.950"
"RABI","AGRICULTURE","Others","Others","Weather","Information regarding weather of panchkula ?","Information regarding weather of panchkula ?
some clouds weather & some chance of rainfall today.","HARYANA","PANCHKULA","RAIPUR RANI                                       ","2014-11-08 06:07:21.227"
"RABI","AGRICULTURE","Others","Others","Weather","Information regarding weather in panchkula ?","Information regarding weather in panchkula ?
 Some clouds, no chance of rain fall today .","HARYANA","PANCHKULA","BARWALA                                           ","2014-11-08 07:37:48.767"
"RABI","AGRICULTURE","Others","Others","Weather","weather of panchkula ?","some of rain fall chance today in panchkula .","HARYANA","PANCHKULA","BARWALA                                           ","2014-11-08 08:51:31.353"
"RABI","AGRICULTURE","Cereals","Wheat","Varieties","Information regarding early sowing varieties of wheat?","Information regarding early sowing varieties of wheat?
WH-1105, WHD-948,WH-711, HD-2967, DPW-621, DBW-17.","HARYANA","PANCHKULA","BARWALA                                           ","2014-11-08 09:10:46.140"
"RABI","AGRICULTURE","Cereals","Wheat","Varieties","Information regarding early sowing varieties of wheat?","Information regarding early sowing varieties of wheat?
WH-1105, WHD-948,WH-711, HD-2967, DPW-621, DBW-17.","HARYANA","PANCHKULA","BARWALA                                           ","2014-11-08 09:45:52.457"
"RABI","AGRICULTURE","Others","Others","Weather","weather of panchkula ?","today afternoon some rainfall of chance.","HARYANA","PANCHKULA","BARWALA                                           ","2014-11-08 09:56:46.467"
"RABI","AGRICULTURE","Others","Others","Weather","Information regarding weather in Panchkula?","Information regarding weather in Panchkula?
Some clouds ,no chance of rainfall today.","HARYANA","PANCHKULA","BARWALA                                           ","2014-11-08 10:17:28.960"
"RABI","AGRICULTURE","Others","Others","Weather","Information regarding weather in Panchkula?","Information regarding weather in Panchkula?
Some clouds, no chance of rainfall today.","HARYANA","PANCHKULA","RAIPUR RANI                                       ","2014-11-08 10:25:16.370"
"RABI","AGRICULTURE","Others","Others","Weather","information regarding weather of panchkula ?","Today some of  rain fall chance in panchkula .","HARYANA","PANCHKULA","RAIPUR RANI                                       ","2014-11-08 11:42:46.027"
"RABI","AGRICULTURE","Others","Others","Weather","information regarding weather of panchkula ?","Today some of  rain fall chance in panchkula .","HARYANA","PANCHKULA","RAIPUR RANI                                       ","2014-11-08 11:42:46.297"
"RABI","AGRICULTURE","Others","Others","Weather","Information regarding weather in panchkula?","Information regarding weather in panchkula?
Some cloud some chance of rainfall today.","HARYANA","PANCHKULA","PINJORE                                           ","2014-11-08 12:24:15.027"
"RABI","HORTICULTURE","Vegetables","Onion","	Plant Protection	","control of fungus in onion seedlings?","control of fungus in onion seedlings? spray M-45 @ 2 g / liter water.","HARYANA","PANCHKULA","RAIPUR RANI                                       ","2014-11-08 14:02:51.817"
"RABI","HORTICULTURE","Vegetables","Tomato","Seeds and Planting Material","Information regarding varieties of tomato?","Information regarding varieties of tomato?
Hisar Lalit, Hisar Lalima, Hisar Arun.","HARYANA","PANCHKULA","RAIPUR RANI                                       ","2014-11-08 14:30:37.863"
"RABI","AGRICULTURE","Others","Others","Weather","weather of panchkula ?","no rain fall chance today in panchkula .","HARYANA","PANCHKULA","BARWALA                                           ","2014-11-08 17:45:26.347"
"RABI","AGRICULTURE","Others","Others","Weather","Information regarding weather in Panchkula?","Some clouds no chance of rain fall today","HARYANA","PANCHKULA","RAIPUR RANI                                       ","2014-11-08 19:11:46.837"
"RABI","AGRICULTURE","Others","Others","Weather","WEATHER OF PANCHKULA ?","WEATHER OF PANCHKULA  ARE :- SOME CLOUD AND NO CHANCE OF RAIN TONIGHT .","HARYANA","PANCHKULA","BARWALA                                           ","2014-11-08 19:57:04.323"
"RABI","AGRICULTURE","Cereals","Wheat","	Plant Protection	","information regarding fertilizer dose in wheat croP?","information regarding fertilizer dose in wheat crop -DAP-50 KG,YA SSP-150 KG,POTASH-40 KG,ZINC-10 KG .","HARYANA","PANCHKULA","BARWALA                                           ","2014-11-08 20:02:53.567"
"RABI","AGRICULTURE","Cereals","Wheat","Seeds","information regarding varieties of wheat?","Varieties  of wheat?  C-306, WH-1025, WH-1080 WH1105,HD2967,DBW17,DPW621,PBW343.PBW550,WD711,WH948 WH157, WH283,","HARYANA","PANCHKULA","MORNI                                             ","2014-11-09 07:02:36.710"
"RABI","HORTICULTURE","Vegetables","Onion","Seeds and Planting Material","Information regarding improved varieties of onion crop ?","Information regarding improved varieties of onion crop ?
hisar-2,pusa red,hisar pyaj-3.","HARYANA","PANCHKULA","PINJORE                                           ","2014-11-09 12:12:13.043"
"RABI","HORTICULTURE","Vegetables","Potato","	Plant Protection	","How to control aphids in tomato?","Spray 400 ml. rogor in 200 lt. of water per acre.","HARYANA","PANCHKULA","BARWALA                                           ","2014-11-09 16:44:33.127"
"KHARIF","AGRICULTURE","Others","Others","	Field Preparation	","Information regarding Mushroom Training?","Information regarding Mushroom Training?
Contact Murthal(Sonipat) 0130-2484107.","HARYANA","PANCHKULA","BARWALA                                           ","2014-11-10 07:41:34.877"
"RABI","AGRICULTURE","Cereals","Wheat","Seeds","information regarding  fertilizer dose  of wheat crop ?","fertilizer dose in wheat crop :-130 kilogram urea, 50kg,dap ,40kg potas. 10kg zink.","HARYANA","PANCHKULA","PINJORE                                           ","2014-11-10 08:51:59.823"
"KHARIF","AGRICULTURE","Others","Others","	Field Preparation	","HAU Helpline  toll free No.","HAU Helpline  toll free No.
HAU Helpline  toll free No.:-1800-180-3001","HARYANA","PANCHKULA","BARWALA                                           ","2014-11-10 09:24:08.903"
"RABI","AGRICULTURE","Others","Others","Weather","Information regarding weather in panchkula.?","Information regarding weather in panchkula ?some cloudy weather,no chance of rainfall today.","HARYANA","PANCHKULA","BARWALA                                           ","2014-11-10 12:34:16.850"
"RABI","AGRICULTURE","Cereals","Wheat","	Plant Protection	","Information regarding seed treatment in wheat with culture?","Seed treatment with 4 injections of Azotobactor or PSB for one acre seed.","HARYANA","PANCHKULA","PINJORE                                           ","2014-11-10 14:16:36.190"
"RABI","AGRICULTURE","Cereals","Wheat","Seeds","information regarding early  varieties of wheat ?","Early varieties of wheat :-WH-1105, 711, 157,1021, 283, RAJ-3765,HD-2967 ,948,DBW-550,621, P.B.W.-343,D.B.W-17","HARYANA","PANCHKULA","BARWALA                                           ","2014-11-11 08:11:29.307"
"RABI","AGRICULTURE","Others","Others","Soil Testing","information regarding to soil and water testing?","information regarding to soil and water testing?        
contact near krishi vighyan kendra.","HARYANA","PANCHKULA","BARWALA                                           ","2014-11-11 15:26:56.620"
"RABI","HORTICULTURE","Vegetables","Potato","	Plant Protection	","WEEDCONTROL IN POTATO ?","control of weeds in POTATO crops are:-spray GREMEKSON @ 300 gram. in 200 litr water per acer.","HARYANA","PANCHKULA","PINJORE                                           ","2014-11-12 09:52:47.860"
"RABI","AGRICULTURE","Cereals","Wheat","Varieties","Information regarding early varieties of wheat?","Information regarding early varieties of wheat?
WH-1105,WH 542, WH 711, DBW 17, PBW 343, DPW-621-50, HD-2967.","HARYANA","PANCHKULA","BARWALA                                           ","2014-11-12 12:59:47.700"
"RABI","HORTICULTURE","Vegetables","Onion","	Plant Protection	","Information regarding how to contro termit in onion crop?","Information regarding how to contro termit in onion crop? control are;-brodcast in kloropaireephos@ 1 liter 25 dry soil,per acer,","HARYANA","PANCHKULA","RAIPUR RANI                                       ","2014-11-12 14:22:50.400"
"RABI","ANIMAL HUSBANDRY","Animal","Bovine(Cow,Buffalo)","Disease Management","Animal Husbandry Toll Free No.?","Animal Husbandry Toll Free No. :-  1800 180 1184.","HARYANA","PANCHKULA","RAIPUR RANI                                       ","2014-11-12 16:11:05.470"
"RABI","HORTICULTURE","Vegetables","Onion","	Plant Protection	","how to control of deemak in onion ?","brodcasting cloropairiphos 1.5 liter with 30 kg sand per acre .","HARYANA","PANCHKULA","BARWALA                                           ","2014-11-13 10:17:00.057"
"RABI","AGRICULTURE","Cereals","Wheat","Cultural Practices","Information regarding how to control weeds in wheat crop ?","Information regarding how to control weeds in wheat crop ?
spray topic @ 160 gm in 250 litre of water/acre.","HARYANA","PANCHKULA","BARWALA                                           ","2014-11-13 10:25:10.897"
"RABI","HORTICULTURE","Vegetables","Potato","	Plant Protection	","INFORMATION REGARDING HOW TO CONTROL EARLY BLIGHT  OF POTATO ?","INFORMATION REGARDING HOW TO CONTROL EARLY BLIGHT  OF POTATO ?SPRAY :- 400 GRAM M-45 IN 200 LITRE WATER / ACRE .","HARYANA","PANCHKULA","RAIPUR RANI                                       ","2014-11-13 10:52:02.773"
"RABI","AGRICULTURE","Others","Others","Weather","information regrading weather of panchkula ?","some clouds , no chance of rain todfay .","HARYANA","PANCHKULA","BARWALA                                           ","2014-11-13 12:05:20.240"
"RABI","HORTICULTURE","Vegetables","Potato","	Plant Protection	","how to control of fungal dieseas in potato ?","spray of m-45 @ 400 gm in 200 liter water per acre .","HARYANA","PANCHKULA","BARWALA                                           ","2014-11-13 12:31:25.290"
"KHARIF","AGRICULTURE","Others","Others","	Field Preparation	","information regarding to weather today?","information regarding to weather today?
some cloud and no chance of rain fall, today","HARYANA","PANCHKULA","RAIPUR RANI                                       ","2014-11-13 13:57:41.137"
"RABI","HORTICULTURE","Vegetables","Potato","	Plant Protection	","HOW  TO   CONTROL  FUNGAL DISEASE  IN POTATO CROP ?","HOW  TO   CONTROL  FUNGAL DISEASE  IN POTATO CROP ?
spray 400gm diathen m-45  or vavistin  in 200 litre water /acre .","HARYANA","PANCHKULA","RAIPUR RANI                                       ","2014-11-13 14:44:36.163"
"RABI","AGRICULTURE","Cereals","Wheat","	Field Preparation	","Information variteas in wheat crop?","Variteas in wheat : wh -1105, wh-711, dpw- 261-50, dpw-2967, hd-2851, dbw-17,pvw343 .","HARYANA","PANCHKULA","BARWALA                                           ","2014-11-13 15:25:41.827"
"RABI","AGRICULTURE","Others","Others","	Plant Protection	","information regardingHAU Helpline No ?","""information regarding HAU Helpline No-1800-180-3001.monday ,wednesday and Friday 10 am to 12 pm
""","HARYANA","PANCHKULA","PINJORE                                           ","2014-11-13 16:01:50.863"
"RABI","AGRICULTURE","Others","Others","Weather","Information regarding weather in Panchkula?","Some clouds no chance of rainfall today.","HARYANA","PANCHKULA","PINJORE                                           ","2014-11-13 16:09:18.410"
"RABI","AGRICULTURE","Others","Others","Weather","Information regarding weather in Panchkula  ?","Information regarding weather in Panchkula  ?
today some clouds, no chances of rainfall.","HARYANA","PANCHKULA","BARWALA                                           ","2014-11-13 16:13:29.617"
"RABI","AGRICULTURE","Cereals","Wheat","Varieties","Information regarding Improved varieties of wheat crop ?","WH-1105,WH 542, whd-902, DBW 17, PBW 343, DPW-621-50,","HARYANA","PANCHKULA","BARWALA                                           ","2014-11-14 14:46:20.160"
"RABI","AGRICULTURE","Others","Others","Weather","weather of panchkula.?","weather of panchkula.? no chance of rain fall today.?","HARYANA","PANCHKULA","RAIPUR RANI                                       ","2014-11-14 17:13:46.497"
"KHARIF","AGRICULTURE","Cereals","Wheat","	Field Preparation	","information regarding fertilizer dose in wheat crop","information regarding fertilizer dose in wheat crop
50 Kg. DAP, 40 Kg. Potash, 10 Kg. Zinc and 20 Kg. Urea per acre at sowing time.","HARYANA","PANCHKULA","PINJORE                                           ","2014-11-15 09:54:45.360"
"KHARIF","AGRICULTURE","Cereals","Wheat","	Field Preparation	","Information regarding late varieties of wheat?","Information regarding late varieties of wheat?
HD-2851, PBW-373, PBW-658, RAJ-3765, UP-2338.","HARYANA","PANCHKULA","BARWALA                                           ","2014-11-15 10:30:30.210"
"RABI","AGRICULTURE","Others","Others","Weather","Information regarding weather in Panchkula?","Some clouds no Chances of rainfall,today.","HARYANA","PANCHKULA","RAIPUR RANI                                       ","2014-11-15 13:53:08.247"
"RABI","HORTICULTURE","Plantation Crops","Eculeptous","Fertilizer Use and Availability","information regarding urea dose safeda plant ?","50 gm urea par plant second year .","HARYANA","PANCHKULA","RAIPUR RANI                                       ","2014-11-15 13:57:56.477"
"RABI","HORTICULTURE","Condiments and Spices","Ginger","	Plant Protection	","control of fungus in ginger?","drenching blitox @ 3 gm / liter water.","HARYANA","PANCHKULA","PINJORE                                           ","2014-11-15 15:25:50.273"
"RABI","AGRICULTURE","Cereals","Wheat","	Plant Protection	","Information regarding yellow rust resistant varieties of wheat?","Information regarding yellow rust resistant varieties of wheat?
WH-1105, WH-711, HD-2967, DPW-621, DBW-17.","HARYANA","PANCHKULA","RAIPUR RANI                                       ","2014-11-15 16:24:32.047"
"RABI","AGRICULTURE","Cereals","Wheat","Varieties","Information regarding yellow rust resistant varieties of wheat?","Information regarding yellow rust resistant varieties of wheat?
WH-1105, WH-711, HD-2967, DPW-621, DBW-17.","HARYANA","PANCHKULA","BARWALA                                           ","2014-11-15 16:38:02.873"
