"Season","Sector","Category","Crop","QueryType","QueryText","KCCAns","StateName","DistrictName","BlockName","CreatedOn"
"RABI","HORTICULTURE","Vegetables","Potato","Seeds and Planting Material","asking about potato","asking about potato","ASSAM","KAMRUP","SUALKUCHI                                         ","2014-10-21 15:58:54.287"
"RABI","HORTICULTURE","Vegetables","Potato","Cultural Practices","ASKING WHERE TO AVAIL POTATO SEEDS","ADVISED TO CONTACT WITH ASSAM SEEDS CORPORATION FOR POTATO SEEDS","ASSAM","KAMRUP","GOROIMARI                                         ","2014-10-21 21:54:54.850"
"RABI","HORTICULTURE","Vegetables","Potato","Fertilizer Use and Availability","ASKING ABOUT THE FERTILIZER DOSE OF POTATO","APPLY UREA 19 KG, SSP 45 KG ,MOP 13 KG AND BORAX 1-1.5 KG /BIGHA ALONG WITH 2 QUINTOL OF DRY COWDUNG","ASSAM","KAMRUP","RANGIA                                            ","2014-10-22 08:53:25.123"
"RABI","HORTICULTURE","Condiments and Spices","Turmeric","Cultural Practices","ASKING FOR CULTURAL PRACTICES","EXPLAIN BRIEFLY","ASSAM","KAMRUP","BEZERA                                            ","2014-10-22 11:48:15.693"
"RABI","AGRICULTURE","Pulses","Lentil (Masur)","Fertilizer Use and Availability","ASKING FERT DOSE","RECOMMENDED HIM TO APPLY 4.5 KG UREA AND 30 KG SSP PER BIGHA","ASSAM","KAMRUP","RANGIA                                            ","2014-10-22 12:00:34.740"
"RABI","AGRICULTURE","Pulses","Lentil (Masur)","Fertilizer Use and Availability","ASKING FOR FERT DOSE OF LENTIL","RECOMMENDED HIM TO APPLY 4.5 KG UREA AND 30 KG SSP PER BIGHA","ASSAM","KAMRUP","RANGIA                                            ","2014-10-22 12:02:17.920"
"RABI","HORTICULTURE","Vegetables","Potato","Nutrient Management","ASKING ABOUT FERTILIZER DOSES OF POTATO","UREA 19 KG,SSP 45,MOP 12 KG PER BIGHA","ASSAM","KAMRUP","CHAMARIA(PT.)                                     ","2014-10-22 12:20:31.060"
"KHARIF","HORTICULTURE","Fruits","Papaya","Field Preparation","WANTED TO KNOW THE FIELD PREPATION PROCEDURE OF PAPAYA","EXPLAINED IN DETAIL","ASSAM","KAMRUP","BIHDIA                                            ","2014-10-22 14:48:05.650"
"JAYAD","HORTICULTURE","Vegetables","Potato","Fertilizer Use and Availability","ASKING ABOUT FERTILIZER DOSE FOR POTATO","APPLY 'UREA 19 KG, SSP 45 KG, MOP 12 KG AND BORUX 1 KG' PER BIGHA","ASSAM","KAMRUP","CHAMARIA(PT.)                                     ","2014-10-23 17:37:38.100"
"RABI","HORTICULTURE","Vegetables","Tomato","Nutrient Management","ASKING ABOUT NUTRIENT DEFICIENCY IN TOMATO.","SUGGESTED TO MIX 2 ML TRACEL/LITER OF WATER AND THEN SPRAY.","ASSAM","KAMRUP","HAJO                                              ","2014-10-24 09:16:34.187"
"RABI","HORTICULTURE","Vegetables","Cauliflower","	Plant Protection	","HORTICULTURE RELATED PROBLEM.","TRANSFER TO HORTICULTURE EXPERT.","ASSAM","KAMRUP","HAJO                                              ","2014-10-24 09:57:37.113"
"JAYAD","HORTICULTURE","Vegetables","Knol-Khol","	Plant Protection	","CONTROL MEASURE OF PEST IN KNOL KHOL","SPRAY 'MALATHION 50 EC' @ 2 ML PER LITRE OF WATER","ASSAM","KAMRUP","HAJO                                              ","2014-10-24 10:01:01.260"
"RABI","HORTICULTURE","Vegetables","Cauliflower","	Plant Protection	","CONTROL MEASURES OF BROWNING","ADVICE TO APLLY BORAX @ 2 GM/L WATER","ASSAM","KAMRUP","HAJO                                              ","2014-10-24 10:08:15.173"
"RABI","HORTICULTURE","Vegetables","Cauliflower","	Plant Protection	","CONTROL MEASURES OF BROWNING","ADVICE TO APLLY BORAX @ 2 GM/L WATER","ASSAM","KAMRUP","HAJO                                              ","2014-10-24 10:09:51.107"
"RABI","HORTICULTURE","Vegetables","Cauliflower","	Plant Protection	","INSECT PEST ATTACT","ADVISED TO SPRAY MALATHION 50 EC @ 2 ML / LITRE WATER","ASSAM","KAMRUP","BOKO                                              ","2014-10-24 10:56:57.090"
"KHARIF","HORTICULTURE","Vegetables","Brinjal","	Plant Protection	","ASKING FOR THE CONTROL MEASURE AGAINST BLIGHT IN BRINJAL CULTIVATION.","SUGGESTED TO APPLY INDOFIL M-45 @ 2 KG PER LITRE OF WATER","ASSAM","KAMRUP","SUALKUCHI                                         ","2014-10-24 14:30:37.487"
"RABI","AGRICULTURE","Oilseeds","Mustard","Fertilizer Use and Availability","ASKING RECOMMENDED FERTILIZER DOSE OF MUSTARD","APPLY RECOMMENDED FERTILIZER DOSE LIKE-UREA @ 12 KG,SSP @30 KG,MOP @ 3 KG,BORAX @ 1-1.3 KG PER BIGHA","ASSAM","KAMRUP","HAJO                                              ","2014-10-24 18:54:22.213"
"RABI","HORTICULTURE","Vegetables","Pumpkin","Seeds and Planting Material","ASKING SOME VARIETY NAME OF PUMPKIN","GROW VARIETY LIKE-ARJUNA F1,SONIA F1 ETC","ASSAM","KAMRUP","HAJO                                              ","2014-10-24 19:26:12.313"
"RABI","HORTICULTURE","Vegetables","Potato","Fertilizer Use and Availability","ASKING ABOUT FERTILIZER DOSE","ADVICE TO APPLY UREA=19 KG,SSP=45 KG,MOP=12 KG/BIGHA","ASSAM","KAMRUP","DIMORIA(PT.)                                      ","2014-10-25 07:52:02.340"
"RABI","HORTICULTURE","Condiments and Spices","Coriander","Seeds and Planting Material","ASKING FOR NAME OF VARIETY","RECOMMENDED HIM CORIANDER K5 (BARAMASI)","ASSAM","KAMRUP","HAJO                                              ","2014-10-25 07:57:04.940"
"RABI","HORTICULTURE","Vegetables","Potato","Cultural Practices","ASKING ABOUT SEED RATE OF POTATO","SEED RATE =3.5 QUINTAL/BIGHA","ASSAM","KAMRUP","HAJO                                              ","2014-10-25 08:25:39.547"
"RABI","HORTICULTURE","Vegetables","Potato","Fertilizer Use and Availability","ASKING CHEMICAL FERT DOSE OF POTATO","RECOMMENDED HIM TO APPLY 19 KG UREA, 45 KG SSP AND 13 KG MOP PER BIGHA","ASSAM","KAMRUP","SUALKUCHI                                         ","2014-10-25 09:06:20.830"
"RABI","HORTICULTURE","Fruits","Mango","	Plant Protection	","CONTROL MEASURES OF FRUIT DROP","ADVICE TO SPRAY TRACEL 2@ 2 GM/L WATER","ASSAM","KAMRUP","CHANDRAPUR                                        ","2014-10-25 10:14:47.890"
"KHARIF","HORTICULTURE","Plantation Crops","Coconut","Fertilizer Use and Availability","ASKING FOR FERT DOSE FOR ONE TIME USE IN COCONUT","RECOMMENDED HIM TO APPLY 750 GRAM UREA,1250 GRAM SSP, 875 GRAM MOP ANG BORAX 25 GRAM PER PLANT BY RING METHOD ONCE IN SEPT-OCT AND ONCE IN MARCH-APRIL","ASSAM","KAMRUP","HAJO                                              ","2014-10-25 10:43:26.520"
"RABI","HORTICULTURE","Fruits","Citrus","Cultural Practices","QUERY REGARDING CULTURAL PRACTICE OF CITRUS","EXPLAINED DETAILS","ASSAM","KAMRUP","BOKO                                              ","2014-10-25 14:23:45.473"
"RABI","AGRICULTURE","Cereals","Paddy (Dhan)","	Plant Protection	","STEM BORER","ADVISED TO SPRAY CLASSIC -20 @ 2 ML/ LITRE","ASSAM","KAMRUP","CHAMARIA(PT.)                                     ","2014-10-25 16:18:43.400"
"RABI","AGRICULTURE","Others","Others","Government Schemes","ASKING ABOUT GOVT SCHEMES TO AVAIL TRACTOR,POWER TILLER AT SUBSIDY RATE","GIVEN IN DETAILS ABOUT HOW TO AVAIL TRACTOR,POWER TILLER AT SUBSIDY RATE","ASSAM","KAMRUP","BOKO                                              ","2014-10-25 16:31:55.130"
"RABI","AGRICULTURE","Cereals","Paddy (Dhan)","Varieties","ASKING RECOMMENDED VARIETY OF BORO RICE","GROW VARIETY LIKE-JYOTIPRASAD,BISHNUPRASAD,DINANATH,SWARNABH,ARIZE-6444,PAC-832,SHAHYADRI","ASSAM","KAMRUP","CHAMARIA(PT.)                                     ","2014-10-25 17:19:41.717"
"RABI","HORTICULTURE","Plantation Crops","Coconut","Fertilizer Use and Availability","CROWN CHOCKING OF COCONUT","ADVISED TO APPLY BORAX 50 GRAM PER PLANT AS DIRECTED","ASSAM","KAMRUP","SUALKUCHI                                         ","2014-10-25 17:40:38.757"
"RABI","HORTICULTURE","Fruits","Banana","	Plant Protection	","fruit scaring beetle","ADVISED TO SPRAY MALATHION 50 EC @ 2 ML/LITRE WATER","ASSAM","KAMRUP","HAJO                                              ","2014-10-25 17:52:15.980"
"RABI","HORTICULTURE","Vegetables","Potato","Nutrient Management","ASKING ABOUT SEED AVABILITY OF POTATO","EXPLAINED ABOUT DETAILS","ASSAM","KAMRUP","GOROIMARI                                         ","2014-10-25 17:54:32.280"
"RABI","AGRICULTURE","Oilseeds","Mustard","Nutrient Management","ASKING ABOUT VERITY AND FERTILIZER DHOSE","TS 38,TS 36,VARUNA,,TM, 2, TM 4, UREA 12,SSP 30 POTAS 3 KG PER BIGHA","ASSAM","KAMRUP","RANGIA                                            ","2014-10-25 18:21:44.810"
"RABI","HORTICULTURE","Vegetables","Potato","Fertilizer Use and Availability","ASKING RECOMMENDED FERTILIZER DOSE OF POTATO","APPLY RECOMMENDED DOSE OF FERTILIZER-UREA @ 19 KG,SSP @45 KG,MOP @ 12 KG PER BIGHA","ASSAM","KAMRUP","RANGIA                                            ","2014-10-25 18:36:38.643"
"RABI","HORTICULTURE","Vegetables","Potato","Field Preparation","asking about the field preparation procedure of potato","EXPLAINED IN DETAIL","ASSAM","KAMRUP","KAMALPUR(PT.)                                     ","2014-10-25 19:56:52.637"
"KHARIF","HORTICULTURE","Vegetables","Potato","Fertilizer Use and Availability","ASKING FOR THE RECOMMENDED FERTILIZER DOSE OF POTATO","SUGGESTED TO APPLY 19 KG UREA,45 KG SSP AND 12 KG MOP","ASSAM","KAMRUP","BOKO                                              ","2014-10-26 08:00:27.833"
"RABI","HORTICULTURE","Medicinal and Aromatic Plants","Betel Vine","	Plant Protection	","ASKING ABOUT ROOT ROT PROBLEM","ADVICE TO APPLY BORDEAUXMIXTURE","ASSAM","KAMRUP","RANI                                              ","2014-10-26 08:27:11.667"
"KHARIF","HORTICULTURE","Vegetables","Chillies","	Plant Protection	","ASKING ABOUT THE CONTROL MEASURE TO CONTROL APHID INFESTATION IN CHILLI","SUGGESTED TO SPRAY MALATHION 50EC@2MILILITER/LITER OF WATER","ASSAM","KAMRUP","CHANDRAPUR                                        ","2014-10-26 08:31:26.320"
"RABI","HORTICULTURE","Vegetables","Beans ","Cultural Practices","ASKING FOR CULTURAL PRACTICES","EXPLAIN IN DETAILS","ASSAM","KAMRUP","BOKO                                              ","2014-10-26 09:42:55.543"
"RABI","HORTICULTURE","Fruits","Papaya","Cultural Practices","QUERY REGARDING CONTROL MEASURES OF MITES IN PAPAYA","RECOMMENDED TO APPLY TOBACO WATER","ASSAM","KAMRUP","CHANDRAPUR                                        ","2014-10-26 11:24:48.813"
"RABI","AGRICULTURE","Sugar and Starch Crops","Sugarcane (Noble Cane)","	Plant Protection	","ASKING ABOUT THE STEM BORER CONTROL","SPRAY NOVACRON @ 2ML/LITRES OF WATER","ASSAM","KAMRUP","HAJO                                              ","2014-10-26 11:57:31.410"
"JAYAD","HORTICULTURE","Vegetables","Chillies","Fertilizer Use and Availability","ASKING ABOUT FERTILIZER DOSE FOR CHILLI","APPLY 'UREA 20 KG, SSP 33 KG, MOP 13 KG' PER BIGHA","ASSAM","KAMRUP","CHHAYGAON(PT.)                                    ","2014-10-26 18:05:18.467"
"JAYAD","HORTICULTURE","Vegetables","Cabbage","Fertilizer Use and Availability","ASKING ABOUT FERTILIZER DOSE FOR CABBAGE","APPLY 'UREA 18 KG, SSP 50 KG, MOP 13 KG, BORUX 1 KG' PER BIGHA","ASSAM","KAMRUP","CHHAYGAON(PT.)                                    ","2014-10-26 19:01:34.810"
"RABI","HORTICULTURE","Vegetables","Pumpkin","	Plant Protection	","DOWNY MILDEW PROBLEM IN PUMPKIN","SPRAY SAAF @ 1GM/LITRE OF WATER","ASSAM","KAMRUP","RANGIA                                            ","2014-10-26 19:51:31.580"
"RABI","HORTICULTURE","Vegetables","Beans ","Nutrient Management","FERTILIZER DOSE OF BEANS","SUGGESTED FERTILIZER DOSE AS UREA-8KG,SSP-30KG,MOP-4KG/BIGHA","ASSAM","KAMRUP","RANGIA                                            ","2014-10-27 09:03:13.213"
"RABI","AGRICULTURE","Oilseeds","Mustard","Nutrient Management","FERTILIZER DOSE OF MUSTARD","GIVEN IN DETAILS","ASSAM","KAMRUP","BEZERA                                            ","2014-10-27 09:31:29.027"
"RABI","HORTICULTURE","Vegetables","Chillies","Cultural Practices","CULTURAL PRACTICE OF CHILLI","CALL TRANSFERED TO AGRIL. EXPERT FOR CONSULTATION","ASSAM","KAMRUP","CHHAYGAON(PT.)                                    ","2014-10-27 10:17:16.107"
"RABI","HORTICULTURE","Vegetables","Chillies","Cultural Practices","CULTURAL PRACTICE OF CHILLI","CALL TRANSFERED TO AGRIL. EXPERT FOR CONSULTATION","ASSAM","KAMRUP","CHHAYGAON(PT.)                                    ","2014-10-27 10:22:39.300"
"RABI","HORTICULTURE","Vegetables","Radish","Fertilizer Use and Availability","WANTED TO KNOW THE AMOUNT OF FERTILIZER REQUIRED IN ONE BIGHA OF RADISH","ADVISED TO APPLY 14 KG UREA 41 KG SUPER 22 KG POTASH AND 3 QUINTLE COWDANG","ASSAM","KAMRUP","CHHAYGAON(PT.)                                    ","2014-10-27 11:51:46.093"
"RABI","AGRICULTURE","Oilseeds","Mustard","	Plant Protection	","QUERY REGARDING CULTURAL PRACTICE OF MUSTARD","EXPLAINED DETAILS","ASSAM","KAMRUP","HAJO                                              ","2014-10-27 12:29:47.120"
"RABI","AGRICULTURE","Oilseeds","Mustard","Cultural Practices","CULTURAL PRACTICES OF MUSTARD","EXPLAINED IN DETAILS","ASSAM","KAMRUP","HAJO                                              ","2014-10-27 12:33:14.130"
"RABI","AGRICULTURE","Others","Others","Government Schemes","ASKING ABOUT TRACTOR SCHEME","ADVICE TO CONTACT WITH ADO","ASSAM","KAMRUP","HAJO                                              ","2014-10-27 12:39:14.667"
"RABI","HORTICULTURE","Vegetables","French Bean","Fertilizer Use and Availability","WANTED TO KNOW THE AMOUNT OF FERTILIZER REQUIRED TO APPLY IN ONE BIGHA OF LAND","ADVISED TO APPLY 8 KG UREA 33 KG SUPER 4 KG POTASH AND 3 QUINTLE COWGANG IN ONE BIGHA OF FRENCH BEAN","ASSAM","KAMRUP","CHAMARIA(PT.)                                     ","2014-10-27 12:41:17.100"
"RABI","AGRICULTURE","Cereals","Paddy (Dhan)","	Plant Protection	","CONTROL MEASURES OF RICE HISPA","ADVICE TO SPRAY CHLORPYRIPHOS 20 EC @ 2 ML/L WATER","ASSAM","KAMRUP","CHHAYGAON(PT.)                                    ","2014-10-27 13:39:23.753"
"RABI","HORTICULTURE","Vegetables","Brinjal","	Plant Protection	","CONTROL MEASURES OF FUNGAL WILT","ADVICE TO SPRAY BAVISTIN @ 2 GM/L WATER","ASSAM","KAMRUP","RANGIA                                            ","2014-10-27 13:48:31.187"
"RABI","HORTICULTURE","Fruits","Banana","	Plant Protection	","PSUEDOSTEM BORER","ADVISED TO SPRAY MALATHION 50 EC @ 2 ML/ LITRE WATER","ASSAM","KAMRUP","BOKO                                              ","2014-10-27 13:54:47.330"
"RABI","HORTICULTURE","Fruits","Banana","	Plant Protection	","FRUIT SCARING BETTLE OF BANANA","ADVISED TO APPLY MALATHION 50 EC @ 2ML/ LITRE WATER","ASSAM","KAMRUP","CHHAYGAON(PT.)                                    ","2014-10-27 14:08:51.230"
"RABI","HORTICULTURE","Vegetables","Spinach (Palak)","	Plant Protection	","ASKING CONTROL OF LEAF ROT IN SPINACH","APPLY BAVISTIN @ 2 GRAM PER LITRE OF WATER","ASSAM","KAMRUP","HAJO                                              ","2014-10-27 16:32:06.913"
"RABI","HORTICULTURE","Medicinal and Aromatic Plants","Betel Vine","	Plant Protection	","ASKING CONTROL MEASURE OF PHYTOPHTHORA LEAF ROT IN BETEL VINE","APPLY 1% BORDEAUX MIXTURE @ 100-150 ML PER VINE","ASSAM","KAMRUP","BEZERA                                            ","2014-10-27 18:35:35.480"
"RABI","HORTICULTURE","Vegetables","Tomato","Seeds and Planting Material","ASKING ABOUT THE VARIETIES","APPLY PANJAB SUHARA, PUNJAB RUBI","ASSAM","KAMRUP","RAMPUR                                            ","2014-10-27 19:36:41.583"
"RABI","HORTICULTURE","Vegetables","Cabbage","Seeds and Planting Material","ASKING ABOUT THE VARIETY","EXPLAINED IN DETAILS","ASSAM","KAMRUP","HAJO                                              ","2014-10-27 19:47:27.747"
"RABI","AGRICULTURE","Others","Others","	Plant Protection	","Management of Anthracnose of beans.","I suggest him to Spray either Dithane Z-78 @ 2 gram per litre of water or Thiram @ 2 gram per litre of water.","ASSAM","KAMRUP","RANGIA                                            ","2014-10-27 20:46:17.890"
"RABI","HORTICULTURE","Vegetables","Potato","Fertilizer Use and Availability","ASKING RECOMMENDED FERTILIZER DOSE OF POTATO","APPLY RECOMMENDED FERTILIZER DOSE-UREA @ 19 KG,SSP @ 45 KG,MOP @ 12 KG,COMPOST @ 1 TONNE PER BIGHA","ASSAM","KAMRUP","CHAYANI                                           ","2014-10-27 21:17:52.450"
"RABI","HORTICULTURE","Vegetables","Beans ","	Plant Protection	","HORTICULTURE RELATED PROBLEM.","SUGGESTED TO CALL AFTER 10 AM","ASSAM","KAMRUP","CHAMARIA(PT.)                                     ","2014-10-28 07:50:12.633"
"RABI","AGRICULTURE","Cereals","Paddy (Dhan)","Nutrient Management","asking about variety of boro rice","dinanath, boro 1, boro 2","ASSAM","KAMRUP","CHAMARIA(PT.)                                     ","2014-10-28 16:48:47.673"
"RABI","AGRICULTURE","Oilseeds","Mustard","Nutrient Management","ASKING FERTILIZER DOSE OF MUSTARD","UREA 12 KG, SSP 30 KG, MOP 3 KG","ASSAM","KAMRUP","HAJO                                              ","2014-10-28 18:22:48.000"
"RABI","HORTICULTURE","Vegetables","Tomato","	Plant Protection	","ASKING ABOUT THE VITAMIN FOR TOMATO","ADVISED HIM TO APPLY TRACEL 2 @ 2GM/LITRE OF WATER","ASSAM","KAMRUP","CHHAYGAON(PT.)                                    ","2014-10-28 18:46:11.283"
"RABI","HORTICULTURE","Vegetables","Chillies","	Plant Protection	","ASKING CONTROL MEASURE OF LEAF CURL IN CHILLI","SPRAY ROGOR 35 EC @ 2 ML PER LITRE OF WATER","ASSAM","KAMRUP","DIMORIA(PT.)                                      ","2014-10-29 13:19:27.090"
"RABI","HORTICULTURE","Plantation Crops","Coconut","	Plant Protection	","ASKING CONTROL OF CROWN CHOCKING IN COCONUT TREE","APPLY BORAX @ 50 GRAM PER TREE ALONG WITH RECOMMENDED FERTILIZER DOSE IN RING METHOD","ASSAM","KAMRUP","RANGIA                                            ","2014-10-29 13:27:48.573"
"RABI","HORTICULTURE","Plantation Crops","Coconut","Cultural Practices","QUERY REGARDING CULTURAL PRACTICE OF COCONUT","EXPLAINED DETAILS","ASSAM","KAMRUP","SUALKUCHI                                         ","2014-10-29 13:46:23.660"
"RABI","HORTICULTURE","Vegetables","Potato","Fertilizer Use and Availability","ASKING FOR FERTILIZER DOSE IN ONE BIGHA POTATO","ADVISED TO APPLY 19 KG UREA 90 KG SUPER 24 KG POTASH AND 2 QUINTOL COWDANG","ASSAM","KAMRUP","KAMALPUR(PT.)                                     ","2014-10-29 15:40:03.933"
"RABI","HORTICULTURE","Vegetables","Potato","Nutrient Management","asking about fertilizer dose of potato","urea 19 kg, ssp 90 kg, mop 24 kg","ASSAM","KAMRUP","CHAMARIA(PT.)                                     ","2014-10-29 16:23:13.590"
"RABI","HORTICULTURE","Vegetables","Potato","Fertilizer Use and Availability","ASKING FOR FERTILIZER DOSE FOR ONE BIGHA OF UNIRRIGATED LAND .","ADVISED TO APPLY 2 QUINTOL COWDANG 19 KG UREA 45 KG SUPER AND 12 KG POTASH IN ONE BIGHA OF POTATO","ASSAM","KAMRUP","BOKO                                              ","2014-10-29 17:01:31.947"
"RABI","HORTICULTURE","Vegetables","Potato","Cultural Practices","ASKING ABOUT SEED TREATMENT","ADVICE TO SEED TREATMENT WITH INDOFIL M 45 @ 2 GM/L WATER","ASSAM","KAMRUP","BOKO                                              ","2014-10-29 17:09:45.407"
"RABI","AGRICULTURE","Oilseeds","Mustard","Fertilizer Use and Availability","ASKING FOR FERT DOSE FOR RAINFED MUSTARD","RECOMMENDED HIM APPLY 12 KG UREA, 30 KG SSP, 3 KG MOP AND 1.5 KG BORAX PER BIGHA","ASSAM","KAMRUP","GOROIMARI                                         ","2014-10-29 17:36:33.820"
"RABI","HORTICULTURE","Vegetables","Cabbage","	Plant Protection	","ASKING FOR CONTROL OF SOIL PEST","RECOMMENDED TO APPLY MALATHION 5% DUST @ 5 KG PER BIGHA","ASSAM","KAMRUP","RANGIA                                            ","2014-10-29 17:57:59.517"
"RABI","AGRICULTURE","Oilseeds","Mustard","Nutrient Management","asking about fertilizer dose","urea 12, ssp 30,3 mop kg","ASSAM","KAMRUP","BIHDIA                                            ","2014-10-29 18:45:55.470"
"RABI","HORTICULTURE","Vegetables","Chillies","	Plant Protection	","ASKING ABOUT FRUIT DROP","ADVICE TO SPRAY MONTEX @ 2 GM/L WATER","ASSAM","KAMRUP","HAJO                                              ","2014-10-29 18:57:26.270"
"KHARIF","HORTICULTURE","Medicinal and Aromatic Plants","Betel Vine","	Plant Protection	","ASKING FOR CONTROL OF STEM ROT","RECOMMENDED TO APPLY BARDOUX MIXTURE","ASSAM","KAMRUP","CHAMARIA(PT.)                                     ","2014-10-29 19:02:14.450"
"RABI","HORTICULTURE","Medicinal and Aromatic Plants","Betel Vine","	Plant Protection	","ASKING ABOUT LEAF SPOT","ADVICE TO SPRAY BORDEAUX MIXTURE","ASSAM","KAMRUP","DIMORIA(PT.)                                      ","2014-10-29 19:08:46.427"
"RABI","HORTICULTURE","Vegetables","Beans ","Cultural Practices","CULTURAL PRACTICES OF BEANS","EXPLAINED IN DETAILS","ASSAM","KAMRUP","CHHAYGAON(PT.)                                    ","2014-10-29 20:05:46.790"
"RABI","HORTICULTURE","Vegetables","Potato","Nutrient Management","FERTILIZER DOSE OF POTATO","SUGGESTED FERTILIZER DSOE AS UREA-19KG,SSP-75KG,MOP-20KG,MUSTARD OIL CAKE/BIGHA","ASSAM","KAMRUP","BIHDIA                                            ","2014-10-30 10:13:27.973"
"RABI","AGRICULTURE","Oilseeds","Mustard","Fertilizer Use and Availability","ASKING FOR FERTILIZER DOSE IN ONE BIGHA OF MUSTARD","ADVISED TO APPLY 12 KG UREA 30 KG SUPER 3 KG POTASH AND 1.3 KG BORAX.","ASSAM","KAMRUP","CHAMARIA(PT.)                                     ","2014-10-30 11:21:45.553"
"RABI","HORTICULTURE","Vegetables","Brinjal","	Plant Protection	","ASKING ABOUT DISEASE OF TOMATO","ADVICE TO APPLY PLANTOMYCINE @ 2 GM  / LITER","ASSAM","KAMRUP","SUALKUCHI                                         ","2014-10-30 13:19:30.557"
"RABI","AGRICULTURE","Oilseeds","Mustard","	Field Preparation	","WANTE TO KNOW THE FIELD PREPARATION PROCEDURE OF MUSTARD","EXPLAINED IN DETAIL","ASSAM","KAMRUP","KAMALPUR(PT.)                                     ","2014-10-30 14:36:34.533"
"RABI","FISHERIES","Inland","Fresh Water","Fish  Marketing","ASKING ABOUT FISHERY PROBLEM","TRANSFER TO FISHERY EXPERT","ASSAM","KAMRUP","KAMALPUR(PT.)                                     ","2014-10-30 17:37:31.213"
"RABI","HORTICULTURE","Vegetables","Potato","	Plant Protection	","ASKING ABOUT THE RECOMMENDED FERTILIZER DOSE OF POTATO","APPLY RECOMMENDED FERTILIZER DOSE-UREA @ 19 KG,SSP @ 45 KG,MOP @ 12 KG,COMPOST @ 1 TONNE PER BIGHA","ASSAM","KAMRUP","BOKO                                              ","2014-10-30 19:07:31.010"
"RABI","HORTICULTURE","Fruits","Banana","Cultural Practices","QUERY REGARDING CULTURAL PRACTICE OF BANANA","EXPLAINED DETAILS","ASSAM","KAMRUP","RANGIA                                            ","2014-10-30 20:22:58.650"
"RABI","HORTICULTURE","Vegetables","Amaranthus/Grain Amaranthus","	Plant Protection	","ASKING CONTROL MEASURE OF LEAF MINER ATTACK IN AMARANTHUS","SPRAY NEEM GOLD @ 5 ML PER LITRE OF WATER","ASSAM","KAMRUP","RANI                                              ","2014-10-30 20:25:27.243"
"RABI","HORTICULTURE","Flowers","Marigold","Nutrient Management","ASKING MICRONUTRIENT/SOIL ENHENCER FOR MARIGOLD","APPLY MULTIPLEX GARDEN MIXTURE @ 10-15 GRAM TO EACH PLANT IN RING METHOD","ASSAM","KAMRUP","HAJO                                              ","2014-10-30 21:24:57.153"
"RABI","AGRICULTURE","Oilseeds","Mustard","Cultural Practices","ASKING ABOUT SEED RATE","ADVICE TO SOWING SEEDS OF 1.3 KG/BIGHA","ASSAM","KAMRUP","HAJO                                              ","2014-10-31 08:11:58.013"
"RABI","HORTICULTURE","Vegetables","Broccoli","Cultural Practices","AGRIL.QUERY","CALL TRANSFERRED","ASSAM","KAMRUP","BEZERA                                            ","2014-10-31 13:25:29.343"
"RABI","HORTICULTURE","Vegetables","Tomato","	Plant Protection	","ASKING FOR CONTROL OF BACTERIAL WILT","RECOMMENDED HIM TO DRENCH THE SOIL WITH STREPTOMYCIN 2 1GRAM PER 10 LITRE OF WATER","ASSAM","KAMRUP","RANGIA                                            ","2014-10-31 17:55:40.633"
"JAYAD","HORTICULTURE","Vegetables","Brinjal","	Plant Protection	","AGRIL.QUERY","CALL TRANSFERRED","ASSAM","KAMRUP","RANGIA                                            ","2014-10-31 17:57:00.820"
"RABI","HORTICULTURE","Vegetables","Tomato","	Plant Protection	","ASKING FOR CONTROL OF BACTERIAL WILT","RECOMMENDED HIM TO DRENCH THE SOIL WITH STREPTOMYCIN @ 1 GRAM PER 10 LITRE OF WATER","ASSAM","KAMRUP","RANGIA                                            ","2014-10-31 17:57:37.027"
"RABI","HORTICULTURE","Fruits","Citrus","	Plant Protection	","LEAF MINER PROBLEM IN CITRUS","SPRAY NUVACRON/DIMECRON @ 1ML/LITRE OF WATER","ASSAM","KAMRUP","RANGIA                                            ","2014-10-31 18:01:24.327"
"RABI","HORTICULTURE","Vegetables","Cabbage","Cultural Practices","QUERY REGARDING REQUIRED NO OF SEEDLINGS PER KATHA LAND IN CABBAGE","RECOMMENDED TO CULTIVATE 250 NOS OF SEEDLINGS PER KATHA","ASSAM","KAMRUP","SUALKUCHI                                         ","2014-10-31 18:43:15.193"
"RABI","AGRICULTURE","Cereals","Paddy (Dhan)","Cultural Practices","QUERY REGARDING CULTURAL PRACTICE OF PADDY","EXPLAINED DETAILS","ASSAM","KAMRUP","RANGIA                                            ","2014-10-31 18:55:20.677"
"RABI","HORTICULTURE","Vegetables","Potato","	Plant Protection	","ASKING CONTROL OF LATE BLIGHT IN POTATO","APPLY RIDOMIL GOLD @ 2 GRAM PER LITRE OF WATER","ASSAM","KAMRUP","CHAMARIA(PT.)                                     ","2014-10-31 19:31:47.270"
