"Season","Sector","Category","Crop","QueryType","QueryText","KCCAns","StateName","DistrictName","BlockName","CreatedOn"
"KHARIF","AGRICULTURE","Others","Others","Weather","mausam ki jankari chahiye","badal rahege barsa ki sambhavna hai","UTTAR PRADESH","MUZAFFARNAGAR","KAIRANA                                           ","2014-09-02 13:09:23.203"
"KHARIF","AGRICULTURE","Others","Others","Weather","ABOUT WEATHER","TOLD ABOUT WEATHER","UTTAR PRADESH","MUZAFFARNAGAR","MUZAFFARNAGAR                                     ","2014-09-03 11:23:08.097"
"KHARIF","AGRICULTURE","Others","Others","Weather","ABOUT WEATHER","TOLD ABOUT WEATHER","UTTAR PRADESH","MUZAFFARNAGAR","MUZAFFARNAGAR                                     ","2014-09-03 11:23:08.097"
"KHARIF","AGRICULTURE","Sugar and Starch Crops","Sugarcane (Noble Cane)","	Plant Protection	","ganne ki phasal ka sandesh chahiye","ganne ki phasal ka sandesh","UTTAR PRADESH","MUZAFFARNAGAR","MUZAFFARNAGAR                                     ","2014-09-03 11:47:44.597"
"KHARIF","AGRICULTURE","Sugar and Starch Crops","Sugarcane (Noble Cane)","	Plant Protection	","ganne ki phasal ka sandesh chahiye","ganne ki phasal ka sandesh","UTTAR PRADESH","MUZAFFARNAGAR","MUZAFFARNAGAR                                     ","2014-09-03 11:47:44.597"
"KHARIF","AGRICULTURE","Cereals","Paddy (Dhan)","	Plant Protection	","dhan me khad kya dale","npk 19 19 19 1 kg/acre","UTTAR PRADESH","MUZAFFARNAGAR","SHAHPUR                                           ","2014-09-04 06:55:41.840"
"RABI","HORTICULTURE","Vegetables","Potato","Seeds and Planting Material","aalu ki kisme bataye","aalu ki kisme- kufri chandra mukhi,kufri sinduri,kufari badsha,kufri saqtlaj,","UTTAR PRADESH","MUZAFFARNAGAR","BAGHARA                                           ","2014-09-04 12:19:30.367"
"KHARIF","AGRICULTURE","Others","Others","Weather","Maosm ki jankari de","Badal rhege hlki baris ho skti hai","UTTAR PRADESH","MUZAFFARNAGAR","SHAHPUR                                           ","2014-09-04 14:12:56.607"
"KHARIF","AGRICULTURE","Pulses","Black Gram (urd bean)","	Plant Protection	","control of fungal disease","mencozeb 2 gram /liter spray","UTTAR PRADESH","MUZAFFARNAGAR","SHAMLI                                            ","2014-09-04 15:49:24.163"
"KHARIF","AGRICULTURE","Pulses","Black Gram (urd bean)","	Plant Protection	","control of fungal disease","mencozeb 2 gram /liter spray","UTTAR PRADESH","MUZAFFARNAGAR","SHAMLI                                            ","2014-09-04 15:55:15.970"
"KHARIF","AGRICULTURE","Cereals","Paddy (Dhan)","Weather","weather information?","halki barish","UTTAR PRADESH","MUZAFFARNAGAR","JANSATH                                           ","2014-09-04 16:17:24.777"
"KHARIF","HORTICULTURE","Plantation Crops","Poplar","	Plant Protection	","POPALAR KI PAATYAN SHUKH RAHI HAI","Copper oxychloride 0.25% Urea (5 g/lit.) or 1% Potassium Nitrate (10g/lit.)KA CHHIDKAV KARE","UTTAR PRADESH","MUZAFFARNAGAR","THANA BHAWAN                                      ","2014-09-04 16:50:19.887"
"KHARIF","HORTICULTURE","Vegetables","Others","	Plant Protection	","same ki pati pili pad rahi hai","daimethoet ka 2.0 ml/lit ka spray kara de.","UTTAR PRADESH","MUZAFFARNAGAR","MORNA                                             ","2014-09-04 17:14:38.623"
"KHARIF","AGRICULTURE","Fodder Crops","Barseem","Seeds","BARSEEM KAB BOYE","OCTOMBER ME","UTTAR PRADESH","MUZAFFARNAGAR","JANSATH                                           ","2014-09-04 18:08:33.057"
"KHARIF","AGRICULTURE","Fodder Crops","Barseem","Seeds","BARSEEM KAB BOYE","OCTOMBER ME","UTTAR PRADESH","MUZAFFARNAGAR","JANSATH                                           ","2014-09-04 18:08:33.057"
"KHARIF","AGRICULTURE","Sugar and Starch Crops","Sugarcane (Noble Cane)","	Plant Protection	","wild pig problem in sugarcane crop","remove manualy","UTTAR PRADESH","MUZAFFARNAGAR","SHAHPUR                                           ","2014-09-04 21:30:21.143"
"KHARIF","AGRICULTURE","Others","Others","Weather","mausam ke baare me bataye","is saptaah bhar baarish ki sambhavna bani rahegi","UTTAR PRADESH","MUZAFFARNAGAR","CHARTHAWAL                                        ","2014-09-05 06:47:42.960"
"KHARIF","AGRICULTURE","Pulses","Black Gram (urd bean)","	Plant Protection	","urd me gidar hai","monocrotofos 36%300-400ml/acre","UTTAR PRADESH","MUZAFFARNAGAR","MUZAFFARNAGAR                                     ","2014-09-05 08:08:58.537"
"KHARIF","HORTICULTURE","Vegetables","French Bean","	Plant Protection	","guar bechani hai","kisi bhi mandi me beche","UTTAR PRADESH","MUZAFFARNAGAR","MUZAFFARNAGAR                                     ","2014-09-05 08:14:43.877"
"KHARIF","AGRICULTURE","Cereals","Oats ","	Plant Protection	","INSECT IN PADDTY","fatera 8kg\acr","UTTAR PRADESH","MUZAFFARNAGAR","KAIRANA                                           ","2014-09-05 12:03:54.203"
"KHARIF","AGRICULTURE","Cereals","Paddy (Dhan)","	Plant Protection	","mosam ke bare batye","badal rhe ge","UTTAR PRADESH","MUZAFFARNAGAR","KHATAULI                                          ","2014-09-05 12:37:56.677"
"KHARIF","HORTICULTURE","Vegetables","Brinjal","Agriculture Mechanization","baigan ka phal phat raha hai","6 gram boron / litre pani me ghol banakar spray kare","UTTAR PRADESH","MUZAFFARNAGAR","JANSATH                                           ","2014-09-05 14:19:20.443"
"KHARIF","AGRICULTURE","Cereals","Paddy (Dhan)","Cultural Practices","DHAAN ME GANDHI KI PROBLEM","SPRAY OF  Imidachloprid 17.8% SL-100 ML /ACRE","UTTAR PRADESH","MUZAFFARNAGAR","PURKAJI                                           ","2014-09-05 14:21:22.930"
"KHARIF","AGRICULTURE","Others","Others","Weather","Maosm ki jankari de","Badal rhege hlki baris ho skti hai","UTTAR PRADESH","MUZAFFARNAGAR","KHATAULI                                          ","2014-09-05 15:41:43.600"
"KHARIF","AGRICULTURE","Others","Others","Weather","mausam ki jankari","6 aur 7 september ko barsat ho sakti hai","UTTAR PRADESH","MUZAFFARNAGAR","CHARTHAWAL                                        ","2014-09-05 16:47:31.620"
"KHARIF","HORTICULTURE","Vegetables","Potato","	Plant Protection	","POTATO ME NPK RECOMMENDATION.","NPK@120:100:140","UTTAR PRADESH","MUZAFFARNAGAR","PURKAJI                                           ","2014-09-05 19:11:38.557"
"KHARIF","AGRICULTURE","Cereals","Paddy (Dhan)","	Plant Protection	","dhaan me tiddi lgi hai kya kare","Dichlorvos 76% EC @ 2 ML / LITAR PANI KA SPRAY KARE,..??? ??? ????????????? @ 200 ml /150 ????  ????  ??  ??????  ???","UTTAR PRADESH","MUZAFFARNAGAR","JANSATH                                           ","2014-09-06 06:14:10.973"
"KHARIF","AGRICULTURE","Others","Others","Weather","mausam ki jankari chahiye","aaj kal me achchi bearish ho skti hai","UTTAR PRADESH","MUZAFFARNAGAR","UN                                                ","2014-09-06 08:56:52.483"
"KHARIF","HORTICULTURE","Vegetables","Potato","Seeds and Planting Material","aalu ka seed rate kya hai","aalu ka seed rate 25-30 qutal / hecter","UTTAR PRADESH","MUZAFFARNAGAR","BUDHANA                                           ","2014-09-06 09:08:46.150"
"KHARIF","HORTICULTURE","Flowers","Marigold","	Plant Protection	","gendha  ki kheti ki jankari digia","proper jankari di","UTTAR PRADESH","MUZAFFARNAGAR","MUZAFFARNAGAR                                     ","2014-09-06 12:52:01.980"
"KHARIF","HORTICULTURE","Vegetables","Onion","Agriculture Mechanization","pyaj ki kisme bataye aur usko kab laga sakte hai","aap pyaj ko Arka Niketan, Arka Kalyan, Arka Lalima aur aap inko 15 October tak laga sakte hai","UTTAR PRADESH","MUZAFFARNAGAR","KHATAULI                                          ","2014-09-06 13:22:39.833"
"KHARIF","AGRICULTURE","Sugar and Starch Crops","Sugarcane (Noble Cane)","Weather","mausam ki jankari den","cloudy sky and heavy rain chance of 8and 9 september","UTTAR PRADESH","MUZAFFARNAGAR","CHARTHAWAL                                        ","2014-09-06 14:40:37.520"
"KHARIF","ANIMAL HUSBANDRY","Animal","Bovine(Cow,Buffalo)","Animal Breeding","pasu kamjor hai","psu ki kaelshiyam 50 ml, maulti nutrien 50 gm, daliya","UTTAR PRADESH","MUZAFFARNAGAR","MUZAFFARNAGAR                                     ","2014-09-06 14:45:28.107"
"KHARIF","AGRICULTURE","Sugar and Starch Crops","Sugarcane (Noble Cane)","	Plant Protection	","ganne ki pattiya pili pad rahi hai","1 kg sulphar + 2kg magnisium/acre 160 liter pani me ghol kar spray kare","UTTAR PRADESH","MUZAFFARNAGAR","SHAHPUR                                           ","2014-09-06 15:32:43.637"
"KHARIF","AGRICULTURE","Cereals","Paddy (Dhan)","	Plant Protection	","problem in paddy","quinalphos 25ec ko 2ml/liter ka sprey kre","UTTAR PRADESH","MUZAFFARNAGAR","SHAHPUR                                           ","2014-09-06 16:37:08.467"
"KHARIF","AGRICULTURE","Sugar and Starch Crops","Sugarcane (Noble Cane)","	Plant Protection	","GANNE ME LAL SARAN","???? ????????????? ????? ?? ??? ????","UTTAR PRADESH","MUZAFFARNAGAR","BUDHANA                                           ","2014-09-07 13:33:28.533"
"KHARIF","HORTICULTURE","Vegetables","Potato","Seeds and Planting Material","potato reserch centre ka number de","01212575497 prsampark kre 10 am to 4 pm.","UTTAR PRADESH","MUZAFFARNAGAR","MUZAFFARNAGAR                                     ","2014-09-07 14:23:30.083"
"KHARIF","AGRICULTURE","Others","Others","Weather","MAUSAM KI JANKARI","8,9,10,11,12, KO BARIS HAI","UTTAR PRADESH","MUZAFFARNAGAR","SHAHPUR                                           ","2014-09-07 14:44:17.583"
"KHARIF","AGRICULTURE","Others","Others","Varieties","Maosm ki jankari de","Badal rhege hlki baris ho skti hai","UTTAR PRADESH","MUZAFFARNAGAR","MORNA                                             ","2014-09-07 15:23:28.580"
"KHARIF","AGRICULTURE","Cereals","Paddy (Dhan)","	Plant Protection	","dhan ki patti pili ho rahi hai","400 gram carbendagim 12%+mancozeb 63 % WP acre ka spray kare","UTTAR PRADESH","MUZAFFARNAGAR","BUDHANA                                           ","2014-09-07 17:25:42.620"
"KHARIF","AGRICULTURE","Cereals","Paddy (Dhan)","Fertilizer Use and Availability","dhaan ki bali ke smy khad ki matra bta de","dhaan me- urea 20 kg + zinc 3 kg / ecar","UTTAR PRADESH","MUZAFFARNAGAR","BUDHANA                                           ","2014-09-08 08:26:07.463"
"KHARIF","AGRICULTURE","Pulses","Pigeon pea (red gram/arhar/tur)","	Plant Protection	","control of fungal disease","mencozeb 2 gram /liter spray","UTTAR PRADESH","MUZAFFARNAGAR","UN                                                ","2014-09-08 08:39:25.060"
"KHARIF","HORTICULTURE","Fruits","Mango","	Plant Protection	","aam ke paudho me phail nahi aate hai","PLANOFIX 1ML/4 LITR PANI ME MILA KAR SPRAY KARE","UTTAR PRADESH","MUZAFFARNAGAR","PURKAJI                                           ","2014-09-08 08:52:14.943"
"KHARIF","AGRICULTURE","Cereals","Paddy (Dhan)","	Plant Protection	","control of yellow leaf in paddy","one kg zinc salphet +4 kg urea +150 liter water /acre spray","UTTAR PRADESH","MUZAFFARNAGAR","CHARTHAWAL                                        ","2014-09-08 09:51:49.430"
"KHARIF","AGRICULTURE","Cereals","Paddy (Dhan)","	Plant Protection	","BALI ME KALA PAD RHA HAI KYA KARE","HEXACHONAZOL KA PRYOG KARE","UTTAR PRADESH","MUZAFFARNAGAR","BUDHANA                                           ","2014-09-08 09:55:43.950"
"KHARIF","AGRICULTURE","Cereals","Paddy (Dhan)","	Plant Protection	","white grub hai kya de","metarizium anuspolly @2kg/acar de ballu ke sath","UTTAR PRADESH","MUZAFFARNAGAR","PURKAJI                                           ","2014-09-08 09:59:48.773"
"KHARIF","HORTICULTURE","Vegetables","Colocasia (Arvi, Arbi)","Seeds and Planting Material","murgi palan","012102575497","UTTAR PRADESH","MUZAFFARNAGAR","SHAHPUR                                           ","2014-09-08 12:20:43.047"
"KHARIF","AGRICULTURE","Pulses","Faba Bean (Horse Bean/windsor Bean)","	Water Management	","manure in mango","500gm uriya dap potas 1kg micronutrients","UTTAR PRADESH","MUZAFFARNAGAR","SHAHPUR                                           ","2014-09-08 12:29:47.617"
"KHARIF","AGRICULTURE","Others","Others","	Field Preparation	","cow ghaas nahi kha rahi hai","aap pasu ko himalya batisa aur liv-52 de aur kide ke liye albendazole tablet de","UTTAR PRADESH","MUZAFFARNAGAR","MUZAFFARNAGAR                                     ","2014-09-08 12:57:58.967"
"KHARIF","HORTICULTURE","Fruits","Aonla","	Plant Protection	","insect in paddy","fatera 8kg\acr","UTTAR PRADESH","MUZAFFARNAGAR","BUDHANA                                           ","2014-09-08 13:33:33.710"
"KHARIF","HORTICULTURE","Vegetables","Cucumber","Vegetative Propagation and Tissue Culture","gross in sugarcane","2liter laso+1kgatrazine 200liter pani me  buai ke turant bad spre kare","UTTAR PRADESH","MUZAFFARNAGAR","BUDHANA                                           ","2014-09-08 13:40:32.317"
"KHARIF","AGRICULTURE","Sugar and Starch Crops","Sugarcane (Noble Cane)","	Plant Protection	","ganne lal gidar hai","ganne me pani bhar kar emidaclorpid 70 % 50 graam +keptam 70% 400 geaaam me milake chidcav kare","UTTAR PRADESH","MUZAFFARNAGAR","BUDHANA                                           ","2014-09-08 14:30:02.757"
"KHARIF","AGRICULTURE","Cereals","Paddy (Dhan)","	Plant Protection	","dhan me shet blight","capton 70% 400 gm + blidamycine 100 gm/ecd spray karein","UTTAR PRADESH","MUZAFFARNAGAR","SHAMLI                                            ","2014-09-08 14:30:24.800"
"KHARIF","HORTICULTURE","Condiments and Spices","Garlic","	Plant Protection	","lahsun ki jankari","lahsun ki jankari di gai","UTTAR PRADESH","MUZAFFARNAGAR","PURKAJI                                           ","2014-09-08 17:09:02.613"
"KHARIF","HORTICULTURE","Plantation Crops","Poplar","Fertilizer Use and Availability","Popular mai kya dale","Micronutrient mixture ka prayog kare","UTTAR PRADESH","MUZAFFARNAGAR","SHAMLI                                            ","2014-09-08 21:25:06.230"
"KHARIF","HORTICULTURE","Vegetables","Chillies","	Plant Protection	","mirche me pattiya sikud rahi hai aur usme na to phool aa rahe hai aur na hi fal","aap mirche me Phosphamidon 40% SL  300 ml +  Metalaxyl-8% + Mancozeb-64% WP 250 gram ko 120-150 liter pani ke sath prati acare ki dar se chidkaw kare","UTTAR PRADESH","MUZAFFARNAGAR","BUDHANA                                           ","2014-09-09 06:30:56.480"
"KHARIF","AGRICULTURE","Cereals","Paddy (Dhan)","	Plant Protection	","KIT LAGE HAI KYA KARE","QUYNALPHAS 25%EC KA PRYOG KARE","UTTAR PRADESH","MUZAFFARNAGAR","BUDHANA                                           ","2014-09-09 06:58:28.413"
"KHARIF","AGRICULTURE","Others","Others","Weather","mausam ki jankari","barish ki sambhabanye kam hai","UTTAR PRADESH","MUZAFFARNAGAR","SHAHPUR                                           ","2014-09-09 07:07:01.557"
"KHARIF","AGRICULTURE","Cereals","Paddy (Dhan)","	Plant Protection	","Dhan mai kida laga hai","Monocrotophas ka spray kare","UTTAR PRADESH","MUZAFFARNAGAR","UN                                                ","2014-09-09 08:39:27.817"
"KHARIF","ANIMAL HUSBANDRY","Animal","Bovine(Cow,Buffalo)","Animal Production (Piggery, Goatery, Sheep Farming etc.)","pashu paalan se sambandhit jankari chahiye","pashu paalan se sambandhit jankari ke liye 18001805141 ya 0522/2741991,2741992 par sampark karen","UTTAR PRADESH","MUZAFFARNAGAR","BUDHANA                                           ","2014-09-09 08:52:30.750"
"KHARIF","AGRICULTURE","Others","Others","	Field Preparation	","kya insecticide tatha fungicide ka spray sath kar sakate hai","agar milane par phate nahi to insecticide tatha fungicide ka spray sath kar sakate hai","UTTAR PRADESH","MUZAFFARNAGAR","PURKAJI                                           ","2014-09-09 08:52:59.910"
"KHARIF","AGRICULTURE","Others","Others","	Plant Protection	","mosam ki jankaeri","mosam me dhup badal bana rahega halkibooda badi ho sakti","UTTAR PRADESH","MUZAFFARNAGAR","SHAMLI                                            ","2014-09-09 09:40:31.960"
"KHARIF","AGRICULTURE","Cereals","Paddy (Dhan)","	Plant Protection	","Insect cantrol in paddy","Monocrotophos 36 EC 500  ml dva ko 250  liter pani me mela krke /Acre  spary kre
""","UTTAR PRADESH","MUZAFFARNAGAR","BUDHANA                                           ","2014-09-09 09:55:35.720"
"KHARIF","AGRICULTURE","Sugar and Starch Crops","Sugarcane (Noble Cane)","	Plant Protection	","ganne ko jangali suar se kaie bachaye","jangli suar se bachav ke liye koi sthayi upay nahi hai, taro ki fencing kare","UTTAR PRADESH","MUZAFFARNAGAR","PURKAJI                                           ","2014-09-09 11:08:56.063"
"KHARIF","AGRICULTURE","Cereals","Paddy (Dhan)","Weather","weather information?","halki barish","UTTAR PRADESH","MUZAFFARNAGAR","PURKAJI                                           ","2014-09-09 12:28:10.843"
"KHARIF","AGRICULTURE","Others","Others","Weather","Mausam Ki Jankari Leni Hai","kisan bhai appke yaha, 9 september se 13 september tak bundabandiaur halki barish ki sambhawana hai","UTTAR PRADESH","MUZAFFARNAGAR","PURKAJI                                           ","2014-09-09 13:11:57.193"
"KHARIF","AGRICULTURE","Cereals","Paddy (Dhan)","	Plant Protection	","dhan ki bali nikal rahi hai kya spray kare","150 ml imidachlopride 17.8 %/ acre ka spray kare","UTTAR PRADESH","MUZAFFARNAGAR","SHAMLI                                            ","2014-09-09 14:11:00.903"
"KHARIF","AGRICULTURE","Sugar and Starch Crops","Sugarcane (Noble Cane)","	Plant Protection	","GANE KI ZAQD M KIDA LAGA HAI KYA KARE","Cartap Hydrochloride 4G 8 KILIO PER EKAR SE DAL DE KHET M","UTTAR PRADESH","MUZAFFARNAGAR","SHAHPUR                                           ","2014-09-09 14:50:50.503"
"KHARIF","AGRICULTURE","Sugar and Starch Crops","Sugarcane (Noble Cane)","	Plant Protection	","GANE KI ZAQD M KIDA LAGA HAI KYA KARE","Cartap Hydrochloride 4G 8 KILIO PER EKAR SE DAL DE KHET M","UTTAR PRADESH","MUZAFFARNAGAR","SHAHPUR                                           ","2014-09-09 14:55:38.773"
"KHARIF","AGRICULTURE","Sugar and Starch Crops","Sugarcane (Noble Cane)","	Plant Protection	","GANE KI ZAD M KIDA LAGA HAI KYA KARE","CLOROPHRIPHOS KA S[PRAY KAR DE 400 ML KA","UTTAR PRADESH","MUZAFFARNAGAR","BAGHARA                                           ","2014-09-09 15:33:21.217"
"KHARIF","AGRICULTURE","Others","Others","	Plant Protection	","dhan ki chatai kar sakte hi","NPK 19:19:19 1kg/ecd spray karein","UTTAR PRADESH","MUZAFFARNAGAR","KAIRANA                                           ","2014-09-09 16:05:32.383"
"KHARIF","AGRICULTURE","Beekeeping","Beekeeping","Training and Exposure Visits","beekeeping","beekeeping ke liye k.v.k  se milen","UTTAR PRADESH","MUZAFFARNAGAR","PURKAJI                                           ","2014-09-09 17:40:48.990"
"KHARIF","AGRICULTURE","Others","Others","	Plant Protection	","GANNE JAD ME KIDE HAI ?","FARTERA 8 KG/ACRE","UTTAR PRADESH","MUZAFFARNAGAR","BUDHANA                                           ","2014-09-09 17:54:41.200"
"KHARIF","HORTICULTURE","Vegetables","Chillies","	Plant Protection	","MIRCH KI PATI MURJHA RAHI HAI KYA KARE","Carbendazim 12% + Mancozeb 63% WP KA SPRAY KAR DE","UTTAR PRADESH","MUZAFFARNAGAR","JANSATH                                           ","2014-09-09 20:44:20.000"
"KHARIF","AGRICULTURE","Oilseeds","Toria","	Plant Protection	","toriya ki sowing ki thi jamav nahi hua","ji aapne jldi bo di he","UTTAR PRADESH","MUZAFFARNAGAR","MUZAFFARNAGAR                                     ","2014-09-09 21:20:46.417"
"KHARIF","AGRICULTURE","Pulses","Black Gram (urd bean)","	Plant Protection	","call disconnected","call disconnected","UTTAR PRADESH","MUZAFFARNAGAR","SHAMLI                                            ","2014-09-10 06:49:10.673"
"KHARIF","HORTICULTURE","Vegetables","Chillies","	Plant Protection	","mirch ki pattiyan sikud rahi hain","dimethoet 1.5 ml/litre paani me milaakar spray karen","UTTAR PRADESH","MUZAFFARNAGAR","THANA BHAWAN                                      ","2014-09-10 07:00:50.517"
"KHARIF","AGRICULTURE","Sugar and Starch Crops","Sugarcane (Noble Cane)","	Plant Protection	","TOP BORER IN SUGARCANE","CARTOP HYDROCHLORIDE 8-10 KIGRA PRATI ACRE PRYOG KARE","UTTAR PRADESH","MUZAFFARNAGAR","KHATAULI                                          ","2014-09-10 08:40:00.057"
"KHARIF","HORTICULTURE","Fruits","Mango","	Plant Protection	","wilt desease?","corbendazim@10gram/liter of water.","UTTAR PRADESH","MUZAFFARNAGAR","UN                                                ","2014-09-10 11:44:12.710"
"KHARIF","AGRICULTURE","Cereals","Paddy (Dhan)","	Plant Protection	","disease in paddy","Copper Hydroxide 77% WP-400 gm/acre","UTTAR PRADESH","MUZAFFARNAGAR","BUDHANA                                           ","2014-09-10 11:58:44.693"
"KHARIF","AGRICULTURE","Cereals","Paddy (Dhan)","	Plant Protection	","DHAN ME KALI PAD RAHI HAI","????????????? 5% ????? 2???? ????? ???? ???? ?? ??? ????? ?????? ???","UTTAR PRADESH","MUZAFFARNAGAR","BUDHANA                                           ","2014-09-10 13:09:19.367"
"KHARIF","HORTICULTURE","Fruits","Papaya","Seeds and Planting Material","papite ki kism bta de","papite ki kism-Pusa Giant,Pusa Nanha,Pusa Delicious,Pusa Majesty,Pusa Dwarf","UTTAR PRADESH","MUZAFFARNAGAR","SHAHPUR                                           ","2014-09-10 16:22:51.073"
"KHARIF","AGRICULTURE","Cereals","Paddy (Dhan)","	Plant Protection	","dhan ki pati pili ho rahi hai kyakare","urea ke sath zinc ka spray kar de 1 kilo + 1 kilo","UTTAR PRADESH","MUZAFFARNAGAR","MUZAFFARNAGAR                                     ","2014-09-10 17:57:27.397"
"JAYAD","AGRICULTURE","Cereals","Paddy (Dhan)","	Plant Protection	","BLAST IN PADDY","SPRAY HEXACONAZOL  @ 1 ML./LIT.OF WATER","UTTAR PRADESH","MUZAFFARNAGAR","CHARTHAWAL                                        ","2014-09-10 17:58:49.333"
"JAYAD","AGRICULTURE","Cereals","Paddy (Dhan)","	Plant Protection	","BLAST IN PADDY","SPRAY HEXACONAZOL  @ 1 ML./LIT.OF WATER","UTTAR PRADESH","MUZAFFARNAGAR","CHARTHAWAL                                        ","2014-09-10 18:08:38.017"
"KHARIF","AGRICULTURE","Sugar and Starch Crops","Sugarcane (Noble Cane)","	Plant Protection	","ganne me samsya hi","captan 70% 400gm + belidamycine 100 gm/ecd dalein","UTTAR PRADESH","MUZAFFARNAGAR","UN                                                ","2014-09-10 19:40:02.920"
"KHARIF","HORTICULTURE","Vegetables","Chillies","	Plant Protection	","mirch ki pattiyan sikud rahi hain","dimethoet 1.5 ml/litre paani me milaakar spray karen","UTTAR PRADESH","MUZAFFARNAGAR","THANA BHAWAN                                      ","2014-09-11 08:05:37.870"
"KHARIF","HORTICULTURE","Fruits","Apple","	Plant Protection	","INSECT IN PADDY","fatera 8kg\acr","UTTAR PRADESH","MUZAFFARNAGAR","SHAHPUR                                           ","2014-09-11 08:52:37.657"
"KHARIF","AGRICULTURE","Cereals","Paddy (Dhan)","	Plant Protection	","dhan me jhulsa ke liye kya kare","STREPTOCYCLINE @6 GRAM,+ HEXACONAZOL @ 300 GRAM PRATI ACRE KA SPRAY KARE","UTTAR PRADESH","MUZAFFARNAGAR","SHAHPUR                                           ","2014-09-11 09:06:24.160"
"KHARIF","AGRICULTURE","Cereals","Paddy (Dhan)","Weather","weather ki jankri","abhi mausam saf nahi hein","UTTAR PRADESH","MUZAFFARNAGAR","KAIRANA                                           ","2014-09-11 09:34:35.710"
"KHARIF","AGRICULTURE","Sugar and Starch Crops","Sugarcane (Noble Cane)","	Plant Protection	","ganne ki pattiyan peeli pad rahi hain","urea 15-20 kilo gram + zinc 4 kilo gram + sulphur 4 kilo gram prati acre prayog karen","UTTAR PRADESH","MUZAFFARNAGAR","SHAHPUR                                           ","2014-09-11 09:36:15.080"
"KHARIF","AGRICULTURE","Others","Others","	Plant Protection	","dhan ka dana kala pad rha hai","Hexaconazole 5% EC @ 300 gm / acre","UTTAR PRADESH","MUZAFFARNAGAR","SHAHPUR                                           ","2014-09-11 09:39:57.980"
"KHARIF","AGRICULTURE","Others","Others","	Plant Protection	","kela ki variety","g-9","UTTAR PRADESH","MUZAFFARNAGAR","MUZAFFARNAGAR                                     ","2014-09-11 09:48:17.383"
"KHARIF","AGRICULTURE","Others","Others","	Plant Protection	","ganne, me barvar nhi horhi hai","tricantrenol 5 kg /acre","UTTAR PRADESH","MUZAFFARNAGAR","JANSATH                                           ","2014-09-11 10:06:35.760"
"KHARIF","HORTICULTURE","Condiments and Spices","Ginger","	Plant Protection	","adarak ki pattiya pili ho rahi hai","aap adarak me  Copper oxychloride 0.25% dawa ko 2 gram prati liter pani ke sath chidkaw kare","UTTAR PRADESH","MUZAFFARNAGAR","JANSATH                                           ","2014-09-11 10:36:18.937"
"KHARIF","AGRICULTURE","Cereals","Paddy (Dhan)","	Plant Protection	","Dhaan kee patti lal pad rahi hai","Dhaan me jhonka rog ke Tricyclazole 75% WP 200 gram / acre ka prayog karen","UTTAR PRADESH","MUZAFFARNAGAR","BUDHANA                                           ","2014-09-11 10:43:27.343"
"KHARIF","HORTICULTURE","Fruits","Lemon","Cultural Practices","lemon ki jankari ke liye","lemon ki jankari di gayi hai","UTTAR PRADESH","MUZAFFARNAGAR","MUZAFFARNAGAR                                     ","2014-09-11 12:01:33.820"
"KHARIF","AGRICULTURE","Cereals","Paddy (Dhan)","	Plant Protection	","paddy me keeda lag raha hai","dhan-Deltamethrin 0.72% w/w + Buprofezin 5.65% w/w EC-500 ml/ekd, bail-qunalphos, borex, copper oxi chloride,       HD-3090 (Pusa Amulya),HD-3086 (Pusa Gautami),HD-2967
HD-3043","UTTAR PRADESH","MUZAFFARNAGAR","SHAHPUR                                           ","2014-09-11 12:30:23.960"
"KHARIF","AGRICULTURE","Cereals","Paddy (Dhan)","	Plant Protection	","stem borer in paddy","400 mili phypronil 5 SC / acre me spray kare","UTTAR PRADESH","MUZAFFARNAGAR","PURKAJI                                           ","2014-09-11 14:56:43.437"
