"Season","Sector","Category","Crop","QueryType","QueryText","KCCAns","StateName","DistrictName","BlockName","CreatedOn"
"KHARIF","AGRICULTURE","Cereals","Paddy (Dhan)","	Plant Protection	","insect infestation in PADDY","Spray imidachlroprid @1ml/3liter of water","JHARKAND","RAMGARH","RAMGARH                                           ","2014-10-01 06:45:46.773"
"KHARIF","HORTICULTURE","Vegetables","Brinjal","Weather","WEATHER","NO RAIN","JHARKAND","RAMGARH","GOLA                                              ","2014-10-07 19:11:44.413"
"RABI","HORTICULTURE","Vegetables","Pea (Vegetable)","Seeds and Planting Material","VARIETIES AND FERTILIZER OF PEA","VARIETIES ARE ARKIL,ARLIVIJNER,JWAHAR MATAR-3,ARLI JANT,SEED RATE ARE 40-50KG/HECT,N:P:K AS 50:60:60KG/HECT","JHARKAND","RAMGARH","RAMGARH                                           ","2014-10-09 09:40:30.680"
"RABI","AGRICULTURE","Others","Others","Weather","WEATHER","NO RAIN BUT RAIN WILL BE 12 OCT","JHARKAND","RAMGARH","MANDU                                             ","2014-10-09 13:45:49.653"
"RABI","HORTICULTURE","Vegetables","Potato","Seeds and Planting Material","Varieties in potato","Varieties 
Kufri Jyoti, Kufri Muthu, Kufri Swarna, Kufri Thangam, Kufri Malar, Kufri Soga and Kufri Giriraj are commonly cultivated.","JHARKAND","RAMGARH","MANDU                                             ","2014-10-09 16:02:12.640"
"KHARIF","HORTICULTURE","Vegetables","Cucumber","	Plant Protection	","insect problem of cucumber","spray imidachloprid @ 1ml/3liter water","JHARKAND","RAMGARH","RAMGARH                                           ","2014-10-10 10:48:07.367"
"KHARIF","HORTICULTURE","Vegetables","Potato","Agriculture Mechanization","seed rate and spacing of potato crops","seed rate- 30qnt. / ha and spacing- row to row- 50cm, plant to plant- 15cm","JHARKAND","RAMGARH","MANDU                                             ","2014-10-10 13:31:51.360"
"KHARIF","AGRICULTURE","Cereals","Paddy (Dhan)","	Plant Protection	","FRUIT BORER IN TOMATO","SPRAY ROGOR 1.5ML/LIT OF WATER WITH MULTIMICRONUTRIENT3ML/LIT","JHARKAND","RAMGARH","DULMI","2014-10-10 16:09:54.590"
"KHARIF","HORTICULTURE","Vegetables","Tomato","	Plant Protection	","Rotting problem tomato","Rotting problem tomato-Spray copper oxychloride @ 2g/lit of water","JHARKAND","RAMGARH","MANDU                                             ","2014-10-11 10:19:17.663"
"RABI","HORTICULTURE","Vegetables","Chillies","Seeds and Planting Material","VARIETY OF chilli –","VARIETY OF chilli –
Punjab lal, pant chilli-3, agni rekha, Krishna, arka lohit, pusa jwala, pusa sadabahar","JHARKAND","RAMGARH","DULMI","2014-10-11 11:33:53.893"
"RABI","HORTICULTURE","Vegetables","Brinjal","Seeds and Planting Material","Best variety of brinjal","Best variety of brinjal
-rajendra baigan-2, pant baigan, punjab sadabahar, sonali, pusa purple long, pusa anmol, arka navneet","JHARKAND","RAMGARH","DULMI","2014-10-11 11:42:07.930"
"RABI","HORTICULTURE","Vegetables","Radish","Seeds and Planting Material","VARIETY OF RADISH","VARIETY OF RADISH- PUSA CHETKI, PUSA DESI, PUSA HIMANI, PUSA RESMI, JAPANI SAFED","JHARKAND","RAMGARH","DULMI","2014-10-11 12:12:36.920"
"KHARIF","AGRICULTURE","Others","Others","Weather","weather information","weather information-A thunderstorm in spots this morning followed by a couple of thunderstorms around this afternoon","JHARKAND","RAMGARH","RAMGARH                                           ","2014-10-12 20:17:52.417"
"KHARIF","AGRICULTURE","Others","Others","Weather","Weather information in ramgarh","Weather information in ramgarh- Cloudy weather in your area & little chance of rain","JHARKAND","RAMGARH","MANDU                                             ","2014-10-13 10:18:34.307"
"RABI","AGRICULTURE","Oilseeds","Raya (Indian Mustard)","Varieties","VARIETY OF OILSEED","BHAWANI/PARWATI/SANGAM/ANURADHA","JHARKAND","RAMGARH","CHITARPUR","2014-10-14 07:48:01.280"
"KHARIF","AGRICULTURE","Cereals","Paddy (Dhan)","	Plant Protection	","DEAD HEART IN PADDY","SPRAY ROGOR 2ML/LIT OF WATER","JHARKAND","RAMGARH","RAMGARH                                           ","2014-10-14 20:04:48.963"
"KHARIF","HORTICULTURE","Vegetables","Brinjal","	Plant Protection	","FRUTI BORER IN BRINJAL","SPRAY TRIZOPHOS 2ML/LIT OF WATER","JHARKAND","RAMGARH","PATRATU                                           ","2014-10-15 18:32:23.417"
"KHARIF","AGRICULTURE","Cereals","Paddy (Dhan)","	Plant Protection	","SHEATH BLIGHT DISEASE IN PADDY","SHEATH BLIGHT DISEASE IN PADDY- spray hexaconazole @ 1ml/liter of water","JHARKAND","RAMGARH","GOLA                                              ","2014-10-18 08:10:20.463"
"KHARIF","AGRICULTURE","Others","Others","Weather","information weather","Cloudy weather in your area chance of","JHARKAND","RAMGARH","MANDU                                             ","2014-10-19 12:38:10.350"
"KHARIF","AGRICULTURE","Cereals","Paddy (Dhan)","	Plant Protection	","VARIETIES OF POTATO","VARIETIES KUPHAR PUSKAR,KUPHARI ANAD,SINDURI 25-30QUINTAL/HECT","JHARKAND","RAMGARH","GOLA                                              ","2014-10-20 15:36:32.640"
"KHARIF","HORTICULTURE","Vegetables","Potato","	Plant Protection	","disease of potato crops","spray mancozeb @ 2gm/liter water","JHARKAND","RAMGARH","GOLA                                              ","2014-10-20 16:46:11.230"
"KHARIF","AGRICULTURE","Others","Others","Weather","Weather information in ramgarh","Weather information in ramgarh-Cloudy weather in your area & little chance of rain","JHARKAND","RAMGARH","GOLA                                              ","2014-10-21 09:32:21.577"
"KHARIF","HORTICULTURE","Vegetables","Brinjal","	Plant Protection	","FRUIT BORER IN BRINJAL","SPRAY TRIAZOPHOS @2ML/LIT OF WATER","JHARKAND","RAMGARH","PATRATU                                           ","2014-10-21 18:19:49.137"
"KHARIF","HORTICULTURE","Vegetables","Potato","	Plant Protection	","DISEASE OF POTATO CROPS","SPRAY CARBENDAZIM @ 2GM/LITER WATER","JHARKAND","RAMGARH","MANDU                                             ","2014-10-21 19:31:19.450"
"KHARIF","HORTICULTURE","Vegetables","Brinjal","	Plant Protection	","INSECT PROBLEM OF BRINJAL CROPS","SPRAY IMIDACHLOPRID @ 1ML/3LITER WATER IN BRINJAL CROPS","JHARKAND","RAMGARH","MANDU                                             ","2014-10-21 19:34:33.267"
"KHARIF","AGRICULTURE","Others","Others","Weather","Weather information","Cloudy weather in your area & little chance of rain","JHARKAND","RAMGARH","GOLA                                              ","2014-10-22 08:41:39.720"
"KHARIF","HORTICULTURE","Vegetables","Brinjal","	Plant Protection	","insect management","qunilphosh 1.5 ml/liter","JHARKAND","RAMGARH","RAMGARH                                           ","2014-10-22 15:06:33.360"
"RABI","AGRICULTURE","Pulses","Green Gram (Moong Bean/ Moong)","Seeds","Variety of mung-","Variety of mung- 
pusa vishal, smart, sona,h.u.m.16","JHARKAND","RAMGARH","GOLA                                              ","2014-10-23 18:07:32.737"
"KHARIF","HORTICULTURE","Vegetables","Tomato","	Plant Protection	","disease of tomato","•Spot drench with Carbendazim (0.1%) with plantomycine","JHARKAND","RAMGARH","MANDU                                             ","2014-10-24 10:10:08.910"
"RABI","HORTICULTURE","Vegetables","Potato","	Plant Protection	","BLIGHT IN POTATO","BLIGHT IN POTATO-Spray carbendazym @ 2.5 gram in 1 litre of water","JHARKAND","RAMGARH","MANDU                                             ","2014-10-24 19:17:29.023"
"KHARIF","AGRICULTURE","Millets","Maize (Makka)","	Plant Protection	","Insect infestation","Spray imidachloprid @ 1ml/3lit of water","JHARKAND","RAMGARH","GOLA                                              ","2014-10-25 11:42:46.617"
"KHARIF","HORTICULTURE","Vegetables","Brinjal","	Plant Protection	","Yellowing of leave brijal","Yellowing of leaves  brijal

Spray mancozeb @2gm/liter water","JHARKAND","RAMGARH","GOLA                                              ","2014-10-25 17:48:35.110"
"RABI","HORTICULTURE","Vegetables","Brinjal","	Plant Protection	","blight in brinjal","blight in brinjal-Spray  saff @ 2g/lit of water","JHARKAND","RAMGARH","PATRATU                                           ","2014-10-25 20:01:21.190"
"KHARIF","HORTICULTURE","Vegetables","Onion","	Plant Protection	","blight disease in onion","blight disease in onion-Spray mancozeb @ 2g/lit of water","JHARKAND","RAMGARH","MANDU                                             ","2014-10-26 07:06:23.107"
"RABI","HORTICULTURE","Vegetables","Potato","	Plant Protection	","blight disease in potato","blight disease in potato-Spray mencozeb @ 2g/lit of water","JHARKAND","RAMGARH","GOLA                                              ","2014-10-26 10:04:57.603"
"KHARIF","AGRICULTURE","Others","Others","Weather","Weather information","Very low Cloudy weather in your area  chance of rain","JHARKAND","RAMGARH","RAMGARH                                           ","2014-10-26 16:45:49.900"
"KHARIF","HORTICULTURE","Vegetables","Brinjal","	Plant Protection	","rotting disease in brinjal","rotting disease in brinjal-Spray copperoxycloride @ 2ml in 1 litre","JHARKAND","RAMGARH","MANDU                                             ","2014-10-27 16:05:28.907"
"RABI","AGRICULTURE","Cereals","Paddy (Dhan)","	Plant Protection	","INSECT PROBLEM IN PADDY PLANT","Spray chlorpryphos @ 2ml/lit of water","JHARKAND","RAMGARH","RAMGARH                                           ","2014-10-28 07:52:51.513"
"RABI","AGRICULTURE","Others","Others","	Plant Protection	","Weather information","Very low Cloudy weather in your area  chance of rain","JHARKAND","RAMGARH","RAMGARH                                           ","2014-10-28 08:01:04.690"
"KHARIF","HORTICULTURE","Vegetables","Potato","	Plant Protection	","disease of potato crops","spray mancozeb @ 2gm/liter water in potato crops","JHARKAND","RAMGARH","PATRATU                                           ","2014-10-28 08:29:24.733"
"KHARIF","HORTICULTURE","Vegetables","Potato","	Plant Protection	","BLIGHT DISEASE IN POTATO","BLIGHT DISEASE IN POTATO-Spray mencozeb @ 2g/lit of water","JHARKAND","RAMGARH","MANDU                                             ","2014-10-28 14:43:48.937"
"RABI","AGRICULTURE","Cereals","Wheat","Seeds","Variety of wheat-","Variety of wheat- P.B.W-373, P.B.W-573, P.B.W-443, P.B.W-343, P.B.W-154, HD-2733, HD-2824, k-9107","JHARKAND","RAMGARH","PATRATU                                           ","2014-10-29 19:37:45.997"
"RABI","HORTICULTURE","Vegetables","Potato","	Plant Protection	","blight disease in potato","blight disease in potato-spray in mancozeb @ 2 gram per liter of water","JHARKAND","RAMGARH","DULMI","2014-10-30 07:42:35.050"
"KHARIF","HORTICULTURE","Vegetables","Onion","	Plant Protection	","varities of onion","varities of onion
Arka niketan, Nasik red, Arka kalyan 76","JHARKAND","RAMGARH","MANDU                                             ","2014-10-30 09:39:34.730"
"RABI","HORTICULTURE","Vegetables","Chillies","	Plant Protection	","insect probelm in chillies plant","Spry quinalphos@ 1 ml in 1 litre of water","JHARKAND","RAMGARH","MANDU                                             ","2014-10-30 17:19:27.027"
"RABI","AGRICULTURE","Others","Others","Weed Management","Weed management in fallow field","Weed management in fallow field-Spray paraquate and diquate @ 2 ml in 1 ml of water","JHARKAND","RAMGARH","MANDU                                             ","2014-10-31 12:21:30.577"
