"Season","Sector","Category","Crop","QueryType","QueryText","KCCAns","StateName","DistrictName","BlockName","CreatedOn"
"JAYAD","AGRICULTURE","Others","Others","Weather","TELL ME WEATHER INFORMATION","RAIN POSSIBILITY IN NEXT 5 DAYS","RAJASTHAN","JHALAWAR","PIRAWA (SUNEL)                                    ","2014-08-09 16:43:57.000"
"","AGRICULTURE","Others","Others","	Field Preparation	","TELL ME WEATHER INFORMATION","RAINFALL POSSIBILITY IN NEXT 5 DAYS","RAJASTHAN","JHALAWAR","PIRAWA (SUNEL)                                    ","2014-08-09 16:44:04.000"
"","HORTICULTURE","Vegetables","Tomato","	Plant Protection	","TELL ME BLIGHT CONTROL IN TOMATO","SPRAY OF CARBENDAZIM 12% + MANCOZEB 63% WP 2 GM PER LITER WATER","RAJASTHAN","JHALAWAR","PIRAWA (SUNEL)                                    ","2014-08-09 16:55:55.000"
"JAYAD","AGRICULTURE","Oilseeds","Soybean (bhat)","	Plant Protection	","pest control in soyabean","SPRAY OF INDOXACARB 14.5% SC 1 ML PER LITER WATER","RAJASTHAN","JHALAWAR","MANOHARTHANA                                      ","2014-08-09 17:50:25.000"
"","","","","","","","RAJASTHAN","JHALAWAR","PIRAWA (SUNEL)                                    ","2014-08-09 18:17:04.000"
"","HORTICULTURE","Fruits","Citrus","","FUNGUS PROBLEM OF CITRUS FRUIT","SPRAY OF COPPER OXICHLORIDE 3 GM PER LITER WATER","RAJASTHAN","JHALAWAR","MANOHARTHANA                                      ","2014-08-09 18:47:30.000"
"","HORTICULTURE","Vegetables","Onion","	Plant Protection	","TELL ME CONTROL OF ROOT ROT IN ONION","DRENCHING OF CARBENDAZIM 250 GM PER BIGHA WITH IRRIGATION","RAJASTHAN","JHALAWAR","JHALRAPATAN                                       ","2014-08-09 19:45:23.000"
"KHARIF","AGRICULTURE","Oilseeds","Castor (Rehri, Rendi, Arandi) ","	Plant Protection	","TELL ME WHEATHER REPORT","LIGHT RAIN MAY BE NEXT 5 DAYS","RAJASTHAN","JHALAWAR","PIRAWA (SUNEL)                                    ","2014-08-09 19:48:29.000"
"","HORTICULTURE","Fruits","Papaya","	Plant Protection	","tell me rot control in papaya","DRENCHING OF CARBENDAZIM 2 GM PER LITER","RAJASTHAN","JHALAWAR","KHANPUR                                           ","2014-08-09 19:48:50.000"
"KHARIF","AGRICULTURE","Oilseeds","Castor (Rehri, Rendi, Arandi) ","	Plant Protection	","TELL ME WHEATHER REPORT","LIGHT RAIN MAY BE NEXT 5 DAYS","RAJASTHAN","JHALAWAR","JHALRAPATAN                                       ","2014-08-09 19:50:56.000"
"","AGRICULTURE","Oilseeds","Soybean (bhat)","	Plant Protection	","TELL ME CONTROL OF WEED IN SOYABEAN","SPRAY OF IMIZATHYPER 10% SL 400 GM PER HA IN DISSOLVE 400 LITER WATER","RAJASTHAN","JHALAWAR","BAKANI                                            ","2014-08-09 20:10:09.000"
"","AGRICULTURE","Oilseeds","Soybean (bhat)","	Plant Protection	","WEED CONTROLE","SPRAY OF IMIZATHYPER 10% SL 400 GM PER HA IN 400 LITER WATER","RAJASTHAN","JHALAWAR","JHALRAPATAN                                       ","2014-08-09 20:46:05.000"
"","AGRICULTURE","Oilseeds","Soybean (bhat)","	Plant Protection	","NPK DEFICENCY IN SOYABEEN","SPRAY SOLUBLE NPK  18:18:18 GRADE 10 GM/LTR WATER","RAJASTHAN","JHALAWAR","JHALRAPATAN                                       ","2014-08-10 06:50:07.000"
"","HORTICULTURE","Vegetables","Tomato","","tell me disease in tomato","?????? + ????????? 75% ??.??. ??? ?? 2 ????? ????? ???? ???? ??? ??? ?? ?????? ?????","RAJASTHAN","JHALAWAR","PIRAWA (SUNEL)                                    ","2014-08-10 06:55:07.000"
"","HORTICULTURE","Vegetables","Tomato","	Plant Protection	","TELL ME CONTROL OF LEAF CURL IN TOMATO","SPRAY OF IMIDACHLOPRID 17.8% SL 0.5 ML PER LITER WATER","RAJASTHAN","JHALAWAR","PIRAWA (SUNEL)                                    ","2014-08-10 07:06:32.000"
"","AGRICULTURE","Others","Others","Weather","TELL ME WEATHER INFORMATION","RAIN FALL POSSIBILITY IN NEXT 5 DAYS, CLOUDY SKY","RAJASTHAN","JHALAWAR","PIRAWA (SUNEL)                                    ","2014-08-10 07:22:05.000"
"","AGRICULTURE","Oilseeds","Soybean (bhat)","	Plant Protection	","Tell me proper plant growth in soyabean","SPRAY SOLUBLE NPK  18:18:18 GRADE 10 GM/LTR WATER","RAJASTHAN","JHALAWAR","BAKANI                                            ","2014-08-10 07:31:00.000"
"JAYAD","AGRICULTURE","Oilseeds","Soybean (bhat)","","TELL ME WEED CONTROL IN SOYABEAN .","SPRAY OF IMIZATHYPER 10% SL 400 GM PER HA IN 400 LITER WATER PER HACTRE","RAJASTHAN","JHALAWAR","JHALRAPATAN                                       ","2014-08-10 07:50:46.000"
"JAYAD","AGRICULTURE","Oilseeds","Soybean (bhat)","","TELL INSECT CONTROL IN SOYABEN","SPARY OF DAIMETHOAT 30% EC 2ML PER LITER WATER","RAJASTHAN","JHALAWAR","DAG                                               ","2014-08-10 08:28:10.000"
"JAYAD","HORTICULTURE","Fruits","Orange","	Plant Protection	","FLOWER DROP IN ORANGE","SPRAY OF PLANOFIX 1 ML PER 4 LITER WATER","RAJASTHAN","JHALAWAR","PIRAWA (SUNEL)                                    ","2014-08-10 08:39:52.000"
"JAYAD","HORTICULTURE","Vegetables","Tomato","	Plant Protection	","TELL ME BLIGHT CONTROL OF TOMATO","SPRAY OF MANCOZEB 2 GM + ACEPHATE 75% SP 2 GM PER LITER WATER","RAJASTHAN","JHALAWAR","PIRAWA (SUNEL)                                    ","2014-08-10 08:42:09.000"
"JAYAD","AGRICULTURE","Oilseeds","Soybean (bhat)","","TELL ME  WEED CONTROL IN SOYABEAN","SPRAY OF IMIZATHYPER 10% SL 400 GM PER HA IN DISSOLVE 400 LITER WATER","RAJASTHAN","JHALAWAR","PIRAWA (SUNEL)                                    ","2014-08-10 08:47:25.000"
"JAYAD","HORTICULTURE","Fruits","Orange","	Plant Protection	","SUCKING PEST IN ORANGE PLANT","SPRAY OF DIMETHOATE  30% EC 2 ML PER LITER WATER","RAJASTHAN","JHALAWAR","PIRAWA (SUNEL)                                    ","2014-08-10 08:48:25.000"
"","HORTICULTURE","Vegetables","Onion","Market Information","MARKET RATE OF ONION","JAIPUR (F & V)  ONION 1500 RS/Q","RAJASTHAN","JHALAWAR","JHALRAPATAN                                       ","2014-08-10 08:57:12.000"
"JAYAD","HORTICULTURE","Fruits","Orange","","TELL ME  SPRAY OF MULTIPLAX","SPRAY OF MULTIPLAX (MICRONUTRIENT) 4 GM PER LITER WATER","RAJASTHAN","JHALAWAR","PIRAWA (SUNEL)                                    ","2014-08-10 08:59:36.000"
"","AGRICULTURE","Others","Others","Weather","TELL ME WEATHER REPORT IN MY DISTRIC","MAY BE RAIN POSSIBILITY ON 10,11 AUGUST IN YOUR DISTRIC","RAJASTHAN","JHALAWAR","KHANPUR                                           ","2014-08-10 09:06:15.000"
"JAYAD","AGRICULTURE","Millets","Maize (Makka)","	Plant Protection	","TELL ME YELLOWING CONTROL IN MAIZE","ZINK SULPHATE(21)","RAJASTHAN","JHALAWAR","MANOHARTHANA                                      ","2014-08-10 09:20:52.000"
"","HORTICULTURE","Fruits","Orange","	Plant Protection	","PEST CONTROL IN ORANGE","SPRAY OF DIMETHOATE 30% EC 2 ML PER LITER WATER","RAJASTHAN","JHALAWAR","PIRAWA (SUNEL)                                    ","2014-08-10 10:15:25.000"
"JAYAD","HORTICULTURE","Fruits","Orange","	Plant Protection	","SUCKING PEST IN ORANGE PLANT","SPRAY OF DIMETHOATE  30% EC 2 ML PER LITER WATER","RAJASTHAN","JHALAWAR","PIRAWA (SUNEL)                                    ","2014-08-10 10:21:43.000"
"JAYAD","AGRICULTURE","Millets","Pearl Millet (Bajra/Bulrush Millet/Spiked Millet)","	Plant Protection	","WEED CONTROL IN MAD AND PARTI SOIL","SPRAY OF GLYPHOSATE 2.5 GM PER LITER WATER FOR CONTROL OF DOOB GRASS IN CROP FREE FIELD","RAJASTHAN","JHALAWAR","PIRAWA (SUNEL)                                    ","2014-08-10 10:35:22.000"
"","AGRICULTURE","Oilseeds","Soybean (bhat)","","TELL ME WEED CONTROL OF SOYBEAN","SPRAY OF IMIZATHYPER 10% SL 400 GM PER HA IN DISSOLVE 400 LITER WATER","RAJASTHAN","JHALAWAR","BAKANI                                            ","2014-08-10 10:43:19.000"
"JAYAD","HORTICULTURE","Vegetables","Tomato","	Plant Protection	","CONTROL OF INSECT IN TOMATO ?","SPRAY OF ACEPHATE 75% SP 2 GM PER LITER WATER + MANCOZEB 2GM PAR LITAR WATER","RAJASTHAN","JHALAWAR","PIRAWA (SUNEL)                                    ","2014-08-10 10:44:25.000"
"","AGRICULTURE","Others","Others","Weather","TELL ME WEATHER INFORMATION","RAIN POSSIBILITY IN NEXT 5 DAYS","RAJASTHAN","JHALAWAR","MANOHARTHANA                                      ","2014-08-10 10:52:22.000"
"JAYAD","AGRICULTURE","Others","Others","Weather","YELLOW COLOUR IN SOYABEEN","SPRAY OF FERUS SULPHATE 5 GM + CITRIC ACID 1 GM PER LITER WATER","RAJASTHAN","JHALAWAR","JHALRAPATAN                                       ","2014-08-10 11:01:47.000"
"JAYAD","AGRICULTURE","Others","Others","Cultural Practices","TELL ME WEED CONTROL IN SOYABEAN.","HAND WEEDING MUST","RAJASTHAN","JHALAWAR","JHALRAPATAN                                       ","2014-08-10 11:02:29.000"
"","HORTICULTURE","Vegetables","Tomato","	Plant Protection	","CONTROL FLOWER DROP IN tomato","PLANOFIX 1 M.L./4LITER NWATER SPRAY","RAJASTHAN","JHALAWAR","PIRAWA (SUNEL)                                    ","2014-08-10 11:04:45.000"
"","AGRICULTURE","Oilseeds","Soybean (bhat)","","TELL ME WEED CONTROL OF SOYBEAN","SPRAY OF IMIZATHYPER 10% SL 400 GM PER HA IN DISSOLVE 400 LITER WATER","RAJASTHAN","JHALAWAR","PIRAWA (SUNEL)                                    ","2014-08-10 11:12:58.000"
"JAYAD","HORTICULTURE","Vegetables","Tomato","","TELL ME  DISEASE CONTROL IN TOMATO","SPRAY MANCOZEB 75% WP 2 GM PER LITER WATER","RAJASTHAN","JHALAWAR","PIRAWA (SUNEL)                                    ","2014-08-10 11:14:57.000"
"JAYAD","HORTICULTURE","Vegetables","Tomato","	Plant Protection	","CONTORL OF INSECT IN TOMATO ?","SPRAY OF IMIDACHLOPRID 17.8% SL 0.5 ML PER LITER WATER","RAJASTHAN","JHALAWAR","BAKANI                                            ","2014-08-10 11:19:42.000"
"JAYAD","HORTICULTURE","Fruits","Orange","Fertilizer Use and Availability","TELL ME FRUIT CRAKING CONTROL IN ORANGE .","BORAX 4 GRAM PER LITRE WATER SPRAY","RAJASTHAN","JHALAWAR","JHALRAPATAN                                       ","2014-08-10 11:29:00.000"
"","AGRICULTURE","Others","Others","Weather","TELL ME WHEATHER REPORT","RAINFALL MAY BE  IN  NEXT FIVE DAYS","RAJASTHAN","JHALAWAR","BAKANI                                            ","2014-08-10 11:31:33.000"
"JAYAD","AGRICULTURE","Oilseeds","Soybean (bhat)","Cultural Practices","HERBICIDE IN GUAR ?","SPRAY OF IMIZATHYPER 10% SL 400 GM PER HA IN DISSOLVE 400 LITER WATER","RAJASTHAN","JHALAWAR","JHALRAPATAN                                       ","2014-08-10 11:46:41.000"
"","","","","","","","RAJASTHAN","JHALAWAR","JHALRAPATAN                                       ","2014-08-10 11:54:49.000"
"","AGRICULTURE","Others","Others","Weather","GIVE ME WEATHER INFORMATION","WEATHER INFORMATION RAINFALL MAY BE OCCER IN NEXT FIVE DAYS","RAJASTHAN","JHALAWAR","PIRAWA (SUNEL)                                    ","2014-08-10 12:02:28.000"
"","AGRICULTURE","Millets","Maize (Makka)","","TELL ME LOW GROETH OF MAIZE","SPRAY SOLUBLE NPK  18:18:18 GRADE 10 GM/LTR WATER","RAJASTHAN","JHALAWAR","DAG                                               ","2014-08-10 12:25:13.000"
"JAYAD","HORTICULTURE","Vegetables","Tomato","	Plant Protection	","TELL ME FROIT BORER CONTROL IN TOMATO","SPRAY OF ACEPHATE 75% SP 2 GM PER LITER WATER","RAJASTHAN","JHALAWAR","PIRAWA (SUNEL)                                    ","2014-08-10 13:24:20.000"
"JAYAD","AGRICULTURE","Fodder Crops","Guar","	Plant Protection	","LOW GROWTH IN GUAR","SPRAY OF UREA 10 GRAM PER LITER WATER","RAJASTHAN","JHALAWAR","PIRAWA (SUNEL)                                    ","2014-08-10 13:28:57.000"
"","AGRICULTURE","Others","Others","Government Schemes","TELL ME SUBSIDY ON SPRINKLER SYSTEM","SUBSIDY ON SPRINKLER SYSTEM= 50% OF TOTAL COST OR 15000/- MAXIMUM","RAJASTHAN","JHALAWAR","DAG                                               ","2014-08-10 13:37:31.000"
"JAYAD","AGRICULTURE","Others","Others","Weather","TELL ME RAIN INFORMATION","NO RAIN POSSIBILITY IN NEXT 5 DAYS","RAJASTHAN","JHALAWAR","PIRAWA (SUNEL)                                    ","2014-08-10 13:45:56.000"
"JAYAD","HORTICULTURE","Fruits","Orange","	Plant Protection	","DRY BRANCH IN ORANGE","BORAX MIXTURE 4 GRAM /PAR LITER WATER SPREY","RAJASTHAN","JHALAWAR","PIRAWA (SUNEL)                                    ","2014-08-10 13:55:31.000"
"","","","","","","","RAJASTHAN","JHALAWAR","JHALRAPATAN                                       ","2014-08-10 14:00:03.000"
"JAYAD","HORTICULTURE","Vegetables","Chillies","	Plant Protection	","TELL ME BLIGHT CONTROL IN CHILLY","SPRAY OF MENCOZEB 2GM PAR LITAR WATER","RAJASTHAN","JHALAWAR","BAKANI                                            ","2014-08-10 14:07:56.000"
"","ANIMAL HUSBANDRY","Animal","Bovine(Cow,Buffalo)","Disease Management","disease problem of buffelo","pz contact of animal doctor","RAJASTHAN","JHALAWAR","JHALRAPATAN                                       ","2014-08-10 16:06:15.000"
"","HORTICULTURE","Fruits","Mango","	Plant Protection	","FOR INSECT CONTROLE IN ORANGE","SPRAY OF ACEPHATE 75% SP 2 GM PER LITER WATER + MENCOJEB 2GM PAR LITAR WATER","RAJASTHAN","JHALAWAR","JHALRAPATAN                                       ","2014-08-10 16:26:32.000"
"JAYAD","AGRICULTURE","Others","Others","Weather","TELL ME RAIN INFORMATION","TWO DAYS RAINFALL","RAJASTHAN","JHALAWAR","JHALRAPATAN                                       ","2014-08-10 17:29:09.000"
"JAYAD","HORTICULTURE","Vegetables","Chillies","","TELL ME FLOWER DROPPING CONTROL IN chilli","FLOWER/FRUIT DROP CONTROL  SPRAY OF PLANOFIX 1 ML PER 4 LITER WATER","RAJASTHAN","JHALAWAR","JHALRAPATAN                                       ","2014-08-11 06:52:38.000"
"JAYAD","HORTICULTURE","Vegetables","Chillies","	Plant Protection	","control of flower dropping in chilli","SPRAY OF PLANOFIX 1 ML PER 4 LITER WATER","RAJASTHAN","JHALAWAR","JHALRAPATAN                                       ","2014-08-11 06:55:33.000"
"","HORTICULTURE","Vegetables","Radish","	Plant Protection	","TELL ME CONTROL OF JASSID IN RADISH","SPRAY OF DIMETHOATE  30% EC 2 ML PER LITER WATER","RAJASTHAN","JHALAWAR","KHANPUR                                           ","2014-08-11 06:58:21.000"
"","","","","","","","RAJASTHAN","JHALAWAR","PIRAWA (SUNEL)                                    ","2014-08-11 07:07:51.000"
"","AGRICULTURE","Others","Others","Weather","TELL ME WEATHER INFORMATION","RAIN FALL  POSSIBILITY IN NEXT 5 DAYS","RAJASTHAN","JHALAWAR","JHALRAPATAN                                       ","2014-08-11 07:26:04.000"
"JAYAD","AGRICULTURE","Oilseeds","Soybean (bhat)","	Plant Protection	","PEST CONTROL IN SOYABEAN","SPRAY OF INDOXACARB 14.5% SC 1 ML PER LITER WATER","RAJASTHAN","JHALAWAR","DAG                                               ","2014-08-11 07:34:56.000"
"JAYAD","AGRICULTURE","Others","Others","Weather","TELL ME WEATHER INFORMATION","RAIN MAY BE CONTINUE NEXT 5 DAYS","RAJASTHAN","JHALAWAR","JHALRAPATAN                                       ","2014-08-11 07:36:15.000"
"JAYAD","HORTICULTURE","Vegetables","Tomato","	Plant Protection	","CONTROL OF DISEASE IN TOMATO ?","SPRAY OF CARBENDAZIM 12% + MANCOZEB 63% WP 2 GM PER LITER WATER","RAJASTHAN","JHALAWAR","JHALRAPATAN                                       ","2014-08-11 07:54:03.000"
"","AGRICULTURE","Oilseeds","Soybean (bhat)","Cultural Practices","TELL ME ABOUT PEST IN SOYABEAN","SPRAY OF DIMETHOATE 30% EC 2 ML PER LITER WATER","RAJASTHAN","JHALAWAR","JHALRAPATAN                                       ","2014-08-11 08:04:54.000"
"","","","","","","","RAJASTHAN","JHALAWAR","PIRAWA (SUNEL)                                    ","2014-08-11 08:14:58.000"
"","AGRICULTURE","Others","Others","Weather","TELL ME WEATHER INFORMATION","MAY BE RAIN POSSIBILITY CONTINUE IN NEXT 5 DAYS","RAJASTHAN","JHALAWAR","BAKANI                                            ","2014-08-11 08:27:19.000"
"JAYAD","AGRICULTURE","Others","Others","Weather","TELL ME WEATHER INFORMATION","RAIN MAY BE CONTINUE NEXT 5 DAYS","RAJASTHAN","JHALAWAR","DAG                                               ","2014-08-11 08:43:53.000"
"","AGRICULTURE","Others","Others","Weather","TELL ME WHEATHER REPORT","NO RAINFALL POSSIBILITY IN YOUR DISTRICT  NEXT 5  DAYS","RAJASTHAN","JHALAWAR","JHALRAPATAN                                       ","2014-08-11 08:50:49.000"
"","AGRICULTURE","Millets","Pearl Millet (Bajra/Bulrush Millet/Spiked Millet)","Bio-Pesticides and Bio-Fertilizers","TELL ME ABOUT LOW GROWTH IN MAKKA","SPRAY MICRONUTRIENT 4 GRAM PER LITER WATER","RAJASTHAN","JHALAWAR","DAG                                               ","2014-08-11 08:55:24.000"
"","HORTICULTURE","Fruits","Orange","	Plant Protection	","pest and black sport in orange plant","???? ????? ???????? 3 ????? + ?????????? 30%  ?.??. 2 ??.??. ????? ???? ???? ??? ??? ????? ?????? ?????","RAJASTHAN","JHALAWAR","PIRAWA (SUNEL)                                    ","2014-08-11 09:10:24.000"
"KHARIF","AGRICULTURE","Others","Others","","TELL ME  WEATHER  REPORT","RAIN FALL POSSIBILITY IN NEXT 5 DAYS","RAJASTHAN","JHALAWAR","BAKANI                                            ","2014-08-11 09:18:18.000"
"","AGRICULTURE","Others","Others","Weather","TELL ME WEATHER INFORMETION IN MY DISTRICT","LIGHT RAIN MAY BE NEXT 3-4 DAYS","RAJASTHAN","JHALAWAR","PIRAWA (SUNEL)                                    ","2014-08-11 09:51:50.000"
"","AGRICULTURE","Others","Others","Weather","TELL ME WEATHER INFORMATION","MAY BE RAIN POSSIBILITY CONTINUE IN NEXT 5 DAYS","RAJASTHAN","JHALAWAR","DAG                                               ","2014-08-11 10:02:30.000"
"","AGRICULTURE","Others","Others","Weather","TELL ME WHEATHER REPORT","???? 5 ????? ??? ????? ?? ???????? ???","RAJASTHAN","JHALAWAR","PIRAWA (SUNEL)                                    ","2014-08-11 10:36:25.000"
"","HORTICULTURE","Vegetables","Tomato","	Plant Protection	","TELL ME FLOWER DROPPING CONTROL IN TOMATO","SPRAY OF PLANOFIX 1 ML PER 4 LITER WATER FOR FLOWER DROP CONTROL","RAJASTHAN","JHALAWAR","PIRAWA (SUNEL)                                    ","2014-08-11 10:37:09.000"
"","HORTICULTURE","Vegetables","Tomato","	Plant Protection	","TELL ME FLOWER DROPPING CONTROL IN TOMATO","SPRAY OF PLANOFIX 1 ML PER 4 LITER WATER FOR FLOWER DROP CONTROL","RAJASTHAN","JHALAWAR","PIRAWA (SUNEL)                                    ","2014-08-11 10:37:12.000"
"JAYAD","AGRICULTURE","Cereals","Paddy (Dhan)","Cultural Practices","HERBICIDE IN RICE ?","SPRAY OF Bispyribac Sodium 10% SC 1 ML PER LITER WATER AFTER 15-25  DAYS OF TRANSPLANTING","RAJASTHAN","JHALAWAR","JHALRAPATAN                                       ","2014-08-11 10:40:32.000"
"JAYAD","HORTICULTURE","Vegetables","Tomato","","TELL ME  DISEASE CONTROL IN TOMATO","SPRAY OF CARBENDAZIM 12% + MANCOZEB 63% WP 2 GM PER LITER WATER","RAJASTHAN","JHALAWAR","BAKANI                                            ","2014-08-11 10:45:26.000"
"JAYAD","AGRICULTURE","Oilseeds","Soybean (bhat)","	Plant Protection	","WEED CONTROL IN SOYBEAN","ONLY HAND HOING","RAJASTHAN","JHALAWAR","PIRAWA (SUNEL)                                    ","2014-08-11 12:25:18.000"
"","AGRICULTURE","Others","Others","Weather","TELL ME WHEATHER REPORT","RAINFALL POSSIBILITY  IN  NEXT 5 DAYS, CLOUDY SKY","RAJASTHAN","JHALAWAR","PIRAWA (SUNEL)                                    ","2014-08-11 13:42:33.000"
"","AGRICULTURE","Oilseeds","Soybean (bhat)","Cultural Practices","TELL ME ABOUT WEED CONTROL IN SOYABEAN","SPRAY OF IMIZATHYPER 10% SL 400 ML PER HA IN 400 LITER WATER","RAJASTHAN","JHALAWAR","JHALRAPATAN                                       ","2014-08-11 13:56:34.000"
"","AGRICULTURE","Others","Others","Weather","TELL ME WEATHER INFORMETION IN MY DISTRICT","LIGHT RAIN MAY BE NEXT 3-4 DAYS","RAJASTHAN","JHALAWAR","PIRAWA (SUNEL)                                    ","2014-08-11 14:05:07.000"
"","","","","","","","RAJASTHAN","JHALAWAR","MANOHARTHANA                                      ","2014-08-11 14:34:48.000"
"JAYAD","HORTICULTURE","Vegetables","Tomato","	Plant Protection	","TELL ME CONTROL FRUIT BORER IN TOMATO","DELTAMETHRIN 2.5 EC 1 ML/LITER WATER","RAJASTHAN","JHALAWAR","PIRAWA (SUNEL)                                    ","2014-08-11 15:02:54.000"
"KHARIF","AGRICULTURE","Others","Others","Weather","TELL ME WEATHER REPORT","NO RAIN POSSIBILITY IN NEXT 4-5 DAYS, BUT SKY CLOUDLY","RAJASTHAN","JHALAWAR","KHANPUR                                           ","2014-08-19 14:34:38.103"
"KHARIF","AGRICULTURE","Others","Others","Weather","TELL ME WEATHER REPORT","NO RAIN POSSIBILITY IN NEXT 4-5 DAYS, BUT SKY CLOUDLY","RAJASTHAN","JHALAWAR","KHANPUR                                           ","2014-08-19 14:34:45.577"
"KHARIF","AGRICULTURE","Others","Others","Weather","TELL ME WEATHER REPORT","NO RAIN POSSIBILITY IN NEXT 4-5 DAYS, BUT SKY CLOUDLY","RAJASTHAN","JHALAWAR","KHANPUR                                           ","2014-08-19 14:34:47.927"
"KHARIF","AGRICULTURE","Others","Others","Weather","TELL ME WEATHER REPORT","NO RAIN POSSIBILITY IN NEXT 4-5 DAYS, BUT SKY CLOUDLY","RAJASTHAN","JHALAWAR","KHANPUR                                           ","2014-08-19 14:34:48.553"
"KHARIF","AGRICULTURE","Others","Others","Weather","TELL ME WEATHER REPORT","NO RAIN POSSIBILITY IN NEXT 4-5 DAYS, BUT SKY CLOUDLY","RAJASTHAN","JHALAWAR","KHANPUR                                           ","2014-08-19 14:34:48.973"
"KHARIF","AGRICULTURE","Oilseeds","Soybean (bhat)","	Plant Protection	","TELL ME CONTROL OF BORER IN SOYABEAN","SPRAY OF ACEPHATE 75% SP 2 GM PER LITER WATER","RAJASTHAN","JHALAWAR","PIRAWA (SUNEL)                                    ","2014-08-19 17:15:53.533"
"KHARIF","AGRICULTURE","Oilseeds","Sesame (Gingelly/Til)/Sesamum","Cultural Practices","TELL ME CONTROL OF STEM ROT IN SESAME","SPRAY OF CARBENDAZIM 2 GM PER LITER WATER","RAJASTHAN","JHALAWAR","KHANPUR                                           ","2014-08-19 17:21:28.440"
"KHARIF","AGRICULTURE","Oilseeds","Sesame (Gingelly/Til)/Sesamum","Cultural Practices","TELL ME CONTROL OF STEM ROT IN SESAME","SPRAY OF CARBENDAZIM 2 GM PER LITER WATER","RAJASTHAN","JHALAWAR","KHANPUR                                           ","2014-08-19 17:26:52.733"
"KHARIF","AGRICULTURE","Oilseeds","Sesame (Gingelly/Til)/Sesamum","Cultural Practices","TELL ME CONTROL OF STEM ROT IN SESAME","SPRAY OF CARBENDAZIM 2 GM PER LITER WATER","RAJASTHAN","JHALAWAR","KHANPUR                                           ","2014-08-19 17:32:18.680"
"KHARIF","AGRICULTURE","Others","Others","Weather","TELL ME WEATHER REPORT IN MY DISTRIC","NO RAIN MAY BE NEXT 5 DAYS IN YOUR DISTRICT","RAJASTHAN","JHALAWAR","PIRAWA (SUNEL)                                    ","2014-08-19 17:37:29.187"
"KHARIF","AGRICULTURE","Oilseeds","Soybean (bhat)","	Plant Protection	","TELL ME INSECT CONTROL IN SOYABEAN","SPRAY TRIJOPHOS 2 ML /LITRE WATER","RAJASTHAN","JHALAWAR","JHALRAPATAN                                       ","2014-08-19 17:43:11.893"
"KHARIF","AGRICULTURE","Oilseeds","Soybean (bhat)","Nutrient Management","tell me about dose of urea in soyabean","SPRAY OF THIOUREA 0.5 GM PER LITER WATER","RAJASTHAN","JHALAWAR","JHALRAPATAN                                       ","2014-08-19 17:46:14.413"
"KHARIF","AGRICULTURE","Others","Others","Weather","TELL ME WEATHER INFORMETION","RAIN MAY BE ON 23 AND 24 AUGUST","RAJASTHAN","JHALAWAR","PIRAWA (SUNEL)                                    ","2014-08-19 17:53:45.860"
"KHARIF","AGRICULTURE","Others","Others","Weather","tell me weather report in JALAWAR","RAIN FALL UP TO 5 DAYS, CLOUDY SKY","RAJASTHAN","JHALAWAR","PIRAWA (SUNEL)                                    ","2014-08-19 18:16:22.270"
"KHARIF","AGRICULTURE","Others","Others","Weather","TELL ME WEATHER REPORT IN JALAWAR","NO RAIN POSSIBILITY IN NEXT 5 DAYS","RAJASTHAN","JHALAWAR","PIRAWA (SUNEL)                                    ","2014-08-19 18:42:01.387"
"KHARIF","HORTICULTURE","Condiments and Spices","Ginger","Cultural Practices","TELL ME CONTROL OF ROOT ROT IN GINGER","BAVISTIN 250 GM PER BHIGA WITH IRRIGATION","RAJASTHAN","JHALAWAR","MANOHARTHANA                                      ","2014-08-19 20:11:16.810"
"KHARIF","HORTICULTURE","Vegetables","Pea (Vegetable)","Seeds and Planting Material","TELL ME PEA VARIETY","JAWAHAR MATAR APARNA","RAJASTHAN","JHALAWAR","PIRAWA (SUNEL)                                    ","2014-08-19 20:20:58.290"
"KHARIF","AGRICULTURE","Others","Others","Weather","TELL ME WEATHER INFORMETION","NO RAIN POSSIBILITY IN NEXT 5 DAYS","RAJASTHAN","JHALAWAR","PIRAWA (SUNEL)                                    ","2014-08-19 20:42:08.000"
"KHARIF","AGRICULTURE","Oilseeds","Soybean (bhat)","	Plant Protection	","TELL ME NOT GROWTH IN SOYABIN","NPK-18;18;18 GRED 10 GRAM/LITER SPRAY","RAJASTHAN","JHALAWAR","JHALRAPATAN                                       ","2014-08-19 21:00:35.790"
"KHARIF","AGRICULTURE","Others","Others","Weather","TELL ME WEATHER REPORT IN MY DISTRICT","NO RAIN FALL IN NEXT FIVE DAY,CLOUDY SKY","RAJASTHAN","JHALAWAR","DAG                                               ","2014-08-20 07:58:14.753"
"KHARIF","AGRICULTURE","Others","Others","Weather","TELL ME WEATHER REPORT IN MY DISTRIC","MAY BE RAIN POSSIBILITY ON 23,24 AUGUST IN YOUR DISTRIC","RAJASTHAN","JHALAWAR","PIRAWA (SUNEL)                                    ","2014-08-20 08:17:57.447"
"KHARIF","AGRICULTURE","Oilseeds","Soybean (bhat)","	Plant Protection	","TELL ME CONTROL GARDAL BEETAL","SPRAY OF INDOXACARB 14.5% SC 0.5 ML PER LITER WATER","RAJASTHAN","JHALAWAR","PIRAWA (SUNEL)                                    ","2014-08-20 08:24:57.270"
"KHARIF","AGRICULTURE","Others","Others","Weather","TELL ME WEATHER REPORT","NO RAIN POSSIBILITY IN NEXT 5 DAYS","RAJASTHAN","JHALAWAR","BAKANI                                            ","2014-08-20 08:25:51.133"
"JAYAD","HORTICULTURE","Vegetables","Tomato","	Plant Protection	","TELL ME LEAF CURL CONTROL IN TOMATO","SPRAY OF IMIDACHLOPRID 17.8% SL 0.5 ML PER LITER WATER 
SPRAY OF MULTIPLAX MICRONUTRIENT 4 GM PER LITER WATER","RAJASTHAN","JHALAWAR","PIRAWA (SUNEL)                                    ","2014-08-20 08:26:28.380"
