"Season","Sector","Category","Crop","QueryType","QueryText","KCCAns","StateName","DistrictName","BlockName","CreatedOn"
"KHARIF","AGRICULTURE","Oilseeds","Soybean (bhat)","	Plant Protection	","TELL ME CONTROL OF LEAF CUTTING PEST IN SOYABEAN","PEST CONTROL IN LEMON CYPERMETHRIN 1.5 ML PER LITER WATER","RAJASTHAN","JHALAWAR","JHALRAPATAN                                       ","2014-08-20 08:37:32.960"
"KHARIF","HORTICULTURE","Vegetables","Pea (Vegetable)","Seeds and Planting Material","TELL ME VARIETY OF VEGETABLE PEA","VARIETY OF VEGETABLE PEA ARKEL,HARA BONA,JWAHAR MATAR-3","RAJASTHAN","JHALAWAR","PIRAWA (SUNEL)                                    ","2014-08-20 08:46:09.767"
"KHARIF","AGRICULTURE","Oilseeds","Soybean (bhat)","	Plant Protection	","pest control of soybean","??????????? ??? ?? 1.5 ??.??. ????? ???? ???? ??? ??? ??? ?? ?????? ?????","RAJASTHAN","JHALAWAR","JHALRAPATAN                                       ","2014-08-20 08:50:29.817"
"KHARIF","HORTICULTURE","Vegetables","Tomato","	Plant Protection	","TELL ME APHID CONTROL IN TOMATO","DAIMITHIYOT 30EC 2 ML /LITER , NPK-18;18;18 GRED 10 GRAM/LITER SPRAY","RAJASTHAN","JHALAWAR","PIRAWA (SUNEL)                                    ","2014-08-20 09:00:25.370"
"KHARIF","AGRICULTURE","Oilseeds","Soybean (bhat)","	Plant Protection	","TELL ME WEED CONTROL IN SOYABEAN .","HAND WEEDING MUST","RAJASTHAN","JHALAWAR","BAKANI                                            ","2014-08-20 10:14:28.277"
"KHARIF","AGRICULTURE","Oilseeds","Soybean (bhat)","	Plant Protection	","tell me control of insect of soyabean","SPRAY OF MONOCROTOPHOS 36% SL 2 ML PER LITER WATER","RAJASTHAN","JHALAWAR","JHALRAPATAN                                       ","2014-08-20 10:36:17.250"
"KHARIF","AGRICULTURE","Others","Others","Weather","TELL ME WEATHER INFORMATION","NO RAIN POSSIBILITY IN NEXT 5 DAYS","RAJASTHAN","JHALAWAR","MANOHARTHANA                                      ","2014-08-20 10:42:40.843"
"KHARIF","AGRICULTURE","Oilseeds","Soybean (bhat)","	Plant Protection	","TELL ME  INSECT CONTROL IN SOYABEN","SPARY OF DAIMETHOAT 30% EC 2ML PER LITER WATER","RAJASTHAN","JHALAWAR","KHANPUR                                           ","2014-08-20 10:55:49.317"
"KHARIF","HORTICULTURE","Vegetables","Tomato","	Plant Protection	","leaf spot in tomato","SPRAY OF COPPER OXICHLORIDE 45 GM + STREPTOCYCLIN 1.5 GM PER 15 LITER WATER","RAJASTHAN","JHALAWAR","PIRAWA (SUNEL)                                    ","2014-08-20 11:06:04.023"
"KHARIF","AGRICULTURE","Others","Others","Weather","TELL ME WEATHER INFORMATION","RAIN FALL POSSIBLE IN NEXT 5 DAYS","RAJASTHAN","JHALAWAR","DAG                                               ","2014-08-20 11:44:17.487"
"KHARIF","AGRICULTURE","Others","Others","Weather","TELL ME WEATHER INFORMATION","RAIN FALL POSSIBLE IN NEXT 5 DAYS","RAJASTHAN","JHALAWAR","DAG                                               ","2014-08-20 11:44:20.063"
"KHARIF","AGRICULTURE","Others","Others","Weather","TELL ME WEATHER INFORMATION","NO RAIN FALL UP TO 5 DAYS, CLOUDY SKY","RAJASTHAN","JHALAWAR","JHALRAPATAN                                       ","2014-08-20 11:45:33.580"
"KHARIF","AGRICULTURE","Oilseeds","Soybean (bhat)","	Plant Protection	","TELL ME WEED CONTROL OF SOYBEAN","SPRAY OF IMIZATHYPER 10% SL 400 GM PER HA IN 400 LITER WATER PER HACTRE","RAJASTHAN","JHALAWAR","JHALRAPATAN                                       ","2014-08-20 11:58:18.070"
"KHARIF","AGRICULTURE","Oilseeds","Soybean (bhat)","	Plant Protection	","TELL ME CONTROL OF LEAF CUTTING PEST IN SOYABEAN","CYPERMETHRIN 1.5 ML PER LITER WATER SPRAY","RAJASTHAN","JHALAWAR","PIRAWA (SUNEL)                                    ","2014-08-20 12:19:11.417"
"KHARIF","HORTICULTURE","Vegetables","Tomato","	Plant Protection	","CALOR ROOT CONTROL IN TOMATO","DRENCHING OF CARBENDAZIM 250 GM PER BIGHA WITH IRRIGATION","RAJASTHAN","JHALAWAR","PIRAWA (SUNEL)                                    ","2014-08-20 12:22:54.753"
"KHARIF","AGRICULTURE","Oilseeds","Soybean (bhat)","	Plant Protection	","INSECT CONTROL IN SOYBEAN","SPRAY OF TRIZOPHOS 40% EC 2 ML PER LITER WATER","RAJASTHAN","JHALAWAR","PIRAWA (SUNEL)                                    ","2014-08-20 13:07:44.260"
"KHARIF","AGRICULTURE","Others","Others","Weather","TELL ME WEATHER INFORMATION","RAIN POSSIBILITY IN NEXT 5 DAYS","RAJASTHAN","JHALAWAR","DAG                                               ","2014-08-20 13:43:25.353"
"KHARIF","AGRICULTURE","Others","Others","Weather","TELL ME RAIN INFORMATION","NO RAIN FALL POSSIBILITY IN NEXT 5 DAYS IN YOUR DIST","RAJASTHAN","JHALAWAR","JHALRAPATAN                                       ","2014-08-20 13:54:00.230"
"KHARIF","AGRICULTURE","Oilseeds","Soybean (bhat)","	Plant Protection	","TELL ME PROPER GROWTH IN SOYABEAN","SPRAY OF THIO UREA 0.5 GM PER LITER WATER FOR BETTER PRODUCTION IN SOYABEN","RAJASTHAN","JHALAWAR","PIRAWA (SUNEL)                                    ","2014-08-20 14:09:28.963"
"RABI","AGRICULTURE","Oilseeds","Mustard","Seeds","TELL VARETY OF MUSTARD","RD-30 T-59,BO-902 VARETY OF MUSTARD","RAJASTHAN","JHALAWAR","PIRAWA (SUNEL)                                    ","2014-08-20 15:07:02.873"
"KHARIF","HORTICULTURE","Fruits","Lemon","	Plant Protection	","TERMOITE CONTROL IN ORANGE","USE PHIPRONIL 5 % EC 5 ML PER PALNT WITH IRRIGATION","RAJASTHAN","JHALAWAR","DAG                                               ","2014-08-20 15:47:10.780"
"KHARIF","AGRICULTURE","Others","Others","Weather","TELL ME WEATHER INFORMATION","NO RAINFALL NEXT FIVE DAYS","RAJASTHAN","JHALAWAR","JHALRAPATAN                                       ","2014-08-20 16:08:20.123"
"KHARIF","AGRICULTURE","Others","Others","Weather","tell me about weather information","NO RAIN FALL POSSIBILITY IN NEXT 5 DAYS IN YOUR DIST","RAJASTHAN","JHALAWAR","PIRAWA (SUNEL)                                    ","2014-08-20 17:48:46.437"
"KHARIF","AGRICULTURE","Others","Others","Weather","TELL ME WEATHER INFORMATION","RAINFALL IN NEXT 2-3 DAYS IN YOUR DISTRICT","RAJASTHAN","JHALAWAR","PIRAWA (SUNEL)                                    ","2014-08-20 17:54:53.253"
"KHARIF","AGRICULTURE","Others","Others","Weather","TELL ME WEATHER INFORMATION","RAINFALL IN NEXT 2-3 DAYS IN YOUR DISTRICT","RAJASTHAN","JHALAWAR","PIRAWA (SUNEL)                                    ","2014-08-20 17:54:53.987"
"KHARIF","HORTICULTURE","Condiments and Spices","Garlic","Seeds and Planting Material","TELL ME GARLIC SEED RATE","GARLIC SEED RATE : 5-6 QT CLOVES PER HACTARE","RAJASTHAN","JHALAWAR","JHALRAPATAN                                       ","2014-08-20 18:06:18.753"
"KHARIF","AGRICULTURE","Millets","Maize (Makka)","	Plant Protection	","TELL ME BLIGHT CONTROL IN MAIZE","SPRAY OF MENCOZEB 2GRABM PAR LITAR WATER","RAJASTHAN","JHALAWAR","MANOHARTHANA                                      ","2014-08-20 18:30:44.243"
"KHARIF","HORTICULTURE","Vegetables","Chillies","	Plant Protection	","PEST CONTROL IN CHILLIE","EMIDACLOROPRID 17.8% 0.5M.L./LITERA WATRE SPRAY","RAJASTHAN","JHALAWAR","JHALRAPATAN                                       ","2014-08-20 19:08:07.620"
"KHARIF","HORTICULTURE","Vegetables","Tomato","	Plant Protection	","EARLY BLIGHT CONTROL IN TOMATO","SPRAY OF COPPER OXICHLORIDE 45 GM + STREPTOCYCLIN 1.5 GM PER 15 LITER WATER","RAJASTHAN","JHALAWAR","JHALRAPATAN                                       ","2014-08-20 19:22:44.147"
"KHARIF","AGRICULTURE","Others","Others","Weather","TELL ME WEATHER REPORT IN JALAWAR","LIGHT RAIN MAY BE NEXT 5 DAYS","RAJASTHAN","JHALAWAR","BAKANI                                            ","2014-08-20 20:09:34.443"
"KHARIF","AGRICULTURE","Oilseeds","Soybean (bhat)","	Plant Protection	","TELL ME CONTROL OF INSECT IN SOYABEAN","SPRAY OF TRIZOPHOS 40% EC 2 ML PER LITER WATER","RAJASTHAN","JHALAWAR","JHALRAPATAN                                       ","2014-08-21 06:38:50.693"
"KHARIF","AGRICULTURE","Oilseeds","Soybean (bhat)","	Plant Protection	","TELL ME CONTROL OF INSECT IN SOYABEAN","SPRAY OF TRIZOPHOS 40% EC 2 ML PER LITER WATER","RAJASTHAN","JHALAWAR","JHALRAPATAN                                       ","2014-08-21 06:39:04.660"
"KHARIF","AGRICULTURE","Oilseeds","Soybean (bhat)","	Plant Protection	","TELL ME CONTROL OF INSECT IN SOYABEAN","SPRAY OF TRIZOPHOS 40% EC 2 ML PER LITER WATER","RAJASTHAN","JHALAWAR","JHALRAPATAN                                       ","2014-08-21 06:39:10.123"
"KHARIF","AGRICULTURE","Oilseeds","Soybean (bhat)","	Plant Protection	","TELL ME CONTROL OF INSECT IN SOYABEAN ?","SPRAY OF TRIZOPHOS 40% EC 2 ML PER LITER WATER","RAJASTHAN","JHALAWAR","PIRAWA (SUNEL)                                    ","2014-08-21 06:43:25.903"
"KHARIF","HORTICULTURE","Vegetables","Potato","	Plant Protection	","TELL ME SOWING TIME  OF POTATO","SOWING TIME  OF POTATO-15 SEP. TO 15 OCTOM.","RAJASTHAN","JHALAWAR","MANOHARTHANA                                      ","2014-08-21 07:36:20.673"
"KHARIF","AGRICULTURE","Others","Others","Weather","TELL ME WEATHER INFORMATION","RAIN POSSIBILITY IN NEXT 5 DAYS ,BUT CLOUDLY","RAJASTHAN","JHALAWAR","JHALRAPATAN                                       ","2014-08-21 07:46:38.707"
"KHARIF","AGRICULTURE","Others","Others","Weather","	RAIN FALL POSSIBLE IN NEXT 5 DAYS","NO RAINFALL NEXT FIVE DAYS","RAJASTHAN","JHALAWAR","BAKANI                                            ","2014-08-21 07:50:22.227"
"KHARIF","AGRICULTURE","Others","Others","Weather","TELL ME WEATHER INFORMATION","NO RAINFALL POSSIBILITY IN NEXT FIVE DAYS  BUT CLOUDY","RAJASTHAN","JHALAWAR","JHALRAPATAN                                       ","2014-08-21 08:13:46.480"
"KHARIF","AGRICULTURE","Pulses","Black Gram (urd bean)","Weather","TELL ME  SPRAY OF MULTIPLAX PULSES","SPRAY OF MULTIPLAX (MICRONUTRIENT) 4 GM PER LITER WATER","RAJASTHAN","JHALAWAR","KHANPUR                                           ","2014-08-21 08:48:37.647"
"KHARIF","AGRICULTURE","Oilseeds","Soybean (bhat)","	Plant Protection	","TELL ME CONTROL THRIPS IN SOYABEEN","SPRAY OF IMIDACHLOPRID(CONFIDOR) 17.8% SL 0.5 ML PER LITER WATER","RAJASTHAN","JHALAWAR","JHALRAPATAN                                       ","2014-08-21 09:13:15.917"
"KHARIF","HORTICULTURE","Vegetables","Tomato","	Plant Protection	","TELL MR FLOWER DROP CONTROL IN","SPRAY OF MULTIPAX 4 GRAM / LITRE WATER","RAJASTHAN","JHALAWAR","JHALRAPATAN                                       ","2014-08-21 09:17:31.323"
"KHARIF","AGRICULTURE","Others","Others","Weather","ENQUARY ABOUT RAIN FALL IN MY DISTRICT","NO RAIN POSSIBILITY IN NEXT 5 DAYS","RAJASTHAN","JHALAWAR","PIRAWA (SUNEL)                                    ","2014-08-21 09:49:56.437"
"KHARIF","AGRICULTURE","Others","Others","Weather","TELL ME WEATHER REPORT ?","LIGHT RAIN MAY BE ON 29-31 AUGUST","RAJASTHAN","JHALAWAR","PIRAWA (SUNEL)                                    ","2014-08-21 10:04:27.977"
"KHARIF","HORTICULTURE","Vegetables","Tomato","	Plant Protection	","TELL ME BLACK ROOT CONTROL IN tomato","CARBENDAZIM 250 GRAM / BIGA WITH IRRIGATION WATER","RAJASTHAN","JHALAWAR","JHALRAPATAN                                       ","2014-08-21 10:13:36.717"
"KHARIF","AGRICULTURE","Oilseeds","Soybean (bhat)","	Plant Protection	","TELL ME CONTROL OF GERDLE BEETLE IN SOYABEAN","TRIZOPHOS 40% EC  2 ML PER LITER WATER","RAJASTHAN","JHALAWAR","JHALRAPATAN                                       ","2014-08-21 10:13:59.873"
"KHARIF","AGRICULTURE","Oilseeds","Soybean (bhat)","	Plant Protection	","TELL ME CONTROL OF GERDLE BEETLE IN SOYABEAN","TRIZOPHOS 40% EC  2 ML PER LITER WATER","RAJASTHAN","JHALAWAR","JHALRAPATAN                                       ","2014-08-21 10:14:00.720"
"JAYAD","AGRICULTURE","Others","Others","Weather","TELL ME WEATHER INFORMATION","RAINFALL ON DATE OF 23,24,25,26 AUGUST","RAJASTHAN","JHALAWAR","KHANPUR                                           ","2014-08-21 10:24:45.143"
"KHARIF","HORTICULTURE","Vegetables","Tomato","	Plant Protection	","JHULSA IN TOMATO","SPRAY OF COPPER OXICHLORIDE 3 GM PER LITER WATER","RAJASTHAN","JHALAWAR","PIRAWA (SUNEL)                                    ","2014-08-21 10:33:21.847"
"KHARIF","HORTICULTURE","Fruits","Orange","Fertilizer Use and Availability","TELL ME MICRONUTREINT IN ORANGE .","SPRAY SOLUBLE NPK  18:18:18 GRADE 10 GM/LTR WATER","RAJASTHAN","JHALAWAR","PIRAWA (SUNEL)                                    ","2014-08-21 10:48:08.700"
"KHARIF","HORTICULTURE","Vegetables","Tomato","	Plant Protection	","FUNGAL DISEASE CONTROL IN TOMARO","SPRAY OF RIDOMIL GOLD 2 GM PER LITER WATER","RAJASTHAN","JHALAWAR","PIRAWA (SUNEL)                                    ","2014-08-21 11:16:21.317"
"KHARIF","AGRICULTURE","Oilseeds","Soybean (bhat)","	Plant Protection	","TELL ME CONTROL OF INSECT IN SOYABEAN ?","SPRAY OF TRIZOPHOS 40% EC 2 ML PER LITER WATER","RAJASTHAN","JHALAWAR","JHALRAPATAN                                       ","2014-08-21 11:40:46.320"
"KHARIF","AGRICULTURE","Others","Others","Weather","TELL ME WEATHER INFORMATION","NO RAIN FALL UP TO 2 DAYS, CLOUDY SKY","RAJASTHAN","JHALAWAR","JHALRAPATAN                                       ","2014-08-21 11:50:26.490"
"KHARIF","AGRICULTURE","Oilseeds","Soybean (bhat)","	Plant Protection	","TELL ME PEST CONTROL OF SOYBEAN","?????????? 1.5 ?? ?? / ???? ???? ??? ??? ????? ?????? ??? |","RAJASTHAN","JHALAWAR","JHALRAPATAN                                       ","2014-08-21 12:01:44.277"
"KHARIF","AGRICULTURE","Others","Others","Weather","ME WEATHER INFORMATION TELL","	RAIN FALL POSSIBLE IN NEXT 5 DAYS","RAJASTHAN","JHALAWAR","PIRAWA (SUNEL)                                    ","2014-08-21 12:41:59.167"
"KHARIF","AGRICULTURE","Oilseeds","Soybean (bhat)","	Plant Protection	","LEAF CUTTING","SPRAY OF ACEPHATE  75% SP 2 GM PER LITER WATER","RAJASTHAN","JHALAWAR","MANOHARTHANA                                      ","2014-08-21 12:43:38.043"
"KHARIF","AGRICULTURE","Oilseeds","Soybean (bhat)","	Plant Protection	","TELL ME CONTROL OF GERDLE BEETLE IN SOYABEAN","TRIZOPHOS 40% EC  2 ML PER LITER WATER","RAJASTHAN","JHALAWAR","JHALRAPATAN                                       ","2014-08-21 13:14:24.570"
"KHARIF","HORTICULTURE","Vegetables","Tomato","	Plant Protection	","DISEASE CONTROL","SPRAY OF CARBENDAZIM 12% + MANCOZEB 63% WP 2 GM PER LITER WATER","RAJASTHAN","JHALAWAR","PIRAWA (SUNEL)                                    ","2014-08-21 13:27:04.730"
"KHARIF","HORTICULTURE","Vegetables","Chillies","	Plant Protection	","thrisp in chilli","SPRAY OF IMIDACHLOPRID(CONFIDOR) 17.8% SL 0.5 ML PER LITER WATER","RAJASTHAN","JHALAWAR","DAG                                               ","2014-08-21 14:02:45.040"
"KHARIF","HORTICULTURE","Vegetables","Tomato","	Plant Protection	","TELL ME LEAF CURL AND FLOWER DROPPING CONTROLI N TOMATO .","TELL ME SUCKING PEST CONTROL
SPRAY OF IMIDACHLOPRID 17.8% SL 0.5 ML PER LITER WATER 
SPRAY OF PLANOFIX 1 ML PER 4 LITER WATER FOR FLOWER DROP CONTROL","RAJASTHAN","JHALAWAR","BAKANI                                            ","2014-08-21 14:03:30.603"
"KHARIF","AGRICULTURE","Oilseeds","Soybean (bhat)","	Plant Protection	","TELL ME CONTROL OF INSECT IN SOYABEAN ?","SPRAY OF TRIZOPHOS 40% EC 2 ML PER LITER WATER","RAJASTHAN","JHALAWAR","JHALRAPATAN                                       ","2014-08-21 14:04:27.640"
"KHARIF","AGRICULTURE","Others","Others","Weather","TEL ME WEATHER INFORMATION","NO RAIN POSSIBILITY IN NEXT 5 DAYS,","RAJASTHAN","JHALAWAR","PIRAWA (SUNEL)                                    ","2014-08-21 14:07:59.597"
"KHARIF","AGRICULTURE","Oilseeds","Soybean (bhat)","	Plant Protection	","ROOT ROT CONTROL IN SOYABEAN","DRENCHING OF CARBENDAZIM 50% 1 KG PER HA","RAJASTHAN","JHALAWAR","BAKANI                                            ","2014-08-21 14:09:05.007"
"KHARIF","AGRICULTURE","Others","Others","Cultural Practices","TELL ME WEATHER REPORT","NO RAINFALL NEXT FIVE DAYS","RAJASTHAN","JHALAWAR","DAG                                               ","2014-08-21 14:45:55.673"
"KHARIF","AGRICULTURE","Others","Others","Weather","TELL ME WEATHER INFORMETION IN MY DISTRICT","NO RAIN POSSIBILITY IN NEXT 5 DAYS","RAJASTHAN","JHALAWAR","KHANPUR                                           ","2014-08-21 14:53:46.153"
"KHARIF","AGRICULTURE","Others","Others","Weather","TELL ME WEATHER INFORMATION","NO RAIN FALL UP TO 5 DAYS, CLOUDY SKY","RAJASTHAN","JHALAWAR","PIRAWA (SUNEL)                                    ","2014-08-21 14:56:52.380"
"KHARIF","HORTICULTURE","Vegetables","Tomato","	Plant Protection	","TELL ME NOT GROWTH IN TOMATO","NPK 18;18;18 GRED 10 GRAM/LITER SPRAY","RAJASTHAN","JHALAWAR","JHALRAPATAN                                       ","2014-08-21 15:01:10.260"
"KHARIF","HORTICULTURE","Fruits","Orange","	Plant Protection	","TELL ME CONTROL OF DIBACK IN ORANGE","SPRAY OF COPPER OXICHLORIDE 45 GM + STREPTOCYCLIN 1.5 GM PER 15 LITER WATER","RAJASTHAN","JHALAWAR","PIRAWA (SUNEL)                                    ","2014-08-21 16:17:52.400"
"KHARIF","AGRICULTURE","Oilseeds","Soybean (bhat)","	Plant Protection	","TELL ME WEED CONTROL IN SOYABIN","NOT WEEDISIDE USE","RAJASTHAN","JHALAWAR","BAKANI                                            ","2014-08-21 17:09:16.240"
"KHARIF","AGRICULTURE","Others","Others","Cultural Practices","TELL ME WEATHER REPORT","NO RAIN POSSIBILITY IN NEXT 5 DAYS, BUT SOME CLOUD POSSIBILITY","RAJASTHAN","JHALAWAR","PIRAWA (SUNEL)                                    ","2014-08-21 17:23:59.950"
"KHARIF","AGRICULTURE","Others","Others","Weather","TELL ME WEATHER INFORMATION","RAINFALL POSSIBILITY IN NEXT FIVE DAYS  BUT CLOUDY","RAJASTHAN","JHALAWAR","JHALRAPATAN                                       ","2014-08-21 17:55:56.537"
"KHARIF","AGRICULTURE","Oilseeds","Soybean (bhat)","	Plant Protection	","tell me about pest in soyabean","SPRAY OF ACEPHATE 75% SP 2 GM PER LITER WATER","RAJASTHAN","JHALAWAR","JHALRAPATAN                                       ","2014-08-21 17:57:21.897"
"KHARIF","HORTICULTURE","Fruits","Orange","	Plant Protection	","TELL ME DI BECK CONTROL IN ORANGE","SPRAY OF COPPER OXICHLORIDE 45 GM + STREPTOCYCLIN 1.5 GM PER 15 LITER WATER","RAJASTHAN","JHALAWAR","KHANPUR                                           ","2014-08-21 18:58:19.467"
"KHARIF","AGRICULTURE","Others","Others","Weather","TELL ME WEATHER REPORT IN JALAWAR","RAIN MAY BE CONTINUE NEXT 3 DAYS","RAJASTHAN","JHALAWAR","PIRAWA (SUNEL)                                    ","2014-08-21 19:08:53.080"
"KHARIF","AGRICULTURE","Oilseeds","Soybean (bhat)","	Plant Protection	","NO GROWTH IN SOYBEAN","SPRAY OF MULTIPLAX (MICRONUTRIENT) 4 ML PER LITER WATER","RAJASTHAN","JHALAWAR","KHANPUR                                           ","2014-08-22 07:07:18.863"
"KHARIF","AGRICULTURE","Oilseeds","Soybean (bhat)","	Plant Protection	","TELL ME BLACK ROOT CONTROL IN soybean","CARBENDAZIM 250 GRAM / BIGA WITH IRRIGATION WATER","RAJASTHAN","JHALAWAR","JHALRAPATAN                                       ","2014-08-22 07:57:14.947"
"KHARIF","AGRICULTURE","Others","Others","Weather","TELL ME WEATHER INFORMATION","MAY BE RAIN POSIBILITY ON 24 AUGUST IN YOUIR DISTRICT","RAJASTHAN","JHALAWAR","PIRAWA (SUNEL)                                    ","2014-08-22 08:06:37.830"
"KHARIF","AGRICULTURE","Others","Others","Weather","TELL ME WEATHER INFORMATION","MAY BE RAIN POSIBILITY ON 24 AUGUST IN YOUIR DISTRICT","RAJASTHAN","JHALAWAR","JHALRAPATAN                                       ","2014-08-22 08:12:35.670"
"KHARIF","AGRICULTURE","Others","Others","Weather","TELL ME WEATHER INFORMATION","RAIN FALL  POSSIBILITY IN NEXT 5 DAYS","RAJASTHAN","JHALAWAR","JHALRAPATAN                                       ","2014-08-22 08:12:54.467"
"KHARIF","AGRICULTURE","Others","Others","Weather","TELL ME WEATHER REPORT IN MY DISTRIC","MAY BE RAIN POSSIBILITY ON 24 TO 27 AUGUST IN YOUR DISTRIC","RAJASTHAN","JHALAWAR","JHALRAPATAN                                       ","2014-08-22 12:11:40.190"
"KHARIF","AGRICULTURE","Others","Others","Weather","TELL ME WEATHER REPORT IN MY DISTRIC","MAY BE RAIN POSSIBILITY ON 24 TO 27 AUGUST IN YOUR DISTRIC","RAJASTHAN","JHALAWAR","JHALRAPATAN                                       ","2014-08-22 12:30:20.960"
"KHARIF","HORTICULTURE","Fruits","Orange","	Plant Protection	","TELL ME FLOWER DROPPING CONTROL IN","FLOWER/FRUIT DROP CONTROL  SPRAY OF PLANOFIX 1 ML PER 4 LITER WATER","RAJASTHAN","JHALAWAR","PIRAWA (SUNEL)                                    ","2014-08-22 12:44:05.183"
"KHARIF","AGRICULTURE","Fodder Crops","Guar","Cultural Practices","TELL ME CONTROL OF THRIPS IN GWAR","SPRAY OF IMIDACHLOPRID(CONFIDOR) 17.8% SL 0.5 ML PER LITER WATER","RAJASTHAN","JHALAWAR","MANOHARTHANA                                      ","2014-08-22 13:01:58.287"
"KHARIF","AGRICULTURE","Oilseeds","Soybean (bhat)","	Plant Protection	","ILLI CONTROL IN SOYABEAN","SPRAY OF DIMETHIOATE 30% EC 2ML/LITER WATER","RAJASTHAN","JHALAWAR","MANOHARTHANA                                      ","2014-08-22 13:16:40.357"
"KHARIF","AGRICULTURE","Others","Others","Weather","TEL ME WEATHER INFORMATION","NO RAIN POSSIBILITY IN NEXT 5 DAYS,","RAJASTHAN","JHALAWAR","PIRAWA (SUNEL)                                    ","2014-08-22 13:21:34.923"
"KHARIF","AGRICULTURE","Others","Others","Weather","TELL ME WEATHER INFORMATION","MAY BE RAIN POSIBILITY ON 24 AUGUST IN YOUIR DISTRICT","RAJASTHAN","JHALAWAR","KHANPUR                                           ","2014-08-22 14:02:44.670"
"KHARIF","AGRICULTURE","Others","Others","Weather","TELL ME WEATHER INFORMATION","NO RAIN FALL UP TO 5 DAYS, CLOUDY SKY","RAJASTHAN","JHALAWAR","JHALRAPATAN                                       ","2014-08-22 14:45:51.177"
"KHARIF","AGRICULTURE","Others","Others","Weather","TELL ME WEATHER INFORMATION","RAINFALL IN NEXT 2-3 DAYS IN YOUR DISTRICT","RAJASTHAN","JHALAWAR","PIRAWA (SUNEL)                                    ","2014-08-22 15:38:57.590"
"KHARIF","AGRICULTURE","Others","Others","Weather","TELL ME WEATHER INFORMATION","RAINFALL IN NEXT 2-3 DAYS IN YOUR DISTRICT","RAJASTHAN","JHALAWAR","PIRAWA (SUNEL)                                    ","2014-08-22 15:44:41.683"
"KHARIF","AGRICULTURE","Others","Others","Weather","TEL ME WEATHER INFORMATION","RAIN FALL POSSIBILITY IN NEXT 5 DAYS","RAJASTHAN","JHALAWAR","KHANPUR                                           ","2014-08-22 15:49:38.747"
"KHARIF","AGRICULTURE","Others","Others","Weather","TELL ME WEATHER INFORMETION","NO RAIN POSSIBILITY IN NEXT 5 DAYS","RAJASTHAN","JHALAWAR","PIRAWA (SUNEL)                                    ","2014-08-22 16:03:58.277"
"KHARIF","AGRICULTURE","Others","Others","Weather","TELL ME WEATHER INFORMATION","RAIN MAY BE CONTINUE NEXT 5 DAYS","RAJASTHAN","JHALAWAR","JHALRAPATAN                                       ","2014-08-22 16:08:14.450"
"KHARIF","HORTICULTURE","Vegetables","Chillies","	Plant Protection	","thrips in chilli","SPRAY OF ACEPHATE 75% SP+MANCOZEB 63% WP 2 GM PER LITER WATER","RAJASTHAN","JHALAWAR","BAKANI                                            ","2014-08-22 16:12:46.543"
"KHARIF","HORTICULTURE","Vegetables","Brinjal","	Plant Protection	","TELL ME FRUIT BORER CONTROL IN BRINJAL","SPRAY OF INDOXACARB 14.5% SC 0.5 ML PER LITER WATER","RAJASTHAN","JHALAWAR","DAG                                               ","2014-08-22 16:26:39.197"
"KHARIF","AGRICULTURE","Oilseeds","Soybean (bhat)","Market Information","TELL ME SOYABEEN AND MAIZE RATE IN RAMGANJ AND KOTA MANDI","3500 RS/Q SOYABEEN ,1300 RS/Q MAIZE","RAJASTHAN","JHALAWAR","MANOHARTHANA                                      ","2014-08-22 16:51:19.793"
"KHARIF","AGRICULTURE","Others","Others","	Plant Protection	","TELL ME FLOWER FALL DOWN IN TOMATO","SPRAY OF PLANOFIX 1 ML PER 4 LITER WATER FOR FLOWER DROP CONTROL","RAJASTHAN","JHALAWAR","PIRAWA (SUNEL)                                    ","2014-08-22 17:18:51.260"
"KHARIF","AGRICULTURE","Others","Others","	Plant Protection	","TELL ME FLOWER FALL DOWN IN TOMATO","SPRAY OF PLANOFIX 1 ML PER 4 LITER WATER FOR FLOWER DROP CONTROL","RAJASTHAN","JHALAWAR","PIRAWA (SUNEL)                                    ","2014-08-22 17:27:44.943"
"KHARIF","AGRICULTURE","Others","Others","Weather","TELL ME WEATHER FORECASTING","24,25,27,28 MAY BE RAINFALL","RAJASTHAN","JHALAWAR","PIRAWA (SUNEL)                                    ","2014-08-22 17:28:22.913"
"KHARIF","HORTICULTURE","Fruits","Orange","	Plant Protection	","TELL ME PROPER PLANT GROWTH IN ORANGE","SPRAY SOLUBLE NPK  18:18:18 GRADE 10 GM/LTR WATER","RAJASTHAN","JHALAWAR","PIRAWA (SUNEL)                                    ","2014-08-22 17:38:03.490"
"KHARIF","AGRICULTURE","Others","Others","Weather","TELL ME WEATHER REPORT","NO RAIN FALL IN NEXT 5 DAYS","RAJASTHAN","JHALAWAR","KHANPUR                                           ","2014-08-22 17:44:04.420"
"KHARIF","AGRICULTURE","Others","Others","Weather","TELL ME WEATHER INFORMATION","RAIN MAY BE CONTINUE NEXT 5 DAYS","RAJASTHAN","JHALAWAR","DAG                                               ","2014-08-22 18:54:53.900"
"KHARIF","AGRICULTURE","Oilseeds","Soybean (bhat)","	Plant Protection	","TELL ME LEAF ROLLER CONTROL IN SOYABEAN","DUSTING METHYL PARATHIAN 2% POWDER 25 KG / HACTARE","RAJASTHAN","JHALAWAR","PIRAWA (SUNEL)                                    ","2014-08-22 19:00:14.423"
"KHARIF","HORTICULTURE","Vegetables","Tomato","	Plant Protection	","TELL ME DISEASE CONTROL OF TOMATO","SPRAY OF KERATHIYAN LC 1ML PER LITER WATER","RAJASTHAN","JHALAWAR","PIRAWA (SUNEL)                                    ","2014-08-22 19:18:13.210"
"KHARIF","AGRICULTURE","Cereals","Wheat","Storage","PEST CONTROL IN STORAGE SEEDS.","ALLUMINIUM PHOSPIDE 3 TABLET IN 10 QUINTAL","RAJASTHAN","JHALAWAR","BAKANI                                            ","2014-08-22 19:54:24.190"
"KHARIF","HORTICULTURE","Vegetables","Tomato","Cultural Practices","TELL ME CONTROL OF ROOT ROT IN TOMATO","BAVISTIN 250 GM PER BHIGA WITH IRRIGATION","RAJASTHAN","JHALAWAR","JHALRAPATAN                                       ","2014-08-23 07:24:33.660"
