"Season","Sector","Category","Crop","QueryType","QueryText","KCCAns","StateName","DistrictName","BlockName","CreatedOn"
"KHARIF","AGRICULTURE","Others","Others","Weather","AAJ KA MAUSAM KAISA RAHEGA","Today we expect: plus 18—11 °C°F, plus 64—52 °C°F, without precipitation, light air. Tomorrow: plus 20—17 °C°F, plus 68—63 °C°F, without precipitation, light air.","UTTARAKHAND","DEHRADUN","DOIWALA                                           ","2014-12-01 11:45:06.350"
"RABI","AGRICULTURE","Cereals","Wheat","Cultural Practices","gehu mein khad kya hai","DAP dekar buai karaye","UTTARAKHAND","DEHRADUN","DOIWALA                                           ","2014-12-01 15:17:50.560"
"RABI","HORTICULTURE","Condiments and Spices","Garlic","	Plant Protection	","lahsun lagane ka samy bataye?","15 october - 15 november","UTTARAKHAND","DEHRADUN","DOIWALA                                           ","2014-12-02 10:05:35.177"
"RABI","HORTICULTURE","Vegetables","Pea (Vegetable)","	Plant Protection	","mater me kida lag raha hai?","apply Cypermethrin 10% EC @ 350-500 ml/acre me spray kare.","UTTARAKHAND","DEHRADUN","SAHASPUR                                          ","2014-12-02 13:49:08.357"
"RABI","AGRICULTURE","Cereals","Wheat","Cultural Practices","gehu ki variety ke liye kaha sampark kare","aap apne block office mein sampark kare","UTTARAKHAND","DEHRADUN","VIKASNAGAR                                        ","2014-12-02 21:16:19.420"
"RABI","HORTICULTURE","Vegetables","Onion","	Plant Protection	","pyaj ki kheti ki jankari de","????? ?? ??????? ???? ???,?????  ???, ???? ?????,????? ?????,????????? ???  ????? ?? ????? ???","UTTARAKHAND","DEHRADUN","RAIPUR                                            ","2014-12-03 07:56:51.687"
"JAYAD","AGRICULTURE","Others","Others","Government Schemes","gende ki phool ki jankari de kheti ki loan ke liye","aap apne jile ke jila krishi adhikari se sampark kare","UTTARAKHAND","DEHRADUN","KALSI                                             ","2014-12-03 11:07:19.710"
"RABI","HORTICULTURE","Vegetables","Potato","	Plant Protection	","aalu kala ho raha hai?","apply Carbendazim 12% + Mancozeb 63% WP @ 400gm/acre me dale.","UTTARAKHAND","DEHRADUN","VIKASNAGAR                                        ","2014-12-03 11:11:26.460"
"RABI","HORTICULTURE","Condiments and Spices","Garlic","Cultural Practices","lehsun ki pattiya bhuri ho rahi hai","spray mencozeb 75 WP @ 2 gram/liter of water","UTTARAKHAND","DEHRADUN","CHAKRATA                                          ","2014-12-03 15:21:17.240"
"KHARIF","AGRICULTURE","Cereals","Paddy (Dhan)","	Plant Protection	","dhan ki basmati ki parjati bataye?","pusa basmati-1509","UTTARAKHAND","DEHRADUN","VIKASNAGAR                                        ","2014-12-04 06:17:08.400"
"RABI","AGRICULTURE","Cereals","Wheat","	Field Preparation	","gehu me kharpatwar ki davai bataye?","apply Sulfosulfuron 75% + Metsulfuran Methyl 5% WG @ 16gm/acre me spray kare.","UTTARAKHAND","DEHRADUN","VIKASNAGAR                                        ","2014-12-04 13:34:31.650"
"RABI","AGRICULTURE","Cereals","Wheat","	Plant Protection	","gehu ke khet mein deemak lag raha hai","broad casting metarihzam anuspori @ 2 kilo + 50 kilo gobar ki khad par acre","UTTARAKHAND","DEHRADUN","DOIWALA                                           ","2014-12-04 15:12:53.080"
"RABI","AGRICULTURE","Cereals","Wheat","Varieties","gehu ki variety","pbw-226,pbw-292,up-2338,dbw-14 or dbw-16","UTTARAKHAND","DEHRADUN","KALSI                                             ","2014-12-04 16:28:50.943"
"RABI","AGRICULTURE","Cereals","Wheat","	Plant Protection	","gehu ki parjati bataye?","PBW-226,PBW-292,PBW-373,DBW-16,DBW-14","UTTARAKHAND","DEHRADUN","SAHASPUR                                          ","2014-12-05 07:38:34.853"
"RABI","AGRICULTURE","Cereals","Wheat","Varieties","gehu ki variety","dbw-1,16,up-2425,2338","UTTARAKHAND","DEHRADUN","DOIWALA                                           ","2014-12-05 10:01:59.057"
"KHARIF","HORTICULTURE","Vegetables","Peas (field peas/ garden peas/matar)","	Plant Protection	","MATAR  ME KHAD KAB LAGAYE","MATAR ME KHAD BOVAI KE TIME DIYA JATA HAI","UTTARAKHAND","DEHRADUN","SAHASPUR                                          ","2014-12-05 14:23:37.217"
"KHARIF","HORTICULTURE","Vegetables","Pea (Vegetable)","	Plant Protection	","MATAR  ME KHAD KAB LAGAYE","MATAR ME KHAD BOVAI KE TIME DIYA JATA HAI","UTTARAKHAND","DEHRADUN","SAHASPUR                                          ","2014-12-05 14:28:56.997"
"KHARIF","HORTICULTURE","Vegetables","Pea (Vegetable)","	Plant Protection	","MATAR  ME KHAD KAB LAGAYE","MATAR ME KHAD BOVAI KE TIME DIYA JATA HAI","UTTARAKHAND","DEHRADUN","SAHASPUR                                          ","2014-12-05 14:29:12.793"
"RABI","HORTICULTURE","Fruits","Papaya","Cultural Practices","SMS seva  band Karna chahte hai","aap ki SMS seva band karne ki request bheji ja rahi hai","UTTARAKHAND","DEHRADUN","DOIWALA                                           ","2014-12-06 12:53:13.820"
"RABI","AGRICULTURE","Cereals","Wheat","Cultural Practices","gehu is samay kaun si kism laga sakte hai","Late variety of wheat dbw-16 , dbw-14 UP-2338, pbw-373 pbw-502, up -2425","UTTARAKHAND","DEHRADUN","SAHASPUR                                          ","2014-12-06 15:03:08.160"
"RABI","AGRICULTURE","Cereals","Wheat","Cultural Practices","gehu ki late kism kaun si hai","Late variety of wheat dbw-16 , dbw-14 UP-2338, pbw-373 pbw-502, up -2425","UTTARAKHAND","DEHRADUN","SAHASPUR                                          ","2014-12-06 15:19:29.713"
"RABI","HORTICULTURE","Vegetables","Chillies","Cultural Practices","MIRCH ME KITNI KHAAD DETE HAI","Apply FYM 20 - 25 tonnes / ha, 60, 100 and 60 kg NPK / ha as basal, 20 kg N and 20 kg K three weeks after transplanting and 40 kg N and 40 kg K / ha six weeks after transplanting as top dressing.","UTTARAKHAND","DEHRADUN","SAHASPUR                                          ","2014-12-06 17:34:05.283"
"RABI","AGRICULTURE","Cereals","Wheat","	Plant Protection	","PAYAJ ME KHAD KYA DE","MICRO NUTRIENT KO DALE","UTTARAKHAND","DEHRADUN","RAIPUR                                            ","2014-12-07 12:34:52.050"
"RABI","AGRICULTURE","Others","Others","Weather","mausam ki jankari de","friday tak baris hone ki sambhavna nahi hai","UTTARAKHAND","DEHRADUN","DOIWALA                                           ","2014-12-07 16:39:00.627"
"RABI","AGRICULTURE","Others","Others","Government Schemes","mini tractor me choot kanha se sampark kare","aap jila udyan adhikari se sampark kare","UTTARAKHAND","DEHRADUN","DOIWALA                                           ","2014-12-07 16:55:22.030"
"RABI","AGRICULTURE","Cereals","Wheat","	Plant Protection	","GEHU NE SICHAI KAR DI HAI","URIYA+ZINC+MARGOZAIM KA PRAYOG KARE","UTTARAKHAND","DEHRADUN","KALSI                                             ","2014-12-08 10:04:45.513"
"RABI","AGRICULTURE","Cereals","Wheat","Cultural Practices","gehu  ki kaun si kism laga sakte hai","Late variety of wheat dbw-16 , dbw-14 UP-2338, pbw-373 pbw-502, up -2425 , pbw-590","UTTARAKHAND","DEHRADUN","KALSI                                             ","2014-12-08 18:10:37.910"
"RABI","ANIMAL HUSBANDRY","Animal","Bovine(Cow,Buffalo)","Animal Breeding","cow heat me nahi aa rahi hai?","doctor se sampark kre.","UTTARAKHAND","DEHRADUN","SAHASPUR                                          ","2014-12-11 11:30:17.450"
"RABI","HORTICULTURE","Plantation Crops","Palmyra","	Plant Protection	","NEEM KA PED SOOKH RAHA HAI","CHLOROPYRIPHOS 20 EC 2 ML / LITER PANI KO 3 LITER PANI KHET ME DALE","UTTARAKHAND","DEHRADUN","RAIPUR                                            ","2014-12-11 13:47:35.487"
"RABI","AGRICULTURE","Cereals","Wheat","Varieties","gehu ki variety batao?","gehu ki variety PBW-226,PBW-292,DBW-16,PBW-373, HAI.","UTTARAKHAND","DEHRADUN","SAHASPUR                                          ","2014-12-12 10:04:09.783"
"RABI","AGRICULTURE","Others","Others","Weather","MOUSAM KI JANKARI DE?","Today we expect: plus 21—19 °C, rain, light air. Tomorrow: plus 18—19 °C, heavy rain, light breeze.","UTTARAKHAND","DEHRADUN","RAIPUR                                            ","2014-12-13 07:11:38.500"
"RABI","AGRICULTURE","Others","Others","Cultural Practices","hame sms caNCEL KARWANA HAI","AAPKA SMS BAND HO GAYA HAI","UTTARAKHAND","DEHRADUN","KALSI                                             ","2014-12-13 16:48:38.493"
"RABI","HORTICULTURE","Vegetables","Potato","	Plant Protection	","aalu mein deemak lag raha hai","broad casting chloropyriphos 20 EC @ 2.5-3 liter of water","UTTARAKHAND","DEHRADUN","SAHASPUR                                          ","2014-12-13 17:32:52.007"
"KHARIF","HORTICULTURE","Vegetables","Tomato","	Plant Protection	","me choti jot ka kisan hu tamatar lagana cahta hu","tamatar ka biz dar 1 kilogram hai aur prajati pant t-3,pusa gaurav  ,solangola  ,vl tamatar-1  ,arka saurabh","UTTARAKHAND","DEHRADUN","SAHASPUR                                          ","2014-12-14 10:46:06.197"
"RABI","HORTICULTURE","Vegetables","French Bean","Seeds and Planting Material","french been ka seed rate kya hai?","apply jhadidar kisma: 80-90kg, beldar kisma: 25-30kg/ha.","UTTARAKHAND","DEHRADUN","SAHASPUR                                          ","2014-12-14 11:33:38.380"
"RABI","HORTICULTURE","Vegetables","Cauliflower","	Plant Protection	","fulgobhi mein ful compect nahi ho rahe hai","spray boran @ 2 gram/liter of water","UTTARAKHAND","DEHRADUN","DOIWALA                                           ","2014-12-14 18:12:09.920"
"RABI","AGRICULTURE","Cereals","Wheat","	Plant Protection	","gehu me harbicide kab de?","gehu me harbicide 33 din ke bad de.","UTTARAKHAND","DEHRADUN","DOIWALA                                           ","2014-12-15 12:42:26.720"
"RABI","HORTICULTURE","Vegetables","Pea (Vegetable)","	Plant Protection	","matar me kya de?","spray NPK:19,19,19 1kg/acre","UTTARAKHAND","DEHRADUN","SAHASPUR                                          ","2014-12-15 13:54:01.667"
"RABI","HORTICULTURE","Vegetables","Tomato","	Plant Protection	","tamatar ki pattiya sikud rahi hai","spray imidachlopride 17.8 SL @ 1 mili/liter of water","UTTARAKHAND","DEHRADUN","DOIWALA                                           ","2014-12-15 21:37:53.583"
"KHARIF","AGRICULTURE","Others","Others","Weather","aaj ka mausam kaisa rahega","Today we expect: plus 21 °C°F, plus 70 °C°F, without precipitation, light air. Tomorrow: plus 21 °C°F, plus 70 °C°F, without precipitation, light breeze.","UTTARAKHAND","DEHRADUN","KALSI                                             ","2014-12-16 09:31:28.987"
"KHARIF","HORTICULTURE","Vegetables","Tomato","Vegetative Propagation and Tissue Culture","tamatar ki gucche bali prajati ka naam kya hai","tamatar ki gucche bali prajati ka naam angoor lata hai","UTTARAKHAND","DEHRADUN","RAIPUR                                            ","2014-12-16 10:02:13.183"
"RABI","AGRICULTURE","Cereals","Wheat","	Plant Protection	","GEHU KI PACHETI VARIETY BATAYE?","apply HALNA (K7903) RR-21","UTTARAKHAND","DEHRADUN","RAIPUR                                            ","2014-12-16 11:21:31.357"
"RABI","AGRICULTURE","Cereals","Wheat","	Plant Protection	","PACHETI GEHU KA SEED RATE KYA HAI?","APPLY 120KG/HA.","UTTARAKHAND","DEHRADUN","RAIPUR                                            ","2014-12-16 11:32:21.063"
"RABI","AGRICULTURE","Others","Others","Government Schemes","SMS DEACTIVE KARNA HAI?","JANKARI DI GAI","UTTARAKHAND","DEHRADUN","DOIWALA                                           ","2014-12-16 11:35:42.620"
"KHARIF","AGRICULTURE","Others","Others","Government Schemes","krish loan lena hai kaha sampark kare","krishi loan lena hai to apne najdiki block me sampark kare","UTTARAKHAND","DEHRADUN","KALSI                                             ","2014-12-16 11:35:54.280"
"RABI","ANIMAL HUSBANDRY","Animal","Pig","Animal Production (Piggery, Goatery, Sheep Farming etc.)","PIGGERY FARM ISTITUTE KAHA HAI?","NATIONAL RESEARCH CENTER ON PIG (INDIAN COUNCIL OF AGRICULTURAL RECEARCH) RANI, GUWAHATI,ASSAM-781131","UTTARAKHAND","DEHRADUN","DOIWALA                                           ","2014-12-16 12:10:26.653"
"RABI","AGRICULTURE","Others","Others","Weather","mousam kio jankari de?","Today we expect: plus 17—12 °C°F, plus 63—54 °C°F, without precipitation, light air. Tomorrow: plus 18—17 °C°F, plus 64—63 °C°F, without precipitation, light breeze.","UTTARAKHAND","DEHRADUN","RAIPUR                                            ","2014-12-16 13:13:13.227"
"KHARIF","AGRICULTURE","Others","Others","Fertilizer Use and Availability","UREA FOSPHATE KA GHOL FASAL PAR DENA HAI KYA MATRA DE","UREA FOSPHATE KA GHOL FASAL PAR DENA HAI TO 1 KILOGRAM KA 1.5 5 KI DAR SE DE","UTTARAKHAND","DEHRADUN","RAIPUR                                            ","2014-12-17 07:04:29.977"
"KHARIF","AGRICULTURE","Others","Others","Weather","AAJ AK MAUSAM KAISA RAHEGA","Today we expect: plus 14—11 °C°F, plus 57—52 °C°F, without precipitation, light air. Tomorrow: plus 15—11 °C°F, plus 59—52 °C°F, without precipitation, light breeze.","UTTARAKHAND","DEHRADUN","KALSI                                             ","2014-12-17 07:08:33.533"
"RABI","AGRICULTURE","Cereals","Wheat","	Plant Protection	","GEHU ME BATHUA HO GAI HAI?","SPRAY Clodinafop Propargyl 15% + Metsulfuron Methyl  1% WP @ 400GM/HA.","UTTARAKHAND","DEHRADUN","KALSI                                             ","2014-12-17 07:24:16.270"
"KHARIF","AGRICULTURE","Others","Others","Weather","AAJ KA MAUSAM KAISA RAHEGA","Today we expect: plus 20—22 °C°F, plus 68—72 °C°F, without precipitation, light breeze. Tomorrow: plus 20—23 °C°F, plus 68—73 °C°F, without precipitation, light breeze.","UTTARAKHAND","DEHRADUN","DOIWALA                                           ","2014-12-17 10:42:20.693"
"RABI","AGRICULTURE","Cereals","Wheat","	Plant Protection	","gehu me futav ke liye kya kare?","40kg urea + 8kg zinc sulphate mono /acre me dale.","UTTARAKHAND","DEHRADUN","VIKASNAGAR                                        ","2014-12-17 15:25:05.760"
"RABI","AGRICULTURE","Cereals","Wheat","Fertilizer Use and Availability","gehu em khad ke liye kya de","kisan bhai gehu me sichai ke bad 70-90 kg urea/hactayer de","UTTARAKHAND","DEHRADUN","RAIPUR                                            ","2014-12-17 16:53:11.150"
"JAYAD","HORTICULTURE","Vegetables","Potato","Seeds and Planting Material","ALOO KA BIZ DAR KYA HAI","ALOO KA BIZ DAR 30-35 QUNTAL HAI","UTTARAKHAND","DEHRADUN","SAHASPUR                                          ","2014-12-18 09:06:04.610"
"KHARIF","AGRICULTURE","Others","Others","Weather","aaj ka mausam kaisa rahega","1 hour ago at the weather station (116 km) it was +10.6 °C, +51 °F, high air pressure, very high humidity (100%), light air (1 m/s) (4 km/h) (2 mph) (2 knots) (1 Bft)blowing from the west. Fog or ice fog. Horizontal visibility 0.1 km. Horizontal visibility 0.03 miles.","UTTARAKHAND","DEHRADUN","RAIPUR                                            ","2014-12-18 12:38:22.670"
"RABI","AGRICULTURE","Cereals","Wheat","Weed Management","gehu mein weed control ke liye bataye","spray  Sulfosulfuron 75% + Metsulfuran Methyl 5% WG @ 16 gram/acre","UTTARAKHAND","DEHRADUN","RAIPUR                                            ","2014-12-18 17:02:37.807"
"RABI","AGRICULTURE","Cereals","Wheat","Weed Management","gehu mein weed control ke liye bataye","spray  Sulfosulfuron 75% + Metsulfuran Methyl 5% WG @ 16 gram/acre","UTTARAKHAND","DEHRADUN","RAIPUR                                            ","2014-12-18 17:10:10.197"
"KHARIF","AGRICULTURE","Others","Others","Weather","aaj ka mausam kaisa rahega","Today we expect: plus 18—10 °C°F, plus 64—50 °C°F, without precipitation, light air. Tomorrow: plus 19 °C°F, plus 66 °C°F, without precipitation, light breeze.","UTTARAKHAND","DEHRADUN","VIKASNAGAR                                        ","2014-12-19 15:38:11.527"
"RABI","HORTICULTURE","Vegetables","Capsicum","Vegetative Propagation and Tissue Culture","simla mirch ki kisme bataye","simla mirch ki kisme bharat ,indira , pusa dipti ,caloforniya bander hai","UTTARAKHAND","DEHRADUN","VIKASNAGAR                                        ","2014-12-19 16:29:05.110"
"KHARIF","HORTICULTURE","Vegetables","Bhindi(Okra/Ladysfinger)","Seeds and Planting Material","bhindi ka biz dar kya hai","bhindi ka biz dar 8-10 kilo/hacter hai","UTTARAKHAND","DEHRADUN","DOIWALA                                           ","2014-12-19 18:36:33.017"
"RABI","HORTICULTURE","Fruits","Papaya","	Plant Protection	","PAPITA KI PARJATI BATAYE?","pant papita-1","UTTARAKHAND","DEHRADUN","VIKASNAGAR                                        ","2014-12-20 10:18:08.453"
"RABI","AGRICULTURE","Cereals","Wheat","	Plant Protection	","gehu me kharpatwar ho raha hai?","Sulfosulfuron 75% + Metsulfuran Methyl 5% WG @ 16gm/acre me spray kare.","UTTARAKHAND","DEHRADUN","VIKASNAGAR                                        ","2014-12-20 13:12:38.560"
"RABI","HORTICULTURE","Vegetables","Brinjal","Cultural Practices","baigan ko kab laga sakte hai","baigan ki roapi 15 farvary se kar sakte hai","UTTARAKHAND","DEHRADUN","DOIWALA                                           ","2014-12-20 16:32:21.947"
"RABI","AGRICULTURE","Others","Others","Government Schemes","kisaan call center me job ke liye  phone aaya hai kya kare","yah fraud hai krapya rupya na jama kare","UTTARAKHAND","DEHRADUN","SAHASPUR                                          ","2014-12-20 17:12:55.993"
"KHARIF","HORTICULTURE","Vegetables","Brinjal","Seeds and Planting Material","BEGAN KA BIZ DAR KYA HAI","BEGAN KA BIZ DAR 500 GRAM/HACTER HAI","UTTARAKHAND","DEHRADUN","RAIPUR                                            ","2014-12-21 08:00:22.897"
"KHARIF","AGRICULTURE","Others","Others","Government Schemes","hame jile ki krishi yojna ke bare me bataye","aap apne jile ke block ya jila krishi adhikari se sampark kare","UTTARAKHAND","DEHRADUN","KALSI                                             ","2014-12-21 12:06:01.667"
"RABI","AGRICULTURE","Cereals","Wheat","Cultural Practices","gehu me pahla panikab lagate hai","KISAN BHAI GEHU ME PAHLI SINCHAI BUVAI KE 21  SE 25 DIN ME KATE HAI","UTTARAKHAND","DEHRADUN","SAHASPUR                                          ","2014-12-21 13:59:19.013"
"RABI","AGRICULTURE","Others","Others","Weather","mausam ki janakri de","aaj kal mausam saaf hai","UTTARAKHAND","DEHRADUN","RAIPUR                                            ","2014-12-21 19:57:50.087"
"RABI","AGRICULTURE","Cereals","Wheat","	Plant Protection	","gehu ki late variety bta de","gehu ki late variety hai dbw 14 dbw 16 narendwer gehu 1014 bo sakte hai aap","UTTARAKHAND","DEHRADUN","KALSI                                             ","2014-12-21 20:04:19.240"
"RABI","ANIMAL HUSBANDRY","Animal","Bovine(Cow,Buffalo)","Dairy Production","gay doodh kam de rahi hai","glyco powder 50 graam / day roti ke sath de","UTTARAKHAND","DEHRADUN","VIKASNAGAR                                        ","2014-12-22 17:47:36.437"
"RABI","AGRICULTURE","Millets","Maize (Makka)","Sowing Time and Weather","makke ki variety","sidtec-2324,shaktimaan-1","UTTARAKHAND","DEHRADUN","SAHASPUR                                          ","2014-12-22 18:13:16.817"
"RABI","HORTICULTURE","Vegetables","Bitter Gourd","	Plant Protection	","karele ki variety bataye?","indam 1024,1124,49, green crocodial.","UTTARAKHAND","DEHRADUN","RAIPUR                                            ","2014-12-23 07:55:19.353"
"RABI","AGRICULTURE","Cereals","Wheat","	Plant Protection	","GEHU ME MADUSI HO GAI HAI?","SPRAY Clodinafop Propargyl 15% + Metsulfuron Methyl  1% WP @ 400GM/HA.","UTTARAKHAND","DEHRADUN","VIKASNAGAR                                        ","2014-12-23 09:04:27.340"
"RABI","ANIMAL HUSBANDRY","Avian","Turkey","Disease Management","paultri ki jankari kanha se milegi","aap krashi vigyan kendra harbat pur dhak rani se sampark kare","UTTARAKHAND","DEHRADUN","VIKASNAGAR                                        ","2014-12-23 12:32:43.787"
"RABI","AGRICULTURE","Cereals","Wheat","Cultural Practices","gehu me chaudi pati aur sakri patti ke kharpatvaar hai kya dale","Sulfosulfuron 75% + Metsulfuran Methyl 5% WG
 dose/acre : 16 gm/acre","UTTARAKHAND","DEHRADUN","DOIWALA                                           ","2014-12-23 13:01:02.390"
"RABI","ANIMAL HUSBANDRY","Animal","Bovine(Cow,Buffalo)","Disease Management","gay patla gober kar rahi hai","20 graam / day chay ki patti pani ke sath de","UTTARAKHAND","DEHRADUN","RAIPUR                                            ","2014-12-23 15:58:41.027"
"RABI","ANIMAL HUSBANDRY","Animal","Bovine(Cow,Buffalo)","Disease Reporting","gaye ko dast ho gai?","20gm tea patti khilaye.","UTTARAKHAND","DEHRADUN","RAIPUR                                            ","2014-12-23 16:21:00.020"
"RABI","ANIMAL HUSBANDRY","Animal","Bovine(Cow,Buffalo)","Disease Reporting","gaye ko dast ho gai?","20gm tea patti khilaye.","UTTARAKHAND","DEHRADUN","RAIPUR                                            ","2014-12-23 16:22:50.720"
"RABI","AGRICULTURE","Cereals","Wheat","	Plant Protection	","mousam ki jankari dijiye?","Today we expect: plus 15—9 °C°F, plus 59—48 °C°F, without precipitation, light air. Tomorrow: plus 18—15 °C°F, plus 64—59 °C°F, without precipitation, light air.","UTTARAKHAND","DEHRADUN","CHAKRATA                                          ","2014-12-23 16:29:22.520"
"KHARIF","AGRICULTURE","Others","Others","Weather","AAJ KA MAUSAM KAISA RAHEGA","13 hours ago at the weather station (110 km) it was +9.4 °C, +49 °F, mostly clear, very high air pressure, high humidity (72%), light air (1 m/s) (4 km/h) (2 mph) (2 knots) (1 Bft)blowing from the east.","UTTARAKHAND","DEHRADUN","RAIPUR                                            ","2014-12-24 06:19:57.320"
"RABI","AGRICULTURE","Cereals","Wheat","	Plant Protection	","mousam ki jankari dijiye?","Today we expect: plus 17—15 °C°F, plus 63—59 °C°F, without precipitation, light air. Tomorrow: plus 17—15 °C°F, plus 63—59 °C°F, without precipitation, light breeze.","UTTARAKHAND","DEHRADUN","DOIWALA                                           ","2014-12-24 08:58:47.027"
"JAYAD","HORTICULTURE","Fruits","Mango","	Plant Protection	","aam ka ped hai uski patti tedi ho rahi hai kya kare","aap aopne ped me coper oxicloride ki 3 gramki matra ko /liter pani me ghol banakar spray kare","UTTARAKHAND","DEHRADUN","DOIWALA                                           ","2014-12-24 10:48:47.383"
"RABI","AGRICULTURE","Cereals","Wheat","Weed Management","gehu mein weed control bataye","spray Sulfosulfuron 75% WG @ 1 unit/acre","UTTARAKHAND","DEHRADUN","DOIWALA                                           ","2014-12-24 14:26:13.577"
"RABI","HORTICULTURE","Condiments and Spices","Turmeric","Post Harvest Management (Cleaning, Grading, Packaging, Food Processing, Cool Chain etc.)","HALDI ME CAMAK KE LIYE KYA DALE","PISI HALDI 100 GRAAM / QUINTAL HALDI KO UBALTE SAMAY DALE","UTTARAKHAND","DEHRADUN","RAIPUR                                            ","2014-12-24 16:14:59.470"
"RABI","AGRICULTURE","Others","Others","Weather","MAUSAM KI JANKARI DE","BARIS HONE KI SAMBHAVNA NAHI HAI","UTTARAKHAND","DEHRADUN","DOIWALA                                           ","2014-12-24 16:21:01.807"
"RABI","HORTICULTURE","Vegetables","Tomato","Fertilizer Use and Availability","tamatar ki pattiya pili ho rahi hai","spray NPK (19;19:19) @ 1-1.5 kilo/acre","UTTARAKHAND","DEHRADUN","DOIWALA                                           ","2014-12-24 16:50:51.350"
"JAYAD","HORTICULTURE","Vegetables","Tomato","Cultural Practices","tamatar ki nursary kab lagaye","january february","UTTARAKHAND","DEHRADUN","KALSI                                             ","2014-12-24 18:20:45.400"
"RABI","AGRICULTURE","Cereals","Wheat","	Plant Protection	","GEHU PILA PAD RAHA HAI","SPRAY npk (19:19:19) @ 1.5-2 KILO/ACRE","UTTARAKHAND","DEHRADUN","KALSI                                             ","2014-12-24 20:05:51.267"
"RABI","ANIMAL HUSBANDRY","Animal","Bovine(Cow,Buffalo)","Dairy Production","pashu doodh kam de raha hai","aap glyco powder 50 graam / day aate ki loi me de","UTTARAKHAND","DEHRADUN","DOIWALA                                           ","2014-12-25 18:09:21.460"
"RABI","HORTICULTURE","Vegetables","Pea (Vegetable)","Fertilizer Use and Availability","matar ki fali fat rahi hai","spray boran @ 2 gram/liter of water","UTTARAKHAND","DEHRADUN","VIKASNAGAR                                        ","2014-12-25 20:57:37.937"
"RABI","HORTICULTURE","Vegetables","Onion","	Plant Protection	","pyaz me N.P.K -KI matra bataye?","pyaz me N.P.K -KI matra 100kg-50kg-50kg/hectare me dale.","UTTARAKHAND","DEHRADUN","CHAKRATA                                          ","2014-12-25 20:58:40.570"
"RABI","AGRICULTURE","Cereals","Wheat","	Plant Protection	","gehu me kitne din me pani de?","21 din me","UTTARAKHAND","DEHRADUN","DOIWALA                                           ","2014-12-26 11:42:56.897"
"RABI","AGRICULTURE","Others","Others","Soil Testing","mitti chek karani hai?","nanda ki chuki prem nagar dehradun","UTTARAKHAND","DEHRADUN","SAHASPUR                                          ","2014-12-26 11:52:27.650"
"RABI","AGRICULTURE","Others","Others","Nutrient Management","vermi compost ki training kanha se milegi","Dr. A. K. Singh	KVK, Dhakrani, P.O.- Herbertpur, Distt. – Dehradun-248001	01360-224378	9761411017","UTTARAKHAND","DEHRADUN","DOIWALA                                           ","2014-12-26 14:43:21.190"
"RABI","AGRICULTURE","Others","Others","Weather","gehu ki pehli sichai kab kre?","gehu ki pehli sichai 21-25 den me kre.","UTTARAKHAND","DEHRADUN","DOIWALA                                           ","2014-12-27 08:57:14.950"
