"Season","Sector","Category","Crop","QueryType","QueryText","KCCAns","StateName","DistrictName","BlockName","CreatedOn"
"RABI","HORTICULTURE","Vegetables","Onion","	Plant Protection	","pyaz me kharpatwar ki davai bataye?","apply fluchloralin 45ec ka spray kare.","UTTARAKHAND","DEHRADUN","RAIPUR                                            ","2014-12-27 08:57:45.003"
"RABI","HORTICULTURE","Fruits","Mango","	Plant Protection	","mango ke ped par kida laga hai?","Dimethoate or Methyl demeton @ 2 ml/lit will control the pests","UTTARAKHAND","DEHRADUN","DOIWALA                                           ","2014-12-27 09:39:12.900"
"RABI","AGRICULTURE","Cereals","Wheat","	Plant Protection	","mousam ki jankari dijiye?","Today we expect: plus 12—10 °C°F, plus 54—50 °C°F, without precipitation, light air. Tomorrow: plus 15 °C°F, plus 59 °C°F, without precipitation, light breeze.","UTTARAKHAND","DEHRADUN","VIKASNAGAR                                        ","2014-12-27 15:08:36.463"
"RABI","HORTICULTURE","Vegetables","Onion","	Plant Protection	","pyaj ki nursery ko kya bavestien se upcharit kar sakte hai","kisaan bhai aap bavestien 2 graam / liter pani me ghol kar upcharit kar sakte hai","UTTARAKHAND","DEHRADUN","RAIPUR                                            ","2014-12-27 18:11:44.387"
"RABI","AGRICULTURE","Others","Others","Training and Exposure Visits","KRASHI VIGYAN KENDRA KA KYA NUMBER HAI","KRASHI VIGYAN KENDRA   Dr. A. K. Singh	KVK, Dhakrani, P.O.- Herbertpur, Distt. – Dehradun-248001	01360-224378","UTTARAKHAND","DEHRADUN","VIKASNAGAR                                        ","2014-12-27 20:35:28.627"
"RABI","HORTICULTURE","Flowers","Rose","Cultural Practices","GULAB KO KAB LAGA SAKATE HAI","GULAB KO OCTOBER ME LAGA SAKATE HAI","UTTARAKHAND","DEHRADUN","CHAKRATA                                          ","2014-12-27 21:44:13.740"
"RABI","AGRICULTURE","Cereals","Wheat","	Plant Protection	","gehu upchar ki davai bataye?","apply carbendazim 50%wp @ 2gm/kg bij se upchar kare.","UTTARAKHAND","DEHRADUN","VIKASNAGAR                                        ","2014-12-28 12:23:05.263"
"KHARIF","AGRICULTURE","Others","Others","Weather","HAME AAJ KAMAUSAM BATAYEE","1 hour ago at the weather station (110 km) it was +13.4 °C,   clear, very high air pressure, light air (1 m/s)    blowing from the west.","UTTARAKHAND","DEHRADUN","DOIWALA                                           ","2014-12-28 15:36:21.650"
"KHARIF","HORTICULTURE","Vegetables","Potato","Cultural Practices","aloo me jhulsa laga hai kya kare","aloo me jhulsa laga hai to radomil @ 2 gram/liter ki dar se ghol banakar spray kare","UTTARAKHAND","DEHRADUN","SAHASPUR                                          ","2014-12-28 17:31:24.733"
"KHARIF","AGRICULTURE","Others","Others","Weather","AAJ KA MAUSAM KAISA RAHEGA","Today we expect: plus 8 °C,  without precipitation, light breeze. Tomorrow: plus 18—15 °C,  without precipitation, light breeze.","UTTARAKHAND","DEHRADUN","KALSI                                             ","2014-12-28 20:38:53.617"
"KHARIF","AGRICULTURE","Others","Others","Government Schemes","MERE NUMBER PAR MESSEGE BADALNA HAI KRIPA KARKE MESEGE BADLE","AAP KE NUMBER PAR MESEGE KI SUBIDHA SAFALTAPURVAK BADAL DI GAYI HAI KAST KE LIYE HAME KHED HAI","UTTARAKHAND","DEHRADUN","DOIWALA                                           ","2014-12-28 21:28:57.590"
"RABI","HORTICULTURE","Vegetables","Onion","	Plant Protection	","Pyaz kee nursery pili pad rahi haui","2 Gram Copper Oxy Chloride 50% WP/ litre pani ke sath spray + 0.1 gram streptocycline / litre pani bhi milaye","UTTARAKHAND","DEHRADUN","RAIPUR                                            ","2014-12-29 07:14:18.273"
"RABI","AGRICULTURE","Cereals","Wheat","	Plant Protection	","gehu me kharpatwar ho raha hai?","apply Sulfosulfuron 75% + Metsulfuran Methyl 5% WG @ 16gm /acre me spray kare.","UTTARAKHAND","DEHRADUN","VIKASNAGAR                                        ","2014-12-29 12:02:19.333"
"KHARIF","HORTICULTURE","Vegetables","Potato","Field Preparation","aloo ko kya abhi laga sakte hai","nahi abhi aloo ko nahi  laga sakte hai","UTTARAKHAND","DEHRADUN","VIKASNAGAR                                        ","2014-12-30 10:19:56.323"
"RABI","ANIMAL HUSBANDRY","Animal","Goat","Market Information","bakri palan karna hai kahan se le?","bakri anusandhan kendra ka ph. no. 0565-2763320","UTTARAKHAND","DEHRADUN","SAHASPUR                                          ","2014-12-30 11:35:26.243"
"KHARIF","AGRICULTURE","Others","Others","Weather","kya aaj barish hogi","nahi aaj aapke yaha par barish nahi hogi","UTTARAKHAND","DEHRADUN","SAHASPUR                                          ","2014-12-30 11:49:48.620"
"RABI","HORTICULTURE","Vegetables","Tomato","Government Schemes","TAMATER ME POLYHOUSE ME KITNI CHHOOT HAI","POLY HOUSE ME CHHOOT KE LIYE AAP JILA UDYAN ADHIKARI SE SAMPARK KARE","UTTARAKHAND","DEHRADUN","VIKASNAGAR                                        ","2014-12-30 21:04:28.873"
"KHARIF","AGRICULTURE","Others","Others","Government Schemes","JILE KI KRISHI YOJNA KE BARE ME BATAYEE","1-apne rajya ,jile ya blok ke krishi yojna ke bare me jankari ke liye in numbaro par sampark kare --------9412309322 ,0135-2772677  ,0135-2772496,9410534744 ----2-aapke pradesh me 60 varsh ke ayu se adhik umra ke kisano ko kisan penshon di jayegi ! DHANYABAD-----3-PRADESH ME SWAROJGAR YOGNA KE ANTARGAT BORVEL VIKAS AUR GREEN HOUSE KE BADLAV KE LIYE 75 % ANUDAN AUR PHAL PAUDH ROPAN YOJNA KE TAHAT 90 % ANUDAN DIYA JAYEGA UTTARAKHAND KI MANDI KA RATE JANNE KE LIYE 1800-102-4608 PAR SAMPARK KARE","UTTARAKHAND","DEHRADUN","DOIWALA                                           ","2014-12-31 07:04:29.803"
"RABI","AGRICULTURE","Others","Others","Government Schemes","bakri palan me lon lena hai?","krishi adhikari se samprk kare.","UTTARAKHAND","DEHRADUN","DOIWALA                                           ","2014-12-31 07:20:02.907"
"KHARIF","AGRICULTURE","Others","Others","Government Schemes","AAJ KA MAUSAM KAISA RAHEGA","Today we expect: plus 17—15 °C,  without precipitation, gentle breeze. Tomorrow: plus 18—15 °C,  without precipitation, light breeze.","UTTARAKHAND","DEHRADUN","KALSI                                             ","2014-12-31 07:26:40.257"
"KHARIF","AGRICULTURE","Others","Others","	Field Preparation	","HAME KRISHI YOJNA KE BARE ME BATAYEE","1-apne rajya ,jile ya blok ke krishi yojna ke bare me jankari ke liye in numbaro par sampark kare --------9412309322 ,0135-2772677  ,0135-2772496,9410534744 ----2-aapke pradesh me 60 varsh ke ayu se adhik umra ke kisano ko kisan penshon di jayegi ! DHANYABAD-----3-PRADESH ME SWAROJGAR YOGNA KE ANTARGAT BORVEL VIKAS AUR GREEN HOUSE KE BADLAV KE LIYE 75 % ANUDAN AUR PHAL PAUDH ROPAN YOJNA KE TAHAT 90 % ANUDAN DIYA JAYEGA UTTARAKHAND KI MANDI KA RATE JANNE KE LIYE 1800-102-4608 PAR SAMPARK KARE","UTTARAKHAND","DEHRADUN","KALSI                                             ","2014-12-31 07:45:17.570"
"KHARIF","AGRICULTURE","Others","Others","Weather","kya aaj barish ho sakti hai","Today we expect: plus 18—15 °C,  without precipitation, gentle breeze. Tomorrow: plus 21—17 °C,  without precipitation, light breeze.","UTTARAKHAND","DEHRADUN","DOIWALA                                           ","2014-12-31 09:46:04.633"
"RABI","AGRICULTURE","Cereals","Wheat","Weed Management","gehu mein weed control bataye","spray sulfosulfuron 75 % + metsulfuron 5 % @ 16 grqam/hectare","UTTARAKHAND","DEHRADUN","DOIWALA                                           ","2014-12-31 13:08:09.190"
"RABI","HORTICULTURE","Fruits","Acid Lime","	Plant Protection	","nibu me fangas laga hai?","spray 3% Copper oxychloride or 0.1% Carbendazim","UTTARAKHAND","DEHRADUN","SAHASPUR                                          ","2014-12-31 16:26:06.400"
