"Season","Sector","Category","Crop","QueryType","QueryText","KCCAns","StateName","DistrictName","BlockName","CreatedOn"
"KHARIF","AGRICULTURE","Fiber Crops","Cotton (Kapas)","Agriculture Mechanization","ask for cotton fungiside information","suggest: spray mancozeb 35gm/pump","GUJARAT","SABARKANTHA","MEGHRAJ                                           ","2014-09-28 10:12:16.780"
"KHARIF","AGRICULTURE","Fiber Crops","Cotton (Kapas)","	Plant Protection	","ASK ABOUT SUCKING PEST","suggested thiomithoxime 6 gram per pump","GUJARAT","SABARKANTHA","HIMATNAGAR                                        ","2014-09-28 10:32:41.490"
"KHARIF","AGRICULTURE","Fiber Crops","Cotton (Kapas)","	Plant Protection	","ask abt cotton in khuniya tapka","""1 gm streptocicline +20gm blue copper/15 liter water to apply
""","GUJARAT","SABARKANTHA","MEGHRAJ                                           ","2014-09-28 11:02:12.563"
"KHARIF","AGRICULTURE","Oilseeds","Soybean (bhat)","	Plant Protection	","ask abt heliothis","i suggested cyper methrin 25 ml / pamp","GUJARAT","SABARKANTHA","BAYAD                                             ","2014-09-28 12:40:47.653"
"KHARIF","AGRICULTURE","Others","Others","Weather","ask for weather information","i suggested no rainfall","GUJARAT","SABARKANTHA","IDAR                                              ","2014-09-28 17:29:41.870"
"KHARIF","AGRICULTURE","Fiber Crops","Cotton (Kapas)","	Plant Protection	","Ask for cotton growth information.","i suggested to apply regular dose of fertilizer in cotton.","GUJARAT","SABARKANTHA","IDAR                                              ","2014-09-28 18:11:39.660"
"KHARIF","AGRICULTURE","Oilseeds","Castor (Rehri, Rendi, Arandi) ","	Plant Protection	","ask about castor larva","i suggest spray cypermetharin 6 ml / pump","GUJARAT","SABARKANTHA","IDAR                                              ","2014-09-28 18:40:15.317"
"KHARIF","AGRICULTURE","Fiber Crops","Cotton (Kapas)","	Plant Protection	","ask about sucking pest in cotton","I suggested to spray dimethoat 15 ml/pump for control sucking pest in cotton","GUJARAT","SABARKANTHA","MODASA                                            ","2014-09-29 07:59:40.973"
"KHARIF","AGRICULTURE","Fiber Crops","Cotton (Kapas)","Agriculture Mechanization","ask for cotton flowering information","suggest: spray boomflower 20ml/pump","GUJARAT","SABARKANTHA","VADALI                                            ","2014-09-29 08:13:30.603"
"KHARIF","AGRICULTURE","Oilseeds","Castor (Rehri, Rendi, Arandi) ","	Plant Protection	","ask for  larva problem /iyal","suggest:quinalphose 30 ml per pump and to sprey","GUJARAT","SABARKANTHA","PRANTIJ                                           ","2014-09-29 09:26:38.787"
"KHARIF","AGRICULTURE","Others","Others","	Field Preparation	","ask about research related","I suggested to visit dativada uni. Sdau","GUJARAT","SABARKANTHA","IDAR                                              ","2014-09-29 09:47:01.117"
"KHARIF","AGRICULTURE","Others","Others","	Plant Protection	","ask about weather","suggestedb 18001801717","GUJARAT","SABARKANTHA","KHEDBRAHMA                                        ","2014-09-29 10:01:05.780"
"KHARIF","AGRICULTURE","Fiber Crops","Cotton (Kapas)","	Plant Protection	","ask about leaf spot in cotton","I suggested to spray mencozeb 30 gm /pump for control leaf spot in cotton","GUJARAT","SABARKANTHA","HIMATNAGAR                                        ","2014-09-29 10:05:12.660"
"KHARIF","AGRICULTURE","Fiber Crops","Cotton (Kapas)","	Plant Protection	","ASK ABOUT FLOWERING","SUGGESTED BOOM FLOWER 30 ML PER PUMP","GUJARAT","SABARKANTHA","MALPUR                                            ","2014-09-29 12:34:38.143"
"KHARIF","AGRICULTURE","Fiber Crops","Cotton (Kapas)","Market Information","ask about market information","I suggested to market yard no. 1800 102 8767","GUJARAT","SABARKANTHA","TALOD                                             ","2014-09-29 13:02:08.437"
"KHARIF","HORTICULTURE","Vegetables","Brinjal","	Plant Protection	","ask for  larva problem","suggest:cypermethrin 10 ml. per pump and to spray.","GUJARAT","SABARKANTHA","BHILODA                                           ","2014-09-29 14:07:03.750"
"KHARIF","AGRICULTURE","Others","Others","	Plant Protection	","ask for kcc information","sugg to information","GUJARAT","SABARKANTHA","DHANSURA                                          ","2014-09-29 15:30:49.577"
"KHARIF","AGRICULTURE","Fodder Crops","Guar","Cultural Practices","ask for  weed control information","suggest: not use weedicide in any stand crop","GUJARAT","SABARKANTHA","TALOD                                             ","2014-09-29 15:52:22.600"
"KHARIF","AGRICULTURE","Fiber Crops","Cotton (Kapas)","	Plant Protection	","ask for cotto fertilizer dose","sugg to potash 10 kg /vigha","GUJARAT","SABARKANTHA","IDAR                                              ","2014-09-29 16:07:21.910"
"KHARIF","AGRICULTURE","Fiber Crops","Cotton (Kapas)","	Plant Protection	","Ask for cotton whitefly problem.","I suggested to spray tryzophos 30 ml./pump.","GUJARAT","SABARKANTHA","IDAR                                              ","2014-09-29 16:48:44.163"
"KHARIF","HORTICULTURE","Vegetables","Potato","Fertilizer Use and Availability","Ask for potato fertilizer information.","I suggested to visit agro.-center.","GUJARAT","SABARKANTHA","TALOD                                             ","2014-09-29 18:29:21.750"
"KHARIF","AGRICULTURE","Others","Others","	Field Preparation	","ASK ABOUT WEBSITE","SUGGESTED IKISAN.IN","GUJARAT","SABARKANTHA","PRANTIJ                                           ","2014-09-30 10:50:14.230"
"KHARIF","AGRICULTURE","Others","Others","Government Schemes","ask for govt. scheme information","I suggested to dao","GUJARAT","SABARKANTHA","PRANTIJ                                           ","2014-09-30 11:09:32.757"
"KHARIF","AGRICULTURE","Oilseeds","Castor (Rehri, Rendi, Arandi) ","	Plant Protection	","Ask for the larva control","corazon 5  ml / 10 liter water","GUJARAT","SABARKANTHA","HIMATNAGAR                                        ","2014-09-30 12:09:14.730"
"KHARIF","AGRICULTURE","Others","Others","Government Schemes","ask for kisancredit card information","suggest : visit nearest nationalized bank.","GUJARAT","SABARKANTHA","HIMATNAGAR                                        ","2014-09-30 12:19:15.530"
"KHARIF","AGRICULTURE","Oilseeds","Castor (Rehri, Rendi, Arandi) ","	Plant Protection	","ASK ABOUT SUCKING PEST","suggested thiomithoxime 6 gram per pump","GUJARAT","SABARKANTHA","IDAR                                              ","2014-09-30 12:39:11.850"
"KHARIF","AGRICULTURE","Fiber Crops","Cotton (Kapas)","	Plant Protection	","Ask for cotton flowering problem.","i suggested to spray boomflower 20 ml./pump.","GUJARAT","SABARKANTHA","HIMATNAGAR                                        ","2014-09-30 14:33:20.650"
"KHARIF","AGRICULTURE","Fiber Crops","Cotton (Kapas)","	Plant Protection	","Ask for cotton whitefly problem.","i suggested to spray tryzophos 30 ml./pump.","GUJARAT","SABARKANTHA","MODASA                                            ","2014-09-30 15:14:10.303"
"KHARIF","AGRICULTURE","Fiber Crops","Cotton (Kapas)","	Plant Protection	","ask for white fly control information","suggest:phosphamidon 15 ml/pump sprey
suggest:thayomithoczem 5 ml/pump sprey","GUJARAT","SABARKANTHA","HIMATNAGAR                                        ","2014-09-30 15:19:50.597"
"KHARIF","AGRICULTURE","Others","Others","Fertilizer Use and Availability","ask for fertilizer information","suggest:give 19-19-19 100 gm/pump and to sprey","GUJARAT","SABARKANTHA","IDAR                                              ","2014-09-30 15:26:52.683"
"KHARIF","HORTICULTURE","Vegetables","Brinjal","	Plant Protection	","ask for sucking pest control information","suggest:dia methote 10 ml/ 10 lit. water","GUJARAT","SABARKANTHA","TALOD                                             ","2014-09-30 16:13:54.210"
"KHARIF","AGRICULTURE","Oilseeds","Castor (Rehri, Rendi, Arandi) ","	Plant Protection	","Ask for castor semi looper problem.","i suggested to spray quinalphos 30 ml./pump.","GUJARAT","SABARKANTHA","MALPUR                                            ","2014-09-30 17:34:48.453"
"KHARIF","AGRICULTURE","Fiber Crops","Cotton (Kapas)","	Plant Protection	","ask for fungus problem","suggest:blue copper 40 gm per pamp and dranching","GUJARAT","SABARKANTHA","PRANTIJ                                           ","2014-09-30 18:27:41.507"
"KHARIF","AGRICULTURE","Fiber Crops","Cotton (Kapas)","	Plant Protection	","ask for  larva problem","suggest:quinalphose 30 ml per pump and to sprey","GUJARAT","SABARKANTHA","BAYAD                                             ","2014-09-30 19:35:30.437"
