"Season","Sector","Category","Crop","QueryType","QueryText","KCCAns","StateName","DistrictName","BlockName","CreatedOn"
"KHARIF","AGRICULTURE","Fiber Crops","Cotton (Kapas)","	Plant Protection	","ask abt sucking pest.in crop","Dimethoate 10 ml / 10 lit water","GUJARAT","SABARKANTHA","MODASA                                            ","2014-09-17 10:22:10.290"
"KHARIF","AGRICULTURE","Fiber Crops","Cotton (Kapas)","	Plant Protection	","ask for cotton jasside","spray imidaclopride 5 ml / 10 lit water","GUJARAT","SABARKANTHA","HIMATNAGAR                                        ","2014-09-17 10:31:46.050"
"KHARIF","AGRICULTURE","Fiber Crops","Cotton (Kapas)","	Plant Protection	","ask aboy cotton ball drop","napethilic acitic acid 5ml+potaisim nitrate13-0-45) 200gm+ 15 liter water","GUJARAT","SABARKANTHA","HIMATNAGAR                                        ","2014-09-17 10:42:09.593"
"KHARIF","AGRICULTURE","Fiber Crops","Cotton (Kapas)","	Plant Protection	","ask abt cotton in leaf spots","mancozeb 25 gram per pump and to spray.","GUJARAT","SABARKANTHA","PRANTIJ                                           ","2014-09-17 10:58:40.490"
"KHARIF","HORTICULTURE","Vegetables","Brinjal","	Plant Protection	","ask for  larva problem","suggest:cypermethrin 10 ml. per pump and to spray.","GUJARAT","SABARKANTHA","PRANTIJ                                           ","2014-09-17 11:24:02.410"
"KHARIF","AGRICULTURE","Fiber Crops","Cotton (Kapas)","	Plant Protection	","ask abt mealey bug in cotton","methyel perathion 2kg/vigha to apply","GUJARAT","SABARKANTHA","KHEDBRAHMA                                        ","2014-09-17 12:00:43.513"
"KHARIF","AGRICULTURE","Fiber Crops","Cotton (Kapas)","	Plant Protection	","ask for cotton angular disease control","suggest:streptocyclin 6 gm+blue coper 50 gm/100 lit water","GUJARAT","SABARKANTHA","DHANSURA                                          ","2014-09-17 13:04:52.503"
"KHARIF","AGRICULTURE","Fiber Crops","Cotton (Kapas)","	Plant Protection	","ask abt mealely bug in cotton","pprofenophose 30ml/pump to apply","GUJARAT","SABARKANTHA","BHILODA                                           ","2014-09-17 13:06:07.403"
"KHARIF","AGRICULTURE","Oilseeds","Soybean (bhat)","	Plant Protection	","Ask for soyabean heliothis.","I suggested to spray Quinalphos 30 ml./pump.","GUJARAT","SABARKANTHA","BAYAD                                             ","2014-09-17 14:27:37.490"
"KHARIF","AGRICULTURE","Fiber Crops","Cotton (Kapas)","	Plant Protection	","Ask for cotton leaf become yellow colour.","I suggested to spray( N-P-K:19-19-19) ,100 gram/pump.","GUJARAT","SABARKANTHA","HIMATNAGAR                                        ","2014-09-17 17:15:52.243"
"KHARIF","HORTICULTURE","Vegetables","Chillies","	Plant Protection	","ask for chilly leaf curl control","i suggested to sprey diemithoat 15 ml/pump","GUJARAT","SABARKANTHA","KHEDBRAHMA                                        ","2014-09-18 08:10:53.397"
"KHARIF","AGRICULTURE","Others","Others","Government Schemes","ask for govt. scheme information","i suggested to contact dao","GUJARAT","SABARKANTHA","MALPUR                                            ","2014-09-18 08:56:05.417"
"KHARIF","AGRICULTURE","Oilseeds","Castor (Rehri, Rendi, Arandi) ","	Plant Protection	","ask for castor varatie","sugg to g c h-5","GUJARAT","SABARKANTHA","IDAR                                              ","2014-09-18 09:09:15.220"
"KHARIF","HORTICULTURE","Vegetables","Cucumber","	Plant Protection	","ask for cucumber yellowing leaf control","i suggested to give fertilizer","GUJARAT","SABARKANTHA","BAYAD                                             ","2014-09-18 09:09:53.547"
"KHARIF","AGRICULTURE","Fiber Crops","Cotton (Kapas)","	Plant Protection	","ASK ABOUT MEALY BUG IN COTTON","I SUGEGSTED TO SPRAY CHLOROPYRIPHOS 25 ML/PUMP FOR CONTROL MEALY BUG IN COTTON","GUJARAT","SABARKANTHA","KHEDBRAHMA                                        ","2014-09-18 09:45:10.597"
"KHARIF","AGRICULTURE","Oilseeds","Sesame (Gingelly/Til)/Sesamum","Sowing Time and Weather","ASK ABOUT SOWING TIME OF SESAME","I SUGEGSTED TO 15 AUGUST TO 15 SEPTEMBER  SOWING TIME OF SESAME","GUJARAT","SABARKANTHA","BHILODA                                           ","2014-09-18 11:02:10.330"
"KHARIF","AGRICULTURE","Others","Others","Weather","ask for rain fall information","suggest: : today no rain fall data","GUJARAT","SABARKANTHA","MODASA                                            ","2014-09-18 14:49:19.290"
"KHARIF","AGRICULTURE","Oilseeds","Soybean (bhat)","	Plant Protection	","ask abt heliothis","i suggested cyper methrin 15 ml / pamp","GUJARAT","SABARKANTHA","BAYAD                                             ","2014-09-18 14:56:23.860"
"KHARIF","AGRICULTURE","Millets","Sorghum (Jowar/Great Millet)","Agriculture Mechanization","ask for sorghum heliothis information","i suggested spray quinalphos  20  ml / 10 li. Water","GUJARAT","SABARKANTHA","BAYAD                                             ","2014-09-18 15:17:45.677"
"KHARIF","AGRICULTURE","Oilseeds","Castor (Rehri, Rendi, Arandi) ","Fertilizer Use and Availability","Ask for castor fertilizer information.","I suggested to apply urea fertilizer in castor.","GUJARAT","SABARKANTHA","BHILODA                                           ","2014-09-18 18:26:36.480"
"KHARIF","AGRICULTURE","Fiber Crops","Cotton (Kapas)","	Plant Protection	","Ask for cotton thrips.","I suggested to spray  Thiamethoxam 25% WG 7 gram/pump.","GUJARAT","SABARKANTHA","MODASA                                            ","2014-09-18 18:34:21.903"
"KHARIF","AGRICULTURE","Fiber Crops","Cotton (Kapas)","	Plant Protection	","ask about sucking pest in cotton","I suggested spray tirzophosh 30 mili / 15 liter","GUJARAT","SABARKANTHA","MODASA                                            ","2014-09-19 08:18:30.723"
"KHARIF","AGRICULTURE","Oilseeds","Groundnut (pea nut/mung phalli)","	Plant Protection	","ask about groundnut catterpiller","i suggested quinalphos 20ml/pump","GUJARAT","SABARKANTHA","MEGHRAJ                                           ","2014-09-19 08:27:20.750"
"KHARIF","AGRICULTURE","Fodder Crops","Guar","	Plant Protection	","ask for guar flower drop information","i suggested to sprey boom flower 30 ml/pump","GUJARAT","SABARKANTHA","MODASA                                            ","2014-09-19 08:42:29.203"
"KHARIF","AGRICULTURE","Others","Others","Weather","ask about weather information","no possibilities of rain","GUJARAT","SABARKANTHA","HIMATNAGAR                                        ","2014-09-19 14:04:25.423"
"KHARIF","AGRICULTURE","Fiber Crops","Cotton (Kapas)","	Plant Protection	","ask for fungus problem","suggest:blue copper 40 gm per pamp and dranching","GUJARAT","SABARKANTHA","TALOD                                             ","2014-09-19 14:18:37.853"
"KHARIF","AGRICULTURE","Fiber Crops","Cotton (Kapas)","Agriculture Mechanization","ask for cotton aphid information","suggest: spray prophenophose 25mnl/pump","GUJARAT","SABARKANTHA","VADALI                                            ","2014-09-19 17:19:25.537"
"KHARIF","AGRICULTURE","Others","Others","Credit","Ask about subsidy information","no subsidy for your problem","GUJARAT","SABARKANTHA","MODASA                                            ","2014-09-19 17:27:35.110"
"KHARIF","HORTICULTURE","Vegetables","Chillies","	Plant Protection	","ask for fungus problem","suggest:carbendesim 5 gm/10 lit water and sprey","GUJARAT","SABARKANTHA","HIMATNAGAR                                        ","2014-09-19 17:44:53.847"
"KHARIF","AGRICULTURE","Others","Others","Organic Farming","ASK FOR ORGANIC IN COTTON","APPLY;GOMUTRA","GUJARAT","SABARKANTHA","DHANSURA                                          ","2014-09-20 10:00:38.487"
"KHARIF","AGRICULTURE","Fiber Crops","Cotton (Kapas)","	Plant Protection	","ask abt sucking pest.in crop","Traizophos 20  ml / 10 lit water","GUJARAT","SABARKANTHA","IDAR                                              ","2014-09-20 11:20:34.763"
"KHARIF","AGRICULTURE","Fiber Crops","Cotton (Kapas)","	Plant Protection	","ask for flower drop problem","suggest:boom flower 20 ml/pump sprey for flower drop","GUJARAT","SABARKANTHA","HIMATNAGAR                                        ","2014-09-20 11:34:56.847"
"KHARIF","AGRICULTURE","Fiber Crops","Cotton (Kapas)","	Plant Protection	","ask for sucking pest control information","suggest:dia methote 10 ml/ 10 lit. water","GUJARAT","SABARKANTHA","BHILODA                                           ","2014-09-20 13:18:09.407"
"KHARIF","AGRICULTURE","Others","Others","Weather","ASK FOR RAINfall INFORMATION","SUGGEST:NO RAINfall INFORMATION","GUJARAT","SABARKANTHA","MODASA                                            ","2014-09-20 14:16:14.663"
"KHARIF","HORTICULTURE","Fruits","Aonla","	Plant Protection	","ask for flower drop problem","suggest:boom flower 20 ml/pump sprey for flower drop","GUJARAT","SABARKANTHA","VADALI                                            ","2014-09-21 09:01:15.163"
"KHARIF","AGRICULTURE","Fiber Crops","Cotton (Kapas)","	Plant Protection	","ask for white fly control information","suggest:prophenophose 25 ml/pump sprey","GUJARAT","SABARKANTHA","IDAR                                              ","2014-09-21 10:01:29.460"
"KHARIF","HORTICULTURE","Vegetables","Brinjal","	Plant Protection	","ask abt var. of brinjal ?","suggested anand ringan-1 and doli-5.","GUJARAT","SABARKANTHA","BAYAD                                             ","2014-09-21 10:43:44.440"
"KHARIF","AGRICULTURE","Oilseeds","Castor (Rehri, Rendi, Arandi) ","	Plant Protection	","ask about termite in castor","I suggested drenching the cloropayriphosh 30 mili / 15 liter","GUJARAT","SABARKANTHA","MEGHRAJ                                           ","2014-09-21 11:32:35.503"
"KHARIF","AGRICULTURE","Fiber Crops","Cotton (Kapas)","	Plant Protection	","ask about fertilizer in coton","suggested 20-20-20 100 gram spray","GUJARAT","SABARKANTHA","PRANTIJ                                           ","2014-09-21 14:16:49.620"
"KHARIF","AGRICULTURE","Fiber Crops","Cotton (Kapas)","	Plant Protection	","ask for sucking pest control information","suggest:dia methote 10 ml/ 10 lit. water","GUJARAT","SABARKANTHA","DHANSURA                                          ","2014-09-21 14:46:45.650"
"KHARIF","AGRICULTURE","Others","Others","Market Information","ask about market bazar","suggested 18001028767","GUJARAT","SABARKANTHA","TALOD                                             ","2014-09-21 14:50:20.743"
"KHARIF","AGRICULTURE","Oilseeds","Sesame (Gingelly/Til)/Sesamum","	Plant Protection	","ask abt larvae problem?","suggested cypermethrin 15 ml/pump.","GUJARAT","SABARKANTHA","HIMATNAGAR                                        ","2014-09-21 16:20:47.987"
"KHARIF","AGRICULTURE","Fiber Crops","Cotton (Kapas)","	Plant Protection	","ASK ABOUT FLOWERING","SUGGESTED BOOM FLOWER 30 ML PER PUMP","GUJARAT","SABARKANTHA","MEGHRAJ                                           ","2014-09-21 16:53:18.997"
"KHARIF","AGRICULTURE","Fiber Crops","Cotton (Kapas)","Agriculture Mechanization","ask for white fly control information","suggest:sprey tryzophose 25 ml/pump+1 spoon washing powdar","GUJARAT","SABARKANTHA","BHILODA                                           ","2014-09-21 17:36:09.030"
"KHARIF","HORTICULTURE","Vegetables","Potato","Cultural Practices","ask about general information","information provided","GUJARAT","SABARKANTHA","MODASA                                            ","2014-09-21 21:05:24.630"
"KHARIF","AGRICULTURE","Oilseeds","Soybean (bhat)","	Plant Protection	","ask abt heliothis","i suggested cyper methrin 25 ml / pamp","GUJARAT","SABARKANTHA","BAYAD                                             ","2014-09-22 08:42:28.390"
"KHARIF","AGRICULTURE","Oilseeds","Groundnut (pea nut/mung phalli)","Agriculture Mechanization","ask for groundnut  heliothis information","suggest: spray quinalphose 25ml/pump","GUJARAT","SABARKANTHA","TALOD                                             ","2014-09-22 09:41:40.770"
"KHARIF","AGRICULTURE","Fiber Crops","Cotton (Kapas)","	Plant Protection	","ask for sucking pest control information","suggest:dia methote 10 ml/ 10 lit. water","GUJARAT","SABARKANTHA","MALPUR                                            ","2014-09-22 10:13:26.083"
"KHARIF","HORTICULTURE","Vegetables","Potato","Agriculture Mechanization","ask for potato fertilizer dose information","suggest: in potato apply 220:110:220 npk kg/ha","GUJARAT","SABARKANTHA","MODASA                                            ","2014-09-22 11:19:24.200"
"KHARIF","AGRICULTURE","Fiber Crops","Cotton (Kapas)","Cultural Practices","ask for cotton growth information","i suggested to give hyumic acid","GUJARAT","SABARKANTHA","IDAR                                              ","2014-09-22 16:12:40.030"
"KHARIF","AGRICULTURE","Others","Others","Government Schemes","ask for govt.scheme information","i suggested to contact dao","GUJARAT","SABARKANTHA","VADALI                                            ","2014-09-22 16:59:51.913"
"KHARIF","AGRICULTURE","Fiber Crops","Cotton (Kapas)","	Plant Protection	","ask about fungus on cotton","I suggested spray mencozeb 35 gram / 15 liter","GUJARAT","SABARKANTHA","PRANTIJ                                           ","2014-09-23 08:54:32.740"
"KHARIF","AGRICULTURE","Oilseeds","Castor (Rehri, Rendi, Arandi) ","Fertilizer Use and Availability","ask about fertilizer use in castor","I suggested to 19 kg/ha nitrogen fertilizer use in castor","GUJARAT","SABARKANTHA","HIMATNAGAR                                        ","2014-09-23 09:17:20.930"
"KHARIF","AGRICULTURE","Others","Others","Government Schemes","ask about government schemes","I suggested to contact district agriculture officer","GUJARAT","SABARKANTHA","PRANTIJ                                           ","2014-09-23 09:28:03.140"
"KHARIF","HORTICULTURE","Drug and Narcotics","Tobacco","	Plant Protection	","ask for tobbacco sowing season","sugg to saptembar","GUJARAT","SABARKANTHA","PRANTIJ                                           ","2014-09-23 09:31:25.810"
"KHARIF","AGRICULTURE","Fiber Crops","Cotton (Kapas)","	Plant Protection	","ask about wilt in cotton","u suggested to spray mencozeb 30 gm/pump for control wilt in cotton","GUJARAT","SABARKANTHA","PRANTIJ                                           ","2014-09-23 09:33:55.333"
"KHARIF","HORTICULTURE","Vegetables","Potato","Cultural Practices","ask for potato sowing season","i suggested nov. month","GUJARAT","SABARKANTHA","TALOD                                             ","2014-09-23 09:45:14.573"
"KHARIF","AGRICULTURE","Fiber Crops","Cotton (Kapas)","	Plant Protection	","ask for cotton  leaf control","i suggested to sprey diemithoat 15 ml/pump","GUJARAT","SABARKANTHA","BAYAD                                             ","2014-09-23 09:52:27.010"
"KHARIF","HORTICULTURE","Fruits","Papaya","	Plant Protection	","ASK ABOUT SUCKING PEST","Traizophos 30 ml / 10 lit water","GUJARAT","SABARKANTHA","DHANSURA                                          ","2014-09-23 14:22:23.397"
"KHARIF","HORTICULTURE","Vegetables","Brinjal","	Plant Protection	","Ask for brinjal information.","i suggested to contact distributor.","GUJARAT","SABARKANTHA","PRANTIJ                                           ","2014-09-23 15:25:04.340"
"KHARIF","AGRICULTURE","Fiber Crops","Cotton (Kapas)","	Plant Protection	","ask for white fly control information","suggest:thayomithoczem 5 ml/pump sprey","GUJARAT","SABARKANTHA","VADALI                                            ","2014-09-23 17:21:34.360"
"KHARIF","AGRICULTURE","Others","Others","Government Schemes","ASK FOR REGISTRATION","Registration successfully done.","GUJARAT","SABARKANTHA","IDAR                                              ","2014-09-23 18:18:22.740"
"KHARIF","AGRICULTURE","Oilseeds","Castor (Rehri, Rendi, Arandi) ","	Plant Protection	","ask for termite control information","suggest:fipronil 25 ml/pump sprey","GUJARAT","SABARKANTHA","BHILODA                                           ","2014-09-23 18:46:40.550"
"KHARIF","AGRICULTURE","Others","Others","Government Schemes","ask about government schemes","I suggested to contact district agriculture officer","GUJARAT","SABARKANTHA","IDAR                                              ","2014-09-24 08:37:47.037"
"KHARIF","AGRICULTURE","Fodder Crops","Guar","Cultural Practices","ask for guar flowering information","i suggested to sprey boom flower 30 ml/pump","GUJARAT","SABARKANTHA","IDAR                                              ","2014-09-24 09:38:41.580"
"KHARIF","AGRICULTURE","Fiber Crops","Cotton (Kapas)","	Plant Protection	","Ask for cotton fungus.","I suggested to spray mancozeb 35 gram/pump.","GUJARAT","SABARKANTHA","BAYAD                                             ","2014-09-24 15:30:28.713"
"KHARIF","AGRICULTURE","Others","Others","Weather","ASK FOR RAINfall INFORMATION","SUGGEST:NO RAINfall INFORMATION","GUJARAT","SABARKANTHA","VADALI                                            ","2014-09-24 16:13:56.727"
"KHARIF","HORTICULTURE","Fruits","Papaya","Fertilizer Use and Availability","Ask for papaya growth information.","I suggested to apply regular dose of fertilizer in papaya.","GUJARAT","SABARKANTHA","IDAR                                              ","2014-09-24 18:17:10.900"
"KHARIF","AGRICULTURE","Fiber Crops","Cotton (Kapas)","	Plant Protection	","ask control of sucking pest","I suggested spray imidaklorprid 5 mili /pump","GUJARAT","SABARKANTHA","MEGHRAJ                                           ","2014-09-24 18:31:08.283"
"KHARIF","HORTICULTURE","Fruits","Pomegranate","Agriculture Mechanization","ask for government schem","suggest:contect to district agricultur officer","GUJARAT","SABARKANTHA","TALOD                                             ","2014-09-25 08:39:59.087"
"KHARIF","AGRICULTURE","Fiber Crops","Cotton (Kapas)","	Plant Protection	","ASK ABOUT SUCKING PEST IN COTTON","I SUGGESTED TO SPRAY DIMETHOAT 15 ML/PUMP FOR CONTROL SUCKING PEST IN COTTON","GUJARAT","SABARKANTHA","IDAR                                              ","2014-09-25 10:42:28.240"
"KHARIF","AGRICULTURE","Others","Others","Weather","ask for weather information","i suggested no rainfall","GUJARAT","SABARKANTHA","KHEDBRAHMA                                        ","2014-09-25 11:04:26.380"
"KHARIF","AGRICULTURE","Others","Others","Weather","ask for weather information","i suggested no rainfall","GUJARAT","SABARKANTHA","KHEDBRAHMA                                        ","2014-09-25 11:07:22.550"
"KHARIF","AGRICULTURE","Fiber Crops","Cotton (Kapas)","	Plant Protection	","ask for sucking pest control information","suggest:prophenophose 25 ml/pump sprey","GUJARAT","SABARKANTHA","PRANTIJ                                           ","2014-09-25 13:38:03.530"
"KHARIF","AGRICULTURE","Fiber Crops","Cotton (Kapas)","	Plant Protection	","ask abt khuniya tapka in cotton","6gm streptrocicline + 60gm blue copper/pump to apply","GUJARAT","SABARKANTHA","PRANTIJ                                           ","2014-09-25 14:30:19.663"
"KHARIF","AGRICULTURE","Fiber Crops","Cotton (Kapas)","	Plant Protection	","ask abt khuniya tapka in cotton","6gm streptrocicline + 60gm blue copper/pump to apply","GUJARAT","SABARKANTHA","PRANTIJ                                           ","2014-09-25 14:30:22.080"
"KHARIF","HORTICULTURE","Vegetables","Drum Stick","	Plant Protection	","ask abt drumstick in sowing distance","6 miter*6 miter","GUJARAT","SABARKANTHA","IDAR                                              ","2014-09-25 15:26:31.627"
"KHARIF","AGRICULTURE","Fiber Crops","Cotton (Kapas)","	Plant Protection	","ask control of sucking pest","I suggested spray imidaklorprid 7 mili /pump","GUJARAT","SABARKANTHA","PRANTIJ                                           ","2014-09-25 15:48:01.333"
"KHARIF","AGRICULTURE","Fiber Crops","Cotton (Kapas)","Agriculture Mechanization","ask for cotton fungiside information","suggest:mancozeb 30 gm per pamp and to sprey","GUJARAT","SABARKANTHA","HIMATNAGAR                                        ","2014-09-25 17:51:57.830"
"KHARIF","AGRICULTURE","Others","Others","	Plant Protection	","Ask for market rate","call 1800 102 8767 for market rate","GUJARAT","SABARKANTHA","HIMATNAGAR                                        ","2014-09-26 10:57:17.250"
"KHARIF","AGRICULTURE","Fiber Crops","Cotton (Kapas)","	Plant Protection	","ASK ABOUT SUCKING PEST","Traizophos 30 ml / 10 lit water","GUJARAT","SABARKANTHA","IDAR                                              ","2014-09-26 10:59:45.230"
"KHARIF","AGRICULTURE","Oilseeds","Groundnut (pea nut/mung phalli)","	Plant Protection	","ask for g'nut heliothish","quinalphos 30 ml.per pump and to spray.","GUJARAT","SABARKANTHA","PRANTIJ                                           ","2014-09-26 11:17:52.003"
"KHARIF","AGRICULTURE","Fiber Crops","Cotton (Kapas)","	Plant Protection	","ask about root wilt","suggetsed mencozeb 35 gm per pump","GUJARAT","SABARKANTHA","MODASA                                            ","2014-09-26 11:24:45.923"
"KHARIF","HORTICULTURE","Drug and Narcotics","Tobacco","	Plant Protection	","ask abt sowing time ?","suggested best time octomber.","GUJARAT","SABARKANTHA","MODASA                                            ","2014-09-26 12:18:14.873"
"KHARIF","AGRICULTURE","Fiber Crops","Cotton (Kapas)","	Plant Protection	","ask control of sucking pest","I suggested spray imidaklorprid 7 mili /pump","GUJARAT","SABARKANTHA","BHILODA                                           ","2014-09-26 17:41:25.787"
"KHARIF","HORTICULTURE","Condiments and Spices","Fenugreek","	Plant Protection	","Ask for fenugreek sowingtime information.","fenugreek sowingtime:sept.-to november month.","GUJARAT","SABARKANTHA","HIMATNAGAR                                        ","2014-09-26 18:04:57.130"
"KHARIF","HORTICULTURE","Vegetables","Bottle Gourd ","	Plant Protection	","ask control of wilt problem","I suggested drenching blue copper 40 gram /pump","GUJARAT","SABARKANTHA","IDAR                                              ","2014-09-26 18:05:20.173"
"KHARIF","AGRICULTURE","Fiber Crops","Cotton (Kapas)","	Plant Protection	","ASK ABOUT SUCKING PEST IN COTTON","I SUGGESTED TO SPRAY DIMETHOAT 15 ML/PUMP FOR CONTROL SUCKING PEST IN COTTON","GUJARAT","SABARKANTHA","BAYAD                                             ","2014-09-27 09:53:29.680"
"KHARIF","AGRICULTURE","Others","Others","	Plant Protection	","ask for weediside information","sugg to information","GUJARAT","SABARKANTHA","TALOD                                             ","2014-09-27 10:15:13.380"
"KHARIF","AGRICULTURE","Oilseeds","Castor (Rehri, Rendi, Arandi) ","	Plant Protection	","ASK ABOUT LARVA IN CASTOR","I SUGGESTED TO SPRAY QUINALPHOS 20 ML/PUMP FOR CONTROL  LARVA IN CASTOR","GUJARAT","SABARKANTHA","HIMATNAGAR                                        ","2014-09-27 10:16:12.377"
"KHARIF","AGRICULTURE","Oilseeds","Castor (Rehri, Rendi, Arandi) ","	Field Preparation	","ask abt fertilizer ?","suggeste apply urea and dap 15 kg /vigha","GUJARAT","SABARKANTHA","MALPUR                                            ","2014-09-27 11:11:32.223"
"KHARIF","AGRICULTURE","Fiber Crops","Cotton (Kapas)","	Plant Protection	","ASK ABOUT SUCKING PEST IN COTTON","I SUGGESTED TO SPRAY TRIZOPHOS 25 ML/PUMP FOR CONTROL SUCKING PEST IN COTTON","GUJARAT","SABARKANTHA","PRANTIJ                                           ","2014-09-27 11:15:46.890"
"KHARIF","AGRICULTURE","Fiber Crops","Cotton (Kapas)","	Plant Protection	","ask for cotton information","sugg to information","GUJARAT","SABARKANTHA","HIMATNAGAR                                        ","2014-09-27 11:56:15.210"
"KHARIF","HORTICULTURE","Drug and Narcotics","Tobacco","Cultural Practices","Ask about general information and ID number","ID number has been provided","GUJARAT","SABARKANTHA","IDAR                                              ","2014-09-27 14:57:18.830"
"KHARIF","AGRICULTURE","Oilseeds","Castor (Rehri, Rendi, Arandi) ","	Plant Protection	","ask abt late variety in caster","gujarat caster hybrids-5","GUJARAT","SABARKANTHA","HIMATNAGAR                                        ","2014-09-27 15:43:28.597"
"KHARIF","AGRICULTURE","Others","Others","Market Information","ask for market information","www.agmarknet.com","GUJARAT","SABARKANTHA","BAYAD                                             ","2014-09-27 15:55:01.587"
"KHARIF","AGRICULTURE","Fiber Crops","Cotton (Kapas)","Agriculture Mechanization","ask for cotton white fly information","suggest: spray tryjophose 20ml/pump for mealy bug","GUJARAT","SABARKANTHA","TALOD                                             ","2014-09-27 17:46:31.527"
"KHARIF","HORTICULTURE","Vegetables","Chillies","	Plant Protection	","ask for sucking pest control information","suggest:dia methote 10 ml/ 10 lit. water","GUJARAT","SABARKANTHA","DHANSURA                                          ","2014-09-27 17:50:33.530"
"KHARIF","AGRICULTURE","Oilseeds","Castor (Rehri, Rendi, Arandi) ","Agriculture Mechanization","ask for weediside information in standing crop","suggest: no advise weedisdie for standing crop","GUJARAT","SABARKANTHA","PRANTIJ                                           ","2014-09-27 18:12:16.573"
"KHARIF","AGRICULTURE","Others","Others","	Field Preparation	","Ask for market rate","call on 1800 102 8767 for market price","GUJARAT","SABARKANTHA","HIMATNAGAR                                        ","2014-09-27 19:01:03.130"
"KHARIF","AGRICULTURE","Oilseeds","Castor (Rehri, Rendi, Arandi) ","Agriculture Mechanization","ask for castor  fertilizers dose information","suggest: in cotton give urea with irrigation","GUJARAT","SABARKANTHA","MALPUR                                            ","2014-09-28 08:39:05.193"
"KHARIF","AGRICULTURE","Fiber Crops","Cotton (Kapas)","Agriculture Mechanization","ask for cotton  thrips information","suggest: spray tryjophose 20ml/pump for mealy bug","GUJARAT","SABARKANTHA","HIMATNAGAR                                        ","2014-09-28 09:54:00.383"
