"Season","Sector","Category","Crop","QueryType","QueryText","KCCAns","StateName","DistrictName","BlockName","CreatedOn"
"KHARIF","HORTICULTURE","Vegetables","Chillies","Agriculture Mechanization","ask for chili fertilizer dose information","suggest: apply npk fertilizer dose in base dose application","GUJARAT","VADODARA","VADODARA(CITY AND RURAL)                          ","2014-09-24 09:02:03.703"
"KHARIF","AGRICULTURE","Fiber Crops","Cotton (Kapas)","	Plant Protection	","ask for cotton red leaf spot control","i suggested to sprey carbandazim 25 gm/pump","GUJARAT","VADODARA","SANKHEDA                                          ","2014-09-24 09:08:24.743"
"KHARIF","AGRICULTURE","Others","Others","Weather","Ask for market rate","call 1800 102 8767 for market rate","GUJARAT","VADODARA","KARJAN                                            ","2014-09-24 09:28:22.573"
"KHARIF","AGRICULTURE","Fiber Crops","Cotton (Kapas)","	Plant Protection	","ask for cotton sucking pest control","i suggested to sprey diemithoat 15 ml/pump","GUJARAT","VADODARA","SHINOR                                            ","2014-09-24 09:29:28.860"
"KHARIF","AGRICULTURE","Fiber Crops","Cotton (Kapas)","	Plant Protection	","ask about cotton engular leaf spot","1 gm streptocylin  + 20 gm blue copper (copper oxychoride) + 15 liter water","GUJARAT","VADODARA","WAGHODIA                                          ","2014-09-24 10:10:07.400"
"KHARIF","AGRICULTURE","Pulses","Bengal Gram (Gram/Chick Pea/Kabuli/Chana)","Sowing Time and Weather","ask about sowing time of gram","I suggested to October to November sowing time of gram","GUJARAT","VADODARA","NASWADI                                           ","2014-09-24 10:37:44.910"
"KHARIF","AGRICULTURE","Fiber Crops","Cotton (Kapas)","	Plant Protection	","ask for cotton fertilizer dose","sugg to ammonium salphet 15 kg/vigha","GUJARAT","VADODARA","DABHOI                                            ","2014-09-24 10:52:43.990"
"KHARIF","AGRICULTURE","Fiber Crops","Cotton (Kapas)","Cultural Practices","Ask for cucumber sowingtime information.","cucumber sowingtime :june-july month.","GUJARAT","VADODARA","SANKHEDA                                          ","2014-09-24 14:40:07.280"
"KHARIF","AGRICULTURE","Others","Others","Credit","ask for vima yojna","suggest"":contacat to bank","GUJARAT","VADODARA","JETPUR PAVI                                       ","2014-09-24 19:06:18.843"
"KHARIF","AGRICULTURE","Fiber Crops","Cotton (Kapas)","	Plant Protection	","ask for  larva problem /iyal","suggest:quinalphose 30 ml per pump and to sprey","GUJARAT","VADODARA","DABHOI                                            ","2014-09-25 08:39:04.990"
"KHARIF","HORTICULTURE","Fruits","Banana","Agriculture Mechanization","ask for banana fertilize dose information","suggest: apply 200:100:200 npk gram/plant","GUJARAT","VADODARA","SHINOR                                            ","2014-09-25 08:54:28.953"
"KHARIF","AGRICULTURE","Others","Others","Government Schemes","ask for government schem","suggest:contect to district agricultur officer","GUJARAT","VADODARA","VADODARA(CITY AND RURAL)                          ","2014-09-25 08:57:19.863"
"KHARIF","AGRICULTURE","Fiber Crops","Cotton (Kapas)","	Plant Protection	","ask for cotton flowering information","i suggested to sprey boom flower 30 ml/pump","GUJARAT","VADODARA","VADODARA(CITY AND RURAL)                          ","2014-09-25 10:32:18.590"
"KHARIF","AGRICULTURE","Fiber Crops","Cotton (Kapas)","Agriculture Mechanization","ask for cotton thrips  information","suggest:prophenophose 25 ml/pump sprey","GUJARAT","VADODARA","SHINOR                                            ","2014-09-25 12:14:52.777"
"KHARIF","AGRICULTURE","Cereals","Paddy (Dhan)","	Plant Protection	","ask for paddy yellowing leaf control","i suggested to give fertilizer","GUJARAT","VADODARA","SAVLI                                             ","2014-09-25 12:36:04.370"
"KHARIF","AGRICULTURE","Oilseeds","Castor (Rehri, Rendi, Arandi) ","Agriculture Mechanization","ask for castor varity information","suggest:g.c.h-2,3,4,5,6,7 good varity for castor","GUJARAT","VADODARA","CHHOTA UDEPUR                                     ","2014-09-25 15:26:53.057"
"KHARIF","AGRICULTURE","Others","Others","Government Schemes","ask for govt. scheme information","i suggested to contact dao","GUJARAT","VADODARA","KARJAN                                            ","2014-09-25 16:33:49.990"
"KHARIF","AGRICULTURE","Fiber Crops","Cotton (Kapas)","	Plant Protection	","ask for cotton sucking pest control","i suggested to sprey acetamiprid 5 gm/pump","GUJARAT","VADODARA","VADODARA(CITY AND RURAL)                          ","2014-09-25 16:43:07.433"
"KHARIF","AGRICULTURE","Fiber Crops","Cotton (Kapas)","	Plant Protection	","ask for market price","give number : 1800 102 8767 for market rate","GUJARAT","VADODARA","SHINOR                                            ","2014-09-25 19:54:32.780"
"KHARIF","AGRICULTURE","Fiber Crops","Cotton (Kapas)","	Plant Protection	","ask for cotton fertilizer doz","sugg to uriya 15 kg/vigha","GUJARAT","VADODARA","PADRA                                             ","2014-09-26 08:59:51.990"
"KHARIF","AGRICULTURE","Others","Others","	Field Preparation	","ask about root wilt","suggetsed mencozeb 35 gm per pump","GUJARAT","VADODARA","SHINOR                                            ","2014-09-26 10:50:30.950"
"KHARIF","AGRICULTURE","Fiber Crops","Cotton (Kapas)","	Plant Protection	","ASK FOR COTTON REACTION FOR SPRAY WEEDICIDE ON COTTON.","I SUGGESTED TO SPRAY UREA 100 GRAM/PUMP.","GUJARAT","VADODARA","WAGHODIA                                          ","2014-09-26 14:41:46.097"
"KHARIF","HORTICULTURE","Vegetables","Sponge Gourd","Agriculture Mechanization","ask for sponge gourd growth information","sugegst: no any spray for growth","GUJARAT","VADODARA","VADODARA(CITY AND RURAL)                          ","2014-09-26 19:24:13.150"
"KHARIF","AGRICULTURE","Sugar and Starch Crops","Sugarcane (Noble Cane)","	Plant Protection	","Ask for pig problem.","i suggested to visit agro.-center.","GUJARAT","VADODARA","KARJAN                                            ","2014-09-26 19:54:43.620"
"KHARIF","AGRICULTURE","Fiber Crops","Cotton (Kapas)","	Plant Protection	","Ask for plant protection","Traizophos 20 ml / 10 lit water","GUJARAT","VADODARA","DABHOI                                            ","2014-09-27 08:08:33.637"
"JAYAD","AGRICULTURE","Fiber Crops","Cotton (Kapas)","	Plant Protection	","ask for cotton jasside","spray imidaclopride 5 ml / 10 lit water","GUJARAT","VADODARA","KAWANT                                            ","2014-09-27 09:36:41.797"
"KHARIF","AGRICULTURE","Fiber Crops","Cotton (Kapas)","	Plant Protection	","ASK ABOUT SUCKING PEST","Traizophos 30 ml / 10 lit water","GUJARAT","VADODARA","JETPUR PAVI                                       ","2014-09-27 10:26:14.157"
"KHARIF","AGRICULTURE","Others","Others","Market Information","ask abt reaction in cotton crop ?","sugggested spray urea 100 gm/pump.","GUJARAT","VADODARA","JETPUR PAVI                                       ","2014-09-27 10:28:20.817"
"KHARIF","AGRICULTURE","Fiber Crops","Cotton (Kapas)","	Plant Protection	","ask for cotton heliothish","quinalphos 30 ml.per pump and to spray.","GUJARAT","VADODARA","PADRA                                             ","2014-09-27 11:00:44.530"
"KHARIF","AGRICULTURE","Others","Others","Weather","ask for weather information","i suggested no rainfall","GUJARAT","VADODARA","SHINOR                                            ","2014-09-27 11:04:07.723"
"KHARIF","AGRICULTURE","Fiber Crops","Cotton (Kapas)","Weather","Ask for weather information.","There are no chances of rainfall during next five days.","GUJARAT","VADODARA","NASWADI                                           ","2014-09-27 14:24:18.220"
"KHARIF","AGRICULTURE","Fiber Crops","Cotton (Kapas)","Agriculture Mechanization","ask for cotton fertilizers dose information","suggest: in cotton give urea with irrigation","GUJARAT","VADODARA","CHHOTA UDEPUR                                     ","2014-09-27 15:00:13.230"
"KHARIF","AGRICULTURE","Fiber Crops","Cotton (Kapas)","	Plant Protection	","Ask for plant protection","mithayl-o-demeton 10 ml. per pump and to spray.","GUJARAT","VADODARA","DABHOI                                            ","2014-09-27 15:37:00.447"
"KHARIF","AGRICULTURE","Fiber Crops","Cotton (Kapas)","	Plant Protection	","ask for cotton jasside","sugg to fipronil 30 ml/pamp spre","GUJARAT","VADODARA","DABHOI                                            ","2014-09-27 15:58:06.567"
"KHARIF","AGRICULTURE","Others","Others","	Plant Protection	","ask for sucking pest control information","suggest:dia methote 10 ml/ 10 lit. water","GUJARAT","VADODARA","PADRA                                             ","2014-09-27 16:02:37.900"
"KHARIF","AGRICULTURE","Cereals","Paddy (Dhan)","	Plant Protection	","ask for paddy wilt","carbendezim 15 gm / 10 lit water","GUJARAT","VADODARA","DABHOI                                            ","2014-09-27 16:44:45.867"
"KHARIF","AGRICULTURE","Fiber Crops","Cotton (Kapas)","	Plant Protection	","Ask for cotton fungus.","I suggested to spray mancozeb 35 gram/pump.","GUJARAT","VADODARA","JETPUR PAVI                                       ","2014-09-27 18:18:05.513"
"KHARIF","AGRICULTURE","Fiber Crops","Cotton (Kapas)","	Plant Protection	","ask abt sucking pest","Dimethoate 10 ml / 10 lit water","GUJARAT","VADODARA","DABHOI                                            ","2014-09-27 20:12:38.647"
"KHARIF","AGRICULTURE","Fodder Crops","Guar","	Plant Protection	","ask abt heliothis","i suggested cyper methrin 25 ml / pamp","GUJARAT","VADODARA","JETPUR PAVI                                       ","2014-09-28 09:25:17.047"
"KHARIF","HORTICULTURE","Vegetables","Tomato","Agriculture Mechanization","ask for tomato sowing time information","sugegst: sowing time is oct-nov","GUJARAT","VADODARA","SAVLI                                             ","2014-09-28 09:36:57.070"
"KHARIF","AGRICULTURE","Oilseeds","Castor (Rehri, Rendi, Arandi) ","	Plant Protection	","ask about ver in castor","Gch 2, 4, 5, 7","GUJARAT","VADODARA","DABHOI                                            ","2014-09-28 10:31:23.187"
"KHARIF","AGRICULTURE","Others","Others","Government Schemes","Ask for the govt schme","rotavator subcidi.  50 % or 30000 which is less get by subcidi.","GUJARAT","VADODARA","KAWANT                                            ","2014-09-28 11:13:43.180"
"KHARIF","AGRICULTURE","Oilseeds","Castor (Rehri, Rendi, Arandi) ","	Field Preparation	","ask about ver in castor","Gch 2, 4, 5, 7","GUJARAT","VADODARA","KARJAN                                            ","2014-09-28 12:37:47.027"
"KHARIF","AGRICULTURE","Pulses","Green Gram (Moong Bean/ Moong)","	Plant Protection	","ask for sowing time information","suggest:octo-nov for it","GUJARAT","VADODARA","SAVLI                                             ","2014-09-28 12:41:01.520"
"KHARIF","AGRICULTURE","Oilseeds","Castor (Rehri, Rendi, Arandi) ","	Plant Protection	","ask control of weed","not use weedicide.","GUJARAT","VADODARA","SHINOR                                            ","2014-09-28 12:57:31.513"
"KHARIF","AGRICULTURE","Others","Others","Market Information","ask about merket rate","call 1800 102 8767","GUJARAT","VADODARA","CHHOTA UDEPUR                                     ","2014-09-28 15:20:42.427"
"KHARIF","AGRICULTURE","Others","Others","	Plant Protection	","ask about research related","i suggest to visit aau,anand.","GUJARAT","VADODARA","PADRA                                             ","2014-09-29 09:04:59.457"
"KHARIF","HORTICULTURE","Condiments and Spices","Fenugreek","	Plant Protection	","ask for termite control information","suggest:chloropyriphose 25 ml/pump","GUJARAT","VADODARA","VADODARA(CITY AND RURAL)                          ","2014-09-29 09:34:00.840"
"KHARIF","AGRICULTURE","Sugar and Starch Crops","Sugarcane (Noble Cane)","Agriculture Mechanization","ask for sugarcane sowing time information","suggest: sowing time is oktober-december","GUJARAT","VADODARA","KARJAN                                            ","2014-09-29 09:38:09.417"
"KHARIF","AGRICULTURE","Oilseeds","Sesame (Gingelly/Til)/Sesamum","	Field Preparation	","ask abt sesamum var.?","suggested purva tal-1 in winter .","GUJARAT","VADODARA","DABHOI                                            ","2014-09-29 09:45:28.257"
"KHARIF","AGRICULTURE","Others","Others","	Field Preparation	","ask about weather","suggestedb 18001801717","GUJARAT","VADODARA","PADRA                                             ","2014-09-29 10:09:59.217"
"KHARIF","AGRICULTURE","Others","Others","Weather","ask about weather","I suggested to cloudy sky","GUJARAT","VADODARA","VADODARA(CITY AND RURAL)                          ","2014-09-29 10:43:21.070"
"KHARIF","AGRICULTURE","Fiber Crops","Cotton (Kapas)","	Plant Protection	","ask for cotton jasside","spray imidaclopride 5 ml / 10 lit water
suggested thiomithoxime 6 gram per pump","GUJARAT","VADODARA","SHINOR                                            ","2014-09-29 11:00:40.030"
"KHARIF","HORTICULTURE","Vegetables","Chillies","	Plant Protection	","ask for sucking pest control information","suggest:dia methote 10 ml/ 10 lit. water","GUJARAT","VADODARA","NASWADI                                           ","2014-09-29 11:33:25.070"
"KHARIF","AGRICULTURE","Fiber Crops","Cotton (Kapas)","	Plant Protection	","ask about sucking pest in coton","Traizophos 20 ml / 10 lit water","GUJARAT","VADODARA","DABHOI                                            ","2014-09-29 13:13:25.177"
"KHARIF","AGRICULTURE","Fiber Crops","Cotton (Kapas)","	Plant Protection	","ASK ABOUT SUCKING PEST IN COTTON","I SUGGESTED TO SPRAY DIMETHOAT 15 ML/PUMP FOR CONTROL SUCKING PEST IN COTTON","GUJARAT","VADODARA","KAWANT                                            ","2014-09-29 13:14:22.237"
"KHARIF","AGRICULTURE","Others","Others","Government Schemes","ask for govt. scheme information","i sauggested to contact dao","GUJARAT","VADODARA","DABHOI                                            ","2014-09-29 14:21:39.910"
"KHARIF","AGRICULTURE","Others","Others","Weather","ask for rainfall information","sugg to no rainfall","GUJARAT","VADODARA","KARJAN                                            ","2014-09-29 15:38:13.817"
"KHARIF","AGRICULTURE","Fiber Crops","Cotton (Kapas)","	Plant Protection	","ask for cotton angular disease control","suggest:streptocyclin 6 gm+blue coper 50 gm/100 lit water","GUJARAT","VADODARA","SHINOR                                            ","2014-09-29 15:38:30.170"
"KHARIF","AGRICULTURE","Fiber Crops","Cotton (Kapas)","	Plant Protection	","ask for cotton mealybug control","i suggested to sprey prophenophos 30 ml/pump","GUJARAT","VADODARA","PADRA                                             ","2014-09-29 20:00:26.457"
"KHARIF","AGRICULTURE","Fiber Crops","Cotton (Kapas)","	Plant Protection	","ask for cotton mealybug control","i suggested to sprey prophenophos 30 ml/pump","GUJARAT","VADODARA","PADRA                                             ","2014-09-29 20:02:23.903"
"KHARIF","AGRICULTURE","Others","Others","Market Information","ask  for marke rate","suggested 18001028767","GUJARAT","VADODARA","VADODARA(CITY AND RURAL)                          ","2014-09-30 10:36:53.003"
"KHARIF","AGRICULTURE","Others","Others","	Plant Protection	","Ask for market rate","call on 1800 102 8767 for market price","GUJARAT","VADODARA","KARJAN                                            ","2014-09-30 11:40:02.467"
"KHARIF","HORTICULTURE","Condiments and Spices","Fenugreek","Cultural Practices","ask for fenugreek variety information","i suggested gujarat methi -1","GUJARAT","VADODARA","VADODARA(CITY AND RURAL)                          ","2014-09-30 11:44:21.553"
"KHARIF","AGRICULTURE","Oilseeds","Castor (Rehri, Rendi, Arandi) ","	Plant Protection	","ask for castor seed tritment","sugg to thiram 3 gm /1 kg seed","GUJARAT","VADODARA","SANKHEDA                                          ","2014-09-30 12:04:19.550"
"KHARIF","HORTICULTURE","Drug and Narcotics","Tobacco","	Plant Protection	","ask abt larva
in tobacco","quinalphos 30 ml.per pump and to spray.","GUJARAT","VADODARA","VADODARA(CITY AND RURAL)                          ","2014-09-30 12:33:18.600"
"KHARIF","AGRICULTURE","Millets","Maize (Makka)","Agriculture Mechanization","ask for maize fertilizer dose information","suggest: in maize apply 100:50:00 npk kg/ha","GUJARAT","VADODARA","","2014-09-30 16:21:11.713"
"KHARIF","HORTICULTURE","Condiments and Spices","Fenugreek","	Plant Protection	","Ask for fenugreek sowingtime information.","fenugreek sowingtime :september to november month.","GUJARAT","VADODARA","VADODARA(CITY AND RURAL)                          ","2014-09-30 17:14:25.727"
"KHARIF","AGRICULTURE","Fiber Crops","Cotton (Kapas)","	Plant Protection	","Ask for cotton fungus problem.","i suggested to spray mancozeb 35 gram/pump.","GUJARAT","VADODARA","SAVLI                                             ","2014-09-30 17:33:00.183"
"KHARIF","AGRICULTURE","Pulses","Bengal Gram (Gram/Chick Pea/Kabuli/Chana)","Agriculture Mechanization","ask for gram sowing time information","suggest: sowing time is oct-nov.","GUJARAT","VADODARA","VADODARA(CITY AND RURAL)                          ","2014-09-30 17:58:10.380"
"KHARIF","AGRICULTURE","Oilseeds","Sesame (Gingelly/Til)/Sesamum","	Field Preparation	","ask about sowing time of sesame","i suggested 15 Aug- 15 Sep","GUJARAT","VADODARA","SAVLI                                             ","2014-09-30 18:41:11.400"
