"Season","Sector","Category","Crop","QueryType","QueryText","KCCAns","StateName","DistrictName","BlockName","CreatedOn"
"JAYAD","HORTICULTURE","Vegetables","Pumpkin","	Plant Protection	","fruit fly in pumpkin","spray malathion 1.5 ml / lit of water","TAMILNADU","ARIYALUR","T. PALUR                                          ","2014-08-01 06:50:07.000"
"JAYAD","AGRICULTURE","Millets","Maize (Makka)","Fertilizer Use and Availability","maize top fertilizer management","apply urea 30 kg / 1 acre after 60 days","TAMILNADU","ARIYALUR","T. PALUR                                          ","2014-08-01 07:41:58.000"
"JAYAD","HORTICULTURE","Vegetables","Chillies","Soil Testing","Season for onion","Sow the medium sized bulbs during April – May and October – November","TAMILNADU","ARIYALUR","T. PALUR                                          ","2014-08-01 07:56:45.000"
"JAYAD","HORTICULTURE","Flowers","Marigold","Field Preparation","MARIGOLD Varieties","Local types (orange & yellow), Pusa Narangi Gainda, Pusa Basanthi Gainda (IARI varieties) and MDU 1 can be cultivated.","TAMILNADU","ARIYALUR","JAYAMKONDAM                                       ","2014-08-01 08:10:18.000"
"JAYAD","AGRICULTURE","Cereals","Paddy (Dhan)","Fertilizer Use and Availability","top dressing in paddy","apply urea 25 kg + potash 15 kg + neem cake 5 kg/ac","TAMILNADU","ARIYALUR","ANDIMADAM                                         ","2014-08-01 09:22:56.000"
"JAYAD","AGRICULTURE","Cereals","Paddy (Dhan)","	Plant Protection	","zinc defeciency in paddy","apply zinc sulphate 5kg/ac","TAMILNADU","ARIYALUR","THIRUMANUR                                        ","2014-08-01 09:47:44.000"
"JAYAD","AGRICULTURE","Sugar and Starch Crops","Sugarcane (Noble Cane)","	Plant Protection	","Early shoot borer IN sugarcane","spray Fipronil 2ml/lit of water","TAMILNADU","ARIYALUR","THIRUMANUR                                        ","2014-08-01 09:59:07.000"
"JAYAD","HORTICULTURE","Vegetables","Curry Leaf","Field Preparation","CURRY LEAF Preparation of field","The field is ploughed 3-4 times to get a fine tilth. Before last ploughing well decomposed FYM is applied @ 20 t/ha. Pit size of 30 x30x30 cm is dug one to two months before planting at a spacing of 1.2 to 1.5 m.","TAMILNADU","ARIYALUR","ARIYALUR                                          ","2014-08-01 10:03:57.000"
"JAYAD","AGRICULTURE","Others","Others","Agriculture Mechanization","asking about solar power subsidy","Executive Engineer (AE),Jeyangondam Road,Ariyalur - 621 704 Phone - 04329 220 945","TAMILNADU","ARIYALUR","T. PALUR                                          ","2014-08-01 10:21:48.000"
"JAYAD","HORTICULTURE","Vegetables","Onion","	Plant Protection	","top shoot borer in brinjal","spray quinolphos 2ml+neemoil 3ml+teepol 1ml/lit of water","TAMILNADU","ARIYALUR","T. PALUR                                          ","2014-08-01 10:59:46.000"
"JAYAD","AGRICULTURE","Cereals","Paddy (Dhan)","	Plant Protection	","Mealybug in paddy","Spraying of Dimethoate 2ml/lit of water","TAMILNADU","ARIYALUR","JAYAMKONDAM                                       ","2014-08-01 11:41:01.000"
"JAYAD","AGRICULTURE","Millets","Maize (Makka)","Market Information","market rate for maize","Kallakurichi Other 1299	- 1431 Rs/Quintal","TAMILNADU","ARIYALUR","T. PALUR                                          ","2014-08-01 12:11:03.000"
"JAYAD","AGRICULTURE","Cereals","Paddy (Dhan)","Fertilizer Use and Availability","top dressing for paddy","apply urea 25 kg + potash 15 kg + neem cake 5 kg+MN mixer 5kg/ac","TAMILNADU","ARIYALUR","T. PALUR                                          ","2014-08-01 12:42:40.000"
"JAYAD","HORTICULTURE","Vegetables","Drum Stick","	Plant Protection	","flower shed in moringa","spray palnofix 5 ml /10 lit of water","TAMILNADU","ARIYALUR","JAYAMKONDAM                                       ","2014-08-01 12:57:30.000"
"JAYAD","AGRICULTURE","Oilseeds","Groundnut (pea nut/mung phalli)","Fertilizer Use and Availability","groundnut top dressing","apply gypsum 80 kg/ac","TAMILNADU","ARIYALUR","JAYAMKONDAM                                       ","2014-08-01 13:18:16.000"
"JAYAD","AGRICULTURE","Others","Others","Weather","weather detial for ariyalur dist","date from 2 to 6 no rain","TAMILNADU","ARIYALUR","T. PALUR                                          ","2014-08-01 13:21:58.000"
"JAYAD","HORTICULTURE","Vegetables","Drum Stick","	Plant Protection	","pod fly in moringa","Spray dichlorvos 2 ml/lit of water","TAMILNADU","ARIYALUR","T. PALUR                                          ","2014-08-01 14:20:26.000"
"JAYAD","AGRICULTURE","Oilseeds","Groundnut (pea nut/mung phalli)","Fertilizer Use and Availability","top dressing for groundnut","foliar spray groundnutrich 2.5kg/ac","TAMILNADU","ARIYALUR","JAYAMKONDAM                                       ","2014-08-01 14:24:32.000"
"JAYAD","HORTICULTURE","Plantation Crops","Sandal Wood","	Plant Protection	","root rot in sandal wood","drench with copper oxy chloride 2gm/liter of water","TAMILNADU","ARIYALUR","ARIYALUR                                          ","2014-08-01 14:44:29.000"
"JAYAD","HORTICULTURE","Vegetables","Onion","Fertilizer Use and Availability","leaf blight in  onion","spray SAAF 2gm/lit of water","TAMILNADU","ARIYALUR","THIRUMANUR                                        ","2014-08-01 16:16:00.000"
"JAYAD","AGRICULTURE","Oilseeds","Sesame (Gingelly/Til)/Sesamum","Market Information","market rate for sesame","recommented for Kallakurichi market:6711-10299/quintal","TAMILNADU","ARIYALUR","SENDURAI                                          ","2014-08-01 17:02:07.000"
"JAYAD","AGRICULTURE","Oilseeds","Groundnut (pea nut/mung phalli)","Market Information","market price of ground nut","recommended for groundnut market price 5500-5800Rs/quintal","TAMILNADU","ARIYALUR","JAYAMKONDAM                                       ","2014-08-01 17:28:27.000"
"JAYAD","HORTICULTURE","Vegetables","Brinjal","	Plant Protection	","Red Spider mite in brinjal","recommended for spray dicofol 2ml/lit of water","TAMILNADU","ARIYALUR","ANDIMADAM                                         ","2014-08-01 18:37:09.000"
"JAYAD","AGRICULTURE","Millets","Maize (Makka)","Nutrient Management","zinc Deficiency Symptoms in maize","recommended for Spray zinc sulphate 2.5 gm+ferrous sulphate 2.5 /lit of water","TAMILNADU","ARIYALUR","T. PALUR                                          ","2014-08-01 18:40:59.000"
"JAYAD","AGRICULTURE","Oilseeds","Groundnut (pea nut/mung phalli)","Fertilizer Use and Availability","groundnut top dressing fertilizer management","recommended for top dressing of groundnut apply zypsum 150kg / ac","TAMILNADU","ARIYALUR","JAYAMKONDAM                                       ","2014-08-01 20:25:51.000"
"JAYAD","AGRICULTURE","Oilseeds","Sunflower (suryamukhi)","Fertilizer Use and Availability","Basal fertilizer management for sunflower","recommended for Basal fertilizer management for sunflower  apply urea 25 kg + superphosphate 150 kg+potash 26 kg/ac","TAMILNADU","ARIYALUR","ARIYALUR                                          ","2014-08-01 21:09:25.000"
"JAYAD","AGRICULTURE","Oilseeds","Groundnut (pea nut/mung phalli)","	Plant Protection	","Early leaf spot in groundnut","recommended for groundnut early spot Spray (mancozeb + carbendazim) SAAF 2 gm / lit of water","TAMILNADU","ARIYALUR","JAYAMKONDAM                                       ","2014-08-02 09:02:26.000"
"JAYAD","HORTICULTURE","Vegetables","Bitter Gourd","	Plant Protection	","mosaic virus bitter gourd","recommended mosaic virus bitter gourd spray dimethoate 2ml+neem oil 3ml+teepol 1ml/lit of water","TAMILNADU","ARIYALUR","JAYAMKONDAM                                       ","2014-08-02 10:11:34.000"
"JAYAD","HORTICULTURE","Vegetables","Drum Stick","Nutrient Management","Drum stick flower dropping","recommended for Drum stick flower dropping Spray palnofix 2ml/tank","TAMILNADU","ARIYALUR","JAYAMKONDAM                                       ","2014-08-02 11:50:45.000"
"JAYAD","AGRICULTURE","Fiber Crops","Cotton (Kapas)","Fertilizer Use and Availability","top dressing for cotton","recommended for Apply Urea 48 kg  + potash 20 kg/ac","TAMILNADU","ARIYALUR","THIRUMANUR                                        ","2014-08-02 11:51:43.000"
"JAYAD","AGRICULTURE","Millets","Maize (Makka)","Fertilizer Use and Availability","Top dressing fertilizer management for maize","recommended Top dressing fertilizer management for maize  apply urea 25 kg + potash 30 kg kg/ac","TAMILNADU","ARIYALUR","T. PALUR                                          ","2014-08-02 13:08:33.000"
"JAYAD","AGRICULTURE","Oilseeds","Sesame (Gingelly/Til)/Sesamum","Market Information","season for sesamum","recomemded season for sesamum Adippattam July-Aug CO 1, TMV 3,TMV 7","TAMILNADU","ARIYALUR","SENDURAI                                          ","2014-08-02 13:52:16.000"
"","","","","","","","TAMILNADU","ARIYALUR","JAYAMKONDAM                                       ","2014-08-02 15:01:06.000"
"JAYAD","AGRICULTURE","Millets","Maize (Makka)","Nutrient Management","maize top fertilizer management","recommended for apply urea 30 kg / 1 acre after 60 days","TAMILNADU","ARIYALUR","ARIYALUR                                          ","2014-08-02 15:30:13.000"
"JAYAD","AGRICULTURE","Cereals","Paddy (Dhan)","	Plant Protection	","root nematode in paddy","recommended for applay carbofuran 5kg/acr","TAMILNADU","ARIYALUR","THIRUMANUR                                        ","2014-08-02 16:18:14.000"
"JAYAD","AGRICULTURE","Sugar and Starch Crops","Sugarcane (Noble Cane)","Fertilizer Use and Availability","sugarcane top dressing fertilizer management","Recommended for apply urea 80 kg + potash 25 kg / ac","TAMILNADU","ARIYALUR","THIRUMANUR                                        ","2014-08-02 17:37:07.000"
"JAYAD","HORTICULTURE","Vegetables","Bitter Gourd","	Plant Protection	","nematode in bitter gourd","Recommended for apply carbofuran 3 - 5kg / ac","TAMILNADU","ARIYALUR","SENDURAI                                          ","2014-08-02 19:32:11.000"
"JAYAD","HORTICULTURE","Vegetables","Onion","Fertilizer Use and Availability","Onion basal fertilizer management details","recommended for Apply urea 12 kg, super phosphate- 150 kg, potash 19.5kg/ acre","TAMILNADU","ARIYALUR","JAYAMKONDAM                                       ","2014-08-02 19:46:52.000"
"JAYAD","HORTICULTURE","Vegetables","Drum Stick","","Flower drop in drum stick","recommended for spray planofix 5ml/10 lit of water","TAMILNADU","ARIYALUR","JAYAMKONDAM                                       ","2014-08-02 20:05:36.000"
"JAYAD","AGRICULTURE","Others","Others","	Plant Protection	","weed management in waste land","recommended for spray roundup 3 ml / 1 litre of water","TAMILNADU","ARIYALUR","ARIYALUR                                          ","2014-08-02 21:31:12.000"
"JAYAD","AGRICULTURE","Millets","Maize (Makka)","Fertilizer Use and Availability","TNAU MAIZE MAXIM application","recommmended TNAU MAIZE MAXIM application  Foliar spray for TNAU MAIZE MAXIM 2.5 kg/ac","TAMILNADU","ARIYALUR","ANDIMADAM                                         ","2014-08-03 07:14:24.000"
"JAYAD","AGRICULTURE","Millets","Maize (Makka)","Nutrient Management","maize top fertilizer management","recommended for apply urea 30 kg / 1 acre after 60 days","TAMILNADU","ARIYALUR","JAYAMKONDAM                                       ","2014-08-03 07:20:52.000"
"JAYAD","AGRICULTURE","Cereals","Paddy (Dhan)","Fertilizer Use and Availability","Foliar nutrition for paddy","recommended Foliar nutrition for paddy spray urea 10gm +DAP 20gm + potassium chloride 10 gm /lit of water","TAMILNADU","ARIYALUR","ARIYALUR                                          ","2014-08-03 08:05:10.000"
"JAYAD","AGRICULTURE","Sugar and Starch Crops","Sugarcane (Noble Cane)","Fertilizer Use and Availability","sugarcane top dressing fertilizer management","Recommended apply urea 80 kg + potash 25 kg / ac","TAMILNADU","ARIYALUR","SENDURAI                                          ","2014-08-03 11:25:34.000"
"JAYAD","AGRICULTURE","Sugar and Starch Crops","Sugarcane (Noble Cane)","Fertilizer Use and Availability","sugarcane fertilizer management","Recommended for apply magnesium sulphate 5 kg / ac","TAMILNADU","ARIYALUR","THIRUMANUR                                        ","2014-08-03 14:49:32.000"
"JAYAD","AGRICULTURE","Cereals","Paddy (Dhan)","	Plant Protection	","stem borer in paddy","recommended for spray profenophos 2ml+neemoil 3ml+teepol 1ml/lit of water","TAMILNADU","ARIYALUR","THIRUMANUR                                        ","2014-08-03 14:50:51.000"
"JAYAD","AGRICULTURE","Others","Others","Market Information","market rate sms","registered","TAMILNADU","ARIYALUR","JAYAMKONDAM                                       ","2014-08-03 15:47:34.000"
"JAYAD","AGRICULTURE","Cereals","Paddy (Dhan)","Nutrient Management","paddy basal fertilizer management","Recommended for apply DAP 50 kg + zinc sulphate 10 kg + neem cake 10kg + FYM 10ton /ac","TAMILNADU","ARIYALUR","JAYAMKONDAM                                       ","2014-08-03 15:47:37.000"
"JAYAD","HORTICULTURE","Vegetables","Bitter Gourd","Fertilizer Use and Availability","foliar spray in bitter gourd","foliar spray for 19:19:19 50 gm/tank","TAMILNADU","ARIYALUR","ARIYALUR                                          ","2014-08-03 16:26:50.000"
"JAYAD","AGRICULTURE","Cereals","Paddy (Dhan)","	Plant Protection	","paddy stem borer","spray cartap hydrochloride 2g/lit.","TAMILNADU","ARIYALUR","JAYAMKONDAM                                       ","2014-08-03 16:31:22.000"
"JAYAD","HORTICULTURE","Vegetables","Brinjal","	Plant Protection	","fruit borer in brinjal","recommended for spray emamectin benzoate 5 giram/10 lit.","TAMILNADU","ARIYALUR","T. PALUR                                          ","2014-08-03 17:17:20.000"
"JAYAD","HORTICULTURE","Vegetables","Onion","Cultural Practices","sowing in season onion	season","Recommended for sowing season in onion April – May,October – November.","TAMILNADU","ARIYALUR","ARIYALUR                                          ","2014-08-03 18:14:27.000"
"JAYAD","AGRICULTURE","Cereals","Paddy (Dhan)","	Plant Protection	","stemborer in paddy","recommended for spray cartap hydrochloride 2g/lit.","TAMILNADU","ARIYALUR","ANDIMADAM                                         ","2014-08-03 19:09:00.000"
"JAYAD","AGRICULTURE","Others","Others","Credit","Message need my mobile","recommended for as your request we are activated","TAMILNADU","ARIYALUR","SENDURAI                                          ","2014-08-03 19:25:53.000"
"JAYAD","AGRICULTURE","Fiber Crops","Cotton (Kapas)","	Field Preparation	","cotton sowing season and vareity","Recommended for cotton sowing season : August - September and vareity : LRA 5166, SVPR 2, SVPR 4, Surabhi,","TAMILNADU","ARIYALUR","T. PALUR                                          ","2014-08-03 20:24:55.000"
"JAYAD","AGRICULTURE","Millets","Maize (Makka)","Nutrient Management","maize booster application","recommended for apply 3 kg maize maxim/acre","TAMILNADU","ARIYALUR","T. PALUR                                          ","2014-08-03 20:28:09.000"
"JAYAD","AGRICULTURE","Sugar and Starch Crops","Sugarcane (Noble Cane)","	Plant Protection	","sugarcane shoot borer","Early shoot borer: recommended for apply Carbofuran 3CG 5 kg acre","TAMILNADU","ARIYALUR","SENDURAI                                          ","2014-08-04 08:54:51.000"
"JAYAD","AGRICULTURE","Cereals","Paddy (Dhan)","	Plant Protection	","stem borer in paddy","recommended for  spray spray chlorpyrifos 2ml+neem oil +teepol 1ml/lit of water","TAMILNADU","ARIYALUR","JAYAMKONDAM                                       ","2014-08-04 09:32:38.000"
"JAYAD","AGRICULTURE","Sugar and Starch Crops","Sugarcane (Noble Cane)","	Plant Protection	","stem borer in sugarcane","recommended stem borer in sugarcane spray monocrotophos 2 ml / lit + achephate 2 gm /ac","TAMILNADU","ARIYALUR","ARIYALUR                                          ","2014-08-04 10:11:50.000"
"JAYAD","HORTICULTURE","Vegetables","Ash Gourd (Petha)","Nutrient Management","ash gourd foliar spray","spray water soluble fertilizer 19-19-19 5 gm /lit of water","TAMILNADU","ARIYALUR","THIRUMANUR                                        ","2014-08-04 11:03:55.000"
"JAYAD","AGRICULTURE","Cereals","Paddy (Dhan)","	Plant Protection	","paddy stem borer","recommended for paddy stem borer spray monocrotophos 2ml / lit of water","TAMILNADU","ARIYALUR","JAYAMKONDAM                                       ","2014-08-04 11:29:39.000"
"JAYAD","AGRICULTURE","Millets","Maize (Makka)","Fertilizer Use and Availability","Basal ferilizer management for maize","recommended Basal ferilizer management for maize Apply urea 30 kg + super phosphate 150 kg + potash 30 kg /ac","TAMILNADU","ARIYALUR","JAYAMKONDAM                                       ","2014-08-04 12:00:28.000"
"JAYAD","AGRICULTURE","Others","Others","Government Schemes","Regional Research Station contac number for vridhachalam","Recommended Regional Research Station contac number for :04143-238231,9486261672","TAMILNADU","ARIYALUR","SENDURAI                                          ","2014-08-04 12:03:43.000"
"JAYAD","AGRICULTURE","Others","Others","Government Schemes","Regional Research Station contac number for vridhachalam","Recommended Regional Research Station contac number for :04143-238231,9486261672","TAMILNADU","ARIYALUR","ANDIMADAM                                         ","2014-08-04 12:06:17.000"
"JAYAD","AGRICULTURE","Others","Others","Government Schemes","block level agri department contact number","recommended for contact number 04143-238749","TAMILNADU","ARIYALUR","ANDIMADAM                                         ","2014-08-04 12:09:15.000"
"JAYAD","AGRICULTURE","Millets","Maize (Makka)","Market Information","Basal ferilizer management for maize","recommended Basal ferilizer management for maize Apply urea 30 kg + super phosphate 150 kg + potash 30 kg /ac","TAMILNADU","ARIYALUR","JAYAMKONDAM                                       ","2014-08-04 12:15:59.000"
"JAYAD","AGRICULTURE","Cereals","Paddy (Dhan)","Nutrient Management","paddy top fertilizer management","apply ammonium sulfate 30 kilo / acre","TAMILNADU","ARIYALUR","JAYAMKONDAM                                       ","2014-08-04 12:54:09.000"
"JAYAD","AGRICULTURE","Millets","Maize (Makka)","Seeds","hybrid of Maize crops","recommended for hybrid of Maize is TNAU maize hybrid Co 6","TAMILNADU","ARIYALUR","JAYAMKONDAM                                       ","2014-08-04 13:59:46.000"
"JAYAD","AGRICULTURE","Others","Others","Weather","weather forecost","ariyalur district weather forecost report tody is not a rainy day","TAMILNADU","ARIYALUR","THIRUMANUR                                        ","2014-08-04 14:26:33.000"
"JAYAD","AGRICULTURE","Millets","Sorghum (Jowar/Great Millet)","Cultural Practices","varieties for sorghum","K Tall, CO (S) 28, TNAU SORGHUM variety CO 30, BSR 1","TAMILNADU","ARIYALUR","JAYAMKONDAM                                       ","2014-08-04 14:33:09.000"
"JAYAD","HORTICULTURE","Flowers","Marigold","Nutrient Management","celosiai foliar application details","Recommended for celosiai foliar spray 19:19:19 50gm / tank","TAMILNADU","ARIYALUR","ANDIMADAM                                         ","2014-08-04 18:19:25.000"
"JAYAD","HORTICULTURE","Vegetables","Drum Stick","	Plant Protection	","bud worm in moringa","recommended for spray chlorpyriphos 2ml/lit.","TAMILNADU","ARIYALUR","JAYAMKONDAM                                       ","2014-08-04 20:33:25.000"
"JAYAD","AGRICULTURE","Cereals","Paddy (Dhan)","Market Information","Paddy Co 43 market rate : 1292 - 1589 Rs./Quintal","Recommended for Paddy Co 43 market rate : 1292 - 1589 Rs./Quintal","TAMILNADU","ARIYALUR","THIRUMANUR                                        ","2014-08-04 20:35:36.000"
"JAYAD","AGRICULTURE","Cereals","Paddy (Dhan)","Seeds","paddy seed","recommended 0435-2472108 number to contact rrc, aduthurai.","TAMILNADU","ARIYALUR","THIRUMANUR                                        ","2014-08-04 21:21:15.000"
"JAYAD","AGRICULTURE","Cereals","Paddy (Dhan)","Seeds","paddy CR 1009 seeds availability details","Recommended Tamilnadu Rice Research Institute Aduthurai contact no. 0435 - 2472098, 0435 - 2472131.","TAMILNADU","ARIYALUR","THIRUMANUR                                        ","2014-08-04 21:29:32.000"
"JAYAD","AGRICULTURE","Fiber Crops","Cotton (Kapas)","	Field Preparation	","cotton sowing season and variety","cotton sowing season : August - september and variety : LRA 5166, SVPR 2, SVPR 4, Surabhi","TAMILNADU","ARIYALUR","JAYAMKONDAM                                       ","2014-08-04 21:36:23.000"
"JAYAD","AGRICULTURE","Oilseeds","Sesame (Gingelly/Til)/Sesamum","Market Information","sesame market rate","Recommended for sesame market rate : 6361 - 9866 Rs./Quintal","TAMILNADU","ARIYALUR","ARIYALUR                                          ","2014-08-04 21:40:33.000"
"JAYAD","HORTICULTURE","Vegetables","Drum Stick","Fertilizer Use and Availability","moringa fertilizer management","recommended for appaly Recommended for apply urea 45gm / plant","TAMILNADU","ARIYALUR","ANDIMADAM                                         ","2014-08-05 07:11:27.000"
"JAYAD","AGRICULTURE","Pulses","Black Gram (urd bean)","Seeds","seeds availability of blackgram","recommended 04322-296447 contact no for pulses research station","TAMILNADU","ARIYALUR","ARIYALUR                                          ","2014-08-05 08:43:23.000"
"JAYAD","HORTICULTURE","Vegetables","Brinjal","Fertilizer Use and Availability","shoot borer in brinjal","recommended for spray quinalphos 2 ml + neem oil 3 ml + wetting agent 1 ml / lit of water","TAMILNADU","ARIYALUR","ARIYALUR                                          ","2014-08-05 09:03:24.000"
"JAYAD","AGRICULTURE","Oilseeds","Groundnut (pea nut/mung phalli)","Fertilizer Use and Availability","foliyar spray in groundnut","spray groundnut rich 2kg/200 lit/ac","TAMILNADU","ARIYALUR","ARIYALUR                                          ","2014-08-05 09:34:34.000"
"JAYAD","HORTICULTURE","Vegetables","Watermelon","Market Information","watermelon market rate trichy","recommended watermelon market rate trichy rs 18 /kg","TAMILNADU","ARIYALUR","T. PALUR                                          ","2014-08-05 09:54:30.000"
"JAYAD","AGRICULTURE","Oilseeds","Sesame (Gingelly/Til)/Sesamum","Seeds","sowing season VARIETIES for sesamum","recommended for sesamum VARIETIES are CO 1, TMV 3,TMV 7","TAMILNADU","ARIYALUR","SENDURAI                                          ","2014-08-05 10:04:56.000"
"JAYAD","HORTICULTURE","Vegetables","Onion","	Plant Protection	","Leaf Blight in onion","recommended Leaf Blight in onion spray mancozeb +carbendazim (saaf) 2.5gm/lit of water","TAMILNADU","ARIYALUR","T. PALUR                                          ","2014-08-05 10:10:33.000"
"JAYAD","AGRICULTURE","Oilseeds","Sesame (Gingelly/Til)/Sesamum","Seeds","sowing season for sesamum","sowing season for sesamum oct-nov","TAMILNADU","ARIYALUR","SENDURAI                                          ","2014-08-05 11:12:33.000"
"JAYAD","AGRICULTURE","Oilseeds","Groundnut (pea nut/mung phalli)","Market Information","market price for groundnut","recommended for market price 5600-6000Rs/quintal","TAMILNADU","ARIYALUR","JAYAMKONDAM                                       ","2014-08-05 11:32:35.000"
"JAYAD","AGRICULTURE","Oilseeds","Sesame (Gingelly/Til)/Sesamum","Market Information","sesame market rate","recommended sesame market rate rs 7800-8000/quintal","TAMILNADU","ARIYALUR","JAYAMKONDAM                                       ","2014-08-05 11:39:04.000"
"JAYAD","HORTICULTURE","Flowers","Chrysanthemum","Cultural Practices","sowing season of chrysanthemum","recommended for sowing season of chrysanthemum  Planting during June - July at 30 x 30 cm spacing on one side of ridges  (1,11,000 plants/ha).","TAMILNADU","ARIYALUR","ANDIMADAM                                         ","2014-08-05 11:56:48.000"
"JAYAD","HORTICULTURE","Vegetables","Onion","	Plant Protection	","leaf Blight (Blast) onion","recommeded for spray carbendazim 2gm/lit","TAMILNADU","ARIYALUR","T. PALUR                                          ","2014-08-05 12:58:26.000"
"JAYAD","HORTICULTURE","Vegetables","Drum Stick","	Plant Protection	","flower drop in drum stick","recommended for spray Plano fix - 5 ml / 10 lit of water","TAMILNADU","ARIYALUR","ANDIMADAM                                         ","2014-08-05 13:32:50.000"
"JAYAD","AGRICULTURE","Cereals","Paddy (Dhan)","Nutrient Management","top dressing for paddy","recommended for apply urea 25 kg + potash 15 kg + neem cake 5 kg+MN mixer 5kg/ac","TAMILNADU","ARIYALUR","SENDURAI                                          ","2014-08-05 13:45:54.000"
"JAYAD","HORTICULTURE","Vegetables","Brinjal","Seeds and Planting Material","brinjal varieties","recommended for brinjal varieties Co 1, Co 2, MDU 1, PKM 1, PLR 1, KKM 1, PPI 1, Annamalai and COBH 1 (Hybrid)","TAMILNADU","ARIYALUR","THIRUMANUR                                        ","2014-08-05 15:22:03.000"
"JAYAD","HORTICULTURE","Vegetables","Onion","	Plant Protection	","thrips in onion","recommended spray for methyl dematan 2ml/lit of water","TAMILNADU","ARIYALUR","JAYAMKONDAM                                       ","2014-08-05 16:00:25.000"
"JAYAD","HORTICULTURE","Vegetables","Beans ","	Plant Protection	","Beans leaf spot","recommended for Beans leaf spot Spray wettable sulphur 3gm/lit","TAMILNADU","ARIYALUR","THIRUMANUR                                        ","2014-08-05 16:07:32.000"
"JAYAD","HORTICULTURE","Vegetables","Onion","	Plant Protection	","Leaf Blight in onion","spray mancozeb + carbendazim (saaf) 2.5gm/lit of water","TAMILNADU","ARIYALUR","T. PALUR                                          ","2014-08-05 16:34:06.000"
