"Season","Sector","Category","Crop","QueryType","QueryText","KCCAns","StateName","DistrictName","BlockName","CreatedOn"
"JAYAD","AGRICULTURE","Oilseeds","Groundnut (pea nut/mung phalli)","	Plant Protection	","thrips in groundnut","Recommended for spray imidacloprid 2ml / lit.","TAMILNADU","ARIYALUR","T. PALUR                                          ","2014-08-05 17:40:03.000"
"JAYAD","AGRICULTURE","Fiber Crops","Cotton (Kapas)","	Plant Protection	","Mealy bug for cotton","recommended for Mealy bug for cotton Spray profenophos 25 EC 2 ml + acephate 2 ml / lit","TAMILNADU","ARIYALUR","JAYAMKONDAM                                       ","2014-08-05 17:47:16.000"
"JAYAD","AGRICULTURE","Cereals","Paddy (Dhan)","Nutrient Management","top dressing for paddy","recommended for apply urea 25 kg + potash 15 kg + neem cake 5 kg+MN mixer 5kg/ac","TAMILNADU","ARIYALUR","T. PALUR                                          ","2014-08-05 17:54:45.000"
"JAYAD","AGRICULTURE","Oilseeds","Groundnut (pea nut/mung phalli)","	Plant Protection	","root rot in groundnut","recommended for spray coc 2 g/lit","TAMILNADU","ARIYALUR","JAYAMKONDAM                                       ","2014-08-05 18:03:51.000"
"JAYAD","HORTICULTURE","Vegetables","Tomato","Nutrient Management","tomato top dressing fertilizer","recommended for apply urea 40 kg/ acre","TAMILNADU","ARIYALUR","T. PALUR                                          ","2014-08-05 18:09:31.000"
"JAYAD","AGRICULTURE","Cereals","Paddy (Dhan)","Seeds","Paddy CR 1009 seeds availability details","Recommended Tamilnadu Rice Research Institute, Aduthurai contact no. 0435 - 2472098,  0435 - 2472131","TAMILNADU","ARIYALUR","THIRUMANUR                                        ","2014-08-05 18:45:22.000"
"JAYAD","HORTICULTURE","Vegetables","Onion","	Plant Protection	","cutworms in onion","recommended spray for chlorpyriphos 2ml/lit of water","TAMILNADU","ARIYALUR","T. PALUR                                          ","2014-08-05 19:13:14.000"
"JAYAD","AGRICULTURE","Millets","Maize (Makka)","Nutrient Management","maize top dressing fertilizer management","Recommended for apply urea 60kg / ac 30days after sowing","TAMILNADU","ARIYALUR","T. PALUR                                          ","2014-08-05 19:46:09.000"
"JAYAD","AGRICULTURE","Cereals","Paddy (Dhan)","Nutrient Management","paddy top dressing fertilizer management","Recommended for apply urea 25 kg + potash 15 kg + neem cake 5 kg/ac","TAMILNADU","ARIYALUR","THIRUMANUR                                        ","2014-08-05 19:46:56.000"
"JAYAD","HORTICULTURE","Vegetables","Drum Stick","	Plant Protection	","leaf caterpiller in moringa","recommended spray for carbaryl 2gm+FORS 25gm/lit of water","TAMILNADU","ARIYALUR","T. PALUR                                          ","2014-08-05 20:40:30.000"
"JAYAD","HORTICULTURE","Vegetables","Drum Stick","	Plant Protection	","moringa fertilizer management","Recommended for apply urea 45gm / plant","TAMILNADU","ARIYALUR","ARIYALUR                                          ","2014-08-05 20:48:58.000"
"JAYAD","HORTICULTURE","Vegetables","Tomato","	Plant Protection	","tomato top dressing fertilizer management","Recommended for apply urea 60kg / ac","TAMILNADU","ARIYALUR","T. PALUR                                          ","2014-08-05 20:54:29.000"
"JAYAD","HORTICULTURE","Vegetables","Bhindi(Okra/Ladysfinger)","Seeds and Planting Material","sowing season for bhendi","recommended for sowing season for bhendi june-aug","TAMILNADU","ARIYALUR","SENDURAI                                          ","2014-08-06 08:31:53.000"
"JAYAD","HORTICULTURE","Vegetables","Brinjal","Nutrient Management","brinjal basal fertilizer","recommended for apply urea 40 kg + s.phosphate 75 kg + pottash 35 kg/acre.","TAMILNADU","ARIYALUR","T. PALUR                                          ","2014-08-06 09:30:43.000"
"JAYAD","AGRICULTURE","Oilseeds","Groundnut (pea nut/mung phalli)","	Plant Protection	","thrips in groundnut","recommended for spray  imidacloprid 2ml / lit","TAMILNADU","ARIYALUR","T. PALUR                                          ","2014-08-06 09:32:44.000"
"JAYAD","HORTICULTURE","Flowers","Chrysanthemum","Fertilizer Use and Availability","top dreesing for chrysanthemum","recommended for applay urea 60kg/acr","TAMILNADU","ARIYALUR","JAYAMKONDAM                                       ","2014-08-06 10:55:02.000"
"JAYAD","AGRICULTURE","Pulses","Black Gram (urd bean)","Fertilizer Use and Availability","blackgram fertilizer management","Recommender for spray pulses onder 2.25kg / ac 200 litter of water","TAMILNADU","ARIYALUR","JAYAMKONDAM                                       ","2014-08-06 11:21:30.000"
"JAYAD","HORTICULTURE","Vegetables","Drum Stick","Market Information","drum stick market rate","recommended drum stick market rate  rs 25-35/kg","TAMILNADU","ARIYALUR","ARIYALUR                                          ","2014-08-06 12:12:29.000"
"JAYAD","AGRICULTURE","Cereals","Paddy (Dhan)","	Plant Protection	","bacterial leaf blight in paddy.","recommended for spray bactereomycin 18 g/acre.","TAMILNADU","ARIYALUR","T. PALUR                                          ","2014-08-06 13:55:07.000"
"JAYAD","AGRICULTURE","Oilseeds","Groundnut (pea nut/mung phalli)","Nutrient Management","groundnut fertilizer management","Recommended For spray TNAU Groundnut rich 2.20kg / ac","TAMILNADU","ARIYALUR","T. PALUR                                          ","2014-08-06 14:36:37.000"
"JAYAD","AGRICULTURE","Cereals","Paddy (Dhan)","Seeds","paddy samba variety","Samba (Aug)  I.White Ponni,BPT 5204, CO 43, CR 1009, ADT 38, TRY 1*, TRY 3*, ADT (R) 44, CORH 4, CO (R) 48, CO (R) 49, CO (R) 50, ADT (R) 49,TNAU Rice ADT 50, Swarna sub1","TAMILNADU","ARIYALUR","ARIYALUR                                          ","2014-08-06 14:53:34.000"
"JAYAD","AGRICULTURE","Cereals","Paddy (Dhan)","Seeds","paddy samba variety","recommended for Samba (Aug)  I.White Ponni,BPT 5204, CO 43, CR 1009, ADT 38, TRY 1*, TRY 3*, ADT (R) 44, CORH 4, CO (R) 48, CO (R) 49, CO (R) 50, ADT (R) 49,TNAU Rice ADT 50, Swarna sub1","TAMILNADU","ARIYALUR","ARIYALUR                                          ","2014-08-06 14:54:00.000"
"JAYAD","AGRICULTURE","Cereals","Paddy (Dhan)","Nutrient Management","top dressing for paddy","recommended for apply urea 25 kg + potash 15 kg + neem cake 5 kg+MN mixer 5kg/ac","TAMILNADU","ARIYALUR","JAYAMKONDAM                                       ","2014-08-06 14:54:01.000"
"JAYAD","AGRICULTURE","Oilseeds","Groundnut (pea nut/mung phalli)","	Plant Protection	","groundnut aphid","recommended for groundnut aphid spray methyl demeton 2ml+neem oil 3ml+ teepol 1ml/lit of water","TAMILNADU","ARIYALUR","T. PALUR                                          ","2014-08-06 15:15:19.000"
"JAYAD","HORTICULTURE","Flowers","Tuberose","Nutrient Management","top dressing for tuberose","apply urea 50kg+potash 25kg/ag","TAMILNADU","ARIYALUR","SENDURAI                                          ","2014-08-06 18:03:01.000"
"JAYAD","HORTICULTURE","Fruits","Banana","Fertilizer Use and Availability","Better bunchy fruit size increase in banana","recommended froSpray potassium sulphate 10 gm/liter of water","TAMILNADU","ARIYALUR","ANDIMADAM                                         ","2014-08-06 18:18:53.000"
"JAYAD","AGRICULTURE","Sugar and Starch Crops","Sugarcane (Noble Cane)","	Plant Protection	","wild animals are damaged in sugarcane field","recommended contact for nearest forest office","TAMILNADU","ARIYALUR","ARIYALUR                                          ","2014-08-06 18:39:09.000"
"JAYAD","AGRICULTURE","Oilseeds","Sesame (Gingelly/Til)/Sesamum","Market Information","Market rate for sesamum","at kallakurichi Rs 8586 10254/qntl","TAMILNADU","ARIYALUR","SENDURAI                                          ","2014-08-06 18:45:26.000"
"JAYAD","AGRICULTURE","Millets","Maize (Makka)","Fertilizer Use and Availability","basfertilizer management for maize","recommended for basal fertilizer management apply urea 30kg+ super phospate 150kg+ potash 30kg/acre","TAMILNADU","ARIYALUR","JAYAMKONDAM                                       ","2014-08-06 18:52:43.000"
"JAYAD","HORTICULTURE","Flowers","Jasmine","	Plant Protection	","checking pest in cock","recommended for spray methyldemeton 2 ml /lit of water","TAMILNADU","ARIYALUR","ANDIMADAM                                         ","2014-08-06 20:46:20.000"
"JAYAD","AGRICULTURE","Others","Others","Government Schemes","Agricultural department engineering contact number","recommended for Agricultural department engineering: 04329-220945","TAMILNADU","ARIYALUR","ARIYALUR                                          ","2014-08-06 20:53:11.000"
"JAYAD","HORTICULTURE","Vegetables","Onion","Market Information","market price for onion","recommended for onion price 32.00Rs/Kg","TAMILNADU","ARIYALUR","ARIYALUR                                          ","2014-08-07 08:17:27.000"
"JAYAD","HORTICULTURE","Vegetables","Onion","Fertilizer Use and Availability","onion foliar application details","Recommended for spray potassium sulphate 1kg / 100lit / ac harvest before 30 days","TAMILNADU","ARIYALUR","T. PALUR                                          ","2014-08-07 08:47:30.000"
"JAYAD","AGRICULTURE","Cereals","Paddy (Dhan)","Fertilizer Use and Availability","paddy top dressing fertilizer management","Recommended for apply urea 25 kg + potash 15 kg + neem cake 5 kg/ac","TAMILNADU","ARIYALUR","THIRUMANUR                                        ","2014-08-07 09:48:28.000"
"JAYAD","AGRICULTURE","Others","Others","Weather","weather report in ariyalur","recommended to have no rain","TAMILNADU","ARIYALUR","THIRUMANUR                                        ","2014-08-07 11:02:11.000"
"JAYAD","HORTICULTURE","Flowers","Marigold","Nutrient Management","foliar spray in marigold","recommended for micro nutrient 5kg /ac","TAMILNADU","ARIYALUR","JAYAMKONDAM                                       ","2014-08-07 11:26:34.000"
"JAYAD","AGRICULTURE","Fiber Crops","Cotton (Kapas)","Market Information","market rate for cotton","recommended rate for cotton is rs.4100-4800/q","TAMILNADU","ARIYALUR","ARIYALUR                                          ","2014-08-07 11:46:09.000"
"JAYAD","HORTICULTURE","Plantation Crops","Coconut","Nutrient Management","fertilizer management for coconut","recommended for apply 1.300 kg urea + 2 kg superphosphate + 2 kg potash + 5 kg neem cake + 50 kg FYM + 1 kg micro nutrient /tree /year on two split.","TAMILNADU","ARIYALUR","THIRUMANUR                                        ","2014-08-07 11:54:10.000"
"JAYAD","AGRICULTURE","Oilseeds","Groundnut (pea nut/mung phalli)","	Plant Protection	","thrips in groundnut","Recommended for Recommended for spray imidacloprid 2ml / lit.","TAMILNADU","ARIYALUR","ARIYALUR                                          ","2014-08-07 12:37:00.000"
"JAYAD","HORTICULTURE","Vegetables","Drum Stick","	Plant Protection	","caterpillar in moringa","recommended for spray malathion 2 ml/lit","TAMILNADU","ARIYALUR","T. PALUR                                          ","2014-08-07 13:39:25.000"
"JAYAD","AGRICULTURE","Oilseeds","Groundnut (pea nut/mung phalli)","	Plant Protection	","Tobacco caterpillar in groundnut","spray quinalphos 2ml / lit","TAMILNADU","ARIYALUR","T. PALUR                                          ","2014-08-07 14:03:47.000"
"JAYAD","AGRICULTURE","Cereals","Paddy (Dhan)","Nutrient Management","top dressing for paddy","recommended for apply urea 25 kg + potash 15 kg + neem cake 5 kg+MN mixer 5kg/ac","TAMILNADU","ARIYALUR","SENDURAI                                          ","2014-08-07 14:47:29.000"
"JAYAD","AGRICULTURE","Fiber Crops","Cotton (Kapas)","Seeds","cotton varieties","recommended for cotton varieties are MCU 5, Suvin, TCHB 213*, MCU 12, MCU 13, Surabhi","TAMILNADU","ARIYALUR","T. PALUR                                          ","2014-08-07 15:19:31.000"
"JAYAD","HORTICULTURE","Vegetables","Bitter Gourd","Nutrient Management","foliar spray in bitter gourd","recommended for Spray Ethrel 100 ppm (1 ml dissolved in 10 lit of water) four times from 15th day after sowing at weekly intervals.","TAMILNADU","ARIYALUR","SENDURAI                                          ","2014-08-07 16:25:49.000"
"JAYAD","AGRICULTURE","Cereals","Paddy (Dhan)","Fertilizer Use and Availability","top dressing for paddy","recommended for apply urea 25 kg + potash 15 kg + neem cake 5 kg+MN mixer 5kg/ac","TAMILNADU","ARIYALUR","SENDURAI                                          ","2014-08-07 17:03:49.000"
"JAYAD","AGRICULTURE","Oilseeds","Sesame (Gingelly/Til)/Sesamum","Market Information","sesame market rate","recommended for sesame market rate:9500-12000/quintal","TAMILNADU","ARIYALUR","JAYAMKONDAM                                       ","2014-08-07 17:45:16.000"
"JAYAD","HORTICULTURE","Flowers","Marigold","Market Information","market rate for marigold","Marigold Kumbakonam Market Local 1 60.00/Kg 40.00/Kg","TAMILNADU","ARIYALUR","THIRUMANUR                                        ","2014-08-07 21:01:47.000"
"JAYAD","AGRICULTURE","Cereals","Paddy (Dhan)","Weather","weather detail for ariyalur dist","date from 8 to 12 no rain","TAMILNADU","ARIYALUR","ARIYALUR                                          ","2014-08-07 21:47:43.000"
"JAYAD","AGRICULTURE","Millets","Sorghum (Jowar/Great Millet)","	Field Preparation	","cumbu varities","recommended cumbu varities  CO 7, CO (Cu) 9, X 7, ICMV 221, TNAU cumbu hybrid Co 9","TAMILNADU","ARIYALUR","ANDIMADAM                                         ","2014-08-08 08:08:58.000"
"JAYAD","AGRICULTURE","Oilseeds","Groundnut (pea nut/mung phalli)","Fertilizer Use and Availability","groundnut basal fertilizer management","Recommended for apply DAP 50kg / ac","TAMILNADU","ARIYALUR","SENDURAI                                          ","2014-08-08 09:37:32.000"
"JAYAD","HORTICULTURE","Vegetables","Onion","Nutrient Management","basal fertilizer management for onion","Recommended for apply 25kg urea + superphosphate 145kg+potash 20kg/ac","TAMILNADU","ARIYALUR","T. PALUR                                          ","2014-08-08 12:35:14.000"
"JAYAD","AGRICULTURE","Others","Others","Weather","weather report ariyalur","recommended weather report ariyalur today no rain","TAMILNADU","ARIYALUR","ARIYALUR                                          ","2014-08-08 14:06:42.000"
"JAYAD","HORTICULTURE","Plantation Crops","Coconut","	Plant Protection	","Rhinoceros beetle in coconut","recommended for Soak castor cake at 1 kg in 5 l of water in small mud pots and keep them in the coconut gardens to attract and kill the adults.","TAMILNADU","ARIYALUR","ARIYALUR                                          ","2014-08-08 14:31:17.000"
"JAYAD","AGRICULTURE","Others","Others","Weather","asking about weather details","Recommended for Today No Rain Fall","TAMILNADU","ARIYALUR","THIRUMANUR                                        ","2014-08-08 14:33:28.000"
"JAYAD","HORTICULTURE","Vegetables","Drum Stick","	Plant Protection	","Moringa pod fly management ","Recommended for spray Profenofos 2ml / lit.","TAMILNADU","ARIYALUR","JAYAMKONDAM                                       ","2014-08-08 15:03:07.000"
"JAYAD","AGRICULTURE","Oilseeds","Groundnut (pea nut/mung phalli)","Seeds","Groundnut seeds availability","recommended for Groundnut seeds availability details contact to Seed Centre Tamil Nadu Agricultural University Coimbatore-phone number:0422 6611232","TAMILNADU","ARIYALUR","THIRUMANUR                                        ","2014-08-08 15:07:08.000"
"JAYAD","AGRICULTURE","Cereals","Paddy (Dhan)","Fertilizer Use and Availability","Paddy nursery fertilizer","recommended for apply DAP 2kg/cent","TAMILNADU","ARIYALUR","ARIYALUR                                          ","2014-08-08 16:01:20.000"
"JAYAD","AGRICULTURE","Cereals","Paddy (Dhan)","Fertilizer Use and Availability","top dressing for paddy","recommended for apply urea 25 kg + potash 15 kg + neem cake 5 kg+MN mixer 5kg/ac","TAMILNADU","ARIYALUR","THIRUMANUR                                        ","2014-08-08 17:02:11.000"
"JAYAD","HORTICULTURE","Vegetables","Ash Gourd (Petha)","Market Information","Ashgourd Market rate","Ashgourd Market rate : 6 - 8 Rs./Kg","TAMILNADU","ARIYALUR","ARIYALUR                                          ","2014-08-08 17:19:18.000"
"JAYAD","HORTICULTURE","Plantation Crops","Cashew","	Plant Protection	","cashew Stem borer","Root feeding with Monocrotophos 36 WSC 10 ml + 10 ml of water kept in a polythene bag on one side of the tree and keep the same amount on the other side of the tree (Total 20 ml/tree) divided into two equal halves will give protection when there is moderate incidence.","TAMILNADU","ARIYALUR","SENDURAI                                          ","2014-08-08 17:23:06.000"
"","AGRICULTURE","Millets","Italian Millet (Thenai/Navane/Foxtail Millet/Kang)","Market Information","market price of thenai","recommended for market price of thenai is rs.1850/quintol","TAMILNADU","ARIYALUR","JAYAMKONDAM                                       ","2014-08-08 18:34:46.000"
"JAYAD","AGRICULTURE","Cereals","Paddy (Dhan)","Fertilizer Use and Availability","paddy top dressing fertilizer management","Recommended for apply urea 25 kg + potash 15 kg + neem cake 5 kg/ac","TAMILNADU","ARIYALUR","ANDIMADAM                                         ","2014-08-08 19:05:32.000"
"JAYAD","HORTICULTURE","Flowers","Tuberose","Cultural Practices","planting season of tuberose","recommended for planting season of tuberose is June - July","TAMILNADU","ARIYALUR","ANDIMADAM                                         ","2014-08-08 19:06:48.000"
"JAYAD","AGRICULTURE","Fiber Crops","Cotton (Kapas)","Market Information","Cotton market rate","Recommended for Cotton market rate : 4116 - 5096 Rs./Quintal","TAMILNADU","ARIYALUR","SENDURAI                                          ","2014-08-08 19:42:11.000"
"JAYAD","AGRICULTURE","Millets","Maize (Makka)","Market Information","market rate for maize","Gangavalli Other 1360 - 1380 Rs/Quintal","TAMILNADU","ARIYALUR","JAYAMKONDAM                                       ","2014-08-08 20:01:23.000"
"JAYAD","AGRICULTURE","Millets","Maize (Makka)","Market Information","market rate for maize","Gangavalli Other 1360 - 1380 Rs/Quintal","TAMILNADU","ARIYALUR","JAYAMKONDAM                                       ","2014-08-08 20:31:46.000"
"JAYAD","AGRICULTURE","Sugar and Starch Crops","Sugarcane (Noble Cane)","Nutrient Management","sugarcane fertilizer management","Recommendd for apply magnesium sulphate 5 kg / ac","TAMILNADU","ARIYALUR","THIRUMANUR                                        ","2014-08-08 20:36:25.000"
"JAYAD","AGRICULTURE","Oilseeds","Sunflower (suryamukhi)","Nutrient Management","Boron application for sunflower","recommended for spray borax 3 gm/ litre of water","TAMILNADU","ARIYALUR","THIRUMANUR                                        ","2014-08-08 21:18:35.000"
"JAYAD","HORTICULTURE","Vegetables","Drum Stick","	Plant Protection	","fruit fly in drumstick","recommended for spray malathion 2 ml + neem oil 3 ml + wetting agent 1 ml / lit of water","TAMILNADU","ARIYALUR","ARIYALUR                                          ","2014-08-09 07:54:41.000"
"JAYAD","AGRICULTURE","Oilseeds","Groundnut (pea nut/mung phalli)","	Plant Protection	","Groundnut booster application","recommended for Foliar spray for peanut rich 2.20 kg + 200 lit of water/ac","TAMILNADU","ARIYALUR","JAYAMKONDAM                                       ","2014-08-09 09:09:59.000"
"JAYAD","HORTICULTURE","Vegetables","Chillies","	Plant Protection	","thrips control in Chilli","recommended for Spray Fipronil 1.5 ml/lit of water","TAMILNADU","ARIYALUR","THIRUMANUR                                        ","2014-08-09 10:00:06.000"
"JAYAD","AGRICULTURE","Millets","Pearl Millet (Bajra/Bulrush Millet/Spiked Millet)","Government Schemes","Asking about crop insurance details","recommended number for agriculture office 04329244570","TAMILNADU","ARIYALUR","THIRUMANUR                                        ","2014-08-09 10:54:30.000"
"JAYAD","HORTICULTURE","Vegetables","Bhindi(Okra/Ladysfinger)","Cultural Practices","bhendi sowing season","Recommended for bhendi season June – August","TAMILNADU","ARIYALUR","ANDIMADAM                                         ","2014-08-09 10:56:17.000"
"JAYAD","AGRICULTURE","Cereals","Paddy (Dhan)","Fertilizer Use and Availability","top dressing for paddy","recommended for apply urea 25 kg + potash 15 kg + neem cake 5 kg+MN mixer 5kg/ac","TAMILNADU","ARIYALUR","JAYAMKONDAM                                       ","2014-08-09 11:34:58.000"
"JAYAD","AGRICULTURE","Oilseeds","Groundnut (pea nut/mung phalli)","	Plant Protection	","Root Rot in groundnut","Recommended for apply Trichoderma viride 1kg + FYM 20kg / ac","TAMILNADU","ARIYALUR","THIRUMANUR                                        ","2014-08-09 12:08:30.000"
"JAYAD","AGRICULTURE","Others","Others","Government Schemes","veppanthattai research station contact number","recommended for contact number 04328264112","TAMILNADU","ARIYALUR","T. PALUR                                          ","2014-08-09 12:39:09.000"
"JAYAD","AGRICULTURE","Millets","Maize (Makka)","Fertilizer Use and Availability","maize top dressing fertilizer management","Recommended for apply urea 60kg / ac 30days after sowing","TAMILNADU","ARIYALUR","SENDURAI                                          ","2014-08-09 12:57:01.000"
"JAYAD","HORTICULTURE","Plantation Crops","Cashew","	Plant Protection	","shoot caterpillars in cashewnut","recommended for spray Profenophos 50 EC @ 2 ml/lit.","TAMILNADU","ARIYALUR","ARIYALUR                                          ","2014-08-09 14:04:20.000"
"JAYAD","HORTICULTURE","Vegetables","Bitter Gourd","Nutrient Management","bitter gorud top dressing fertilizer management","Recommended for urea 10gm / pit","TAMILNADU","ARIYALUR","THIRUMANUR                                        ","2014-08-09 14:52:05.000"
"JAYAD","HORTICULTURE","Fruits","Mango","Fertilizer Use and Availability","mango fertilizer management","Recommended for apply urea 200gm + potash 300gm + super phosphate 200gm / tree","TAMILNADU","ARIYALUR","ARIYALUR                                          ","2014-08-09 15:03:57.000"
"JAYAD","HORTICULTURE","Fruits","Mango","Nutrient Management","mango fertilizer management","Recommended for apply urea 200gm + potash 300gm + super phosphate 200gm / tree","TAMILNADU","ARIYALUR","ARIYALUR                                          ","2014-08-09 15:24:15.000"
"JAYAD","AGRICULTURE","Cereals","Paddy (Dhan)","Nutrient Management","top dressing for paddy","recommended for apply urea 25 kg + potash 15 kg + neem cake 5 kg+MN mixer 5kg/ac","TAMILNADU","ARIYALUR","JAYAMKONDAM                                       ","2014-08-09 16:26:18.000"
"JAYAD","HORTICULTURE","Vegetables","Bhindi(Okra/Ladysfinger)","	Plant Protection	","yellow vein mosaic virus in bhendi","Recommended for spray methyldemeton 2ml / lit","TAMILNADU","ARIYALUR","ARIYALUR                                          ","2014-08-09 18:52:19.000"
"JAYAD","AGRICULTURE","Oilseeds","Groundnut (pea nut/mung phalli)","	Plant Protection	","Root Rot in groundnut","Recommended for apply Trichoderma viride 1kg + FYM 20kg / ac","TAMILNADU","ARIYALUR","ARIYALUR                                          ","2014-08-09 20:42:55.000"
"JAYAD","AGRICULTURE","Pulses","Pigeon pea (red gram/arhar/tur)","Seeds","Krishi Vigyan Kendra Cholamadevi ariyalur","recommended  Krishi Vigyan Kendra Cholamadevi ariyalur contact 04331 – 260335","TAMILNADU","ARIYALUR","ANDIMADAM                                         ","2014-08-09 22:00:53.000"
"JAYAD","AGRICULTURE","Cereals","Paddy (Dhan)","Nutrient Management","paddy top dressing","recommended for apply urea 25 kg + potash 15 kg + mn mixture.","TAMILNADU","ARIYALUR","T. PALUR                                          ","2014-08-10 06:56:50.000"
"JAYAD","HORTICULTURE","Vegetables","Drum Stick","Market Information","moringa market rate","recommended as 25-35/kg.","TAMILNADU","ARIYALUR","SENDURAI                                          ","2014-08-10 08:26:41.000"
"JAYAD","AGRICULTURE","Fiber Crops","Cotton (Kapas)","Market Information","market rate for cotton","Konganapuram Other 4800	- 5200 Rs/Quintal","TAMILNADU","ARIYALUR","ARIYALUR                                          ","2014-08-10 08:33:11.000"
"JAYAD","HORTICULTURE","Flowers","Jasmine","Field Preparation","jasmine planting season","jasmine planting season : june - november","TAMILNADU","ARIYALUR","THIRUMANUR                                        ","2014-08-10 12:12:04.000"
"JAYAD","AGRICULTURE","Millets","Sorghum (Jowar/Great Millet)","Cultural Practices","weeed management in sorghum.","recommended for spray atrazime 100g/acre.","TAMILNADU","ARIYALUR","JAYAMKONDAM                                       ","2014-08-10 12:13:27.000"
"JAYAD","AGRICULTURE","Millets","Sorghum (Jowar/Great Millet)","Cultural Practices","weed management in sorghum.","recommended for spray atrazine 100 g/acre.","TAMILNADU","ARIYALUR","JAYAMKONDAM                                       ","2014-08-10 12:18:16.000"
"JAYAD","HORTICULTURE","Vegetables","Bhindi(Okra/Ladysfinger)","	Plant Protection	","Fruit borer in bhendi","recommended for spray quinalphos 2ml+neem oil 3ml+teepol 1ml/lit of water","TAMILNADU","ARIYALUR","ARIYALUR                                          ","2014-08-10 13:30:19.000"
"JAYAD","HORTICULTURE","Vegetables","Drum Stick","Market Information","Drumstick Kumbakonam Market","recommended for Drumstick Kumbakonam Market 30.00/Kg","TAMILNADU","ARIYALUR","T. PALUR                                          ","2014-08-10 17:52:24.000"
"JAYAD","HORTICULTURE","Plantation Crops","Coconut","Government Schemes","coconut tree climber availability details","recommended number for ariyalur kvk 04331 260335","TAMILNADU","ARIYALUR","ANDIMADAM                                         ","2014-08-10 18:33:32.000"
