"Season","Sector","Category","Crop","QueryType","QueryText","KCCAns","StateName","DistrictName","BlockName","CreatedOn"
"JAYAD","AGRICULTURE","Oilseeds","Groundnut (pea nut/mung phalli)","Fertilizer Use and Availability","Groundnut top dressing fertilizer management","recommended for Groundnut top dressing fertilizer management Apply gypsum 80 kg / ac","TAMILNADU","ARIYALUR","JAYAMKONDAM                                       ","2014-08-11 07:03:11.000"
"JAYAD","HORTICULTURE","Vegetables","Brinjal","	Plant Protection	","brinjal fruit borer","recommended for spray thiodicarb 2 g/lit.","TAMILNADU","ARIYALUR","T. PALUR                                          ","2014-08-11 09:34:33.000"
"JAYAD","AGRICULTURE","Millets","Maize (Makka)","Nutrient Management","top dressing fertilizer management for  maize","recommended for Apply Urea 25 kg+ potash 30 kg /ac","TAMILNADU","ARIYALUR","T. PALUR                                          ","2014-08-11 10:09:35.000"
"JAYAD","AGRICULTURE","Millets","Maize (Makka)","Market Information","market rate in maize","Recommended for market rate in maize Rs 1400-1600/quintal","TAMILNADU","ARIYALUR","JAYAMKONDAM                                       ","2014-08-11 10:32:56.000"
"JAYAD","HORTICULTURE","Vegetables","Onion","Fertilizer Use and Availability","basal fertilizer in onion","Recommended for apply 25kg urea + superphosphate 145kg+potash 20kg/ac","TAMILNADU","ARIYALUR","ARIYALUR                                          ","2014-08-11 11:55:45.000"
"JAYAD","AGRICULTURE","Cereals","Paddy (Dhan)","Market Information","market price for paddy","recommended for paddy price;1600-1700Rs/quintal","TAMILNADU","ARIYALUR","THIRUMANUR                                        ","2014-08-11 13:50:57.000"
"JAYAD","AGRICULTURE","Millets","Sorghum (Jowar/Great Millet)","Cultural Practices","seed rate in cumbu","Recommended for seed rate in cumbu 5 kg/acre","TAMILNADU","ARIYALUR","SENDURAI                                          ","2014-08-11 15:05:20.000"
"JAYAD","HORTICULTURE","Vegetables","Onion","Fertilizer Use and Availability","onion top dressing fertilizer management","Recommended for Recommended for apply urea 24kg /ac","TAMILNADU","ARIYALUR","JAYAMKONDAM                                       ","2014-08-11 15:33:09.000"
"JAYAD","AGRICULTURE","Oilseeds","Sesame (Gingelly/Til)/Sesamum","Market Information","sesame market rate","recommended for sesame market rate:rate.6336-9236/quintal","TAMILNADU","ARIYALUR","JAYAMKONDAM                                       ","2014-08-11 15:56:56.000"
"KHARIF","HORTICULTURE","Vegetables","Brinjal","Nutrient Management","brinjal basal fertilizer management","Recommended for Apply urea 42 kg + Super phosphate 125kg + potash 20kg / ac","TAMILNADU","ARIYALUR","JAYAMKONDAM                                       ","2014-08-19 16:20:02.973"
"KHARIF","HORTICULTURE","Flowers","Tuberose","Market Information","tuberose blight","recommended for spray mangozeb 2ml/litre","TAMILNADU","ARIYALUR","JAYAMKONDAM                                       ","2014-08-19 16:52:39.983"
"KHARIF","AGRICULTURE","Cereals","Paddy (Dhan)","Fertilizer Use and Availability","Paddy basal fertilizer","recommended for Paddy basal fertilizer Apply DAP 50 kg + zinc sulphate 15 kg/ac","TAMILNADU","ARIYALUR","JAYAMKONDAM                                       ","2014-08-19 17:18:47.423"
"KHARIF","AGRICULTURE","Oilseeds","Sesame (Gingelly/Til)/Sesamum","Market Information","Kallakurichi Sesame market rate","Recommended for Kallakurichi Sesame market rate : 6498 - 9236 Rs./Quintal","TAMILNADU","ARIYALUR","SENDURAI                                          ","2014-08-19 20:46:01.353"
"KHARIF","HORTICULTURE","Vegetables","Bhindi(Okra/Ladysfinger)","	Plant Protection	","mosaic in bhendi","","TAMILNADU","ARIYALUR","ARIYALUR                                          ","2014-08-20 07:22:49.737"
"KHARIF","HORTICULTURE","Vegetables","Brinjal","	Plant Protection	","root  rot in brinjal","drench with copper oxchyloride 2 gm/lit of water","TAMILNADU","ARIYALUR","ANDIMADAM                                         ","2014-08-20 07:54:14.823"
"KHARIF","HORTICULTURE","Vegetables","Bhindi(Okra/Ladysfinger)","	Plant Protection	","caterpillar in bhendi","recommended for spray quinalphos 2 ml/litr.","TAMILNADU","ARIYALUR","THIRUMANUR                                        ","2014-08-20 12:08:59.440"
"KHARIF","HORTICULTURE","Fruits","Grape","Seeds and Planting Material","planting material for grape","recommended to contact periyakulam 04546-231726","TAMILNADU","ARIYALUR","JAYAMKONDAM                                       ","2014-08-20 12:15:21.747"
"KHARIF","HORTICULTURE","Flowers","Tuberose","Cultural Practices","seed rate for tuberose","recommended seed rate for tuberose 44800 corms/ac","TAMILNADU","ARIYALUR","ANDIMADAM                                         ","2014-08-20 12:53:33.650"
"KHARIF","AGRICULTURE","Cereals","Paddy (Dhan)","","samba season varieties","recommended for .White Ponni, CO 43, ADT 40, CR 1009, TRY 1*, ADT 38, ADT(R) 44, CO(R) 48, CO(R) 49, CO (R) 50, ADT(R)49, TNAU Rice ADT50,
Swarna Sub1, ADT(R) 46","TAMILNADU","ARIYALUR","SENDURAI                                          ","2014-08-20 12:57:12.133"
"KHARIF","AGRICULTURE","Cereals","Paddy (Dhan)","Seeds","samba varieties for paddy","recommended for samba varieties for paddy;White Ponni, CO 43, ADT 40, CR 1009, TRY 1*, ADT 38, ADT(R) 44,","TAMILNADU","ARIYALUR","ANDIMADAM                                         ","2014-08-20 14:12:31.727"
"KHARIF","HORTICULTURE","Vegetables","Ash Gourd (Petha)","Nursery Management","foliar spray in ash gourd","recommended for spray mn mixture 5g/lit of water","TAMILNADU","ARIYALUR","SENDURAI                                          ","2014-08-20 14:16:21.643"
"KHARIF","AGRICULTURE","Fodder Crops","fodder sorghum","Seeds","season for kolukattai grass","recommended season for kolukattai grass is Oct - Dec, CO 1","TAMILNADU","ARIYALUR","T. PALUR                                          ","2014-08-20 15:09:31.220"
"KHARIF","HORTICULTURE","Vegetables","Brinjal","	Plant Protection	","brinjal fruit borer","recommended for thiodicarp 2 g/lit.","TAMILNADU","ARIYALUR","T. PALUR                                          ","2014-08-20 15:31:00.277"
"KHARIF","AGRICULTURE","Cereals","Paddy (Dhan)","Seeds","seed treatment in paddy","recommended Treat the seeds with talc based formulation of Pseudomonas fluorescens 10g/kg of seed and soak in 1lit of water overnight. Decant the excess water and allow the seeds to sprout for 24hrs and then sow.","TAMILNADU","ARIYALUR","ARIYALUR                                          ","2014-08-20 15:39:47.820"
"KHARIF","AGRICULTURE","Pulses","Black Gram (urd bean)","Seeds","variety of blackgram","recommended VBN 3 (To avoid Yellow Mosaic Virus treat the seeds with Imidachlorphid @ 1 ml / kg seed) VBN(Bg) 4, VBN (Bg) 5, TNAU (Blackgram) VBN 6, TNAU (Blackgram) Co 6, APK 1","TAMILNADU","ARIYALUR","ARIYALUR                                          ","2014-08-20 15:42:02.183"
"KHARIF","HORTICULTURE","Plantation Crops","Cashew","Nutrient Management","foliar spray for cashewnut","recommended foliar spray 19:9:19 WSF 10gm/lit of water","TAMILNADU","ARIYALUR","SENDURAI                                          ","2014-08-20 17:00:25.203"
"KHARIF","AGRICULTURE","Oilseeds","Groundnut (pea nut/mung phalli)","Nutrient Management","groundnut fertilizer management","Recommended for spray TNAU Groundnut rich 2.20kg / ac","TAMILNADU","ARIYALUR","ARIYALUR                                          ","2014-08-20 17:10:35.237"
"KHARIF","HORTICULTURE","Flowers","Marigold","Seeds and Planting Material","Marigold seed rate","Recommended for Marigold seed rate : 1kg / ac","TAMILNADU","ARIYALUR","THIRUMANUR                                        ","2014-08-20 17:14:57.980"
"KHARIF","HORTICULTURE","Vegetables","Pumpkin","	Plant Protection	","epilachna beetle in pumpkin","recommended spray malathion 2ml/lit.","TAMILNADU","ARIYALUR","JAYAMKONDAM                                       ","2014-08-20 17:34:42.737"
"KHARIF","AGRICULTURE","Fiber Crops","Cotton (Kapas)","Nutrient Management","cotton basal fertilizer management","Recommended for apply urea 33kg + super phosphate 100kg + potash 26kg / ac","TAMILNADU","ARIYALUR","T. PALUR                                          ","2014-08-20 18:09:41.177"
"KHARIF","HORTICULTURE","Condiments and Spices","Turmeric","Fertilizer Use and Availability","Basal fertilizer management for turmeric","Recommended for apply urea 15 kg + superphosphate 145kg + potash 15 kg /ac","TAMILNADU","ARIYALUR","THIRUMANUR                                        ","2014-08-20 19:13:41.547"
"KHARIF","AGRICULTURE","Cereals","Paddy (Dhan)","Seeds","seeds availability in paddy","recommended to contact tnau cbe rice department 0422-2474967","TAMILNADU","ARIYALUR","ARIYALUR                                          ","2014-08-20 19:33:28.230"
"KHARIF","HORTICULTURE","Vegetables","Brinjal","Nutrient Management","brinjal top dressing fertilizer management","apply urea 42kg / ac","TAMILNADU","ARIYALUR","THIRUMANUR                                        ","2014-08-20 21:07:48.433"
"KHARIF","AGRICULTURE","Millets","Maize (Makka)","	Plant Protection	","root rot in maize","recommended for drench with coc 2g/lit.","TAMILNADU","ARIYALUR","JAYAMKONDAM                                       ","2014-08-20 21:12:59.920"
"KHARIF","HORTICULTURE","Flowers","Marigold","Seeds and Planting Material","Marigold seed rate","Recommended for Marigold seed rate : 1kg / ac","TAMILNADU","ARIYALUR","THIRUMANUR                                        ","2014-08-20 21:53:38.273"
"KHARIF","AGRICULTURE","Millets","FingerMillet  (Ragi/Mandika)","	Field Preparation	","cumbu season","Recommended for cumbu season September - October","TAMILNADU","ARIYALUR","JAYAMKONDAM                                       ","2014-08-21 06:49:34.307"
"KHARIF","AGRICULTURE","Oilseeds","Groundnut (pea nut/mung phalli)","Nutrient Management","groundnut leaf feeder","recommended for spray borax 5gm/liter water","TAMILNADU","ARIYALUR","JAYAMKONDAM                                       ","2014-08-21 06:54:35.797"
"KHARIF","AGRICULTURE","Oilseeds","Groundnut (pea nut/mung phalli)","Nutrient Management","groundnut foliar nutrient management","recommended for spray borax 5gm/liter water","TAMILNADU","ARIYALUR","JAYAMKONDAM                                       ","2014-08-21 06:55:48.280"
"KHARIF","AGRICULTURE","Oilseeds","Sesame (Gingelly/Til)/Sesamum","Fertilizer Use and Availability","Basal fertilizer management for sesame","recommended for apply urea 30kg + superphosphate 58kg + potash 15 kg/ac","TAMILNADU","ARIYALUR","SENDURAI                                          ","2014-08-21 07:20:12.640"
"KHARIF","AGRICULTURE","Oilseeds","Groundnut (pea nut/mung phalli)","	Plant Protection	","root grub management in groundnut","recommended for apply neemcake 20kg+carbofuradon granules 5kg+10kg sand","TAMILNADU","ARIYALUR","JAYAMKONDAM                                       ","2014-08-21 09:14:56.627"
"KHARIF","HORTICULTURE","Flowers","Jasmine","Fertilizer Use and Availability","fertiliser manangement in jasmine","recommended for apply 6:12:12@ 100 gm/plant","TAMILNADU","ARIYALUR","JAYAMKONDAM                                       ","2014-08-21 10:24:56.240"
"KHARIF","HORTICULTURE","Vegetables","Onion","	Plant Protection	","Leaf Blight in onion","Recommended for spray mancozeb + carbendazim (saaf) 2.5gm/lit of water","TAMILNADU","ARIYALUR","THIRUMANUR                                        ","2014-08-21 12:52:20.223"
"KHARIF","AGRICULTURE","Oilseeds","Sesame (Gingelly/Til)/Sesamum","Market Information","market rate for sesame","Kallakurichi Other 6749	- 9461 Rs/Quintal","TAMILNADU","ARIYALUR","SENDURAI                                          ","2014-08-21 13:14:08.527"
"KHARIF","AGRICULTURE","Millets","FingerMillet  (Ragi/Mandika)","	Field Preparation	","cumbu sowing season","Recommended for cumbu sowing season : September - october","TAMILNADU","ARIYALUR","SENDURAI                                          ","2014-08-21 14:27:44.767"
"KHARIF","AGRICULTURE","Cereals","Paddy (Dhan)","Seeds","paddy seeds availability","recommended number for trichy agriculture college 0431-2906100","TAMILNADU","ARIYALUR","JAYAMKONDAM                                       ","2014-08-21 14:44:54.760"
"KHARIF","AGRICULTURE","Cereals","Paddy (Dhan)","	Plant Protection	","paddy seed availability","recommended for contact to aduthurai rice research institute 0435-2472098","TAMILNADU","ARIYALUR","JAYAMKONDAM                                       ","2014-08-21 14:47:12.187"
"KHARIF","AGRICULTURE","Pulses","Black Gram (urd bean)","Cultural Practices","sowing season of blackgram","recommended for sowing season of blackgram is june-august","TAMILNADU","ARIYALUR","JAYAMKONDAM                                       ","2014-08-21 15:06:01.287"
"KHARIF","AGRICULTURE","Millets","Maize (Makka)","Fertilizer Use and Availability","maize basal fertilizer management","apply urea 30kg + super phos phate 150kg + potash 30kg / ac","TAMILNADU","ARIYALUR","SENDURAI                                          ","2014-08-21 15:12:08.383"
"KHARIF","HORTICULTURE","Vegetables","Brinjal","	Plant Protection	","brinjal fruit borer","recommended for spray quinophos 2 ml + neem oil 3 ml + teepol 1 ml / 1 litre of water","TAMILNADU","ARIYALUR","ARIYALUR                                          ","2014-08-21 15:54:46.763"
"KHARIF","AGRICULTURE","Millets","Maize (Makka)","Fertilizer Use and Availability","maize basal fertilizer management","Recommended for apply urea 30kg + super phos phate 150kg + potash 30kg / ac","TAMILNADU","ARIYALUR","JAYAMKONDAM                                       ","2014-08-21 19:04:53.850"
"KHARIF","AGRICULTURE","Cereals","Paddy (Dhan)","Fertilizer Use and Availability","paddy foliar application details","recommended for apply urea 100gm + super 200gm + potash 100gm / tank","TAMILNADU","ARIYALUR","THIRUMANUR                                        ","2014-08-21 19:20:32.970"
"KHARIF","AGRICULTURE","Others","Others","	Plant Protection	","Weed management for wasteland","recommended for spray glyphosate 10 ml and 20 g ammonium sulphate/litre of water","TAMILNADU","ARIYALUR","JAYAMKONDAM                                       ","2014-08-21 19:34:04.887"
"KHARIF","AGRICULTURE","Others","Others","Credit","Message need my mobile in english","recommended for as your request we are activated","TAMILNADU","ARIYALUR","THIRUMANUR                                        ","2014-08-21 19:38:16.853"
"KHARIF","HORTICULTURE","Vegetables","Onion","Market Information","market rate in onion","Recommended for market rate in onion Rs 1800.00/50Kg","TAMILNADU","ARIYALUR","ARIYALUR                                          ","2014-08-21 20:08:25.880"
"KHARIF","AGRICULTURE","Millets","Pearl Millet (Bajra/Bulrush Millet/Spiked Millet)","Market Information","cumbu market information","recommended for cumbu market information 1710/quintal","TAMILNADU","ARIYALUR","ARIYALUR                                          ","2014-08-21 21:27:23.320"
"KHARIF","AGRICULTURE","Sugar and Starch Crops","Sugarcane (Noble Cane)","	Plant Protection	","Stem borer in sugarcane","recommended for Spray chlorpyriphos 2 ml / lit of water","TAMILNADU","ARIYALUR","ARIYALUR                                          ","2014-08-22 11:21:51.153"
"KHARIF","AGRICULTURE","Others","Others","Credit","Kisan credit card details","recommended for Contact to bank manager","TAMILNADU","ARIYALUR","T. PALUR                                          ","2014-08-22 11:46:03.493"
"KHARIF","FISHERIES","Inland","Fresh Water","Fish Fingerling Production","fisheries department no of thanjavur","recommended number for fisheries department 04362-235389","TAMILNADU","ARIYALUR","JAYAMKONDAM                                       ","2014-08-22 12:49:26.220"
"KHARIF","AGRICULTURE","Millets","Maize (Makka)","Nutrient Management","basal fertilizer for maize","recommended for apply urea 30kg+super 145kg +potash 30kg/ac","TAMILNADU","ARIYALUR","SENDURAI                                          ","2014-08-22 13:11:55.210"
"KHARIF","HORTICULTURE","Vegetables","Amaranthus/Grain Amaranthus","	Plant Protection	","leaf spot in amaranthus","Recommended for spray carbendazim 2gm / lit","TAMILNADU","ARIYALUR","JAYAMKONDAM                                       ","2014-08-22 13:16:32.340"
"KHARIF","AGRICULTURE","Others","Others","Weather","ariyalur Weather report","recommended for today rainy day in ariyalur","TAMILNADU","ARIYALUR","SENDURAI                                          ","2014-08-22 15:31:44.593"
"KHARIF","AGRICULTURE","Oilseeds","Groundnut (pea nut/mung phalli)","	Plant Protection	","caterpillar in groundnut","recommended for spray spray chlorpyriphos 2 ml / lit of water","TAMILNADU","ARIYALUR","JAYAMKONDAM                                       ","2014-08-22 15:38:31.837"
"KHARIF","HORTICULTURE","Vegetables","Bhindi(Okra/Ladysfinger)","Cultural Practices","varieties in bhendi","Recommended for varieties in bhendi MDU 1, Arka Anamika, Arka Abhay and Parbhani Kranti","TAMILNADU","ARIYALUR","T. PALUR                                          ","2014-08-22 15:44:30.710"
"KHARIF","AGRICULTURE","Oilseeds","Sesame (Gingelly/Til)/Sesamum","Market Information","market rate for sesame","Kallakurichi other 6374	- 8616 Rs/Quintal","TAMILNADU","ARIYALUR","SENDURAI                                          ","2014-08-22 15:58:38.530"
"KHARIF","AGRICULTURE","Others","Others","Weather","asking about weather details","Recommended for today rainy day","TAMILNADU","ARIYALUR","SENDURAI                                          ","2014-08-22 15:59:23.860"
"KHARIF","AGRICULTURE","Others","Others","Weather","ariyalur Weather report","raecommended for today rainy day in ariyalur","TAMILNADU","ARIYALUR","ARIYALUR                                          ","2014-08-22 16:03:33.040"
"KHARIF","AGRICULTURE","Others","Others","Training and Exposure Visits","contact to kvk dept","Recommended for contact to kvk dept number 04331 – 260335","TAMILNADU","ARIYALUR","THIRUMANUR                                        ","2014-08-22 16:18:48.250"
"KHARIF","AGRICULTURE","Pulses","Black Gram (urd bean)","	Plant Protection	","aphids in black gram","recommended for black gram aphids imidachloprid 1ml/liter of water","TAMILNADU","ARIYALUR","T. PALUR                                          ","2014-08-22 16:39:38.703"
"KHARIF","AGRICULTURE","Pulses","Black Gram (urd bean)","	Plant Protection	","cowpea mosaic virus in blackgram","recommended for spray monocrotophos 2ml+neem oil 3ml+teepol 1 ml/liter of water","TAMILNADU","ARIYALUR","JAYAMKONDAM                                       ","2014-08-22 16:50:03.540"
"KHARIF","AGRICULTURE","Pulses","Black Gram (urd bean)","	Plant Protection	","cowpea mosaic virus in blackgram","recommended for spray monocrotophos 2ml+neem oil 3ml+teepol 1 ml/liter of water","TAMILNADU","ARIYALUR","JAYAMKONDAM                                       ","2014-08-22 16:51:27.363"
"KHARIF","AGRICULTURE","Pulses","Black Gram (urd bean)","	Plant Protection	","cowpea mosaic virus in blackgram","recommended for spray monocrotophos 2ml+neem oil 3ml+teepol 1 ml/liter of water","TAMILNADU","ARIYALUR","JAYAMKONDAM                                       ","2014-08-22 16:51:28.093"
"KHARIF","AGRICULTURE","Pulses","Black Gram (urd bean)","	Plant Protection	","cowpea mosaic virus in blackgram","recommended for spray monocrotophos 2ml+neem oil 3ml+teepol 1 ml/liter of water","TAMILNADU","ARIYALUR","JAYAMKONDAM                                       ","2014-08-22 16:51:28.790"
"KHARIF","AGRICULTURE","Pulses","Black Gram (urd bean)","	Plant Protection	","cowpea mosaic virus in blackgram","recommended for spray monocrotophos 2ml+neem oil 3ml+teepol 1 ml/liter of water","TAMILNADU","ARIYALUR","JAYAMKONDAM                                       ","2014-08-22 16:51:29.357"
"KHARIF","AGRICULTURE","Pulses","Black Gram (urd bean)","	Plant Protection	","cowpea mosaic virus in blackgram","recommended for spray monocrotophos 2ml+neem oil 3ml+teepol 1 ml/liter of water","TAMILNADU","ARIYALUR","JAYAMKONDAM                                       ","2014-08-22 16:51:39.233"
"KHARIF","AGRICULTURE","Pulses","Black Gram (urd bean)","	Plant Protection	","cowpea mosaic virus in blackgram","recommended for spray monocrotophos 2ml+neem oil 3ml+teepol 1 ml/liter of water","TAMILNADU","ARIYALUR","JAYAMKONDAM                                       ","2014-08-22 16:51:44.997"
"KHARIF","AGRICULTURE","Pulses","Black Gram (urd bean)","	Plant Protection	","cowpea mosaic virus in blackgram","recommended for spray monocrotophos 2ml+neem oil 3ml+teepol 1 ml/liter of water","TAMILNADU","ARIYALUR","JAYAMKONDAM                                       ","2014-08-22 16:51:49.507"
"KHARIF","AGRICULTURE","Pulses","Black Gram (urd bean)","	Plant Protection	","cowpea mosaic virus in blackgram","recommended for spray monocrotophos 2ml+neem oil 3ml+teepol 1 ml/liter of water","TAMILNADU","ARIYALUR","JAYAMKONDAM                                       ","2014-08-22 16:51:51.160"
"KHARIF","AGRICULTURE","Sugar and Starch Crops","Sugarcane (Noble Cane)","Fertilizer Use and Availability","Top dressing fertilizer management for sugarcane","recommended for Top dressing fertilizer management for sugarcane Apply urea 80 kg + potash 25 kg + mn mixture 10 kg/ac","TAMILNADU","ARIYALUR","ANDIMADAM                                         ","2014-08-22 17:01:16.047"
"KHARIF","AGRICULTURE","Sugar and Starch Crops","Sugarcane (Noble Cane)","Fertilizer Use and Availability","Top dressing fertilizer management for sugarcane","recommended for Top dressing fertilizer management for sugarcane Apply urea 80 kg + potash 25 kg + mn mixture 10 kg/ac","TAMILNADU","ARIYALUR","ANDIMADAM                                         ","2014-08-22 17:01:44.603"
"KHARIF","AGRICULTURE","Sugar and Starch Crops","Sugarcane (Noble Cane)","Fertilizer Use and Availability","Top dressing fertilizer management for sugarcane","recommended for Top dressing fertilizer management for sugarcane Apply urea 80 kg + potash 25 kg + mn mixture 10 kg/ac","TAMILNADU","ARIYALUR","ANDIMADAM                                         ","2014-08-22 17:01:45.940"
"KHARIF","AGRICULTURE","Sugar and Starch Crops","Sugarcane (Noble Cane)","Fertilizer Use and Availability","Top dressing fertilizer management for sugarcane","recommended for Top dressing fertilizer management for sugarcane Apply urea 80 kg + potash 25 kg + mn mixture 10 kg/ac","TAMILNADU","ARIYALUR","ANDIMADAM                                         ","2014-08-22 17:01:46.797"
"KHARIF","AGRICULTURE","Sugar and Starch Crops","Sugarcane (Noble Cane)","Fertilizer Use and Availability","Top dressing fertilizer management for sugarcane","recommended for Top dressing fertilizer management for sugarcane Apply urea 80 kg + potash 25 kg + mn mixture 10 kg/ac","TAMILNADU","ARIYALUR","ANDIMADAM                                         ","2014-08-22 17:01:47.427"
"KHARIF","AGRICULTURE","Millets","Maize (Makka)","	Water Management	","water management in maize","Maize crop is sensitive to both moisture stress and excessive moisture, hence regulate irrigation according to the requirement. Ensure optimum moisture availability during the most critical phase (45 to 65 days after sowing); otherwise yield will be reduced by a considerable extent.","TAMILNADU","ARIYALUR","T. PALUR                                          ","2014-08-22 17:03:47.933"
"KHARIF","HORTICULTURE","Vegetables","Chillies","Cultural Practices","sowing season for chilli","Recommended for sowing season for chilli September- October","TAMILNADU","ARIYALUR","JAYAMKONDAM                                       ","2014-08-22 18:44:53.027"
"KHARIF","HORTICULTURE","Fruits","Mango","Fertilizer Use and Availability","Fertilizer management for mango","recommended for apply 400 gm urea +superphosphate 1.250 kg + potash 500 gm /tree","TAMILNADU","ARIYALUR","ARIYALUR                                          ","2014-08-22 18:58:58.430"
"KHARIF","HORTICULTURE","Vegetables","Onion","Cultural Practices","Sowing season for small onion","recommended for Sowing season for small onion is April – May and October – November","TAMILNADU","ARIYALUR","JAYAMKONDAM                                       ","2014-08-22 19:18:59.360"
"KHARIF","HORTICULTURE","Vegetables","Carrot","Field Preparation","Carrot Sowing","Mark the rows with spacing of 25 – 30 cm apart. Sow the seeds mixed with sand (one part of seed with 4 parts of sand).","TAMILNADU","ARIYALUR","SENDURAI                                          ","2014-08-23 08:33:28.303"
"KHARIF","HORTICULTURE","Vegetables","Carrot","Field Preparation","Carrot Sowing","Mark the rows with spacing of 25 – 30 cm apart. Sow the seeds mixed with sand (one part of seed with 4 parts of sand).","TAMILNADU","ARIYALUR","SENDURAI                                          ","2014-08-23 08:34:12.573"
"KHARIF","HORTICULTURE","Vegetables","Ash Gourd (Petha)","	Plant Protection	","ash gourd thrips","recommended for spray methyl dematan 1 ml / 1 litre of water","TAMILNADU","ARIYALUR","SENDURAI                                          ","2014-08-23 10:04:05.360"
"KHARIF","HORTICULTURE","Flowers","Jasmine","Seeds and Planting Material","planting season for jasmine","planting season for jasmine June to November","TAMILNADU","ARIYALUR","JAYAMKONDAM                                       ","2014-08-23 12:07:36.627"
"KHARIF","AGRICULTURE","Fiber Crops","Cotton (Kapas)","Market Information","market rate for cotton","Panruti	Other 3234 - 4869 Rs/Quintal","TAMILNADU","ARIYALUR","ARIYALUR                                          ","2014-08-23 12:08:09.790"
"KHARIF","AGRICULTURE","Cereals","Paddy (Dhan)","	Plant Protection	","paddy leaf folder","recommended for spray monocrotophos 2 ml / 1 litre of water","TAMILNADU","ARIYALUR","T. PALUR                                          ","2014-08-23 13:17:47.317"
