"Season","Sector","Category","Crop","QueryType","QueryText","KCCAns","StateName","DistrictName","BlockName","CreatedOn"
"JAYAD","AGRICULTURE","Cereals","Paddy (Dhan)","Fertilizer Use and Availability","top dressing fertilizer management paddy","apply 25 kg urea + 15 kg potash + 5 kg neemcake/ac","TAMILNADU","THIRUVARUR","MUTHUPETTAI                                       ","2014-08-01 09:03:52.000"
"JAYAD","AGRICULTURE","Beekeeping","Beekeeping","	Field Preparation	","apiculture department contact number","0422-6611214","TAMILNADU","THIRUVARUR","","2014-08-01 11:00:26.000"
"JAYAD","AGRICULTURE","Fiber Crops","Cotton (Kapas)","Fertilizer Use and Availability","cotton foliar spray","Spray DAP 20 gram /liter","TAMILNADU","THIRUVARUR","","2014-08-01 12:15:20.000"
"JAYAD","ANIMAL HUSBANDRY","Avian","Guineafowl","Animal Breeding","turkey egg availability","contact to namakal verterinary KVK 04286 – 266345","TAMILNADU","THIRUVARUR","THIRUVARUR                                        ","2014-08-01 12:39:10.000"
"JAYAD","AGRICULTURE","Cereals","Paddy (Dhan)","	Field Preparation	","rice seeds availability","contact to Krishi Vigyan Kendra , Needamangalam","TAMILNADU","THIRUVARUR","KOTTUR                                            ","2014-08-01 12:44:15.000"
"JAYAD","HORTICULTURE","Flowers","Jasmine","Market Information","market rate forjasmine","kumbakonam market:160-200/kg","TAMILNADU","THIRUVARUR","NIDAMANGALAM                                      ","2014-08-01 14:21:49.000"
"JAYAD","HORTICULTURE","Vegetables","Snake Gourd","Field Preparation","spacing of snake gourd crops","spacing of snake gourd is 2.5 x 2 m","TAMILNADU","THIRUVARUR","THIRUVARUR                                        ","2014-08-01 14:55:52.000"
"JAYAD","HORTICULTURE","Plantation Crops","Coconut","Market Information","coconut market information","coconut market information Rs.18/nut","TAMILNADU","THIRUVARUR","MANNARGUDI                                        ","2014-08-01 15:53:18.000"
"JAYAD","HORTICULTURE","Plantation Crops","Coconut","	Plant Protection	","Button shedding in coconut","recommended for Root feeding with TNAU coconut tonic 200 ml / tree","TAMILNADU","THIRUVARUR","KORADACHERRY                                      ","2014-08-01 16:48:53.000"
"JAYAD","AGRICULTURE","Cereals","Paddy (Dhan)","Fertilizer Use and Availability","top dressing for paddy","recommended for apply urea 25 kg + potash 15 kg + neem cake 5 kg+MN mixer 5kg/ac","TAMILNADU","THIRUVARUR","MUTHUPETTAI                                       ","2014-08-01 17:32:47.000"
"JAYAD","AGRICULTURE","Fiber Crops","Cotton (Kapas)","	Plant Protection	","cotton aphids","recommended for cotton aphid spray methyl demeton 2.5ml+ neem oil 3ml+ teepol 1ml/lit of water","TAMILNADU","THIRUVARUR","MANNARGUDI                                        ","2014-08-01 17:48:25.000"
"JAYAD","AGRICULTURE","Cereals","Paddy (Dhan)","Soil Testing","Asking about soil sample collection procedure details and soil testing laboratory contact number","recommended for Soil Testing lab, O/o Assistant Director of Agriculture, Big Mill Street, Thiruvarur. 610 001.G. Meena, 9791474922","TAMILNADU","THIRUVARUR","THIRUVARUR                                        ","2014-08-01 20:12:43.000"
"JAYAD","AGRICULTURE","Others","Others","Government Schemes","kvk contact number for needamangalam","phone number:04367-260666,261444","TAMILNADU","THIRUVARUR","","2014-08-02 12:46:19.000"
"JAYAD","AGRICULTURE","Fiber Crops","Cotton (Kapas)","	Plant Protection	","American boll worm in cotton","Recommended for spray quinalphos 2ml/liter of water","TAMILNADU","THIRUVARUR","KOTTUR                                            ","2014-08-02 15:18:32.000"
"JAYAD","AGRICULTURE","Cereals","Paddy (Dhan)","	Plant Protection	","stem borer in paddy","Recommended for spray Profenofos 2ml / lit","TAMILNADU","THIRUVARUR","NIDAMANGALAM                                      ","2014-08-02 15:28:31.000"
"JAYAD","AGRICULTURE","Cereals","Paddy (Dhan)","	Plant Protection	","weed management in paddy","recommended for spray 2,4 D sodium salt","TAMILNADU","THIRUVARUR","THIRUVARUR                                        ","2014-08-02 16:38:59.000"
"JAYAD","AGRICULTURE","Others","Others","Credit","Message need my mobile in english","recommended for as your request we are activated","TAMILNADU","THIRUVARUR","TIRUTTURAIPPUNDI                                  ","2014-08-02 17:54:53.000"
"JAYAD","AGRICULTURE","Sugar and Starch Crops","Tapioca (Cassava)","Fertilizer Use and Availability","Top dressing fertilizer management for tapioca","recommended Top dressing fertilizer management for tapioca apply urea 35 kg,+ potasah 75 kg / ac","TAMILNADU","THIRUVARUR","VALANGAIMAN                                       ","2014-08-03 06:13:25.000"
"JAYAD","HORTICULTURE","Vegetables","Brinjal","	Plant Protection	","brinjal white fly","recommended for spray spiromesifen 1 ml + neem oil 3 ml + teepol 1 ml / 1 litre of water","TAMILNADU","THIRUVARUR","MANNARGUDI                                        ","2014-08-03 07:47:39.000"
"JAYAD","AGRICULTURE","Cereals","Paddy (Dhan)","Fertilizer Use and Availability","fertiliser management in paddy","apply micro nutrients 5 kg / acre","TAMILNADU","THIRUVARUR","THIRUVARUR                                        ","2014-08-03 09:29:32.000"
"JAYAD","AGRICULTURE","Cereals","Paddy (Dhan)","	Plant Protection	","paddy brown plant hopper","recommended paddy brown plant hopper spray imidacloprid 2ml + neem oil 3ml+teepol 1ml/lit of water","TAMILNADU","THIRUVARUR","NIDAMANGALAM                                      ","2014-08-03 11:40:53.000"
"JAYAD","AGRICULTURE","Others","Others","Weather","weather detail in thiruvarur","have no rain in thiruvarur","TAMILNADU","THIRUVARUR","","2014-08-03 14:30:21.000"
"JAYAD","HORTICULTURE","Vegetables","Snake Gourd","Cultural Practices","snake gourd spacing.","2 X 1.5 m.","TAMILNADU","THIRUVARUR","THIRUVARUR                                        ","2014-08-03 18:22:53.000"
"JAYAD","AGRICULTURE","Cereals","Paddy (Dhan)","Bio-Pesticides and Bio-Fertilizers","preparation method of panjakaviya","recommended for preparation method of panjakaviya is Cow dung - 5 kg,Cow ghee - 1 kg,Cow Urine - 3 liters, Cow milk - 3 liters,Cow curd -2 liters,Tender coconut water - 3 liters,Jaggery - 3 kg,Well ripened poovan banana – 12 nos.","TAMILNADU","THIRUVARUR","THIRUVARUR                                        ","2014-08-03 18:43:31.000"
"JAYAD","HORTICULTURE","Flowers","Jasmine","Market Information","market price for jathimalli","recommended for market  price 370.00/Kg/Rs","TAMILNADU","THIRUVARUR","NIDAMANGALAM                                      ","2014-08-04 10:20:49.000"
"JAYAD","AGRICULTURE","Cereals","Paddy (Dhan)","Seeds","paddy variety IR 20 seeds availbility","recommended number for agriculture office in thiruvarur 04366 224150","TAMILNADU","THIRUVARUR","","2014-08-04 11:22:27.000"
"JAYAD","AGRICULTURE","Cereals","Paddy (Dhan)","Fertilizer Use and Availability","basal fertilizer for paddy","Recommended for apply DAP 50KG+ neem cake 10 kg+ zinc sulphate10kg +FYM 5 ton /acre","TAMILNADU","THIRUVARUR","MANNARGUDI                                        ","2014-08-04 12:41:54.000"
"JAYAD","AGRICULTURE","Fodder Crops","fodder sorghum","Cultural Practices","fodder sorghum seed availability","recommended to contact tnau seed center 0422 6611232","TAMILNADU","THIRUVARUR","THIRUVARUR                                        ","2014-08-04 13:28:02.000"
"JAYAD","AGRICULTURE","Cereals","Paddy (Dhan)","","paddy varieties","ir 20, adt 38,44,co 43, ponmani,white ponni.","TAMILNADU","THIRUVARUR","KOTTUR                                            ","2014-08-04 18:11:25.000"
"JAYAD","AGRICULTURE","Cereals","Paddy (Dhan)","Crop Insurance","paddy varieties","recommende forir 20, co 43, adt 38,44, white ponni.","TAMILNADU","THIRUVARUR","KODAVASAL                                         ","2014-08-04 18:42:20.000"
"JAYAD","AGRICULTURE","Cereals","Paddy (Dhan)","Fertilizer Use and Availability","ADT 50 paddy seed availability","recommended contact number to needamangalam KVK","TAMILNADU","THIRUVARUR","VALANGAIMAN                                       ","2014-08-04 18:44:23.000"
"JAYAD","AGRICULTURE","Pulses","Black Gram (urd bean)","Fertilizer Use and Availability","basal fertilizer management for black gram","recommended for basal fertilizer management for black gram vapply 10kg urea + super phosphate 62kg+ potash 8kg /ac","TAMILNADU","THIRUVARUR","THIRUVARUR                                        ","2014-08-04 19:48:07.000"
"JAYAD","HORTICULTURE","Vegetables","Brinjal","	Plant Protection	","ADT 50 paddy seed availability","recommended contact number to needamangalam KVK","TAMILNADU","THIRUVARUR","THIRUVARUR                                        ","2014-08-04 19:49:17.000"
"JAYAD","HORTICULTURE","Plantation Crops","Coconut","	Plant Protection	","coconut Stem bleeding disease","Recommended for The bark of the trunk should be removed in the bleeding area and Bordeaux paste should be applied in this area","TAMILNADU","THIRUVARUR","MANNARGUDI                                        ","2014-08-04 20:49:57.000"
"JAYAD","HORTICULTURE","Fruits","Banana","	Plant Protection	","Sigatoka leaf spot in banana","Recommended for spray carbendazim 2gm / lit","TAMILNADU","THIRUVARUR","","2014-08-04 20:59:11.000"
"JAYAD","AGRICULTURE","Cereals","Paddy (Dhan)","Fertilizer Use and Availability","paddy foliar application details","Recommended for apply urea 100gm + super 200gm + potash 100gm / tank","TAMILNADU","THIRUVARUR","KORADACHERRY                                      ","2014-08-05 11:06:49.000"
"JAYAD","AGRICULTURE","Cereals","Paddy (Dhan)","	Plant Protection	","top dressing for paddy","recommended for apply urea 25 kg + potash 15 kg + neem cake 5 kg+MN mixer 5kg/ac","TAMILNADU","THIRUVARUR","","2014-08-05 11:24:27.000"
"JAYAD","AGRICULTURE","Others","Others","Government Schemes","contact to Engineering dept","Recommended for contact to Engineering dept number  044 2766 3843 ","TAMILNADU","THIRUVARUR","","2014-08-05 14:47:46.000"
"JAYAD","HORTICULTURE","Fruits","Banana","	Plant Protection	","sucker treatment for banana","recommended for apply furadan 40gm/sucker","TAMILNADU","THIRUVARUR","MANNARGUDI                                        ","2014-08-05 15:06:20.000"
"JAYAD","HORTICULTURE","Fruits","Mango","Nutrient Management","mango fertilizer management","Recommended for apply urea 200gm + potash 300gm + super phosphate 200gm / tree","TAMILNADU","THIRUVARUR","NIDAMANGALAM                                      ","2014-08-05 19:15:25.000"
"JAYAD","HORTICULTURE","Plantation Crops","Coconut","Fertilizer Use and Availability","Coconut fertilizer management","recommended Coconut fertilizer management Apply urea 1/2kg, super phosphate 2kg, pottash 2 kg, neem cake 5kg, farm yard manure 50kg /tree/5year","TAMILNADU","THIRUVARUR","","2014-08-06 08:14:27.000"
"JAYAD","AGRICULTURE","Cereals","Paddy (Dhan)","Seeds","Tamil Nadu Rice Research Institute,Aduthurai","recommended contact 0435-2472108, 0435-2472098","TAMILNADU","THIRUVARUR","KOTTUR                                            ","2014-08-06 10:22:57.000"
"JAYAD","HORTICULTURE","Vegetables","Brinjal","	Plant Protection	","Mealy bug in brinjal","recommended for Mealy bug in brinjal  spray imidacloprid 2ml + neem oil 3ml+teepol 1ml/lit of water","TAMILNADU","THIRUVARUR","MANNARGUDI                                        ","2014-08-06 15:01:26.000"
"JAYAD","AGRICULTURE","Millets","Maize (Makka)","Fertilizer Use and Availability","maize top dressing fertilizer management","Recommended for apply urea 60kg / ac 30days after sowing","TAMILNADU","THIRUVARUR","KODAVASAL                                         ","2014-08-06 16:51:02.000"
"JAYAD","AGRICULTURE","Pulses","Black Gram (urd bean)","Seeds","Black gram sowing seasons","recommended for Black gram sowing season - Adipattam (June-August) , Puratasipattam (September-November), Rice fallows (January","TAMILNADU","THIRUVARUR","KOTTUR                                            ","2014-08-06 18:59:40.000"
"JAYAD","AGRICULTURE","Oilseeds","Sesame (Gingelly/Til)/Sesamum","Market Information","Alangudi sesame market rate","Recommended for Alangudi sesame market rate : 7800 - 8000 Rs./Quintal","TAMILNADU","THIRUVARUR","NIDAMANGALAM                                      ","2014-08-06 19:30:50.000"
"JAYAD","AGRICULTURE","Cereals","Paddy (Dhan)","Cultural Practices","sowing season for paddy","recommended for sowing season for paddy samba august","TAMILNADU","THIRUVARUR","","2014-08-07 10:11:43.000"
"JAYAD","HORTICULTURE","Condiments and Spices","Turmeric","Cultural Practices","turmeric season","recommended for sowing at may-june.","TAMILNADU","THIRUVARUR","MUTHUPETTAI                                       ","2014-08-07 10:31:25.000"
"JAYAD","AGRICULTURE","Cereals","Paddy (Dhan)","Seeds","seeds availability of paddy","recommended for contact 044-27885404 agricultural department","TAMILNADU","THIRUVARUR","KOTTUR                                            ","2014-08-07 10:44:50.000"
"JAYAD","HORTICULTURE","Fruits","Banana","	Plant Protection	","Sigatoka leaf spot in banana","Recommended for spray carbendazim 2gm / lit","TAMILNADU","THIRUVARUR","","2014-08-07 11:28:42.000"
"JAYAD","AGRICULTURE","Others","Others","Credit","Kisan credit card details","recommended for Explain & Contact bank manager","TAMILNADU","THIRUVARUR","","2014-08-07 11:54:48.000"
"JAYAD","HORTICULTURE","Vegetables","Brinjal","Fertilizer Use and Availability","basal fertilizer for brinjal","recommended basal fertilizer for brinjal apply urea 43kg +super 125 kg +potash 20kg /ac","TAMILNADU","THIRUVARUR","KORADACHERRY                                      ","2014-08-07 14:56:34.000"
"JAYAD","AGRICULTURE","Cereals","Paddy (Dhan)","	Plant Protection	","Weed management for wasteland","recommended spray glyphosate 10 ml and 20 g ammonium sulphate/litre of water.","TAMILNADU","THIRUVARUR","NIDAMANGALAM                                      ","2014-08-07 16:43:14.000"
"JAYAD","AGRICULTURE","Sugar and Starch Crops","Sugarcane (Noble Cane)","Fertilizer Use and Availability","foliar spray in sugarcane","apply micro nutrient 5kg/ac","TAMILNADU","THIRUVARUR","NIDAMANGALAM                                      ","2014-08-08 10:46:55.000"
"JAYAD","AGRICULTURE","Cereals","Paddy (Dhan)","Cultural Practices","paddy varieties","recommended for sowing adt 38,44,co 43,white ponni, ponmani.","TAMILNADU","THIRUVARUR","THIRUVARUR                                        ","2014-08-08 11:40:46.000"
"JAYAD","AGRICULTURE","Oilseeds","Sesame (Gingelly/Til)/Sesamum","Market Information","Sesame Market Rate","Recommended for Sesame Market Rate : 6561 - 9741 Rs./Quintal","TAMILNADU","THIRUVARUR","NIDAMANGALAM                                      ","2014-08-08 11:52:29.000"
"JAYAD","HORTICULTURE","Vegetables","Snake Gourd","Fertilizer Use and Availability","snake gourd foliar application details","Recommended for snake gourd foliar spray for 19:19:19 5 gm/lit.","TAMILNADU","THIRUVARUR","KORADACHERRY                                      ","2014-08-08 14:14:28.000"
"JAYAD","AGRICULTURE","Cereals","Paddy (Dhan)","	Plant Protection	","Rice tungro diesease","spray Imidacloprid 2ml / lit","TAMILNADU","THIRUVARUR","KORADACHERRY                                      ","2014-08-08 14:17:04.000"
"JAYAD","HORTICULTURE","Vegetables","Brinjal","	Plant Protection	","white fly in brinjal","recommended for spray Phosphamidon 2ml / lit","TAMILNADU","THIRUVARUR","MANNARGUDI                                        ","2014-08-08 16:53:14.000"
"JAYAD","HORTICULTURE","Vegetables","Snake Gourd","Fertilizer Use and Availability","snake gourd foliar application details","snake gourd foliar spray for 19:19:19 50 gm/tank","TAMILNADU","THIRUVARUR","KORADACHERRY                                      ","2014-08-08 18:42:19.000"
"JAYAD","HORTICULTURE","Vegetables","Bitter Gourd","	Plant Protection	","bitter gourd foliar application details","recommended for foliar application for ethrel 2.5ml/tank","TAMILNADU","THIRUVARUR","MANNARGUDI                                        ","2014-08-09 07:24:42.000"
"JAYAD","HORTICULTURE","Vegetables","Bitter Gourd","Fertilizer Use and Availability","foliyar spray in bittergourd","recommended for Spray 19:19:19 @5gm/lit","TAMILNADU","THIRUVARUR","MANNARGUDI                                        ","2014-08-09 07:39:58.000"
"JAYAD","HORTICULTURE","Flowers","Jasmine","Nutrient Management","jasmine top dressing","recommended for apply urea 120 g + super phosphate 350 g +potash 200 g/ plant /year.","TAMILNADU","THIRUVARUR","MANNARGUDI                                        ","2014-08-09 12:36:14.000"
"JAYAD","HORTICULTURE","Vegetables","Brinjal","Fertilizer Use and Availability","flower drop in brinjal","recommended for Spray planofix - 5 ml / 10 lit of water","TAMILNADU","THIRUVARUR","MANNARGUDI                                        ","2014-08-09 12:46:58.000"
"JAYAD","AGRICULTURE","Others","Others","Weather","planting season for mulbery","recommemded for Plant during rainy season","TAMILNADU","THIRUVARUR","TIRUTTURAIPPUNDI                                  ","2014-08-09 14:59:44.000"
"JAYAD","AGRICULTURE","Cereals","Paddy (Dhan)","Nutrient Management","paddy top fertilizer management","apply ammonium sulfate 30 kilo / acre","TAMILNADU","THIRUVARUR","TIRUTTURAIPPUNDI                                  ","2014-08-09 17:45:25.000"
"JAYAD","AGRICULTURE","Cereals","Paddy (Dhan)","Fertilizer Use and Availability","paddy top dressing fertilizer management","Recommended for apply urea 25 kg + potash 15 kg + neem cake 5 kg/ac","TAMILNADU","THIRUVARUR","TIRUTTURAIPPUNDI                                  ","2014-08-09 17:50:03.000"
"JAYAD","AGRICULTURE","Cereals","Paddy (Dhan)","	Plant Protection	","rodent management in paddy field","recommended for zinc phosphide mixed with eatables","TAMILNADU","THIRUVARUR","THIRUVARUR                                        ","2014-08-09 18:17:35.000"
"JAYAD","AGRICULTURE","Cereals","Paddy (Dhan)","	Plant Protection	","Leaf folder in paddy","recommended for Leaf folder in paddy Spray chlorprriphos 2 ml /litre","TAMILNADU","THIRUVARUR","THIRUVARUR                                        ","2014-08-09 20:46:43.000"
"JAYAD","AGRICULTURE","Cereals","Paddy (Dhan)","Fertilizer Use and Availability","Paddy nursery fertilizer","recommended for apply DAP 2kg/cent","TAMILNADU","THIRUVARUR","THIRUVARUR                                        ","2014-08-10 11:00:39.000"
"JAYAD","AGRICULTURE","Cereals","Paddy (Dhan)","	Plant Protection	","paddy blast","Spray tricyclozole  2 gm /lit","TAMILNADU","THIRUVARUR","KOTTUR                                            ","2014-08-10 11:32:31.000"
"JAYAD","AGRICULTURE","Cereals","Paddy (Dhan)","Cultural Practices","varieties in paddy","Recommended for varieties in paddy White Ponni, CO 43, CR 1009, ADT 38, TRY 1*, TRY 3*, ADT (R) 44, CORH 4, CO (R) 48, CO (R) 49, CO (R) 50, ADT (R) 49,TNAU Rice ADT 50, Swarna sub1","TAMILNADU","THIRUVARUR","KORADACHERRY                                      ","2014-08-10 17:00:54.000"
"JAYAD","HORTICULTURE","Fruits","Mango","	Plant Protection	","stem borer of Mango control details","recommended for apply Hook out the grub from the bore hole - apply monocrotophos 10 to 20 ml/ hole","TAMILNADU","THIRUVARUR","KOTTUR                                            ","2014-08-10 18:09:30.000"
"JAYAD","HORTICULTURE","Vegetables","Brinjal","	Plant Protection	","Powdery mildew in brinjal","recommended for spray Carbendazim 2gm / lit of water","TAMILNADU","THIRUVARUR","MUTHUPETTAI                                       ","2014-08-10 18:20:47.000"
"JAYAD","AGRICULTURE","Cereals","Paddy (Dhan)","Seeds","varieties of paddy","I.White Ponni, CO 43, CR 1009, ADT 38, TRY 1*, TRY 3*, ADT (R) 44, CORH 4, CO (R) 48, CO (R) 49, CO (R) 50, ADT (R) 49,TNAU Rice ADT 50, Swarna sub1","TAMILNADU","THIRUVARUR","NIDAMANGALAM                                      ","2014-08-11 09:05:21.000"
"JAYAD","HORTICULTURE","Plantation Crops","Coconut","	Plant Protection	","rhinoceros beetle in coconut","recommended for apply neem seed powder 50 gm + 100 gm sand","TAMILNADU","THIRUVARUR","NIDAMANGALAM                                      ","2014-08-11 11:16:53.000"
"JAYAD","AGRICULTURE","Others","Others","Weather","weather details for namakkal","recommended for weather details for namakkal today have rain","TAMILNADU","THIRUVARUR","MANNARGUDI                                        ","2014-08-11 16:15:37.000"
"KHARIF","AGRICULTURE","Others","Others","Training and Exposure Visits","kvk contact number","recommeded for 04364-260666 kvk","TAMILNADU","THIRUVARUR","MANNARGUDI                                        ","2014-08-19 16:23:58.800"
"KHARIF","HORTICULTURE","Vegetables","Brinjal","	Plant Protection	","Mealy bug in brinjal","recommended for Mealy bug in brinjal Spray profenophos 25 EC 2 ml + acephate 2 ml / lit","TAMILNADU","THIRUVARUR","NIDAMANGALAM                                      ","2014-08-19 17:42:08.557"
"KHARIF","AGRICULTURE","Cereals","Paddy (Dhan)","	Plant Protection	","paddy stem borer.","recommended for spray cartap hydrochloraide 2 g/lit.","TAMILNADU","THIRUVARUR","NIDAMANGALAM                                      ","2014-08-19 20:09:01.420"
"KHARIF","AGRICULTURE","Others","Others","Cultural Practices","forestry extension centre contact no.","recommended 0436-2292989 number.","TAMILNADU","THIRUVARUR","NIDAMANGALAM                                      ","2014-08-19 22:01:46.147"
"KHARIF","AGRICULTURE","Others","Others","Cultural Practices","forestry extension centre contact no.","recommended 0436-2292989 number.","TAMILNADU","THIRUVARUR","NIDAMANGALAM                                      ","2014-08-19 22:02:50.603"
"KHARIF","AGRICULTURE","Others","Others","Government Schemes","TNPL contact number","recommended contact number for TNPL 94425 - 91411","TAMILNADU","THIRUVARUR","VALANGAIMAN                                       ","2014-08-20 08:01:47.320"
"JAYAD","AGRICULTURE","Cereals","Paddy (Dhan)","Seeds","sowing season for paddy","recommended sowing season for paddy is aug","TAMILNADU","THIRUVARUR","THIRUVARUR                                        ","2014-08-20 08:07:45.557"
"KHARIF","AGRICULTURE","Cereals","Paddy (Dhan)","Fertilizer Use and Availability","top dressing for paddy","recommended for apply urea 25kg +potash 15kg /ac","TAMILNADU","THIRUVARUR","NANNILAM                                          ","2014-08-20 08:12:14.413"
"KHARIF","AGRICULTURE","Fiber Crops","Cotton (Kapas)","Fertilizer Use and Availability","foliar spray in cotton","recommended for spray cottonplus 2kg/ac/lit","TAMILNADU","THIRUVARUR","VALANGAIMAN                                       ","2014-08-20 09:09:20.760"
"KHARIF","HORTICULTURE","Fruits","Acid Lime","Fertilizer Use and Availability","citru fertilizer management","Recommended for apply 200 gm urea + 100gm super + 100gm potash /ac","TAMILNADU","THIRUVARUR","MANNARGUDI                                        ","2014-08-20 09:32:24.830"
"KHARIF","HORTICULTURE","Vegetables","Lab Lab","	Plant Protection	","leaf minor in lablab","recommended for spray neem oil","TAMILNADU","THIRUVARUR","MANNARGUDI                                        ","2014-08-20 09:41:56.747"
"KHARIF","AGRICULTURE","Cereals","Paddy (Dhan)","Soil Testing","thanjavur soil testing contact","recommended for 9443846697 soil testing","TAMILNADU","THIRUVARUR","THIRUVARUR                                        ","2014-08-20 12:44:22.350"
"KHARIF","HORTICULTURE","Plantation Crops","Coconut","Market Information","coconut market rate","recommended big 18, small-12.","TAMILNADU","THIRUVARUR","NIDAMANGALAM                                      ","2014-08-20 14:55:02.250"
"KHARIF","AGRICULTURE","Cereals","Paddy (Dhan)","Nutrient Management","paddy nursery fertilizer management","Recommended for apply DAP 2kg / ac","TAMILNADU","THIRUVARUR","KODAVASAL                                         ","2014-08-20 15:14:29.973"
"KHARIF","AGRICULTURE","Cereals","Paddy (Dhan)","Nutrient Management","paddy basal fertilizer management","Recommended for apply DAP 50 kg + zinc sulphate 10 kg + neem cake 10kg + FYM 10ton /ac","TAMILNADU","THIRUVARUR","NANNILAM                                          ","2014-08-20 16:31:37.520"
"KHARIF","AGRICULTURE","Others","Others","Government Schemes","contact to Veterinary dept","Recommended for contact to Veterinary dept number 04366 226263","TAMILNADU","THIRUVARUR","NIDAMANGALAM                                      ","2014-08-20 19:29:25.433"
"KHARIF","AGRICULTURE","Cereals","Paddy (Dhan)","Fertilizer Use and Availability","basal fertiliser for paddy nursery","apply DAP 1.5kg/cent","TAMILNADU","THIRUVARUR","NANNILAM                                          ","2014-08-20 20:53:48.117"
"KHARIF","HORTICULTURE","Condiments and Spices","Ginger","	Plant Protection	","leaf curl in Ginger","Recommended for methyldemeton 2ml / lit","TAMILNADU","THIRUVARUR","NIDAMANGALAM                                      ","2014-08-20 21:46:33.460"
"KHARIF","AGRICULTURE","Cereals","Paddy (Dhan)","Nutrient Management","paddy basal fertilizer management","Recommended for apply DAP 50 kg + zinc sulphate 10 kg + neem cake 10kg + FYM 10ton /ac","TAMILNADU","THIRUVARUR","NANNILAM                                          ","2014-08-20 22:15:23.880"
"KHARIF","AGRICULTURE","Cereals","Paddy (Dhan)","Seeds","Paddy late-samba variety","recommended for Late Samba/Thaladi  (Sep - Oct)  ADT 38, ADT 39,  ADT(R) 46, CORH 4, CO (R) 48,CO (R) 49, CO (R) 50, ADT (R) 49","TAMILNADU","THIRUVARUR","VALANGAIMAN                                       ","2014-08-21 08:22:28.770"
"KHARIF","AGRICULTURE","Cereals","Paddy (Dhan)","	Plant Protection	","weed management for paddy","recommended spray for pendimethalinn 800ml/ac","TAMILNADU","THIRUVARUR","KORADACHERRY                                      ","2014-08-21 09:31:29.023"
