"Season","Sector","Category","Crop","QueryType","QueryText","KCCAns","StateName","DistrictName","BlockName","CreatedOn"
"KHARIF","AGRICULTURE","Cereals","Paddy (Dhan)","Fertilizer Use and Availability","basal fertilizer for paddy nursery","recommended for apply DAP 1.5kg/cent","TAMILNADU","THIRUVARUR","KODAVASAL                                         ","2014-08-21 09:37:09.107"
"KHARIF","AGRICULTURE","Cereals","Paddy (Dhan)","Seeds","ADT50 paddy seed availability","recommended contact number to The Programme Coordinator, KVK,Needamangalam – 614 404.Ph.: 04367 – 261444","TAMILNADU","THIRUVARUR","MANNARGUDI                                        ","2014-08-21 09:56:22.627"
"KHARIF","AGRICULTURE","Cereals","Paddy (Dhan)","Seeds","ADT50 paddy seed availability","recommended contact number to The Programme Coordinator, KVK,Needamangalam – 614 404.Ph.: 04367 – 261444","TAMILNADU","THIRUVARUR","MANNARGUDI                                        ","2014-08-21 09:56:55.560"
"KHARIF","AGRICULTURE","Pulses","Black Gram (urd bean)","Nutrient Management","foliar spray in blackgram","recommended for spray pulse wonder 2kg/ac/lit","TAMILNADU","THIRUVARUR","KODAVASAL                                         ","2014-08-21 10:54:35.287"
"KHARIF","AGRICULTURE","Millets","Maize (Makka)","Market Information","maize market rate","recommended as Rs1349-1418/quintal.","TAMILNADU","THIRUVARUR","NIDAMANGALAM                                      ","2014-08-21 13:38:26.443"
"KHARIF","AGRICULTURE","Cereals","Paddy (Dhan)","Cultural Practices","paddy nursery stage.","recommended  for 25-30 days.","TAMILNADU","THIRUVARUR","KORADACHERRY                                      ","2014-08-21 13:47:56.677"
"KHARIF","AGRICULTURE","Cereals","Paddy (Dhan)","Fertilizer Use and Availability","paddy nursery fertilizer management","Recommended for apply DAP 2kg / ac","TAMILNADU","THIRUVARUR","THIRUVARUR                                        ","2014-08-21 15:58:09.127"
"KHARIF","AGRICULTURE","Cereals","Paddy (Dhan)","Crop Insurance","paddy varieties","recommended for White Ponni, CO 43, CR 1009, ADT 38, TRY 1*, TRY 3*, ADT (R) 44, CORH 4, CO (R) 48, CO (R) 49, CO (R) 50, ADT (R) 49,TNAU Rice ADT 50.","TAMILNADU","THIRUVARUR","KOTTUR                                            ","2014-08-21 16:59:31.093"
"KHARIF","AGRICULTURE","Cereals","Paddy (Dhan)","	Plant Protection	","weeds control in paddy","Recommended for spray pendimethalin 400gm / ac on 5 days after sowing","TAMILNADU","THIRUVARUR","VALANGAIMAN                                       ","2014-08-21 17:08:50.817"
"KHARIF","HORTICULTURE","Plantation Crops","Coconut","Nutrient Management","coconut boron deficiency","recommended for apply borox 200 g/tree.","TAMILNADU","THIRUVARUR","KODAVASAL                                         ","2014-08-21 17:26:44.970"
"KHARIF","HORTICULTURE","Vegetables","Brinjal","	Plant Protection	","ant control in brinjal field","recommended spray for chlorpyriphos 2ml+ imidachlopride 2ml+neemoil 2ml+teepol 1ml/lit of water","TAMILNADU","THIRUVARUR","MANNARGUDI                                        ","2014-08-22 07:21:42.117"
"KHARIF","AGRICULTURE","Cereals","Paddy (Dhan)","Nutrient Management","top dressing for paddy","recommended for apply urea 25kg +potash 15kg /ac","TAMILNADU","THIRUVARUR","NIDAMANGALAM                                      ","2014-08-22 08:56:14.343"
"KHARIF","AGRICULTURE","Others","Others","Government Schemes","Solar pump system subsidy","recommended number for agriculture engineering office is 04366 241 577","TAMILNADU","THIRUVARUR","KODAVASAL                                         ","2014-08-22 11:57:48.290"
"KHARIF","FISHERIES","Inland","Brackish","Fishery Nutrition","asking about fishery farm details","Recommended for Assistant Director of Fisheries, (Inland) No.20/3, Sivam Nagar, Panagal Salai, AVN Colony, Thiruvarur contact no. 04366 - 224140","TAMILNADU","THIRUVARUR","NANNILAM                                          ","2014-08-22 13:06:03.430"
"KHARIF","HORTICULTURE","Plantation Crops","Coconut","Fertilizer Use and Availability","fertilizer management for coconut","recommended for apply 1.300 kg urea + 2 kg superphosphate + 2 kg potash + 5 kg neem cake + 50 kg FYM + 1 kg micro nutrient /tree /year on two split","TAMILNADU","THIRUVARUR","MANNARGUDI                                        ","2014-08-22 15:18:22.740"
"KHARIF","AGRICULTURE","Others","Others","Soil Testing","Asking about soil sample collection procedure details","recommended for Soil Testing lab, O/o Assistant Director of Agriculture, Big Mill Street, Thiruvarur. 610 001.","TAMILNADU","THIRUVARUR","NANNILAM                                          ","2014-08-22 16:30:29.307"
"KHARIF","AGRICULTURE","Cereals","Paddy (Dhan)","	Plant Protection	","Brown Plant hopper in paddy","recommended for Spray imidaclopride 2 ml/lit","TAMILNADU","THIRUVARUR","MANNARGUDI                                        ","2014-08-22 17:34:34.907"
"KHARIF","AGRICULTURE","Cereals","Paddy (Dhan)","Fertilizer Use and Availability","paddy basal fertilizer management","Recommended for apply DAP 50 kg + zinc sulphate 10 kg + neem cake 10kg + FYM 10ton /ac","TAMILNADU","THIRUVARUR","MANNARGUDI                                        ","2014-08-22 18:12:22.853"
"KHARIF","HORTICULTURE","Plantation Crops","Coconut","Market Information","copra market rate","recommended for copra market rate:10529-11089/quintal","TAMILNADU","THIRUVARUR","NIDAMANGALAM                                      ","2014-08-22 18:55:10.570"
"KHARIF","HORTICULTURE","Fruits","Guava","	Plant Protection	","mealy bug in guava","recommended for mealy bug in guava spray imidacloprid 2 ml / lit of water.","TAMILNADU","THIRUVARUR","KORADACHERRY                                      ","2014-08-22 19:21:27.917"
"KHARIF","AGRICULTURE","Cereals","Paddy (Dhan)","Fertilizer Use and Availability","top dressing fertilizer management paddy","recommended for top dressing fertilizer management paddy apply 25 kg urea + 15 kg potash + 5 kg neemcake/ac","TAMILNADU","THIRUVARUR","KOTTUR                                            ","2014-08-22 20:25:42.600"
"KHARIF","AGRICULTURE","Cereals","Paddy (Dhan)","	Plant Protection	","paddy stem borer","recommended for paddy stem borer  Spray quinalphos2ml/l","TAMILNADU","THIRUVARUR","THIRUVARUR                                        ","2014-08-22 21:58:29.647"
"KHARIF","AGRICULTURE","Cereals","Paddy (Dhan)","	Plant Protection	","weed management in diret sowing paddy field","reommended spray for SOFIT 180gm/ac","TAMILNADU","THIRUVARUR","MANNARGUDI                                        ","2014-08-23 07:57:16.453"
"KHARIF","HORTICULTURE","Vegetables","Brinjal","Nutrient Management","brinjal top dressing fertilizer management","Recommended for apply urea 42kg / ac","TAMILNADU","THIRUVARUR","MANNARGUDI                                        ","2014-08-23 08:19:42.517"
"KHARIF","AGRICULTURE","Others","Others","Government Schemes","asking about kisan credit card details","Recommended contact to nationalized bank","TAMILNADU","THIRUVARUR","MANNARGUDI                                        ","2014-08-23 08:33:10.537"
"KHARIF","HORTICULTURE","Plantation Crops","Coconut","Soil Testing","about soil testng lab address","Regulated market complex , ADA office upstair , Thiruvarur – 610 001","TAMILNADU","THIRUVARUR","MANNARGUDI                                        ","2014-08-23 09:25:57.387"
"KHARIF","AGRICULTURE","Cereals","Paddy (Dhan)","Nutrient Management","paddy top dressing fertilizer management","Recommended for apply urea 25 kg + potash 15 kg + neem cake 5 kg/ac","TAMILNADU","THIRUVARUR","NANNILAM                                          ","2014-08-23 10:06:04.903"
"KHARIF","HORTICULTURE","Plantation Crops","Coconut","Nutrient Management","top dressing for coconut","recommended frtilzer for urea 650gm+potash 1kg+SSP 1kg+neemcake 2.5kg+FYM 25kg/tree","TAMILNADU","THIRUVARUR","VALANGAIMAN                                       ","2014-08-23 10:49:01.250"
"KHARIF","AGRICULTURE","Cereals","Paddy (Dhan)","Training and Exposure Visits","late samba varieties",".White Ponni, ADT 39, TRY 1*, TRY 3*, ADT (R)46,CO (R) 48, CO (R) 49, CO (R) 50, ADT (R) 49","TAMILNADU","THIRUVARUR","KORADACHERRY                                      ","2014-08-23 11:12:04.047"
"KHARIF","HORTICULTURE","Fruits","Mango","	Plant Protection	","Mango hoppers","RECOMMENDED FOR Spray imidaclopride 2 ml/lit","TAMILNADU","THIRUVARUR","TIRUTTURAIPPUNDI                                  ","2014-08-23 11:39:05.487"
"KHARIF","AGRICULTURE","Pulses","Black Gram (urd bean)","	Plant Protection	","black gram season and variety details","Recommended for black gram season : june - august and variety : VBN (Bg) 4, VBN(Bg) 5, VBN 7","TAMILNADU","THIRUVARUR","MANNARGUDI                                        ","2014-08-23 11:44:02.287"
"KHARIF","AGRICULTURE","Cereals","Paddy (Dhan)","Nutrient Management","paddy nursery fertilizer management","Recommended for apply DAP 2kg / ac","TAMILNADU","THIRUVARUR","KOTTUR                                            ","2014-08-23 13:07:34.760"
"KHARIF","AGRICULTURE","Others","Others","Weather","thiruvarur Weather report","recommended for today rainy day in thiruvarur","TAMILNADU","THIRUVARUR","KORADACHERRY                                      ","2014-08-23 16:06:23.680"
"KHARIF","AGRICULTURE","Cereals","Paddy (Dhan)","Market Information","paddy market price","recommended for price 1500/kg","TAMILNADU","THIRUVARUR","KODAVASAL                                         ","2014-08-23 17:16:48.797"
"KHARIF","AGRICULTURE","Cereals","Paddy (Dhan)","Seeds","paddy varieties for thiruvarur","recommended for paddy varieties are ADT 38, ADT 39, TRY 1*, TRY 3*, ADT (R) 46, ADT (R) 49, CO (R) 48, CO (R) 49, CO (R) 50","TAMILNADU","THIRUVARUR","MANNARGUDI                                        ","2014-08-23 17:22:43.153"
"KHARIF","AGRICULTURE","Cereals","Paddy (Dhan)","Fertilizer Use and Availability","paddy top dressing fertilizer management","Recommended for apply urea 25 kg + potash 15 kg + neem cake 5 kg/ac","TAMILNADU","THIRUVARUR","VALANGAIMAN                                       ","2014-08-23 17:28:22.307"
"KHARIF","AGRICULTURE","Cereals","Paddy (Dhan)","Seeds","co 50 seeds availability","recommended number for agriculture office 04362-267680","TAMILNADU","THIRUVARUR","VALANGAIMAN                                       ","2014-08-23 18:57:30.730"
"KHARIF","AGRICULTURE","Others","Others","Agriculture Mechanization","drum seeder availability","recommended to TNAU farm management 0422-6611257","TAMILNADU","THIRUVARUR","KORADACHERRY                                      ","2014-08-23 19:43:25.830"
"KHARIF","AGRICULTURE","Cereals","Paddy (Dhan)","Fertilizer Use and Availability","paddy basal fertilizer management","Recommended for apply DAP 50 kg + zinc sulphate 10 kg + neem cake 10kg + FYM 10ton /ac","TAMILNADU","THIRUVARUR","NANNILAM                                          ","2014-08-23 19:49:30.637"
"KHARIF","AGRICULTURE","Cereals","Paddy (Dhan)","Fertilizer Use and Availability","paddy basal fertilizer management","Recommended for apply DAP 50 kg + zinc sulphate 10 kg + neem cake 10kg + FYM 10ton /ac","TAMILNADU","THIRUVARUR","NANNILAM                                          ","2014-08-23 19:50:55.063"
"KHARIF","AGRICULTURE","Cereals","Paddy (Dhan)","Seeds","total duration of paddy variety cr 1009","recommended for cr 1009 total duration of paddy is 155 - 160 days","TAMILNADU","THIRUVARUR","NANNILAM                                          ","2014-08-23 20:19:35.787"
"KHARIF","AGRICULTURE","Cereals","Paddy (Dhan)","	Plant Protection	","Paddy stem borer","recommended for Paddy stem borer Spray quinalphos 2ml/litre","TAMILNADU","THIRUVARUR","MANNARGUDI                                        ","2014-08-23 20:27:52.563"
"KHARIF","AGRICULTURE","Cereals","Paddy (Dhan)","Fertilizer Use and Availability","Top dressing fertilizer management  for paddy","Recommended for apply urea 25 kg + potash 15 kg /ac","TAMILNADU","THIRUVARUR","THIRUVARUR                                        ","2014-08-23 21:19:51.887"
"KHARIF","AGRICULTURE","Cereals","Paddy (Dhan)","Fertilizer Use and Availability","Paddy basal fertilizer","recommended for Paddy basal fertilizer  Apply DAP 50 kg + zinc sulphate 15 kg/ac+neem cake 10kg/ac","TAMILNADU","THIRUVARUR","KODAVASAL                                         ","2014-08-24 10:30:23.320"
"KHARIF","AGRICULTURE","Cereals","Paddy (Dhan)","Fertilizer Use and Availability","Paddy nursery fertilizer","recommended for Paddy nursery fertilizer apply DAP 2kg/cent","TAMILNADU","THIRUVARUR","KODAVASAL                                         ","2014-08-24 12:30:06.057"
"KHARIF","AGRICULTURE","Others","Others","Seeds","planting spacing of teak","recommended for planting spacing of teak is 1.8x1.8 m","TAMILNADU","THIRUVARUR","NANNILAM                                          ","2014-08-24 14:44:20.763"
"KHARIF","AGRICULTURE","Others","Others","Weather","asking about weather report","Recommended for today no rain","TAMILNADU","THIRUVARUR","MANNARGUDI                                        ","2014-08-24 15:18:00.540"
"KHARIF","AGRICULTURE","Cereals","Paddy (Dhan)","Cultural Practices","Pre emergence Weed control in paddy","Recommended for Apply Pendimethalin 500 ml + 20 kg/ac","TAMILNADU","THIRUVARUR","THIRUVARUR                                        ","2014-08-24 15:18:52.220"
"KHARIF","FISHERIES","Inland","Fresh Water","Fish Fingerling Production","fisheries department no of thiruvarur","recommended number for thiruvarur fisheries department 04366 224140","TAMILNADU","THIRUVARUR","NIDAMANGALAM                                      ","2014-08-24 17:10:51.643"
"KHARIF","AGRICULTURE","Cereals","Paddy (Dhan)","	Plant Protection	","Paddy stem borer","recommended for Spray quinalphos 2ml/litre of water","TAMILNADU","THIRUVARUR","MANNARGUDI                                        ","2014-08-24 18:24:57.137"
"KHARIF","HORTICULTURE","Vegetables","Snake Gourd","	Plant Protection	","fruit fly in snake gourd.","recommended for spray fenthion 2 ml/lit.","TAMILNADU","THIRUVARUR","MANNARGUDI                                        ","2014-08-24 18:44:29.820"
"KHARIF","AGRICULTURE","Cereals","Paddy (Dhan)","Fertilizer Use and Availability","Paddy nursery fertilizer","Recommended for Apply DAP 2kg/cent.","TAMILNADU","THIRUVARUR","MANNARGUDI                                        ","2014-08-24 18:49:47.570"
"KHARIF","AGRICULTURE","Others","Others","Weather","asking about weather report","Recommended for today no rain","TAMILNADU","THIRUVARUR","MANNARGUDI                                        ","2014-08-24 19:23:40.477"
"KHARIF","AGRICULTURE","Cereals","Paddy (Dhan)","Seeds","paddy varieties for Tiruvarur","recommended for paddy varieties are ADT 38, ADT 39, TRY 1*, TRY 3*, ADT (R) 46, ADT (R) 49, CO (R) 48, CO (R) 49, CO (R) 50","TAMILNADU","THIRUVARUR","THIRUVARUR                                        ","2014-08-24 20:51:49.837"
"KHARIF","AGRICULTURE","Cereals","Paddy (Dhan)","Soil Health Card","weed management in direct paddy sowing","Apply pendimethalin 400gm/ac on 5 days after sowing on the day of receipt of soaking rain followed by one hand weeding on 30 to 35 days after sowing","TAMILNADU","THIRUVARUR","THIRUVARUR                                        ","2014-08-25 06:32:19.910"
"KHARIF","AGRICULTURE","Cereals","Paddy (Dhan)","Fertilizer Use and Availability","Paddy nursery fertilizer","recommended for Paddy nursery fertilizer apply DAP 2kg/cent","TAMILNADU","THIRUVARUR","NANNILAM                                          ","2014-08-25 07:29:58.180"
"KHARIF","HORTICULTURE","Vegetables","Bitter Gourd","	Plant Protection	","fruit fly in bittergourd","recommended for spray malathion 2ml/lit","TAMILNADU","THIRUVARUR","MANNARGUDI                                        ","2014-08-25 11:24:37.983"
"KHARIF","HORTICULTURE","Fruits","Mango","Post Harvest Management (Cleaning, Grading, Packaging, Food Processing, Cool Chain etc.)","post harvest departmet contct no.","recommended 0422-6611268 number to contact post harvest department.","TAMILNADU","THIRUVARUR","KOTTUR                                            ","2014-08-25 12:34:34.130"
"KHARIF","HORTICULTURE","Vegetables","Amaranthus/Grain Amaranthus","Market Information","amaranthus seed availability","Department of Vegetable Crops, TNAU, Coimbatore-3 0422-6611283,Mobile:99944 25720","TAMILNADU","THIRUVARUR","THIRUVARUR                                        ","2014-08-25 13:06:33.960"
"KHARIF","AGRICULTURE","Cereals","Paddy (Dhan)","Cultural Practices","duration for paddy Swarna Sub","Recommended for duration for paddy Swarna Sub 150 days","TAMILNADU","THIRUVARUR","TIRUTTURAIPPUNDI                                  ","2014-08-25 13:42:57.020"
"KHARIF","AGRICULTURE","Cereals","Paddy (Dhan)","	Plant Protection	","Pre emergence Weed control in paddy","recommended for Apply Pendimethalin 500 ml + 20 kg/ac","TAMILNADU","THIRUVARUR","KOTTUR                                            ","2014-08-25 15:43:31.553"
"KHARIF","AGRICULTURE","Others","Others","Credit","Message need my mobile in english","recommended for as your request we are activated","TAMILNADU","THIRUVARUR","VALANGAIMAN                                       ","2014-08-25 16:01:19.310"
"KHARIF","AGRICULTURE","Others","Others","Weather","Weather details for tiruvarur district","Recommended for weather report today no rain","TAMILNADU","THIRUVARUR","KORADACHERRY                                      ","2014-08-25 16:25:11.750"
"KHARIF","AGRICULTURE","Cereals","Paddy (Dhan)","Cultural Practices","sowing season for paddy","recommended for paddy  season ; Thaladi (Sep -Oct)","TAMILNADU","THIRUVARUR","KODAVASAL                                         ","2014-08-25 17:04:52.837"
"KHARIF","AGRICULTURE","Cereals","Paddy (Dhan)","	Plant Protection	","Seed treatment for paddy","recommended for Treat the seeds with Pseudomonas fluorescens 10g/kg of seed","TAMILNADU","THIRUVARUR","TIRUTTURAIPPUNDI                                  ","2014-08-25 17:24:50.493"
"KHARIF","AGRICULTURE","Cereals","Paddy (Dhan)","Seeds","total duration of BPT 5204","recommended for total duration of BPT 5204 is 150 days","TAMILNADU","THIRUVARUR","KODAVASAL                                         ","2014-08-25 17:31:29.737"
"KHARIF","AGRICULTURE","Cereals","Paddy (Dhan)","Soil Health Card","paddy weed management","recommended for piritalaclore 300gm/acre","TAMILNADU","THIRUVARUR","MUTHUPETTAI                                       ","2014-08-25 18:17:38.700"
"KHARIF","AGRICULTURE","Cereals","Paddy (Dhan)","Fertilizer Use and Availability","foliar spray paddy","Recommended for foliar spray paddy spray 5 gm/lit.","TAMILNADU","THIRUVARUR","KORADACHERRY                                      ","2014-08-25 18:20:32.053"
"KHARIF","AGRICULTURE","Cereals","Paddy (Dhan)","Seeds","paddy seeds availability details","recommended number for agriculture office 04366 230544","TAMILNADU","THIRUVARUR","NANNILAM                                          ","2014-08-25 18:33:47.810"
"KHARIF","AGRICULTURE","Others","Others","Government Schemes","cow loan details","Recommended for contact bank manager","TAMILNADU","THIRUVARUR","KORADACHERRY                                      ","2014-08-25 20:29:18.327"
"KHARIF","AGRICULTURE","Cereals","Paddy (Dhan)","Fertilizer Use and Availability","Top dressing fertilizer management for paddy","recommended for apply urea 25 kg + potash 15 kg + neem cake 5 kg + Microfood 10 kg/ ac","TAMILNADU","THIRUVARUR","KODAVASAL                                         ","2014-08-25 20:40:56.923"
"KHARIF","AGRICULTURE","Cereals","Paddy (Dhan)","Seeds","season varieties for paddy","recommended for season varieties for paddy ;ADT 36, ADT 37, ASD 16, ASD 18, MDU 5, IR 50, ADT 43","TAMILNADU","THIRUVARUR","VALANGAIMAN                                       ","2014-08-26 08:22:20.533"
"KHARIF","AGRICULTURE","Cereals","Paddy (Dhan)","Agriculture Mechanization","asking about direct drum seeder","recommended contact number for AMRC,CBE 0422-2457576","TAMILNADU","THIRUVARUR","KORADACHERRY                                      ","2014-08-26 11:33:32.167"
"KHARIF","AGRICULTURE","Cereals","Paddy (Dhan)","Nutrient Management","paddy nursery basal fertilizer management","Recommended for DAP 2kg / ac","TAMILNADU","THIRUVARUR","KOTTUR                                            ","2014-08-26 11:56:10.250"
"KHARIF","HORTICULTURE","Plantation Crops","Coconut","Government Schemes","asking about Coconut Research Station, veppankulam, thanjavur contact no.","Recommended Coconut Research Station, veppankulam, thanjavur contact no. 04373 - 260250, 04373 - 202534.","TAMILNADU","THIRUVARUR","TIRUTTURAIPPUNDI                                  ","2014-08-26 13:31:44.940"
"KHARIF","HORTICULTURE","Vegetables","Amaranthus/Grain Amaranthus","Seeds and Planting Material","asking about Krishi Vigyan Kendra, Needamangalam, tiruvarur district contact no.","Recommended Krishi Vigyan Kendra, Needamangalam, tiruvarur district contact no. 04367 - 260666","TAMILNADU","THIRUVARUR","THIRUVARUR                                        ","2014-08-26 14:54:49.853"
"KHARIF","AGRICULTURE","Cereals","Paddy (Dhan)","Sowing Time and Weather","sowing season for paddy","recommended sowing season for paddy sep","TAMILNADU","THIRUVARUR","MANNARGUDI                                        ","2014-08-27 10:58:17.370"
"KHARIF","AGRICULTURE","Cereals","Paddy (Dhan)","Cultural Practices","direct sowing time for ponmani variety","recommended for direct sowing time for ponmani variety is august 1- 30","TAMILNADU","THIRUVARUR","THIRUVARUR                                        ","2014-08-27 15:18:48.913"
"KHARIF","AGRICULTURE","Cereals","Paddy (Dhan)","	Plant Protection	","Post emergence Weed control in paddy","recommended for Spray naminee gold 2.5ml/lit of water","TAMILNADU","THIRUVARUR","TIRUTTURAIPPUNDI                                  ","2014-08-27 20:50:43.110"
"KHARIF","HORTICULTURE","Vegetables","Cluster Bean","Cultural Practices","Sowing Season of Clusterbeans","recommended for Sowing Season of Clusterbeans is June- July and October -November","TAMILNADU","THIRUVARUR","TIRUTTURAIPPUNDI                                  ","2014-08-28 08:26:34.117"
"KHARIF","AGRICULTURE","Others","Others","Government Schemes","Agricultural govt scheme details & contact details","recommended for contact Assistant Director of Agriculture officer","TAMILNADU","THIRUVARUR","KOTTUR                                            ","2014-08-28 11:06:55.547"
"KHARIF","AGRICULTURE","Cereals","Paddy (Dhan)","Seeds","variety of paddy","recommended variety of paddy ADT 38, ADT 39, TRY 1*, TRY 3*, ADT (R) 46, ADT (R) 49, CO (R) 48, CO (R) 49, CO (R) 50","TAMILNADU","THIRUVARUR","KODAVASAL                                         ","2014-08-28 11:20:17.243"
"KHARIF","AGRICULTURE","Others","Others","Government Schemes","Needamangalam kvk contact number","recommended for 04362- 260666, 261444","TAMILNADU","THIRUVARUR","NANNILAM                                          ","2014-08-28 13:49:36.237"
"KHARIF","AGRICULTURE","","","","Top dressing fertilizer management for sugarcane","recommended for apply urea 80 + potash 25kg /ac","TAMILNADU","THIRUVARUR","MANNARGUDI                                        ","2014-08-28 15:17:34.210"
"KHARIF","HORTICULTURE","Fruits","Mango","	Plant Protection	","Root rot in mango","recommended for Root rot in mango Spray copper oxychloride 2gm/lit of water","TAMILNADU","THIRUVARUR","THIRUVARUR                                        ","2014-08-28 15:53:53.930"
"KHARIF","AGRICULTURE","Cereals","Paddy (Dhan)","Fertilizer Use and Availability","paddy fertilizer management","Recommended for apply micro mixture 5kg / ac","TAMILNADU","THIRUVARUR","","2014-08-28 16:16:38.097"
"KHARIF","AGRICULTURE","Cereals","","Cultural Practices","paddy drought tesisitant  varieties","recommended for rmd 1, pmk 4","TAMILNADU","THIRUVARUR","NANNILAM                                          ","2014-08-28 17:06:32.830"
"KHARIF","AGRICULTURE","Cereals","Paddy (Dhan)","Fertilizer Use and Availability","Paddy basal fertilizer","recommended for Paddy basal fertilizer Apply DAP 50 kg + zinc sulphate 15 kg/ac","TAMILNADU","THIRUVARUR","TIRUTTURAIPPUNDI                                  ","2014-08-28 18:38:07.703"
"KHARIF","AGRICULTURE","Cereals","Paddy (Dhan)","	Plant Protection	","caterpillar in paddy.","recommended for pray quinalphos 2ml/lit.","TAMILNADU","THIRUVARUR","KODAVASAL                                         ","2014-08-28 18:52:49.400"
"KHARIF","AGRICULTURE","Cereals","Paddy (Dhan)","Fertilizer Use and Availability","Paddy top dressing fertilizer","recommended for Paddy top dressing fertilizer apply urea 25kg, potash 15kg, neemcake 5kg/ac","TAMILNADU","THIRUVARUR","MANNARGUDI                                        ","2014-08-28 21:11:24.990"
