"Season","Sector","Category","Crop","QueryType","QueryText","KCCAns","StateName","DistrictName","BlockName","CreatedOn"
"KHARIF","HORTICULTURE","Flowers","Marigold","	Plant Protection	","TELL ME BLIGHT CONTROL IN MARIGOLD","SPRAY OF ACEPHATE 75 SP + MENCOZEB 63 WP 2 GRAM/LITRE WATER","RAJASTHAN","AJMER","PISANGAN                                          ","2014-09-21 17:01:32.483"
"KHARIF","AGRICULTURE","Pulses","Green Gram (Moong Bean/ Moong)","	Plant Protection	","MOONG RATE KISHAN GARH MANDI","NOT AVAILABLE","RAJASTHAN","AJMER","BHINAY                                            ","2014-09-21 18:38:23.083"
"KHARIF","AGRICULTURE","Others","Others","Weather","TELL ME RAIN INFORMATION","NO RAIN POSSIBILITY IN NEXT 5  DAYS","RAJASTHAN","AJMER","KISHANGARH                                        ","2014-09-21 20:23:10.913"
"KHARIF","AGRICULTURE","Fiber Crops","Cotton (Kapas)","	Plant Protection	","TELL ME FLOWER DROPPING CONTROL IN COTTON","SPRAY OF PLANOFIX 1 ML PER 4 LITER WATER","RAJASTHAN","AJMER","MASOODA                                           ","2014-09-22 07:26:34.960"
"KHARIF","AGRICULTURE","Others","Others","Weather","TELL ME WEATHER INFORMATION","NO RAIN FALL UP TO 5 DAYS","RAJASTHAN","AJMER","MASOODA                                           ","2014-09-22 08:11:05.247"
"KHARIF","HORTICULTURE","Vegetables","Chapan Kaddu","Vegetative Propagation and Tissue Culture","about","SPRAY OF MULTIPLAX MICRONUTRIENT 50 ML PER TANKI (15 LITER WATER)","RAJASTHAN","AJMER","BHINAY                                            ","2014-09-22 08:14:47.327"
"KHARIF","HORTICULTURE","Vegetables","Tomato","	Plant Protection	","TELL ME  INSECT CONTROL IN CHILLI","SPRAY OF IMIDACHLOPRID 17.8% SL 0.5 ML PER LITER WATER","RAJASTHAN","AJMER","SRINAGAR                                          ","2014-09-22 08:39:02.453"
"KHARIF","HORTICULTURE","Vegetables","Tomato","	Plant Protection	","TELL ME  DISEASE CONTROL IN TOMATO","SPRAY MANCOZEB 75% WP 2 GM PER LITER WATER","RAJASTHAN","AJMER","SRINAGAR                                          ","2014-09-22 08:40:20.260"
"KHARIF","HORTICULTURE","Fruits","Citrus","	Plant Protection	","tell me about pest in citrus","????????????? 36 % ??.??. 2 ??.??. ????? ???? ???? ??? ??? ????? ?????? ?????
SPRAY OF MONOCROTOPHOS 36% SL 2 ML PER LITER WATER","RAJASTHAN","AJMER","ARAIN                                             ","2014-09-22 08:44:05.423"
"KHARIF","AGRICULTURE","Fiber Crops","Cotton (Kapas)","	Plant Protection	","TELL ME CONTROL OF WHITE FLY IN COTTON","SPRAY OF ACETAMIPRID 20% SP 0.5 GM PER LITER WATER","RAJASTHAN","AJMER","SRINAGAR                                          ","2014-09-22 09:19:32.853"
"KHARIF","ANIMAL HUSBANDRY","Animal","POULTRY  FARM ","Credit","TELL ME INFORMION IN POULTRY FARM","?????????? ???? ????? ?? ???? ?? ?????? ???- 0141- 2350929","RAJASTHAN","AJMER","SRINAGAR                                          ","2014-09-22 09:32:55.107"
"KHARIF","AGRICULTURE","Fiber Crops","Cotton (Kapas)","	Plant Protection	","pest control of cotton","SPRAY OF ACETAMIPRID 20% SP 0.5 GM PER LITER WATER","RAJASTHAN","AJMER","KEKRI                                             ","2014-09-22 09:41:17.547"
"KHARIF","AGRICULTURE","Others","Others","Soil Testing","TELL  ME SOIL TESTING UNIT","CONTECT   KVK  DISTRICT HAD  QUARTER","RAJASTHAN","AJMER","ARAIN                                             ","2014-09-22 10:20:02.170"
"KHARIF","HORTICULTURE","Vegetables","Cauliflower","	Plant Protection	","TELL ME FLOWER DROP CONTROL IN CAULIFLOWER","SPRAY OF PLANOFIX 1 ML PER 4 LITER WATER","RAJASTHAN","AJMER","PISANGAN                                          ","2014-09-22 10:45:23.913"
"KHARIF","AGRICULTURE","Fiber Crops","Cotton (Kapas)","	Plant Protection	","TELL ME RED LEAF CONTROL IN COTTON","SPRAY OF UREA PHOSPHATE 17:44 GRADE 10 GM PER LITER WATER 
SPRAY OF MULTIPLAX MICRONUTRIENT 4 GM PER LITER WATER","RAJASTHAN","AJMER","JAWAJA                                            ","2014-09-22 12:03:49.190"
"KHARIF","AGRICULTURE","Fiber Crops","Cotton (Kapas)","Bio-Pesticides and Bio-Fertilizers","TELL ME  FLOWER DROPPING CONTROL","SPRAY OF PLANOFIX 1 ML PER 4 LITER WATER TO PREVENT FLOWER DROPPING","RAJASTHAN","AJMER","SRINAGAR                                          ","2014-09-22 14:17:33.850"
"RABI","AGRICULTURE","Fiber Crops","Cotton (Kapas)","	Plant Protection	","TELL ME NOT FLOWRING IN COTTON","PLANOFIX 1 ML / 4 LITTER WATTER + MULTIPLEX 5 ML /LITER SPRAY","RAJASTHAN","AJMER","SRINAGAR                                          ","2014-09-22 15:46:08.340"
"KHARIF","AGRICULTURE","Fodder Crops","Guar","	Plant Protection	","TELL ME CONTROL BLIGHT IN GUAR","SPRAY OF COPPER OXICHLORIDE 45 GM + STREPTOSAYKLIN 1.5 GM 15 LITER WATER","RAJASTHAN","AJMER","BHINAY                                            ","2014-09-22 17:12:46.743"
"KHARIF","AGRICULTURE","Fiber Crops","Cotton (Kapas)","	Plant Protection	","TELL ME FUNGIES CONTROL OF COTTON","SPRAY OF COPPER OXICHLORIDE 3 GM PER LITER WATER","RAJASTHAN","AJMER","BHINAY                                            ","2014-09-23 06:26:30.410"
"KHARIF","HORTICULTURE","Fruits","Citrus","	Plant Protection	","TELL ME INSECT CONTROL OF CITRUS","SPRAY OF IMIDACHLOPRID 17.5% SL 0.5 ML PER LITER WATER","RAJASTHAN","AJMER","KEKRI                                             ","2014-09-23 10:26:15.850"
"KHARIF","AGRICULTURE","Cereals","Wheat","Varieties","TELL ME VARIETY OF WHEAT","WHEAT VARIETY - PBW-343,RAJ-3077,4037,3777,3765,4083,4120,4079,PBW-550,373,WH-1080","RAJASTHAN","AJMER","MASOODA                                           ","2014-09-23 10:51:45.940"
"KHARIF","AGRICULTURE","Pulses","Green Gram (Moong Bean/ Moong)","	Plant Protection	","TELL ME MANDI RATE","KEKRI  MOONG (LOCAL) 5650","RAJASTHAN","AJMER","ARAIN                                             ","2014-09-23 11:18:58.050"
"KHARIF","HORTICULTURE","Vegetables","Onion","	Plant Protection	","TELL ME INSECT CONTROL OF ONION","SPRAY OF DIMETHOATE 30% EC 2 ML PER LITER WATER","RAJASTHAN","AJMER","SRINAGAR                                          ","2014-09-23 12:58:53.550"
"KHARIF","AGRICULTURE","Pulses","Bengal Gram (Gram/Chick Pea/Kabuli/Chana)","Varieties","TELL ME VARIETY OF GRAM","GRAM VARIETY - GNG-663,469,C235,G130,H208,RSG-44,2,888,895,973,807,963,902,945,GNG- 1581","RAJASTHAN","AJMER","SRINAGAR                                          ","2014-09-23 13:54:24.083"
"KHARIF","AGRICULTURE","Oilseeds","Mustard","Weather","TELL ME WEATHER REPORT ?","NO RAIN POSSIBILITY IN NEXT 5 DAYS","RAJASTHAN","AJMER","MASOODA                                           ","2014-09-23 14:06:14.947"
"KHARIF","AGRICULTURE","Fodder Crops","Guar","	Plant Protection	","TELL ME JHULSA ROG IN GOWER","SPRAY OF COPPER OXICHLORIDE 45 GM + STREPTOCYCLIN 1.5 GM PER TANKI (15 LITER)","RAJASTHAN","AJMER","PISANGAN                                          ","2014-09-23 14:16:01.660"
"KHARIF","AGRICULTURE","Fiber Crops","Cotton (Kapas)","	Plant Protection	","TELL ME PEST CONTROL IN COTTON","ACEFATE 2 GRAM/LITER SPRAY","RAJASTHAN","AJMER","BHINAY                                            ","2014-09-23 15:23:24.477"
"KHARIF","AGRICULTURE","Oilseeds","Mustard","Seeds","TELL ME VAREITY  IN MUSTRD","MUSTARD VARIETY- T59,PUSA BOLD,RH30,BIO902,LAXMI,VASUNDHARA,JAGANNATH,RGN48","RAJASTHAN","AJMER","JAWAJA                                            ","2014-09-23 15:36:15.390"
"KHARIF","HORTICULTURE","Vegetables","Brinjal","	Plant Protection	","TELL ME PEST CONTROL OF BRINJAL","SPRAY OF CARBERYL 50% EC 4 GM PER LITER WATER","RAJASTHAN","AJMER","MASOODA                                           ","2014-09-23 17:47:50.347"
"KHARIF","AGRICULTURE","Others","Others","Weather","TELL ME WEATHER REPORT ?","NO RAIN POSSIBILITY IN NEXT 5 DAYS","RAJASTHAN","AJMER","ARAIN                                             ","2014-09-23 20:34:46.297"
"KHARIF","HORTICULTURE","Vegetables","Tomato","Seeds and Planting Material","TELL ME TIME OF SOWING OF TOMATO","15 OCT-15 NOV","RAJASTHAN","AJMER","PISANGAN                                          ","2014-09-23 21:13:19.150"
"RABI","HORTICULTURE","Condiments and Spices","Cumin","Cultural Practices","TELL ME HERBICIDE IN TOMATO ?","SPRAY OF PENDIMETHILIN 30% EC 2.5-3 LITER PER HA AFTER SOWING BUT BEFORE GERMINATION","RAJASTHAN","AJMER","PISANGAN                                          ","2014-09-23 21:38:13.400"
"KHARIF","HORTICULTURE","Condiments and Spices","Cumin","	Plant Protection	","TELL ME SEED TREATMENT OF CUMIN","MENKOJEB 2 GRAM/KG SEED","RAJASTHAN","AJMER","SRINAGAR                                          ","2014-09-23 21:40:24.240"
"KHARIF","AGRICULTURE","Others","Others","	Plant Protection	","TELL ME WEED CONTROL IN GUAR.","HAND WEEDING ONLY","RAJASTHAN","AJMER","BHINAY                                            ","2014-09-24 07:41:53.083"
"KHARIF","AGRICULTURE","Others","Others","Government Schemes","TELL ME ABOUT SUBSIDY ON ONION STORAGE","50% SUBSIDY ON ONION STORAGE","RAJASTHAN","AJMER","KISHANGARH                                        ","2014-09-24 09:23:37.743"
"RABI","HORTICULTURE","Vegetables","Onion","	Plant Protection	","TELL ME THRIPS CONTROL IN ONION","SPRAY OF DIMETHOATE 30% EC 2 ML PER LITER WATER","RAJASTHAN","AJMER","KISHANGARH                                        ","2014-09-24 10:38:14.563"
"KHARIF","AGRICULTURE","Others","Others","Weather","TELL ME WEATHER REPORT IN MY DISTRIC","MAINLY CLEAR SKY IN NEXT DAYS IN YOUR DISTRIC.MAXIMUM TEMP.33 DIGREE","RAJASTHAN","AJMER","KEKRI                                             ","2014-09-24 10:38:22.943"
"KHARIF","AGRICULTURE","Others","Others","Soil Testing","TELL ME ABOUT SOIL TESTING ?","DEEG 6-9 INCH DEEP `V` SHAPE PIT AND TACKING 500 GM SOIL SAMPLE FOR TESTING SOIL","RAJASTHAN","AJMER","ARAIN                                             ","2014-09-24 11:40:02.670"
"KHARIF","AGRICULTURE","Others","Others","Weather","TELL ME MANDI RATE","BEAWAR  GOWAR 5250","RAJASTHAN","AJMER","MASOODA                                           ","2014-09-24 12:25:43.923"
"KHARIF","AGRICULTURE","Others","Others","Weather","TELL ME WEATHER REPORT IN MY DISTRIC","MAINLY CLEAR SKY IN NEXT DAYS IN YOUR DISTRIC.MAXIMUM TEMP.33 DIGREE","RAJASTHAN","AJMER","KEKRI                                             ","2014-09-24 12:29:36.430"
"RABI","ANIMAL HUSBANDRY","Avian","Duck","Livestock Products Processing and Packaging","TELL ME HEN PRODUCTION","CONTACT NO. OF POULTRY FARM= 0141-2350929","RAJASTHAN","AJMER","ARAIN                                             ","2014-09-24 13:36:30.327"
"KHARIF","AGRICULTURE","Fiber Crops","Cotton (Kapas)","	Plant Protection	","FLOWER DROP CONTROL IN COTTON","SPRAY OF PLANOFIX 1 ML PER 4 LITER WATER","RAJASTHAN","AJMER","BHINAY                                            ","2014-09-24 13:49:10.830"
"KHARIF","AGRICULTURE","Others","Others","	Plant Protection	","tell me weahter information","NO RAIN POSSIBILITY IN NEXT 5 DAYS","RAJASTHAN","AJMER","MASOODA                                           ","2014-09-24 14:25:40.607"
"KHARIF","AGRICULTURE","Fiber Crops","Cotton (Kapas)","	Plant Protection	","TELL ME WHITE FLY IN COTTON","SPRAY OF ACETAMIPRID 20% SP 0.5 GM PER LITER WATER","RAJASTHAN","AJMER","BHINAY                                            ","2014-09-24 14:55:28.517"
"KHARIF","AGRICULTURE","Others","Others","	Plant Protection	","TELL ME RAIN INFORMATION","NO RAIN POSSIBILITY IN NEXT 5 DAYS","RAJASTHAN","AJMER","MASOODA                                           ","2014-09-24 15:11:29.453"
"KHARIF","AGRICULTURE","Fiber Crops","Cotton (Kapas)","	Plant Protection	","TELL ME CONTROL JAISED IN COTTON","SPRAY OF THIOMETHOXAM 25% WG 0.5 GM  PER LITER WATER","RAJASTHAN","AJMER","MASOODA                                           ","2014-09-24 15:31:44.077"
"RABI","AGRICULTURE","Others","Others","Weather","TELL ME WEATHER REPORT IN MY DISTRICT","NO RAIN POSSIBILITY IN NEXT FIVE DAYS","RAJASTHAN","AJMER","KEKRI                                             ","2014-09-24 15:38:06.813"
"KHARIF","HORTICULTURE","Vegetables","Chillies","	Plant Protection	","TELL ME INSECT CONTROL IN CHILLIES ?","SPRAY OF  IMIDACLOPRID 17.8 %  SL 0.5  PER LITER WATER","RAJASTHAN","AJMER","BHINAY                                            ","2014-09-25 10:13:17.377"
"KHARIF","AGRICULTURE","Pulses","Bengal Gram (Gram/Chick Pea/Kabuli/Chana)","Varieties","TELL ME VARIETY OF GRAM ?","VARIETY OF GRAM FOR RAINFED AREA = GNG 1581 (GANGAUR) RSG 973, RSG 974","RAJASTHAN","AJMER","MASOODA                                           ","2014-09-25 11:07:26.910"
"KHARIF","AGRICULTURE","Others","Others","Weather","TELL ME WEATHER INFORMATION","NO RAIN FALL NEXT 5 DAYS BUT CLOUDY SKY","RAJASTHAN","AJMER","ARAIN                                             ","2014-09-25 11:30:13.417"
"KHARIF","AGRICULTURE","Others","Others","Government Schemes","TELL ME SUBSIDY IN ROTA WETER","SUBSIDY ON ROTAVATOR=50% OF TOTAL COST OR 35000/- MAXIMUM","RAJASTHAN","AJMER","MASOODA                                           ","2014-09-25 11:52:22.503"
"KHARIF","HORTICULTURE","Vegetables","Cauliflower","Fertilizer Use and Availability","TELL ME MICRONUTRIENT IN CAULIFLOWER .","SPRAY OF POTASSIUM SULPHATE 0:0:50 10 GM PER LITER WATER","RAJASTHAN","AJMER","PISANGAN                                          ","2014-09-25 12:04:44.840"
"KHARIF","AGRICULTURE","Others","Others","Weather","TELL ME WEATHER INFORMATION","NO RAIN FALL NEXT 5 DAYS BUT CLOUDY SKY","RAJASTHAN","AJMER","ARAIN                                             ","2014-09-25 12:45:53.247"
"KHARIF","AGRICULTURE","Others","Others","Weather","TELL ME WEATHER INFORMATION","NO RAINFALL POSSIBILITY IN NEXT FIVE DAYS  BUT CLOUDY","RAJASTHAN","AJMER","BHINAY                                            ","2014-09-25 12:53:19.840"
"KHARIF","AGRICULTURE","Others","Others","Weather","TELL ME WEATHER INFORMETION","NO RAIN POSSIBILITY IN NEXT 5 DAYS","RAJASTHAN","AJMER","BHINAY                                            ","2014-09-25 13:14:23.260"
"KHARIF","AGRICULTURE","Others","Others","Weather","TELL ME WEATHER INFORMATION","NO RAIN FALL UP TO 5 DAYS, CLOUDY SKY","RAJASTHAN","AJMER","PISANGAN                                          ","2014-09-25 14:14:13.760"
"KHARIF","AGRICULTURE","Others","Others","Weather","TELL ME WEATHER INFORMETION","NO RAIN POSSIBILITY IN NEXT 5 DAYS","RAJASTHAN","AJMER","MASOODA                                           ","2014-09-25 14:19:15.447"
"KHARIF","AGRICULTURE","Others","Others","Weather","TELL ME RAIN INFORMATION","NO RAIN FALL POSSIBILITY IN NEXT 5 DAYS IN YOUR DIST","RAJASTHAN","AJMER","SRINAGAR                                          ","2014-09-25 14:23:52.337"
"KHARIF","AGRICULTURE","Others","Others","	Plant Protection	","INSECET CONTROLL IN BRINJAL","SPRAY OF ACEPHATE 75% SP 2 GM PER LITER WATER + MENCOJEB 2GM PAR LITAR WATER","RAJASTHAN","AJMER","BHINAY                                            ","2014-09-25 14:45:11.990"
"KHARIF","AGRICULTURE","Fiber Crops","Cotton (Kapas)","	Plant Protection	","TELL ME ABOUT SUCKING PEST CONTROL IN COTTON","SPRAY OF DIMETHOATE  30% EC 2 ML PER LITER WATER","RAJASTHAN","AJMER","BHINAY                                            ","2014-09-25 16:23:37.937"
"KHARIF","AGRICULTURE","Fiber Crops","Cotton (Kapas)","	Plant Protection	","TELL ME ABOUT SUCKING PEST CONTROL IN COTTON","SPRAY OF DIMETHOATE  30% EC 2 ML PER LITER WATER","RAJASTHAN","AJMER","BHINAY                                            ","2014-09-25 16:23:38.063"
"KHARIF","AGRICULTURE","Fiber Crops","Cotton (Kapas)","	Plant Protection	","TELL ME ABOUT SUCKING PEST CONTROL IN COTTON","SPRAY OF DIMETHOATE  30% EC 2 ML PER LITER WATER","RAJASTHAN","AJMER","BHINAY                                            ","2014-09-25 16:23:38.070"
"KHARIF","AGRICULTURE","Oilseeds","Groundnut (pea nut/mung phalli)","	Plant Protection	","TELL ME PLANT PRTECXTION IN GRUNDNUT","USE CHLOROPYRIFOS 20% EC 4 LITER PER HA WITH IRRIGATION FOR TERMITE CONTROL","RAJASTHAN","AJMER","PISANGAN                                          ","2014-09-25 16:46:33.350"
"KHARIF","AGRICULTURE","Others","Others","Weather","TELL ME WEATHER INFORMATION","NO RAIN POSSIBILITY IN NEXT 5 DAYS","RAJASTHAN","AJMER","MASOODA                                           ","2014-09-25 16:57:55.290"
"KHARIF","AGRICULTURE","Others","Others","Weather","TELL ME WEATHER INFORMETION","NO RAIN POSSIBILITY IN NEXT 5 DAYS","RAJASTHAN","AJMER","PISANGAN                                          ","2014-09-25 20:29:08.823"
"KHARIF","AGRICULTURE","Others","Others","Weather","TELL ME WEATHER INFORMETION","NO RAIN POSSIBILITY IN NEXT 5 DAYS","RAJASTHAN","AJMER","PISANGAN                                          ","2014-09-25 20:29:11.327"
"KHARIF","HORTICULTURE","Vegetables","Brinjal","	Plant Protection	","TELL ME PEST CONTROL IN BRINJAL","DAIMITHIYOT 30EC 2 ML /LITER SPRAY","RAJASTHAN","AJMER","SRINAGAR                                          ","2014-09-26 07:33:26.513"
"KHARIF","AGRICULTURE","Others","Others","Weather","TELL ME WEATHER INFORMETION IN MY DISTRICT","NO RAIN POSSIBILITY IN NEXT 5 DAYS,BUT SKY CLOUDLY","RAJASTHAN","AJMER","KISHANGARH                                        ","2014-09-26 08:31:37.043"
"KHARIF","HORTICULTURE","Vegetables","Cauliflower","Cultural Practices","TELL ME NOT FLOWERING IN CAULIFLOWER","DEPEND OF VARAITY","RAJASTHAN","AJMER","PISANGAN                                          ","2014-09-26 08:49:08.323"
"KHARIF","HORTICULTURE","Fruits","Ber","	Plant Protection	","TEL ME FLOWER DROP CONTROL IN BER .","SPRAY OF DIMETHOATE 30% EC 2 ML PER LITER WATER 
SPRAY OF PLANOFIX 1 ML PER 4 LITER WATER FOR FLOWER DROP CONTROL","RAJASTHAN","AJMER","MASOODA                                           ","2014-09-26 10:01:30.947"
"KHARIF","AGRICULTURE","Fiber Crops","Cotton (Kapas)","	Plant Protection	","TELL ME CONTROL OF SUCKING PEST IN COTTON ?","SPRAY OF ACEPHATE 75% SP 2 GM PER LITER WATER","RAJASTHAN","AJMER","ARAIN                                             ","2014-09-26 10:37:58.860"
"KHARIF","HORTICULTURE","Vegetables","Bhindi(Okra/Ladysfinger)","	Plant Protection	","LOW FLOWERING IN BHINDI","TELL ME FOR PROPER GROWTH IN GROUNDNUT","RAJASTHAN","AJMER","ARAIN                                             ","2014-09-26 11:04:56.090"
"KHARIF","AGRICULTURE","Others","Others","Weather","TELL ME WEATHER INFORMETION IN MY DISTRICT","NO RAIN POSSIBILITY IN NEXT 5 DAYS,BUT SKY CLOUDLY","RAJASTHAN","AJMER","KEKRI                                             ","2014-09-26 12:20:59.010"
"RABI","AGRICULTURE","Others","Others","Weather","TELL ME WEATHER REPORT IN MY DISTRICT","NO RAIN POSSIBILITY IN NEXT FIVE DAY,CLOUDY SKY","RAJASTHAN","AJMER","KISHANGARH                                        ","2014-09-26 14:14:49.647"
"KHARIF","AGRICULTURE","Others","Others","Weather","TELL ME WEATHER REPORT IN MY DISTRICT","???? ???? ?? ???? ???? ??? ?? ????? ?? ??????? ???? ??","RAJASTHAN","AJMER","BHINAY                                            ","2014-09-26 19:17:17.860"
"RABI","AGRICULTURE","Others","Others","Soil Testing","Tell me about soil testing","DEEG 6-9 INCH DEEP `V` SHAPE PIT AND TACKING 500 GM SOIL SAMPLE FOR TESTING SOIL 
CONTACT TO AG. DEPTT. FOR SOIL TESTING","RAJASTHAN","AJMER","SRINAGAR                                          ","2014-09-27 07:07:53.723"
"KHARIF","HORTICULTURE","Vegetables","Onion","	Plant Protection	","TELL ME INSECT CONTROL IN ONION .","SPRAY OF IMIDACHLOPRID(CONFIDOR) 17.8% SL 1 LITRE PER HACTRE","RAJASTHAN","AJMER","ARAIN                                             ","2014-09-27 08:06:17.507"
"KHARIF","AGRICULTURE","Others","Others","Weather","TELL ME WEATHER INFORMATION","NO RAINFALL POSSIBILITY IN NEXT FIVE DAYS  BUT CLOUDY","RAJASTHAN","AJMER","BHINAY                                            ","2014-09-27 08:27:49.540"
"KHARIF","HORTICULTURE","Vegetables","Smooth Guard","	Plant Protection	","TELL ME INSECT CONTROL IN TINDA.","SPRAY OF DICIFOL 1.5 ML PER LITER WATER","RAJASTHAN","AJMER","SRINAGAR                                          ","2014-09-27 09:26:04.000"
"KHARIF","AGRICULTURE","Others","Others","Weather","TELL ME WEATHER INFORMETION","NO RAIN POSSIBILITY IN NEXT 5 DAYS","RAJASTHAN","AJMER","KISHANGARH                                        ","2014-09-27 10:29:37.510"
"KHARIF","AGRICULTURE","Others","Others","Soil Testing","TELL ME SOIL TESTING INFO.","DEEG 6-9 INCH DEEP `V` SHAPE PIT AND TACKING 500 GM SOIL SAMPLE FOR TESTING SOIL","RAJASTHAN","AJMER","ARAIN                                             ","2014-09-27 11:16:46.587"
"RABI","HORTICULTURE","Plantation Crops","Sagoan","Field Preparation","TELL ME ABOUT NO PROPER GROWTH OF SAGON","NO CLIMATE FAVERABLE FOR RAJASTHAN IN SAGOAN TREE","RAJASTHAN","AJMER","KISHANGARH                                        ","2014-09-27 11:41:16.187"
"RABI","AGRICULTURE","Others","Others","	Plant Protection	","TELL ME CONTROL OF TERMITE IN SAGWAN TREE ?","USE CHLOROPYRIFOS 20% EC 2 ML PER LITER WATER IN ROOT ZONE","RAJASTHAN","AJMER","KISHANGARH                                        ","2014-09-27 11:57:30.717"
"KHARIF","HORTICULTURE","Vegetables","Chillies","	Plant Protection	","TELL ME PEAST CONTROL IN OKRA","CYPERMETHRIN 1.5 ML PER LITRE WATER SPRAY","RAJASTHAN","AJMER","JAWAJA                                            ","2014-09-27 12:26:41.197"
"KHARIF","AGRICULTURE","Others","Others","Weather","TELL ME WEATHER REPORT IN MY DISTRICT","NO RAIN POSSIBILITY IN NEXT FIVE DAY,CLOUDY SKY","RAJASTHAN","AJMER","KEKRI                                             ","2014-09-27 12:34:47.173"
"RABI","AGRICULTURE","Oilseeds","Mustard","Fertilizer Use and Availability","FERTILIZER DOSE FOR MUSTURD","FERTILIZER DOSE FOR MUSTURD - UREA 60 KG, SSP 250 KG (BEDFORE SOWING),  UREA 60 KG(TOP DRESSING)/HA","RAJASTHAN","AJMER","SRINAGAR                                          ","2014-09-27 12:37:43.770"
"KHARIF","HORTICULTURE","Vegetables","Brinjal","	Plant Protection	","TELL ME SUCKING PEST CONTROL IN brinjal","SPRAY OF IMIDACHLOPRID 17.8% SL  0.5 ML PER LITER WATER 
+  SPRAY OF ACEPHATE 75%SP 2 GRAM PER LITER WATER","RAJASTHAN","AJMER","MASOODA                                           ","2014-09-27 13:05:56.360"
"KHARIF","AGRICULTURE","Others","Others","	Plant Protection	","tell me","SPRAY OF MULTIPLEX POWDER 60 GM/ 15 LITER WATER","RAJASTHAN","AJMER","PISANGAN                                          ","2014-09-27 13:08:46.500"
"KHARIF","HORTICULTURE","Vegetables","Bhindi(Okra/Ladysfinger)","	Plant Protection	","TELL ME SUCKING PEST CONTROL IN","SPRAY OF IMIDACHLOPRID 17.8% SL  0.5 ML PER LITER WATER","RAJASTHAN","AJMER","SRINAGAR                                          ","2014-09-27 13:12:01.710"
"KHARIF","HORTICULTURE","Vegetables","Cauliflower","	Plant Protection	","TELL ME CONTROL NUTRIENT DIFFICEANCE","SPRAY OF MULTIPLAX (MICRONUTRIENT) 4 GM PER LITER WATER","RAJASTHAN","AJMER","KISHANGARH                                        ","2014-09-27 13:25:18.403"
"KHARIF","AGRICULTURE","Others","Others","Weather","SUBSIDY ON THRESHER ?","SUBSIDY ON THRESHER= 30000/- MAXIMUM","RAJASTHAN","AJMER","KISHANGARH                                        ","2014-09-27 16:58:42.860"
"KHARIF","HORTICULTURE","Vegetables","Tomato","Seeds and Planting Material","RELL ME VARIETIE OF TOMATO ?","VARIETY OF TOMATO= AVNISH 2, RASHMI, VAISHALI, PUSA GOURAV, PUSA SADABAHAR, PUSA ROHINI, P H 8","RAJASTHAN","AJMER","KISHANGARH                                        ","2014-09-27 17:02:56.973"
"KHARIF","AGRICULTURE","Pulses","Green Gram (Moong Bean/ Moong)","Market Information","TELL ME MARKET RATE OF MOONGBEAN","MARKET RATE OF MOONGBEAN IN KEKRI - 5700/ QUENTAL","RAJASTHAN","AJMER","KEKRI                                             ","2014-09-27 19:23:59.237"
"KHARIF","AGRICULTURE","Fodder Crops","Guar","	Plant Protection	","TELL ME FLOWER DROPPING IN GUAR","SPRAY OF PLANOFIX 1 ML PER 4 LITER WATER 
?","RAJASTHAN","AJMER","KEKRI                                             ","2014-09-27 20:36:42.283"
"KHARIF","AGRICULTURE","Oilseeds","Mustard","Varieties","TELL ME VARIETIE OF MUSTARD ?","MUSTARD VARIETY- T59,PUSA BOLD,RH30,BIO902,LAXMI,VASUNDHARA,JAGANNATH,RGN48,73","RAJASTHAN","AJMER","KEKRI                                             ","2014-09-28 07:25:48.303"
"KHARIF","AGRICULTURE","Fiber Crops","Cotton (Kapas)","	Plant Protection	","TELL ME CONTROL OF INSECT IN COTTON ?","SPRAY OF ACEPHATE 75% SP 2 GM PER LITER WATER","RAJASTHAN","AJMER","MASOODA                                           ","2014-09-28 08:36:07.757"
"KHARIF","HORTICULTURE","Flowers","Rose","Fertilizer Use and Availability","TELL ME GROWTH IN ROSE","SPRAY OF MULTIPLAX (MICRONUTRIENT) 4 ML PER LITER WATER","RAJASTHAN","AJMER","KISHANGARH                                        ","2014-09-28 09:03:28.767"
"KHARIF","AGRICULTURE","Others","Others","Soil Testing","TELL ME SOIL TESTING INFO.","DEEG 6-9 INCH DEEP `V` SHAPE PIT AND TACKING 500 GM SOIL SAMPLE FOR TESTING SOIL","RAJASTHAN","AJMER","MASOODA                                           ","2014-09-28 09:25:11.467"
"KHARIF","AGRICULTURE","Oilseeds","Mustard","	Plant Protection	","TELL ME CUT WARM IN MUSTARD","DUSTING OF METHYL PARATHIAN 2% 25 KG PER HA","RAJASTHAN","AJMER","KEKRI                                             ","2014-09-28 09:35:14.463"
"KHARIF","AGRICULTURE","Oilseeds","Mustard","	Plant Protection	","PANTED BUG IN MUSTARD","DUSTING OF METHYL PARATHIAN 2% 25 KG PER HA","RAJASTHAN","AJMER","BHINAY                                            ","2014-09-28 10:52:33.717"
"KHARIF","AGRICULTURE","Pulses","Black Gram (urd bean)","	Plant Protection	","tell me control in jivanu rog in urd","SPRAY OF COPPER OXICHLORIDE 45 GM  + STREPTOCYCLIN 1.5 GM PER 15 LITER WATER","RAJASTHAN","AJMER","KEKRI                                             ","2014-09-28 17:33:54.120"
