"Season","Sector","Category","Crop","QueryType","QueryText","KCCAns","StateName","DistrictName","BlockName","CreatedOn"
"KHARIF","AGRICULTURE","Others","Others","Weather","TELL ME WEATHER INFORMATION","RAIN MAY BE CONTINUE NEXT 5 DAYS","RAJASTHAN","AJMER","PISANGAN                                          ","2014-09-03 13:02:44.123"
"KHARIF","AGRICULTURE","Others","Others","Weather","TELL ME WEATHER INFORMATION","RAIN MAY BE CONTINUE NEXT 5 DAYS","RAJASTHAN","AJMER","PISANGAN                                          ","2014-09-03 13:02:44.123"
"KHARIF","AGRICULTURE","Pulses","Green Gram (Moong Bean/ Moong)","	Plant Protection	","POD BORRER CONTROL IN MOONG","SPRAY OF INDOXACARB 14.5% SC 1 ML PER LITER WATER","RAJASTHAN","AJMER","KEKRI                                             ","2014-09-04 11:06:57.020"
"KHARIF","HORTICULTURE","Vegetables","Cauliflower","	Plant Protection	","pest control of calliflower","SPRAY OF DIMETHOATE 30% EC 2 ML PER LITER WATER","RAJASTHAN","AJMER","PISANGAN                                          ","2014-09-05 12:33:27.520"
"KHARIF","HORTICULTURE","Vegetables","Cauliflower","	Plant Protection	","pest control of calliflower","SPRAY OF DIMETHOATE 30% EC 2 ML PER LITER WATER","RAJASTHAN","AJMER","PISANGAN                                          ","2014-09-05 12:33:27.520"
"KHARIF","AGRICULTURE","Others","Others","	Field Preparation	","TEST","TEST","RAJASTHAN","AJMER","ARAIN                                             ","2014-09-05 13:48:31.733"
"KHARIF","AGRICULTURE","Pulses","Green Gram (Moong Bean/ Moong)","Weather","TELL ME WEATHER INFORMATION","NO RAIN FALL UP TO 5 DAYS, CLOUDY SKY","RAJASTHAN","AJMER","KEKRI                                             ","2014-09-05 15:42:24.990"
"KHARIF","AGRICULTURE","Pulses","Black Gram (urd bean)","	Plant Protection	","TEST","TEST","RAJASTHAN","AJMER","ARAIN                                             ","2014-09-05 18:47:51.083"
"KHARIF","AGRICULTURE","Pulses","Black Gram (urd bean)","	Plant Protection	","TEST","TEST","RAJASTHAN","AJMER","ARAIN                                             ","2014-09-05 18:47:52.683"
"KHARIF","AGRICULTURE","Pulses","Green Gram (Moong Bean/ Moong)","	Plant Protection	","INSECT CONTROL IN MOONG","SPRAY OF MONOCROTOPHOS 36% SL 2 ML PER LITER WATER","RAJASTHAN","AJMER","SRINAGAR                                          ","2014-09-05 20:29:01.683"
"KHARIF","AGRICULTURE","Pulses","Green Gram (Moong Bean/ Moong)","	Plant Protection	","INSECT CONTROL IN MOONG","SPRAY OF MONOCROTOPHOS 36% SL 2 ML PER LITER WATER","RAJASTHAN","AJMER","JAWAJA                                            ","2014-09-06 06:55:34.963"
"KHARIF","AGRICULTURE","Pulses","Green Gram (Moong Bean/ Moong)","	Plant Protection	","TELL ME CONTROL OF POD BORER IN MOONG","SPRAY OF INDOXACARB 14.5% SC 1 ML PER LITER WATER","RAJASTHAN","AJMER","PISANGAN                                          ","2014-09-06 07:00:29.600"
"KHARIF","AGRICULTURE","Fiber Crops","Cotton (Kapas)","	Plant Protection	","PEST CONTROL IN COTTON","ACIPHET 2 GRAM/LITER WATER SPRAY","RAJASTHAN","AJMER","MASOODA                                           ","2014-09-06 09:57:18.963"
"KHARIF","AGRICULTURE","Fiber Crops","Cotton (Kapas)","Weather","TELL MR FLOWER DROP CONTROL IN","SPRAY OF PLANOFIX 1 ML PER 4 LITER WATER","RAJASTHAN","AJMER","PISANGAN                                          ","2014-09-06 10:09:21.207"
"KHARIF","AGRICULTURE","Others","Others","Weather","TEL ME WEATHER INFORMATION","RAIN FALL POSSIBILITY IN NEXT 5 DAYS","RAJASTHAN","AJMER","KISHANGARH                                        ","2014-09-06 10:29:07.590"
"KHARIF","AGRICULTURE","Fiber Crops","Cotton (Kapas)","	Plant Protection	","WHITE FLY CONTROL IN COTTON","SPRAY OF IMIDACHLOPRID 17.8% SL 0.5 ML PER LITER WATER","RAJASTHAN","AJMER","KEKRI                                             ","2014-09-06 10:42:32.770"
"KHARIF","AGRICULTURE","Fiber Crops","Cotton (Kapas)","Bio-Pesticides and Bio-Fertilizers","TELL ME INSECT CONTROL OF COTTON","SPRAY OF PROFENOFOS 1.5 ML PER LITER WATER","RAJASTHAN","AJMER","KEKRI                                             ","2014-09-06 11:31:23.023"
"KHARIF","AGRICULTURE","Fodder Crops","Guar","Bio-Pesticides and Bio-Fertilizers","TELL ME INSECT CONTROL OF GUAR","SPRAY OF DIMETHOATE  30% EC 2 ML PER LITER WATER","RAJASTHAN","AJMER","KEKRI                                             ","2014-09-06 12:35:15.117"
"KHARIF","HORTICULTURE","Fruits","Guava","	Plant Protection	","NO GROTH IN GUAVA","SPRAY MICRO NUTRIENT 4 G/LIT WATER","RAJASTHAN","AJMER","MASOODA                                           ","2014-09-06 15:23:19.250"
"KHARIF","AGRICULTURE","Cereals","Barley (Jau)","Weather","TELL ME WEATHER REPORT","RAINFALL IN NEXT 2-3 DAYS IN YOUR DISTRICT","RAJASTHAN","AJMER","MASOODA                                           ","2014-09-06 17:03:48.440"
"KHARIF","AGRICULTURE","Others","Others","Weather","tell me weather information","RAIN POSSIBILITY IN NEXT 3 DAYS","RAJASTHAN","AJMER","MASOODA                                           ","2014-09-06 17:20:33.693"
"KHARIF","AGRICULTURE","Oilseeds","Groundnut (pea nut/mung phalli)","	Plant Protection	","tell me control of white grub of groundnut","USE  Fipronil 0.3% GR 12-15 KG PER HA","RAJASTHAN","AJMER","PISANGAN                                          ","2014-09-06 17:31:21.007"
"KHARIF","AGRICULTURE","Pulses","Green Gram (Moong Bean/ Moong)","	Plant Protection	","TELL ME FLOWER DROPING CONTROL IN MOONG","PLANOFIX 1 ML /4 LITTER WATTER SPRAY","RAJASTHAN","AJMER","PISANGAN                                          ","2014-09-06 18:09:09.783"
"KHARIF","AGRICULTURE","Fodder Crops","Guar","	Plant Protection	","TELL ME PEST CONTROL IN GOWAR","DAIMITHIYOT 30EC 2 ML /LITER SPRAY","RAJASTHAN","AJMER","KISHANGARH                                        ","2014-09-06 18:53:25.070"
"KHARIF","AGRICULTURE","Fodder Crops","Guar","	Plant Protection	","TELL ME PEST CONTROL IN GOWAR","DAIMITHIYOT 30EC 2 ML /LITER SPRAY","RAJASTHAN","AJMER","KISHANGARH                                        ","2014-09-06 18:59:40.683"
"KHARIF","AGRICULTURE","Fodder Crops","Guar","	Plant Protection	","TELL ME PEST CONTROL IN GOWAR","DAIMITHIYOT 30EC 2 ML /LITER SPRAY","RAJASTHAN","AJMER","KISHANGARH                                        ","2014-09-06 19:01:38.370"
"KHARIF","AGRICULTURE","Fiber Crops","Cotton (Kapas)","	Plant Protection	","CONTROL FLOWER DROP IN COTTON","PLANOFIX 1 M.L./4LITER NWATER SPRAY","RAJASTHAN","AJMER","MASOODA                                           ","2014-09-06 20:38:51.797"
"KHARIF","AGRICULTURE","Fiber Crops","Cotton (Kapas)","	Plant Protection	","TELL ME INSECT CONTROL IN COTTON ?","SPRAY OF IMIDACHLOPRID 17.8% SL 0.5 ML PER LITER WATER","RAJASTHAN","AJMER","PISANGAN                                          ","2014-09-07 06:35:56.623"
"KHARIF","AGRICULTURE","Oilseeds","Sesame (Gingelly/Til)/Sesamum","	Plant Protection	","TELL ME BACTIRIAL BLIGHT CONTROL IN TIL","COPPER OXI CLORIDE 45 G + STREPTOCYCLIN 2 G/ 15 LIT WATER","RAJASTHAN","AJMER","ARAIN                                             ","2014-09-07 08:38:42.270"
"KHARIF","AGRICULTURE","Pulses","Green Gram (Moong Bean/ Moong)","	Plant Protection	","TELL ME CONTROL OF POD BORER IN MOONG","SPRAY OF INDOXACARB 14.5% SC 1 ML PER LITER WATER","RAJASTHAN","AJMER","SRINAGAR                                          ","2014-09-07 09:13:00.320"
"KHARIF","AGRICULTURE","Fiber Crops","Cotton (Kapas)","	Plant Protection	","FLOWER DROP & JESSID CONTROL IN COTTON","SPRAY OF PLANOFIX 4 ML + DIMETHOATE  30% EC 30 ML PER 15 LITER WATER","RAJASTHAN","AJMER","BHINAY                                            ","2014-09-07 09:23:55.553"
"KHARIF","AGRICULTURE","Others","Others","Weather","TEL ME WEATHER INFORMATION","RAIN FALL POSSIBILITY IN NEXT 5 DAYS","RAJASTHAN","AJMER","BHINAY                                            ","2014-09-07 09:40:29.287"
"KHARIF","AGRICULTURE","Others","Others","Weather","TEL ME WEATHER INFORMATION","RAIN FALL POSSIBILITY IN NEXT 5 DAYS","RAJASTHAN","AJMER","BHINAY                                            ","2014-09-07 11:37:03.400"
"KHARIF","AGRICULTURE","Fodder Crops","Guar","Cultural Practices","TELL ME ABOUT DISEASE IN GUAR","SPRAY OF COPPER OXICHLORIDE 45 GM + STREPTOCYCLIN 1.5 GM PER 15 LITER WATER","RAJASTHAN","AJMER","BHINAY                                            ","2014-09-07 13:22:49.590"
"KHARIF","AGRICULTURE","Fiber Crops","Cotton (Kapas)","	Plant Protection	","flower fall down in cotton","SPRAY OF PLANOFIX 1 ML PER 4 LITER WATER","RAJASTHAN","AJMER","ARAIN                                             ","2014-09-07 14:30:15.533"
"KHARIF","AGRICULTURE","Millets","Sorghum (Jowar/Great Millet)","	Plant Protection	","TELL ME PEST CONTROL OF JUWAR","DUSTING OF METHYL PARATHIAN 2% 25 KG PER HA","RAJASTHAN","AJMER","KEKRI                                             ","2014-09-07 14:41:19.600"
"KHARIF","AGRICULTURE","Millets","Sorghum (Jowar/Great Millet)","	Plant Protection	","tell me control lat in jower","SPRAY OF INDOXACARB 14.5% SC 1 ML PER LITER WATER","RAJASTHAN","AJMER","BHINAY                                            ","2014-09-07 14:52:12.860"
"KHARIF","HORTICULTURE","Vegetables","Tomato","	Plant Protection	","GROWTH IN TOMATO","MICRONUTRIENT 4 GRAM/LITAR","RAJASTHAN","AJMER","KEKRI                                             ","2014-09-07 17:56:11.867"
"KHARIF","AGRICULTURE","Others","Others","Weather","TELL ME WEATHER REPORT","LIGHT RAINFALL MAY BE OCCUR IN NEXT 3-4 DAYS IN YOUR DISTRICT","RAJASTHAN","AJMER","PISANGAN                                          ","2014-09-07 18:00:03.503"
"KHARIF","ANIMAL HUSBANDRY","Animal","POULTRY  FARM ","Credit","CALL","CONTACT NO. OF POULTRY FARM= 0141-2350929","RAJASTHAN","AJMER","KEKRI                                             ","2014-09-07 18:05:06.743"
"KHARIF","HORTICULTURE","Condiments and Spices","Coriander","	Plant Protection	","YELLOW LEAF OF CORIANDER","SPRAY OF RIDOMIL MZ 2 GM PER LITER WATER","RAJASTHAN","AJMER","SRINAGAR                                          ","2014-09-07 18:22:14.270"
"KHARIF","AGRICULTURE","Others","Others","Varieties","TELL ME WEATHER REPORT IN AJMER","NO RAIN POSSIBILITY IN NEXT 5 DAYS","RAJASTHAN","AJMER","KISHANGARH                                        ","2014-09-07 19:03:54.147"
"KHARIF","AGRICULTURE","Fiber Crops","Cotton (Kapas)","	Plant Protection	","TELL M EFLOWER DROP CONTROL IN COTTON","SPRAY OF PLANOFIX 4 ML PER TANKI (16 LITRE WATER)","RAJASTHAN","AJMER","BHINAY                                            ","2014-09-07 20:32:08.433"
"KHARIF","AGRICULTURE","Others","Others","Weather","TELL ME WEATHER REPORT IN AJMER","NO RAIN POSSIBILITY IN NEXT 5 DAYS","RAJASTHAN","AJMER","BHINAY                                            ","2014-09-07 21:42:52.293"
"KHARIF","AGRICULTURE","Others","Others","Government Schemes","TELL ME SUBSIDY ON BHAGWANI","CONTECT HORTICULTURE SUPERVISOR","RAJASTHAN","AJMER","MASOODA                                           ","2014-09-08 07:01:35.410"
"KHARIF","AGRICULTURE","Oilseeds","Groundnut (pea nut/mung phalli)","	Plant Protection	","TERMITE IN G.NUT","USE CHLOROPYRIPHOS 20% EC 40 ML PER PALNT WITH IRRIGATION","RAJASTHAN","AJMER","BHINAY                                            ","2014-09-08 07:19:17.197"
"KHARIF","AGRICULTURE","Others","Others","Government Schemes","GROWTH IN GREEN CORIENER","MICRONUTRIENT 4 GRAM/LITAR","RAJASTHAN","AJMER","KISHANGARH                                        ","2014-09-08 09:10:06.060"
"KHARIF","AGRICULTURE","Fiber Crops","Cotton (Kapas)","	Plant Protection	","FLOWER DROPING IN COTTON","PLANOFIX 1 ML/4 LITAR","RAJASTHAN","AJMER","ARAIN                                             ","2014-09-08 09:42:27.903"
"KHARIF","HORTICULTURE","Vegetables","Onion","Government Schemes","TELL ME SUBSIDY ON ONION STORGE ?","SUBSIDY ON ONION STORGE = 50% OF TOTAL COST, MAXIMUM 87,500/-","RAJASTHAN","AJMER","BHINAY                                            ","2014-09-08 10:34:48.303"
"KHARIF","AGRICULTURE","Pulses","Green Gram (Moong Bean/ Moong)","	Plant Protection	","TELL ME INSECT CONTROL OF MOONG","SPRAY OF PROFENOFOS 1.5 ML PER LITER WATER","RAJASTHAN","AJMER","ARAIN                                             ","2014-09-08 10:36:17.970"
"KHARIF","AGRICULTURE","Others","Others","Weather","TELL ME WEATHER CONDITION","RAINFALL  POSSIBILITY IN NEXT 5 DAYS OR  SOME CLOUD POSSIBILITY","RAJASTHAN","AJMER","MASOODA                                           ","2014-09-08 11:15:58.310"
"KHARIF","AGRICULTURE","Fiber Crops","Cotton (Kapas)","	Plant Protection	","TELL ME INSECT CONTROL IN COTTON ?","SPRAY OF IMIDACHLOPRID 17.8% SL 0.5 ML PER LITER WATER","RAJASTHAN","AJMER","SRINAGAR                                          ","2014-09-08 13:18:23.120"
"KHARIF","AGRICULTURE","Pulses","Green Gram (Moong Bean/ Moong)","	Plant Protection	","INSECT CONTROL IN MOONG","SPRAY OF ACEPHATE 75% SP 2 GM PER LITER WATER","RAJASTHAN","AJMER","MASOODA                                           ","2014-09-08 13:58:00.883"
"KHARIF","AGRICULTURE","Pulses","Green Gram (Moong Bean/ Moong)","	Plant Protection	","TELL ME PLANT PROTECTION IN MOONG","????????? +?????? 75%  ??.??. 2 ????? ????? ???? ??? ??? ??? ?? ?????? ?????","RAJASTHAN","AJMER","BHINAY                                            ","2014-09-08 14:32:53.257"
"KHARIF","HORTICULTURE","Fruits","Grape","Bio-Pesticides and Bio-Fertilizers","TELL ME NOT GROUTH OF","FERTILIZER IN LEMON OF 1 YRS. FYM= 5 KG, UREA= 50 GM, DAP= 50 GM, MOP= 50 GM PER PLANT","RAJASTHAN","AJMER","PISANGAN                                          ","2014-09-08 14:57:09.263"
"KHARIF","AGRICULTURE","Fiber Crops","Cotton (Kapas)","	Plant Protection	","TELL ME  LEAF BORER CONTROL IN COTTON","SPRAY OF INDOXACARB 0.5 MLMPER LIT WATER","RAJASTHAN","AJMER","PISANGAN                                          ","2014-09-08 16:44:50.150"
"KHARIF","AGRICULTURE","Fodder Crops","Lucerne (Alfalfa)","	Plant Protection	","TELL ME ROOT ROT DISEASE CONTROL IN","CARBANDAJIM 250 GRAM/BIGHA","RAJASTHAN","AJMER","ARAIN                                             ","2014-09-08 17:57:12.827"
"KHARIF","HORTICULTURE","Vegetables","Chillies","	Plant Protection	","TELL ME CONTROL ROOT ROT IN CHILLI","DRENCHING OF CARBENDAZIM 1 KG PER HA WITH IRRIGATION","RAJASTHAN","AJMER","MASOODA                                           ","2014-09-08 18:05:40.427"
"KHARIF","AGRICULTURE","Pulses","Green Gram (Moong Bean/ Moong)","	Plant Protection	","TELL ME LEAF MINOR CONTROL IN MOONG","SPRAY OF DIMETHOATE  30% EC 2 ML PER LITER WATER","RAJASTHAN","AJMER","SRINAGAR                                          ","2014-09-08 19:32:01.910"
"KHARIF","HORTICULTURE","Vegetables","Cauliflower","	Plant Protection	","TELL ME ROOT ROT CONTROL IN CAULIFLOWER","DRENCHING OF CARBENDAZIM 1 KG PER HA WITH IRRIGATION","RAJASTHAN","AJMER","KISHANGARH                                        ","2014-09-08 21:48:07.147"
"KHARIF","HORTICULTURE","Vegetables","Tomato","	Plant Protection	","TELL ME CONTROL BLIGHT IN TOMATO","???? ????? ???????? 45 ????? ??? ?? 15  ???? ???? ??? ??? ?? ?????? ?????","RAJASTHAN","AJMER","BHINAY                                            ","2014-09-09 07:16:41.523"
"KHARIF","AGRICULTURE","Fodder Crops","Guar","	Plant Protection	","TELL ME CONTROL  THRIPS IN GOWER","SPRAY OF IMIDACHLOPRID 17.5% SL 0.5 ML PER LITER WATER","RAJASTHAN","AJMER","BHINAY                                            ","2014-09-09 07:25:07.630"
"KHARIF","AGRICULTURE","Others","Others","	Plant Protection	","TELL ME WEATHER INFORMETION IN MY DISTRICT","NO RAIN POSSIBILITY IN NEXT 5 DAYS","RAJASTHAN","AJMER","ARAIN                                             ","2014-09-09 08:09:54.980"
"KHARIF","AGRICULTURE","Fiber Crops","Cotton (Kapas)","	Plant Protection	","WHITE FLY CONTROL IN COTTON","SPRAY OF THIOMETHOXAM 25% WG 0.5 GM  PER LITER WATER","RAJASTHAN","AJMER","KEKRI                                             ","2014-09-09 08:18:35.527"
"KHARIF","AGRICULTURE","Fiber Crops","Cotton (Kapas)","	Plant Protection	","SUCKING PEST IN COTTON","SPRAY OF ACETAMIPRID 20% SP 0.5 GM PER LITER WATER","RAJASTHAN","AJMER","MASOODA                                           ","2014-09-09 09:43:51.043"
"KHARIF","AGRICULTURE","Fiber Crops","Cotton (Kapas)","	Plant Protection	","PEST CONTROL IN COTTON","SPRAY OF ACEPHATE 75% SP 2 GM PER LITER WATER","RAJASTHAN","AJMER","PISANGAN                                          ","2014-09-09 09:47:37.773"
"KHARIF","AGRICULTURE","Fodder Crops","Guar","	Plant Protection	","TELL ME TERMITE CONTROL IN GUAR .","USE CHLOROPYRIFOS 20% EC 4 LITER PER HA WITH IRRIGATION FOR TERMITE CONTROL","RAJASTHAN","AJMER","SRINAGAR                                          ","2014-09-09 10:26:04.570"
"KHARIF","HORTICULTURE","Vegetables","Bitter Gourd","	Plant Protection	","THRIPS IN KAKRI AND BOTTLE GOURD","SPRAY OF DIMETHOATE 30% EC 2 ML PER LITER WATER","RAJASTHAN","AJMER","PISANGAN                                          ","2014-09-09 12:56:10.840"
"KHARIF","AGRICULTURE","Others","Others","Weather","TELL ME WEATHER REPORT ?","RAIN POSSIBILITY IN NEXT 5 DAYS","RAJASTHAN","AJMER","MASOODA                                           ","2014-09-09 13:06:16.460"
"KHARIF","AGRICULTURE","Oilseeds","Mustard","Sowing Time and Weather","TELL ME SOWING TIME OF MUSTARD","MUSTARD SOWING TIME- UN IRRIGATED- 15 SEPTEMBER TO 15 OCTOBER , IRRIGATED- OCTOBER LAST","RAJASTHAN","AJMER","KEKRI                                             ","2014-09-09 13:39:36.570"
"KHARIF","AGRICULTURE","Millets","Sorghum (Jowar/Great Millet)","Cultural Practices","tell me about pest in jowar","use of mithyl parathian @ 5 kg /beegha in jowar","RAJASTHAN","AJMER","SRINAGAR                                          ","2014-09-09 14:07:18.313"
"KHARIF","AGRICULTURE","Millets","Sorghum (Jowar/Great Millet)","	Plant Protection	","TELL ME FARKA CONTROL IN JAWAR","DUSTING OF METHYL PARATHIAN 2% 25 KG PER HA","RAJASTHAN","AJMER","ARAIN                                             ","2014-09-09 16:18:03.357"
"KHARIF","AGRICULTURE","Fiber Crops","Cotton (Kapas)","	Plant Protection	","TELL ME PEST CONTROL OF COTTON","SPARY OF DAIMETHOAT 30% EC 2ML PER LITER WATER","RAJASTHAN","AJMER","MASOODA                                           ","2014-09-09 16:23:06.400"
"KHARIF","AGRICULTURE","Others","Others","Weather","TELL ME ABOUT WEATHER INFORMATION","RAIN FALL POSSIBLE IN NEXT 5 DAYS","RAJASTHAN","AJMER","MASOODA                                           ","2014-09-09 17:17:32.740"
"KHARIF","AGRICULTURE","Fodder Crops","Guar","	Plant Protection	","TELL ME BLIGHT DISEASE CONTROL IN GOWAR","MENKOJEB + CARBANDAJIM 2 GRAM/LITER STREPTOCYCLEAN 2 GRAM/LITER SPRAY","RAJASTHAN","AJMER","KISHANGARH                                        ","2014-09-09 19:50:43.280"
"KHARIF","HORTICULTURE","Vegetables","Cauliflower","Cultural Practices","TELL ME ABOUT FLOWERING IN CAULIFLOWER","LATE FLOWERING IN CAULIFLOWER DUE TO EXCESS USE OF UREA","RAJASTHAN","AJMER","PISANGAN                                          ","2014-09-10 07:51:39.203"
"KHARIF","AGRICULTURE","Pulses","Green Gram (Moong Bean/ Moong)","	Plant Protection	","INSECT CONTROL IN MOONG","SPRAY OF MONOCROTOPHOS 36% SL 2 ML PER LITER WATER","RAJASTHAN","AJMER","BHINAY                                            ","2014-09-10 08:23:15.017"
"KHARIF","HORTICULTURE","Vegetables","Pumpkin","	Plant Protection	","TELL ME FUNGAL DIS. CONTROL IN PUMPKIN.","SPRAY OF CARBENDAZIM 12% + MANCOZEB 63% WP 2 GM PER LITER WATER(SAAF)","RAJASTHAN","AJMER","BHINAY                                            ","2014-09-10 08:46:13.280"
"KHARIF","AGRICULTURE","Others","Others","Soil Testing","SAMPLE FOR TESTING SOIL","DEEG 6-9 INCH DEEP `V` SHAPE PIT AND TACKING 500 GM SOIL SAMPLE FOR TESTING SOIL","RAJASTHAN","AJMER","BHINAY                                            ","2014-09-10 09:24:56.060"
"KHARIF","HORTICULTURE","Vegetables","Bhindi(Okra/Ladysfinger)","	Plant Protection	","TELL ME INSECT CONTROL IN BHINDI ?","SPRAY OF CARBENDAZIM 12% + MANCOZEB 63% WP 2 GM PER LITER WATER","RAJASTHAN","AJMER","ARAIN                                             ","2014-09-10 09:39:47.100"
"KHARIF","HORTICULTURE","Vegetables","Chillies","	Plant Protection	","TELL ME CONTROL OF SUCKING PEST IN CHILLI","SPRAY OF DIMETHOATE  30% EC 2 ML PER LITER WATER","RAJASTHAN","AJMER","KISHANGARH                                        ","2014-09-10 10:17:08.747"
"KHARIF","AGRICULTURE","Others","Others","Weather","TELL ME ABOUT WEATHER INFORMATION","RAINFALL  POSSIBILITY IN NEXT 5 DAYS OR  SOME CLOUD POSSIBILITY","RAJASTHAN","AJMER","KEKRI                                             ","2014-09-10 11:04:00.453"
"KHARIF","AGRICULTURE","Pulses","Black Gram (urd bean)","	Plant Protection	","TELL ME SUCKING PEST CONTROL","SPRAY OF IMIDACHLOPRID(CONFIDOR) 17.8% SL 0.5 ML PER LITER WATER","RAJASTHAN","AJMER","KEKRI                                             ","2014-09-10 12:26:17.400"
"KHARIF","AGRICULTURE","Pulses","Black Gram (urd bean)","	Plant Protection	","TELL ME SUCKING PEST CONTROL","SPRAY OF IMIDACHLOPRID(CONFIDOR) 17.8% SL 0.5 ML PER LITER WATER","RAJASTHAN","AJMER","KEKRI                                             ","2014-09-10 12:29:51.610"
"KHARIF","AGRICULTURE","Others","Others","Cultural Practices","TELL ME WEED CONTROL IN MAIZE .","HAND WEEDING MUST","RAJASTHAN","AJMER","BHINAY                                            ","2014-09-10 12:38:37.303"
"KHARIF","AGRICULTURE","Others","Others","Cultural Practices","TELL ME WEED CONTROL IN MAIZE .","HAND WEEDING MUST","RAJASTHAN","AJMER","BHINAY                                            ","2014-09-10 12:46:30.250"
"KHARIF","AGRICULTURE","Millets","Sorghum (Jowar/Great Millet)","Fertilizer Use and Availability","TELL ME GROWTH IN SORGHUM","SPRAY SOLUBLE NPK  18:18:18 GRADE 10 GM/LTR WATER","RAJASTHAN","AJMER","BHINAY                                            ","2014-09-10 12:51:27.557"
"KHARIF","AGRICULTURE","Fiber Crops","Cotton (Kapas)","	Plant Protection	","TELL ME FLOWER DROP CONTROL IN COTTON","SPRAY OF PLANOFIX 4 ML PER TANKI (16 LITRE WATER)","RAJASTHAN","AJMER","KEKRI                                             ","2014-09-10 15:56:39.690"
"KHARIF","AGRICULTURE","Fiber Crops","Cotton (Kapas)","	Plant Protection	","TELL ME CONTROL FLOWER DROWPIN","SPRAY OF PLANOFIX 1 ML PER 4 LITER WATER FOR FLOWER DROP CONTROL","RAJASTHAN","AJMER","SRINAGAR                                          ","2014-09-10 15:57:06.860"
"RABI","HORTICULTURE","Vegetables","Cauliflower","Seeds and Planting Material","TELL ME VARIETY OF CAULIFLOWER ?","VARIETY OF CAULIFLOWER = PUSA SUKTI, PUSA POUSHJA","RAJASTHAN","AJMER","MASOODA                                           ","2014-09-10 16:36:33.443"
"KHARIF","AGRICULTURE","Fiber Crops","Cotton (Kapas)","	Plant Protection	","TELL ME CONTROL OF INSECT OF COTTON","SPRAY OF IMIDACHLOPRID 17.8% SL 0.5 ML PER LITER WATER","RAJASTHAN","AJMER","PISANGAN                                          ","2014-09-10 17:44:29.040"
"KHARIF","AGRICULTURE","Fiber Crops","Cotton (Kapas)","	Plant Protection	","TELL ME CONTROL OF WHITE FLY IN COTTON ?","SPRAY OF TRIZOPHOS 40% EC 2 ML PER LITER WATER","RAJASTHAN","AJMER","BHINAY                                            ","2014-09-10 18:51:47.423"
"KHARIF","AGRICULTURE","Others","Others","Weather","TELL ME WEATHER INFORMATION","???? 2-3  ????? ??? ????? ?? ????????  ???","RAJASTHAN","AJMER","ARAIN                                             ","2014-09-10 20:19:14.620"
"KHARIF","HORTICULTURE","Vegetables","Bottle Gourd ","Agriculture Mechanization","TELL ME FLOWER DROP CONTROL  IN BOTTLE","SPRAY OF PLANOFIX 1 ML PER 4 LITER WATER FOR FLOWER DROP CONTROL","RAJASTHAN","AJMER","BHINAY                                            ","2014-09-11 06:48:09.513"
"KHARIF","AGRICULTURE","Fiber Crops","Cotton (Kapas)","Cultural Practices","tell me about flower drop in cotton","SPRAY OF PLANOFIX 1 ML PER 4 LITER WATER","RAJASTHAN","AJMER","KISHANGARH                                        ","2014-09-11 08:19:24.940"
"KHARIF","HORTICULTURE","Vegetables","Onion","	Plant Protection	","TELL ME CONTROL OF FUNGAL DISEASE IN ONION ?","SPRAY OF MANCOZEB 2 GM + ACEPHATE 75% SP 2 GM PER LITER WATER","RAJASTHAN","AJMER","KISHANGARH                                        ","2014-09-11 09:53:44.323"
"KHARIF","AGRICULTURE","Fiber Crops","Cotton (Kapas)","	Plant Protection	","TELL ME FLOWER DROPING CONTROL OF COTTON","SPRAY OF PLANOFIX 1 ML PER 4 LITER WATER FOR FLOWER DROP CONTROL","RAJASTHAN","AJMER","BHINAY                                            ","2014-09-11 10:01:15.433"
"KHARIF","HORTICULTURE","Vegetables","Onion","	Plant Protection	","TELL ME INSECT CONTROL IN ONION","SPARY OF DAIMETHOAT 30% EC 2ML PER LITER WATER","RAJASTHAN","AJMER","MASOODA                                           ","2014-09-11 10:29:04.260"
"KHARIF","AGRICULTURE","Others","Others","Weather","TELL ME WEATHER INFORMATION","LIGHT RAIN MAY BE IN NEXT 2-3 DAYS","RAJASTHAN","AJMER","PISANGAN                                          ","2014-09-11 15:57:28.870"
"KHARIF","AGRICULTURE","Others","Others","Weather","TELL ME WEATHER INFORMATION","LIGHT RAIN MAY BE IN NEXT 2-3 DAYS","RAJASTHAN","AJMER","ARAIN                                             ","2014-09-11 17:08:46.670"
"KHARIF","AGRICULTURE","Fodder Crops","Guar","	Plant Protection	","TELL ME CONTROL OF BLIGHT AND JASSID IN GUAR","SPRAY OF DIMETHOATE  30% EC 2 ML PER LITER WATER  
SPRAY OF COPPER OXICHLORIDE 45 GM + STREPTOCYCLIN 1.5 GM PER 15 LITER WATER","RAJASTHAN","AJMER","JAWAJA                                            ","2014-09-12 06:55:29.120"
"KHARIF","AGRICULTURE","Fiber Crops","Cotton (Kapas)","	Plant Protection	","TELL ME CONTROL OF PERA WILT IN COTTON","SPRAY OF COBALT CHLORIDE 8GM DISSOLVE 400 LITRE WATER CAN APPLY PAR BIGHA FOR PERA WILT CONTROL IN COTTON","RAJASTHAN","AJMER","PISANGAN                                          ","2014-09-12 07:35:43.800"
