"Season","Sector","Category","Crop","QueryType","QueryText","KCCAns","StateName","DistrictName","BlockName","CreatedOn"
"KHARIF","HORTICULTURE","Vegetables","Tomato","	Plant Protection	","LOW FLOWERING IN TOMATO","SPRAY OF PLANOFIX 1 ML PER 4 LITER WATER","RAJASTHAN","AJMER","ARAIN                                             ","2014-09-12 08:38:38.277"
"KHARIF","HORTICULTURE","Vegetables","Bhindi(Okra/Ladysfinger)","	Plant Protection	","CONTROL YELLOW VEN MOSEC IN OKRA","1.Methyl demeton AND 2.Dimethoate 2 ml /LITERA WATRE SPRAY","RAJASTHAN","AJMER","MASOODA                                           ","2014-09-12 11:01:29.047"
"KHARIF","AGRICULTURE","Fiber Crops","Cotton (Kapas)","	Plant Protection	","tell me control fo sucking pest in cotten","SPRAY OF THIOMETHOXAM 25% WG 0.5 GM  PER LITER WATER","RAJASTHAN","AJMER","MASOODA                                           ","2014-09-12 11:36:54.970"
"KHARIF","AGRICULTURE","Others","Others","Weather","TELL ME WEATHER REPORT","RAINFALL POSSIBILITY AFTER 2-3 DAYS","RAJASTHAN","AJMER","KEKRI                                             ","2014-09-12 12:30:54.237"
"KHARIF","AGRICULTURE","Fodder Crops","Guar","	Plant Protection	","FLOWER DROPING IN GWAR","PLANOFIX 1 ML/4 LITAR","RAJASTHAN","AJMER","MASOODA                                           ","2014-09-12 15:41:52.583"
"KHARIF","ANIMAL HUSBANDRY","Animal","POULTRY  FARM ","Credit","TELL ME INFORMION IN POULTRY FARM","?????????? ???? ????? ?? ???? ?? ?????? ???- 0141 2350929","RAJASTHAN","AJMER","SRINAGAR                                          ","2014-09-12 15:56:39.633"
"KHARIF","AGRICULTURE","Others","Others","Weather","TELL ME WEATHER CONDITION","RAINFALL  POSSIBILITY IN NEXT 5 DAYS OR  SOME CLOUD POSSIBILITY","RAJASTHAN","AJMER","MASOODA                                           ","2014-09-12 16:12:23.063"
"KHARIF","AGRICULTURE","Fiber Crops","Cotton (Kapas)","	Plant Protection	","TELL ME PEST CONTROL IN COTTON","INDOXICARB 14.5 SL 1 ML /LITER SPRAY","RAJASTHAN","AJMER","SRINAGAR                                          ","2014-09-12 16:29:17.987"
"KHARIF","HORTICULTURE","Vegetables","Chillies","	Plant Protection	","TELL ME CONTROL OF LEAF CURL OF CHILLIES","SPRAY OF INDOXACARB 14.5% SC 1 ML PER LITER WATER","RAJASTHAN","AJMER","PISANGAN                                          ","2014-09-12 17:04:14.417"
"KHARIF","HORTICULTURE","Vegetables","Onion","	Plant Protection	","TELL ME CONTROL OF DISEASE IN ONION ?","DRENCHING OF CARBENDAZIM 250 GM/BIGHA IN ROOT ZONE WITH IRRIGATION","RAJASTHAN","AJMER","MASOODA                                           ","2014-09-12 17:13:22.417"
"KHARIF","AGRICULTURE","Fiber Crops","Cotton (Kapas)","	Plant Protection	","TELL ME PLANT PROTECTION IN COTTON","SPRAY OF INDOXACARB 14.5% SC 1 ML PER LITER WATER","RAJASTHAN","AJMER","MASOODA                                           ","2014-09-12 17:44:03.957"
"KHARIF","AGRICULTURE","Others","Others","Weather","TELL ME WEATHER INFORMATION","RAINFALL POSSIBILITY IN NEXT 5 DAYS","RAJASTHAN","AJMER","PISANGAN                                          ","2014-09-12 18:24:06.020"
"KHARIF","AGRICULTURE","Others","Others","	Plant Protection	","TELL ME PLANT PROTECTION","????????+?????? 75 ??????.??. ??? ?? 2 ????? ????? ???? ???? ??? ??? ??? ?? ?????? ?????","RAJASTHAN","AJMER","SRINAGAR                                          ","2014-09-12 19:33:39.043"
"KHARIF","AGRICULTURE","Others","Others","Weather","TELL ME WEATHER REPORT ?","RAIN POSSIBILITY IN NEXT 3 DAYS","RAJASTHAN","AJMER","BHINAY                                            ","2014-09-12 19:55:23.857"
"KHARIF","HORTICULTURE","Condiments and Spices","Coriander","	Plant Protection	","TELL ME CONTROL OF BRORER I9N CVORIANDER ?","SPRAY OF PROFENOFOS 1.5 ML PER LITER WATER","RAJASTHAN","AJMER","SRINAGAR                                          ","2014-09-12 21:37:32.527"
"KHARIF","AGRICULTURE","Pulses","Bengal Gram (Gram/Chick Pea/Kabuli/Chana)","Seeds","TELL ME SEED RATE OF GRAM ?","SEED RATE OF GRAM = 80 KG PER HA","RAJASTHAN","AJMER","BHINAY                                            ","2014-09-12 21:39:41.560"
"KHARIF","AGRICULTURE","Millets","Maize (Makka)","	Plant Protection	","TELL ME ROOT ROT CONTROL IN MAIZE ?","DRENCHING OF CARBENDAZIM 250 GM/BIGHA IN ROOT ZONE WITH IRRIGATION","RAJASTHAN","AJMER","KEKRI                                             ","2014-09-13 07:38:56.547"
"KHARIF","AGRICULTURE","Fodder Crops","Guar","Cultural Practices","TELL ME CONTROL OF FLOWER DROPING IN GUAR ?","SPRAY OF PLANOFIX 1 ML PER 4 LITER WATER","RAJASTHAN","AJMER","MASOODA                                           ","2014-09-13 08:10:11.117"
"KHARIF","AGRICULTURE","Fodder Crops","Guar","	Plant Protection	","TELL ME CONTROL OF BLIGHT IN GUAR ?","SPRAY OF HEXACONAZOLE 5% EC 2 ML PER LITER WATER","RAJASTHAN","AJMER","SRINAGAR                                          ","2014-09-13 08:21:57.410"
"KHARIF","AGRICULTURE","Fodder Crops","Guar","	Plant Protection	","TELL ME CONTROL OF BLIGHT IN GUAR ?","SPRAY OF HEXACONAZOLE 5% EC 2 ML PER LITER WATER","RAJASTHAN","AJMER","SRINAGAR                                          ","2014-09-13 08:21:59.863"
"KHARIF","AGRICULTURE","Fodder Crops","Guar","	Plant Protection	","TELL ME CONTROL OF BLIGHT IN GUAR ?","SPRAY OF HEXACONAZOLE 5% EC 2 ML PER LITER WATER","RAJASTHAN","AJMER","SRINAGAR                                          ","2014-09-13 08:22:01.437"
"KHARIF","AGRICULTURE","Others","Others","Soil Testing","TELL ME SOIL TESTING INFO.","DEEG 6-9 INCH DEEP `V` SHAPE PIT AND TACKING 500 GM SOIL SAMPLE FOR TESTING SOIL","RAJASTHAN","AJMER","ARAIN                                             ","2014-09-13 11:21:02.010"
"KHARIF","HORTICULTURE","Fruits","Guava","	Plant Protection	","TELL ME FLOWER DROP CONTROL  INGAVE","SPRAY OF PLANOFIX 1 ML PER 4 LITER WATER FOR FLOWER DROP CONTROL","RAJASTHAN","AJMER","KISHANGARH                                        ","2014-09-13 11:53:17.403"
"KHARIF","HORTICULTURE","Fruits","Guava","	Plant Protection	","TELL ME FLOWER DROP CONTROL  INGAVE","SPRAY OF PLANOFIX 1 ML PER 4 LITER WATER FOR FLOWER DROP CONTROL","RAJASTHAN","AJMER","KISHANGARH                                        ","2014-09-13 11:53:48.790"
"KHARIF","HORTICULTURE","Fruits","Guava","	Plant Protection	","TELL ME FLOWER DROP CONTROL  INGAVE","SPRAY OF PLANOFIX 1 ML PER 4 LITER WATER FOR FLOWER DROP CONTROL","RAJASTHAN","AJMER","KISHANGARH                                        ","2014-09-13 11:54:16.680"
"KHARIF","HORTICULTURE","Fruits","Guava","	Plant Protection	","TELL ME FLOWER DROP CONTROL  INGAVE","SPRAY OF PLANOFIX 1 ML PER 4 LITER WATER FOR FLOWER DROP CONTROL","RAJASTHAN","AJMER","KISHANGARH                                        ","2014-09-13 11:54:45.713"
"KHARIF","HORTICULTURE","Fruits","Guava","	Plant Protection	","TELL ME FLOWER DROP CONTROL  INGAVE","SPRAY OF PLANOFIX 1 ML PER 4 LITER WATER FOR FLOWER DROP CONTROL","RAJASTHAN","AJMER","KISHANGARH                                        ","2014-09-13 11:59:03.517"
"KHARIF","HORTICULTURE","Fruits","Guava","	Plant Protection	","TELL ME FLOWER DROP CONTROL  INGAVE","SPRAY OF PLANOFIX 1 ML PER 4 LITER WATER FOR FLOWER DROP CONTROL","RAJASTHAN","AJMER","KISHANGARH                                        ","2014-09-13 12:01:30.927"
"KHARIF","AGRICULTURE","Others","Others","	Plant Protection	","TELL ME DOSES OF CABENDAZIM FORATE AND MICRONUTRIENT IN ORCHARD","DOSES OF CABENDAZIM = 3 GM, FORATE= 50 GM,  AND MICRONUTRIENT = 50 GM PER PLANT IN ORCHARD","RAJASTHAN","AJMER","PISANGAN                                          ","2014-09-13 12:20:22.413"
"KHARIF","HORTICULTURE","Condiments and Spices","Dill Seed","Cultural Practices","TELL ME CONTROL OF WEEDS IN AJWAIN","HAND WEEDING DONE","RAJASTHAN","AJMER","KISHANGARH                                        ","2014-09-13 12:48:15.760"
"KHARIF","AGRICULTURE","Fiber Crops","Cotton (Kapas)","	Plant Protection	","TELL ME FLOWER DROPPING CONTROL IN COTTON","FLOWER/FRUIT DROP CONTROL  SPRAY OF PLANOFIX 1 ML PER 4 LITER WATER","RAJASTHAN","AJMER","BHINAY                                            ","2014-09-13 12:54:04.540"
"KHARIF","HORTICULTURE","Fruits","Papaya","	Plant Protection	","TELL ME  INSECT CONTROL IN PAPAYA","SPARY OF DAIMETHOAT 30% EC 2ML PER LITER WATER","RAJASTHAN","AJMER","BHINAY                                            ","2014-09-13 12:56:54.540"
"KHARIF","AGRICULTURE","Fiber Crops","Cotton (Kapas)","Cultural Practices","TELL ME CONTROL OF FLOWER DROP IN COTTEN","PLANOFIX 1ML/4LITER WATER SPRAY","RAJASTHAN","AJMER","SRINAGAR                                          ","2014-09-13 13:07:03.727"
"KHARIF","AGRICULTURE","Pulses","Bengal Gram (Gram/Chick Pea/Kabuli/Chana)","Market Information","TELL ME MANDI RATE  OF GRAM","JAIPUR (GRAIN)  GRAM 2600 RS/Q.","RAJASTHAN","AJMER","KISHANGARH                                        ","2014-09-13 13:33:48.463"
"KHARIF","AGRICULTURE","Fiber Crops","Cotton (Kapas)","	Plant Protection	","TELL ME NUTRIENT CONTROL IN COTTON","SPRAY OF UREA PHOSPHATE 10 GM/LITER","RAJASTHAN","AJMER","MASOODA                                           ","2014-09-13 14:05:01.510"
"KHARIF","AGRICULTURE","Fiber Crops","Cotton (Kapas)","	Plant Protection	","TELL ME PLANT PROTECTION IN COTTON","????????+?????? 75 ??????.??. ??? ?? 2 ????? ????? ???? ???? ??? ??? ??? ?? ?????? ????? 
SPRAY OF PLANOFIX 2.5 ML PER 10 LITER WATER","RAJASTHAN","AJMER","BHINAY                                            ","2014-09-13 14:28:23.067"
"KHARIF","AGRICULTURE","Fiber Crops","Cotton (Kapas)","Cultural Practices","TELL ME CONTROL OF FLOWER DROP IN COTTEN","PLANOFIX 1ML/4 LITER WATER SPRAY","RAJASTHAN","AJMER","KEKRI                                             ","2014-09-13 14:49:31.330"
"KHARIF","HORTICULTURE","Vegetables","Chillies","	Plant Protection	","TELL ME LEAF CURUL CONTROL IN CHILLIES","SPRAY OF MENCOZEB+ ASEFATE 2 GM/LITER","RAJASTHAN","AJMER","PISANGAN                                          ","2014-09-13 14:52:48.020"
"KHARIF","AGRICULTURE","Fiber Crops","Cotton (Kapas)","	Plant Protection	","TELL ME BACTERIAL BLIGHT CONTROL IN GUAR","SPRAY OF COPPER OXY CHLORIDE 45 GM + STREPTOCYCLIN 1.5 GM PER 15 LITER WATER","RAJASTHAN","AJMER","KISHANGARH                                        ","2014-09-13 15:00:54.303"
"KHARIF","AGRICULTURE","Oilseeds","Mustard","Seeds","TELL ME VARITIES ODF MUSTARD","VRAETIES OF MUSTARD PUSA BOLD, T59, BIO 902, VSUNDHRA, NAVGOLD","RAJASTHAN","AJMER","BHINAY                                            ","2014-09-13 15:32:56.380"
"KHARIF","HORTICULTURE","Vegetables","Cowpea (Vegetable)","	Plant Protection	","TELL ME CONTROL OF BLIGHT IN COWPEA","SPRAY OF CARBENDAZIM 12% + MANCOZEB 63% WP 2 GM PER LITER WATER","RAJASTHAN","AJMER","KISHANGARH                                        ","2014-09-13 16:18:52.237"
"KHARIF","AGRICULTURE","Fiber Crops","Cotton (Kapas)","	Plant Protection	","TELL ME GROWTH IN COTTON","SPRAY OF SOLUBLE NPK 18:18:18 GRADE 10 GM PER LITER WATER","RAJASTHAN","AJMER","BHINAY                                            ","2014-09-13 18:31:02.767"
"KHARIF","AGRICULTURE","Fodder Crops","Guar","	Plant Protection	","tell me about disease in guar","SPRAY OF COPPER OXICHLORIDE 45 GM + STREPTOCYCLIN 1.5 GM PER 15 LITER WATER","RAJASTHAN","AJMER","KISHANGARH                                        ","2014-09-14 06:47:45.360"
"KHARIF","AGRICULTURE","Fiber Crops","Cotton (Kapas)","	Plant Protection	","TELL ME FLOWER DROPPING OF COTTON","SPRAY OF PLANOFIX 1 ML PER 4 LITER WATER FOR FLOWER DROP CONTROL","RAJASTHAN","AJMER","MASOODA                                           ","2014-09-14 08:54:28.313"
"KHARIF","AGRICULTURE","Fodder Crops","Guar","	Plant Protection	","BLIGHT CONTROL IN GUAR","SPRAY OF COPPER OXICHLORIDE 45 GM + STREPTOCYCLIN 1.5 GM PER 15 LITER WATER","RAJASTHAN","AJMER","JAWAJA                                            ","2014-09-14 09:00:40.220"
"KHARIF","AGRICULTURE","Fiber Crops","Cotton (Kapas)","	Plant Protection	","TELL ME CONTROL OF FRUIT DROPPING IN COTTON","SPRAY OF PLANOFIX 1 ML PER 4 LITER WATER","RAJASTHAN","AJMER","KEKRI                                             ","2014-09-14 12:23:50.193"
"KHARIF","AGRICULTURE","Fiber Crops","Cotton (Kapas)","	Plant Protection	","TELL ME CONTROL OF INSECT IN COTTON","SPRAY OF ACEPHATE 75% SP 2 GM PER LITER WATER","RAJASTHAN","AJMER","MASOODA                                           ","2014-09-14 12:29:04.447"
"KHARIF","HORTICULTURE","Vegetables","Onion","	Plant Protection	","TELL ME YELLOW LEAF CONTROL OF ONION","SPRAY OF ZINK SULPHATE 5 GRAM +BHUJA CHUNA 2.5 GRAM PER LITER WATER","RAJASTHAN","AJMER","PISANGAN                                          ","2014-09-14 13:27:00.560"
"KHARIF","AGRICULTURE","Others","Others","Sowing Time and Weather","TELL ME WEATHER INFORMETION","LIGHT RAIN MAY BE NEXT 2-3 DAYS","RAJASTHAN","AJMER","PISANGAN                                          ","2014-09-14 13:45:17.523"
"KHARIF","AGRICULTURE","Fiber Crops","Cotton (Kapas)","	Plant Protection	","TELL ME CONTROL LEAF BORER","SPRAY OF TRIZOPHOS 40% EC 2 ML PER LITER WATER","RAJASTHAN","AJMER","KEKRI                                             ","2014-09-14 14:15:10.213"
"KHARIF","AGRICULTURE","Others","Others","Weather","TELL ME WEATHER CONDITION","???? ??? ???? ???? ????? ??? ????? ?? ??? ???????? ????  ???????? ???? ??? ?????","RAJASTHAN","AJMER","MASOODA                                           ","2014-09-14 15:04:35.503"
"KHARIF","HORTICULTURE","Vegetables","Onion","	Plant Protection	","TERMITE IN ONION","CHLORPYRIPHOS 1 LITAR","RAJASTHAN","AJMER","PISANGAN                                          ","2014-09-14 15:16:19.153"
"KHARIF","AGRICULTURE","Fiber Crops","Cotton (Kapas)","	Plant Protection	","TELL ME CONTROL OF THRIPS IN COTTEN","SPRAY OF THIOMETHOXAM 25% WG 0.5 GM  PER LITER WATER","RAJASTHAN","AJMER","KEKRI                                             ","2014-09-14 17:45:41.770"
"KHARIF","AGRICULTURE","Others","Others","Cultural Practices","TELL ME WEED CONTROL IN DHANIA .","HAND WEEDING MUST","RAJASTHAN","AJMER","SRINAGAR                                          ","2014-09-15 07:13:32.923"
"KHARIF","AGRICULTURE","Fiber Crops","Cotton (Kapas)","	Plant Protection	","tell me control of flower drop of cotton","PLANOFIX 1ML 4 LITER WATER SPRAY","RAJASTHAN","AJMER","SRINAGAR                                          ","2014-09-15 07:19:48.893"
"KHARIF","AGRICULTURE","Pulses","Green Gram (Moong Bean/ Moong)","	Plant Protection	","TELL ME SUCKING PEST CONTROL IN MOONG","SPRAY OF IMIDACHLOPRID 17.8% SL  0.5 ML PER LITER WATER","RAJASTHAN","AJMER","PISANGAN                                          ","2014-09-15 08:28:23.410"
"KHARIF","HORTICULTURE","Vegetables","Brinjal","	Plant Protection	","TELL ME INSECT CONTROL IN BRINJAL ?","SPRAY OF INDOXACARB 14.5% SC 1 ML PER LITER WATER","RAJASTHAN","AJMER","KEKRI                                             ","2014-09-15 08:55:25.820"
"KHARIF","AGRICULTURE","Others","Others","Weather","TELL ME WEATHER INFORMATION","RAINFALL POSSIBILITY IN NEXT 5 DAYS","RAJASTHAN","AJMER","KEKRI                                             ","2014-09-15 10:22:27.167"
"KHARIF","HORTICULTURE","Vegetables","Onion","Fertilizer Use and Availability","TELL ME FERTILIZER IN ONION","SPRAY OF POTASSIUM SULPHATE 0:0:50 10 GM PER LITER WATER","RAJASTHAN","AJMER","KISHANGARH                                        ","2014-09-15 10:23:44.697"
"KHARIF","ANIMAL HUSBANDRY","Animal","Bovine(Cow,Buffalo)","Disease Management","TELL ME INFO ABOUT ANIMAL.","PLEASE CONTACT TO YOUR NEAREST VETERNARY DR. OR VETERNARY HOSPITAL","RAJASTHAN","AJMER","SRINAGAR                                          ","2014-09-15 10:50:38.580"
"KHARIF","AGRICULTURE","Fiber Crops","Cotton (Kapas)","Cultural Practices","tell me about flower drop in cotton","SPRAY OF PLANOFIX 1 ML PER 4 LITER WATER","RAJASTHAN","AJMER","KISHANGARH                                        ","2014-09-15 11:02:04.823"
"RABI","AGRICULTURE","Oilseeds","Mustard","Seeds","TELL ME ABOUT VARITY OF MUSTARD","VARITY OF MUSTARD = PUSA KALYANI , T-59 , LAXMI , BIO-902","RAJASTHAN","AJMER","BHINAY                                            ","2014-09-15 11:31:52.107"
"KHARIF","AGRICULTURE","Fiber Crops","Cotton (Kapas)","	Plant Protection	","TELL ME FUNGUS CONTROL IN COTTON","SPRAY OF COPPER OXICHLORIDE 45 GM + STREPTOCYCLIN 1.5 GM PER 15 LITER WATER","RAJASTHAN","AJMER","ARAIN                                             ","2014-09-15 12:46:50.870"
"RABI","AGRICULTURE","Others","Others","Weather","TELL ME WEATHER INFORMETION IN MY DISTRICT","RAIN POSSIBILITY IN NEXT 2-3 DAYS","RAJASTHAN","AJMER","PISANGAN                                          ","2014-09-15 12:51:21.427"
"KHARIF","AGRICULTURE","Others","Others","Weather","TELL ME WEATHER INFORMETION","IN MY DISTRICT
NO RAIN POSSIBILITY IN NEXT 5 DAYS","RAJASTHAN","AJMER","MASOODA                                           ","2014-09-15 12:58:07.670"
"KHARIF","AGRICULTURE","Others","Others","Weather","TELL ME WEATHER INFORMETION","NO RAIN POSSIBILITY IN NEXT 5 DAYS","RAJASTHAN","AJMER","ARAIN                                             ","2014-09-15 13:07:27.380"
"KHARIF","AGRICULTURE","Pulses","Black Gram (urd bean)","Weather","TELL ME WEATHER INFORMETION","NO RAIN POSSIBILITY IN NEXT 5 DAYS","RAJASTHAN","AJMER","PISANGAN                                          ","2014-09-15 14:39:43.063"
"KHARIF","AGRICULTURE","Fodder Crops","Lucerne (Alfalfa)","Seeds","TELL ME VARITIES OF LUCERNE","VARIETY OF RIJKA= ANAND 2, LLC-3, LLC-5, TYPE-8, TYPE-9","RAJASTHAN","AJMER","KISHANGARH                                        ","2014-09-15 16:38:52.010"
"KHARIF","AGRICULTURE","Oilseeds","Groundnut (pea nut/mung phalli)","	Plant Protection	","TELL ME CONTROL FEROUS DIFFICEANCE","SPRAY OF FEROUS SULPHATE 5 GM PER LITER WATER","RAJASTHAN","AJMER","ARAIN                                             ","2014-09-15 17:34:28.913"
"JAYAD","HORTICULTURE","Vegetables","Brinjal","Bio-Pesticides and Bio-Fertilizers","TELL ME INSECT CONTROL OF","SPRAY OF IMIDACHLOPRID 17.8 % SL 0.5 ML PER LITER WATER","RAJASTHAN","AJMER","ARAIN                                             ","2014-09-15 19:39:47.340"
"KHARIF","AGRICULTURE","Fodder Crops","Guar","	Plant Protection	","TELL ME BLIGHT CONTROL IN GUAR .","SPRAY OF COPPER OXICHLORIDE 45 GM + STREPTOCYCLIN 1.5 GM PER 15 LITER WATER","RAJASTHAN","AJMER","BHINAY                                            ","2014-09-16 07:03:48.200"
"KHARIF","HORTICULTURE","Vegetables","Tomato","	Plant Protection	","FLOWER DROP IN TOMATO","SPRAY OF PLANOFIX 1ML PER 4 LIT. WATER","RAJASTHAN","AJMER","PISANGAN                                          ","2014-09-16 07:35:33.020"
"KHARIF","AGRICULTURE","Fiber Crops","Cotton (Kapas)","	Plant Protection	","TELL ME FLOWER DROPPING CONTROL","SPRAY PLANOFIX 1 ML/4 LIT WATER FOR FLOWER DROP CONTROL","RAJASTHAN","AJMER","PISANGAN                                          ","2014-09-16 08:23:55.060"
"KHARIF","AGRICULTURE","Pulses","Green Gram (Moong Bean/ Moong)","	Plant Protection	","TELL ME CONTROL OF YELLOWING IN MOONGBEAN","SPRAY OF ACEPHATE 75% SP 2 GM PER LITER WATER + MANCOZEB 2GM PAR LITAR WATER","RAJASTHAN","AJMER","SRINAGAR                                          ","2014-09-16 09:37:56.993"
"KHARIF","HORTICULTURE","Fruits","Aonla","Fertilizer Use and Availability","TELL ME GROWTH IN AONLA","USE MICRONUTRIENT 100 GM PER PLANT","RAJASTHAN","AJMER","PISANGAN                                          ","2014-09-16 11:18:34.553"
"KHARIF","AGRICULTURE","Fodder Crops","Guar","	Plant Protection	","SUCKING PEST IN GUAR","SPRAY OF MONOCROTOPHOS 36% SL 2 ML PER LITER WATER","RAJASTHAN","AJMER","KISHANGARH                                        ","2014-09-16 11:23:20.700"
"KHARIF","HORTICULTURE","Vegetables","Brinjal","	Plant Protection	","TELL ME ABOUT PEST IN BRINJAL","SPRAY OF CARBERYL 50% EC 4 GM PER LITER WATER","RAJASTHAN","AJMER","KEKRI                                             ","2014-09-16 11:40:57.890"
"KHARIF","AGRICULTURE","Fodder Crops","Guar","	Plant Protection	","TELL ME SUCKING PEST CONTROL IN GUAR","SPRAY OF IMIDACHLOPRID 17.8% SL 0.5 ML PER LITER WATER","RAJASTHAN","AJMER","KISHANGARH                                        ","2014-09-16 11:55:22.920"
"KHARIF","AGRICULTURE","Others","Others","Soil Testing","TELL ME SYSTEM OF SOIL TESTING","DEEG 6-9 INCH DEEP `V` SHAPE PIT AND TACKING 500 GM SOIL SAMPLE FOR TESTING SOIL","RAJASTHAN","AJMER","SRINAGAR                                          ","2014-09-16 12:39:22.250"
"KHARIF","HORTICULTURE","Vegetables","Cauliflower","	Plant Protection	","GROTH PARMOT OF GUAR","SPRAY OF SOLUBLE NPK 18:18:18 GRADE 10 GM PER LITER WATER","RAJASTHAN","AJMER","PISANGAN                                          ","2014-09-16 13:26:50.643"
"KHARIF","HORTICULTURE","Fruits","Lemon","	Plant Protection	","TELL ME  ISECT CONTROL IN LEMON","SPRAY OF MALATHIAN 50% EC 2 ML PER LITER WATER","RAJASTHAN","AJMER","PISANGAN                                          ","2014-09-16 13:34:53.167"
"KHARIF","AGRICULTURE","Millets","Pearl Millet (Bajra/Bulrush Millet/Spiked Millet)","	Plant Protection	","TELL ME INSECT CONTROL IN LEMON .","DUSTING OF METHYL PARATHIAN 2% 25 KG PER HA","RAJASTHAN","AJMER","MASOODA                                           ","2014-09-16 13:40:20.703"
"RABI","AGRICULTURE","Oilseeds","Indian rapeseed and mustard (yellow sarson)","Seeds","variety of mustard","variety of mustard - bio-902, vasundara, aravali, laxmi","RAJASTHAN","AJMER","KEKRI                                             ","2014-09-16 13:46:03.780"
"KHARIF","AGRICULTURE","Fodder Crops","Guar","	Plant Protection	","TELL ME BACTIRIAL BLIGHT CONTROL","SPRAY OF COPPER OXICHLORIDE 45 GM +  STREPTOCYCLIN 1.5 G PER 15 LITER WATER","RAJASTHAN","AJMER","ARAIN                                             ","2014-09-16 14:46:59.010"
"KHARIF","AGRICULTURE","Fodder Crops","Guar","Cultural Practices","TELL ME CONTROL OF BLIGHT IN GWAR","SPRAY OF COPPER OXICHLORIDE 45 GM + STREPTOCYCLIN 1.5 G PER 15 LITER WATER","RAJASTHAN","AJMER","ARAIN                                             ","2014-09-16 14:50:44.590"
"KHARIF","AGRICULTURE","Fodder Crops","Guar","	Plant Protection	","TELL ME CONTROL WHITE INSECT","SPRAY OF ACETAMIPRID 20% SP 0.5 GM PER LITER WATER","RAJASTHAN","AJMER","PISANGAN                                          ","2014-09-16 15:11:59.440"
"KHARIF","AGRICULTURE","Fiber Crops","Cotton (Kapas)","	Plant Protection	","TELL ME Cercospora leaf spot CONTROL IN COTTON","SPRAY OF Copper- oxy- chloride 3 gram /litre water","RAJASTHAN","AJMER","ARAIN                                             ","2014-09-16 16:28:35.467"
"KHARIF","AGRICULTURE","Others","Others","Weather","TELL ME RAIN INFORMATION","NO RAIN POSSIBILITY IN NEXT 5  DAYS","RAJASTHAN","AJMER","MASOODA                                           ","2014-09-16 20:16:39.220"
"KHARIF","AGRICULTURE","Others","Others","Weather","TELL ME WEATHER REPORT","NO RAINFALL POSSIBILITY IN NEXT 5 DAYS IN YOUR DISTRICTS","RAJASTHAN","AJMER","ARAIN                                             ","2014-09-16 21:06:34.247"
"KHARIF","AGRICULTURE","Others","Others","Government Schemes","tell me about subsidy on pipeline","please contact to ag. supervisor","RAJASTHAN","AJMER","BHINAY                                            ","2014-09-17 08:38:03.210"
"KHARIF","AGRICULTURE","Others","Others","Weather","TELL ME WEATHER INFORMATION","RAINFALL POSSIBILITY IN NEXT 5 DAYS","RAJASTHAN","AJMER","KEKRI                                             ","2014-09-17 08:39:32.150"
"KHARIF","AGRICULTURE","Pulses","Green Gram (Moong Bean/ Moong)","Market Information","TELL ME MANDI RATE OF GREEN GRAM","NAGAUR  MOONG (LOCAL) 6100 RS/Q","RAJASTHAN","AJMER","KEKRI                                             ","2014-09-17 08:49:37.650"
"KHARIF","AGRICULTURE","Fodder Crops","Guar","	Plant Protection	","TELL ME CONTROL OF APHID AND BLIGHT IN GUAR","SPRAY OF DIMETHOATE 30 EC 2ML +  CARBENDAZIM 12% + MANCOZEB 63% WP 2 GM PER LITER WATER","RAJASTHAN","AJMER","MASOODA                                           ","2014-09-17 08:50:03.157"
"KHARIF","AGRICULTURE","Fodder Crops","fodder sorghum","	Plant Protection	","TELL ME CONTROL OF LOCUST IN JAWAR","CYPERMETHRIN 1.5 ML PER LITER WATER SPRAY","RAJASTHAN","AJMER","MASOODA                                           ","2014-09-17 09:46:51.440"
"KHARIF","HORTICULTURE","Flowers","Rose","	Plant Protection	","TELL ME PROPER PLANT GROWTH IN ROSE","SPRAY OF MULTIPLAX MICRONUTRIENT 4 GM PER LITER WATER","RAJASTHAN","AJMER","PISANGAN                                          ","2014-09-17 10:02:41.907"
"KHARIF","HORTICULTURE","Vegetables","Onion","	Plant Protection	","TELL ME DISEASE CONTROL IN ONION","""
 SPARY OF COPPER OXICHLORIDE 3 GM PER LITER WATER ""","RAJASTHAN","AJMER","BHINAY                                            ","2014-09-17 10:04:14.100"
"KHARIF","AGRICULTURE","Pulses","Green Gram (Moong Bean/ Moong)","	Plant Protection	","TELL ME ABOUT PEST IN MOONG","SPRAY OF ACEPHATE 75% SP 2 GM PER LITER WATER","RAJASTHAN","AJMER","KEKRI                                             ","2014-09-17 10:13:12.980"
"KHARIF","AGRICULTURE","Oilseeds","Brown Sarson","Weather","TELL VARIETY OF MUSTARD","VARIETY OF MUSTARD= RGN 73, BIO-902, G M- 2, R H- 819, PUSA BOLD, RGN 48","RAJASTHAN","AJMER","ARAIN                                             ","2014-09-17 12:07:59.823"
"KHARIF","HORTICULTURE","Vegetables","Onion","	Plant Protection	","CALOR ROOT CONTROL IN ONION","CALL CONFRENCE EXPERT","RAJASTHAN","AJMER","KISHANGARH                                        ","2014-09-17 12:46:01.427"
"KHARIF","HORTICULTURE","Vegetables","Onion","	Plant Protection	","TELL ME CALOR ROOT CONTROL IN ONION","CALL CONFRENCE EXPERT","RAJASTHAN","AJMER","KISHANGARH                                        ","2014-09-17 12:48:31.757"
