"Season","Sector","Category","Crop","QueryType","QueryText","KCCAns","StateName","DistrictName","BlockName","CreatedOn"
"KHARIF","HORTICULTURE","Fruits","Lemon","	Plant Protection	","TELL MR FLOWER DROP CONTROL IN","SPRAY OF PLANOFIX 1 ML PER 4 LITER WATER","RAJASTHAN","ALWAR","RAMGARH                                           ","2014-09-02 07:16:30.040"
"KHARIF","HORTICULTURE","Vegetables","Carrot","Agriculture Mechanization","TELL ME  VARIEATY OF CARROT","VARIETY OF CARROT= PUSA RUDHIRA, PUSA ASITA","RAJASTHAN","ALWAR","RAMGARH                                           ","2014-09-02 07:20:56.787"
"KHARIF","AGRICULTURE","Millets","Pearl Millet (Bajra/Bulrush Millet/Spiked Millet)","Varieties","TELL ME BEST VARITIES OF BAJRA.","RAJ-171, ICMH-356, ICTP-8203, WCC-75, HHB-67, RHB-30.","RAJASTHAN","ALWAR","KISHANGARH BAS                                    ","2014-09-03 12:58:34.773"
"KHARIF","AGRICULTURE","Millets","Pearl Millet (Bajra/Bulrush Millet/Spiked Millet)","Varieties","TELL ME BEST VARITIES OF BAJRA.","","RAJASTHAN","ALWAR","KISHANGARH BAS                                    ","2014-09-03 12:59:01.210"
"KHARIF","AGRICULTURE","Millets","Pearl Millet (Bajra/Bulrush Millet/Spiked Millet)","Varieties","TEST CALL","TEST CALL","RAJASTHAN","ALWAR","KISHANGARH BAS                                    ","2014-09-03 13:57:21.757"
"KHARIF","AGRICULTURE","Others","Others","Weather","TELL ME WEATHER INFORMATION","RAINFALL 10 MM NEXT FIVE DAYS OF","RAJASTHAN","ALWAR","KOTKASIM                                          ","2014-09-04 06:51:06.993"
"KHARIF","AGRICULTURE","Fodder Crops","Guar","	Plant Protection	","TELL ME WEED CONTROL GUAR","SPRAY OF IMIZATHYPER 10% SL 400 GM PER HA IN 400 LITER WATER","RAJASTHAN","ALWAR","BEHROR                                            ","2014-09-04 07:23:43.520"
"KHARIF","HORTICULTURE","Vegetables","Chillies","	Plant Protection	","TELL ME PEST CONTROL","SPRAY OF DIMETHOATE 30 EC 2 ML /LITER WATER","RAJASTHAN","ALWAR","RAJGARH                                           ","2014-09-04 07:38:48.277"
"KHARIF","AGRICULTURE","Fiber Crops","Cotton (Kapas)","	Plant Protection	","fruit fall down in cotton","SPRAY OF PLANOFIX 1 ML PER 4 LITER WATER FOR FLOWER DROP CONTROL","RAJASTHAN","ALWAR","RAMGARH                                           ","2014-09-04 10:47:36.843"
"KHARIF","AGRICULTURE","Fiber Crops","Cotton (Kapas)","	Plant Protection	","TELL ME INSECT CONTROL IN COTTON .","SPRAY OF COPPER OXICHLORIDE 45 GM + STREPTOCYCLIN 1.5 GM PER 15 LITER WATER","RAJASTHAN","ALWAR","LACHHMANGARH                                      ","2014-09-04 11:34:41.107"
"KHARIF","AGRICULTURE","Fiber Crops","Cotton (Kapas)","	Plant Protection	","PEST CONTROL IN COTTON","EMIDACLOROPRID 17.8% 0.5M.L./LITERA WATRE SPRAY","RAJASTHAN","ALWAR","MANDAWAR                                          ","2014-09-04 11:45:14.013"
"KHARIF","AGRICULTURE","Pulses","Green Gram (Moong Bean/ Moong)","	Plant Protection	","TELL ME NOT FLOWERING IN MOONG","THIOUREA 0.5 GRAM/LITER SPRAY","RAJASTHAN","ALWAR","KISHANGARH BAS                                    ","2014-09-04 11:57:06.593"
"KHARIF","HORTICULTURE","Vegetables","Bottle Gourd ","	Plant Protection	","thrips in bottle gourd","SPRAY OF IMIDACHLOPRID 17.5% SL 0.5 ML PER LITER WATER","RAJASTHAN","ALWAR","RAMGARH                                           ","2014-09-04 12:18:42.903"
"KHARIF","AGRICULTURE","Others","Others","Weather","TELL ME WEATHER REPORT IN ALWAR","LIGHT RAIN POSSIBILITY IN  NEXT  5 DAYS","RAJASTHAN","ALWAR","BEHROR                                            ","2014-09-04 16:32:20.053"
"KHARIF","HORTICULTURE","Vegetables","Brinjal","Nutrient Management","tell me about no proper growth of brinjal","SPRAY OF MULTIPLAX MICRONUTRIENT 4 GM PER LITER WATER","RAJASTHAN","ALWAR","LACHHMANGARH                                      ","2014-09-05 14:10:45.413"
"KHARIF","HORTICULTURE","Vegetables","Brinjal","Nutrient Management","tell me about no proper growth of brinjal","SPRAY OF MULTIPLAX MICRONUTRIENT 4 GM PER LITER WATER","RAJASTHAN","ALWAR","LACHHMANGARH                                      ","2014-09-05 14:10:45.413"
"KHARIF","HORTICULTURE","Vegetables","Brinjal","	Plant Protection	","tell me pest control","SPRAY OF ACEPHATE 75% SP 2 GM PER LITER WATER","RAJASTHAN","ALWAR","LACHHMANGARH                                      ","2014-09-05 14:18:36.427"
"KHARIF","HORTICULTURE","Vegetables","Brinjal","	Plant Protection	","tell me pest control","SPRAY OF ACEPHATE 75% SP 2 GM PER LITER WATER","RAJASTHAN","ALWAR","LACHHMANGARH                                      ","2014-09-05 14:18:36.427"
"KHARIF","HORTICULTURE","Vegetables","Brinjal","	Plant Protection	","TELL ME PEST CONTROL","SPRAY OF PROFENOFOS 1.5 ML PER LITER WATER","RAJASTHAN","ALWAR","UMREN                                             ","2014-09-05 16:17:29.853"
"KHARIF","HORTICULTURE","Fruits","Pomegranate","	Plant Protection	","FLOWER FALL DOWN IN POMEGRANATE","NO FRUIT IN 4 YEAR IN POMEGRANATE","RAJASTHAN","ALWAR","KOTKASIM                                          ","2014-09-05 18:23:07.107"
"KHARIF","HORTICULTURE","Vegetables","Carrot","	Plant Protection	","WEED CONTROL IN CARROPT","HAND WEEDING DONE","RAJASTHAN","ALWAR","KOTKASIM                                          ","2014-09-05 18:42:55.700"
"KHARIF","HORTICULTURE","Vegetables","Onion","	Plant Protection	","TELL ME CONTROL OF YELLOWING IN ONION","DRENCHING 250 GM CARBENDAZIM PAR BIGHA WITH IRRIGATION","RAJASTHAN","ALWAR","BANSUR                                            ","2014-09-05 19:02:16.297"
"KHARIF","HORTICULTURE","Vegetables","Onion","	Plant Protection	","TELL ME VIRAL DISEASE CONTROL IN ONION","USE SHAP 2GM/LTR","RAJASTHAN","ALWAR","TIJARA                                            ","2014-09-05 19:05:17.640"
"KHARIF","AGRICULTURE","Others","Others","Weather","TELL ME WEATHER CONDATION","IT MAY BE RAIN FAL ON FIVE DAYS","RAJASTHAN","ALWAR","TIJARA                                            ","2014-09-05 19:10:13.423"
"KHARIF","AGRICULTURE","Fiber Crops","Cotton (Kapas)","Bio-Pesticides and Bio-Fertilizers","TELL ME RATE OF GAUR","ALWAR  GOWAR 5200","RAJASTHAN","ALWAR","LACHHMANGARH                                      ","2014-09-05 20:28:14.320"
"KHARIF","HORTICULTURE","Fruits","Pomegranate","	Plant Protection	","TELL ME FRUIT CONTROL IN ANAR","SPRAY OF PLANOFIX 1 ML PER 4 LITER WATER","RAJASTHAN","ALWAR","RENI                                              ","2014-09-05 20:38:35.580"
"KHARIF","HORTICULTURE","Vegetables","Onion","	Plant Protection	","TELL ME CONTROL OF BORER OF ONION","SPRAY OF ACEPHATE 75% SP 2 GM PER LITER WATER","RAJASTHAN","ALWAR","KOTKASIM                                          ","2014-09-05 20:52:19.133"
"KHARIF","AGRICULTURE","Others","Others","Weather","TELL ME WEATHER REPORT IN ALWAR","RAIN FALL POSSIBILITY IN NEXT 5 DAYS, CLOUDY SKY","RAJASTHAN","ALWAR","RAJGARH                                           ","2014-09-05 21:00:22.313"
"KHARIF","HORTICULTURE","Vegetables","Cauliflower","	Plant Protection	","TELL ME BORER CONTROL IN CAULIFLOWER","SPRAY OF IMMECTIN BENZOATE 1 GM PER 3 LITER WATER","RAJASTHAN","ALWAR","BEHROR                                            ","2014-09-06 08:16:52.577"
"KHARIF","HORTICULTURE","Vegetables","Onion","	Plant Protection	","YELLOWING IN ONION","SPRAY OF CARBENDAZIM 12% + MANCOZEB 63% WP 2 GM PER LITER WATER","RAJASTHAN","ALWAR","BANSUR                                            ","2014-09-06 08:22:24.120"
"KHARIF","HORTICULTURE","Fruits","Citrus","	Plant Protection	","TELL MR FLOWER DROP CONTROL IN
CITRUS","SPRAY OF PLANOFIX 1 ML PER 4 LITER WATER","RAJASTHAN","ALWAR","RAJGARH                                           ","2014-09-06 08:33:42.830"
"KHARIF","AGRICULTURE","Fiber Crops","Cotton (Kapas)","	Plant Protection	","TELL ME GROWTH IN COTTON","SPRAY OF MULTIPLAX (MICRONUTRIENT) 4 GM PER LITER WATER","RAJASTHAN","ALWAR","KOTKASIM                                          ","2014-09-06 08:47:33.017"
"KHARIF","AGRICULTURE","Fiber Crops","Cotton (Kapas)","	Plant Protection	","TELL ME INSECT CONTROL IN COTTON .","TELL ME SUCKING PEST CONTROL

SPRAY OF IMIDACHLOPRID 17.8% SL 0.5 ML PER LITER WATER","RAJASTHAN","ALWAR","LACHHMANGARH                                      ","2014-09-06 08:49:07.037"
"KHARIF","AGRICULTURE","Others","Others","	Plant Protection	","TELL ME WEED CONTROL IN WHEAT .","HAND WEEDING MUST","RAJASTHAN","ALWAR","KATHUMAR                                          ","2014-09-06 09:22:42.687"
"KHARIF","HORTICULTURE","Fruits","Citrus","	Plant Protection	","TELL ME PLANT PROTECTION AND NO PAROIPAR GROTH","SPRAY OF COPPER OXICHLORIDE 45 GM + STREPTOCYCLIN 1.5 G PER 15 LITER WATER","RAJASTHAN","ALWAR","LACHHMANGARH                                      ","2014-09-06 09:27:15.857"
"KHARIF","HORTICULTURE","Vegetables","Onion","	Plant Protection	","TELL ME PLANT PROTECTION IN ONION","????????+?????? 75 ??????.??. ??? ?? 2 ????? ????? ???? ???? ??? ??? ??? ?? ?????? ?????","RAJASTHAN","ALWAR","MANDAWAR                                          ","2014-09-06 09:41:27.540"
"KHARIF","AGRICULTURE","Millets","Pearl Millet (Bajra/Bulrush Millet/Spiked Millet)","	Plant Protection	","TELL ME ABOUT PEST IN FODDER BAJRA","DUSTING OF METHYL PARATHIAN 2% 25 KG PER HA","RAJASTHAN","ALWAR","KATHUMAR                                          ","2014-09-06 09:51:35.850"
"KHARIF","AGRICULTURE","Fodder Crops","Guar","	Plant Protection	","TELL ME BLIGHT CONTROL IN GUAR","SPRAY OF COPPER OXICHLORIDE 45 GM + STREPTOCYCLIN 1.5 GM PER 15 LITER WATER","RAJASTHAN","ALWAR","BEHROR                                            ","2014-09-06 10:24:04.260"
"KHARIF","AGRICULTURE","Others","Others","Weather","TEL ME WEATHER INFORMATION","RAIN FALL POSSIBILITY IN NEXT 5 DAYS","RAJASTHAN","ALWAR","BEHROR                                            ","2014-09-06 10:24:38.237"
"KHARIF","HORTICULTURE","Vegetables","Tomato","	Plant Protection	","tell me pest control","SPRAY OF ACEPHATE 75% SP 2 GM PER LITER WATER","RAJASTHAN","ALWAR","BANSUR                                            ","2014-09-06 10:36:08.670"
"KHARIF","AGRICULTURE","Others","Others","Market Information","TELL ME  KHARTHAL MANDI COTTON RATE","NOT AVAILABLE","RAJASTHAN","ALWAR","LACHHMANGARH                                      ","2014-09-06 10:53:28.877"
"KHARIF","AGRICULTURE","Fiber Crops","Cotton (Kapas)","	Plant Protection	","TELL ME  DISEASE CONTROL IN COTTON","SPRAY MANCOZEB 75% WP 2 GM PER LITER WATER","RAJASTHAN","ALWAR","TIJARA                                            ","2014-09-06 11:12:19.117"
"KHARIF","AGRICULTURE","Others","Others","Market Information","GOWER RATE ALWER MANDI","5200 RS/Q GOWER RATE","RAJASTHAN","ALWAR","KOTKASIM                                          ","2014-09-06 11:25:29.730"
"KHARIF","AGRICULTURE","Others","Others","	Plant Protection	","TELL ME TERMITE CONTROL IN WHEAT .","USE CHLOROPYRIFOS 20% EC 15ML/PLANT WITH IRRIGATION","RAJASTHAN","ALWAR","RAMGARH                                           ","2014-09-06 11:40:10.603"
"KHARIF","AGRICULTURE","Others","Others","Weather","TELL ME WEATHER INFORMETION IN MY DISTRICT","NO RAIN POSSIBILITY IN NEXT 5 DAYS","RAJASTHAN","ALWAR","BEHROR                                            ","2014-09-06 11:43:19.410"
"KHARIF","AGRICULTURE","Oilseeds","Sesame (Gingelly/Til)/Sesamum","Cultural Practices","TELL ME ABOUT WEED CONTROL IN TIL","MANUAL WEEDING IN TIL AFTER SOWING","RAJASTHAN","ALWAR","MANDAWAR                                          ","2014-09-06 11:56:29.303"
"KHARIF","AGRICULTURE","Fiber Crops","Cotton (Kapas)","	Plant Protection	","JIVANU ROG IN COTTON","SPRAY OF COPPER OXICHLORIDE 45 GM + STREPTOCYCLIN 1.5 GM PER 15 LITER WATER","RAJASTHAN","ALWAR","MANDAWAR                                          ","2014-09-06 12:12:29.767"
"KHARIF","AGRICULTURE","Others","Others","Weather","TELL ME WEATHER INFORMATION","RAIN MAY BE CONTINUE NEXT 5 DAYS","RAJASTHAN","ALWAR","KISHANGARH BAS                                    ","2014-09-06 13:21:30.773"
"KHARIF","ANIMAL HUSBANDRY","Animal","Bovine(Cow,Buffalo)","Livestock Products Processing and Packaging","NDRI TOLL FREE NO","TOLLFREE HELPLINE FOR VLIVESTOCK 18001801199","RAJASTHAN","ALWAR","LACHHMANGARH                                      ","2014-09-06 14:52:56.520"
"KHARIF","HORTICULTURE","Condiments and Spices","Ginger","Cultural Practices","TELL ME SOWING TIME OF GINGER","APRAIL TO JUNE","RAJASTHAN","ALWAR","TIJARA                                            ","2014-09-06 15:59:46.150"
"KHARIF","AGRICULTURE","Fiber Crops","Cotton (Kapas)","	Plant Protection	","TELL ME YELLOWING IN COTTON","SPRAY OF  NPK 19:19:19 10 GM PER LITER WATER","RAJASTHAN","ALWAR","BANSUR                                            ","2014-09-06 16:37:23.450"
"KHARIF","AGRICULTURE","Others","Others","Weather","TELL ME WEATHER REPORT IN ALWAR","RAIN FALL POSSIBILITY IN NEXT 5 DAYS, CLOUDY SKY","RAJASTHAN","ALWAR","KATHUMAR                                          ","2014-09-06 16:49:22.900"
"KHARIF","AGRICULTURE","Others","Others","Weather","TELL ME WEATHER REPORT ?","LIGHT RAIN MAY BE NEXT 5 DAYS","RAJASTHAN","ALWAR","KOTKASIM                                          ","2014-09-06 17:34:31.440"
"KHARIF","AGRICULTURE","Fiber Crops","Cotton (Kapas)","	Plant Protection	","TERMITE PROBLEM OF COTTON","USE CHLOROPYRIFOS 20% EC 4 LITER PER HA WITH IRRIGATION","RAJASTHAN","ALWAR","KOTKASIM                                          ","2014-09-06 17:50:58.977"
"KHARIF","HORTICULTURE","Vegetables","Onion","	Plant Protection	","CONTROL ROOT ROT IN ONION","CARBENDZIM 300 GRAM /BIGHA SOIL APPLICATION","RAJASTHAN","ALWAR","KISHANGARH BAS                                    ","2014-09-06 17:52:33.180"
"KHARIF","HORTICULTURE","Vegetables","Brinjal","	Plant Protection	","TELL ME SHOOT BORER IN BRINJAL","?????????? ??????? 1 ????? ????? 3 ???? ???? ??? ??? ??? ?? ?????? ????|","RAJASTHAN","ALWAR","RAJGARH                                           ","2014-09-06 19:17:40.677"
"KHARIF","AGRICULTURE","Others","Others","Weather","TELL ME WEATHER REPORT","RAINFALL IN NEXT 2-3 DAYS IN YOUR DISTRICT","RAJASTHAN","ALWAR","BANSUR                                            ","2014-09-06 19:39:59.860"
"KHARIF","HORTICULTURE","Vegetables","Onion","	Plant Protection	","TELL ME PLANT PROTECTION IN ONION","???????????? (??????? ???? ????) 4 ML ????? ???? ???? ??? ??? ?? ?????? ?????
????????????? 12% + ???????? 63% ?????.??. ??? ?? 2  ????? ????? ???? ???? ??? ??? ??? ?? ?????? ?????","RAJASTHAN","ALWAR","BANSUR                                            ","2014-09-06 19:40:55.093"
"KHARIF","AGRICULTURE","Others","Others","Weather","TELL ME WEATHER FORECASTING","NEXT FIVE DAYS RAINFALL","RAJASTHAN","ALWAR","BANSUR                                            ","2014-09-06 20:02:01.847"
"KHARIF","HORTICULTURE","Vegetables","Bhindi(Okra/Ladysfinger)","	Plant Protection	","TELL ME PEST CONTROL IN BHINDI","SPRAY OF IMIDACHLOPRID 17.8% SL 0.5 ML PER LITER WATER","RAJASTHAN","ALWAR","UMREN                                             ","2014-09-06 20:12:40.243"
"KHARIF","AGRICULTURE","Oilseeds","Mustard","	Plant Protection	","SOWING TIME OF MUSTARD","15 SITEMBER TO 15 OCTOMBER SOWING TIME","RAJASTHAN","ALWAR","RAJGARH                                           ","2014-09-06 20:40:54.530"
"KHARIF","AGRICULTURE","Millets","Pearl Millet (Bajra/Bulrush Millet/Spiked Millet)","	Plant Protection	","TELL ME WHITE GRUBS CONTROL IN BAJRA","PIPRONIL 4 KG/BIGHA","RAJASTHAN","ALWAR","KOTKASIM                                          ","2014-09-06 20:56:11.187"
"KHARIF","AGRICULTURE","Others","Others","Weather","TELL ME WEATHER REPORT","RAINFALL POSSIBILITY NEXT 4 DAYS","RAJASTHAN","ALWAR","KATHUMAR                                          ","2014-09-07 07:37:32.957"
"KHARIF","HORTICULTURE","Fruits","Mango","Cultural Practices","TELL ME CONTROL OF FLOWER DROPING IN MANGO ?","SPRAY OF PLANOFIX 1 ML PER 4 LITER WATER FOR FLOWER DROP CONTROL","RAJASTHAN","ALWAR","BANSUR                                            ","2014-09-07 07:57:57.093"
"KHARIF","HORTICULTURE","Vegetables","Brinjal","	Plant Protection	","TELL ME FRUIT BORER CONTROL IN BRINJAL","SPRAY OF INDOXACARB 14.5% SC 0.5 ML PER LITER WATER","RAJASTHAN","ALWAR","LACHHMANGARH                                      ","2014-09-07 08:06:38.983"
"KHARIF","HORTICULTURE","Vegetables","Onion","	Plant Protection	","TELL ME CONTROL OF LEAF ROLLAR IN ONION","SPRAY OF DIMETHOATE  30% EC 2 ML PER LITER WATER  
SPRAY OF CARBENDAZIM 12% + MANCOZEB 63% WP 2 GM PER LITER WATER","RAJASTHAN","ALWAR","THANAGAZI                                         ","2014-09-07 08:13:57.600"
"KHARIF","HORTICULTURE","Vegetables","Onion","	Plant Protection	","TELL ME INSECT CONTROL OF ONION","SPRAY OF DIMETHOATE 30% EC 2 ML PER LITER WATER","RAJASTHAN","ALWAR","KISHANGARH BAS                                    ","2014-09-07 08:22:39.050"
"KHARIF","HORTICULTURE","Vegetables","Tomato","	Plant Protection	","TELL ME CONTROL OF FRUIT ROT IN TOMATO","SPRAY OF CARBENDAZIM 12% + MANCOZEB 63% WP 2 GM PER LITER WATER","RAJASTHAN","ALWAR","THANAGAZI                                         ","2014-09-07 08:28:17.717"
"KHARIF","HORTICULTURE","Vegetables","Bottle Gourd ","	Plant Protection	","TELL ME INSECT CONTROL OF BOTTLE GOURD","SPRAY OF DIMETHOATE 30% EC 2 ML PER LITER WATER","RAJASTHAN","ALWAR","KOTKASIM                                          ","2014-09-07 08:51:39.247"
"KHARIF","HORTICULTURE","Vegetables","Onion","	Plant Protection	","TELL ME MICRONUTRIENT IN ONION.","SPRAY SOLUBLE NPK  18:18:18 GRADE 10 GM/LTR WATER","RAJASTHAN","ALWAR","UMREN                                             ","2014-09-07 08:52:42.377"
"RABI","HORTICULTURE","Vegetables","Cauliflower","	Plant Protection	","TELL ME CONTROL OF YELLOWING IN CAULIFLOWER","SPRAY OF DIMETHOATE  30% EC 2 ML PER LITER WATER  

SPRAY OF CARBENDAZIM 12% + MANCOZEB 63% WP 2 GM PER LITER WATER","RAJASTHAN","ALWAR","TIJARA                                            ","2014-09-07 09:27:59.703"
"KHARIF","AGRICULTURE","Fodder Crops","Guar","	Plant Protection	","TELL ME INSECT CONTROL OF GUAR","SPRAY OF DIMETHOATE 30% EC 2 ML PER LITER WATER","RAJASTHAN","ALWAR","LACHHMANGARH                                      ","2014-09-07 09:50:28.640"
"KHARIF","AGRICULTURE","Others","Others","Weather","LIGHT RAIN MAY BE IN NEXT 2 DAYS","RAINFALL 10 MM NEXT FIVE DAYS OF","RAJASTHAN","ALWAR","RAMGARH                                           ","2014-09-07 10:28:00.500"
"KHARIF","HORTICULTURE","Vegetables","Tomato","	Plant Protection	","TELL ME CONTROL OF FRUIT BORER","SPRAY OF INDOXACARB 14.5% SC 1 ML PER LITER WATER","RAJASTHAN","ALWAR","RAJGARH                                           ","2014-09-07 10:33:27.920"
"KHARIF","AGRICULTURE","Fiber Crops","Cotton (Kapas)","Fertilizer Use and Availability","TELL ME  MICRONUTRENT IN COTTON","SPRAY OF MULTIPLAX (MICRONUTRIENT) 4 GM PER LITER WATER","RAJASTHAN","ALWAR","RAJGARH                                           ","2014-09-07 10:47:56.200"
"KHARIF","AGRICULTURE","Fiber Crops","Cotton (Kapas)","	Plant Protection	","TELL ME BLIGTH IN COTTON","SPRAY OF COPPER OXICHLORIDE 3 GM PER LITER WATER","RAJASTHAN","ALWAR","LACHHMANGARH                                      ","2014-09-07 10:56:00.050"
"KHARIF","AGRICULTURE","Others","Others","Weather","LIGHT RAIN MAY BE IN NEXT 2 DAYS","RAINFALL 10 MM NEXT FIVE DAYS OF","RAJASTHAN","ALWAR","BEHROR                                            ","2014-09-07 11:01:54.747"
"KHARIF","HORTICULTURE","Vegetables","Onion","	Plant Protection	","TELL ME ABOUT PEST IN ONION","SPRAY OF ACEPHATE 75% SP 2 GM PER LITER WATER","RAJASTHAN","ALWAR","BEHROR                                            ","2014-09-07 11:38:53.333"
"RABI","HORTICULTURE","Vegetables","Carrot","	Plant Protection	","TELL ME LOW GROWTH IN CARROT","SPEAY OF POTASSIUM SULPHATE 0:0:50 10 GM PER LITER WATER","RAJASTHAN","ALWAR","MANDAWAR                                          ","2014-09-07 12:27:17.687"
"KHARIF","AGRICULTURE","Others","Others","Cultural Practices","TELL ME MICRONUTRIENT IN COTTON .","SPRAY SOLUBLE NPK  18:18:18 GRADE 10 GM/LTR WATER","RAJASTHAN","ALWAR","MANDAWAR                                          ","2014-09-07 12:42:31.400"
"KHARIF","HORTICULTURE","Vegetables","Onion","Cultural Practices","TELL ME ABOUT GROWTH IN ONION","SPRAY SOLUBLE NPK  0.0.50 GRADE 10 GM/LTR WATER","RAJASTHAN","ALWAR","RAJGARH                                           ","2014-09-07 12:44:45.453"
"KHARIF","AGRICULTURE","Fiber Crops","Cotton (Kapas)","	Plant Protection	","TELL ME CONTROL OF YELLOWING IN COTTON","SPRAY OF MULTIPLAX (MICRONUTRIENT) 3-4 ML PER LITER WATER","RAJASTHAN","ALWAR","KOTKASIM                                          ","2014-09-07 13:50:46.763"
"KHARIF","AGRICULTURE","Fiber Crops","Cotton (Kapas)","	Plant Protection	","TELL ME FLOWER DROP CONTROL IN COTTON","SPRAY OF PLANOFIX 4 ML PER TANKI (16 LITRE WATER)","RAJASTHAN","ALWAR","UMREN                                             ","2014-09-07 14:22:57.250"
"KHARIF","AGRICULTURE","Fiber Crops","Cotton (Kapas)","	Plant Protection	","TELL ME FLOWER DROP CONTROL IN COTTON","SPRAY OF PLANOFIX 4 ML PER TANKI (16 LITRE WATER)","RAJASTHAN","ALWAR","RAMGARH                                           ","2014-09-07 14:42:20.170"
"KHARIF","AGRICULTURE","Fodder Crops","Guar","Market Information","GUAR RATE","4580/-","RAJASTHAN","ALWAR","RAMGARH                                           ","2014-09-07 15:03:28.413"
"KHARIF","AGRICULTURE","Fiber Crops","Cotton (Kapas)","	Plant Protection	","TELL ME PLANT PROTECTION IN COTTON","SPRAY OF MANCOZEB 2 GM + ACEPHATE 75% SP 2 GM PER LITER WATER","RAJASTHAN","ALWAR","KOTKASIM                                          ","2014-09-07 15:16:40.337"
"KHARIF","AGRICULTURE","Others","Others","Weather","TELL ME WEATHER CONDITION","RAINFALL  POSSIBILITY IN NEXT 3 DAYS OR  SOME CLOUD POSSIBILITY","RAJASTHAN","ALWAR","RENI                                              ","2014-09-07 15:46:00.773"
"KHARIF","AGRICULTURE","Others","Others","Weather","TELL ME WEATHER REPORT IN MY DISTRIC","RAIN MAY BE NEXT 2-3 DAYS IN YOUR DISTRICT","RAJASTHAN","ALWAR","BEHROR                                            ","2014-09-07 16:29:07.053"
"KHARIF","AGRICULTURE","Millets","Pearl Millet (Bajra/Bulrush Millet/Spiked Millet)","Market Information","TELL ME MANDI RATE OF BAJRA","ALWAR  BAJRA SMALL RS.1250 /QT.","RAJASTHAN","ALWAR","BANSUR                                            ","2014-09-07 16:44:13.140"
"KHARIF","HORTICULTURE","Vegetables","Pea (Vegetable)","Seeds and Planting Material","TELL ME VAREITY IN PEA","VARIETY OF PEA =KASHI UDAI, PUSA PRAGTI, JAWAHAR MATAR-1","RAJASTHAN","ALWAR","RAMGARH                                           ","2014-09-07 17:21:20.750"
"KHARIF","AGRICULTURE","Others","Others","Weather","TELL ME WEATHER INFORMATION","RAIN POSSIBILITY IN NEXT 5 DAYS","RAJASTHAN","ALWAR","MANDAWAR                                          ","2014-09-07 17:54:13.573"
"KHARIF","HORTICULTURE","Vegetables","Onion","	Plant Protection	","BLIGHT IN  ONION","DIFENACONAJOL 1 ML/LITAR","RAJASTHAN","ALWAR","MANDAWAR                                          ","2014-09-07 18:10:55.500"
"KHARIF","AGRICULTURE","Fiber Crops","Cotton (Kapas)","	Plant Protection	","TELL ME PEST CONTROL OF COTTON","SPARY OF INDOKSAKARB 14.5 % SP 1ML /LITER WATER","RAJASTHAN","ALWAR","BEHROR                                            ","2014-09-07 18:30:23.647"
"KHARIF","AGRICULTURE","Fodder Crops","Guar","	Plant Protection	","TELL ME FUNGAL CONTROL IN GWAR","COC 45+ STREPTYCLNIE 1.5","RAJASTHAN","ALWAR","KATHUMAR                                          ","2014-09-07 18:34:29.487"
"KHARIF","HORTICULTURE","Vegetables","Onion","	Plant Protection	","tell me onion purple blotch control","SPRAY OF Copper oxychloride 2.5 gm/lit water","RAJASTHAN","ALWAR","BANSUR                                            ","2014-09-07 18:39:32.237"
"KHARIF","AGRICULTURE","Others","Others","Government Schemes","SMS ALERT","UR SMS IS ALERTED","RAJASTHAN","ALWAR","LACHHMANGARH                                      ","2014-09-07 19:27:43.357"
"KHARIF","HORTICULTURE","Vegetables","Onion","	Plant Protection	","TELL ME THRIPS CONTROL IN ONION","SPRAY OF DIMETHOATE  30% EC 2 ML PER LITER WATER","RAJASTHAN","ALWAR","UMREN                                             ","2014-09-07 19:27:49.400"
"KHARIF","AGRICULTURE","Others","Others","Weather","TELL ME WEATHER INFORMATION","LIGHT RAINFALL MAY BE OCCUR IN NEXT 3-4 DAYS IN YOUR DISTRICT","RAJASTHAN","ALWAR","KOTKASIM                                          ","2014-09-07 19:46:24.617"
"KHARIF","AGRICULTURE","Others","Others","Weather","TELL ME WEATHER REPORT IN MY DISTRIC","RAIN MAY BE NEXT 2-3 DAYS IN YOUR DISTRICT","RAJASTHAN","ALWAR","RAJGARH                                           ","2014-09-07 19:47:34.903"
"KHARIF","AGRICULTURE","Fiber Crops","Cotton (Kapas)","	Plant Protection	","TELL ME JIVANU ROG IN COTTON","SPRAY OF COPPER OXICHLORIDE 45 GM + STREPTOCYCLIN 1.5 GM PER 15 LITER WATER","RAJASTHAN","ALWAR","TIJARA                                            ","2014-09-07 20:09:41.957"
"KHARIF","HORTICULTURE","Vegetables","Onion","	Plant Protection	","TELL ME CONTROL BORER IN ONION.","???????????? 1.5 ???? ????? ???? ?? ?? ?? ?????? ?????","RAJASTHAN","ALWAR","LACHHMANGARH                                      ","2014-09-07 20:58:30.407"
"KHARIF","AGRICULTURE","Others","Others","Weather","TELL ME WEATHER REPORT IN MY DISTRIC","RAIN MAY BE NEXT 2-3 DAYS IN YOUR DISTRICT","RAJASTHAN","ALWAR","KOTKASIM                                          ","2014-09-07 21:30:45.193"
"RABI","HORTICULTURE","Vegetables","Onion","	Plant Protection	","ROOT ROT CONTROL IN ONION","USE CARBENDAZIM 250 GM/ BHIGA WITH IRRIGATION","RAJASTHAN","ALWAR","KISHANGARH BAS                                    ","2014-09-08 06:32:28.323"
