"Season","Sector","Category","Crop","QueryType","QueryText","KCCAns","StateName","DistrictName","BlockName","CreatedOn"
"RABI","HORTICULTURE","Vegetables","Onion","	Plant Protection	","TELL ME YELLOWING CONTROL IN ONIN","???? ?????? 33% 5 ????? + ???? ??? ???? 2.5 ????? ????? ???? ???? ??? ??? ??? ?? ?????? ?????","RAJASTHAN","ALWAR","KISHANGARH BAS                                    ","2014-09-23 15:16:48.013"
"KHARIF","AGRICULTURE","Fiber Crops","Cotton (Kapas)","	Plant Protection	","TELL ME BLIGHT CONTROL OF COTTON","SPRAY OF COPPER OXICHLORIDE 45 GM + STREPTOCYCLIN 1.5 GM PER 15 LITER WATER","RAJASTHAN","ALWAR","LACHHMANGARH                                      ","2014-09-23 15:23:14.057"
"RABI","AGRICULTURE","Oilseeds","Mustard","Varieties","TELL ME BEST VARITIES OF MUSTARD.","BIO-902, KRANTI, RH-30, VASUNDHARA.","RAJASTHAN","ALWAR","KISHANGARH BAS                                    ","2014-09-23 15:40:00.750"
"KHARIF","AGRICULTURE","Others","Others","Weather","TELL ME WEATHER FORECASTING","Max Temperature ( deg C)       35                  35                  35                  35                  35
Min Temperature ( deg C)       24                  23                  23                  24                  24","RAJASTHAN","ALWAR","KATHUMAR                                          ","2014-09-23 15:41:15.583"
"KHARIF","AGRICULTURE","Others","Others","Cultural Practices","TELL ME WEATHER REPORT","NO RAINFALL NEXT FIVE DAYS","RAJASTHAN","ALWAR","BANSUR                                            ","2014-09-23 15:55:38.910"
"RABI","AGRICULTURE","Oilseeds","Mustard","Varieties","TELL ME VARIETY OF MUSTARD ?","VARIETY OF MUSTARD=NRCDR 2, NRCHB 506 (HYBRID), T59,PUSA BOLD,RH30,BIO902,LAXMI,VASUNDHARA,JAGANNATH,RGN48,73","RAJASTHAN","ALWAR","RAMGARH                                           ","2014-09-23 15:57:03.320"
"KHARIF","AGRICULTURE","Fiber Crops","Cotton (Kapas)","Cultural Practices","TELL ME CONTROL OF FLOWER DROPING IN COTTON ?","SPRAY OF PLANOFIX 1 ML PER 4 LITER WATER","RAJASTHAN","ALWAR","RAMGARH                                           ","2014-09-23 15:58:21.563"
"KHARIF","AGRICULTURE","Others","Others","Weather","TELL ME WEATHER INFORMATION","NO RAINFALL  POSSIBILITY IN NEXT 5 DAYS","RAJASTHAN","ALWAR","RENI                                              ","2014-09-23 16:08:18.027"
"KHARIF","AGRICULTURE","Others","Others","Weather","TELL ME WEATHER FORECASTING","NOT RAINFALL NEXT FIVE DAYS","RAJASTHAN","ALWAR","KOTKASIM                                          ","2014-09-23 16:32:25.450"
"KHARIF","HORTICULTURE","Vegetables","Onion","	Plant Protection	","TELL ME PEST CONTROL OF ONION","SPRAY OF ACEPHATE 75% SP 2 GM PER LITER WATER","RAJASTHAN","ALWAR","KISHANGARH BAS                                    ","2014-09-23 16:43:42.647"
"KHARIF","HORTICULTURE","Vegetables","Onion","	Plant Protection	","TELL ME CONTROL OF FUNGAL DISEASE IN ONION ?","DRENCHING OF CARBENDAZIM 2 GM PER LITER","RAJASTHAN","ALWAR","KISHANGARH BAS                                    ","2014-09-23 17:04:21.523"
"KHARIF","AGRICULTURE","Oilseeds","Mustard","Cultural Practices","TELL ME VARAITIES OF MUSTER","PUSA BOLD,LAXMI,KRANTI,NRCH-506","RAJASTHAN","ALWAR","KATHUMAR                                          ","2014-09-23 18:03:59.823"
"RABI","AGRICULTURE","Others","Others","Weather","tell me weather report in alwar","NO RAINFALL  POSSIBILITY IN NEXT 5 DAYS IN YOUR DISTRICT","RAJASTHAN","ALWAR","KATHUMAR                                          ","2014-09-23 18:15:23.817"
"KHARIF","HORTICULTURE","Vegetables","Onion","	Plant Protection	","TELL ME CONTROL OF FUNGAL DISEASE  IN ONION ?","SPRAY  OF COPPER OXYCHLORIDE 3 GRAM PER LITER WATER","RAJASTHAN","ALWAR","UMREN                                             ","2014-09-23 18:23:12.390"
"KHARIF","HORTICULTURE","Vegetables","Onion","	Plant Protection	","TELL ME PEST CONTROL IN ONION","SPRAY OF INDOXACARB 14.5% SC 10 ML PER 16 LITER WATER","RAJASTHAN","ALWAR","KISHANGARH BAS                                    ","2014-09-23 18:49:29.190"
"RABI","AGRICULTURE","Oilseeds","Mustard","	Plant Protection	","TELL ME CONTROL OF INSECT IN MUSTARD ?","DUSTING OF METHYL PARATHIAN 2% 25 KG PER HA","RAJASTHAN","ALWAR","KATHUMAR                                          ","2014-09-23 20:16:38.790"
"KHARIF","HORTICULTURE","Fruits","Acid Lime","Nutrient Management","TELL ME GROWTH CONTROL IN ACID LIME","SPRAY OF NPK (18-18-18) 10 GRAM PER LITRE WATER","RAJASTHAN","ALWAR","UMREN                                             ","2014-09-23 20:30:58.367"
"KHARIF","AGRICULTURE","Oilseeds","Mustard","	Plant Protection	","VARITY OF MUSTARD","VARIETY OF MUSTARD PUSA KLYANI, PUSA BOLD,KRANTI,LAXMI,T-59, PUSA JAI KISAN , ASIRWAD, VASUNDRA, MAYA","RAJASTHAN","ALWAR","LACHHMANGARH                                      ","2014-09-23 20:34:19.983"
"KHARIF","AGRICULTURE","Others","Others","Weather","TELL ME WEATHER INFORMATION","NO RAIN POSSIBILITY IN NEXT 5 DAYS","RAJASTHAN","ALWAR","KATHUMAR                                          ","2014-09-23 20:36:33.420"
"KHARIF","AGRICULTURE","Oilseeds","Mustard","Varieties","TELL ME MUSTARD VARIETY","VARITIES OF MUSTERD ARAVALI, BIO-902,LAXMI,PUSA GOLD","RAJASTHAN","ALWAR","KISHANGARH BAS                                    ","2014-09-23 20:45:18.117"
"KHARIF","AGRICULTURE","Oilseeds","Mustard","	Plant Protection	","TELL ME PEST CONTROL IN MUSTER","MITHAIL PERATHIYAN 2% 5 KG/BIGHA","RAJASTHAN","ALWAR","KATHUMAR                                          ","2014-09-23 20:53:54.107"
"KHARIF","AGRICULTURE","Others","Others","	Plant Protection	","TELL ME WEATHER INFORMETION IN MY DISTRICT","NO RAIN POSSIBILITY IN NEXT 5 DAYS,BUT SKY CLOUDLY","RAJASTHAN","ALWAR","KISHANGARH BAS                                    ","2014-09-24 06:13:14.603"
"RABI","HORTICULTURE","Vegetables","Onion","	Plant Protection	","PLZ TELL ME CONTROL OF THIRPS IN ONION","SPRAY OF ACIPHATE @ 2GRAM/LITER WATER IN ONION","RAJASTHAN","ALWAR","KATHUMAR                                          ","2014-09-24 06:26:20.870"
"KHARIF","AGRICULTURE","Oilseeds","Mustard","Seeds","VARIETY OF MUSTARD","VARIETY OF MUSTARD= RGN 73, BIO-902, G M- 2, R H- 819, PUSA BOLD, RGN 48,NRCH-506","RAJASTHAN","ALWAR","KATHUMAR                                          ","2014-09-24 06:55:04.517"
"KHARIF","HORTICULTURE","Vegetables","Onion","	Plant Protection	","TELL ME INSECT CONTROL IN ONION ?","SPRAY OF DICIFOL 1.5 ML PER LITER WATER","RAJASTHAN","ALWAR","UMREN                                             ","2014-09-24 06:57:48.623"
"KHARIF","HORTICULTURE","Vegetables","Onion","	Plant Protection	","TELL ME CONTROL OF DISEASE IN ONION ?","SPRAY OF COPPER OXICHLORIDE 3 GM PER LITER WATER","RAJASTHAN","ALWAR","KATHUMAR                                          ","2014-09-24 07:48:37.630"
"KHARIF","HORTICULTURE","Vegetables","Brinjal","	Plant Protection	","TELL ME CONTROL OF INSECT IN BRINJAL ?","SPRAY OF INDOXACARB 14.5% SC 1 ML PER LITER WATER","RAJASTHAN","ALWAR","KATHUMAR                                          ","2014-09-24 07:49:37.220"
"KHARIF","HORTICULTURE","Vegetables","Carrot","	Plant Protection	","TELL ME ROOT ROT CONTROL OF CARROT","USE CARBENDAZIM 250 GM PER BIGHA","RAJASTHAN","ALWAR","BANSUR                                            ","2014-09-24 07:59:26.343"
"KHARIF","AGRICULTURE","Fiber Crops","Cotton (Kapas)","	Plant Protection	","TELL ME LOW GROWTH OF COTTON","SPRAY OF MULTIPLAX (MICRONUTRIENT) 4 GM PER LITER WATER","RAJASTHAN","ALWAR","BEHROR                                            ","2014-09-24 08:09:24.087"
"KHARIF","HORTICULTURE","Vegetables","Onion","	Plant Protection	","TELL ME THRIPS CONTROL IN ONION .","SPRAY OF DIMETHOATE 30% EC 2 ML PER LITER WATER","RAJASTHAN","ALWAR","RAMGARH                                           ","2014-09-24 08:17:55.190"
"KHARIF","AGRICULTURE","Fodder Crops","Guar","	Plant Protection	","TELL ME BACTIRIAL BLIGHT CONTROL IN GUAR","SPRAY OF COPPER OXICHLORIDE 2 GMPER LTR  + STREPTOCYCLIN 2 GM PER 15 LITER WATER","RAJASTHAN","ALWAR","BANSUR                                            ","2014-09-24 08:44:32.657"
"KHARIF","AGRICULTURE","Oilseeds","Indian rapeseed and mustard (yellow sarson)","Seeds","TELL ME SEED TREATMENT OF MUSTARD","USE FOR WHITE RUST  (MENCOJAB+METAXYL)APRON 36 WS 6 GM /KG SEED AND CONTROL OF PENTED BUG IMIDACLOPRID 70 WS 5 GM / KG SEED","RAJASTHAN","ALWAR","BANSUR                                            ","2014-09-24 09:17:02.933"
"RABI","AGRICULTURE","Pulses","Bengal Gram (Gram/Chick Pea/Kabuli/Chana)","	Plant Protection	","TELL ME VARIETY OF GRAM","GRAM VARIETY - GNG-663,469,C235,G130,H208,RSG-44,2,888,895,973,807,963,902,945,GNG- 1581","RAJASTHAN","ALWAR","THANAGAZI                                         ","2014-09-24 09:37:10.810"
"KHARIF","AGRICULTURE","Others","Others","Weather","TEL ME WEATHER INFORMATION","NO RAIN POSSIBILITY IN NEXT 5 DAYS,","RAJASTHAN","ALWAR","RENI                                              ","2014-09-24 09:45:00.383"
"KHARIF","AGRICULTURE","Oilseeds","Mustard","Seeds","TELL","??? ???? ??? ?? ??? ??- 0141-5116242  ???? 
""??	 ????	 ????	 ?? ???? ????? ?? ?????? ????? ""","RAJASTHAN","ALWAR","KATHUMAR                                          ","2014-09-24 09:56:09.313"
"KHARIF","HORTICULTURE","Fruits","Pomegranate","	Plant Protection	","LEAF YELLOW IN POME GRANATE","SPRAY OF MULTIPLAX (MICRONUTRIENT) 4 ML PER LITER WATER","RAJASTHAN","ALWAR","KATHUMAR                                          ","2014-09-24 10:10:25.003"
"KHARIF","AGRICULTURE","Millets","Pearl Millet (Bajra/Bulrush Millet/Spiked Millet)","	Plant Protection	","ABOUT GROTH OF BAJRA","SPRAY OF WATER  SOLUBLE NPK  18:18:18 GRADE 10 GM/LTR WATER","RAJASTHAN","ALWAR","MANDAWAR                                          ","2014-09-24 11:29:55.557"
"KHARIF","AGRICULTURE","Cereals","Wheat","Varieties","tell me about varities of wheat for fodder","raj-3077 is the variety of wheat for fodder","RAJASTHAN","ALWAR","BANSUR                                            ","2014-09-24 12:27:52.037"
"RABI","AGRICULTURE","Oilseeds","Indian rapeseed and mustard (yellow sarson)","Varieties","TELL ME VARIETY OF MUSTARD","MUSTARD VARIETY- T59,PUSA BOLD,RH30,BIO902,LAXMI,VASUNDHARA,JAGANNATH,RGN48,73","RAJASTHAN","ALWAR","KOTKASIM                                          ","2014-09-24 12:52:19.053"
"KHARIF","HORTICULTURE","Vegetables","Onion","	Plant Protection	","TELL ME LOW SIZE IN ONION","SPRAY POTESHIAM SULPHATE  0:0:50   GRADE 10 GM/LTR WATER","RAJASTHAN","ALWAR","MANDAWAR                                          ","2014-09-24 13:06:20.263"
"RABI","AGRICULTURE","Oilseeds","Mustard","Weather","TELL ME SOWING TIME OF MUSTARD ?","SOWING TIME OF MUSTARD - UN IRRIGATED- 15 SEPTEMBER TO 15 OCTOBER , IRRIGATED- OCTOBER LAST","RAJASTHAN","ALWAR","LACHHMANGARH                                      ","2014-09-24 13:09:04.620"
"KHARIF","AGRICULTURE","Others","Others","Weather","TELL ME WEATHER INFORMATION","NO RAIN FALL UP TO 5 DAYS, CLOUDY SKY","RAJASTHAN","ALWAR","RAJGARH                                           ","2014-09-24 13:39:41.053"
"KHARIF","HORTICULTURE","Vegetables","Onion","	Plant Protection	","TELL ME ZINC DEFICIENCY IN ONION","SPRAY OF ZINK SULPHATE 5 GRAM + BUJA HUA CHUNA 2.5 GRAM PER LITER WATER","RAJASTHAN","ALWAR","BEHROR                                            ","2014-09-24 14:57:39.913"
"KHARIF","HORTICULTURE","Condiments and Spices","Garlic","Cultural Practices","TELL ME SOWING TIME OF GARLIC","OCTOBER TO NOVEMBER SOWING TIME OF GARLIC","RAJASTHAN","ALWAR","RAJGARH                                           ","2014-09-24 15:20:40.233"
"KHARIF","HORTICULTURE","Vegetables","Pea (Vegetable)","Cultural Practices","TELL ME VARITIES OF PEA","VARIETY OF PEA - ARKEL , AAJAD P 3 , BONVILE , V L 3 , PANTH UPHAR , LINKAN , PUSA PRAGATI","RAJASTHAN","ALWAR","BANSUR                                            ","2014-09-24 15:41:02.250"
"KHARIF","HORTICULTURE","Vegetables","Radish","Cultural Practices","tell me dose of fertilizer in radish","20kg dap +10 kg potash per bigha fertilizer in radish","RAJASTHAN","ALWAR","BANSUR                                            ","2014-09-24 15:54:47.903"
"KHARIF","HORTICULTURE","Vegetables","Capsicum","	Plant Protection	","TELL ME CONTROL OF BLIGHT IN CHILLI ?","SPRAY OF COPPER OXICHLORIDE 45 GM + STREPTOCYCLIN 1.5 GM PER 15 LITER WATER","RAJASTHAN","ALWAR","THANAGAZI                                         ","2014-09-24 15:57:53.650"
"KHARIF","AGRICULTURE","Oilseeds","Mustard","	Plant Protection	","VARITY OF MUSTARY","VARIETY OF MUSTARD = RH-30,KRANTI,LAXMI,VASUNDRA,BAYO-902","RAJASTHAN","ALWAR","KISHANGARH BAS                                    ","2014-09-24 16:22:15.393"
"KHARIF","HORTICULTURE","Vegetables","Onion","	Plant Protection	","thrips in onion","USE CARBOFURAN 3% G 20-25 KG PER HA","RAJASTHAN","ALWAR","KISHANGARH BAS                                    ","2014-09-24 17:01:44.253"
"KHARIF","AGRICULTURE","Oilseeds","Mustard","	Plant Protection	","varity of mustard","15 sitember to 15 octomber sowing time of mustard","RAJASTHAN","ALWAR","RAJGARH                                           ","2014-09-24 17:18:22.550"
"KHARIF","AGRICULTURE","Fiber Crops","Cotton (Kapas)","Market Information","TELL ME MANDI RATE OF COTTON ?","BIJAYNAGAR MANDI RATE OF  KAPAS 3800 RS/Q","RAJASTHAN","ALWAR","LACHHMANGARH                                      ","2014-09-24 17:25:42.747"
"RABI","AGRICULTURE","Oilseeds","Mustard","Seeds","tell me variety of  , mustard and gram","GRAM VARIETY - RSG 888,807, 945,963, GNG 1581, C 235
MUSTARD VARIETY- T59,PUSA BOLD,RH30,BIO902,LAXMI,VASUNDHARA,JAGANNATH,RGN48,73","RAJASTHAN","ALWAR","BEHROR                                            ","2014-09-24 17:42:34.953"
"KHARIF","HORTICULTURE","Fruits","Lemon","	Plant Protection	","no fruit in lemon","SPRAY OF PLANOFIX 1 ML PER 4 LITER WATER FOR FLOWER DROP CONTROL","RAJASTHAN","ALWAR","UMREN                                             ","2014-09-24 17:43:58.570"
"KHARIF","HORTICULTURE","Vegetables","Peas (field peas/ garden peas/matar)","Cultural Practices","TELL ME VARITIES OF PEA","VARIETY OF PEA - ARKEL , AAJAD P 3 , BONVILE , V L 3 , PANTH UPHAR , LINKAN , PUSA PRAGATI","RAJASTHAN","ALWAR","TIJARA                                            ","2014-09-24 17:50:44.717"
"KHARIF","AGRICULTURE","Others","Others","Weather","TELL ME WEATHER INFORMATION","NO RAIN FALL UP TO 5 DAYS, CLOUDY SKY","RAJASTHAN","ALWAR","RENI                                              ","2014-09-24 18:02:27.807"
"KHARIF","AGRICULTURE","Sugar and Starch Crops","Sugarcane (Noble Cane)","	Plant Protection	","TELL ME BLIGHT CONTROL IN GUAR","SPRAY OF COPPER OXICHLORIDE 45 GM + STREPTOCYCLIN 1.5 GM PER 15 LITER WATER","RAJASTHAN","ALWAR","LACHHMANGARH                                      ","2014-09-24 19:01:52.657"
"KHARIF","AGRICULTURE","Sugar and Starch Crops","Sugarcane (Noble Cane)","	Plant Protection	","TELL ME BLIGHT CONTROL IN GUAR","SPRAY OF COPPER OXICHLORIDE 45 GM + STREPTOCYCLIN 1.5 GM PER 15 LITER WATER","RAJASTHAN","ALWAR","LACHHMANGARH                                      ","2014-09-24 19:01:54.230"
"KHARIF","AGRICULTURE","Sugar and Starch Crops","Sugarcane (Noble Cane)","	Plant Protection	","TELL ME BLIGHT CONTROL IN GUAR","SPRAY OF COPPER OXICHLORIDE 45 GM + STREPTOCYCLIN 1.5 GM PER 15 LITER WATER","RAJASTHAN","ALWAR","LACHHMANGARH                                      ","2014-09-24 19:01:55.823"
"KHARIF","AGRICULTURE","Sugar and Starch Crops","Sugarcane (Noble Cane)","	Plant Protection	","TELL ME BLIGHT CONTROL IN GUAR","SPRAY OF COPPER OXICHLORIDE 45 GM + STREPTOCYCLIN 1.5 GM PER 15 LITER WATER","RAJASTHAN","ALWAR","LACHHMANGARH                                      ","2014-09-24 19:01:57.543"
"KHARIF","AGRICULTURE","Sugar and Starch Crops","Sugarcane (Noble Cane)","	Plant Protection	","TELL ME BLIGHT CONTROL IN GUAR","SPRAY OF COPPER OXICHLORIDE 45 GM + STREPTOCYCLIN 1.5 GM PER 15 LITER WATER","RAJASTHAN","ALWAR","LACHHMANGARH                                      ","2014-09-24 19:01:59.217"
"KHARIF","AGRICULTURE","Others","Others","Weather","TELL ME WEATHER INFORMETION","NO RAIN POSSIBILITY IN NEXT 5 DAYS","RAJASTHAN","ALWAR","LACHHMANGARH                                      ","2014-09-24 19:03:35.957"
"KHARIF","AGRICULTURE","Others","Others","Weather","TELL ME WEATHER INFORMETION","NO RAIN POSSIBILITY IN NEXT 5 DAYS","RAJASTHAN","ALWAR","LACHHMANGARH                                      ","2014-09-24 19:03:37.390"
"KHARIF","AGRICULTURE","Others","Others","Weather","TELL ME WEATHER INFORMETION","NO RAIN POSSIBILITY IN NEXT 5 DAYS","RAJASTHAN","ALWAR","LACHHMANGARH                                      ","2014-09-24 19:03:39.157"
"KHARIF","AGRICULTURE","Others","Others","Weather","TELL ME WEATHER INFORMETION","NO RAIN POSSIBILITY IN NEXT 5 DAYS","RAJASTHAN","ALWAR","LACHHMANGARH                                      ","2014-09-24 19:03:40.733"
"KHARIF","AGRICULTURE","Others","Others","Weather","TELL ME WEATHER INFORMETION","NO RAIN POSSIBILITY IN NEXT 5 DAYS","RAJASTHAN","ALWAR","LACHHMANGARH                                      ","2014-09-24 19:03:42.340"
"KHARIF","AGRICULTURE","Others","Others","Weather","TELL ME WEATHER INFORMETION","NO RAIN POSSIBILITY IN NEXT 5 DAYS","RAJASTHAN","ALWAR","LACHHMANGARH                                      ","2014-09-24 19:03:43.927"
"KHARIF","AGRICULTURE","Others","Others","Weather","TELL ME WEATHER INFORMETION","NO RAIN POSSIBILITY IN NEXT 5 DAYS","RAJASTHAN","ALWAR","RAJGARH                                           ","2014-09-24 19:10:22.980"
"KHARIF","AGRICULTURE","Others","Others","Weather","TELL ME WEATHER INFORMETION","NO RAIN POSSIBILITY IN NEXT 5 DAYS","RAJASTHAN","ALWAR","RAJGARH                                           ","2014-09-24 19:10:25.353"
"KHARIF","AGRICULTURE","Others","Others","Weather","TELL ME WEATHER INFORMETION","NO RAIN POSSIBILITY IN NEXT 5 DAYS","RAJASTHAN","ALWAR","RAJGARH                                           ","2014-09-24 19:10:27.287"
"KHARIF","AGRICULTURE","Others","Others","Weather","TELL ME WEATHER INFORMETION","NO RAIN POSSIBILITY IN NEXT 5 DAYS","RAJASTHAN","ALWAR","RAJGARH                                           ","2014-09-24 19:10:28.907"
"KHARIF","AGRICULTURE","Others","Others","Weather","TELL ME WEATHER INFORMETION","NO RAIN POSSIBILITY IN NEXT 5 DAYS","RAJASTHAN","ALWAR","RAJGARH                                           ","2014-09-24 19:10:31.180"
"KHARIF","AGRICULTURE","Others","Others","Weather","TELL ME WEATHER RERORT","NO RAINFALL NEXT FIVE DAYS","RAJASTHAN","ALWAR","RAJGARH                                           ","2014-09-24 19:10:48.627"
"KHARIF","AGRICULTURE","Others","Others","Weather","TELL ME WEATHER INFORMATION","NO RAIN FALL UP TO 5 DAYS, CLOUDY SKY","RAJASTHAN","ALWAR","KOTKASIM                                          ","2014-09-24 20:34:43.000"
"KHARIF","AGRICULTURE","Oilseeds","Indian rapeseed and mustard (yellow sarson)","Cultural Practices","TELL ME SOWING TIME OF MUSTERD","FIRST WEEK OF OCT. TO LAST WEEK OF OCT,SOWING TIME OF MUSTERD","RAJASTHAN","ALWAR","KATHUMAR                                          ","2014-09-24 20:56:23.900"
"KHARIF","AGRICULTURE","Others","Others","Cultural Practices","TEL ME WEATHER REPORT","NO RAINFALL NEXT FIVE DAYS","RAJASTHAN","ALWAR","UMREN                                             ","2014-09-25 07:02:31.850"
"KHARIF","AGRICULTURE","Millets","Pearl Millet (Bajra/Bulrush Millet/Spiked Millet)","	Plant Protection	","weahter information of alwer dist","no rainfall next five days","RAJASTHAN","ALWAR","RAMGARH                                           ","2014-09-25 07:25:15.740"
"KHARIF","AGRICULTURE","Others","Others","Weather","TELL ME WEATHER INFORMATION","NO RAIN POSSIBILITY IN NEXT 5 DAYS","RAJASTHAN","ALWAR","KATHUMAR                                          ","2014-09-25 07:54:53.803"
"KHARIF","AGRICULTURE","Others","Others","Weather","TELL ME WEATHER INFORMATION","NO RAIN POSSIBILITY IN NEXT 5 DAYS","RAJASTHAN","ALWAR","TIJARA                                            ","2014-09-25 08:07:38.233"
"KHARIF","HORTICULTURE","Vegetables","Onion","	Plant Protection	","tell me control root problem and thrips in onion","USE CARBOFURAN 3% G 20-25 KG PER HA","RAJASTHAN","ALWAR","KOTKASIM                                          ","2014-09-25 08:34:49.403"
"KHARIF","AGRICULTURE","Others","Others","Weather","TELL ME WEATHER INFORMATION","RAINFALL POSSIBILITY IN NEXT 5 DAYS","RAJASTHAN","ALWAR","UMREN                                             ","2014-09-25 09:10:05.320"
"KHARIF","AGRICULTURE","Fodder Crops","Guar","	Plant Protection	","TELL ME BLIGHT CONTROL IN GUAR","SPRAY OF COPPER OXICHLORIDE 45 GM + STREPTOCYCLIN 1.5 GM PER 15 LITER WATER","RAJASTHAN","ALWAR","BEHROR                                            ","2014-09-25 09:35:48.403"
"KHARIF","HORTICULTURE","Vegetables","Onion","	Plant Protection	","root proble in onion","USE CARBOFURAN 3% G 20-25 KG PER HA","RAJASTHAN","ALWAR","LACHHMANGARH                                      ","2014-09-25 09:37:54.223"
"KHARIF","HORTICULTURE","Vegetables","Brinjal","	Plant Protection	","TELL ME INSECT CONTROL IN BRINJAL .","SPRAY OF TRIZOPHOS 40% EC 2 ML PER LITER WATER","RAJASTHAN","ALWAR","KATHUMAR                                          ","2014-09-25 09:38:21.420"
"RABI","AGRICULTURE","Oilseeds","Mustard","Varieties","TELL ME VARIETY OF MUSTARD","VARIETY OF MUSTARD= RGN 73, BIO-902, G M- 2, R H- 819, PUSA BOLD, RGN 48","RAJASTHAN","ALWAR","KATHUMAR                                          ","2014-09-25 09:46:48.400"
"RABI","HORTICULTURE","Vegetables","Onion","	Plant Protection	","TEEL ME YELLOW LEAF OF ONION","SPRAY OF ZINK SULPHATE  5 GRAM +UREA 10 GRAM PER LITER WATER","RAJASTHAN","ALWAR","RAJGARH                                           ","2014-09-25 09:59:23.833"
"KHARIF","HORTICULTURE","Vegetables","Onion","	Plant Protection	","TELL ME INSECT CONTROL IN ONION .","SPRAY OF DIMETHOATE 30% EC 2 ML PER LITER WATER","RAJASTHAN","ALWAR","KISHANGARH BAS                                    ","2014-09-25 10:13:10.323"
"KHARIF","HORTICULTURE","Vegetables","Onion","	Plant Protection	","TELL ME YELLOWING CONTROL IN ONION .","SPRAY OF ZINK SALFET 5 GRAM +BHUJA CHUNA 2.5 GRAM PER LITER WATER","RAJASTHAN","ALWAR","UMREN                                             ","2014-09-25 10:33:22.790"
"KHARIF","AGRICULTURE","Others","Others","Weather","TELL ME WEATHER INFORMATION","NO RAIN POSSIBILITY IN NEXT 5 DAYS","RAJASTHAN","ALWAR","LACHHMANGARH                                      ","2014-09-25 10:43:56.170"
"RABI","HORTICULTURE","Vegetables","Potato","	Plant Protection	","TELL ME SEED TREATMENT IN POTATO ?","DEEP POTATO IN CARBENDAZIM 2 GM PER LITER WATER SOLUTION","RAJASTHAN","ALWAR","RAMGARH                                           ","2014-09-25 10:44:55.763"
"KHARIF","AGRICULTURE","Others","Others","Weather","TELL ME WEATHER INFORMATION","NO RAIN POSSIBILITY IN NEXT 5 DAYS","RAJASTHAN","ALWAR","RENI                                              ","2014-09-25 10:53:39.437"
"KHARIF","HORTICULTURE","Fruits","Lemon","	Plant Protection	","THRIPS IN LEMON","BOREX POWDER 4 GRAM /PAR LITER WATER SPREY","RAJASTHAN","ALWAR","LACHHMANGARH                                      ","2014-09-25 10:58:53.883"
"RABI","AGRICULTURE","Oilseeds","Mustard","Market Information","TELL ME MARKET RATE OF MUSTARD ?","MARKET RATE OF MUSTARD = 3150/- PER QUINTAL IN KHAIRTHAL MANDI","RAJASTHAN","ALWAR","MANDAWAR                                          ","2014-09-25 11:23:13.327"
"KHARIF","AGRICULTURE","Fiber Crops","Cotton (Kapas)","	Plant Protection	","TELL ME CONTROL OF PARAWILT IN COTTON","SPRAY OF COBALT CLORIDE 2 GM IN 100 LTR WATER","RAJASTHAN","ALWAR","UMREN                                             ","2014-09-25 12:58:05.887"
"KHARIF","AGRICULTURE","Oilseeds","Mustard","Fertilizer Use and Availability","TELL ME SULFER DOSE IN MUSTERD","SULFER 10-15 KG/BIGHA","RAJASTHAN","ALWAR","KISHANGARH BAS                                    ","2014-09-25 14:27:32.990"
"KHARIF","HORTICULTURE","Vegetables","Onion","	Plant Protection	","TELL ME DISEASE CONTROL OF ONION","SPRAY OF RIDOMIL MZ 2 GM PER LITER WATER","RAJASTHAN","ALWAR","KISHANGARH BAS                                    ","2014-09-25 15:03:40.537"
"KHARIF","AGRICULTURE","Oilseeds","Brown Sarson","	Plant Protection	","RATE OF MUSTERDS","KHERLI  MUSTARD (LAHA) 3400","RAJASTHAN","ALWAR","KATHUMAR                                          ","2014-09-25 15:18:40.913"
"KHARIF","HORTICULTURE","Vegetables","Onion","	Plant Protection	","PEST PROBLEM OF ONION","SPRAY OF DIMETHOATE 30% EC 2 ML PER LIT WATER","RAJASTHAN","ALWAR","RAJGARH                                           ","2014-09-25 16:16:31.900"
"KHARIF","HORTICULTURE","Vegetables","Onion","	Plant Protection	","TELL ME LEAF YELLOWING IN ONION","MENKOJEB 2 GRAM/LITER + DAIMITHIYOT 30EC 2ML /LITER SPRAY","RAJASTHAN","ALWAR","KATHUMAR                                          ","2014-09-25 18:49:33.257"
"JAYAD","AGRICULTURE","Others","Others","Weather","TELL ME WEATHER REPORT IN MY DISTRICT","NO RAIN POSSIBILITY IN NEXT FIVE DAY,CLOUDY SKY","RAJASTHAN","ALWAR","RAJGARH                                           ","2014-09-25 18:58:03.927"
"KHARIF","HORTICULTURE","Vegetables","Onion","	Plant Protection	","TELL ME PEST CONTROL OF ONION","SPRAY OF ACEPHATE 75% SP 2 GM PER LITER WATER","RAJASTHAN","ALWAR","RAMGARH                                           ","2014-09-25 19:07:31.840"
"RABI","HORTICULTURE","Vegetables","Onion","	Plant Protection	","TELL ME ABOUT PEST CONTROL IN ONION","SPRAY OF CARBENDAZIM 12% + MANCOZEB 63% WP 2 GM PER LITER WATER","RAJASTHAN","ALWAR","RAMGARH                                           ","2014-09-25 19:13:50.793"
"RABI","AGRICULTURE","Oilseeds","Brown Sarson","	Plant Protection	","TELL ME ABOUT VARIETY OF MUSTARD","VARIETY OF MUSTARD= ARAWALI, VASHUNDHRA, SAWARN JYOTI

VARIETY OF MUSTARD= BIO-902, G M- 2, R H- 819","RAJASTHAN","ALWAR","KATHUMAR                                          ","2014-09-25 19:32:38.127"
