"Season","Sector","Category","Crop","QueryType","QueryText","KCCAns","StateName","DistrictName","BlockName","CreatedOn"
"KHARIF","AGRICULTURE","Oilseeds","Soybean (bhat)","	Plant Protection	","WEED CONTROL IN SOYABEAN AFTER 45 DAYS OF SOWING","HAND HOWING IN SOYABEAN","RAJASTHAN","DUNGARPUR","SIMALWARA                                         ","2014-09-06 07:13:32.150"
"KHARIF","AGRICULTURE","Oilseeds","Soybean (bhat)","	Plant Protection	","TELL ME WEED CONTROL IN SOYBEAN","NO USE OF HERBICIDE","RAJASTHAN","DUNGARPUR","ASPUR                                             ","2014-09-06 18:56:37.420"
"KHARIF","AGRICULTURE","Others","Others","Weather","TELL ME WEATHER INFORMATION","LIGHT RAINFALL MAY BE OCCUR IN NEXT 3-4 DAYS IN YOUR DISTRICT","RAJASTHAN","DUNGARPUR","ASPUR                                             ","2014-09-06 19:00:07.167"
"KHARIF","AGRICULTURE","Others","Others","Weather","TELL ME WEATHER CONDITION","RAINFALL  POSSIBILITY IN NEXT 5 DAYS OR  SOME CLOUD POSSIBILITY","RAJASTHAN","DUNGARPUR","BICHIWARA                                         ","2014-09-06 20:49:05.250"
"KHARIF","HORTICULTURE","Vegetables","Chillies","	Plant Protection	","TELL ME SUCKING PEST CONTROL","SPRAY OF IMIDACHLOPRID 17.8% SL 0.5 ML PER LITER WATER","RAJASTHAN","DUNGARPUR","BICHIWARA                                         ","2014-09-07 10:46:18.763"
"KHARIF","HORTICULTURE","Vegetables","Chillies","	Plant Protection	","TELL ME MICRONUTRIENT IN CHILLIES .","SPRAY SOLUBLE NPK  18:18:18 GRADE 10 GM/LTR WATER","RAJASTHAN","DUNGARPUR","BICHIWARA                                         ","2014-09-08 06:43:38.987"
"KHARIF","AGRICULTURE","Fiber Crops","Cotton (Kapas)","	Plant Protection	","TELL ME FLOWER CONTROL IKN COTTON","SPRAY OF PLANOFIX 1 ML PER 4 LITER WATER","RAJASTHAN","DUNGARPUR","SIMALWARA                                         ","2014-09-08 18:17:21.253"
"KHARIF","AGRICULTURE","Oilseeds","Groundnut (pea nut/mung phalli)","	Plant Protection	","TELL ME THRIPS IN GROUNDNUT","SPRAY OF IMIDACHLOPRID 17.5% SL 0.5 ML PER LITER WATER","RAJASTHAN","DUNGARPUR","BICHIWARA                                         ","2014-09-09 20:16:11.980"
"KHARIF","AGRICULTURE","Oilseeds","Soybean (bhat)","	Plant Protection	","TELL ME INSECT CONTROL IN SOYABEN","SPRAY OF ACEPHATE 75%SP 2 GRAM PER LITER WATER","RAJASTHAN","DUNGARPUR","ASPUR                                             ","2014-09-10 10:13:02.303"
"KHARIF","HORTICULTURE","Vegetables","Chillies","	Plant Protection	","TELL ME SUCKING PEST CONTROL IN CHILLIES .","SPRAY OF IMIDACHLOPRID 17.8% SL 0.5 ML PER LITER WATER","RAJASTHAN","DUNGARPUR","SIMALWARA                                         ","2014-09-12 07:31:52.833"
"KHARIF","AGRICULTURE","Millets","Maize (Makka)","	Plant Protection	","TELL ME PEST CONTROL IN MAKKA","SPRAY OF ACEPHATE 75%SP 2 GRAM PER LITER WATER","RAJASTHAN","DUNGARPUR","DUNGARPUR                                         ","2014-09-13 20:18:21.560"
"KHARIF","AGRICULTURE","Millets","Maize (Makka)","	Plant Protection	","TELL ME LEAF YELLOWING IN MAIZE","MENKOJEB 2 GRAM/LITER SPRAY","RAJASTHAN","DUNGARPUR","SIMALWARA                                         ","2014-09-13 20:19:20.713"
"KHARIF","AGRICULTURE","Oilseeds","Soybean (bhat)","	Plant Protection	","tell me control of insect of soyabean","SPRAY OF MONOCROTOPHOS 36% SL 2 ML PER LITER WATER","RAJASTHAN","DUNGARPUR","ASPUR                                             ","2014-09-14 14:38:50.507"
"KHARIF","AGRICULTURE","Oilseeds","Soybean (bhat)","	Plant Protection	","TELL ME SHOOT BORER IN SOYABEAN","SPRAY OF TRIZOPHOS 40% EC 2 ML PER LITER WATER","RAJASTHAN","DUNGARPUR","ASPUR                                             ","2014-09-14 14:53:48.107"
"KHARIF","HORTICULTURE","Vegetables","Brinjal","	Plant Protection	","TELL ME INSECT CONTROL IN BRINJAL ?","SPRAY OF IMMECTIN BENZOATE 1 GM PER 3 LITER WATER","RAJASTHAN","DUNGARPUR","ASPUR                                             ","2014-09-15 09:39:16.593"
"KHARIF","AGRICULTURE","Pulses","Bengal Gram (Gram/Chick Pea/Kabuli/Chana)","	Plant Protection	","TELL ME SEED TREATMENT FOR ROOT ROT IN GRAM","USE CARBENDAZIM 2 GM PER KG SEED","RAJASTHAN","DUNGARPUR","ASPUR                                             ","2014-09-16 09:02:57.747"
"KHARIF","HORTICULTURE","Vegetables","Brinjal","	Plant Protection	","TELL ME CONTROL OF TOP BORER IN BRINJAL","SPRAY OF INDOXACARB 14.5% SC 1 ML PER LITER WATER","RAJASTHAN","DUNGARPUR","SIMALWARA                                         ","2014-09-17 08:24:54.730"
"KHARIF","AGRICULTURE","Oilseeds","Mustard","	Plant Protection	","TELL ME VARIETY OF MUSTARD","MUSTARD VARIETY- T59,PUSA BOLD,RH30,BIO902,LAXMI,VASUNDHARA,JAGANNATH,RGN48,73","RAJASTHAN","DUNGARPUR","ASPUR                                             ","2014-09-17 09:13:32.927"
"KHARIF","AGRICULTURE","Oilseeds","Soybean (bhat)","	Plant Protection	","TELL ME CONTROL OF BORER IN SOYABEAN","SPRAY OF INDOXACARB 14.5% SC 1 ML PER LITER WATER","RAJASTHAN","DUNGARPUR","SAGWARA                                           ","2014-09-17 13:08:39.270"
"KHARIF","AGRICULTURE","Oilseeds","Soybean (bhat)","	Plant Protection	","TELL ME DISEASE CONTROL OF SOYBEAN","SPRAY MANCOZEB 75% WP 2 GM PER LITER WATER","RAJASTHAN","DUNGARPUR","DUNGARPUR                                         ","2014-09-17 17:44:19.213"
"KHARIF","AGRICULTURE","Oilseeds","Soybean (bhat)","	Plant Protection	","TELL ME  INSECT CONTROL IN SOYABEAN","SPRAY OF MONOCROTOPHOS 36% SL 2 ML PER LITER WATER","RAJASTHAN","DUNGARPUR","BICHIWARA                                         ","2014-09-18 10:15:24.930"
"KHARIF","AGRICULTURE","Oilseeds","Soybean (bhat)","	Plant Protection	","TELL ME  INSECT CONTROL IN SOYABEAN","SPRAY OF MONOCROTOPHOS 36% SL 2 ML PER LITER WATER","RAJASTHAN","DUNGARPUR","BICHIWARA                                         ","2014-09-18 10:18:18.267"
"KHARIF","AGRICULTURE","Oilseeds","Soybean (bhat)","	Plant Protection	","TELL ME  LEAF BORER CONTROL IN SOYABEAN","SPRAY OF MONOCROTOPHOS 36% SL 2 ML PER LITER WATER","RAJASTHAN","DUNGARPUR","ASPUR                                             ","2014-09-19 10:00:50.857"
"KHARIF","AGRICULTURE","Others","Others","Government Schemes","TELL ME SUBSIDY ON SEED DRILL","SUBSIDY ON SEED DRILL= 50% OF TOTAL COST OR 15000/- MAXIMUM","RAJASTHAN","DUNGARPUR","DUNGARPUR                                         ","2014-09-19 14:17:08.363"
"KHARIF","HORTICULTURE","Fruits","Citrus","Nutrient Management","TELL ME NUTRIENT MANAGEMENT ?","USE MICRONUTRIENT 100 GM PER PLANT","RAJASTHAN","DUNGARPUR","SAGWARA                                           ","2014-09-19 19:33:56.250"
"KHARIF","AGRICULTURE","Others","Others","Weather","TELL ME WEATHER INFORMATION","NO RAIN POSSIBILITY IN NEXT 5 DAYS","RAJASTHAN","DUNGARPUR","ASPUR                                             ","2014-09-20 11:07:14.710"
"KHARIF","AGRICULTURE","Oilseeds","Soybean (bhat)","	Plant Protection	","TELL ME CONTROL OF BORER IN SOYABEAN ?","SPRAY OF PROFENOFOS 1.5 ML PER LITER WATER","RAJASTHAN","DUNGARPUR","ASPUR                                             ","2014-09-21 07:49:11.297"
"KHARIF","AGRICULTURE","Millets","Maize (Makka)","	Plant Protection	","TELL ME CONTROL OF BORER IN MAIZE","SPRAY OF MONOCROTOPHOS 36% SL 2 ML PER LITER WATER","RAJASTHAN","DUNGARPUR","SIMALWARA                                         ","2014-09-21 08:28:38.980"
"KHARIF","AGRICULTURE","Pulses","Black Gram (urd bean)","	Plant Protection	","TELL ME ABOUT PEST IN URD","SPRAY OF PROFENOFOS 50 EC 1.5 ML PER LITER WATER","RAJASTHAN","DUNGARPUR","ASPUR                                             ","2014-09-21 10:39:12.480"
"KHARIF","AGRICULTURE","Oilseeds","Soybean (bhat)","	Plant Protection	","TELL ME CONTROL GARDER BITTEL","SPRAY OF TRIZOPHOS 40% EC 2 ML PER LITER WATER","RAJASTHAN","DUNGARPUR","SIMALWARA                                         ","2014-09-22 14:22:07.223"
"KHARIF","AGRICULTURE","Oilseeds","Soybean (bhat)","	Plant Protection	","THRIPS IN SOYABEEN","PROPHENOPHOSE 2 GRAM /PAR LITER WATER SPREY","RAJASTHAN","DUNGARPUR","SAGWARA                                           ","2014-09-23 16:47:55.483"
"KHARIF","AGRICULTURE","Others","Others","Weather","TELL ME WEATHER INFORMATION","NO RAIN FALL NEXT  5 DAYS BUT CLOUDY SKY","RAJASTHAN","DUNGARPUR","SIMALWARA                                         ","2014-09-24 21:12:05.423"
"KHARIF","AGRICULTURE","Oilseeds","Soybean (bhat)","	Plant Protection	","TELL ME PIG CONTROL IN FARM.","CALL ESCLATE TO EXPERT","RAJASTHAN","DUNGARPUR","ASPUR                                             ","2014-09-26 09:14:12.347"
"RABI","AGRICULTURE","Others","Others","Government Schemes","TELL ME SUBSIDY OF SOLAR SYSTEM","TO CONTACT NEAREST AGRICULTURE DEPARTMENT","RAJASTHAN","DUNGARPUR","BICHIWARA                                         ","2014-09-26 09:22:49.657"
"KHARIF","AGRICULTURE","Others","Others","	Plant Protection	","TELL ME VARI","VARIETY OF MUSTARD= ARAWALI, VASHUNDHRA, SAWARN JYOTI","RAJASTHAN","DUNGARPUR","DUNGARPUR                                         ","2014-09-26 20:15:31.880"
"KHARIF","AGRICULTURE","Oilseeds","Soybean (bhat)","	Plant Protection	","PEST CONTROL IN SOYBEAN","SPRAY OF PROFENOFOS 1.5 ML PER LITER WATER","RAJASTHAN","DUNGARPUR","DUNGARPUR                                         ","2014-09-27 11:36:19.590"
"KHARIF","HORTICULTURE","Vegetables","Beet Root (Garden Beet/Stock Beet)","Cold Storage","TELL ME WEATHER INFORMETION","RAIN POSSIBILITY IN NEXT 5 DAYS","RAJASTHAN","DUNGARPUR","SIMALWARA                                         ","2014-09-27 20:39:52.673"
"KHARIF","HORTICULTURE","Vegetables","Beet Root (Garden Beet/Stock Beet)","Cold Storage","TELL ME WEATHER INFORMETION","RAIN POSSIBILITY IN NEXT 5 DAYS","RAJASTHAN","DUNGARPUR","SIMALWARA                                         ","2014-09-27 20:39:54.693"
"KHARIF","HORTICULTURE","Vegetables","Chillies","	Plant Protection	","ROOT ROT IN CHILLI","DRENCHING OF CARBENDAZIM 2 GM PER LITER","RAJASTHAN","DUNGARPUR","DUNGARPUR                                         ","2014-09-28 08:05:26.547"
"RABI","AGRICULTURE","Others","Others","Weather","TELL ME WEATHER INFORMATION","NO RAIN FALL UP TO 5 DAYS","RAJASTHAN","DUNGARPUR","ASPUR                                             ","2014-09-28 12:32:29.430"
"KHARIF","AGRICULTURE","Millets","Maize (Makka)","	Plant Protection	","TELL ME INSECT CONTROL IN MAIZE ?","SPRAY OF INDOXACARB 14.5% SC 1 ML PER LITER WATER","RAJASTHAN","DUNGARPUR","DUNGARPUR                                         ","2014-09-28 14:15:31.907"
"RABI","AGRICULTURE","Others","Others","Weather","TELL ME WEATHER INFORMETION","???? 5 ???? ??? ???? ???? ??? ????? ?? ???????? ???? ?? ?? ???? ??? ?? ????? ??","RAJASTHAN","DUNGARPUR","ASPUR                                             ","2014-09-28 15:30:08.630"
"KHARIF","AGRICULTURE","Oilseeds","Soybean (bhat)","	Plant Protection	","TELL ME ABOUT SUCKING PEST CONTROL IN SOYABEAN","USE IMIDACHLOPRID 17.8% SL 0.5 ML PER LITER WATER IN ROOT ZONE","RAJASTHAN","DUNGARPUR","BICHIWARA                                         ","2014-09-28 19:14:31.390"
"KHARIF","AGRICULTURE","Pulses","Black Gram (urd bean)","	Plant Protection	","GREEN CATER PILLER IN URD BEAN","SPRAY OF MONOCROTOPHOS 36% SL 2.5 ML PER LITER WATER","RAJASTHAN","DUNGARPUR","SIMALWARA                                         ","2014-09-30 07:44:35.143"
"KHARIF","AGRICULTURE","Others","Others","Weather","TELL ME WEATHER FORECASTING","NOT RAINFALL NEXT FIVE DAYS","RAJASTHAN","DUNGARPUR","ASPUR                                             ","2014-09-30 14:50:36.750"
