"Season","Sector","Category","Crop","QueryType","QueryText","KCCAns","StateName","DistrictName","BlockName","CreatedOn"
"KHARIF","AGRICULTURE","Others","Others","Weather","TELL ME WEATHER INFORMATION","NO RAIN POSSIBILITY IN NEXT 5 DAYS","RAJASTHAN","UDAIPUR","BHINDER                                           ","2014-10-01 11:39:58.590"
"KHARIF","AGRICULTURE","Others","Others","Weather","TEL ME WEATHER INFORMATION","NO RAIN POSSIBILITY IN NEXT 5 DAYS,","RAJASTHAN","UDAIPUR","DHARIAWAD                                         ","2014-10-01 13:00:04.150"
"KHARIF","AGRICULTURE","Others","Others","Weather","TELL ME WEATHER INFORMETION","NO RAIN POSSIBILITY IN NEXT 5 DAYS","RAJASTHAN","UDAIPUR","BARGAON                                           ","2014-10-01 14:10:16.357"
"KHARIF","HORTICULTURE","Fruits","Guava","	Plant Protection	","TELL ME FLOWER DROP CONTROL IN GUAVA ?","SPRAY OF PLANOFIX 1 ML PER 4 LITER WATER","RAJASTHAN","UDAIPUR","BHINDER                                           ","2014-10-02 16:47:25.573"
"RABI","AGRICULTURE","Oilseeds","Mustard","	Plant Protection	","TELL ME CONTROL CUTTING PEST","DUSTING OF METHYL PARATHIAN 2% 20 KG PER HA","RAJASTHAN","UDAIPUR","BHINDER                                           ","2014-10-03 11:33:26.380"
"KHARIF","AGRICULTURE","Others","Others","Weather","TELL ME WEATHER REPORT ?","NO RAIN POSSIBILITY IN NEXT 5 DAYS","RAJASTHAN","UDAIPUR","MAVLI                                             ","2014-10-03 13:39:00.000"
"RABI","HORTICULTURE","Vegetables","Beans ","	Plant Protection	","TELL ME NO FLOWER IN LEMON","SPRAY OF PLANOFIX 1 ML PER 4 LITER WATER","RAJASTHAN","UDAIPUR","BHINDER                                           ","2014-10-03 16:44:14.800"
"KHARIF","AGRICULTURE","Others","Others","Weather","tell me weather information","NO RAIN FALL POSSIBILITY IN NEXT 5 DAYS IN YOUR DIST","RAJASTHAN","UDAIPUR","MAVLI                                             ","2014-10-04 07:28:07.833"
"RABI","HORTICULTURE","Vegetables","Cauliflower","	Plant Protection	","sowing time of cabbage","sitember octomber sowing time cabbage","RAJASTHAN","UDAIPUR","GIRWA                                             ","2014-10-04 07:42:03.657"
"KHARIF","AGRICULTURE","Others","Others","Weather","TELL ME WEATHER INFORMATION","NO RAIN POSSIBILITY IN NEXT 5 DAYS","RAJASTHAN","UDAIPUR","DHARIAWAD                                         ","2014-10-04 15:43:32.047"
"KHARIF","AGRICULTURE","Others","Others","Weather","TELL ME WEATHER INFORMATION","NO RAIN POSSIBILITY IN NEXT 5 DAYS","RAJASTHAN","UDAIPUR","DHARIAWAD                                         ","2014-10-04 17:56:26.553"
"KHARIF","HORTICULTURE","Fruits","Ber","	Plant Protection	","TELL ME INSECT CONTROL IN BER ?","SPRAY OF DIMETHOATE  30% EC 2 ML PER LITER WATER","RAJASTHAN","UDAIPUR","MAVLI                                             ","2014-10-04 18:07:04.577"
"RABI","AGRICULTURE","Millets","Maize (Makka)","	Plant Protection	","TELL ME CONTROL FARDKA IN MAIZE","MITHAILE DEMOATON 25% EC 2 GRAM /PAR LITER WATER SPREY","RAJASTHAN","UDAIPUR","MAVLI                                             ","2014-10-04 20:24:46.120"
"KHARIF","HORTICULTURE","Vegetables","Chillies","	Plant Protection	","PEST CONTROL IN CHILLIE","EMIDACLOPRID 17.8% 0.5M.L./LITERA WATRE SPRAY","RAJASTHAN","UDAIPUR","GIRWA                                             ","2014-10-05 09:01:13.563"
"KHARIF","HORTICULTURE","Vegetables","Brinjal","	Plant Protection	","TELL ME FUNGIES CONTROL OF BRINJAL","USE CARBENDAZIM 50 GM PER KAYARI","RAJASTHAN","UDAIPUR","GIRWA                                             ","2014-10-05 10:12:25.377"
"KHARIF","AGRICULTURE","Others","Others","Weather","TELL ME WEATHER INFORMATION","NO RAIN POSSIBILITY IN NEXT 5 DAYS","RAJASTHAN","UDAIPUR","BHINDER                                           ","2014-10-05 12:25:19.457"
"KHARIF","HORTICULTURE","Fruits","Mango","	Plant Protection	","TELL ME DISEASE CONTROL OF MANGO","SPRAY OF COPPER OXICHLORIDE 3 GM PER  LITER WATER","RAJASTHAN","UDAIPUR","JHADOL                                            ","2014-10-05 12:38:30.723"
"KHARIF","AGRICULTURE","Others","Others","Weather","TELL ME MANDI RATE OF GWAR","5200/- RS PER QT. MADNI RATE OF GWAR","RAJASTHAN","UDAIPUR","BHINDER                                           ","2014-10-05 18:04:07.800"
"KHARIF","HORTICULTURE","Vegetables","Cauliflower","Cultural Practices","TELL ME VARAITIES  OF CAULIFLOWER","PUSA DEPALI,PUSA KETKI,PUSA KUNWARI","RAJASTHAN","UDAIPUR","GIRWA                                             ","2014-10-05 19:33:19.780"
"RABI","HORTICULTURE","Flowers","Marigold","	Plant Protection	","TELL ME CONTROL OF LEAF CUTTING PEST IN MERIGLD","MONOCROTOPHOS 36%SL 2ML/LITER WATER SPRAY","RAJASTHAN","UDAIPUR","MAVLI                                             ","2014-10-05 20:46:31.740"
"RABI","HORTICULTURE","Vegetables","Pea (Vegetable)","Seeds and Planting Material","TELL ME VARIETY OF PEA ?","VARIETY OF PEA = PANT UPHAR,JAWAHAR MATAR,BONVILE,LINKAN","RAJASTHAN","UDAIPUR","MAVLI                                             ","2014-10-06 09:00:35.947"
"KHARIF","AGRICULTURE","Others","Others","Weather","TELL ME WEATHER INFORMATION","NO RAIN FALL UP TO 5 DAYS, CLOUDY SKY","RAJASTHAN","UDAIPUR","BHINDER                                           ","2014-10-06 11:12:22.880"
"KHARIF","AGRICULTURE","Others","Others","Government Schemes","CALL","??????? ?????? ????? ?? ??? ???? ?? 50 % ?????? ??? ??|","RAJASTHAN","UDAIPUR","GOGUNDA                                           ","2014-10-06 14:43:52.090"
"RABI","AGRICULTURE","Fodder Crops","Guar","	Plant Protection	","TELL ME CONTROL BACTRIL BLIGHT IN GOWER","SPRAY OF COPPER OXI CLORIDE 45 GM + STREPTOCYCLIN 1.5 GM PER 15 LITER WATER","RAJASTHAN","UDAIPUR","SALUMBAR                                          ","2014-10-06 16:41:15.147"
"RABI","HORTICULTURE","Medicinal and Aromatic Plants","Safed Musli","Cultural Practices","TELL ME CROP DURATION OF SAFED MUSLI ?","CROP DURATION OF SAFED MUSLI = 80-90 DAYS","RAJASTHAN","UDAIPUR","GOGUNDA                                           ","2014-10-06 20:27:18.410"
"RABI","AGRICULTURE","Oilseeds","Mustard","Sowing Time and Weather","TELL SOWING TIME OF MUSTARD","MUSTARD SOWING TIME- UN IRRIGATED- 15 SEPTEMBER TO 15 OCTOBER , IRRIGATED- OCTOBER LAST","RAJASTHAN","UDAIPUR","MAVLI                                             ","2014-10-07 10:43:45.560"
"KHARIF","AGRICULTURE","Others","Others","Weather","TELL ME WEATHER INFORMATION","NO RAINFALL POSSIBILITY IN NEXT FIVE DAYS  BUT CLOUDY","RAJASTHAN","UDAIPUR","GIRWA                                             ","2014-10-07 11:07:58.437"
"RABI","AGRICULTURE","Others","Others","Sowing Time and Weather","TELL ME SOWING SEASON OF ISABGOL","SOWING SEASON OF ISABGOL - OCTOBER LAST TO NOVEMBER FIRST WEEK","RAJASTHAN","UDAIPUR","BARGAON                                           ","2014-10-07 15:01:09.460"
"RABI","AGRICULTURE","Oilseeds","Mustard","Fertilizer Use and Availability","TELL ME VARITIES OF MUSTERD","BIO-902, RGN-13, VASUNDRA VARITIES OF MUSTERD","RAJASTHAN","UDAIPUR","MAVLI                                             ","2014-10-07 15:06:49.890"
"RABI","AGRICULTURE","Others","Others","	Plant Protection	","TELL ME WEATERH INFORMATION","NO RIANFALL NEXT FIVE DAYS","RAJASTHAN","UDAIPUR","SALUMBAR                                          ","2014-10-07 16:38:29.360"
"KHARIF","AGRICULTURE","Others","Others","Weather","TELL ME WEATHER INFORMATION","NO RAINFALL POSSIBILITY IN NEXT FIVE DAYS  BUT CLOUDY","RAJASTHAN","UDAIPUR","MAVLI                                             ","2014-10-08 08:05:24.543"
"RABI","AGRICULTURE","Others","Others","Soil Testing","TELL ME SOIL TESTING INFO.","DEEG 6-9 INCH DEEP `V` SHAPE PIT AND TACKING 500 GM SOIL SAMPLE FOR TESTING SOIL","RAJASTHAN","UDAIPUR","GIRWA                                             ","2014-10-08 12:24:52.940"
"KHARIF","HORTICULTURE","Vegetables","Capsicum","	Plant Protection	","TELL ME SUCKING PEST IN CHILLI ?","SPRAY OF DIMETHOATE 30% EC 2 ML PER LITER WATER","RAJASTHAN","UDAIPUR","MAVLI                                             ","2014-10-08 15:43:26.620"
"KHARIF","AGRICULTURE","Others","Others","Weather","TELL ME WEATHER INFORMATION","RAINFALL POSSIBILITY IN NEXT 5 DAYS","RAJASTHAN","UDAIPUR","MAVLI                                             ","2014-10-08 17:05:12.857"
"RABI","HORTICULTURE","Vegetables","Brinjal","	Plant Protection	","TELL ME CONTROL OF INSECT IN BRINJAL ?","SPRAY OF INDOXACARB 14.5% SC 1 ML PER LITER WATER","RAJASTHAN","UDAIPUR","SARADA                                            ","2014-10-09 10:20:26.530"
"RABI","AGRICULTURE","Fodder Crops","Other","Bio-Pesticides and Bio-Fertilizers","TELL ME FOR CALLING IN KCC","THANX FOR CALLING IN KCC","RAJASTHAN","UDAIPUR","MAVLI                                             ","2014-10-09 14:58:13.833"
"RABI","HORTICULTURE","Condiments and Spices","Garlic","	Plant Protection	","TELL ME CONTROL OF YELLOWING IN GARLIC","SPRAY OF DIMETHOATE 30 EC 2ML +  CARBENDAZIM 12% + MANCOZEB 63% WP 2 GM PER LITER WATER","RAJASTHAN","UDAIPUR","DHARIAWAD                                         ","2014-10-09 18:45:26.033"
"KHARIF","HORTICULTURE","Vegetables","Potato","	Plant Protection	","TELL ME SOWING TIME OF POTATO","SOWING TIME OF POTATO = MID SEPTMBER TO MID OCTOBER","RAJASTHAN","UDAIPUR","BHINDER                                           ","2014-10-10 07:42:10.697"
"KHARIF","AGRICULTURE","Cereals","Wheat","Seeds","TELL ME WHEAT VARIETY","raj-1482, 4120, lok-1, raj-3077,3777,3765,4037,6560 ???? ?? ????","RAJASTHAN","UDAIPUR","BARGAON                                           ","2014-10-10 08:21:56.577"
"RABI","AGRICULTURE","Pulses","Bengal Gram (Gram/Chick Pea/Kabuli/Chana)","Seeds","TELL ME VARITIES OF GRAM","GRAM VARIETY - GNG-663,469,C235,G130,H208,RSG-44,2,888,895,973,807,963,902,945,GNG- 1581","RAJASTHAN","UDAIPUR","BHINDER                                           ","2014-10-10 15:35:53.223"
"RABI","AGRICULTURE","Others","Others","Weather","TELL ME WEATHER INFORMATION","NO RAIN FALL IN NEXT 5 DAYS","RAJASTHAN","UDAIPUR","MAVLI                                             ","2014-10-11 15:33:08.000"
"RABI","AGRICULTURE","Cereals","Wheat","	Plant Protection	","TELL ME WEATHER CONDITION","???? 5 ????? ??? ????? ?? ????????  ???","RAJASTHAN","UDAIPUR","MAVLI                                             ","2014-10-11 16:45:57.573"
"RABI","AGRICULTURE","Others","Others","Weather","TELL ME WEATHER REPORT INUDAIPUR","NO RAINFALL IN NEXT 5 DAYS IN YOUR DISTRICT","RAJASTHAN","UDAIPUR","SALUMBAR                                          ","2014-10-11 20:59:27.073"
"RABI","AGRICULTURE","Oilseeds","Mustard","Varieties","TELL ME VAREITY OF MUSTURD","MUSTARD VARIETY- T59,PUSA BOLD,RH30,BIO902,LAXMI,VASUNDHARA,JAGANNATH,RGN48,73","RAJASTHAN","UDAIPUR","JHADOL                                            ","2014-10-12 08:37:31.927"
"RABI","HORTICULTURE","Fruits","Lemon","	Plant Protection	","TELL ME PROPER PLANT GROWTH IN LEMON","FERTILIZER IN LEMON OF 5 YRS. 60 KG, UREA= 200 GM, SSP= 1500 GM, MOP= 500 GM , MICRONUTRIENT 100 G PER PLANT","RAJASTHAN","UDAIPUR","SARADA                                            ","2014-10-12 15:58:04.230"
"RABI","AGRICULTURE","Oilseeds","Mustard","	Plant Protection	","TELL ME APHID CONTROL IN MUSTARD","DUSTING OF METHYL PARATHIAN 2% 25 KG PER HA","RAJASTHAN","UDAIPUR","BHINDER                                           ","2014-10-12 17:57:32.290"
"KHARIF","HORTICULTURE","Fruits","Lemon","	Plant Protection	","TELL ME CONTROL OF LAF BORER OF LEMON","SPRAY OF MALATHIAN 50% EC 2 ML PER LITER WATER","RAJASTHAN","UDAIPUR","SARADA                                            ","2014-10-13 09:21:18.370"
"RABI","AGRICULTURE","Pulses","Bengal Gram (Gram/Chick Pea/Kabuli/Chana)","	Plant Protection	","TELL ME WEEDICIDE IN GRAM","WEED CONTROL IN GRAM -PENDIMITHALIN 2.5 LITRE IN 600 LITRE WATER PER HACTRE","RAJASTHAN","UDAIPUR","SARADA                                            ","2014-10-13 10:57:52.430"
"RABI","AGRICULTURE","Oilseeds","Indian rapeseed and mustard (yellow sarson)","	Plant Protection	","TELL ME CONTROL OF PANTED BUG IN MUSTARD","APPLY METHYL PARATHION 2 % 20-25 KG PER HECTARE MIXING WITH 10 KG DUST","RAJASTHAN","UDAIPUR","MAVLI                                             ","2014-10-13 11:06:32.773"
"RABI","AGRICULTURE","Oilseeds","Mustard","	Plant Protection	","PYAJI WEED CONTROL IN MUSTARD","PYAJI CONTROL IN MUSTURD - OXIDIJARIL 800 ML/HA WITH 500 LIT WATEWR","RAJASTHAN","UDAIPUR","GIRWA                                             ","2014-10-14 07:50:25.187"
"RABI","AGRICULTURE","Others","Others","Weather","TELL ME WEATHER INFORMATION","NO RAIN FALL UP TO 5 DAYS","RAJASTHAN","UDAIPUR","MAVLI                                             ","2014-10-14 09:30:28.160"
"KHARIF","AGRICULTURE","Others","Others","Weather","WEATHER REPORT OF UDAIPUR","NO RAINFALL  POSSIBILITY IN NEXT 5 DAYS OR  SOME CLOUD POSSIBILITY","RAJASTHAN","UDAIPUR","MAVLI                                             ","2014-10-14 09:31:50.830"
"RABI","AGRICULTURE","Oilseeds","Mustard","	Plant Protection	","TELL ME SEED TREATMENT OF MUSTARD","USE FOR WHITE RUST  (MENCOJAB+METAXYL)APRON 36 WS 6 GM /KG SEED AND CONTROL OF PENTED BUG IMIDACLOPRID 70 WS 5 GM / KG SEED","RAJASTHAN","UDAIPUR","BHINDER                                           ","2014-10-14 10:56:47.547"
"RABI","AGRICULTURE","Pulses","Bengal Gram (Gram/Chick Pea/Kabuli/Chana)","	Plant Protection	","TELL ME WEED CONTROL IN GRAM","SPRAY OF PENDIMETHILIN 30% EC 2.5-3 LITER PER HA AFTER SOWING BUT BEFORE GERMINATION","RAJASTHAN","UDAIPUR","MAVLI                                             ","2014-10-15 08:57:16.097"
"RABI","AGRICULTURE","Oilseeds","Mustard","Weather","TELL ME CONTROL OF PAINTED BUG IN MUSTARD","DUSTING METHAIL PAIRATHION 2 % 20 KG PER HA","RAJASTHAN","UDAIPUR","BHINDER                                           ","2014-10-15 12:46:00.560"
"RABI","AGRICULTURE","Others","Others","Weather","TELL ME WEATHER INFORMETION","NO RAIN POSSIBILITY IN NEXT 5 DAYS,BUT SKY CLOUDLY","RAJASTHAN","UDAIPUR","MAVLI                                             ","2014-10-15 16:08:18.590"
"RABI","HORTICULTURE","Fruits","Banana","	Plant Protection	","flower fall down in banana","SPRAY OF PLANOFIX 1 ML PER 4 LITER WATER","RAJASTHAN","UDAIPUR","BARGAON                                           ","2014-10-15 20:50:53.593"
"RABI","AGRICULTURE","Oilseeds","Soybean (bhat)","Cultural Practices","TELL ME MANDI PRICE OF SOYABEAN","BARI SADRI MANDI SOYABEAN YELLOW 2835 RS PER QT.","RAJASTHAN","UDAIPUR","DHARIAWAD                                         ","2014-10-16 14:21:37.940"
"RABI","HORTICULTURE","Vegetables","Chillies","	Plant Protection	","TELL ME LESF CURUL CONTROL IN CHILLIES","SPRAY OF DIMITHOAT 30 % 2 ML/LITER PER HA","RAJASTHAN","UDAIPUR","SALUMBAR                                          ","2014-10-16 19:28:49.980"
"RABI","AGRICULTURE","Others","Others","Weather","TELL ME WEATHER CONDITION","NO RAINFALL  POSSIBILITY IN NEXT 5 DAYS OR  SOME CLOUD POSSIBILITY","RAJASTHAN","UDAIPUR","SALUMBAR                                          ","2014-10-16 21:05:45.427"
"RABI","HORTICULTURE","Vegetables","Cauliflower","Seeds and Planting Material","TELL ME VARITI OF CAULIFLOWER-SNOW BALL","VARITI OF CAULIFLOWER-SNOW BALL","RAJASTHAN","UDAIPUR","GIRWA                                             ","2014-10-16 21:39:15.747"
"RABI","AGRICULTURE","Oilseeds","Mustard","	Plant Protection	","TELL ME INSECT CONTROL IN MUSTRAD .","DUSTING OF METHYL PARATHIAN 2% 25 KG PER HA","RAJASTHAN","UDAIPUR","SARADA                                            ","2014-10-17 11:24:18.777"
"RABI","AGRICULTURE","Oilseeds","Mustard","	Plant Protection	","TELL ME INSECT CONTROL IN MUSTRAD .","DUSTING OF METHYL PARATHIAN 2% 25 KG PER HA","RAJASTHAN","UDAIPUR","SARADA                                            ","2014-10-17 11:24:21.053"
"RABI","AGRICULTURE","Others","Others","Cultural Practices","TELL ME GREEN HOUSE INFO.","PLEASE CONTACT TO AG DEPTT. OF YOUR DISTT.","RAJASTHAN","UDAIPUR","MAVLI                                             ","2014-10-17 13:27:06.193"
"RABI","AGRICULTURE","Cereals","Barley (Jau)","Varieties","TELL ME VARIETY OF BARLEY","BARLEY VARIETY - RD2052,RD31,RD103,BL2,RD2503,2508,2035,2552,2624,2660","RAJASTHAN","UDAIPUR","MAVLI                                             ","2014-10-17 18:12:36.377"
"RABI","AGRICULTURE","Cereals","Barley (Jau)","Varieties","TELL ME VARIETY OF BARLEY","BARLEY VARIETY - RD2052,RD31,RD103,BL2,RD2503,2508,2035,2552,2624,2660","RAJASTHAN","UDAIPUR","MAVLI                                             ","2014-10-17 18:12:43.453"
"KHARIF","AGRICULTURE","Oilseeds","Soybean (bhat)","Market Information","TELL ME MANDI RATE OF SOYBEAN","NIMBAHEDA  SOYABEAN YELLOW 2922 RS/QU.","RAJASTHAN","UDAIPUR","DHARIAWAD                                         ","2014-10-17 18:38:33.533"
"RABI","AGRICULTURE","Others","Others","Weather","TELL ME WEATHER INFORMATION","NO RAIN FALL UP TO 5 DAYS","RAJASTHAN","UDAIPUR","MAVLI                                             ","2014-10-18 12:01:12.883"
"RABI","AGRICULTURE","Others","Others","	Plant Protection	","TELL ME WEATHER INFORMETION IN MY DISTRICT","RAINFALL 10 MM NEXT FIVE DAYS OF","RAJASTHAN","UDAIPUR","MAVLI                                             ","2014-10-18 12:09:39.930"
"KHARIF","HORTICULTURE","Vegetables","Bhindi(Okra/Ladysfinger)","Seeds and Planting Material","TELL ME BHINDI VARIETY ?","VARIETY OF BHINDI =  PARBHANI KRANTI, PUSA MAKHMALI, ARKA ANAMIKA","RAJASTHAN","UDAIPUR","SARADA                                            ","2014-10-18 12:14:51.537"
"KHARIF","AGRICULTURE","Oilseeds","Indian rapeseed and mustard (yellow sarson)","	Plant Protection	","pest control of mustard","DUSTING OF METHYL PARATHIAN 2% 25 KG PER HA","RAJASTHAN","UDAIPUR","BHINDER                                           ","2014-10-18 13:29:15.893"
"RABI","AGRICULTURE","Others","Others","Weather","TELL ME WEATHER FORECASTING","NOT RAINFAL NEXT FIVE DAYS","RAJASTHAN","UDAIPUR","GIRWA                                             ","2014-10-18 14:43:26.293"
"KHARIF","HORTICULTURE","Condiments and Spices","Ginger","	Plant Protection	","TELL ME CONTROL OF YELLOW COLOR OF GINGER","SPRAY OF MENCOZEB 75 WP 2 G/LIT WATER","RAJASTHAN","UDAIPUR","JHADOL                                            ","2014-10-18 15:09:47.330"
"RABI","AGRICULTURE","Others","Others","Weather","TELL ME WEATHER INFORMATION","NO RAIN POSSIBILITY IN NEXT 5 DAYS","RAJASTHAN","UDAIPUR","SALUMBAR                                          ","2014-10-18 15:26:58.513"
"RABI","AGRICULTURE","Others","Others","	Plant Protection	","tell me weather information","NO RAIN FALL UP TO 5 DAYS, CLOUDY SKY","RAJASTHAN","UDAIPUR","BHINDER                                           ","2014-10-18 15:58:25.180"
"KHARIF","AGRICULTURE","Others","Others","Weather","TEL ME WEATHER INFORMATION","NO RAIN POSSIBILITY IN NEXT 5 DAYS,","RAJASTHAN","UDAIPUR","MAVLI                                             ","2014-10-19 07:54:33.493"
"RABI","HORTICULTURE","Vegetables","Pea (Vegetable)","Seeds and Planting Material","TELL ME VARIETY OF PEA","??? ?? ??????- ?????,???????,????? ???","RAJASTHAN","UDAIPUR","SALUMBAR                                          ","2014-10-19 08:59:52.883"
"RABI","AGRICULTURE","Cereals","Wheat","Varieties","TELL ME  VARIETY OF WHEAT ?","VARIETY OF WHEAT = RAJ 4037, RAJ 3077, RAJ 3777, RAJ 4120","RAJASTHAN","UDAIPUR","GIRWA                                             ","2014-10-19 09:43:15.267"
"RABI","AGRICULTURE","Sugar and Starch Crops","Sugarcane (Noble Cane)","	Plant Protection	","TELL ME CONTROL OF TERITMENT IN SUGARCANE ?","USE CHLOROPYRIFOS 20% EC 4 LITER PER HA WITH IRRIGATION","RAJASTHAN","UDAIPUR","MAVLI                                             ","2014-10-19 16:04:18.260"
"RABI","HORTICULTURE","Flowers","Rose","	Plant Protection	","TELL ME PROPER FLOWERING","SPRAY OF MULTIPLAX (MICRONUTRIENT) 4 ML PER LITER WATER","RAJASTHAN","UDAIPUR","MAVLI                                             ","2014-10-19 19:22:45.197"
"KHARIF","AGRICULTURE","Oilseeds","Mustard","Varieties","TEL ME SEED TREATMENT OF MUSTARD ?","USE FOR WHITE RUST  (MENCOJAB+METAXYL)APRON 36 WS 6 GM /KG SEED AND CONTROL OF PENTED BUG IMIDACLOPRID 70 WS 5 GM / KG SEED","RAJASTHAN","UDAIPUR","GIRWA                                             ","2014-10-19 19:59:20.893"
"RABI","AGRICULTURE","Fodder Crops","Guar","Market Information","TELL ME MARKET RATE OF GUAR ?","UDAIPUR MANDI ME GOWAR KA BHAW 5100 RS/QT","RAJASTHAN","UDAIPUR","SALUMBAR                                          ","2014-10-19 20:57:05.157"
"RABI","AGRICULTURE","Cereals","Wheat","Seeds","TELL ME WHEAT VARIETY","???? ?? ??????- ??????????-343,550,373,???- 3077,4037,3777,3765,4120,4079,????????-1080","RAJASTHAN","UDAIPUR","GOGUNDA                                           ","2014-10-20 12:09:30.210"
"RABI","HORTICULTURE","Vegetables","Chillies","	Plant Protection	","THRIPS IN CHILLIES","SPRAY OF IMIDACHLOPRID 17.8  S.L 0.5 ML  PER LITER WATER","RAJASTHAN","UDAIPUR","SALUMBAR                                          ","2014-10-20 17:51:11.767"
"RABI","AGRICULTURE","Others","Others","	Plant Protection	","SUBSIDY IN PIPE LINGE","28 RU METER SUBSIDY","RAJASTHAN","UDAIPUR","SALUMBAR                                          ","2014-10-20 21:43:01.777"
"RABI","AGRICULTURE","Cereals","Wheat","Sowing Time and Weather","TELL ME SOWING SEASON OF WHEAT ?","WHEAT SOWING TIME- OCT LAST WEAK TO NOVEMBER THIRD WEAK AND TILL DECEMBER LAST WEAK FOR LATE","RAJASTHAN","UDAIPUR","GIRWA                                             ","2014-10-21 07:24:20.640"
"RABI","AGRICULTURE","Cereals","Wheat","	Plant Protection	","TELL ME SEED TREATMENT IN WHEAT","USE CHLOROPYRIFOS 20% EC 8 ML PER KG SEED FOR SEED TREATMENT WHEAT","RAJASTHAN","UDAIPUR","MAVLI                                             ","2014-10-21 13:25:57.853"
"RABI","AGRICULTURE","Cereals","Wheat","Varieties","TELL ME VARIETY OF WHEAT","VARIETY OF WHEAT= RAJ 4037, RAJ 3077, RAJ 3765, RAJ 1482, RAJ 4120 , PBW 343, PBW 550","RAJASTHAN","UDAIPUR","MAVLI                                             ","2014-10-21 13:45:00.973"
"RABI","AGRICULTURE","Oilseeds","Mustard","Weather","TELL ME MUSTARD VARIETY","????? ?? ??????- ?? 59,???? ???????,???? ?????,?????-30,????-902,???????,???????(??????9304),???????,????????-48,73,??????????-2,??????????-506(????)","RAJASTHAN","UDAIPUR","KOTRA                                             ","2014-10-21 14:13:42.257"
"RABI","AGRICULTURE","Oilseeds","Mustard","Weather","TELL ME MUSTARD VARIETY","????? ?? ??????- ?? 59,???? ???????,???? ?????,?????-30,????-902,???????,???????(??????9304),???????,????????-48,73,??????????-2,??????????-506(????)","RAJASTHAN","UDAIPUR","KOTRA                                             ","2014-10-21 14:13:42.723"
"RABI","AGRICULTURE","Oilseeds","Mustard","	Plant Protection	","CUT WORM CONTROL IN MUSTARD","DUSTING OF METHYL PARATHIAN 2% 25 KG PER HA","RAJASTHAN","UDAIPUR","DHARIAWAD                                         ","2014-10-21 15:45:22.723"
"RABI","HORTICULTURE","Vegetables","Onion","	Plant Protection	","TELL ME SOWING TIME OF ONION.","SOWING TIME OF ONION-oct to nov","RAJASTHAN","UDAIPUR","BHINDER                                           ","2014-10-22 12:55:26.897"
"RABI","HORTICULTURE","Flowers","Rose","	Plant Protection	","TELL ME CONTROL OF FUNGAL DISEASE IN ROSE ?","COPPER OXI CLORIDE 45 G + STREPTOCYCLIN 2 G/15 LIT WATER","RAJASTHAN","UDAIPUR","BHINDER                                           ","2014-10-22 16:01:13.050"
"RABI","AGRICULTURE","Oilseeds","Soybean (bhat)","Market Information","TELL ME MARKET RATE OF SOYABEAN ?","NIMBAHEDA MANDI ME  SOYABEAN YELLOW KA BHAW 2900 RS/QT","RAJASTHAN","UDAIPUR","DHARIAWAD                                         ","2014-10-22 19:39:29.363"
"RABI","AGRICULTURE","Others","Others","Weather","TELL ME WEATHER INFORMATION","NO RAIN FALL UP TO 5 DAYS, CLOUDY SKY","RAJASTHAN","UDAIPUR","SALUMBAR                                          ","2014-10-22 19:54:42.660"
"RABI","AGRICULTURE","Others","Others","	Field Preparation	","TELL ME  SOIL SAMPLE FOR TESTING SOIL","DEEG 6-9 INCH DEEP `V` SHAPE PIT AND TACKING 500 GM SOIL SAMPLE FOR TESTING SOIL","RAJASTHAN","UDAIPUR","GIRWA                                             ","2014-10-23 07:59:18.640"
"RABI","AGRICULTURE","Cereals","Wheat","Varieties","TELL ME VARIETY OF WHEAT","VARIETY OF WHEAT= RAJ 4037, RAJ 3077, RAJ 3765, RAJ 1482, RAJ 4120 , PBW 343, PBW 550","RAJASTHAN","UDAIPUR","BHINDER                                           ","2014-10-23 08:04:02.757"
"RABI","AGRICULTURE","Cereals","Wheat","	Plant Protection	","TELL ME CONTROL OF TRITMENT IN WHEAT ?","USE QUINOLPHOS 5 % G 20 KG/HA","RAJASTHAN","UDAIPUR","SALUMBAR                                          ","2014-10-23 08:05:29.720"
"RABI","AGRICULTURE","Oilseeds","Mustard","	Plant Protection	","TELL ME WEED CONTROL IN MUSTARD (STANDING CROP)","NO HERBICIDE USED","RAJASTHAN","UDAIPUR","MAVLI                                             ","2014-10-23 15:55:59.787"
"KHARIF","AGRICULTURE","Others","Others","Weather","TELL ME WEATHER REPORT IN MY DISTRIC","MAINLY CLEAR SKY IN NEXT DAYS IN YOUR DISTRIC.MAXIMUM TEMP.33 DIGREE","RAJASTHAN","UDAIPUR","SALUMBAR                                          ","2014-10-24 06:58:29.210"
"KHARIF","HORTICULTURE","Fruits","Lemon","	Plant Protection	","TELL ME FLOWER DROPPING CONTROL IN LEMON","SPRAY OF PLANOFIX 1 ML PER 4 LITER WATER","RAJASTHAN","UDAIPUR","MAVLI                                             ","2014-10-24 09:01:03.470"
"RABI","AGRICULTURE","Others","Others","Government Schemes","TELL ME SUBSIDY INFO","PLEASE CONTACT TO AG DEPTT. OF YOUR DISTT.","RAJASTHAN","UDAIPUR","SARADA                                            ","2014-10-24 18:25:06.940"
