"Season","Sector","Category","Crop","QueryType","QueryText","KCCAns","StateName","DistrictName","BlockName","CreatedOn"
"RABI","HORTICULTURE","Vegetables","Pea (Vegetable)","Seeds and Planting Material","TELL ME VERIETY OF PEAS","VARIETY OF PEA ARKEL,BONNEVILLE,AZAD","RAJASTHAN","UDAIPUR","DHARIAWAD                                         ","2014-10-25 15:47:10.743"
"RABI","AGRICULTURE","Others","Others","Weather","TELL ME WEATHER INFORMATION","NO RAIN POSSIBILITY IN NEXT 5 DAYS","RAJASTHAN","UDAIPUR","JHADOL                                            ","2014-10-25 19:26:53.167"
"RABI","AGRICULTURE","Others","Others","Weather","TELL ME WEATHER INFORMATION","NO RAIN FALL POSSIBILITY IN NEXT 5 DAYS, CLOUDY SKY","RAJASTHAN","UDAIPUR","GIRWA                                             ","2014-10-26 11:32:30.637"
"RABI","HORTICULTURE","Vegetables","Chillies","	Plant Protection	","TELL ME ABOUT PEST CONTROL IN CHILLI","MENCOJEB 2GM + 2GM ??????  / LIT WATER","RAJASTHAN","UDAIPUR","MAVLI                                             ","2014-10-26 14:43:07.873"
"RABI","HORTICULTURE","Vegetables","Chillies","	Plant Protection	","tell me varity of chilli","pusa jawala , pusa sadabhar , pant c -1, panjab lal  ,","RAJASTHAN","UDAIPUR","MAVLI                                             ","2014-10-27 09:34:27.180"
"RABI","AGRICULTURE","Others","Others","Weather","TEL ME WEATHER INFORMATION","NO RAIN POSSIBILITY IN NEXT 5 DAYS, BUT SOME CLOUD POSSIBILITY","RAJASTHAN","UDAIPUR","BHINDER                                           ","2014-10-27 11:27:52.407"
"KHARIF","AGRICULTURE","Oilseeds","Soybean (bhat)","Market Information","TELL ME MARKET RATE OF SOYABEAN ?","MARKET RATE OF SOYABEAN = 2850/- PER QUINTAL IN BARI SADRI MANDI","RAJASTHAN","UDAIPUR","MAVLI                                             ","2014-10-27 12:36:09.210"
"RABI","AGRICULTURE","Cereals","Barley (Jau)","Varieties","BARLY VARIETY","BARLY VARIETY RD-2052,2035,103","RAJASTHAN","UDAIPUR","MAVLI                                             ","2014-10-27 13:33:06.460"
"RABI","AGRICULTURE","Cereals","Wheat","Varieties","LATE VARIETIES OF WHEAT","LATE VARIETIES OF WHEAT = PBW-373, RAJ-3765, RAJ-3077, RAJ-3777, RAJ-4037, RAJ-4120, RAJ-4083","RAJASTHAN","UDAIPUR","MAVLI                                             ","2014-10-27 13:34:33.133"
"KHARIF","AGRICULTURE","Fiber Crops","Cotton (Kapas)","	Plant Protection	","TELL  ME ABOUT FLOWER DROPPING CONTROL IN COTTON","SPRAY OF PLANOFIX 1 ML PER 4 LITER WATER FOR FLOWER DROP CONTROL","RAJASTHAN","UDAIPUR","BHINDER                                           ","2014-10-27 16:16:36.927"
"KHARIF","HORTICULTURE","Vegetables","Onion","Cultural Practices","TELL ME VARAITIES OF ONION","PUSA RED","RAJASTHAN","UDAIPUR","BARGAON                                           ","2014-10-27 18:22:55.477"
"RABI","AGRICULTURE","Oilseeds","Soybean (bhat)","Market Information","TELL ME MARKET RATE OF SOYABEAN ?","BARI SADRI  SOYABEAN YELLOW 2950 RS/QT","RAJASTHAN","UDAIPUR","GOGUNDA                                           ","2014-10-28 14:12:00.533"
"RABI","AGRICULTURE","Pulses","Bengal Gram (Gram/Chick Pea/Kabuli/Chana)","Seeds","TELL ME GRAM VARIETY","GRAM VARIETY - RSG 88,RSG 973, RSG 974, GNG 1581, RSG 896, RSG 991","RAJASTHAN","UDAIPUR","SALUMBAR                                          ","2014-10-28 14:12:35.617"
"RABI","AGRICULTURE","Others","Others","Weather","TELL ME WEATHER INFORMATION","RAINFALL POSSIBILITY IN NEXT 5 DAYS","RAJASTHAN","UDAIPUR","JHADOL                                            ","2014-10-28 16:41:42.220"
"RABI","AGRICULTURE","Beekeeping","Beekeeping","Cultural Practices","TELL ME ABOUT BEEKEEPING","PLZ VISIT AT KVK BADGAON UDAIPUR","RAJASTHAN","UDAIPUR","BHINDER                                           ","2014-10-28 17:29:09.920"
"RABI","HORTICULTURE","Fruits","Orange","	Plant Protection	","TELL ME INSECT CONTROL IN ORANGE ?","SPRAY OF DIMETHIOATE 30% EC 2ML/LITER WATER","RAJASTHAN","UDAIPUR","MAVLI                                             ","2014-10-29 11:57:18.997"
"RABI","AGRICULTURE","Others","Others","	Plant Protection	","PEST CONTROL IN SAGWAN","SPRAY OF MONOCROTOPHOS 36% SL 2 ML PER LITER WATER","RAJASTHAN","UDAIPUR","GIRWA                                             ","2014-10-29 12:15:42.590"
"RABI","AGRICULTURE","Others","Others","Weather","TELL ME WEATHER INFORMETION","RAIN POSSIBILITY IN NEXT 5 DAYS","RAJASTHAN","UDAIPUR","MAVLI                                             ","2014-10-29 12:28:14.660"
"RABI","AGRICULTURE","Others","Others","Government Schemes","TELL ME SUBSIDY ON VERMICOMPOST UNIT ?","SUBSIDY ON VERMICOMPOST UNIT = 50% OF TOTAL COST MAXIMUM 50000/- PER UNIT","RAJASTHAN","UDAIPUR","GIRWA                                             ","2014-10-29 12:51:11.233"
"RABI","AGRICULTURE","Others","Others","Weather","TELL ME WEATHER INFORMATION","LIGHT RAIN MAY BE NEXT 2 DAYS","RAJASTHAN","UDAIPUR","MAVLI                                             ","2014-10-29 15:49:24.873"
"RABI","AGRICULTURE","Others","Others","Weather","TELL ME SUBSIDY ON SPIRNKAL ?","SUBSIDY ON SPRINKLER SYSTEM= 50% OF TOTAL COST OR 15000/- MAXIMUM","RAJASTHAN","UDAIPUR","BHINDER                                           ","2014-10-29 16:30:14.193"
"RABI","AGRICULTURE","Others","Others","Government Schemes","TELL ME SPRINKLER SYSTEM TOTAL COST SUBSIDY","SPRINKLER SYSTEM TOTAL COST 50% SUBSIDY","RAJASTHAN","UDAIPUR","BHINDER                                           ","2014-10-29 17:01:09.200"
"RABI","AGRICULTURE","Others","Others","Weather","TELL ME WEATHER INFORMATION","LIGHT RAIN MAY BE NEXT 2 DAYS","RAJASTHAN","UDAIPUR","SALUMBAR                                          ","2014-10-29 19:49:52.157"
"RABI","AGRICULTURE","Oilseeds","Mustard","	Plant Protection	","TELL ME PEST CONTROL OF MUSTAED","DUSTING OF METHYL PARATHIAN 2% 25 KG PER HA","RAJASTHAN","UDAIPUR","MAVLI                                             ","2014-10-30 07:24:33.220"
"RABI","AGRICULTURE","Fodder Crops","Lucerne (Alfalfa)","Varieties","TELL ME VARIETY OF LURCEN","VARIETY OF RIJKA= ANAND 2, LLC-3, LLC-5, TYPE-8, TYPE-9","RAJASTHAN","UDAIPUR","JHADOL                                            ","2014-10-30 08:22:59.597"
"RABI","HORTICULTURE","Fruits","Pomegranate","Seeds and Planting Material","TELL ME VARIETY OF POMEGRANATE","VARIETY OF POMEGRANATE= GANESH, SINDURI, MRIDULA","RAJASTHAN","UDAIPUR","BHINDER                                           ","2014-10-30 09:30:58.530"
"RABI","HORTICULTURE","Vegetables","Potato","Seeds and Planting Material","TELL ME VARIETY OF POTATO","VARIETY OF POTATO KUFARI LALIMA,KUFARI JAYOTI,KUFARI SINDURI","RAJASTHAN","UDAIPUR","SARADA                                            ","2014-10-30 13:05:49.580"
"RABI","HORTICULTURE","Fruits","Mango","	Plant Protection	","TELL ME CONTROL OF MANGOMALFORMATION OF MANGO","SPRAY MANCOZEB 75% WP 2 GM PER LITER WATER","RAJASTHAN","UDAIPUR","SARADA                                            ","2014-10-30 15:40:44.783"
"RABI","AGRICULTURE","Millets","Maize (Makka)","	Plant Protection	","TELL ME KHAPRA CONTROL IN MAIZE","????? ??? ????? ? ???? ?? ?????? ?? ??? ??????????? ???????? 3 ???? ????? 10 ??????? ???? ?? ????? ?? ??????? ?????","RAJASTHAN","UDAIPUR","KHERWARA                                          ","2014-10-30 15:48:03.947"
"RABI","AGRICULTURE","Cereals","Wheat","Weather","TELL ME WEATHER INFORMETION ?","LIGHT RAIN MAY BE NEXT 1-2 DAYS","RAJASTHAN","UDAIPUR","GIRWA                                             ","2014-10-31 08:23:56.510"
"RABI","AGRICULTURE","Cereals","Wheat","Varieties","TELL ME VARIETY OF WHEAT","WHEAT VARIETY - PBW-343,RAJ-3077,4037,3765,4083,4120,4079,PBW-550,373,WH-1080","RAJASTHAN","UDAIPUR","BHINDER                                           ","2014-10-31 14:18:35.740"
"RABI","AGRICULTURE","Cereals","Wheat","Varieties","TELL ME VARAITIES OF WHEAT","RAJ-3077,RAJ-4037","RAJASTHAN","UDAIPUR","GIRWA                                             ","2014-10-31 14:21:22.713"
"RABI","AGRICULTURE","Cereals","Wheat","Seeds","TELL ME VARITIES OF WHEAT","WHEAT VARIETY - PBW-343,RAJ-3077,4037,3777,3765,4083,4120,4079,PBW-550,373,WH-1080","RAJASTHAN","UDAIPUR","MAVLI                                             ","2014-10-31 14:43:56.707"
"RABI","AGRICULTURE","Others","Others","Government Schemes","TELL ME SUBSIDY ON UNDERGROUND PIPELINE","50 % SUBSIDY, MAXIMUM 600 METER","RAJASTHAN","UDAIPUR","SALUMBAR                                          ","2014-10-31 14:52:55.643"
"RABI","AGRICULTURE","Others","Others","Government Schemes","TELL ME SUBCIDICE ON PVC PIPE LINE","50%SUBCIDICE ON PVC PIPE LINE","RAJASTHAN","UDAIPUR","SALUMBAR                                          ","2014-10-31 21:46:30.167"
