"Season","Sector","Category","Crop","QueryType","QueryText","KCCAns","StateName","DistrictName","BlockName","CreatedOn"
"KHARIF","HORTICULTURE","Vegetables","Drum Stick","	Plant Protection	","leaf caterpiller in moringa","recommended for spray dimethoate 2ml+neemoil 3ml+teepol 1ml/lit of water","TAMILNADU","THENI","ANDIPATTI                                         ","2014-10-19 11:02:03.150"
"KHARIF","HORTICULTURE","Plantation Crops","Coconut","Nutrient Management","coconut fertilizer management","Recommended for apply urea 1.300kg + super phosphate 2kg + potash 2 kg + neem cake 5kg + farm yard manure 50kg + micro mixture 1kg /tree/year","TAMILNADU","THENI","BODINAYAKKANUR                                    ","2014-10-19 11:41:24.423"
"KHARIF","HORTICULTURE","Fruits","Grape","	Plant Protection	","Grapes Downy mildew:","recommended for spray Metalaxyl + Mancozeb 0.4 %./ 1 litre of water","TAMILNADU","THENI","KAMBAM","2014-10-19 12:10:32.033"
"KHARIF","HORTICULTURE","Vegetables","Drum Stick","Nutrient Management","drum stick boran deficiency","Recommended for Foliar spray borax 5gm / lit","TAMILNADU","THENI","BODINAYAKKANUR                                    ","2014-10-19 13:04:41.000"
"KHARIF","AGRICULTURE","Cereals","Paddy (Dhan)","Nutrient Management","paddy nursery fertilizer management","Recommended for apply DAP 2kg / ac","TAMILNADU","THENI","PERIYAKULAM                                       ","2014-10-19 18:36:29.610"
"KHARIF","HORTICULTURE","Plantation Crops","Arecanut","Cultural Practices","arecanut spacing as in coocnut.","recommended for 2.75 m * 2.75 m.","TAMILNADU","THENI","CHINNAMANUR                                       ","2014-10-20 18:14:27.110"
"KHARIF","HORTICULTURE","Flowers","Jasmine","	Plant Protection	","Red Spider mite in jasmine","recommended for spray spray Dicofol 2ml / lit of water","TAMILNADU","THENI","THENI                                             ","2014-10-20 19:16:33.347"
"KHARIF","HORTICULTURE","Vegetables","Tomato","Market Information","market rate for tomato","Recommended for market rate for tomato Rs 12/kg","TAMILNADU","THENI","UTTAMAPALAIYAM                                    ","2014-10-21 15:33:11.293"
"KHARIF","AGRICULTURE","Cereals","Paddy (Dhan)","Fertilizer Use and Availability","paddy basal fertilizer management","Recommended for apply DAP 50 kg + zinc sulphate 10 kg + neem cake 10kg + FYM 10ton /ac","TAMILNADU","THENI","KAMBAM","2014-10-21 15:48:48.857"
"KHARIF","HORTICULTURE","Flowers","Jasmine","Seeds and Planting Material","mullai seedlings.","recommended 04366-224861 number to horticulture department.","TAMILNADU","THENI","ANDIPATTI                                         ","2014-10-21 15:51:27.890"
"KHARIF","AGRICULTURE","Pulses","Black Gram (urd bean)","Varieties","black gram season","recommended for september- november.","TAMILNADU","THENI","UTTAMAPALAIYAM                                    ","2014-10-21 15:55:10.340"
"KHARIF","AGRICULTURE","Pulses","Mochai (lab-lab)","	Plant Protection	","fertilizer recommended for field lab lab","recommneded for applay 12.5;25;12.5 NPK /HECTER","TAMILNADU","THENI","ANDIPATTI                                         ","2014-10-21 17:05:01.330"
"KHARIF","HORTICULTURE","Vegetables","Bitter Gourd","Cultural Practices","bitter gourd season","recommended for the season;  July and January.","TAMILNADU","THENI","KADAMALAIKUNDRU MYLADUMPARAI                      ","2014-10-21 17:38:26.383"
"KHARIF","HORTICULTURE","Vegetables","Beans ","	Plant Protection	","leaf spot in beans","Recommended for spray mancozeb + carbendazim (SAAF)2.5gm/lit of water","TAMILNADU","THENI","KAMBAM","2014-10-21 17:42:55.910"
"KHARIF","AGRICULTURE","Pulses","Mochai (lab-lab)","	Plant Protection	","root rot in lab lab","recommended for soil drench with Carbendazim 2 gm/lit of water","TAMILNADU","THENI","CHINNAMANUR                                       ","2014-10-21 20:01:13.933"
"KHARIF","HORTICULTURE","Fruits","Banana","Nutrient Management","banana fertilizer management","Recommended for apply 150 gm urea + 200 gm super phosphate + 200 gm potash /plant","TAMILNADU","THENI","UTTAMAPALAIYAM                                    ","2014-10-22 08:06:46.793"
"KHARIF","AGRICULTURE","Cereals","Paddy (Dhan)","Nutrient Management","paddy top dressing fertilizer management","Recommended for apply urea 25 kg + potash 15 kg + neem cake 5 kg/ac","TAMILNADU","THENI","UTTAMAPALAIYAM                                    ","2014-10-22 08:35:24.440"
"KHARIF","HORTICULTURE","Plantation Crops","Coconut","Fertilizer Use and Availability","fertilizer management for coconut","recommended for apply 1.300 kg urea + 2 kg superphosphate + 2 kg potash + 5 kg neem cake + 50 kg FYM + 1 kg micro nutrient /tree /year on two split","TAMILNADU","THENI","KADAMALAIKUNDRU MYLADUMPARAI                      ","2014-10-22 15:37:14.260"
"KHARIF","AGRICULTURE","Millets","Maize (Makka)","Fertilizer Use and Availability","Top dressing fertilizer management for maize","recommended for apply urea 25 kg + potash 30 kg kg/ac","TAMILNADU","THENI","KADAMALAIKUNDRU MYLADUMPARAI                      ","2014-10-22 19:01:37.323"
"RABI","HORTICULTURE","Condiments and Spices","Cardamom","Fertilizer Use and Availability","CARDAMOM FERTILIZER MANAGEMENT","RECOMMENDED FOR CARDAMOM FERTILIZER MANAGEMENT UREA 30 KG+SUPER PHOSPHATE 94 KG + POTASH 25 KG/ac","TAMILNADU","THENI","KAMBAM","2014-10-22 19:52:21.633"
"KHARIF","HORTICULTURE","Flowers","Marigold","Fertilizer Use and Availability","Marigold top dressing fertilizer","recommended for Apply urea 40 kg + micro food 3 kg / ac","TAMILNADU","THENI","KADAMALAIKUNDRU MYLADUMPARAI                      ","2014-10-23 10:20:57.007"
"KHARIF","HORTICULTURE","Vegetables","Drum Stick","	Plant Protection	","leaf caterpillar in moringa","Recommended for spray Carbaryl 2ml / lit","TAMILNADU","THENI","THENI                                             ","2014-10-23 11:13:25.407"
"KHARIF","HORTICULTURE","Vegetables","Drum Stick","Cultural Practices","moringa foliar spray","recommended for spray planofix 5 ml/ 10 lit.","TAMILNADU","THENI","UTTAMAPALAIYAM                                    ","2014-10-23 11:19:38.740"
"KHARIF","AGRICULTURE","Cereals","Paddy (Dhan)","Government Schemes","paddy seed availability","Recommended for contact to aduthurai rice research institute 0435-2472098","TAMILNADU","THENI","PERIYAKULAM                                       ","2014-10-23 14:13:01.413"
"KHARIF","HORTICULTURE","Flowers","Jasmine","Government Schemes","Jasmine seedling availability","Recommended for contact to horticulture office :04546 - 242240","TAMILNADU","THENI","ANDIPATTI                                         ","2014-10-23 14:36:13.120"
"KHARIF","HORTICULTURE","Flowers","Jasmine","Seeds and Planting Material","horticulture department no of theni","recommended number for theni horticulture department 04366-224861","TAMILNADU","THENI","ANDIPATTI                                         ","2014-10-23 14:40:38.270"
"KHARIF","HORTICULTURE","Flowers","Jasmine","Seeds and Planting Material","horticulture department no of theni","recommended number for theni horticulture department 04366-224861","TAMILNADU","THENI","ANDIPATTI                                         ","2014-10-23 14:47:11.543"
"KHARIF","AGRICULTURE","Others","Others","Government Schemes","periyakulam horticulture department contact number","recommended for the contact number ;04546 233225","TAMILNADU","THENI","ANDIPATTI                                         ","2014-10-23 15:05:45.110"
"KHARIF","AGRICULTURE","Others","Others","Seeds","horticulture department no of theni","recommended number for theni horticulture department 04546 250139","TAMILNADU","THENI","ANDIPATTI                                         ","2014-10-23 15:18:53.240"
"KHARIF","HORTICULTURE","Vegetables","Cucumber","	Plant Protection	","root rot in cucumber","Recommended for soil drench with copper oxychloride 2.5gm / lit.","TAMILNADU","THENI","CHINNAMANUR                                       ","2014-10-23 15:51:51.680"
"RABI","HORTICULTURE","Fruits","Grape","	Plant Protection	","flower shed grape","recommended for flower shed grape spray mancozeb + carbendazim (SAAF)2.5gm/lit of water","TAMILNADU","THENI","KAMBAM","2014-10-23 16:01:29.970"
"KHARIF","HORTICULTURE","Vegetables","Chillies","Nutrient Management","foliar spray for chilli","Foliar spray of Zn SO4 @ 0.5 per cent thrice at 10 days interval from 40 days after planting. 
Spray 19:19:19 + Mn @ 1 % at 60 days after planting.","TAMILNADU","THENI","UTTAMAPALAIYAM                                    ","2014-10-23 18:08:02.977"
"KHARIF","HORTICULTURE","Fruits","Chestnut","Fertilizer Use and Availability","top dressing fertilizers for chestnut","recommended for apply 500 g urea ,200 g super phosphate ,300 g potash/tree/year","TAMILNADU","THENI","KADAMALAIKUNDRU MYLADUMPARAI                      ","2014-10-23 19:37:55.877"
"KHARIF","AGRICULTURE","Cereals","Paddy (Dhan)","	Plant Protection	","Seed treatment for paddy","recommended for Treat the seeds with Pseudomonas fluorescens 10g/kg of seed","TAMILNADU","THENI","UTTAMAPALAIYAM                                    ","2014-10-24 07:08:43.110"
"KHARIF","AGRICULTURE","Fiber Crops","Cotton (Kapas)","Fertilizer Use and Availability","Fertilizer management for cotton","recommended for Apply Urea 50 kg + potash 20 kg + micro food 5 kg/ac","TAMILNADU","THENI","ANDIPATTI                                         ","2014-10-24 13:24:58.947"
"RABI","HORTICULTURE","Vegetables","Ash Gourd (Petha)","Nutrient Management","Flower drop in ASH GOURD","Flower drop in ASH GOURD  spray planofix 5ml/10 lit of water","TAMILNADU","THENI","KADAMALAIKUNDRU MYLADUMPARAI                      ","2014-10-24 14:41:57.900"
"RABI","HORTICULTURE","Fruits","Banana","Market Information","banana market rate","Recommended for banana market rate rs 280 /kg","TAMILNADU","THENI","PERIYAKULAM                                       ","2014-10-24 19:28:05.463"
"KHARIF","AGRICULTURE","Pulses","Black Gram (urd bean)","	Plant Protection	","foliar spray for blackgram","recommended for DAP 2kg/ac","TAMILNADU","THENI","ANDIPATTI                                         ","2014-10-25 06:47:53.933"
"KHARIF","HORTICULTURE","Vegetables","Onion","	Plant Protection	","Leaf Blight in onion","Recommended for spray mancozeb + carbendazim (saaf) 2.5gm/lit of water","TAMILNADU","THENI","UTTAMAPALAIYAM                                    ","2014-10-25 09:12:18.387"
"KHARIF","HORTICULTURE","Vegetables","Beet Root (Garden Beet/Stock Beet)","Nutrient Management","beetroot Phosphorus , Deficiency Symptoms","recommended for foliar application of DAP 2% at fortnightly intervals.","TAMILNADU","THENI","KAMBAM","2014-10-25 11:25:00.927"
"KHARIF","HORTICULTURE","Vegetables","Beet Root (Garden Beet/Stock Beet)","Nutrient Management","beet root Phosphorus Deficiency Symptoms","recommended for Foliar application of DAP 2% at fortnightly intervals.","TAMILNADU","THENI","KAMBAM","2014-10-25 12:35:51.300"
"KHARIF","HORTICULTURE","Plantation Crops","Cashew","	Plant Protection	","cashew sucking pest and loopers","recommended for spray monocrotophos 2 ml / 1 litre of water","TAMILNADU","THENI","KAMBAM","2014-10-25 13:17:19.070"
"KHARIF","AGRICULTURE","Sugar and Starch Crops","Sugarcane (Noble Cane)","Cultural Practices","Sugarcane Trash Composting method","recommended for Addition of rock phosphate and gypsum facilitates for quicker decomposition","TAMILNADU","THENI","PERIYAKULAM                                       ","2014-10-25 16:37:53.930"
"KHARIF","HORTICULTURE","Vegetables","Beet Root (Garden Beet/Stock Beet)","	Plant Protection	","leaf webber in beet root","recommended for spray malathion 2ml/lit of water","TAMILNADU","THENI","PERIYAKULAM                                       ","2014-10-25 16:47:45.833"
"KHARIF","AGRICULTURE","Others","Others","Market Information","23.10.2014 cocoon rate","cocoon rate - COIMBATORE 181 -  210 / kilo","TAMILNADU","THENI","BODINAYAKKANUR                                    ","2014-10-25 17:41:20.557"
"KHARIF","HORTICULTURE","Vegetables","Beet Root (Garden Beet/Stock Beet)","	Plant Protection	","alterneria leaf spot in beetroot","recommended for chlorothalonil (kavach) 2ml/lit of water","TAMILNADU","THENI","KAMBAM","2014-10-26 09:18:22.510"
"KHARIF","HORTICULTURE","Plantation Crops","Cashew","Fertilizer Use and Availability","Cashew top dressing fertilizer","Recommended for apply urea 1 kg, super phosphate 500 gm,potash 1.5 kg/tree","TAMILNADU","THENI","KADAMALAIKUNDRU MYLADUMPARAI                      ","2014-10-26 14:27:14.337"
"KHARIF","HORTICULTURE","Vegetables","Drum Stick","	Plant Protection	","leaf caterpillar in moringa","Recommended for Spray neem oil 5ml / lit","TAMILNADU","THENI","PERIYAKULAM                                       ","2014-10-26 15:21:01.863"
"KHARIF","HORTICULTURE","Medicinal and Aromatic Plants","Betel Vine","Nutrient Management","betel vine top dressing fertlizer management","Recommended for apply urea 30kg / ac","TAMILNADU","THENI","PERIYAKULAM                                       ","2014-10-26 15:36:14.350"
"RABI","AGRICULTURE","Cereals","Paddy (Dhan)","Fertilizer Use and Availability","paddy basal fertilizer management","Recommended for apply DAP 50 kg + zinc sulphate 10 kg + neem cake 10kg + FYM 10ton /ac","TAMILNADU","THENI","PERIYAKULAM                                       ","2014-10-26 17:05:59.637"
"RABI","AGRICULTURE","Others","Others","Weed Management","Weed management for wasteland","Recommended for Weed management for wasteland spray glyphosate 10 ml and 20 g ammonium sulphate/litre of water.","TAMILNADU","THENI","PERIYAKULAM                                       ","2014-10-26 18:37:59.260"
"KHARIF","HORTICULTURE","Plantation Crops","Coconut","	Plant Protection	","Coconut rhinocerous beetle","recommended for apply monocrotophos 10ml + water 10ml/ tree for root feeding.","TAMILNADU","THENI","PERIYAKULAM                                       ","2014-10-26 19:23:44.687"
"RABI","HORTICULTURE","Flowers","Jasmine","	Plant Protection	","Jasmine Boron Deficiency Symptoms","Recommended for Jasmine  Boron Deficiency Symptoms Spray borax 5 gm/ litre","TAMILNADU","THENI","THENI                                             ","2014-10-26 19:47:47.140"
"KHARIF","HORTICULTURE","Plantation Crops","Coconut","Market Information","market rate for coconut","Recommended for market rate for coconut Rs 13.00/Piece","TAMILNADU","THENI","PERIYAKULAM                                       ","2014-10-26 21:20:40.913"
"KHARIF","HORTICULTURE","Vegetables","Drum Stick","Nutrient Management","fertiliser management in drumstick","recommended for Apply 6:12:12 @10gm/lit","TAMILNADU","THENI","KADAMALAIKUNDRU MYLADUMPARAI                      ","2014-10-27 08:40:41.040"
"KHARIF","AGRICULTURE","Millets","Italian Millet (Thenai/Navane/Foxtail Millet/Kang)","Seeds","seeds availability of tenai","recommended to contact tnau cbe 0422-2450455","TAMILNADU","THENI","BODINAYAKKANUR                                    ","2014-10-27 08:51:43.000"
"KHARIF","HORTICULTURE","Vegetables","Ridge Gourd","	Plant Protection	","bitter gourd foliar application details","bitter gourd foliar spray for 19:19:19 50 gm/tank","TAMILNADU","THENI","KAMBAM","2014-10-28 08:34:12.643"
"KHARIF","HORTICULTURE","Vegetables","Mushroom","Field Preparation","about mushroom training DETAILS","recommended for contact to mushroom department 0422 - 6611336 and Krishi Vigyan Kendra, Madurai - Ph.0452-2422955/2422956","TAMILNADU","THENI","UTTAMAPALAIYAM                                    ","2014-10-29 07:54:54.893"
"KHARIF","HORTICULTURE","Vegetables","Mushroom","Training and Exposure Visits","about mushroom training details","recommended for contact to mushroom department 0422-6611336","TAMILNADU","THENI","UTTAMAPALAIYAM                                    ","2014-10-29 10:17:49.020"
"KHARIF","HORTICULTURE","Vegetables","Mushroom","Training and Exposure Visits","mushroom training details","recommended for contact to mushroom department 0422-6611336","TAMILNADU","THENI","UTTAMAPALAIYAM                                    ","2014-10-29 12:06:36.717"
"KHARIF","HORTICULTURE","Vegetables","Tomato","	Plant Protection	","flower shed in tomato","Recommended for spray planofix 5 ml/10lit of water","TAMILNADU","THENI","THENI                                             ","2014-10-29 15:35:08.000"
"KHARIF","HORTICULTURE","Vegetables","Chillies","	Plant Protection	","leaf curl in chilli","Recommended for spray methyldemeton 2ml / lit","TAMILNADU","THENI","ANDIPATTI                                         ","2014-10-29 17:22:40.687"
"KHARIF","AGRICULTURE","Others","Others","Weed Management","weed management for wasteland","Recommended for spray glyphosate  10 ml and 20 g ammonium sulphate/litre of water","TAMILNADU","THENI","BODINAYAKKANUR                                    ","2014-10-30 14:40:16.720"
"KHARIF","AGRICULTURE","Cereals","Paddy (Dhan)","Seeds","contact to agriculture dept","Recommended for contact to agriculture dept number 0431 –2690692","TAMILNADU","THENI","BODINAYAKKANUR                                    ","2014-10-30 20:23:57.473"
"KHARIF","HORTICULTURE","Vegetables","Tomato","Cultural Practices","sowing season for tomato","recommended for the season   November – December","TAMILNADU","THENI","ANDIPATTI                                         ","2014-10-30 20:41:45.690"
"KHARIF","AGRICULTURE","Cereals","Paddy (Dhan)","Fertilizer Use and Availability","paddy top dressing fertilizer management","Recommended for apply urea 25 kg + potash 15 kg + neem cake 5 kg/ac","TAMILNADU","THENI","CHINNAMANUR                                       ","2014-10-31 16:03:32.740"
"RABI","AGRICULTURE","Cereals","Paddy (Dhan)","Fertilizer Use and Availability","Paddy basal fertilizer","rECOMMENDED FOR Paddy basal fertilizer for apply DAP 50 kg + zinc sulphate 10kg + neem cake 10 kg/ac","TAMILNADU","THENI","BODINAYAKKANUR                                    ","2014-10-31 17:19:00.913"
"KHARIF","HORTICULTURE","Vegetables","Kundru","Fertilizer Use and Availability","snake gourd top dressing fertilizer management","Recommended for apply urea 10gm / pit","TAMILNADU","THENI","THENI                                             ","2014-10-31 19:29:34.657"
"KHARIF","HORTICULTURE","Vegetables","Drum Stick","Fertilizer Use and Availability","fertigation fertilizer for moringa","recommended for Apply 19:19:19 complex 4 kg/ac for 15 days interval","TAMILNADU","THENI","KADAMALAIKUNDRU MYLADUMPARAI                      ","2014-10-31 21:08:57.000"
