"Season","Sector","Category","Crop","QueryType","QueryText","KCCAns","StateName","DistrictName","BlockName","CreatedOn"
"KHARIF","HORTICULTURE","Fruits","Banana","Market Information","market rate for banana","market rate for banana rs:150-350/bunch","TAMILNADU","THENI","PERIYAKULAM                                       ","2014-09-18 10:57:41.847"
"KHARIF","AGRICULTURE","Others","Others","Government Schemes","asking about kisan credit card details","Recommended contact to nationalized bank","TAMILNADU","THENI","ANDIPATTI                                         ","2014-09-18 14:52:11.170"
"KHARIF","AGRICULTURE","Millets","Maize (Makka)","Fertilizer Use and Availability","Top dressing fertilizer management for maize","recommended for Apply urea 40 kg, potash 20 kg, neem cake 10 kg/ac","TAMILNADU","THENI","KADAMALAIKUNDRU MYLADUMPARAI                      ","2014-09-18 17:07:57.690"
"KHARIF","HORTICULTURE","Fruits","Mango","Seeds and Planting Material","seed availability details contact number","recommended for the contact number; 04366-224861","TAMILNADU","THENI","BODINAYAKKANUR                                    ","2014-09-18 18:11:56.740"
"KHARIF","HORTICULTURE","Fruits","Banana","	Plant Protection	","Rhizome weevil in banana","recommended for spray monocrotophos 3ml/tree","TAMILNADU","THENI","UTTAMAPALAIYAM                                    ","2014-09-18 18:48:22.483"
"KHARIF","HORTICULTURE","Fruits","Banana","	Plant Protection	","banana Rhizome weevil","banana Rhizome weevil Stem injection with monocrotophos 4ml/plant 30 degree","TAMILNADU","THENI","UTTAMAPALAIYAM                                    ","2014-09-18 18:56:50.593"
"KHARIF","AGRICULTURE","Others","Others","Government Schemes","horticulture department no of theni","recommended number for horticulture department  04366-224861","TAMILNADU","THENI","UTTAMAPALAIYAM                                    ","2014-09-18 20:31:07.190"
"KHARIF","AGRICULTURE","Sugar and Starch Crops","Tapioca (Cassava)","	Plant Protection	","Cercospora Leaf spot tapioca","recommended for spray chlorothalanil 2ml/liter water","TAMILNADU","THENI","THENI                                             ","2014-09-19 08:33:03.293"
"KHARIF","HORTICULTURE","Vegetables","Bhindi(Okra/Ladysfinger)","Market Information","bhindi after 1 month market details","recommended for contact to DEMIC department 0422 - 2431405","TAMILNADU","THENI","ANDIPATTI                                         ","2014-09-19 09:35:43.773"
"KHARIF","HORTICULTURE","Vegetables","Bhindi(Okra/Ladysfinger)","Field Preparation","bhindi hybrid varieties","Hybrid : Co 3, Co BhH 1","TAMILNADU","THENI","ANDIPATTI                                         ","2014-09-19 10:05:07.917"
"KHARIF","HORTICULTURE","Vegetables","Drum Stick","Cultural Practices","season for drum stick","recommended season for drum stick during July – October","TAMILNADU","THENI","THENI                                             ","2014-09-19 12:00:01.787"
"KHARIF","AGRICULTURE","Millets","Maize (Makka)","Fertilizer Use and Availability","Top dressing fertilizer management for maize","recommended Apply urea 40 kg, potash 10 kg, zinc sulphate 10 kg, neem cake 10 kg/ac","TAMILNADU","THENI","THENI                                             ","2014-09-19 12:41:12.790"
"KHARIF","HORTICULTURE","Vegetables","Mushroom","Training and Exposure Visits","asking about mushroom training details","Recommended for given TNAU Mushroom dept. contact no. 0422 - 6611336","TAMILNADU","THENI","THENI                                             ","2014-09-19 13:33:49.587"
"KHARIF","AGRICULTURE","Fiber Crops","Cotton (Kapas)","Fertilizer Use and Availability","Basal fertilizer management for cotton","recommended for Basal fertilizer management for cotton apply urea 33kg+superphosphate 100kg+potash 26kg/ac","TAMILNADU","THENI","KADAMALAIKUNDRU MYLADUMPARAI                      ","2014-09-19 17:18:38.490"
"KHARIF","HORTICULTURE","Vegetables","Mushroom","Training and Exposure Visits","mushroom training details contact number","recommended for the contact number ;0422 - 6611336","TAMILNADU","THENI","UTTAMAPALAIYAM                                    ","2014-09-19 18:35:55.507"
"KHARIF","HORTICULTURE","Plantation Crops","Coconut","Nutrient Management","coconut fertilizer management","Recommended for apply FYM 10kg / tree","TAMILNADU","THENI","PERIYAKULAM                                       ","2014-09-20 09:43:55.953"
"KHARIF","AGRICULTURE","Cereals","Paddy (Dhan)","Nutrient Management","top dressing fertilizer management for paddy","recommended for urea 25kg+ potash 15kg / ac","TAMILNADU","THENI","UTTAMAPALAIYAM                                    ","2014-09-20 10:27:10.357"
"KHARIF","AGRICULTURE","Cereals","Oats ","Nutrient Management","khaira disease in paddy","recommended spray zinch sulphate 500gm/liter water","TAMILNADU","THENI","THENI                                             ","2014-09-20 12:25:58.760"
"KHARIF","HORTICULTURE","Vegetables","Drum Stick","Market Information","Drum Stick market rate","Recommended for Drum Stick market rate :  18 – 30 Rs./Kg","TAMILNADU","THENI","BODINAYAKKANUR                                    ","2014-09-20 13:27:19.430"
"KHARIF","HORTICULTURE","Plantation Crops","Coconut","Agriculture Mechanization","Button shedding in coconut","Recommended for root feeding with TNAU coconut tonic 200 ml / tree","TAMILNADU","THENI","KAMBAM","2014-09-20 16:55:55.870"
"KHARIF","HORTICULTURE","Vegetables","Drum Stick","Seeds and Planting Material","seed availability details contact number","recommended for contact number;04542-240931","TAMILNADU","THENI","BODINAYAKKANUR                                    ","2014-09-20 18:40:05.313"
"KHARIF","HORTICULTURE","Vegetables","Brinjal","	Plant Protection	","thrips in brinjal","Spray imidaclopride 2 ml/lit","TAMILNADU","THENI","KADAMALAIKUNDRU MYLADUMPARAI                      ","2014-09-21 08:06:14.010"
"KHARIF","HORTICULTURE","Vegetables","Cauliflower","	Plant Protection	","cut worms in cauliflower","recommended apray for chlorpyriphos 2ml+neemoil 3ml+teepol 1ml/lit of water","TAMILNADU","THENI","ANDIPATTI                                         ","2014-09-21 13:10:27.627"
"KHARIF","HORTICULTURE","Vegetables","Chillies","Market Information","market rate for chilli","Madurai Market	Round	1	30.00/Kg	20.00/Kg","TAMILNADU","THENI","ANDIPATTI                                         ","2014-09-21 13:19:17.560"
"KHARIF","AGRICULTURE","Cereals","Paddy (Dhan)","	Plant Protection	","Paddy stem borer","recommended for Paddy stem borer Spray quinalphos 2ml/litre","TAMILNADU","THENI","UTTAMAPALAIYAM                                    ","2014-09-21 14:22:00.140"
"KHARIF","HORTICULTURE","Fruits","Banana","	Plant Protection	","Mealy bug for banana","recommended for Mealy bug for banana Spray profenophos 25 EC 2 ml + acephate 2 ml / lit","TAMILNADU","THENI","UTTAMAPALAIYAM                                    ","2014-09-21 15:55:58.360"
"KHARIF","HORTICULTURE","Fruits","Banana","	Plant Protection	","Better bunchy fruit size increase in banana","recommended for Better bunchy fruit size increase in banana Spray potassium sulphate 10 gm/lit","TAMILNADU","THENI","UTTAMAPALAIYAM                                    ","2014-09-21 16:07:59.463"
"KHARIF","AGRICULTURE","Cereals","Paddy (Dhan)","	Plant Protection	","BLB in paddy","Recommended for spray bactreiomycin 18 gm /ac","TAMILNADU","THENI","UTTAMAPALAIYAM                                    ","2014-09-21 18:18:52.520"
"KHARIF","HORTICULTURE","Vegetables","Tomato","Market Information","tomato market rate","Recommended for tomato market rate : 10 - 20 Rs./Kg","TAMILNADU","THENI","THENI                                             ","2014-09-22 09:48:58.657"
"KHARIF","HORTICULTURE","Vegetables","Cucumber","Nutrient Management","cucumber top dressing fertilizer management","Recommended for apply urea 28kg / ac","TAMILNADU","THENI","CHINNAMANUR                                       ","2014-09-22 10:22:00.320"
"KHARIF","AGRICULTURE","Fiber Crops","Cotton (Kapas)","Training and Exposure Visits","SEASON AND VARIETIES COTTON","recommended for MCU 5, MCU 5 VT, Suvin, TCHB 213*, MCU 12,","TAMILNADU","THENI","THENI                                             ","2014-09-22 16:23:52.437"
"KHARIF","AGRICULTURE","Cereals","Paddy (Dhan)","	Plant Protection	","Sheath Rot in paddy","Recommended for Spray Carbendazim 2gm / lit","TAMILNADU","THENI","UTTAMAPALAIYAM                                    ","2014-09-22 16:55:56.727"
"KHARIF","AGRICULTURE","Millets","Sorghum (Jowar/Great Millet)","	Plant Protection	","Stem borer in sorghum","Recommended for apply carbofuran 5kg + sand 20 kg/ac","TAMILNADU","THENI","UTTAMAPALAIYAM                                    ","2014-09-22 16:59:32.823"
"KHARIF","AGRICULTURE","Cereals","Paddy (Dhan)","Cultural Practices","Suitable paddy varieties for theni","White Ponni, ADT 39, ADT 38, ADT (R)46, CO (R) 48, CO (R) 49, CO (R) 50, ADT (R) 49, CORH 4","TAMILNADU","THENI","PERIYAKULAM                                       ","2014-09-23 11:21:36.267"
"KHARIF","HORTICULTURE","Vegetables","Drum Stick","Market Information","drum stick market rate Ottanchatram","recommended for drum stick market rate Ottanchatram  rs 23.00/kg","TAMILNADU","THENI","ANDIPATTI                                         ","2014-09-23 17:23:06.317"
"KHARIF","AGRICULTURE","Millets","Sorghum (Jowar/Great Millet)","Varieties","sorghum season","recommended for sowing at september-october.","TAMILNADU","THENI","ANDIPATTI                                         ","2014-09-23 19:45:14.347"
"KHARIF","HORTICULTURE","Plantation Crops","Coconut","Market Information","copra market rate","recommended for copra market rate rs 10125-10416/quintal","TAMILNADU","THENI","UTTAMAPALAIYAM                                    ","2014-09-23 20:49:14.777"
"KHARIF","HORTICULTURE","Vegetables","Tomato","Fertilizer Use and Availability","Top dressing fertilizer management for tomato","recommended apply urea 60 kg/ac","TAMILNADU","THENI","UTTAMAPALAIYAM                                    ","2014-09-24 10:18:12.557"
"KHARIF","HORTICULTURE","Fruits","Grape","	Plant Protection	","graps mealy bug","Release Coccinellid beetle, Cryptolaemus montrouzieri at the rate of 10 per vine.","TAMILNADU","THENI","UTTAMAPALAIYAM                                    ","2014-09-24 11:59:38.100"
"KHARIF","AGRICULTURE","Others","Others","Weather","weather detail in theni","have no rain in theni","TAMILNADU","THENI","PERIYAKULAM                                       ","2014-09-24 12:50:36.760"
"KHARIF","AGRICULTURE","Pulses","Pigeon pea (red gram/arhar/tur)","Cultural Practices","Red gram sowing season","Recommended for Purattasipattam (September – October)","TAMILNADU","THENI","PERIYAKULAM                                       ","2014-09-24 13:11:18.037"
"KHARIF","HORTICULTURE","Fruits","Acid Lime","	Plant Protection	","citru fertilizer management","Recommended for apply 200 gm urea + 100gm super + 100gm potash /ac","TAMILNADU","THENI","KADAMALAIKUNDRU MYLADUMPARAI                      ","2014-09-24 15:17:37.987"
"KHARIF","HORTICULTURE","Vegetables","Drum Stick","Fertilizer Use and Availability","Drum stick fertilizer management","RECOMMENDED FOR Drum stick fertilizer management Apply urea 38 g + super phosphate 38 g + potash 20 g / pit","TAMILNADU","THENI","KADAMALAIKUNDRU MYLADUMPARAI                      ","2014-09-24 17:32:21.730"
"KHARIF","AGRICULTURE","Millets","Italian Millet (Thenai/Navane/Foxtail Millet/Kang)","	Field Preparation	","Cumbu SEASON","RECOMMENDED FOR Cumbu SEASON September -October)","TAMILNADU","THENI","ANDIPATTI                                         ","2014-09-25 09:13:44.090"
"KHARIF","ANIMAL HUSBANDRY","Animal","POULTRY  FARM ","Animal Production (Piggery, Goatery, Sheep Farming etc.)","THENI Veterinary DEPARTMENT NUMBER","RECOMMENDED FOR THENI Veterinary DEPARTMENT NUMBER CONTACT 04546-260047","TAMILNADU","THENI","KADAMALAIKUNDRU MYLADUMPARAI                      ","2014-09-25 09:37:14.360"
"KHARIF","AGRICULTURE","Others","Others","Government Schemes","asking about govt.schemes details","Recommended contact to block level agriculture office","TAMILNADU","THENI","ANDIPATTI                                         ","2014-09-25 09:51:39.543"
"KHARIF","AGRICULTURE","Fiber Crops","Cotton (Kapas)","Fertilizer Use and Availability","Basal fertilizer management for cotton","RECOMMENDED FOR Basal fertilizer management for cotton apply urea 33kg+superphosphate 100kg+potash 26kg/ac","TAMILNADU","THENI","ANDIPATTI                                         ","2014-09-25 10:19:40.213"
"KHARIF","HORTICULTURE","Flowers","Rose","	Plant Protection	","rose Botrytis Blight","recommended for spray carbendazim @ 1 g / litre of water.","TAMILNADU","THENI","ANDIPATTI                                         ","2014-09-25 13:38:31.590"
"KHARIF","HORTICULTURE","Fruits","Banana","Fertilizer Use and Availability","Fertilizer management for banana","recommended for apply urea 150gm+superphosphate 200gm+potash 200gm /plant","TAMILNADU","THENI","PERIYAKULAM                                       ","2014-09-25 16:25:45.537"
"KHARIF","HORTICULTURE","","","","Fertilizer management for banana","recommended for apply urea 150gm+superphosphate 200gm+potash 200gm /plant","TAMILNADU","THENI","PERIYAKULAM                                       ","2014-09-25 16:27:58.833"
"KHARIF","HORTICULTURE","","","","Fertilizer management for banana","recommended for apply urea 150gm+superphosphate 200gm+potash 200gm /plant","TAMILNADU","THENI","PERIYAKULAM                                       ","2014-09-25 16:28:00.483"
"KHARIF","HORTICULTURE","Vegetables","Drum Stick","Fertilizer Use and Availability","drum stick fertilizer management","RECOMMENDED FOR drum stick fertilizer management apply urea 38 g + super phosphate 38 g + potash 20 g / pit","TAMILNADU","THENI","KADAMALAIKUNDRU MYLADUMPARAI                      ","2014-09-25 17:06:19.950"
"KHARIF","AGRICULTURE","Cereals","Paddy (Dhan)","Fertilizer Use and Availability","basal fertilizer management for paddy","recommended for apply dap 50kg /ac","TAMILNADU","THENI","UTTAMAPALAIYAM                                    ","2014-09-25 17:58:32.637"
"KHARIF","AGRICULTURE","Others","Others","Weather","weather forecast","recommended for today is arainy day","TAMILNADU","THENI","UTTAMAPALAIYAM                                    ","2014-09-25 18:35:29.213"
"KHARIF","HORTICULTURE","Vegetables","Onion","	Plant Protection	","Onion Thrips control details","recommended for Spray Fipronil 5 % SC 1.5 ml/lit of water","TAMILNADU","THENI","ANDIPATTI                                         ","2014-09-25 19:06:58.103"
"KHARIF","HORTICULTURE","Vegetables","Cowpea (Vegetable)","	Plant Protection	","aphids in cowpea","recommended for rogar 2ml+neemoil 3ml+teepol 1ml/lit of water","TAMILNADU","THENI","CHINNAMANUR                                       ","2014-09-26 08:08:27.670"
"KHARIF","AGRICULTURE","Others","Others","	Plant Protection	","Weed management for wasteland","recommended for spray glyphosate 10 ml and 20 g ammonium sulphate/litre of water.","TAMILNADU","THENI","THENI                                             ","2014-09-26 08:52:15.733"
"KHARIF","HORTICULTURE","Vegetables","Tomato","Nutrient Management","flower drop in tomato","recommended for spray planofix 5ml/10lit of water","TAMILNADU","THENI","ANDIPATTI                                         ","2014-09-26 10:52:26.777"
"KHARIF","HORTICULTURE","Vegetables","Drum Stick","	Plant Protection	","caterpillar in drum stick","recommended for spray chlorpyriphos 2 ml / lit of water","TAMILNADU","THENI","ANDIPATTI                                         ","2014-09-26 10:55:00.260"
"KHARIF","AGRICULTURE","Others","Others","	Plant Protection	","Weed management for wasteland","recommended for spray glyphosate  10 ml and 20 g ammonium sulphate / litre of water","TAMILNADU","THENI","THENI                                             ","2014-09-26 12:04:42.083"
"KHARIF","AGRICULTURE","Cereals","Paddy (Dhan)","	Plant Protection	","paddy nursery fertilizer management","recommended for apply DAP 2kg / ac","TAMILNADU","THENI","UTTAMAPALAIYAM                                    ","2014-09-26 15:29:52.943"
"KHARIF","HORTICULTURE","Fruits","Mango","	Plant Protection	","mango leaf webber.","recommended for spray quinalphos 2ml/lit.","TAMILNADU","THENI","KADAMALAIKUNDRU MYLADUMPARAI                      ","2014-09-26 17:13:21.607"
"KHARIF","AGRICULTURE","Others","Others","Government Schemes","block level agri department contact  number","recommended for contact number 04175 - 242211","TAMILNADU","THENI","ANDIPATTI                                         ","2014-09-26 18:10:55.203"
"KHARIF","HORTICULTURE","Flowers","Marigold","Fertilizer Use and Availability","seed rate for marigold","recommended for the seed rate 1.5 kg/hecter","TAMILNADU","THENI","UTTAMAPALAIYAM                                    ","2014-09-26 18:41:59.283"
"KHARIF","HORTICULTURE","Vegetables","Chinese Cabbage","	Plant Protection	","Powdery mildew in beans","Recommended for spray carbendazim 2gm / lit","TAMILNADU","THENI","BODINAYAKKANUR                                    ","2014-09-26 19:58:11.690"
"KHARIF","HORTICULTURE","Plantation Crops","Cashew","Fertilizer Use and Availability","cashewnut fertilizer management","Recommended for apply urea 500gm + super phosphate 200gm + potash 300gm / tree","TAMILNADU","THENI","KAMBAM","2014-09-26 20:37:04.367"
"KHARIF","HORTICULTURE","Vegetables","Tomato","	Plant Protection	","Fruit Borer in tomato","recommended for spray Quinalphos 2ml/lit of water","TAMILNADU","THENI","ANDIPATTI                                         ","2014-09-26 21:42:26.780"
"KHARIF","AGRICULTURE","Pulses","Black Gram (urd bean)","Nutrient Management","foliar spray in black gram","recommended for spray DAP 2kg/ac","TAMILNADU","THENI","BODINAYAKKANUR                                    ","2014-09-27 07:58:33.720"
"KHARIF","HORTICULTURE","Vegetables","Potato","Field Preparation","potato tuber seed availability","Dr.J.Rajangam, Ph.D., Professor and Head, Horticultural Research Station, Kodaikanal-624103 Dindigul(Dt.) Phone:04542-240931 Mobile:9443889717","TAMILNADU","THENI","KAMBAM","2014-09-27 08:17:20.503"
"KHARIF","HORTICULTURE","Fruits","Banana","Market Information","market rate for banana","recommended market rate for banana rs.300/bunch","TAMILNADU","THENI","PERIYAKULAM                                       ","2014-09-27 08:33:46.687"
"KHARIF","ANIMAL HUSBANDRY","Animal","Bovine(Cow,Buffalo)","Dairy Production","poultry manangement","recommended for contact no 04546-260047  veterinary department","TAMILNADU","THENI","PERIYAKULAM                                       ","2014-09-27 08:35:15.560"
"KHARIF","HORTICULTURE","Vegetables","Tomato","Fertilizer Use and Availability","Hybrid tomato top dressing fertilizer","recommended for Apply urea 42 kg, potash 32 kg/ac for 30th, 45, 60 th days","TAMILNADU","THENI","UTTAMAPALAIYAM                                    ","2014-09-27 09:59:50.017"
"KHARIF","HORTICULTURE","Vegetables","Tomato","Nutrient Management","flower drop in tomato","recommended for spray planofix 5ml/10lit of water","TAMILNADU","THENI","UTTAMAPALAIYAM                                    ","2014-09-28 10:15:18.043"
"KHARIF","HORTICULTURE","Vegetables","Drum Stick","Market Information","moringa market rate","recommended as Rs 4/ kattu","TAMILNADU","THENI","BODINAYAKKANUR                                    ","2014-09-28 14:51:37.030"
"KHARIF","AGRICULTURE","Millets","Maize (Makka)","Fertilizer Use and Availability","Pre emergency Weed control in maize","recommended for Spray atrazin 2gm/lit","TAMILNADU","THENI","THENI                                             ","2014-09-28 16:04:11.307"
"KHARIF","HORTICULTURE","Vegetables","Drum Stick","Fertilizer Use and Availability","Drum stick fertilizer management","recommended for Apply urea 38 g + super phosphate 38 g + potash 20 g / pit","TAMILNADU","THENI","BODINAYAKKANUR                                    ","2014-09-28 16:12:17.910"
"KHARIF","HORTICULTURE","Vegetables","Drum Stick","Fertilizer Use and Availability","Drum stick fertilizer management","Recommended for apply urea 38 g + super phosphate 38 g + potash 20 g / pit","TAMILNADU","THENI","THENI                                             ","2014-09-28 16:15:21.943"
"KHARIF","HORTICULTURE","Vegetables","Chillies","	Plant Protection	","damping off in chilli","recommended drench the soil with coc 2.5gm/lit","TAMILNADU","THENI","BODINAYAKKANUR                                    ","2014-09-29 07:02:45.597"
"KHARIF","HORTICULTURE","Vegetables","Drum Stick","Market Information","market rate for drumstick","Drumstick Madurai Market rate 30.00/Kg","TAMILNADU","THENI","BODINAYAKKANUR                                    ","2014-09-29 07:13:38.927"
"KHARIF","AGRICULTURE","Millets","Sorghum (Jowar/Great Millet)","Cultural Practices","sorghum sowing season and variety","Recommended for sorghum sowing season : September - october  and variety : CO(S) 28, CO 30, K Tall, K 11, BSR 1, APK 1","TAMILNADU","THENI","ANDIPATTI                                         ","2014-09-29 10:02:31.870"
"KHARIF","HORTICULTURE","Fruits","Mango","Seeds and Planting Material","mango seedlings","recommended 04546-231726, 04546-233225 numbers to contact hc&ri, periyakulam.","TAMILNADU","THENI","BODINAYAKKANUR                                    ","2014-09-29 11:01:36.373"
"KHARIF","HORTICULTURE","Vegetables","Drum Stick","Cultural Practices","moringa spacing details","Recommended for moringa spacing 2m x 2.5m","TAMILNADU","THENI","KAMBAM","2014-09-29 19:33:06.310"
"KHARIF","HORTICULTURE","Vegetables","Ash Gourd (Petha)","Field Preparation","Ash gourd varieties and Season","Co 1 and Co 2 are the popular varieties and Planting is done during July and January.","TAMILNADU","THENI","ANDIPATTI                                         ","2014-09-30 07:48:51.593"
"KHARIF","HORTICULTURE","Vegetables","Tomato","Market Information","season for tomato","recommended season for oct-nov","TAMILNADU","THENI","ANDIPATTI                                         ","2014-09-30 07:53:05.847"
"KHARIF","HORTICULTURE","Vegetables","Drum Stick","Nutrient Management","flower shed in moringa","Recommended for spray palnofix 5 ml /10 lit of water","TAMILNADU","THENI","ANDIPATTI                                         ","2014-09-30 08:04:37.497"
"KHARIF","AGRICULTURE","Others","Others","Weather","weather detail in theni","have rain in theni","TAMILNADU","THENI","THENI                                             ","2014-09-30 10:08:54.760"
"KHARIF","HORTICULTURE","Flowers","Marigold","Seeds and Planting Material","variety of marigold","recommended variety of marigold Local types (orange & yellow), Pusa Narangi Gainda, Pusa Basanthi Gainda (IARI varieties) and MDU 1","TAMILNADU","THENI","ANDIPATTI                                         ","2014-09-30 13:33:50.057"
"KHARIF","HORTICULTURE","Vegetables","Drum Stick","Market Information","market rate for drum stick","Drumstick Madurai Market rate 30.00/Kg","TAMILNADU","THENI","ANDIPATTI                                         ","2014-09-30 13:34:49.753"
"KHARIF","HORTICULTURE","Vegetables","Lab Lab","	Plant Protection	","Root rot in LAB LAB","RECOMMENDED FOR Root rot in LAB LAB  Spray copper oxychloride 2gm/lit of water","TAMILNADU","THENI","CHINNAMANUR                                       ","2014-09-30 18:11:54.257"
