"Season","Sector","Category","Crop","QueryType","QueryText","KCCAns","StateName","DistrictName","BlockName","CreatedOn"
"KHARIF","AGRICULTURE","Others","Others","Soil Testing","soil test lab contact no.","recommended 9442022064 number.","TAMILNADU","THENI","KAMBAM","2014-09-01 19:34:17.740"
"KHARIF","HORTICULTURE","Vegetables","Chillies","Market Information","chilli market rate","recommended as Rs 28/kg.","TAMILNADU","THENI","ANDIPATTI                                         ","2014-09-01 19:51:29.847"
"KHARIF","AGRICULTURE","Fiber Crops","Cotton (Kapas)","Cultural Practices","cotton varieties","recommended for MCU 5,  Suvin, TCHB 213*, MCU 12,
MCU 13, Surabhi.","TAMILNADU","THENI","BODINAYAKKANUR                                    ","2014-09-02 10:14:25.597"
"KHARIF","AGRICULTURE","Pulses","Black Gram (urd bean)","	Field Preparation	","Black gram sowing season","Recommended for Black gram sowing season : September - November","TAMILNADU","THENI","PERIYAKULAM                                       ","2014-09-02 11:18:11.837"
"KHARIF","HORTICULTURE","Vegetables","Tomato","Fertilizer Use and Availability","tomato foliar application details","Recommended for tomato foliar spray for 19:19:19 50 gm/tank","TAMILNADU","THENI","BODINAYAKKANUR                                    ","2014-09-02 18:52:49.667"
"KHARIF","HORTICULTURE","Plantation Crops","Coconut","Nutrient Management","coconut fertilizer management","recommended for apply 1.300 kg urea + 2 kg superphosphate + 2 kg potash + 5 kg neem cake + 50 kg FYM + 1 kg micro nutrient /tree /year on two split","TAMILNADU","THENI","CHINNAMANUR                                       ","2014-09-02 19:47:18.637"
"KHARIF","HORTICULTURE","Vegetables","Cucumber","Market Information","market price of cucumber","recommended for market price of cucumber is rs.20/kg","TAMILNADU","THENI","UTTAMAPALAIYAM                                    ","2014-09-04 09:33:09.240"
"KHARIF","HORTICULTURE","Vegetables","Drum Stick","	Plant Protection	","Drum stick flower dropping","recommended for Spray planofix 5ml/tank","TAMILNADU","THENI","KADAMALAIKUNDRU MYLADUMPARAI                      ","2014-09-04 10:32:35.873"
"KHARIF","HORTICULTURE","Vegetables","Drum Stick","	Plant Protection	","Drum stick flower dropping","recommended for Spray planofix 5ml/tank","TAMILNADU","THENI","KADAMALAIKUNDRU MYLADUMPARAI                      ","2014-09-04 10:32:35.873"
"KHARIF","HORTICULTURE","Vegetables","Drum Stick","	Plant Protection	","Drum stick flower dropping","recommended for Spray planofix 5ml/tank","TAMILNADU","THENI","KADAMALAIKUNDRU MYLADUMPARAI                      ","2014-09-04 10:32:35.873"
"KHARIF","AGRICULTURE","Others","Others","Credit","Message need my mobile in english","recommended for as your request we are activated","TAMILNADU","THENI","KAMBAM","2014-09-04 10:41:07.570"
"KHARIF","HORTICULTURE","Vegetables","Drum Stick","Fertilizer Use and Availability","Drum stick fertilizer management","recommended for Apply urea 38 g + potash 20 g / pit","TAMILNADU","THENI","KADAMALAIKUNDRU MYLADUMPARAI                      ","2014-09-04 10:47:14.240"
"KHARIF","HORTICULTURE","Vegetables","Drum Stick","Fertilizer Use and Availability","Drum stick fertilizer management","recommended for Apply urea 38 g + potash 20 g / pit","TAMILNADU","THENI","KADAMALAIKUNDRU MYLADUMPARAI                      ","2014-09-04 10:47:14.240"
"KHARIF","HORTICULTURE","Vegetables","Drum Stick","Fertilizer Use and Availability","Drum stick fertilizer management","recommended for Apply urea 38 g + potash 20 g / pit","TAMILNADU","THENI","KADAMALAIKUNDRU MYLADUMPARAI                      ","2014-09-04 10:47:14.240"
"KHARIF","HORTICULTURE","Vegetables","Bhindi(Okra/Ladysfinger)","	Plant Protection	","Aphids in bhendi","Recommended for spray Dimethoate 2ml / lit of water","TAMILNADU","THENI","UTTAMAPALAIYAM                                    ","2014-09-04 14:16:27.017"
"KHARIF","HORTICULTURE","Vegetables","Bhindi(Okra/Ladysfinger)","	Plant Protection	","Aphids in bhendi","Recommended for spray Dimethoate 2ml / lit of water","TAMILNADU","THENI","UTTAMAPALAIYAM                                    ","2014-09-04 14:16:27.017"
"KHARIF","HORTICULTURE","Vegetables","Brinjal","	Plant Protection	","Brinjal fruit borer","recommended for spray Chlorantraniliprole 20 SC 80 ml/acre","TAMILNADU","THENI","ANDIPATTI                                         ","2014-09-04 14:28:09.487"
"KHARIF","HORTICULTURE","Vegetables","Bhindi(Okra/Ladysfinger)","	Plant Protection	","White fly in bhendi","recommended for White fly in bhendi spray dimethoate 2ml+neem oil 3ml+teepol 1ml/lit of water","TAMILNADU","THENI","THENI                                             ","2014-09-04 14:31:26.477"
"KHARIF","AGRICULTURE","Cereals","Paddy (Dhan)","	Plant Protection	","Rice tungro disease in paddy","recommended for spray  Imidacloprid 2ml/lit of water","TAMILNADU","THENI","UTTAMAPALAIYAM                                    ","2014-09-04 15:19:52.240"
"KHARIF","HORTICULTURE","Vegetables","Drum Stick","Fertilizer Use and Availability","moringa fertilizer management","Recommended for apply urea 45gm / plant.","TAMILNADU","THENI","KADAMALAIKUNDRU MYLADUMPARAI                      ","2014-09-04 16:09:51.427"
"KHARIF","HORTICULTURE","Vegetables","Drum Stick","Fertilizer Use and Availability","moringa fertilizer management","Recommended for apply urea 45gm / plant.","TAMILNADU","THENI","KADAMALAIKUNDRU MYLADUMPARAI                      ","2014-09-04 16:09:51.427"
"KHARIF","HORTICULTURE","Vegetables","Drum Stick","Fertilizer Use and Availability","moringa fertilizer management","Recommended for apply urea 45gm / plant.","TAMILNADU","THENI","KADAMALAIKUNDRU MYLADUMPARAI                      ","2014-09-04 16:09:51.427"
"KHARIF","AGRICULTURE","Others","Others","Market Information","market rate for cocoon","REcommended for market rate for cocoon  Rs 373/kg","TAMILNADU","THENI","BODINAYAKKANUR                                    ","2014-09-04 17:35:19.217"
"KHARIF","AGRICULTURE","Others","Others","Market Information","market rate for cocoon","REcommended for market rate for cocoon  Rs 373/kg","TAMILNADU","THENI","BODINAYAKKANUR                                    ","2014-09-04 17:35:19.217"
"KHARIF","HORTICULTURE","Vegetables","Drum Stick","Fertilizer Use and Availability","Drum stick fertilizer management","recommmended for Drum stick fertilizer management Apply urea 38 g + super phosphate 38 g + potash 20 g / pit","TAMILNADU","THENI","KADAMALAIKUNDRU MYLADUMPARAI                      ","2014-09-06 09:09:31.480"
"KHARIF","AGRICULTURE","Sugar and Starch Crops","Sugarcane (Noble Cane)","Fertilizer Use and Availability","sugarcane top dressing fertilizer management","recommended for Apply urea 80 kg, potasah 25 kg / ac.","TAMILNADU","THENI","PERIYAKULAM                                       ","2014-09-06 12:56:32.247"
"KHARIF","AGRICULTURE","Cereals","Paddy (Dhan)","	Plant Protection	","BLB in paddy","recommended for Spray bactreiomycin 18 gm /ac","TAMILNADU","THENI","UTTAMAPALAIYAM                                    ","2014-09-06 17:04:15.617"
"KHARIF","HORTICULTURE","Vegetables","Brinjal","Market Information","brinjal market information","recommended for brinjal market information 20/kg","TAMILNADU","THENI","BODINAYAKKANUR                                    ","2014-09-06 20:54:56.613"
"KHARIF","AGRICULTURE","Cereals","Paddy (Dhan)","	Plant Protection	","BLB in paddy","recommended for BLB in paddy spray bactreiomycin 18 gm /ac","TAMILNADU","THENI","UTTAMAPALAIYAM                                    ","2014-09-07 10:12:34.190"
"KHARIF","HORTICULTURE","Vegetables","Brinjal","	Plant Protection	","shoot and fruit borer in brinjal","Recommended for spray Triazophos 2ml / lit","TAMILNADU","THENI","KADAMALAIKUNDRU MYLADUMPARAI                      ","2014-09-07 10:51:32.720"
"KHARIF","HORTICULTURE","Vegetables","Tomato","	Plant Protection	","Leaf Blight in tomato","recommended for Leaf Blight in tomato spray carbendazim 2gm/litter water","TAMILNADU","THENI","THENI                                             ","2014-09-07 13:34:52.863"
"KHARIF","HORTICULTURE","Vegetables","Beet Root (Garden Beet/Stock Beet)","Cultural Practices","sowing season for beetroot","Recommended for sowing season for beetroot  July – August.","TAMILNADU","THENI","ANDIPATTI                                         ","2014-09-08 06:29:22.670"
"KHARIF","AGRICULTURE","Cereals","Paddy (Dhan)","Fertilizer Use and Availability","Foliar nutrition for paddy","recommended for spray urea 10gm +DAP 20gm + potassium chloride 10 gm /lit of water","TAMILNADU","THENI","UTTAMAPALAIYAM                                    ","2014-09-08 09:51:34.107"
"KHARIF","HORTICULTURE","Vegetables","Tomato","Nutrient Management","tomato top dressing","recommended for apply urea40 kg + potash 33 kg/ acre.","TAMILNADU","THENI","THENI                                             ","2014-09-08 14:14:51.553"
"KHARIF","HORTICULTURE","Flowers","Tuberose","Nutrient Management","tuberose foliar spray","recommended for spray zinc sulphate 5 g + ferrous sulphate 2 g + boron 1 g/lit.","TAMILNADU","THENI","CHINNAMANUR                                       ","2014-09-08 16:12:51.203"
"KHARIF","HORTICULTURE","Vegetables","Drum Stick","Nutrient Management","moringa foliar spray","recommended for spray  boron 2 g/lit.","TAMILNADU","THENI","BODINAYAKKANUR                                    ","2014-09-08 20:14:11.200"
"KHARIF","AGRICULTURE","Fodder Crops","fodder maize ","Government Schemes","asking about fodder seeds availability details","Recommended TNAU fodder dept. contact no. 0422 - 6611228","TAMILNADU","THENI","ANDIPATTI                                         ","2014-09-09 11:28:00.113"
"KHARIF","HORTICULTURE","Vegetables","Tomato","Nutrient Management","tomato foliar spray","recommended for spray boron 2 g/lit.","TAMILNADU","THENI","BODINAYAKKANUR                                    ","2014-09-09 17:04:04.773"
"KHARIF","HORTICULTURE","Vegetables","Tomato","	Plant Protection	","leaf spot in tomato","Recommended for Spray Mancozeb 2 g/lit.","TAMILNADU","THENI","THENI                                             ","2014-09-09 19:12:21.760"
"KHARIF","AGRICULTURE","Cereals","Paddy (Dhan)","	Plant Protection	","stem borer in paddy","Recommended for spray chlorpyrifos 2ml+neem oil 3ml+teepol 1ml/lit of water","TAMILNADU","THENI","UTTAMAPALAIYAM                                    ","2014-09-09 20:31:55.773"
"KHARIF","HORTICULTURE","Vegetables","Tomato","Nutrient Management","foliar application in tomato","recommended for Spray borax 5 gm/ litre","TAMILNADU","THENI","BODINAYAKKANUR                                    ","2014-09-10 06:56:50.020"
"KHARIF","HORTICULTURE","Fruits","Banana","Nutrient Management","banana foliar spray","recommended for spray potasium sulphate 10 g/lit.","TAMILNADU","THENI","UTTAMAPALAIYAM                                    ","2014-09-10 09:27:47.060"
"JAYAD","HORTICULTURE","Vegetables","Beet Root (Garden Beet/Stock Beet)","	Plant Protection	","beet root leaf miner","recommended for Spray quinalphos 25 EC 2ml / lit of water","TAMILNADU","THENI","KAMBAM","2014-09-10 11:01:36.757"
"KHARIF","HORTICULTURE","Fruits","Banana","Nutrient Management","bunch development in banana","recommended spray potassium sulphate 7gm + 19:19:19  7gm mix with 1 lit of water","TAMILNADU","THENI","UTTAMAPALAIYAM                                    ","2014-09-10 11:24:02.473"
"KHARIF","HORTICULTURE","Fruits","Banana","	Plant Protection	","Panama disease in banana","Recommended for Corm injection carbendazim 2GM / lit","TAMILNADU","THENI","UTTAMAPALAIYAM                                    ","2014-09-10 11:24:34.620"
"KHARIF","AGRICULTURE","Cereals","Paddy (Dhan)","	Plant Protection	","paddy brown plant hopper","recommended for spray imidachloprid 1 ml/lit.","TAMILNADU","THENI","UTTAMAPALAIYAM                                    ","2014-09-10 12:07:52.547"
"KHARIF","HORTICULTURE","Vegetables","Brinjal","Cultural Practices","brinjal season","recommended for december-january","TAMILNADU","THENI","KADAMALAIKUNDRU MYLADUMPARAI                      ","2014-09-10 13:30:42.447"
"KHARIF","HORTICULTURE","Vegetables","Tomato","	Plant Protection	","Early Blight for tomato","Recommended for spray mancozeb 2g/lit.","TAMILNADU","THENI","KADAMALAIKUNDRU MYLADUMPARAI                      ","2014-09-10 15:50:51.903"
"KHARIF","HORTICULTURE","Fruits","Banana","	Plant Protection	","Mealy bug in banana","Recommended for spray imidacloprid 2ml / lit of water","TAMILNADU","THENI","UTTAMAPALAIYAM                                    ","2014-09-10 17:17:09.730"
"KHARIF","AGRICULTURE","Others","Others","Government Schemes","Solar pump system subsidy","recommended number for agriculture engineering office 04546 25 34 39","TAMILNADU","THENI","BODINAYAKKANUR                                    ","2014-09-10 20:44:35.110"
"KHARIF","AGRICULTURE","Millets","Maize (Makka)","Market Information","maize market price","redommended for price 1450-1520 /quintal","TAMILNADU","THENI","PERIYAKULAM                                       ","2014-09-10 21:02:02.853"
"KHARIF","HORTICULTURE","Vegetables","Beet Root (Garden Beet/Stock Beet)","Market Information","beet root market rate madurai","recommended for beet root market rate madurai RS 15/kg","TAMILNADU","THENI","ANDIPATTI                                         ","2014-09-10 21:14:24.747"
"KHARIF","AGRICULTURE","Others","Others","Agriculture Mechanization","agri engineering supcidy details","recommended for contact to Phone - 04546 25 34 39","TAMILNADU","THENI","BODINAYAKKANUR                                    ","2014-09-11 08:23:27.090"
"KHARIF","AGRICULTURE","Fodder Crops","Napier Grass","Seeds","napier grass setts","recommended 04546 –247564 number to contact kvk.","TAMILNADU","THENI","ANDIPATTI                                         ","2014-09-11 17:42:02.133"
"KHARIF","HORTICULTURE","Vegetables","Brinjal","	Plant Protection	","Bacterial Wilt in brinjal","Recommended for spray copper oxychloride 2gm / lit of water","TAMILNADU","THENI","ANDIPATTI                                         ","2014-09-12 14:14:00.030"
"KHARIF","HORTICULTURE","Vegetables","Tomato","Agriculture Mechanization","Microbiology department contact number","Recommended for microbiology department contact number: 0422-6611294","TAMILNADU","THENI","CHINNAMANUR                                       ","2014-09-12 14:38:39.700"
"KHARIF","HORTICULTURE","Fruits","Mango","Cultural Practices","inter cropping in mango","recommended for Short duration crops like legumes, vegetables, groundnut etc. can be raised during pre- bearing age.","TAMILNADU","THENI","PERIYAKULAM                                       ","2014-09-12 14:49:30.187"
"KHARIF","HORTICULTURE","Fruits","Banana","	Plant Protection	","leaf spot in banana,","recommended for spray mancozeb 2 gm /lit of water","TAMILNADU","THENI","UTTAMAPALAIYAM                                    ","2014-09-12 16:04:52.070"
"KHARIF","HORTICULTURE","Vegetables","Chillies","Market Information","market rate for chilli","Recommended for market rate for chilli Rs 13/kg","TAMILNADU","THENI","ANDIPATTI                                         ","2014-09-12 16:40:24.243"
"KHARIF","HORTICULTURE","Vegetables","Beans ","	Plant Protection	","Pod borer in beans","Recommended for pod borer in beans spray quinalphos 2 ml / liter of water","TAMILNADU","THENI","UTTAMAPALAIYAM                                    ","2014-09-12 21:16:38.543"
"KHARIF","HORTICULTURE","Plantation Crops","Coconut","Seeds and Planting Material","coconut seedling availability","recommended number for coconut research station 04373 260205","TAMILNADU","THENI","PERIYAKULAM                                       ","2014-09-12 21:42:45.600"
"KHARIF","HORTICULTURE","Fruits","Mango","	Plant Protection	","mango aphids","recommended for Dimethoate 30 EC or methyldemeton 25 EC 1 ml/l","TAMILNADU","THENI","BODINAYAKKANUR                                    ","2014-09-13 07:23:56.290"
"KHARIF","HORTICULTURE","Plantation Crops","Coconut","	Plant Protection	","Button shedding in coconut","recommended for Root feeding with TNAU coconut tonic 200 ml / tree","TAMILNADU","THENI","BODINAYAKKANUR                                    ","2014-09-13 09:10:26.717"
"KHARIF","HORTICULTURE","Fruits","Banana","Nutrient Management","Better bunchy fruit size increase in banana","Spray potassium sulphate 10 gm/lit","TAMILNADU","THENI","PERIYAKULAM                                       ","2014-09-13 10:39:14.603"
"KHARIF","HORTICULTURE","Vegetables","Drum Stick","	Plant Protection	","fruitfly in moringa","recommended spray for dichlorvos 2ml+neemoilml+teepol 1ml/lit of water","TAMILNADU","THENI","KADAMALAIKUNDRU MYLADUMPARAI                      ","2014-09-13 13:21:08.477"
"KHARIF","AGRICULTURE","Others","Others","Organic Farming","panchakavya availability in bodinayakkanur","recommended for contact to agriculture officer","TAMILNADU","THENI","BODINAYAKKANUR                                    ","2014-09-13 13:41:48.980"
"KHARIF","AGRICULTURE","Others","Others","Organic Farming","panchakavya availability in bodinayakkanur","recommended for contact to agriculture officer","TAMILNADU","THENI","BODINAYAKKANUR                                    ","2014-09-13 13:42:29.017"
"KHARIF","AGRICULTURE","Others","Others","Government Schemes","Asking about food& mouth detail","Recommended for contact to veterinary department","TAMILNADU","THENI","KAMBAM","2014-09-13 15:00:08.087"
"KHARIF","HORTICULTURE","Vegetables","Bitter Gourd","Fertilizer Use and Availability","bitter gourd top dressing fertilizer management","Recommended for apply urea 10gm / pit.","TAMILNADU","THENI","UTTAMAPALAIYAM                                    ","2014-09-13 16:59:40.227"
"KHARIF","AGRICULTURE","Others","Others","Government Schemes","input subsidies","recommended to contact agri department","TAMILNADU","THENI","ANDIPATTI                                         ","2014-09-13 19:22:09.720"
"KHARIF","AGRICULTURE","Millets","Maize (Makka)","Market Information","market rate for maize","Kallakurichi Other 1269 - 1329 Rs/Quintal","TAMILNADU","THENI","PERIYAKULAM                                       ","2014-09-14 07:09:17.630"
"KHARIF","AGRICULTURE","Others","Others","Weather","asking about weather details","Recommended for today rainy day","TAMILNADU","THENI","UTTAMAPALAIYAM                                    ","2014-09-14 09:33:06.013"
"KHARIF","HORTICULTURE","Vegetables","Cauliflower","	Plant Protection	","cauliflower Cut Worms","Set up light trap in summer months. Spray Chlorpyriphos 2 ml/lit in the collar region during evening hours.","TAMILNADU","THENI","ANDIPATTI                                         ","2014-09-14 10:52:41.853"
"KHARIF","HORTICULTURE","Vegetables","Cauliflower","	Plant Protection	","Cut Worms in cauliflower","recommended for Spray Chlorpyriphos 2 ml/lit of  water","TAMILNADU","THENI","ANDIPATTI                                         ","2014-09-14 16:24:26.793"
"KHARIF","AGRICULTURE","Millets","Maize (Makka)","Market Information","maize market rate","recommended as Rs.1450-1520/ quintal","TAMILNADU","THENI","BODINAYAKKANUR                                    ","2014-09-14 17:49:25.103"
"KHARIF","AGRICULTURE","Cereals","Paddy (Dhan)","Fertilizer Use and Availability","Paddy nursery fertilizer","Recommended for apply DAP 2kg/cent","TAMILNADU","THENI","UTTAMAPALAIYAM                                    ","2014-09-15 06:43:35.793"
"KHARIF","HORTICULTURE","Fruits","Banana","	Plant Protection	","Cut worm in banana","recommended for spray chlorphyriphos 2ml/lit of water","TAMILNADU","THENI","UTTAMAPALAIYAM                                    ","2014-09-15 11:42:58.607"
"KHARIF","HORTICULTURE","Vegetables","Drum Stick","Fertilizer Use and Availability","fertiliser management in drumstick","recommended for Apply 6:12:12 @10gm/lit","TAMILNADU","THENI","KADAMALAIKUNDRU MYLADUMPARAI                      ","2014-09-15 11:58:32.257"
"KHARIF","HORTICULTURE","Vegetables","Beet Root (Garden Beet/Stock Beet)","	Plant Protection	","Nematode in Beet root","Recommended for apply carbofuran 3 - 5 kg / ac","TAMILNADU","THENI","UTTAMAPALAIYAM                                    ","2014-09-15 13:03:28.790"
"KHARIF","HORTICULTURE","Vegetables","Drum Stick","Nutrient Management","moringa foliar application details","Recommended for moringa foliar spray for 19:19:19 50 gm/tank","TAMILNADU","THENI","","2014-09-15 15:53:44.513"
"KHARIF","HORTICULTURE","Vegetables","Drum Stick","	Plant Protection	","Moringa pod fly management","Recommended for spray monocrotophos 2ml/liter of water","TAMILNADU","THENI","THENI                                             ","2014-09-15 17:50:48.270"
"KHARIF","HORTICULTURE","Fruits","Banana","Fertilizer Use and Availability","National Research Centre for Banana contact number","National Research Centre for Banana contact number:91-431-2618104, 2618106","TAMILNADU","THENI","CHINNAMANUR                                       ","2014-09-15 18:28:39.497"
"KHARIF","AGRICULTURE","Cereals","Paddy (Dhan)","Fertilizer Use and Availability","Paddy nursery fertilizer","Recommended for apply DAP 2kg/cent","TAMILNADU","THENI","THENI                                             ","2014-09-15 19:53:26.703"
"KHARIF","HORTICULTURE","Plantation Crops","Coconut","Nutrient Management","button shed in coconut","Recommended for Root feeding of the tonic @ 200 ml / palm twice a year at six months interval","TAMILNADU","THENI","CHINNAMANUR                                       ","2014-09-16 07:05:24.830"
"KHARIF","HORTICULTURE","Vegetables","Drum Stick","	Plant Protection	","pruning for moringa","recommended for perranial crop pruning should must, after pruning apply bordeaux paste on tree","TAMILNADU","THENI","ANDIPATTI                                         ","2014-09-16 08:33:54.287"
"KHARIF","AGRICULTURE","Others","Others","	Plant Protection	","needamangalam kvk contact number","recommended for needamangalam kvk contact number 04367-
260666","TAMILNADU","THENI","THENI                                             ","2014-09-16 11:42:09.307"
"KHARIF","HORTICULTURE","Flowers","Marigold","Market Information","Marigold market rate","Recommended for Marigold market rate : 15 - 30 Rs./Kg","TAMILNADU","THENI","THENI                                             ","2014-09-16 12:33:33.360"
"KHARIF","HORTICULTURE","Vegetables","Cauliflower","	Plant Protection	","Cut Worms in cauliflower","recommended for spray Spray Chlorpyriphos 2 ml/lit of water","TAMILNADU","THENI","ANDIPATTI                                         ","2014-09-16 15:16:28.667"
"KHARIF","AGRICULTURE","Others","Others","Government Schemes","Asking about bore well subsidy details","Recommended for contact to agriculture office and near bank","TAMILNADU","THENI","PERIYAKULAM                                       ","2014-09-16 15:42:41.830"
"KHARIF","AGRICULTURE","Others","Others","Government Schemes","Asking about bore well subsidy details","Recommended for contact to agriculture office and near bank","TAMILNADU","THENI","PERIYAKULAM                                       ","2014-09-16 15:44:42.423"
"KHARIF","AGRICULTURE","Oilseeds","Mustard","Seeds","Mustard seed rate and spacing","Recommended for Mustard seed rate : 2.4kg - 2.8kg and spacing : 45 cm x 30 cm","TAMILNADU","THENI","BODINAYAKKANUR                                    ","2014-09-16 17:17:12.217"
"KHARIF","AGRICULTURE","Cereals","Paddy (Dhan)","Fertilizer Use and Availability","Tillering stage fertilizer management for paddy","Recommended for apply ammonium sulphate 30 kg + potash 20 kg + neem cake 5 kg +Microfood5kg/ ac","TAMILNADU","THENI","UTTAMAPALAIYAM                                    ","2014-09-16 18:02:20.800"
"KHARIF","ANIMAL HUSBANDRY","Animal","Goat","Dairy Production","theni veterinary department contact number","recommended for contact number; 04546-260047","TAMILNADU","THENI","UTTAMAPALAIYAM                                    ","2014-09-16 18:21:51.673"
"KHARIF","HORTICULTURE","Fruits","Banana","Fertilizer Use and Availability","Banana fertiliser management","apply urea 150 g + supperphosphate 200 gm + potash 200 gm/tree","TAMILNADU","THENI","BODINAYAKKANUR                                    ","2014-09-16 19:17:19.277"
"KHARIF","HORTICULTURE","Fruits","Banana","Nutrient Management","banana fertilizer management","Recommended for apply 150 gm urea + 200 gm super phosphate + 200 gm potash /plant","TAMILNADU","THENI","UTTAMAPALAIYAM                                    ","2014-09-17 09:31:51.527"
"KHARIF","AGRICULTURE","Cereals","Paddy (Dhan)","Nutrient Management","paddy foliar application details","Recommended for apply urea 100gm + super 200gm + potash 100gm / tank","TAMILNADU","THENI","UTTAMAPALAIYAM                                    ","2014-09-17 11:42:27.037"
"KHARIF","HORTICULTURE","Fruits","Banana","Fertilizer Use and Availability","Fertilizer management for banana","Recommended for apply urea 150gm+superphosphate 200gm+potash 200gm /plant","TAMILNADU","THENI","UTTAMAPALAIYAM                                    ","2014-09-17 12:24:42.170"
"KHARIF","AGRICULTURE","Cereals","Paddy (Dhan)","	Field Preparation	","SRI  Transplanting","RECOMMENDED Square planting of 25 x 25 cm (10 x 10 inch)","TAMILNADU","THENI","THENI                                             ","2014-09-17 12:25:48.317"
"KHARIF","HORTICULTURE","Flowers","Chrysanthemum","Seeds and Planting Material","Harvest period of chrysanthemum","recommended for Harvesting of the flowers starts from 3rd month onwards","TAMILNADU","THENI","PERIYAKULAM                                       ","2014-09-17 14:18:28.510"
"KHARIF","HORTICULTURE","Vegetables","Cucumber","Field Preparation","cucumber Season","Sow the seeds during June or January to April","TAMILNADU","THENI","UTTAMAPALAIYAM                                    ","2014-09-18 10:17:04.667"
