"Season","Sector","Category","Crop","QueryType","QueryText","KCCAns","StateName","DistrictName","BlockName","CreatedOn"
"RABI","AGRICULTURE","Cereals","Wheat","	Plant Protection	","how to control slow growth and yellow leaf in wheat  crops?","how to control slow growth and yellow leaf in wheat  crops?
control are:-spray 2.5 kg urea+ 500 gram zinc 16% in 100 liter water per acr.","HARYANA","MEWAT","TAORU                                             ","2014-12-18 20:54:58.847"
"RABI","AGRICULTURE","Cereals","Wheat","Bio-Pesticides and Bio-Fertilizers","How to control flower dropping in Lemon?","Spray-1 ml pilanofix 4.5 litar water par acre.","HARYANA","MEWAT","NAGINA                                            ","2014-12-19 09:40:29.753"
"RABI","AGRICULTURE","Cereals","Wheat","	Plant Protection	","Information regarding how to control yellowness of leaves in wheat?","Spray 500 gm. Ferrous Sulphate in 100 lt. of water per acre.","HARYANA","MEWAT","NUH                                               ","2014-12-19 10:07:46.370"
"RABI","AGRICULTURE","Cereals","Wheat","	Plant Protection	","Information regarding  late varieties of wheat crop ?","Late varities of wheat - HD-2851 ,HD-2932 ,RAJ-3765 ,PBW-373 ,UP-2338 .W H-306,1025,","HARYANA","MEWAT","NAGINA                                            ","2014-12-19 13:20:57.517"
"RABI","AGRICULTURE","Cereals","Wheat","Varieties","Information regarding late varieties of wheat?","Information regarding late varieties of wheat?
Late Varieties of wheat - HD-2851 ,HD-2932, PBW-373, PBW-658, RAJ-3765, UP-2338.","HARYANA","MEWAT","PUNAHANA                                          ","2014-12-19 14:46:30.203"
"RABI","AGRICULTURE","Others","Others","Weather","Information regarding weather of mewat?","Information regarding weather of mewat? weather of mewat:-some clouds and no chance of rainfall in today,","HARYANA","MEWAT","PUNAHANA                                          ","2014-12-19 15:17:37.073"
"RABI","AGRICULTURE","Others","Others","Weather","Information regarding weather of mewat?","Information regarding weather of mewat? weather of mewat are:-some clouds and no chance of rainfall in today,","HARYANA","MEWAT","NUH                                               ","2014-12-19 18:34:15.240"
"RABI","AGRICULTURE","Cereals","Wheat","Bio-Pesticides and Bio-Fertilizers","how to control of termite in wheat crops?","control of termite in wheat crops are:-brodcasting choloropyriphose 2 litr in 25 kilo dry soil(ret)per acer.","HARYANA","MEWAT","NUH                                               ","2014-12-20 08:16:15.820"
"RABI","AGRICULTURE","Cereals","Wheat","	Plant Protection	","How to improved growth in wheat crop?","Spray of NPK(19:19:19) @1 Kg in 100 Lt water/acre.","HARYANA","MEWAT","PUNAHANA                                          ","2014-12-20 08:35:50.507"
"RABI","AGRICULTURE","Cereals","Wheat","	Plant Protection	","How to improved growth in wheat crop?","Spray of NPK(19:19:19) @1 Kg in 100 Lt water/acre.","HARYANA","MEWAT","PUNAHANA                                          ","2014-12-20 08:44:04.523"
"RABI","AGRICULTURE","Others","Others","Weather","weather of mewat ?","weather of mewat ? some clouds no chance rain fall in today .","HARYANA","MEWAT","TAORU                                             ","2014-12-20 08:56:39.843"
"RABI","AGRICULTURE","Cereals","Wheat","Fertilizer Use and Availability","Information regarding improved growth in wheat?
spray of N P K (19:19:19)@ 1Kg in  100-125 liter water per acre.","Information regarding improved growth in wheat?
spray of N P K (19:19:19)@ 1Kg in  100-125 liter water per acre.","HARYANA","MEWAT","NAGINA                                            ","2014-12-20 11:57:40.403"
"RABI","AGRICULTURE","Others","Others","Weather","Information regarding weather in PALWAL ?","Some  clouds no chance of rain fall today","HARYANA","MEWAT","NUH                                               ","2014-12-20 12:06:12.170"
"RABI","AGRICULTURE","Cereals","Wheat","Bio-Pesticides and Bio-Fertilizers","Information regarding how to improve growth in cotton crop?","Information regarding how to improve growth in cotton crop?
Spray of NPK(19:19:19)@1 Kg in 100 Lt water/acre.","HARYANA","MEWAT","TAORU                                             ","2014-12-20 12:11:18.493"
"RABI","AGRICULTURE","Pulses","Rajma (french bean)","	Plant Protection	","How to  improved growth in rajma?","SPRAY 2.5KG UREA+500GM ZINC IN 100LTR OF WATER /ACRE .","HARYANA","MEWAT","NUH                                               ","2014-12-20 15:01:04.163"
"RABI","HORTICULTURE","Vegetables","Potato","Fertilizer Use and Availability","Information regarding how to improved growth in potato ?","Information regarding how to improved growth in potato ?spray npk 19:19:19 @ 1 kg in 100 litre of water/acre.","HARYANA","MEWAT","NUH                                               ","2014-12-20 17:27:23.497"
"RABI","AGRICULTURE","Cereals","Wheat","	Plant Protection	","how to control slow groth IN WHEAT crops?","control are:-spray-2.5 kg urea+500 gram zink 16% in 120 liter water per acer.","HARYANA","MEWAT","PUNAHANA                                          ","2014-12-21 07:48:00.050"
"KHARIF","AGRICULTURE","Cereals","Wheat","	Field Preparation	","Information regarding to improved yellowness in wheat crop ?","Information regarding to improved yellowness in wheat crop ?
spray ferous sulphate @ 500 gm in 100 litre of water/acre.","HARYANA","MEWAT","NUH                                               ","2014-12-21 09:15:49.887"
"RABI","AGRICULTURE","Oilseeds","Mustard","	Plant Protection	","how to control slow groth and yelow leaf in sarson crops?","control are:-spray-2.5 kg urea+500 gram zink 16% in 200 liter water per acer.","HARYANA","MEWAT","NUH                                               ","2014-12-21 18:40:08.537"
"RABI","AGRICULTURE","Others","Others","	Plant Protection	","Information regarding weather in MEWAT.?","Some clouds no Chances of rainfall,today.","HARYANA","MEWAT","NUH                                               ","2014-12-21 19:47:16.980"
"RABI","AGRICULTURE","Cereals","Wheat","	Plant Protection	","Information regarding for weed control in wheat crop?","Spray- topik 160 gram 200 liatr water par acre.","HARYANA","MEWAT","FEROZEPUR JHIRKA                                  ","2014-12-22 09:37:08.237"
"RABI","AGRICULTURE","Oilseeds","Mustard","Cultural Practices","information regarding weeds control in musterd crop ?","information regarding weeds control in musterd crop ? spray 25 ml glyboset or glysofate (rounup)in 125- 150 litre water / acre .","HARYANA","MEWAT","TAORU                                             ","2014-12-22 12:02:24.533"
"RABI","AGRICULTURE","Others","Others","	Plant Protection	","Information regarding weather in mewat ?","Some clouds and no chance of rainfall today.","HARYANA","MEWAT","NUH                                               ","2014-12-22 17:13:26.220"
"RABI","HORTICULTURE","Vegetables","Onion","	Plant Protection	","Information regarding to control of purpul bloch in onion crop ?","Information regarding to control of purpul bloch in onion crop ?
Spray mancozeb @ 500 gm in 200 litre of water/acre.","HARYANA","MEWAT","FEROZEPUR JHIRKA                                  ","2014-12-22 17:56:50.050"
"RABI","AGRICULTURE","Cereals","Wheat","Bio-Pesticides and Bio-Fertilizers","information regarding how to control low grouth in wheat crop ?","information regarding how to control low grouth in wheat crop ? spray :- 500gm zink (21%)+ 2kg urea in 100 litre  water / acre .","HARYANA","MEWAT","NAGINA                                            ","2014-12-22 19:46:15.113"
"RABI","AGRICULTURE","Others","Others","Weather","INFORMATION  REGARDING OF BETTER GROWTH IN  WHEAT   CROP ?","INFORMATION  REGARDING OF BETTER GROWTH IN  WHEAT   CROP ? 
Spray- 2.5kg Urea + 500 gm Zinc 21 % in 100 Ltr of water /acre .","HARYANA","MEWAT","PUNAHANA                                          ","2014-12-22 21:29:58.550"
"RABI","AGRICULTURE","Others","Others","Weather","Information regarding to weather in mewat ?","Today some clouds and no  chance of ranfall.","HARYANA","MEWAT","TAORU                                             ","2014-12-23 09:17:47.750"
"RABI","AGRICULTURE","Cereals","Wheat","Fertilizer Use and Availability","Information regarding control yellowing of leaf in WHEAT ?","SPRAY 2.5KG UREA+500GM ZINC21% IN 100LTR OF WATER /ACRE .","HARYANA","MEWAT","NUH                                               ","2014-12-23 16:26:01.510"
"RABI","AGRICULTURE","Cereals","Wheat","Cultural Practices","HOW TO   WEEDS   CONTROL   IN   WHEAT   CROP ?","SPRAY OF ACORD PLUS 500 ML   IN   250   LITER   WATER  / ACRE,","HARYANA","MEWAT","NUH                                               ","2014-12-23 20:17:11.083"
"KHARIF","AGRICULTURE","Cereals","Wheat","	Field Preparation	","information regarding control yellowing of leaf in WHEAT ?","information regarding control yellowing of leaf in WHEAT ?
SPRAY 2.5KG UREA+500GM ZINC21% IN 100LTR OF WATER /ACRE .","HARYANA","MEWAT","PUNAHANA                                          ","2014-12-24 07:43:29.757"
"KHARIF","HORTICULTURE","Vegetables","Amaranthus/Grain Amaranthus","	Plant Protection	","How to control Early Blight in Tomato?","How to control Early Blight in Tomato?
Spray 400 gm. Mencozeb in 200 lt. of water per acre.","HARYANA","MEWAT","FEROZEPUR JHIRKA                                  ","2014-12-24 07:47:55.247"
"KHARIF","AGRICULTURE","Cereals","Wheat","	Field Preparation	","Information regarding how to control Phalaris Minor weeds in wheat?","Information regarding how to control Phalaris Minor weeds in wheat?
Spray 13.5 gm. Leader in 200 lt. of water per acre after 30-35 days of sowing.","HARYANA","MEWAT","FEROZEPUR JHIRKA                                  ","2014-12-24 07:56:26.613"
"RABI","AGRICULTURE","Cereals","Wheat","Cultural Practices","Iformation regarding how to control nemotod.(deemak) in wheat crop  ?","Iformation regarding how to control nemotod.(deemak) in wheat crop  ?
Broadcast carbofuran 13 kg mixed in 20 kg urea  acre  .","HARYANA","MEWAT","NUH                                               ","2014-12-24 13:25:35.420"
"RABI","AGRICULTURE","Cereals","Wheat","Bio-Pesticides and Bio-Fertilizers","Information regarding how to control zinc deficiency in wheat?","Information regarding how to control zinc deficiency in wheat?
Spray 2.5 kg. urea and 500 gm. zinc in 100 lt. of water per acre.","HARYANA","MEWAT","NAGINA                                            ","2014-12-24 14:20:31.507"
"RABI","HORTICULTURE","Vegetables","Pointed Gourd","	Plant Protection	","How to control Early Blight in Potato?","Spray 400 gm. M-45 in 200 lt. of water per acre.","HARYANA","MEWAT","NUH                                               ","2014-12-25 17:43:59.637"
"RABI","AGRICULTURE","Others","Others","Weather","Information regarding weather in Mewat ?","Some clouds and no chances of rainfall,today.","HARYANA","MEWAT","NUH                                               ","2014-12-26 07:32:10.607"
"KHARIF","AGRICULTURE","Cereals","Wheat","	Field Preparation	","control of nematode in wheat?","control of nematode in wheat?
broadcast carbafuran @ 13 kg per acre.","HARYANA","MEWAT","TAORU                                             ","2014-12-26 07:55:03.767"
"RABI","AGRICULTURE","Others","Others","Weather","WEATHER OF MEWAT ?","WEATHER OF MEWAT ARE :- SOME CLOUD AND FOG , NO CHANCE OF RAIN TODAY .","HARYANA","MEWAT","NUH                                               ","2014-12-26 08:03:25.163"
"RABI","AGRICULTURE","Cereals","Wheat","	Plant Protection	","Information regarding how to control Phalaris Minor weeds in wheat?","spray 160 gm topik @ 200 lt water per acre,","HARYANA","MEWAT","TAORU                                             ","2014-12-26 08:05:19.373"
"RABI","AGRICULTURE","Others","Others","	Plant Protection	","Information regarding how to control Broad Leaf &narrow leaf weeds in wheat?","Spray-500 gram accord plus 22/EC ,200litar water par acre.","HARYANA","MEWAT","PUNAHANA                                          ","2014-12-26 11:48:13.463"
"RABI","HORTICULTURE","Vegetables","Tomato","	Plant Protection	","how to control fungal diseas in  Tomato?","Spray 600 gm.indofil M-45 in 200 lt. of water per acre.","HARYANA","MEWAT","NUH                                               ","2014-12-26 12:18:23.500"
"RABI","AGRICULTURE","Others","Others","Weather","WEATHER OF MEWAT ?","WEATHER OF MEWAT ? NO CHANCE OF RAINFALL TODAY .","HARYANA","MEWAT","NUH                                               ","2014-12-26 13:52:15.177"
"RABI","HORTICULTURE","Vegetables","Brinjal","	Plant Protection	","How to control Early Blight in onion ?","-Spray 400 gm. M-45 in 200 lt. of water per acre.","HARYANA","MEWAT","NUH                                               ","2014-12-26 14:53:42.313"
"RABI","HORTICULTURE","Vegetables","Potato","	Plant Protection	","information regarding how to fungle disease in potato ??","information regarding how to fungle disease in potato ??
information regarding how to fungle disease in potato?spray 600gm diathen m-45 in 250 litre water /acre .","HARYANA","MEWAT","PUNAHANA                                          ","2014-12-27 08:23:06.030"
"RABI","AGRICULTURE","Cereals","Wheat","	Plant Protection	","information regarding slow growth and yellow leaf in wheat crops?","control are:-spray NPK(19:19:19) @1 kilo in 150 liter water per acer.","HARYANA","MEWAT","PUNAHANA                                          ","2014-12-27 12:20:35.060"
"RABI","AGRICULTURE","Cereals","Wheat","Weed Management","Information regarding how to control mixed  weeds in wheat?","Information regarding how to control mixed  weeds in wheat?
Spray:500 ml  accord plus( 22%EC )or160 gm   vesta or16 gm Total   IN 200 litre water / acre .","HARYANA","MEWAT","TAORU                                             ","2014-12-27 14:51:31.160"
"RABI","AGRICULTURE","Cereals","Wheat","Fertilizer Use and Availability","Information regarding how to control yellowness of leaves in wheat?","Spray 2.5 kg. Urea and 500 gm. Zinc 21% in 100 lt. of water per acre.","HARYANA","MEWAT","PUNAHANA                                          ","2014-12-27 15:55:29.107"
"RABI","AGRICULTURE","Others","Others","Weather","Information regarding weather in mewat?","Some clouds and no chances of rainfall,today.","HARYANA","MEWAT","FEROZEPUR JHIRKA                                  ","2014-12-27 17:52:22.540"
"RABI","AGRICULTURE","Others","Others","Weed Management","Information regarding for weed control in wheat crop?","Information regarding for weed control in wheat crop?
Spray- topik 160 gram 200 liatr water par acre.","HARYANA","MEWAT","TAORU                                             ","2014-12-27 20:17:31.380"
"RABI","AGRICULTURE","Cereals","Wheat","	Plant Protection	","HOW TO  WEEDS CONTROL IN WHEAT CROP ?","SPRAY 16 Gm ,TOTAL,OR 500 ML  ACORD PLUS IN  250 LITRE   WATER /ACRE  30-35 DAYS AFTER SOWING TIMe .","HARYANA","MEWAT","NAGINA                                            ","2014-12-28 07:39:32.310"
"RABI","AGRICULTURE","Others","Others","	Plant Protection	","How to control aphids in WHEAT?","Spray 400 ml. malathion in 200 lt. of water per acre.","HARYANA","MEWAT","TAORU                                             ","2014-12-28 08:27:04.393"
"RABI","HORTICULTURE","Vegetables","Potato","	Plant Protection	","HOW TO CONTROL FUNGAL DISEASE IN POTATO CROP ?","spray 400 gm indofil, m-45  or bavestin in 200 litre water /acre .","HARYANA","MEWAT","NUH                                               ","2014-12-28 10:50:17.843"
"RABI","AGRICULTURE","Others","Others","Weather","Information regarding to weather in mewat ?","Information regarding to weather in mewat ? 
Today some clouds and no chance of ranfall.","HARYANA","MEWAT","NUH                                               ","2014-12-28 20:39:08.597"
"KHARIF","AGRICULTURE","Others","Others","	Field Preparation	","information regarding low grouth /yellow leaf of crop ?","information regarding low grouth /yellow leaf of crop ?
spray;- 1 kg n.p.k (19;19;19);in 100 lit water / acre.","HARYANA","MEWAT","FEROZEPUR JHIRKA                                  ","2014-12-29 08:01:26.990"
"KHARIF","AGRICULTURE","Cereals","Wheat","	Field Preparation	","information regarding low grouth /yellow leaf of crop ?","information regarding low grouth /yellow leaf of crop ?
spray 1 kg N,P,K-19;19;19 @ 100 LT WATER PAR ACRE ,","HARYANA","MEWAT","PUNAHANA                                          ","2014-12-29 10:09:30.010"
"RABI","AGRICULTURE","Cereals","Wheat","	Plant Protection	","INFORMATION   REGARDING First    IRRIGATION    OF  WHEAT   CROP ?","INFORMATION   REGARDING First    IRRIGATION    OF  WHEAT   CROP ? 
First    IRRIGATION  21 to 25 days   OF  WHEAT   CROP","HARYANA","MEWAT","FEROZEPUR JHIRKA                                  ","2014-12-29 14:23:49.180"
"RABI","AGRICULTURE","Others","Others","Government Schemes","Information regarding agriculture impliments subsidy (gov.scheme)  ?","Information regarding agriculture impliments subsidy (gov.scheme)  ?please cont.nearest A.D.O  in blok.","HARYANA","MEWAT","NAGINA                                            ","2014-12-29 16:41:25.120"
"RABI","AGRICULTURE","Cereals","Wheat","Fertilizer Use and Availability","Information regarding control yellowing of leaf in WHEAT ?","Information regarding control yellowing of leaf in WHEAT ?
SPRAY 2.5KG UREA+500GM ZINC21% IN 100LTR OF WATER /ACRE .","HARYANA","MEWAT","TAORU                                             ","2014-12-29 17:21:28.840"
"RABI","HORTICULTURE","Vegetables","Bhindi(Okra/Ladysfinger)","Seeds and Planting Material","Information regarding to Improved varieties of bhindi crop ?","pusa sawani,barsha uphar,hisar unnat,hisar naveen.","HARYANA","MEWAT","PUNAHANA                                          ","2014-12-29 18:50:07.493"
"RABI","HORTICULTURE","Vegetables","Tomato","Cultural Practices","information regarding how to fungle disease in tomato ?","information regarding how to fungle disease in tomato ?spray 600gm diathen m-45 in 250 litre water /acre .","HARYANA","MEWAT","NUH                                               ","2014-12-29 20:18:28.883"
"RABI","HORTICULTURE","Vegetables","Cabbage","Cultural Practices","information regarding cabbageof nursery ?","please cabbage in this time plantation .","HARYANA","MEWAT","FEROZEPUR JHIRKA                                  ","2014-12-30 08:45:27.500"
"RABI","AGRICULTURE","Cereals","Wheat","	Plant Protection	","Information regarding how to control Phalaris Minor & Wilt Oat weeds in wheat?","Spray 160 gm. Topik in 200 lt. of water per acre to control Phalaris Minor & Wilt Oat in wheat.","HARYANA","MEWAT","FEROZEPUR JHIRKA                                  ","2014-12-30 08:58:44.133"
"RABI","AGRICULTURE","Pulses","Rajma (french bean)","	Field Preparation	","Sowing time of rajma ?","Sowing time of rajma ?September month .","HARYANA","MEWAT","NUH                                               ","2014-12-30 10:25:00.770"
"RABI","AGRICULTURE","Cereals","Wheat","Cultural Practices","information regarding improved  growth  in  wheat crop.","information regarding improved  growth  in  wheat crop.
 answer:-spray_2.5 kg urea + 500 gm zink(21%) in 100 litre water / acre.","HARYANA","MEWAT","NUH                                               ","2014-12-30 17:08:30.817"
"RABI","AGRICULTURE","Cereals","Wheat","	Plant Protection	","information regarding control yellowing of leaf in WHEAT ?","information regarding control yellowing of leaf in WHEAT ?
SPRAY 2.5KG UREA+500GM ZINC21% IN 100LTR OF WATER /ACRE .","HARYANA","MEWAT","NUH                                               ","2014-12-31 10:13:12.040"
"RABI","AGRICULTURE","Others","Others","Weather","Information regarding to weather in mewat ?","Information regarding to weather in mewat ? 
Some clouds and  no chances of rainfall today.","HARYANA","MEWAT","FEROZEPUR JHIRKA                                  ","2014-12-31 11:08:31.707"
"RABI","AGRICULTURE","Others","Others","Weather","Information regarding weather in Mewat?","Today some clouds, no chances of rainfall.","HARYANA","MEWAT","FEROZEPUR JHIRKA                                  ","2014-12-31 13:17:39.317"
"RABI","AGRICULTURE","Others","Others","Weather","WEATHER OF MEWAT ?","WEATHER OF MEWAT ? NO CHANCE RAIN FALL IN TODAY.","HARYANA","MEWAT","NUH                                               ","2014-12-31 17:00:53.847"
